Sheet: Enunciado
B2: Preguntas | F2: Tipo de incidencia | G2: Máximo tiempo de respuesta
B3: Número de incidencias mensuales. | F3: Alto | G3: 5
B4: Porcentaje de respuestas contestadas en tiempo mensualmente. | F4: Medio | G4: 15
B5: Tendencias de los indicadores anteriores. | F5: Bajo | G5: 30
B6: Análisis segmentado por departamento. | F6: *El máximo tiempo de respuesta indica el número de días límite en el que se debe dar
B7: Análisis segmentado por Tipo de Incidencia. | F7: la respuesta a la incidencia según el tipo de incidencia reportada.
B8: Media de retraso por tipo de incidencia.
B9: Tiempo medio de respuesta por tipo de incidencia.
B10: Tiempo medio de respuesta por departamento.
B11: Desviación de los tiempos medios de respuesta respecto a los tipos de incidencia. | F11: Departamento
F12: Dept1 | G12: Corbatas
F13: Dept2 | G13: Pañuelos
F14: Dept3 | G14: Camisas
F15: Dept4 | G15: Chaquetas
F16: Dept5 | G16: Pantalones
F17: Dept6 | G17: Chalecos

Sheet: Datos
A1: Número de incidencia | B1: Tipo de Incidencia | C1: Llegada | D1: Respuesta | E1: Departamento | F1: Target | G1: ON TIME | H1: Año Llegada | I1: Mes Llegada | J1: Tiempo respuesta | K1: Desviación (si out of time)
A2: Dept5-16003 | B2: Medio | C2: 41521 | D2: 41547 | E2: =+LEFT(RC[-4],5) -> Dept5 | F2: =+VLOOKUP(RC[-4],Enunciado!R3C6:R5C7,2,0)+RC[-3] -> 41536 | G2: =+IF(RC[-1]>=RC[-3],"ON TIME","OUT OF TIME") -> OUT OF TIME | H2: =+YEAR(RC[-5]) -> 2013 | I2: =+MONTH(RC[-6]) -> 9 | J2: =+RC[-6]-RC[-7] -> 26 | K2: =+IF(RC[-4]="OUT of TIME",RC[-1]-VLOOKUP(RC[-9],Enunciado!R3C6:R5C7,2,0),"") -> 11
A3: Dept5-24435 | B3: Alto | C3: 41310 | D3: 41315 | E3: =+LEFT(RC[-4],5) -> Dept5 | F3: =+VLOOKUP(RC[-4],Enunciado!R3C6:R5C7,2,0)+RC[-3] -> 41315 | G3: =+IF(RC[-1]>=RC[-3],"ON TIME","OUT OF TIME") -> ON TIME | H3: =+YEAR(RC[-5]) -> 2013 | I3: =+MONTH(RC[-6]) -> 2 | J3: =+RC[-6]-RC[-7] -> 5 | K3: =+IF(RC[-4]="OUT of TIME",RC[-1]-VLOOKUP(RC[-9],Enunciado!R3C6:R5C7,2,0),"") ->  | N3: Respuestas
A4: Dept3-28859 | B4: Alto | C4: 40951 | D4: 40954 | E4: =+LEFT(RC[-4],5) -> Dept3 | F4: =+VLOOKUP(RC[-4],Enunciado!R3C6:R5C7,2,0)+RC[-3] -> 40956 | G4: =+IF(RC[-1]>=RC[-3],"ON TIME","OUT OF TIME") -> ON TIME | H4: =+YEAR(RC[-5]) -> 2012 | I4: =+MONTH(RC[-6]) -> 2 | J4: =+RC[-6]-RC[-7] -> 3 | K4: =+IF(RC[-4]="OUT of TIME",RC[-1]-VLOOKUP(RC[-9],Enunciado!R3C6:R5C7,2,0),"") -> 
A5: Dept5-1606 | B5: Medio | C5: 41379 | D5: 41382 | E5: =+LEFT(RC[-4],5) -> Dept5 | F5: =+VLOOKUP(RC[-4],Enunciado!R3C6:R5C7,2,0)+RC[-3] -> 41394 | G5: =+IF(RC[-1]>=RC[-3],"ON TIME","OUT OF TIME") -> ON TIME | H5: =+YEAR(RC[-5]) -> 2013 | I5: =+MONTH(RC[-6]) -> 4 | J5: =+RC[-6]-RC[-7] -> 3 | K5: =+IF(RC[-4]="OUT of TIME",RC[-1]-VLOOKUP(RC[-9],Enunciado!R3C6:R5C7,2,0),"") ->  | O5: 2012 | AA5: 2013 | AN5: Total
A6: Dept2-8381 | B6: Alto | C6: 41511 | D6: 41546 | E6: =+LEFT(RC[-4],5) -> Dept2 | F6: =+VLOOKUP(RC[-4],Enunciado!R3C6:R5C7,2,0)+RC[-3] -> 41516 | G6: =+IF(RC[-1]>=RC[-3],"ON TIME","OUT OF TIME") -> OUT OF TIME | H6: =+YEAR(RC[-5]) -> 2013 | I6: =+MONTH(RC[-6]) -> 8 | J6: =+RC[-6]-RC[-7] -> 35 | K6: =+IF(RC[-4]="OUT of TIME",RC[-1]-VLOOKUP(RC[-9],Enunciado!R3C6:R5C7,2,0),"") -> 30 | O6: 1 | P6: 2 | Q6: 3 | R6: 4 | S6: 5 | T6: 6 | U6: 7 | V6: 8 | W6: 9 | X6: 10 | Y6: 11 | Z6: 12 | AA6: 1 | AB6: 2 | AC6: 3 | AD6: 4 | AE6: 5 | AF6: 6 | AG6: 7 | AH6: 8 | AI6: 9 | AJ6: 10 | AK6: 11 | AL6: 12
A7: Dept2-20854 | B7: Alto | C7: 41128 | D7: 41130 | E7: =+LEFT(RC[-4],5) -> Dept2 | F7: =+VLOOKUP(RC[-4],Enunciado!R3C6:R5C7,2,0)+RC[-3] -> 41133 | G7: =+IF(RC[-1]>=RC[-3],"ON TIME","OUT OF TIME") -> ON TIME | H7: =+YEAR(RC[-5]) -> 2012 | I7: =+MONTH(RC[-6]) -> 8 | J7: =+RC[-6]-RC[-7] -> 2 | K7: =+IF(RC[-4]="OUT of TIME",RC[-1]-VLOOKUP(RC[-9],Enunciado!R3C6:R5C7,2,0),"") ->  | O7: =+DATE(R5C15,R[-1]C,1) -> 40909 | P7: =+DATE(R5C15,R[-1]C,1) -> 40940 | Q7: =+DATE(R5C15,R[-1]C,1) -> 40969 | R7: =+DATE(R5C15,R[-1]C,1) -> 41000 | S7: =+DATE(R5C15,R[-1]C,1) -> 41030 | T7: =+DATE(R5C15,R[-1]C,1) -> 41061 | U7: =+DATE(R5C15,R[-1]C,1) -> 41091 | V7: =+DATE(R5C15,R[-1]C,1) -> 41122 | W7: =+DATE(R5C15,R[-1]C,1) -> 41153 | X7: =+DATE(R5C15,R[-1]C,1) -> 41183 | Y7: =+DATE(R5C15,R[-1]C,1) -> 41214 | Z7: =+DATE(R5C15,R[-1]C,1) -> 41244 | AA7: =+DATE(R5C27,R[-1]C,1) -> 41275 | AB7: =+DATE(R5C27,R[-1]C,1) -> 41306 | AC7: =+DATE(R5C27,R[-1]C,1) -> 41334 | AD7: =+DATE(R5C27,R[-1]C,1) -> 41365 | AE7: =+DATE(R5C27,R[-1]C,1) -> 41395 | AF7: =+DATE(R5C27,R[-1]C,1) -> 41426 | AG7: =+DATE(R5C27,R[-1]C,1) -> 41456 | AH7: =+DATE(R5C27,R[-1]C,1) -> 41487 | AI7: =+DATE(R5C27,R[-1]C,1) -> 41518 | AJ7: =+DATE(R5C27,R[-1]C,1) -> 41548 | AK7: =+DATE(R5C27,R[-1]C,1) -> 41579 | AL7: =+DATE(R5C27,R[-1]C,1) -> 41609
A8: Dept5-472 | B8: Medio | C8: 41366 | D8: 41405 | E8: =+LEFT(RC[-4],5) -> Dept5 | F8: =+VLOOKUP(RC[-4],Enunciado!R3C6:R5C7,2,0)+RC[-3] -> 41381 | G8: =+IF(RC[-1]>=RC[-3],"ON TIME","OUT OF TIME") -> OUT OF TIME | H8: =+YEAR(RC[-5]) -> 2013 | I8: =+MONTH(RC[-6]) -> 4 | J8: =+RC[-6]-RC[-7] -> 39 | K8: =+IF(RC[-4]="OUT of TIME",RC[-1]-VLOOKUP(RC[-9],Enunciado!R3C6:R5C7,2,0),"") -> 24
A9: Dept1-8874 | B9: Medio | C9: 41559 | D9: 41578 | E9: =+LEFT(RC[-4],5) -> Dept1 | F9: =+VLOOKUP(RC[-4],Enunciado!R3C6:R5C7,2,0)+RC[-3] -> 41574 | G9: =+IF(RC[-1]>=RC[-3],"ON TIME","OUT OF TIME") -> OUT OF TIME | H9: =+YEAR(RC[-5]) -> 2013 | I9: =+MONTH(RC[-6]) -> 10 | J9: =+RC[-6]-RC[-7] -> 19 | K9: =+IF(RC[-4]="OUT of TIME",RC[-1]-VLOOKUP(RC[-9],Enunciado!R3C6:R5C7,2,0),"") -> 4 | N9: General
A10: Dept2-4814 | B10: Bajo | C10: 41049 | D10: 41051 | E10: =+LEFT(RC[-4],5) -> Dept2 | F10: =+VLOOKUP(RC[-4],Enunciado!R3C6:R5C7,2,0)+RC[-3] -> 41079 | G10: =+IF(RC[-1]>=RC[-3],"ON TIME","OUT OF TIME") -> ON TIME | H10: =+YEAR(RC[-5]) -> 2012 | I10: =+MONTH(RC[-6]) -> 5 | J10: =+RC[-6]-RC[-7] -> 2 | K10: =+IF(RC[-4]="OUT of TIME",RC[-1]-VLOOKUP(RC[-9],Enunciado!R3C6:R5C7,2,0),"") ->  | N10: Total | O10: =+COUNTIFS(R2C8:R1001C8,R[-5]C15,R2C9:R1001C9,R6C) -> 35 | P10: =+COUNTIFS(R2C8:R1001C8,R[-5]C15,R2C9:R1001C9,R6C) -> 49 | Q10: =+COUNTIFS(R2C8:R1001C8,R[-5]C15,R2C9:R1001C9,R6C) -> 38 | R10: =+COUNTIFS(R2C8:R1001C8,R[-5]C15,R2C9:R1001C9,R6C) -> 41 | S10: =+COUNTIFS(R2C8:R1001C8,R[-5]C15,R2C9:R1001C9,R6C) -> 48 | T10: =+COUNTIFS(R2C8:R1001C8,R[-5]C15,R2C9:R1001C9,R6C) -> 50 | U10: =+COUNTIFS(R2C8:R1001C8,R[-5]C15,R2C9:R1001C9,R6C) -> 46 | V10: =+COUNTIFS(R2C8:R1001C8,R[-5]C15,R2C9:R1001C9,R6C) -> 34 | W10: =+COUNTIFS(R2C8:R1001C8,R[-5]C15,R2C9:R1001C9,R6C) -> 41 | X10: =+COUNTIFS(R2C8:R1001C8,R[-5]C15,R2C9:R1001C9,R6C) -> 34 | Y10: =+COUNTIFS(R2C8:R1001C8,R[-5]C15,R2C9:R1001C9,R6C) -> 52 | Z10: =+COUNTIFS(R2C8:R1001C8,R[-5]C15,R2C9:R1001C9,R6C) -> 43 | AA10: =+COUNTIFS(R2C8:R1001C8,R[-5]C27,R2C9:R1001C9,R6C[-12]) -> 35 | AB10: =+COUNTIFS(R2C8:R1001C8,R[-5]C27,R2C9:R1001C9,R6C[-12]) -> 28 | AC10: =+COUNTIFS(R2C8:R1001C8,R[-5]C27,R2C9:R1001C9,R6C[-12]) -> 35 | AD10: =+COUNTIFS(R2C8:R1001C8,R[-5]C27,R2C9:R1001C9,R6C[-12]) -> 28 | AE10: =+COUNTIFS(R2C8:R1001C8,R[-5]C27,R2C9:R1001C9,R6C[-12]) -> 42 | AF10: =+COUNTIFS(R2C8:R1001C8,R[-5]C27,R2C9:R1001C9,R6C[-12]) -> 48 | AG10: =+COUNTIFS(R2C8:R1001C8,R[-5]C27,R2C9:R1001C9,R6C[-12]) -> 45 | AH10: =+COUNTIFS(R2C8:R1001C8,R[-5]C27,R2C9:R1001C9,R6C[-12]) -> 51 | AI10: =+COUNTIFS(R2C8:R1001C8,R[-5]C27,R2C9:R1001C9,R6C[-12]) -> 48 | AJ10: =+COUNTIFS(R2C8:R1001C8,R[-5]C27,R2C9:R1001C9,R6C[-12]) -> 51 | AK10: =+COUNTIFS(R2C8:R1001C8,R[-5]C27,R2C9:R1001C9,R6C[-12]) -> 39 | AL10: =+COUNTIFS(R2C8:R1001C8,R[-5]C27,R2C9:R1001C9,R6C[-12]) -> 39 | AN10: =+SUM(RC[-25]:RC[-2]) -> 1000
A11: Dept2-18996 | B11: Bajo | C11: 41068 | D11: 41086 | E11: =+LEFT(RC[-4],5) -> Dept2 | F11: =+VLOOKUP(RC[-4],Enunciado!R3C6:R5C7,2,0)+RC[-3] -> 41098 | G11: =+IF(RC[-1]>=RC[-3],"ON TIME","OUT OF TIME") -> ON TIME | H11: =+YEAR(RC[-5]) -> 2012 | I11: =+MONTH(RC[-6]) -> 6 | J11: =+RC[-6]-RC[-7] -> 18 | K11: =+IF(RC[-4]="OUT of TIME",RC[-1]-VLOOKUP(RC[-9],Enunciado!R3C6:R5C7,2,0),"") ->  | N11: Tiempo de respuesta | O11: =+AVERAGEIFS(R2C10:R1001C10,R2C8:R1001C8,YEAR(R7C),R2C9:R1001C9,MONTH(R7C)) -> 12.5142857142857 | P11: =+AVERAGEIFS(R2C10:R1001C10,R2C8:R1001C8,YEAR(R7C),R2C9:R1001C9,MONTH(R7C)) -> 11.7142857142857 | Q11: =+AVERAGEIFS(R2C10:R1001C10,R2C8:R1001C8,YEAR(R7C),R2C9:R1001C9,MONTH(R7C)) -> 10.8684210526316 | R11: =+AVERAGEIFS(R2C10:R1001C10,R2C8:R1001C8,YEAR(R7C),R2C9:R1001C9,MONTH(R7C)) -> 9.70731707317073 | S11: =+AVERAGEIFS(R2C10:R1001C10,R2C8:R1001C8,YEAR(R7C),R2C9:R1001C9,MONTH(R7C)) -> 8.77083333333333 | T11: =+AVERAGEIFS(R2C10:R1001C10,R2C8:R1001C8,YEAR(R7C),R2C9:R1001C9,MONTH(R7C)) -> 14.36 | U11: =+AVERAGEIFS(R2C10:R1001C10,R2C8:R1001C8,YEAR(R7C),R2C9:R1001C9,MONTH(R7C)) -> 9.04347826086956 | V11: =+AVERAGEIFS(R2C10:R1001C10,R2C8:R1001C8,YEAR(R7C),R2C9:R1001C9,MONTH(R7C)) -> 8.91176470588235 | W11: =+AVERAGEIFS(R2C10:R1001C10,R2C8:R1001C8,YEAR(R7C),R2C9:R1001C9,MONTH(R7C)) -> 10.1219512195122 | X11: =+AVERAGEIFS(R2C10:R1001C10,R2C8:R1001C8,YEAR(R7C),R2C9:R1001C9,MONTH(R7C)) -> 15.7352941176471 | Y11: =+AVERAGEIFS(R2C10:R1001C10,R2C8:R1001C8,YEAR(R7C),R2C9:R1001C9,MONTH(R7C)) -> 11.4038461538462 | Z11: =+AVERAGEIFS(R2C10:R1001C10,R2C8:R1001C8,YEAR(R7C),R2C9:R1001C9,MONTH(R7C)) -> 12.6279069767442 | AA11: =+AVERAGEIFS(R2C10:R1001C10,R2C8:R1001C8,YEAR(R7C),R2C9:R1001C9,MONTH(R7C)) -> 11.7428571428571 | AB11: =+AVERAGEIFS(R2C10:R1001C10,R2C8:R1001C8,YEAR(R7C),R2C9:R1001C9,MONTH(R7C)) -> 14.8571428571429 | AC11: =+AVERAGEIFS(R2C10:R1001C10,R2C8:R1001C8,YEAR(R7C),R2C9:R1001C9,MONTH(R7C)) -> 13.4285714285714 | AD11: =+AVERAGEIFS(R2C10:R1001C10,R2C8:R1001C8,YEAR(R7C),R2C9:R1001C9,MONTH(R7C)) -> 12.3214285714286 | AE11: =+AVERAGEIFS(R2C10:R1001C10,R2C8:R1001C8,YEAR(R7C),R2C9:R1001C9,MONTH(R7C)) -> 12.047619047619 | AF11: =+AVERAGEIFS(R2C10:R1001C10,R2C8:R1001C8,YEAR(R7C),R2C9:R1001C9,MONTH(R7C)) -> 9.16666666666667 | AG11: =+AVERAGEIFS(R2C10:R1001C10,R2C8:R1001C8,YEAR(R7C),R2C9:R1001C9,MONTH(R7C)) -> 11.2 | AH11: =+AVERAGEIFS(R2C10:R1001C10,R2C8:R1001C8,YEAR(R7C),R2C9:R1001C9,MONTH(R7C)) -> 13.921568627451 | AI11: =+AVERAGEIFS(R2C10:R1001C10,R2C8:R1001C8,YEAR(R7C),R2C9:R1001C9,MONTH(R7C)) -> 15.4166666666667 | AJ11: =+AVERAGEIFS(R2C10:R1001C10,R2C8:R1001C8,YEAR(R7C),R2C9:R1001C9,MONTH(R7C)) -> 8.90196078431373 | AK11: =+AVERAGEIFS(R2C10:R1001C10,R2C8:R1001C8,YEAR(R7C),R2C9:R1001C9,MONTH(R7C)) -> 10.8974358974359 | AL11: =+AVERAGEIFS(R2C10:R1001C10,R2C8:R1001C8,YEAR(R7C),R2C9:R1001C9,MONTH(R7C)) -> 11.8205128205128
A12: Dept6-7842 | B12: Alto | C12: 41612 | D12: 41627 | E12: =+LEFT(RC[-4],5) -> Dept6 | F12: =+VLOOKUP(RC[-4],Enunciado!R3C6:R5C7,2,0)+RC[-3] -> 41617 | G12: =+IF(RC[-1]>=RC[-3],"ON TIME","OUT OF TIME") -> OUT OF TIME | H12: =+YEAR(RC[-5]) -> 2013 | I12: =+MONTH(RC[-6]) -> 12 | J12: =+RC[-6]-RC[-7] -> 15 | K12: =+IF(RC[-4]="OUT of TIME",RC[-1]-VLOOKUP(RC[-9],Enunciado!R3C6:R5C7,2,0),"") -> 10 | N12: % ON TIME | O12: =+R[16]C/R[-2]C -> 0.685714285714286 | P12: =+R[16]C/R[-2]C -> 0.693877551020408 | Q12: =+R[16]C/R[-2]C -> 0.763157894736842 | R12: =+R[16]C/R[-2]C -> 0.682926829268293 | S12: =+R[16]C/R[-2]C -> 0.729166666666667 | T12: =+R[16]C/R[-2]C -> 0.56 | U12: =+R[16]C/R[-2]C -> 0.695652173913043 | V12: =+R[16]C/R[-2]C -> 0.735294117647059 | W12: =+R[16]C/R[-2]C -> 0.658536585365854 | X12: =+R[16]C/R[-2]C -> 0.617647058823529 | Y12: =+R[16]C/R[-2]C -> 0.75 | Z12: =+R[16]C/R[-2]C -> 0.697674418604651 | AA12: =+R[16]C/R[-2]C -> 0.685714285714286 | AB12: =+R[16]C/R[-2]C -> 0.678571428571429 | AC12: =+R[16]C/R[-2]C -> 0.657142857142857 | AD12: =+R[16]C/R[-2]C -> 0.678571428571429 | AE12: =+R[16]C/R[-2]C -> 0.69047619047619 | AF12: =+R[16]C/R[-2]C -> 0.770833333333333 | AG12: =+R[16]C/R[-2]C -> 0.777777777777778 | AH12: =+R[16]C/R[-2]C -> 0.627450980392157 | AI12: =+R[16]C/R[-2]C -> 0.604166666666667 | AJ12: =+R[16]C/R[-2]C -> 0.764705882352941 | AK12: =+R[16]C/R[-2]C -> 0.743589743589744 | AL12: =+R[16]C/R[-2]C -> 0.743589743589744
A13: Dept4-12854 | B13: Bajo | C13: 41534 | D13: 41536 | E13: =+LEFT(RC[-4],5) -> Dept4 | F13: =+VLOOKUP(RC[-4],Enunciado!R3C6:R5C7,2,0)+RC[-3] -> 41564 | G13: =+IF(RC[-1]>=RC[-3],"ON TIME","OUT OF TIME") -> ON TIME | H13: =+YEAR(RC[-5]) -> 2013 | I13: =+MONTH(RC[-6]) -> 9 | J13: =+RC[-6]-RC[-7] -> 2 | K13: =+IF(RC[-4]="OUT of TIME",RC[-1]-VLOOKUP(RC[-9],Enunciado!R3C6:R5C7,2,0),"") -> 
A14: Dept1-16301 | B14: Alto | C14: 41530 | D14: 41535 | E14: =+LEFT(RC[-4],5) -> Dept1 | F14: =+VLOOKUP(RC[-4],Enunciado!R3C6:R5C7,2,0)+RC[-3] -> 41535 | G14: =+IF(RC[-1]>=RC[-3],"ON TIME","OUT OF TIME") -> ON TIME | H14: =+YEAR(RC[-5]) -> 2013 | I14: =+MONTH(RC[-6]) -> 9 | J14: =+RC[-6]-RC[-7] -> 5 | K14: =+IF(RC[-4]="OUT of TIME",RC[-1]-VLOOKUP(RC[-9],Enunciado!R3C6:R5C7,2,0),"") ->  | N14: Departamento | O14: Respuesas recibidas
A15: Dept3-10605 | B15: Medio | C15: 41153 | D15: 41165 | E15: =+LEFT(RC[-4],5) -> Dept3 | F15: =+VLOOKUP(RC[-4],Enunciado!R3C6:R5C7,2,0)+RC[-3] -> 41168 | G15: =+IF(RC[-1]>=RC[-3],"ON TIME","OUT OF TIME") -> ON TIME | H15: =+YEAR(RC[-5]) -> 2012 | I15: =+MONTH(RC[-6]) -> 9 | J15: =+RC[-6]-RC[-7] -> 12 | K15: =+IF(RC[-4]="OUT of TIME",RC[-1]-VLOOKUP(RC[-9],Enunciado!R3C6:R5C7,2,0),"") ->  | N15: Dept1 | O15: =+COUNTIFS(R2C8:R1001C8,R5C15,R2C9:R1001C9,R6C,R2C5:R1001C5,RC14) -> 6 | P15: =+COUNTIFS(R2C8:R1001C8,R5C15,R2C9:R1001C9,R6C,R2C5:R1001C5,RC14) -> 12 | Q15: =+COUNTIFS(R2C8:R1001C8,R5C15,R2C9:R1001C9,R6C,R2C5:R1001C5,RC14) -> 6 | R15: =+COUNTIFS(R2C8:R1001C8,R5C15,R2C9:R1001C9,R6C,R2C5:R1001C5,RC14) -> 7 | S15: =+COUNTIFS(R2C8:R1001C8,R5C15,R2C9:R1001C9,R6C,R2C5:R1001C5,RC14) -> 3 | T15: =+COUNTIFS(R2C8:R1001C8,R5C15,R2C9:R1001C9,R6C,R2C5:R1001C5,RC14) -> 12 | U15: =+COUNTIFS(R2C8:R1001C8,R5C15,R2C9:R1001C9,R6C,R2C5:R1001C5,RC14) -> 6 | V15: =+COUNTIFS(R2C8:R1001C8,R5C15,R2C9:R1001C9,R6C,R2C5:R1001C5,RC14) -> 3 | W15: =+COUNTIFS(R2C8:R1001C8,R5C15,R2C9:R1001C9,R6C,R2C5:R1001C5,RC14) -> 7 | X15: =+COUNTIFS(R2C8:R1001C8,R5C15,R2C9:R1001C9,R6C,R2C5:R1001C5,RC14) -> 9 | Y15: =+COUNTIFS(R2C8:R1001C8,R5C15,R2C9:R1001C9,R6C,R2C5:R1001C5,RC14) -> 8 | Z15: =+COUNTIFS(R2C8:R1001C8,R5C15,R2C9:R1001C9,R6C,R2C5:R1001C5,RC14) -> 10 | AA15: =+COUNTIFS(R2C8:R1001C8,R5C27,R2C9:R1001C9,R6C,R2C5:R1001C5,RC14) -> 3 | AB15: =+COUNTIFS(R2C8:R1001C8,R5C27,R2C9:R1001C9,R6C,R2C5:R1001C5,RC14) -> 7 | AC15: =+COUNTIFS(R2C8:R1001C8,R5C27,R2C9:R1001C9,R6C,R2C5:R1001C5,RC14) -> 6 | AD15: =+COUNTIFS(R2C8:R1001C8,R5C27,R2C9:R1001C9,R6C,R2C5:R1001C5,RC14) -> 3 | AE15: =+COUNTIFS(R2C8:R1001C8,R5C27,R2C9:R1001C9,R6C,R2C5:R1001C5,RC14) -> 6 | AF15: =+COUNTIFS(R2C8:R1001C8,R5C27,R2C9:R1001C9,R6C,R2C5:R1001C5,RC14) -> 9 | AG15: =+COUNTIFS(R2C8:R1001C8,R5C27,R2C9:R1001C9,R6C,R2C5:R1001C5,RC14) -> 10 | AH15: =+COUNTIFS(R2C8:R1001C8,R5C27,R2C9:R1001C9,R6C,R2C5:R1001C5,RC14) -> 7 | AI15: =+COUNTIFS(R2C8:R1001C8,R5C27,R2C9:R1001C9,R6C,R2C5:R1001C5,RC14) -> 5 | AJ15: =+COUNTIFS(R2C8:R1001C8,R5C27,R2C9:R1001C9,R6C,R2C5:R1001C5,RC14) -> 11 | AK15: =+COUNTIFS(R2C8:R1001C8,R5C27,R2C9:R1001C9,R6C,R2C5:R1001C5,RC14) -> 10 | AL15: =+COUNTIFS(R2C8:R1001C8,R5C27,R2C9:R1001C9,R6C,R2C5:R1001C5,RC14) -> 4 | AN15: =+SUM(RC[-25]:RC[-2]) -> 170
A16: Dept1-11709 | B16: Medio | C16: 40954 | D16: 40955 | E16: =+LEFT(RC[-4],5) -> Dept1 | F16: =+VLOOKUP(RC[-4],Enunciado!R3C6:R5C7,2,0)+RC[-3] -> 40969 | G16: =+IF(RC[-1]>=RC[-3],"ON TIME","OUT OF TIME") -> ON TIME | H16: =+YEAR(RC[-5]) -> 2012 | I16: =+MONTH(RC[-6]) -> 2 | J16: =+RC[-6]-RC[-7] -> 1 | K16: =+IF(RC[-4]="OUT of TIME",RC[-1]-VLOOKUP(RC[-9],Enunciado!R3C6:R5C7,2,0),"") ->  | N16: Dept2 | O16: =+COUNTIFS(R2C8:R1001C8,R5C15,R2C9:R1001C9,R6C,R2C5:R1001C5,RC14) -> 6 | P16: =+COUNTIFS(R2C8:R1001C8,R5C15,R2C9:R1001C9,R6C,R2C5:R1001C5,RC14) -> 12 | Q16: =+COUNTIFS(R2C8:R1001C8,R5C15,R2C9:R1001C9,R6C,R2C5:R1001C5,RC14) -> 8 | R16: =+COUNTIFS(R2C8:R1001C8,R5C15,R2C9:R1001C9,R6C,R2C5:R1001C5,RC14) -> 4 | S16: =+COUNTIFS(R2C8:R1001C8,R5C15,R2C9:R1001C9,R6C,R2C5:R1001C5,RC14) -> 16 | T16: =+COUNTIFS(R2C8:R1001C8,R5C15,R2C9:R1001C9,R6C,R2C5:R1001C5,RC14) -> 7 | U16: =+COUNTIFS(R2C8:R1001C8,R5C15,R2C9:R1001C9,R6C,R2C5:R1001C5,RC14) -> 11 | V16: =+COUNTIFS(R2C8:R1001C8,R5C15,R2C9:R1001C9,R6C,R2C5:R1001C5,RC14) -> 6 | W16: =+COUNTIFS(R2C8:R1001C8,R5C15,R2C9:R1001C9,R6C,R2C5:R1001C5,RC14) -> 11 | X16: =+COUNTIFS(R2C8:R1001C8,R5C15,R2C9:R1001C9,R6C,R2C5:R1001C5,RC14) -> 8 | Y16: =+COUNTIFS(R2C8:R1001C8,R5C15,R2C9:R1001C9,R6C,R2C5:R1001C5,RC14) -> 9 | Z16: =+COUNTIFS(R2C8:R1001C8,R5C15,R2C9:R1001C9,R6C,R2C5:R1001C5,RC14) -> 7 | AA16: =+COUNTIFS(R2C8:R1001C8,R5C27,R2C9:R1001C9,R6C,R2C5:R1001C5,RC14) -> 11 | AB16: =+COUNTIFS(R2C8:R1001C8,R5C27,R2C9:R1001C9,R6C,R2C5:R1001C5,RC14) -> 4 | AC16: =+COUNTIFS(R2C8:R1001C8,R5C27,R2C9:R1001C9,R6C,R2C5:R1001C5,RC14) -> 4 | AD16: =+COUNTIFS(R2C8:R1001C8,R5C27,R2C9:R1001C9,R6C,R2C5:R1001C5,RC14) -> 6 | AE16: =+COUNTIFS(R2C8:R1001C8,R5C27,R2C9:R1001C9,R6C,R2C5:R1001C5,RC14) -> 4 | AF16: =+COUNTIFS(R2C8:R1001C8,R5C27,R2C9:R1001C9,R6C,R2C5:R1001C5,RC14) -> 8 | AG16: =+COUNTIFS(R2C8:R1001C8,R5C27,R2C9:R1001C9,R6C,R2C5:R1001C5,RC14) -> 6 | AH16: =+COUNTIFS(R2C8:R1001C8,R5C27,R2C9:R1001C9,R6C,R2C5:R1001C5,RC14) -> 7 | AI16: =+COUNTIFS(R2C8:R1001C8,R5C27,R2C9:R1001C9,R6C,R2C5:R1001C5,RC14) -> 7 | AJ16: =+COUNTIFS(R2C8:R1001C8,R5C27,R2C9:R1001C9,R6C,R2C5:R1001C5,RC14) -> 10 | AK16: =+COUNTIFS(R2C8:R1001C8,R5C27,R2C9:R1001C9,R6C,R2C5:R1001C5,RC14) -> 8 | AL16: =+COUNTIFS(R2C8:R1001C8,R5C27,R2C9:R1001C9,R6C,R2C5:R1001C5,RC14) -> 9 | AN16: =+SUM(RC[-25]:RC[-2]) -> 189
A17: Dept4-16263 | B17: Bajo | C17: 41515 | D17: 41556 | E17: =+LEFT(RC[-4],5) -> Dept4 | F17: =+VLOOKUP(RC[-4],Enunciado!R3C6:R5C7,2,0)+RC[-3] -> 41545 | G17: =+IF(RC[-1]>=RC[-3],"ON TIME","OUT OF TIME") -> OUT OF TIME | H17: =+YEAR(RC[-5]) -> 2013 | I17: =+MONTH(RC[-6]) -> 8 | J17: =+RC[-6]-RC[-7] -> 41 | K17: =+IF(RC[-4]="OUT of TIME",RC[-1]-VLOOKUP(RC[-9],Enunciado!R3C6:R5C7,2,0),"") -> 11 | N17: Dept3 | O17: =+COUNTIFS(R2C8:R1001C8,R5C15,R2C9:R1001C9,R6C,R2C5:R1001C5,RC14) -> 3 | P17: =+COUNTIFS(R2C8:R1001C8,R5C15,R2C9:R1001C9,R6C,R2C5:R1001C5,RC14) -> 6 | Q17: =+COUNTIFS(R2C8:R1001C8,R5C15,R2C9:R1001C9,R6C,R2C5:R1001C5,RC14) -> 7 | R17: =+COUNTIFS(R2C8:R1001C8,R5C15,R2C9:R1001C9,R6C,R2C5:R1001C5,RC14) -> 9 | S17: =+COUNTIFS(R2C8:R1001C8,R5C15,R2C9:R1001C9,R6C,R2C5:R1001C5,RC14) -> 4 | T17: =+COUNTIFS(R2C8:R1001C8,R5C15,R2C9:R1001C9,R6C,R2C5:R1001C5,RC14) -> 8 | U17: =+COUNTIFS(R2C8:R1001C8,R5C15,R2C9:R1001C9,R6C,R2C5:R1001C5,RC14) -> 13 | V17: =+COUNTIFS(R2C8:R1001C8,R5C15,R2C9:R1001C9,R6C,R2C5:R1001C5,RC14) -> 5 | W17: =+COUNTIFS(R2C8:R1001C8,R5C15,R2C9:R1001C9,R6C,R2C5:R1001C5,RC14) -> 8 | X17: =+COUNTIFS(R2C8:R1001C8,R5C15,R2C9:R1001C9,R6C,R2C5:R1001C5,RC14) -> 3 | Y17: =+COUNTIFS(R2C8:R1001C8,R5C15,R2C9:R1001C9,R6C,R2C5:R1001C5,RC14) -> 12 | Z17: =+COUNTIFS(R2C8:R1001C8,R5C15,R2C9:R1001C9,R6C,R2C5:R1001C5,RC14) -> 4 | AA17: =+COUNTIFS(R2C8:R1001C8,R5C27,R2C9:R1001C9,R6C,R2C5:R1001C5,RC14) -> 5 | AB17: =+COUNTIFS(R2C8:R1001C8,R5C27,R2C9:R1001C9,R6C,R2C5:R1001C5,RC14) -> 4 | AC17: =+COUNTIFS(R2C8:R1001C8,R5C27,R2C9:R1001C9,R6C,R2C5:R1001C5,RC14) -> 7 | AD17: =+COUNTIFS(R2C8:R1001C8,R5C27,R2C9:R1001C9,R6C,R2C5:R1001C5,RC14) -> 2 | AE17: =+COUNTIFS(R2C8:R1001C8,R5C27,R2C9:R1001C9,R6C,R2C5:R1001C5,RC14) -> 10 | AF17: =+COUNTIFS(R2C8:R1001C8,R5C27,R2C9:R1001C9,R6C,R2C5:R1001C5,RC14) -> 11 | AG17: =+COUNTIFS(R2C8:R1001C8,R5C27,R2C9:R1001C9,R6C,R2C5:R1001C5,RC14) -> 8 | AH17: =+COUNTIFS(R2C8:R1001C8,R5C27,R2C9:R1001C9,R6C,R2C5:R1001C5,RC14) -> 10 | AI17: =+COUNTIFS(R2C8:R1001C8,R5C27,R2C9:R1001C9,R6C,R2C5:R1001C5,RC14) -> 4 | AJ17: =+COUNTIFS(R2C8:R1001C8,R5C27,R2C9:R1001C9,R6C,R2C5:R1001C5,RC14) -> 5 | AK17: =+COUNTIFS(R2C8:R1001C8,R5C27,R2C9:R1001C9,R6C,R2C5:R1001C5,RC14) -> 3 | AL17: =+COUNTIFS(R2C8:R1001C8,R5C27,R2C9:R1001C9,R6C,R2C5:R1001C5,RC14) -> 8 | AN17: =+SUM(RC[-25]:RC[-2]) -> 159
A18: Dept1-23520 | B18: Medio | C18: 41509 | D18: 41528 | E18: =+LEFT(RC[-4],5) -> Dept1 | F18: =+VLOOKUP(RC[-4],Enunciado!R3C6:R5C7,2,0)+RC[-3] -> 41524 | G18: =+IF(RC[-1]>=RC[-3],"ON TIME","OUT OF TIME") -> OUT OF TIME | H18: =+YEAR(RC[-5]) -> 2013 | I18: =+MONTH(RC[-6]) -> 8 | J18: =+RC[-6]-RC[-7] -> 19 | K18: =+IF(RC[-4]="OUT of TIME",RC[-1]-VLOOKUP(RC[-9],Enunciado!R3C6:R5C7,2,0),"") -> 4 | N18: Dept4 | O18: =+COUNTIFS(R2C8:R1001C8,R5C15,R2C9:R1001C9,R6C,R2C5:R1001C5,RC14) -> 5 | P18: =+COUNTIFS(R2C8:R1001C8,R5C15,R2C9:R1001C9,R6C,R2C5:R1001C5,RC14) -> 10 | Q18: =+COUNTIFS(R2C8:R1001C8,R5C15,R2C9:R1001C9,R6C,R2C5:R1001C5,RC14) -> 9 | R18: =+COUNTIFS(R2C8:R1001C8,R5C15,R2C9:R1001C9,R6C,R2C5:R1001C5,RC14) -> 6 | S18: =+COUNTIFS(R2C8:R1001C8,R5C15,R2C9:R1001C9,R6C,R2C5:R1001C5,RC14) -> 7 | T18: =+COUNTIFS(R2C8:R1001C8,R5C15,R2C9:R1001C9,R6C,R2C5:R1001C5,RC14) -> 7 | U18: =+COUNTIFS(R2C8:R1001C8,R5C15,R2C9:R1001C9,R6C,R2C5:R1001C5,RC14) -> 4 | V18: =+COUNTIFS(R2C8:R1001C8,R5C15,R2C9:R1001C9,R6C,R2C5:R1001C5,RC14) -> 7 | W18: =+COUNTIFS(R2C8:R1001C8,R5C15,R2C9:R1001C9,R6C,R2C5:R1001C5,RC14) -> 3 | X18: =+COUNTIFS(R2C8:R1001C8,R5C15,R2C9:R1001C9,R6C,R2C5:R1001C5,RC14) -> 5 | Y18: =+COUNTIFS(R2C8:R1001C8,R5C15,R2C9:R1001C9,R6C,R2C5:R1001C5,RC14) -> 9 | Z18: =+COUNTIFS(R2C8:R1001C8,R5C15,R2C9:R1001C9,R6C,R2C5:R1001C5,RC14) -> 9 | AA18: =+COUNTIFS(R2C8:R1001C8,R5C27,R2C9:R1001C9,R6C,R2C5:R1001C5,RC14) -> 4 | AB18: =+COUNTIFS(R2C8:R1001C8,R5C27,R2C9:R1001C9,R6C,R2C5:R1001C5,RC14) -> 3 | AC18: =+COUNTIFS(R2C8:R1001C8,R5C27,R2C9:R1001C9,R6C,R2C5:R1001C5,RC14) -> 9 | AD18: =+COUNTIFS(R2C8:R1001C8,R5C27,R2C9:R1001C9,R6C,R2C5:R1001C5,RC14) -> 4 | AE18: =+COUNTIFS(R2C8:R1001C8,R5C27,R2C9:R1001C9,R6C,R2C5:R1001C5,RC14) -> 8 | AF18: =+COUNTIFS(R2C8:R1001C8,R5C27,R2C9:R1001C9,R6C,R2C5:R1001C5,RC14) -> 7 | AG18: =+COUNTIFS(R2C8:R1001C8,R5C27,R2C9:R1001C9,R6C,R2C5:R1001C5,RC14) -> 7 | AH18: =+COUNTIFS(R2C8:R1001C8,R5C27,R2C9:R1001C9,R6C,R2C5:R1001C5,RC14) -> 7 | AI18: =+COUNTIFS(R2C8:R1001C8,R5C27,R2C9:R1001C9,R6C,R2C5:R1001C5,RC14) -> 10 | AJ18: =+COUNTIFS(R2C8:R1001C8,R5C27,R2C9:R1001C9,R6C,R2C5:R1001C5,RC14) -> 10 | AK18: =+COUNTIFS(R2C8:R1001C8,R5C27,R2C9:R1001C9,R6C,R2C5:R1001C5,RC14) -> 2 | AL18: =+COUNTIFS(R2C8:R1001C8,R5C27,R2C9:R1001C9,R6C,R2C5:R1001C5,RC14) -> 6 | AN18: =+SUM(RC[-25]:RC[-2]) -> 158
A19: Dept2-2219 | B19: Bajo | C19: 41184 | D19: 41195 | E19: =+LEFT(RC[-4],5) -> Dept2 | F19: =+VLOOKUP(RC[-4],Enunciado!R3C6:R5C7,2,0)+RC[-3] -> 41214 | G19: =+IF(RC[-1]>=RC[-3],"ON TIME","OUT OF TIME") -> ON TIME | H19: =+YEAR(RC[-5]) -> 2012 | I19: =+MONTH(RC[-6]) -> 10 | J19: =+RC[-6]-RC[-7] -> 11 | K19: =+IF(RC[-4]="OUT of TIME",RC[-1]-VLOOKUP(RC[-9],Enunciado!R3C6:R5C7,2,0),"") ->  | N19: Dept5 | O19: =+COUNTIFS(R2C8:R1001C8,R5C15,R2C9:R1001C9,R6C,R2C5:R1001C5,RC14) -> 10 | P19: =+COUNTIFS(R2C8:R1001C8,R5C15,R2C9:R1001C9,R6C,R2C5:R1001C5,RC14) -> 3 | Q19: =+COUNTIFS(R2C8:R1001C8,R5C15,R2C9:R1001C9,R6C,R2C5:R1001C5,RC14) -> 3 | R19: =+COUNTIFS(R2C8:R1001C8,R5C15,R2C9:R1001C9,R6C,R2C5:R1001C5,RC14) -> 8 | S19: =+COUNTIFS(R2C8:R1001C8,R5C15,R2C9:R1001C9,R6C,R2C5:R1001C5,RC14) -> 7 | T19: =+COUNTIFS(R2C8:R1001C8,R5C15,R2C9:R1001C9,R6C,R2C5:R1001C5,RC14) -> 8 | U19: =+COUNTIFS(R2C8:R1001C8,R5C15,R2C9:R1001C9,R6C,R2C5:R1001C5,RC14) -> 4 | V19: =+COUNTIFS(R2C8:R1001C8,R5C15,R2C9:R1001C9,R6C,R2C5:R1001C5,RC14) -> 6 | W19: =+COUNTIFS(R2C8:R1001C8,R5C15,R2C9:R1001C9,R6C,R2C5:R1001C5,RC14) -> 5 | X19: =+COUNTIFS(R2C8:R1001C8,R5C15,R2C9:R1001C9,R6C,R2C5:R1001C5,RC14) -> 2 | Y19: =+COUNTIFS(R2C8:R1001C8,R5C15,R2C9:R1001C9,R6C,R2C5:R1001C5,RC14) -> 9 | Z19: =+COUNTIFS(R2C8:R1001C8,R5C15,R2C9:R1001C9,R6C,R2C5:R1001C5,RC14) -> 5 | AA19: =+COUNTIFS(R2C8:R1001C8,R5C27,R2C9:R1001C9,R6C,R2C5:R1001C5,RC14) -> 7 | AB19: =+COUNTIFS(R2C8:R1001C8,R5C27,R2C9:R1001C9,R6C,R2C5:R1001C5,RC14) -> 6 | AC19: =+COUNTIFS(R2C8:R1001C8,R5C27,R2C9:R1001C9,R6C,R2C5:R1001C5,RC14) -> 2 | AD19: =+COUNTIFS(R2C8:R1001C8,R5C27,R2C9:R1001C9,R6C,R2C5:R1001C5,RC14) -> 7 | AE19: =+COUNTIFS(R2C8:R1001C8,R5C27,R2C9:R1001C9,R6C,R2C5:R1001C5,RC14) -> 9 | AF19: =+COUNTIFS(R2C8:R1001C8,R5C27,R2C9:R1001C9,R6C,R2C5:R1001C5,RC14) -> 7 | AG19: =+COUNTIFS(R2C8:R1001C8,R5C27,R2C9:R1001C9,R6C,R2C5:R1001C5,RC14) -> 10 | AH19: =+COUNTIFS(R2C8:R1001C8,R5C27,R2C9:R1001C9,R6C,R2C5:R1001C5,RC14) -> 11 | AI19: =+COUNTIFS(R2C8:R1001C8,R5C27,R2C9:R1001C9,R6C,R2C5:R1001C5,RC14) -> 13 | AJ19: =+COUNTIFS(R2C8:R1001C8,R5C27,R2C9:R1001C9,R6C,R2C5:R1001C5,RC14) -> 9 | AK19: =+COUNTIFS(R2C8:R1001C8,R5C27,R2C9:R1001C9,R6C,R2C5:R1001C5,RC14) -> 6 | AL19: =+COUNTIFS(R2C8:R1001C8,R5C27,R2C9:R1001C9,R6C,R2C5:R1001C5,RC14) -> 5 | AN19: =+SUM(RC[-25]:RC[-2]) -> 162
A20: Dept4-16321 | B20: Alto | C20: 41336 | D20: 41385 | E20: =+LEFT(RC[-4],5) -> Dept4 | F20: =+VLOOKUP(RC[-4],Enunciado!R3C6:R5C7,2,0)+RC[-3] -> 41341 | G20: =+IF(RC[-1]>=RC[-3],"ON TIME","OUT OF TIME") -> OUT OF TIME | H20: =+YEAR(RC[-5]) -> 2013 | I20: =+MONTH(RC[-6]) -> 3 | J20: =+RC[-6]-RC[-7] -> 49 | K20: =+IF(RC[-4]="OUT of TIME",RC[-1]-VLOOKUP(RC[-9],Enunciado!R3C6:R5C7,2,0),"") -> 44 | N20: Dept6 | O20: =+COUNTIFS(R2C8:R1001C8,R5C15,R2C9:R1001C9,R6C,R2C5:R1001C5,RC14) -> 5 | P20: =+COUNTIFS(R2C8:R1001C8,R5C15,R2C9:R1001C9,R6C,R2C5:R1001C5,RC14) -> 6 | Q20: =+COUNTIFS(R2C8:R1001C8,R5C15,R2C9:R1001C9,R6C,R2C5:R1001C5,RC14) -> 5 | R20: =+COUNTIFS(R2C8:R1001C8,R5C15,R2C9:R1001C9,R6C,R2C5:R1001C5,RC14) -> 7 | S20: =+COUNTIFS(R2C8:R1001C8,R5C15,R2C9:R1001C9,R6C,R2C5:R1001C5,RC14) -> 11 | T20: =+COUNTIFS(R2C8:R1001C8,R5C15,R2C9:R1001C9,R6C,R2C5:R1001C5,RC14) -> 8 | U20: =+COUNTIFS(R2C8:R1001C8,R5C15,R2C9:R1001C9,R6C,R2C5:R1001C5,RC14) -> 8 | V20: =+COUNTIFS(R2C8:R1001C8,R5C15,R2C9:R1001C9,R6C,R2C5:R1001C5,RC14) -> 7 | W20: =+COUNTIFS(R2C8:R1001C8,R5C15,R2C9:R1001C9,R6C,R2C5:R1001C5,RC14) -> 7 | X20: =+COUNTIFS(R2C8:R1001C8,R5C15,R2C9:R1001C9,R6C,R2C5:R1001C5,RC14) -> 7 | Y20: =+COUNTIFS(R2C8:R1001C8,R5C15,R2C9:R1001C9,R6C,R2C5:R1001C5,RC14) -> 5 | Z20: =+COUNTIFS(R2C8:R1001C8,R5C15,R2C9:R1001C9,R6C,R2C5:R1001C5,RC14) -> 8 | AA20: =+COUNTIFS(R2C8:R1001C8,R5C27,R2C9:R1001C9,R6C,R2C5:R1001C5,RC14) -> 5 | AB20: =+COUNTIFS(R2C8:R1001C8,R5C27,R2C9:R1001C9,R6C,R2C5:R1001C5,RC14) -> 4 | AC20: =+COUNTIFS(R2C8:R1001C8,R5C27,R2C9:R1001C9,R6C,R2C5:R1001C5,RC14) -> 7 | AD20: =+COUNTIFS(R2C8:R1001C8,R5C27,R2C9:R1001C9,R6C,R2C5:R1001C5,RC14) -> 6 | AE20: =+COUNTIFS(R2C8:R1001C8,R5C27,R2C9:R1001C9,R6C,R2C5:R1001C5,RC14) -> 5 | AF20: =+COUNTIFS(R2C8:R1001C8,R5C27,R2C9:R1001C9,R6C,R2C5:R1001C5,RC14) -> 6 | AG20: =+COUNTIFS(R2C8:R1001C8,R5C27,R2C9:R1001C9,R6C,R2C5:R1001C5,RC14) -> 4 | AH20: =+COUNTIFS(R2C8:R1001C8,R5C27,R2C9:R1001C9,R6C,R2C5:R1001C5,RC14) -> 9 | AI20: =+COUNTIFS(R2C8:R1001C8,R5C27,R2C9:R1001C9,R6C,R2C5:R1001C5,RC14) -> 9 | AJ20: =+COUNTIFS(R2C8:R1001C8,R5C27,R2C9:R1001C9,R6C,R2C5:R1001C5,RC14) -> 6 | AK20: =+COUNTIFS(R2C8:R1001C8,R5C27,R2C9:R1001C9,R6C,R2C5:R1001C5,RC14) -> 10 | AL20: =+COUNTIFS(R2C8:R1001C8,R5C27,R2C9:R1001C9,R6C,R2C5:R1001C5,RC14) -> 7 | AN20: =+SUM(RC[-25]:RC[-2]) -> 162
A21: Dept3-4500 | B21: Alto | C21: 41118 | D21: 41120 | E21: =+LEFT(RC[-4],5) -> Dept3 | F21: =+VLOOKUP(RC[-4],Enunciado!R3C6:R5C7,2,0)+RC[-3] -> 41123 | G21: =+IF(RC[-1]>=RC[-3],"ON TIME","OUT OF TIME") -> ON TIME | H21: =+YEAR(RC[-5]) -> 2012 | I21: =+MONTH(RC[-6]) -> 7 | J21: =+RC[-6]-RC[-7] -> 2 | K21: =+IF(RC[-4]="OUT of TIME",RC[-1]-VLOOKUP(RC[-9],Enunciado!R3C6:R5C7,2,0),"") -> 
A22: Dept3-13857 | B22: Medio | C22: 41094 | D22: 41098 | E22: =+LEFT(RC[-4],5) -> Dept3 | F22: =+VLOOKUP(RC[-4],Enunciado!R3C6:R5C7,2,0)+RC[-3] -> 41109 | G22: =+IF(RC[-1]>=RC[-3],"ON TIME","OUT OF TIME") -> ON TIME | H22: =+YEAR(RC[-5]) -> 2012 | I22: =+MONTH(RC[-6]) -> 7 | J22: =+RC[-6]-RC[-7] -> 4 | K22: =+IF(RC[-4]="OUT of TIME",RC[-1]-VLOOKUP(RC[-9],Enunciado!R3C6:R5C7,2,0),"") ->  | N22: Tipo de incidencia
A23: Dept2-27829 | B23: Bajo | C23: 41378 | D23: 41378 | E23: =+LEFT(RC[-4],5) -> Dept2 | F23: =+VLOOKUP(RC[-4],Enunciado!R3C6:R5C7,2,0)+RC[-3] -> 41408 | G23: =+IF(RC[-1]>=RC[-3],"ON TIME","OUT OF TIME") -> ON TIME | H23: =+YEAR(RC[-5]) -> 2013 | I23: =+MONTH(RC[-6]) -> 4 | J23: =+RC[-6]-RC[-7] -> 0 | K23: =+IF(RC[-4]="OUT of TIME",RC[-1]-VLOOKUP(RC[-9],Enunciado!R3C6:R5C7,2,0),"") ->  | N23: Alto | O23: =+COUNTIFS(R2C8:R1001C8,R5C15,R2C9:R1001C9,R6C,R2C2:R1001C2,RC14) -> 9 | P23: =+COUNTIFS(R2C8:R1001C8,R5C15,R2C9:R1001C9,R6C,R2C2:R1001C2,RC14) -> 17 | Q23: =+COUNTIFS(R2C8:R1001C8,R5C15,R2C9:R1001C9,R6C,R2C2:R1001C2,RC14) -> 11 | R23: =+COUNTIFS(R2C8:R1001C8,R5C15,R2C9:R1001C9,R6C,R2C2:R1001C2,RC14) -> 15 | S23: =+COUNTIFS(R2C8:R1001C8,R5C15,R2C9:R1001C9,R6C,R2C2:R1001C2,RC14) -> 17 | T23: =+COUNTIFS(R2C8:R1001C8,R5C15,R2C9:R1001C9,R6C,R2C2:R1001C2,RC14) -> 16 | U23: =+COUNTIFS(R2C8:R1001C8,R5C15,R2C9:R1001C9,R6C,R2C2:R1001C2,RC14) -> 13 | V23: =+COUNTIFS(R2C8:R1001C8,R5C15,R2C9:R1001C9,R6C,R2C2:R1001C2,RC14) -> 11 | W23: =+COUNTIFS(R2C8:R1001C8,R5C15,R2C9:R1001C9,R6C,R2C2:R1001C2,RC14) -> 17 | X23: =+COUNTIFS(R2C8:R1001C8,R5C15,R2C9:R1001C9,R6C,R2C2:R1001C2,RC14) -> 10 | Y23: =+COUNTIFS(R2C8:R1001C8,R5C15,R2C9:R1001C9,R6C,R2C2:R1001C2,RC14) -> 14 | Z23: =+COUNTIFS(R2C8:R1001C8,R5C15,R2C9:R1001C9,R6C,R2C2:R1001C2,RC14) -> 17 | AA23: =+COUNTIFS(R2C8:R1001C8,R5C27,R2C9:R1001C9,R6C,R2C2:R1001C2,RC14) -> 9 | AB23: =+COUNTIFS(R2C8:R1001C8,R5C27,R2C9:R1001C9,R6C,R2C2:R1001C2,RC14) -> 11 | AC23: =+COUNTIFS(R2C8:R1001C8,R5C27,R2C9:R1001C9,R6C,R2C2:R1001C2,RC14) -> 14 | AD23: =+COUNTIFS(R2C8:R1001C8,R5C27,R2C9:R1001C9,R6C,R2C2:R1001C2,RC14) -> 6 | AE23: =+COUNTIFS(R2C8:R1001C8,R5C27,R2C9:R1001C9,R6C,R2C2:R1001C2,RC14) -> 14 | AF23: =+COUNTIFS(R2C8:R1001C8,R5C27,R2C9:R1001C9,R6C,R2C2:R1001C2,RC14) -> 16 | AG23: =+COUNTIFS(R2C8:R1001C8,R5C27,R2C9:R1001C9,R6C,R2C2:R1001C2,RC14) -> 13 | AH23: =+COUNTIFS(R2C8:R1001C8,R5C27,R2C9:R1001C9,R6C,R2C2:R1001C2,RC14) -> 12 | AI23: =+COUNTIFS(R2C8:R1001C8,R5C27,R2C9:R1001C9,R6C,R2C2:R1001C2,RC14) -> 16 | AJ23: =+COUNTIFS(R2C8:R1001C8,R5C27,R2C9:R1001C9,R6C,R2C2:R1001C2,RC14) -> 20 | AK23: =+COUNTIFS(R2C8:R1001C8,R5C27,R2C9:R1001C9,R6C,R2C2:R1001C2,RC14) -> 13 | AL23: =+COUNTIFS(R2C8:R1001C8,R5C27,R2C9:R1001C9,R6C,R2C2:R1001C2,RC14) -> 12 | AN23: =+SUM(RC[-25]:RC[-2]) -> 323
A24: Dept2-20210 | B24: Bajo | C24: 40969 | D24: 40971 | E24: =+LEFT(RC[-4],5) -> Dept2 | F24: =+VLOOKUP(RC[-4],Enunciado!R3C6:R5C7,2,0)+RC[-3] -> 40999 | G24: =+IF(RC[-1]>=RC[-3],"ON TIME","OUT OF TIME") -> ON TIME | H24: =+YEAR(RC[-5]) -> 2012 | I24: =+MONTH(RC[-6]) -> 3 | J24: =+RC[-6]-RC[-7] -> 2 | K24: =+IF(RC[-4]="OUT of TIME",RC[-1]-VLOOKUP(RC[-9],Enunciado!R3C6:R5C7,2,0),"") ->  | N24: Medio | O24: =+COUNTIFS(R2C8:R1001C8,R5C15,R2C9:R1001C9,R6C,R2C2:R1001C2,RC14) -> 9 | P24: =+COUNTIFS(R2C8:R1001C8,R5C15,R2C9:R1001C9,R6C,R2C2:R1001C2,RC14) -> 17 | Q24: =+COUNTIFS(R2C8:R1001C8,R5C15,R2C9:R1001C9,R6C,R2C2:R1001C2,RC14) -> 13 | R24: =+COUNTIFS(R2C8:R1001C8,R5C15,R2C9:R1001C9,R6C,R2C2:R1001C2,RC14) -> 11 | S24: =+COUNTIFS(R2C8:R1001C8,R5C15,R2C9:R1001C9,R6C,R2C2:R1001C2,RC14) -> 20 | T24: =+COUNTIFS(R2C8:R1001C8,R5C15,R2C9:R1001C9,R6C,R2C2:R1001C2,RC14) -> 20 | U24: =+COUNTIFS(R2C8:R1001C8,R5C15,R2C9:R1001C9,R6C,R2C2:R1001C2,RC14) -> 23 | V24: =+COUNTIFS(R2C8:R1001C8,R5C15,R2C9:R1001C9,R6C,R2C2:R1001C2,RC14) -> 14 | W24: =+COUNTIFS(R2C8:R1001C8,R5C15,R2C9:R1001C9,R6C,R2C2:R1001C2,RC14) -> 17 | X24: =+COUNTIFS(R2C8:R1001C8,R5C15,R2C9:R1001C9,R6C,R2C2:R1001C2,RC14) -> 12 | Y24: =+COUNTIFS(R2C8:R1001C8,R5C15,R2C9:R1001C9,R6C,R2C2:R1001C2,RC14) -> 24 | Z24: =+COUNTIFS(R2C8:R1001C8,R5C15,R2C9:R1001C9,R6C,R2C2:R1001C2,RC14) -> 17 | AA24: =+COUNTIFS(R2C8:R1001C8,R5C27,R2C9:R1001C9,R6C,R2C2:R1001C2,RC14) -> 10 | AB24: =+COUNTIFS(R2C8:R1001C8,R5C27,R2C9:R1001C9,R6C,R2C2:R1001C2,RC14) -> 8 | AC24: =+COUNTIFS(R2C8:R1001C8,R5C27,R2C9:R1001C9,R6C,R2C2:R1001C2,RC14) -> 10 | AD24: =+COUNTIFS(R2C8:R1001C8,R5C27,R2C9:R1001C9,R6C,R2C2:R1001C2,RC14) -> 13 | AE24: =+COUNTIFS(R2C8:R1001C8,R5C27,R2C9:R1001C9,R6C,R2C2:R1001C2,RC14) -> 14 | AF24: =+COUNTIFS(R2C8:R1001C8,R5C27,R2C9:R1001C9,R6C,R2C2:R1001C2,RC14) -> 19 | AG24: =+COUNTIFS(R2C8:R1001C8,R5C27,R2C9:R1001C9,R6C,R2C2:R1001C2,RC14) -> 14 | AH24: =+COUNTIFS(R2C8:R1001C8,R5C27,R2C9:R1001C9,R6C,R2C2:R1001C2,RC14) -> 22 | AI24: =+COUNTIFS(R2C8:R1001C8,R5C27,R2C9:R1001C9,R6C,R2C2:R1001C2,RC14) -> 10 | AJ24: =+COUNTIFS(R2C8:R1001C8,R5C27,R2C9:R1001C9,R6C,R2C2:R1001C2,RC14) -> 17 | AK24: =+COUNTIFS(R2C8:R1001C8,R5C27,R2C9:R1001C9,R6C,R2C2:R1001C2,RC14) -> 10 | AL24: =+COUNTIFS(R2C8:R1001C8,R5C27,R2C9:R1001C9,R6C,R2C2:R1001C2,RC14) -> 14 | AN24: =+SUM(RC[-25]:RC[-2]) -> 358
A25: Dept2-7059 | B25: Medio | C25: 41126 | D25: 41129 | E25: =+LEFT(RC[-4],5) -> Dept2 | F25: =+VLOOKUP(RC[-4],Enunciado!R3C6:R5C7,2,0)+RC[-3] -> 41141 | G25: =+IF(RC[-1]>=RC[-3],"ON TIME","OUT OF TIME") -> ON TIME | H25: =+YEAR(RC[-5]) -> 2012 | I25: =+MONTH(RC[-6]) -> 8 | J25: =+RC[-6]-RC[-7] -> 3 | K25: =+IF(RC[-4]="OUT of TIME",RC[-1]-VLOOKUP(RC[-9],Enunciado!R3C6:R5C7,2,0),"") ->  | N25: Bajo | O25: =+COUNTIFS(R2C8:R1001C8,R5C15,R2C9:R1001C9,R6C,R2C2:R1001C2,RC14) -> 17 | P25: =+COUNTIFS(R2C8:R1001C8,R5C15,R2C9:R1001C9,R6C,R2C2:R1001C2,RC14) -> 15 | Q25: =+COUNTIFS(R2C8:R1001C8,R5C15,R2C9:R1001C9,R6C,R2C2:R1001C2,RC14) -> 14 | R25: =+COUNTIFS(R2C8:R1001C8,R5C15,R2C9:R1001C9,R6C,R2C2:R1001C2,RC14) -> 15 | S25: =+COUNTIFS(R2C8:R1001C8,R5C15,R2C9:R1001C9,R6C,R2C2:R1001C2,RC14) -> 11 | T25: =+COUNTIFS(R2C8:R1001C8,R5C15,R2C9:R1001C9,R6C,R2C2:R1001C2,RC14) -> 14 | U25: =+COUNTIFS(R2C8:R1001C8,R5C15,R2C9:R1001C9,R6C,R2C2:R1001C2,RC14) -> 10 | V25: =+COUNTIFS(R2C8:R1001C8,R5C15,R2C9:R1001C9,R6C,R2C2:R1001C2,RC14) -> 9 | W25: =+COUNTIFS(R2C8:R1001C8,R5C15,R2C9:R1001C9,R6C,R2C2:R1001C2,RC14) -> 7 | X25: =+COUNTIFS(R2C8:R1001C8,R5C15,R2C9:R1001C9,R6C,R2C2:R1001C2,RC14) -> 12 | Y25: =+COUNTIFS(R2C8:R1001C8,R5C15,R2C9:R1001C9,R6C,R2C2:R1001C2,RC14) -> 14 | Z25: =+COUNTIFS(R2C8:R1001C8,R5C15,R2C9:R1001C9,R6C,R2C2:R1001C2,RC14) -> 9 | AA25: =+COUNTIFS(R2C8:R1001C8,R5C27,R2C9:R1001C9,R6C,R2C2:R1001C2,RC14) -> 16 | AB25: =+COUNTIFS(R2C8:R1001C8,R5C27,R2C9:R1001C9,R6C,R2C2:R1001C2,RC14) -> 9 | AC25: =+COUNTIFS(R2C8:R1001C8,R5C27,R2C9:R1001C9,R6C,R2C2:R1001C2,RC14) -> 11 | AD25: =+COUNTIFS(R2C8:R1001C8,R5C27,R2C9:R1001C9,R6C,R2C2:R1001C2,RC14) -> 9 | AE25: =+COUNTIFS(R2C8:R1001C8,R5C27,R2C9:R1001C9,R6C,R2C2:R1001C2,RC14) -> 14 | AF25: =+COUNTIFS(R2C8:R1001C8,R5C27,R2C9:R1001C9,R6C,R2C2:R1001C2,RC14) -> 13 | AG25: =+COUNTIFS(R2C8:R1001C8,R5C27,R2C9:R1001C9,R6C,R2C2:R1001C2,RC14) -> 18 | AH25: =+COUNTIFS(R2C8:R1001C8,R5C27,R2C9:R1001C9,R6C,R2C2:R1001C2,RC14) -> 17 | AI25: =+COUNTIFS(R2C8:R1001C8,R5C27,R2C9:R1001C9,R6C,R2C2:R1001C2,RC14) -> 22 | AJ25: =+COUNTIFS(R2C8:R1001C8,R5C27,R2C9:R1001C9,R6C,R2C2:R1001C2,RC14) -> 14 | AK25: =+COUNTIFS(R2C8:R1001C8,R5C27,R2C9:R1001C9,R6C,R2C2:R1001C2,RC14) -> 16 | AL25: =+COUNTIFS(R2C8:R1001C8,R5C27,R2C9:R1001C9,R6C,R2C2:R1001C2,RC14) -> 13 | AN25: =+SUM(RC[-25]:RC[-2]) -> 319
A26: Dept2-25937 | B26: Medio | C26: 41266 | D26: 41266 | E26: =+LEFT(RC[-4],5) -> Dept2 | F26: =+VLOOKUP(RC[-4],Enunciado!R3C6:R5C7,2,0)+RC[-3] -> 41281 | G26: =+IF(RC[-1]>=RC[-3],"ON TIME","OUT OF TIME") -> ON TIME | H26: =+YEAR(RC[-5]) -> 2012 | I26: =+MONTH(RC[-6]) -> 12 | J26: =+RC[-6]-RC[-7] -> 0 | K26: =+IF(RC[-4]="OUT of TIME",RC[-1]-VLOOKUP(RC[-9],Enunciado!R3C6:R5C7,2,0),"") -> 
A27: Dept1-19032 | B27: Medio | C27: 41277 | D27: 41278 | E27: =+LEFT(RC[-4],5) -> Dept1 | F27: =+VLOOKUP(RC[-4],Enunciado!R3C6:R5C7,2,0)+RC[-3] -> 41292 | G27: =+IF(RC[-1]>=RC[-3],"ON TIME","OUT OF TIME") -> ON TIME | H27: =+YEAR(RC[-5]) -> 2013 | I27: =+MONTH(RC[-6]) -> 1 | J27: =+RC[-6]-RC[-7] -> 1 | K27: =+IF(RC[-4]="OUT of TIME",RC[-1]-VLOOKUP(RC[-9],Enunciado!R3C6:R5C7,2,0),"") ->  | N27: Respuesta ON TIME
A28: Dept3-4478 | B28: Medio | C28: 41102 | D28: 41106 | E28: =+LEFT(RC[-4],5) -> Dept3 | F28: =+VLOOKUP(RC[-4],Enunciado!R3C6:R5C7,2,0)+RC[-3] -> 41117 | G28: =+IF(RC[-1]>=RC[-3],"ON TIME","OUT OF TIME") -> ON TIME | H28: =+YEAR(RC[-5]) -> 2012 | I28: =+MONTH(RC[-6]) -> 7 | J28: =+RC[-6]-RC[-7] -> 4 | K28: =+IF(RC[-4]="OUT of TIME",RC[-1]-VLOOKUP(RC[-9],Enunciado!R3C6:R5C7,2,0),"") ->  | N28: ON TIME | O28: =+COUNTIFS(R2C8:R1001C8,R[-23]C15,R2C9:R1001C9,R6C,R2C7:R1001C7,"ON TIME") -> 24 | P28: =+COUNTIFS(R2C8:R1001C8,R[-23]C15,R2C9:R1001C9,R6C,R2C7:R1001C7,"ON TIME") -> 34 | Q28: =+COUNTIFS(R2C8:R1001C8,R[-23]C15,R2C9:R1001C9,R6C,R2C7:R1001C7,"ON TIME") -> 29 | R28: =+COUNTIFS(R2C8:R1001C8,R[-23]C15,R2C9:R1001C9,R6C,R2C7:R1001C7,"ON TIME") -> 28 | S28: =+COUNTIFS(R2C8:R1001C8,R[-23]C15,R2C9:R1001C9,R6C,R2C7:R1001C7,"ON TIME") -> 35 | T28: =+COUNTIFS(R2C8:R1001C8,R[-23]C15,R2C9:R1001C9,R6C,R2C7:R1001C7,"ON TIME") -> 28 | U28: =+COUNTIFS(R2C8:R1001C8,R[-23]C15,R2C9:R1001C9,R6C,R2C7:R1001C7,"ON TIME") -> 32 | V28: =+COUNTIFS(R2C8:R1001C8,R[-23]C15,R2C9:R1001C9,R6C,R2C7:R1001C7,"ON TIME") -> 25 | W28: =+COUNTIFS(R2C8:R1001C8,R[-23]C15,R2C9:R1001C9,R6C,R2C7:R1001C7,"ON TIME") -> 27 | X28: =+COUNTIFS(R2C8:R1001C8,R[-23]C15,R2C9:R1001C9,R6C,R2C7:R1001C7,"ON TIME") -> 21 | Y28: =+COUNTIFS(R2C8:R1001C8,R[-23]C15,R2C9:R1001C9,R6C,R2C7:R1001C7,"ON TIME") -> 39 | Z28: =+COUNTIFS(R2C8:R1001C8,R[-23]C15,R2C9:R1001C9,R6C,R2C7:R1001C7,"ON TIME") -> 30 | AA28: =+COUNTIFS(R2C8:R1001C8,R[-23]C27,R2C9:R1001C9,R6C[-12],R2C7:R1001C7,"ON TIME") -> 24 | AB28: =+COUNTIFS(R2C8:R1001C8,R[-23]C27,R2C9:R1001C9,R6C[-12],R2C7:R1001C7,"ON TIME") -> 19 | AC28: =+COUNTIFS(R2C8:R1001C8,R[-23]C27,R2C9:R1001C9,R6C[-12],R2C7:R1001C7,"ON TIME") -> 23 | AD28: =+COUNTIFS(R2C8:R1001C8,R[-23]C27,R2C9:R1001C9,R6C[-12],R2C7:R1001C7,"ON TIME") -> 19 | AE28: =+COUNTIFS(R2C8:R1001C8,R[-23]C27,R2C9:R1001C9,R6C[-12],R2C7:R1001C7,"ON TIME") -> 29 | AF28: =+COUNTIFS(R2C8:R1001C8,R[-23]C27,R2C9:R1001C9,R6C[-12],R2C7:R1001C7,"ON TIME") -> 37 | AG28: =+COUNTIFS(R2C8:R1001C8,R[-23]C27,R2C9:R1001C9,R6C[-12],R2C7:R1001C7,"ON TIME") -> 35 | AH28: =+COUNTIFS(R2C8:R1001C8,R[-23]C27,R2C9:R1001C9,R6C[-12],R2C7:R1001C7,"ON TIME") -> 32 | AI28: =+COUNTIFS(R2C8:R1001C8,R[-23]C27,R2C9:R1001C9,R6C[-12],R2C7:R1001C7,"ON TIME") -> 29 | AJ28: =+COUNTIFS(R2C8:R1001C8,R[-23]C27,R2C9:R1001C9,R6C[-12],R2C7:R1001C7,"ON TIME") -> 39 | AK28: =+COUNTIFS(R2C8:R1001C8,R[-23]C27,R2C9:R1001C9,R6C[-12],R2C7:R1001C7,"ON TIME") -> 29 | AL28: =+COUNTIFS(R2C8:R1001C8,R[-23]C27,R2C9:R1001C9,R6C[-12],R2C7:R1001C7,"ON TIME") -> 29 | AN28: =+SUM(RC[-25]:RC[-2]) -> 696
A29: Dept3-16431 | B29: Alto | C29: 41411 | D29: 41431 | E29: =+LEFT(RC[-4],5) -> Dept3 | F29: =+VLOOKUP(RC[-4],Enunciado!R3C6:R5C7,2,0)+RC[-3] -> 41416 | G29: =+IF(RC[-1]>=RC[-3],"ON TIME","OUT OF TIME") -> OUT OF TIME | H29: =+YEAR(RC[-5]) -> 2013 | I29: =+MONTH(RC[-6]) -> 5 | J29: =+RC[-6]-RC[-7] -> 20 | K29: =+IF(RC[-4]="OUT of TIME",RC[-1]-VLOOKUP(RC[-9],Enunciado!R3C6:R5C7,2,0),"") -> 15 | N29: OUT OF TIME | O29: =+R[-19]C-R[-1]C -> 11 | P29: =+R[-19]C-R[-1]C -> 15 | Q29: =+R[-19]C-R[-1]C -> 9 | R29: =+R[-19]C-R[-1]C -> 13 | S29: =+R[-19]C-R[-1]C -> 13 | T29: =+R[-19]C-R[-1]C -> 22 | U29: =+R[-19]C-R[-1]C -> 14 | V29: =+R[-19]C-R[-1]C -> 9 | W29: =+R[-19]C-R[-1]C -> 14 | X29: =+R[-19]C-R[-1]C -> 13 | Y29: =+R[-19]C-R[-1]C -> 13 | Z29: =+R[-19]C-R[-1]C -> 13 | AA29: =+R[-19]C-R[-1]C -> 11 | AB29: =+R[-19]C-R[-1]C -> 9 | AC29: =+R[-19]C-R[-1]C -> 12 | AD29: =+R[-19]C-R[-1]C -> 9 | AE29: =+R[-19]C-R[-1]C -> 13 | AF29: =+R[-19]C-R[-1]C -> 11 | AG29: =+R[-19]C-R[-1]C -> 10 | AH29: =+R[-19]C-R[-1]C -> 19 | AI29: =+R[-19]C-R[-1]C -> 19 | AJ29: =+R[-19]C-R[-1]C -> 12 | AK29: =+R[-19]C-R[-1]C -> 10 | AL29: =+R[-19]C-R[-1]C -> 10 | AN29: =+SUM(RC[-25]:RC[-2]) -> 304
A30: Dept5-21657 | B30: Alto | C30: 41219 | D30: 41219 | E30: =+LEFT(RC[-4],5) -> Dept5 | F30: =+VLOOKUP(RC[-4],Enunciado!R3C6:R5C7,2,0)+RC[-3] -> 41224 | G30: =+IF(RC[-1]>=RC[-3],"ON TIME","OUT OF TIME") -> ON TIME | H30: =+YEAR(RC[-5]) -> 2012 | I30: =+MONTH(RC[-6]) -> 11 | J30: =+RC[-6]-RC[-7] -> 0 | K30: =+IF(RC[-4]="OUT of TIME",RC[-1]-VLOOKUP(RC[-9],Enunciado!R3C6:R5C7,2,0),"") ->  | N30: **OT-Dept1 | O30: =+COUNTIFS(R2C8:R1001C8,R5C15,R2C9:R1001C9,R6C,R2C7:R1001C7,"ON TIME",R2C5:R1001C5,R[-15]C14) -> 6 | P30: =+COUNTIFS(R2C8:R1001C8,R5C15,R2C9:R1001C9,R6C,R2C7:R1001C7,"ON TIME",R2C5:R1001C5,R[-15]C14) -> 8 | Q30: =+COUNTIFS(R2C8:R1001C8,R5C15,R2C9:R1001C9,R6C,R2C7:R1001C7,"ON TIME",R2C5:R1001C5,R[-15]C14) -> 3 | R30: =+COUNTIFS(R2C8:R1001C8,R5C15,R2C9:R1001C9,R6C,R2C7:R1001C7,"ON TIME",R2C5:R1001C5,R[-15]C14) -> 5 | S30: =+COUNTIFS(R2C8:R1001C8,R5C15,R2C9:R1001C9,R6C,R2C7:R1001C7,"ON TIME",R2C5:R1001C5,R[-15]C14) -> 2 | T30: =+COUNTIFS(R2C8:R1001C8,R5C15,R2C9:R1001C9,R6C,R2C7:R1001C7,"ON TIME",R2C5:R1001C5,R[-15]C14) -> 6 | U30: =+COUNTIFS(R2C8:R1001C8,R5C15,R2C9:R1001C9,R6C,R2C7:R1001C7,"ON TIME",R2C5:R1001C5,R[-15]C14) -> 6 | V30: =+COUNTIFS(R2C8:R1001C8,R5C15,R2C9:R1001C9,R6C,R2C7:R1001C7,"ON TIME",R2C5:R1001C5,R[-15]C14) -> 3 | W30: =+COUNTIFS(R2C8:R1001C8,R5C15,R2C9:R1001C9,R6C,R2C7:R1001C7,"ON TIME",R2C5:R1001C5,R[-15]C14) -> 4 | X30: =+COUNTIFS(R2C8:R1001C8,R5C15,R2C9:R1001C9,R6C,R2C7:R1001C7,"ON TIME",R2C5:R1001C5,R[-15]C14) -> 5 | Y30: =+COUNTIFS(R2C8:R1001C8,R5C15,R2C9:R1001C9,R6C,R2C7:R1001C7,"ON TIME",R2C5:R1001C5,R[-15]C14) -> 7 | Z30: =+COUNTIFS(R2C8:R1001C8,R5C15,R2C9:R1001C9,R6C,R2C7:R1001C7,"ON TIME",R2C5:R1001C5,R[-15]C14) -> 6 | AA30: =+COUNTIFS(R2C8:R1001C8,R5C27,R2C9:R1001C9,R6C,R2C7:R1001C7,"ON TIME",R2C5:R1001C5,R[-15]C14) -> 3 | AB30: =+COUNTIFS(R2C8:R1001C8,R5C27,R2C9:R1001C9,R6C,R2C7:R1001C7,"ON TIME",R2C5:R1001C5,R[-15]C14) -> 5 | AC30: =+COUNTIFS(R2C8:R1001C8,R5C27,R2C9:R1001C9,R6C,R2C7:R1001C7,"ON TIME",R2C5:R1001C5,R[-15]C14) -> 5 | AD30: =+COUNTIFS(R2C8:R1001C8,R5C27,R2C9:R1001C9,R6C,R2C7:R1001C7,"ON TIME",R2C5:R1001C5,R[-15]C14) -> 1 | AE30: =+COUNTIFS(R2C8:R1001C8,R5C27,R2C9:R1001C9,R6C,R2C7:R1001C7,"ON TIME",R2C5:R1001C5,R[-15]C14) -> 4 | AF30: =+COUNTIFS(R2C8:R1001C8,R5C27,R2C9:R1001C9,R6C,R2C7:R1001C7,"ON TIME",R2C5:R1001C5,R[-15]C14) -> 7 | AG30: =+COUNTIFS(R2C8:R1001C8,R5C27,R2C9:R1001C9,R6C,R2C7:R1001C7,"ON TIME",R2C5:R1001C5,R[-15]C14) -> 6 | AH30: =+COUNTIFS(R2C8:R1001C8,R5C27,R2C9:R1001C9,R6C,R2C7:R1001C7,"ON TIME",R2C5:R1001C5,R[-15]C14) -> 5 | AI30: =+COUNTIFS(R2C8:R1001C8,R5C27,R2C9:R1001C9,R6C,R2C7:R1001C7,"ON TIME",R2C5:R1001C5,R[-15]C14) -> 4 | AJ30: =+COUNTIFS(R2C8:R1001C8,R5C27,R2C9:R1001C9,R6C,R2C7:R1001C7,"ON TIME",R2C5:R1001C5,R[-15]C14) -> 6 | AK30: =+COUNTIFS(R2C8:R1001C8,R5C27,R2C9:R1001C9,R6C,R2C7:R1001C7,"ON TIME",R2C5:R1001C5,R[-15]C14) -> 6 | AL30: =+COUNTIFS(R2C8:R1001C8,R5C27,R2C9:R1001C9,R6C,R2C7:R1001C7,"ON TIME",R2C5:R1001C5,R[-15]C14) -> 4 | AN30: =+SUM(RC[-25]:RC[-2]) -> 117
A31: Dept2-12688 | B31: Medio | C31: 41115 | D31: 41118 | E31: =+LEFT(RC[-4],5) -> Dept2 | F31: =+VLOOKUP(RC[-4],Enunciado!R3C6:R5C7,2,0)+RC[-3] -> 41130 | G31: =+IF(RC[-1]>=RC[-3],"ON TIME","OUT OF TIME") -> ON TIME | H31: =+YEAR(RC[-5]) -> 2012 | I31: =+MONTH(RC[-6]) -> 7 | J31: =+RC[-6]-RC[-7] -> 3 | K31: =+IF(RC[-4]="OUT of TIME",RC[-1]-VLOOKUP(RC[-9],Enunciado!R3C6:R5C7,2,0),"") ->  | N31: OT-Dept2 | O31: =+COUNTIFS(R2C8:R1001C8,R5C15,R2C9:R1001C9,R6C,R2C7:R1001C7,"ON TIME",R2C5:R1001C5,R[-15]C14) -> 4 | P31: =+COUNTIFS(R2C8:R1001C8,R5C15,R2C9:R1001C9,R6C,R2C7:R1001C7,"ON TIME",R2C5:R1001C5,R[-15]C14) -> 10 | Q31: =+COUNTIFS(R2C8:R1001C8,R5C15,R2C9:R1001C9,R6C,R2C7:R1001C7,"ON TIME",R2C5:R1001C5,R[-15]C14) -> 8 | R31: =+COUNTIFS(R2C8:R1001C8,R5C15,R2C9:R1001C9,R6C,R2C7:R1001C7,"ON TIME",R2C5:R1001C5,R[-15]C14) -> 3 | S31: =+COUNTIFS(R2C8:R1001C8,R5C15,R2C9:R1001C9,R6C,R2C7:R1001C7,"ON TIME",R2C5:R1001C5,R[-15]C14) -> 8 | T31: =+COUNTIFS(R2C8:R1001C8,R5C15,R2C9:R1001C9,R6C,R2C7:R1001C7,"ON TIME",R2C5:R1001C5,R[-15]C14) -> 5 | U31: =+COUNTIFS(R2C8:R1001C8,R5C15,R2C9:R1001C9,R6C,R2C7:R1001C7,"ON TIME",R2C5:R1001C5,R[-15]C14) -> 10 | V31: =+COUNTIFS(R2C8:R1001C8,R5C15,R2C9:R1001C9,R6C,R2C7:R1001C7,"ON TIME",R2C5:R1001C5,R[-15]C14) -> 6 | W31: =+COUNTIFS(R2C8:R1001C8,R5C15,R2C9:R1001C9,R6C,R2C7:R1001C7,"ON TIME",R2C5:R1001C5,R[-15]C14) -> 5 | X31: =+COUNTIFS(R2C8:R1001C8,R5C15,R2C9:R1001C9,R6C,R2C7:R1001C7,"ON TIME",R2C5:R1001C5,R[-15]C14) -> 6 | Y31: =+COUNTIFS(R2C8:R1001C8,R5C15,R2C9:R1001C9,R6C,R2C7:R1001C7,"ON TIME",R2C5:R1001C5,R[-15]C14) -> 8 | Z31: =+COUNTIFS(R2C8:R1001C8,R5C15,R2C9:R1001C9,R6C,R2C7:R1001C7,"ON TIME",R2C5:R1001C5,R[-15]C14) -> 5 | AA31: =+COUNTIFS(R2C8:R1001C8,R5C27,R2C9:R1001C9,R6C,R2C7:R1001C7,"ON TIME",R2C5:R1001C5,R[-15]C14) -> 7 | AB31: =+COUNTIFS(R2C8:R1001C8,R5C27,R2C9:R1001C9,R6C,R2C7:R1001C7,"ON TIME",R2C5:R1001C5,R[-15]C14) -> 3 | AC31: =+COUNTIFS(R2C8:R1001C8,R5C27,R2C9:R1001C9,R6C,R2C7:R1001C7,"ON TIME",R2C5:R1001C5,R[-15]C14) -> 4 | AD31: =+COUNTIFS(R2C8:R1001C8,R5C27,R2C9:R1001C9,R6C,R2C7:R1001C7,"ON TIME",R2C5:R1001C5,R[-15]C14) -> 4 | AE31: =+COUNTIFS(R2C8:R1001C8,R5C27,R2C9:R1001C9,R6C,R2C7:R1001C7,"ON TIME",R2C5:R1001C5,R[-15]C14) -> 2 | AF31: =+COUNTIFS(R2C8:R1001C8,R5C27,R2C9:R1001C9,R6C,R2C7:R1001C7,"ON TIME",R2C5:R1001C5,R[-15]C14) -> 7 | AG31: =+COUNTIFS(R2C8:R1001C8,R5C27,R2C9:R1001C9,R6C,R2C7:R1001C7,"ON TIME",R2C5:R1001C5,R[-15]C14) -> 3 | AH31: =+COUNTIFS(R2C8:R1001C8,R5C27,R2C9:R1001C9,R6C,R2C7:R1001C7,"ON TIME",R2C5:R1001C5,R[-15]C14) -> 2 | AI31: =+COUNTIFS(R2C8:R1001C8,R5C27,R2C9:R1001C9,R6C,R2C7:R1001C7,"ON TIME",R2C5:R1001C5,R[-15]C14) -> 5 | AJ31: =+COUNTIFS(R2C8:R1001C8,R5C27,R2C9:R1001C9,R6C,R2C7:R1001C7,"ON TIME",R2C5:R1001C5,R[-15]C14) -> 8 | AK31: =+COUNTIFS(R2C8:R1001C8,R5C27,R2C9:R1001C9,R6C,R2C7:R1001C7,"ON TIME",R2C5:R1001C5,R[-15]C14) -> 4 | AL31: =+COUNTIFS(R2C8:R1001C8,R5C27,R2C9:R1001C9,R6C,R2C7:R1001C7,"ON TIME",R2C5:R1001C5,R[-15]C14) -> 8 | AN31: =+SUM(RC[-25]:RC[-2]) -> 135
A32: Dept2-18576 | B32: Medio | C32: 41234 | D32: 41242 | E32: =+LEFT(RC[-4],5) -> Dept2 | F32: =+VLOOKUP(RC[-4],Enunciado!R3C6:R5C7,2,0)+RC[-3] -> 41249 | G32: =+IF(RC[-1]>=RC[-3],"ON TIME","OUT OF TIME") -> ON TIME | H32: =+YEAR(RC[-5]) -> 2012 | I32: =+MONTH(RC[-6]) -> 11 | J32: =+RC[-6]-RC[-7] -> 8 | K32: =+IF(RC[-4]="OUT of TIME",RC[-1]-VLOOKUP(RC[-9],Enunciado!R3C6:R5C7,2,0),"") ->  | N32: OT-Dept3 | O32: =+COUNTIFS(R2C8:R1001C8,R5C15,R2C9:R1001C9,R6C,R2C7:R1001C7,"ON TIME",R2C5:R1001C5,R[-15]C14) -> 0 | P32: =+COUNTIFS(R2C8:R1001C8,R5C15,R2C9:R1001C9,R6C,R2C7:R1001C7,"ON TIME",R2C5:R1001C5,R[-15]C14) -> 5 | Q32: =+COUNTIFS(R2C8:R1001C8,R5C15,R2C9:R1001C9,R6C,R2C7:R1001C7,"ON TIME",R2C5:R1001C5,R[-15]C14) -> 3 | R32: =+COUNTIFS(R2C8:R1001C8,R5C15,R2C9:R1001C9,R6C,R2C7:R1001C7,"ON TIME",R2C5:R1001C5,R[-15]C14) -> 4 | S32: =+COUNTIFS(R2C8:R1001C8,R5C15,R2C9:R1001C9,R6C,R2C7:R1001C7,"ON TIME",R2C5:R1001C5,R[-15]C14) -> 4 | T32: =+COUNTIFS(R2C8:R1001C8,R5C15,R2C9:R1001C9,R6C,R2C7:R1001C7,"ON TIME",R2C5:R1001C5,R[-15]C14) -> 4 | U32: =+COUNTIFS(R2C8:R1001C8,R5C15,R2C9:R1001C9,R6C,R2C7:R1001C7,"ON TIME",R2C5:R1001C5,R[-15]C14) -> 8 | V32: =+COUNTIFS(R2C8:R1001C8,R5C15,R2C9:R1001C9,R6C,R2C7:R1001C7,"ON TIME",R2C5:R1001C5,R[-15]C14) -> 4 | W32: =+COUNTIFS(R2C8:R1001C8,R5C15,R2C9:R1001C9,R6C,R2C7:R1001C7,"ON TIME",R2C5:R1001C5,R[-15]C14) -> 6 | X32: =+COUNTIFS(R2C8:R1001C8,R5C15,R2C9:R1001C9,R6C,R2C7:R1001C7,"ON TIME",R2C5:R1001C5,R[-15]C14) -> 2 | Y32: =+COUNTIFS(R2C8:R1001C8,R5C15,R2C9:R1001C9,R6C,R2C7:R1001C7,"ON TIME",R2C5:R1001C5,R[-15]C14) -> 8 | Z32: =+COUNTIFS(R2C8:R1001C8,R5C15,R2C9:R1001C9,R6C,R2C7:R1001C7,"ON TIME",R2C5:R1001C5,R[-15]C14) -> 4 | AA32: =+COUNTIFS(R2C8:R1001C8,R5C27,R2C9:R1001C9,R6C,R2C7:R1001C7,"ON TIME",R2C5:R1001C5,R[-15]C14) -> 3 | AB32: =+COUNTIFS(R2C8:R1001C8,R5C27,R2C9:R1001C9,R6C,R2C7:R1001C7,"ON TIME",R2C5:R1001C5,R[-15]C14) -> 2 | AC32: =+COUNTIFS(R2C8:R1001C8,R5C27,R2C9:R1001C9,R6C,R2C7:R1001C7,"ON TIME",R2C5:R1001C5,R[-15]C14) -> 4 | AD32: =+COUNTIFS(R2C8:R1001C8,R5C27,R2C9:R1001C9,R6C,R2C7:R1001C7,"ON TIME",R2C5:R1001C5,R[-15]C14) -> 2 | AE32: =+COUNTIFS(R2C8:R1001C8,R5C27,R2C9:R1001C9,R6C,R2C7:R1001C7,"ON TIME",R2C5:R1001C5,R[-15]C14) -> 6 | AF32: =+COUNTIFS(R2C8:R1001C8,R5C27,R2C9:R1001C9,R6C,R2C7:R1001C7,"ON TIME",R2C5:R1001C5,R[-15]C14) -> 10 | AG32: =+COUNTIFS(R2C8:R1001C8,R5C27,R2C9:R1001C9,R6C,R2C7:R1001C7,"ON TIME",R2C5:R1001C5,R[-15]C14) -> 8 | AH32: =+COUNTIFS(R2C8:R1001C8,R5C27,R2C9:R1001C9,R6C,R2C7:R1001C7,"ON TIME",R2C5:R1001C5,R[-15]C14) -> 8 | AI32: =+COUNTIFS(R2C8:R1001C8,R5C27,R2C9:R1001C9,R6C,R2C7:R1001C7,"ON TIME",R2C5:R1001C5,R[-15]C14) -> 4 | AJ32: =+COUNTIFS(R2C8:R1001C8,R5C27,R2C9:R1001C9,R6C,R2C7:R1001C7,"ON TIME",R2C5:R1001C5,R[-15]C14) -> 4 | AK32: =+COUNTIFS(R2C8:R1001C8,R5C27,R2C9:R1001C9,R6C,R2C7:R1001C7,"ON TIME",R2C5:R1001C5,R[-15]C14) -> 3 | AL32: =+COUNTIFS(R2C8:R1001C8,R5C27,R2C9:R1001C9,R6C,R2C7:R1001C7,"ON TIME",R2C5:R1001C5,R[-15]C14) -> 4 | AN32: =+SUM(RC[-25]:RC[-2]) -> 110
A33: Dept2-4510 | B33: Medio | C33: 41098 | D33: 41114 | E33: =+LEFT(RC[-4],5) -> Dept2 | F33: =+VLOOKUP(RC[-4],Enunciado!R3C6:R5C7,2,0)+RC[-3] -> 41113 | G33: =+IF(RC[-1]>=RC[-3],"ON TIME","OUT OF TIME") -> OUT OF TIME | H33: =+YEAR(RC[-5]) -> 2012 | I33: =+MONTH(RC[-6]) -> 7 | J33: =+RC[-6]-RC[-7] -> 16 | K33: =+IF(RC[-4]="OUT of TIME",RC[-1]-VLOOKUP(RC[-9],Enunciado!R3C6:R5C7,2,0),"") -> 1 | N33: OT-Dept4 | O33: =+COUNTIFS(R2C8:R1001C8,R5C15,R2C9:R1001C9,R6C,R2C7:R1001C7,"ON TIME",R2C5:R1001C5,R[-15]C14) -> 5 | P33: =+COUNTIFS(R2C8:R1001C8,R5C15,R2C9:R1001C9,R6C,R2C7:R1001C7,"ON TIME",R2C5:R1001C5,R[-15]C14) -> 5 | Q33: =+COUNTIFS(R2C8:R1001C8,R5C15,R2C9:R1001C9,R6C,R2C7:R1001C7,"ON TIME",R2C5:R1001C5,R[-15]C14) -> 8 | R33: =+COUNTIFS(R2C8:R1001C8,R5C15,R2C9:R1001C9,R6C,R2C7:R1001C7,"ON TIME",R2C5:R1001C5,R[-15]C14) -> 6 | S33: =+COUNTIFS(R2C8:R1001C8,R5C15,R2C9:R1001C9,R6C,R2C7:R1001C7,"ON TIME",R2C5:R1001C5,R[-15]C14) -> 6 | T33: =+COUNTIFS(R2C8:R1001C8,R5C15,R2C9:R1001C9,R6C,R2C7:R1001C7,"ON TIME",R2C5:R1001C5,R[-15]C14) -> 5 | U33: =+COUNTIFS(R2C8:R1001C8,R5C15,R2C9:R1001C9,R6C,R2C7:R1001C7,"ON TIME",R2C5:R1001C5,R[-15]C14) -> 1 | V33: =+COUNTIFS(R2C8:R1001C8,R5C15,R2C9:R1001C9,R6C,R2C7:R1001C7,"ON TIME",R2C5:R1001C5,R[-15]C14) -> 5 | W33: =+COUNTIFS(R2C8:R1001C8,R5C15,R2C9:R1001C9,R6C,R2C7:R1001C7,"ON TIME",R2C5:R1001C5,R[-15]C14) -> 2 | X33: =+COUNTIFS(R2C8:R1001C8,R5C15,R2C9:R1001C9,R6C,R2C7:R1001C7,"ON TIME",R2C5:R1001C5,R[-15]C14) -> 3 | Y33: =+COUNTIFS(R2C8:R1001C8,R5C15,R2C9:R1001C9,R6C,R2C7:R1001C7,"ON TIME",R2C5:R1001C5,R[-15]C14) -> 7 | Z33: =+COUNTIFS(R2C8:R1001C8,R5C15,R2C9:R1001C9,R6C,R2C7:R1001C7,"ON TIME",R2C5:R1001C5,R[-15]C14) -> 7 | AA33: =+COUNTIFS(R2C8:R1001C8,R5C27,R2C9:R1001C9,R6C,R2C7:R1001C7,"ON TIME",R2C5:R1001C5,R[-15]C14) -> 4 | AB33: =+COUNTIFS(R2C8:R1001C8,R5C27,R2C9:R1001C9,R6C,R2C7:R1001C7,"ON TIME",R2C5:R1001C5,R[-15]C14) -> 3 | AC33: =+COUNTIFS(R2C8:R1001C8,R5C27,R2C9:R1001C9,R6C,R2C7:R1001C7,"ON TIME",R2C5:R1001C5,R[-15]C14) -> 4 | AD33: =+COUNTIFS(R2C8:R1001C8,R5C27,R2C9:R1001C9,R6C,R2C7:R1001C7,"ON TIME",R2C5:R1001C5,R[-15]C14) -> 3 | AE33: =+COUNTIFS(R2C8:R1001C8,R5C27,R2C9:R1001C9,R6C,R2C7:R1001C7,"ON TIME",R2C5:R1001C5,R[-15]C14) -> 6 | AF33: =+COUNTIFS(R2C8:R1001C8,R5C27,R2C9:R1001C9,R6C,R2C7:R1001C7,"ON TIME",R2C5:R1001C5,R[-15]C14) -> 5 | AG33: =+COUNTIFS(R2C8:R1001C8,R5C27,R2C9:R1001C9,R6C,R2C7:R1001C7,"ON TIME",R2C5:R1001C5,R[-15]C14) -> 7 | AH33: =+COUNTIFS(R2C8:R1001C8,R5C27,R2C9:R1001C9,R6C,R2C7:R1001C7,"ON TIME",R2C5:R1001C5,R[-15]C14) -> 5 | AI33: =+COUNTIFS(R2C8:R1001C8,R5C27,R2C9:R1001C9,R6C,R2C7:R1001C7,"ON TIME",R2C5:R1001C5,R[-15]C14) -> 6 | AJ33: =+COUNTIFS(R2C8:R1001C8,R5C27,R2C9:R1001C9,R6C,R2C7:R1001C7,"ON TIME",R2C5:R1001C5,R[-15]C14) -> 8 | AK33: =+COUNTIFS(R2C8:R1001C8,R5C27,R2C9:R1001C9,R6C,R2C7:R1001C7,"ON TIME",R2C5:R1001C5,R[-15]C14) -> 2 | AL33: =+COUNTIFS(R2C8:R1001C8,R5C27,R2C9:R1001C9,R6C,R2C7:R1001C7,"ON TIME",R2C5:R1001C5,R[-15]C14) -> 5 | AN33: =+SUM(RC[-25]:RC[-2]) -> 118
A34: Dept3-5720 | B34: Alto | C34: 41509 | D34: 41513 | E34: =+LEFT(RC[-4],5) -> Dept3 | F34: =+VLOOKUP(RC[-4],Enunciado!R3C6:R5C7,2,0)+RC[-3] -> 41514 | G34: =+IF(RC[-1]>=RC[-3],"ON TIME","OUT OF TIME") -> ON TIME | H34: =+YEAR(RC[-5]) -> 2013 | I34: =+MONTH(RC[-6]) -> 8 | J34: =+RC[-6]-RC[-7] -> 4 | K34: =+IF(RC[-4]="OUT of TIME",RC[-1]-VLOOKUP(RC[-9],Enunciado!R3C6:R5C7,2,0),"") ->  | N34: OT-Dept5 | O34: =+COUNTIFS(R2C8:R1001C8,R5C15,R2C9:R1001C9,R6C,R2C7:R1001C7,"ON TIME",R2C5:R1001C5,R[-15]C14) -> 7 | P34: =+COUNTIFS(R2C8:R1001C8,R5C15,R2C9:R1001C9,R6C,R2C7:R1001C7,"ON TIME",R2C5:R1001C5,R[-15]C14) -> 1 | Q34: =+COUNTIFS(R2C8:R1001C8,R5C15,R2C9:R1001C9,R6C,R2C7:R1001C7,"ON TIME",R2C5:R1001C5,R[-15]C14) -> 2 | R34: =+COUNTIFS(R2C8:R1001C8,R5C15,R2C9:R1001C9,R6C,R2C7:R1001C7,"ON TIME",R2C5:R1001C5,R[-15]C14) -> 4 | S34: =+COUNTIFS(R2C8:R1001C8,R5C15,R2C9:R1001C9,R6C,R2C7:R1001C7,"ON TIME",R2C5:R1001C5,R[-15]C14) -> 7 | T34: =+COUNTIFS(R2C8:R1001C8,R5C15,R2C9:R1001C9,R6C,R2C7:R1001C7,"ON TIME",R2C5:R1001C5,R[-15]C14) -> 3 | U34: =+COUNTIFS(R2C8:R1001C8,R5C15,R2C9:R1001C9,R6C,R2C7:R1001C7,"ON TIME",R2C5:R1001C5,R[-15]C14) -> 4 | V34: =+COUNTIFS(R2C8:R1001C8,R5C15,R2C9:R1001C9,R6C,R2C7:R1001C7,"ON TIME",R2C5:R1001C5,R[-15]C14) -> 3 | W34: =+COUNTIFS(R2C8:R1001C8,R5C15,R2C9:R1001C9,R6C,R2C7:R1001C7,"ON TIME",R2C5:R1001C5,R[-15]C14) -> 4 | X34: =+COUNTIFS(R2C8:R1001C8,R5C15,R2C9:R1001C9,R6C,R2C7:R1001C7,"ON TIME",R2C5:R1001C5,R[-15]C14) -> 0 | Y34: =+COUNTIFS(R2C8:R1001C8,R5C15,R2C9:R1001C9,R6C,R2C7:R1001C7,"ON TIME",R2C5:R1001C5,R[-15]C14) -> 5 | Z34: =+COUNTIFS(R2C8:R1001C8,R5C15,R2C9:R1001C9,R6C,R2C7:R1001C7,"ON TIME",R2C5:R1001C5,R[-15]C14) -> 4 | AA34: =+COUNTIFS(R2C8:R1001C8,R5C27,R2C9:R1001C9,R6C,R2C7:R1001C7,"ON TIME",R2C5:R1001C5,R[-15]C14) -> 5 | AB34: =+COUNTIFS(R2C8:R1001C8,R5C27,R2C9:R1001C9,R6C,R2C7:R1001C7,"ON TIME",R2C5:R1001C5,R[-15]C14) -> 3 | AC34: =+COUNTIFS(R2C8:R1001C8,R5C27,R2C9:R1001C9,R6C,R2C7:R1001C7,"ON TIME",R2C5:R1001C5,R[-15]C14) -> 0 | AD34: =+COUNTIFS(R2C8:R1001C8,R5C27,R2C9:R1001C9,R6C,R2C7:R1001C7,"ON TIME",R2C5:R1001C5,R[-15]C14) -> 4 | AE34: =+COUNTIFS(R2C8:R1001C8,R5C27,R2C9:R1001C9,R6C,R2C7:R1001C7,"ON TIME",R2C5:R1001C5,R[-15]C14) -> 8 | AF34: =+COUNTIFS(R2C8:R1001C8,R5C27,R2C9:R1001C9,R6C,R2C7:R1001C7,"ON TIME",R2C5:R1001C5,R[-15]C14) -> 5 | AG34: =+COUNTIFS(R2C8:R1001C8,R5C27,R2C9:R1001C9,R6C,R2C7:R1001C7,"ON TIME",R2C5:R1001C5,R[-15]C14) -> 7 | AH34: =+COUNTIFS(R2C8:R1001C8,R5C27,R2C9:R1001C9,R6C,R2C7:R1001C7,"ON TIME",R2C5:R1001C5,R[-15]C14) -> 6 | AI34: =+COUNTIFS(R2C8:R1001C8,R5C27,R2C9:R1001C9,R6C,R2C7:R1001C7,"ON TIME",R2C5:R1001C5,R[-15]C14) -> 7 | AJ34: =+COUNTIFS(R2C8:R1001C8,R5C27,R2C9:R1001C9,R6C,R2C7:R1001C7,"ON TIME",R2C5:R1001C5,R[-15]C14) -> 8 | AK34: =+COUNTIFS(R2C8:R1001C8,R5C27,R2C9:R1001C9,R6C,R2C7:R1001C7,"ON TIME",R2C5:R1001C5,R[-15]C14) -> 5 | AL34: =+COUNTIFS(R2C8:R1001C8,R5C27,R2C9:R1001C9,R6C,R2C7:R1001C7,"ON TIME",R2C5:R1001C5,R[-15]C14) -> 4 | AN34: =+SUM(RC[-25]:RC[-2]) -> 106
A35: Dept5-6079 | B35: Alto | C35: 41306 | D35: 41308 | E35: =+LEFT(RC[-4],5) -> Dept5 | F35: =+VLOOKUP(RC[-4],Enunciado!R3C6:R5C7,2,0)+RC[-3] -> 41311 | G35: =+IF(RC[-1]>=RC[-3],"ON TIME","OUT OF TIME") -> ON TIME | H35: =+YEAR(RC[-5]) -> 2013 | I35: =+MONTH(RC[-6]) -> 2 | J35: =+RC[-6]-RC[-7] -> 2 | K35: =+IF(RC[-4]="OUT of TIME",RC[-1]-VLOOKUP(RC[-9],Enunciado!R3C6:R5C7,2,0),"") ->  | N35: OT-Dept6 | O35: =+COUNTIFS(R2C8:R1001C8,R5C15,R2C9:R1001C9,R6C,R2C7:R1001C7,"ON TIME",R2C5:R1001C5,R[-15]C14) -> 2 | P35: =+COUNTIFS(R2C8:R1001C8,R5C15,R2C9:R1001C9,R6C,R2C7:R1001C7,"ON TIME",R2C5:R1001C5,R[-15]C14) -> 5 | Q35: =+COUNTIFS(R2C8:R1001C8,R5C15,R2C9:R1001C9,R6C,R2C7:R1001C7,"ON TIME",R2C5:R1001C5,R[-15]C14) -> 5 | R35: =+COUNTIFS(R2C8:R1001C8,R5C15,R2C9:R1001C9,R6C,R2C7:R1001C7,"ON TIME",R2C5:R1001C5,R[-15]C14) -> 6 | S35: =+COUNTIFS(R2C8:R1001C8,R5C15,R2C9:R1001C9,R6C,R2C7:R1001C7,"ON TIME",R2C5:R1001C5,R[-15]C14) -> 8 | T35: =+COUNTIFS(R2C8:R1001C8,R5C15,R2C9:R1001C9,R6C,R2C7:R1001C7,"ON TIME",R2C5:R1001C5,R[-15]C14) -> 5 | U35: =+COUNTIFS(R2C8:R1001C8,R5C15,R2C9:R1001C9,R6C,R2C7:R1001C7,"ON TIME",R2C5:R1001C5,R[-15]C14) -> 3 | V35: =+COUNTIFS(R2C8:R1001C8,R5C15,R2C9:R1001C9,R6C,R2C7:R1001C7,"ON TIME",R2C5:R1001C5,R[-15]C14) -> 4 | W35: =+COUNTIFS(R2C8:R1001C8,R5C15,R2C9:R1001C9,R6C,R2C7:R1001C7,"ON TIME",R2C5:R1001C5,R[-15]C14) -> 6 | X35: =+COUNTIFS(R2C8:R1001C8,R5C15,R2C9:R1001C9,R6C,R2C7:R1001C7,"ON TIME",R2C5:R1001C5,R[-15]C14) -> 5 | Y35: =+COUNTIFS(R2C8:R1001C8,R5C15,R2C9:R1001C9,R6C,R2C7:R1001C7,"ON TIME",R2C5:R1001C5,R[-15]C14) -> 4 | Z35: =+COUNTIFS(R2C8:R1001C8,R5C15,R2C9:R1001C9,R6C,R2C7:R1001C7,"ON TIME",R2C5:R1001C5,R[-15]C14) -> 4 | AA35: =+COUNTIFS(R2C8:R1001C8,R5C27,R2C9:R1001C9,R6C,R2C7:R1001C7,"ON TIME",R2C5:R1001C5,R[-15]C14) -> 2 | AB35: =+COUNTIFS(R2C8:R1001C8,R5C27,R2C9:R1001C9,R6C,R2C7:R1001C7,"ON TIME",R2C5:R1001C5,R[-15]C14) -> 3 | AC35: =+COUNTIFS(R2C8:R1001C8,R5C27,R2C9:R1001C9,R6C,R2C7:R1001C7,"ON TIME",R2C5:R1001C5,R[-15]C14) -> 6 | AD35: =+COUNTIFS(R2C8:R1001C8,R5C27,R2C9:R1001C9,R6C,R2C7:R1001C7,"ON TIME",R2C5:R1001C5,R[-15]C14) -> 5 | AE35: =+COUNTIFS(R2C8:R1001C8,R5C27,R2C9:R1001C9,R6C,R2C7:R1001C7,"ON TIME",R2C5:R1001C5,R[-15]C14) -> 3 | AF35: =+COUNTIFS(R2C8:R1001C8,R5C27,R2C9:R1001C9,R6C,R2C7:R1001C7,"ON TIME",R2C5:R1001C5,R[-15]C14) -> 3 | AG35: =+COUNTIFS(R2C8:R1001C8,R5C27,R2C9:R1001C9,R6C,R2C7:R1001C7,"ON TIME",R2C5:R1001C5,R[-15]C14) -> 4 | AH35: =+COUNTIFS(R2C8:R1001C8,R5C27,R2C9:R1001C9,R6C,R2C7:R1001C7,"ON TIME",R2C5:R1001C5,R[-15]C14) -> 6 | AI35: =+COUNTIFS(R2C8:R1001C8,R5C27,R2C9:R1001C9,R6C,R2C7:R1001C7,"ON TIME",R2C5:R1001C5,R[-15]C14) -> 3 | AJ35: =+COUNTIFS(R2C8:R1001C8,R5C27,R2C9:R1001C9,R6C,R2C7:R1001C7,"ON TIME",R2C5:R1001C5,R[-15]C14) -> 5 | AK35: =+COUNTIFS(R2C8:R1001C8,R5C27,R2C9:R1001C9,R6C,R2C7:R1001C7,"ON TIME",R2C5:R1001C5,R[-15]C14) -> 9 | AL35: =+COUNTIFS(R2C8:R1001C8,R5C27,R2C9:R1001C9,R6C,R2C7:R1001C7,"ON TIME",R2C5:R1001C5,R[-15]C14) -> 4 | AN35: =+SUM(RC[-25]:RC[-2]) -> 110
A36: Dept3-3587 | B36: Bajo | C36: 41426 | D36: 41428 | E36: =+LEFT(RC[-4],5) -> Dept3 | F36: =+VLOOKUP(RC[-4],Enunciado!R3C6:R5C7,2,0)+RC[-3] -> 41456 | G36: =+IF(RC[-1]>=RC[-3],"ON TIME","OUT OF TIME") -> ON TIME | H36: =+YEAR(RC[-5]) -> 2013 | I36: =+MONTH(RC[-6]) -> 6 | J36: =+RC[-6]-RC[-7] -> 2 | K36: =+IF(RC[-4]="OUT of TIME",RC[-1]-VLOOKUP(RC[-9],Enunciado!R3C6:R5C7,2,0),"") -> 
A37: Dept4-6503 | B37: Medio | C37: 41205 | D37: 41218 | E37: =+LEFT(RC[-4],5) -> Dept4 | F37: =+VLOOKUP(RC[-4],Enunciado!R3C6:R5C7,2,0)+RC[-3] -> 41220 | G37: =+IF(RC[-1]>=RC[-3],"ON TIME","OUT OF TIME") -> ON TIME | H37: =+YEAR(RC[-5]) -> 2012 | I37: =+MONTH(RC[-6]) -> 10 | J37: =+RC[-6]-RC[-7] -> 13 | K37: =+IF(RC[-4]="OUT of TIME",RC[-1]-VLOOKUP(RC[-9],Enunciado!R3C6:R5C7,2,0),"") ->  | N37: % OT-Dept1 | O37: =+R[-7]C/R[-22]C -> 1 | P37: =+R[-7]C/R[-22]C -> 0.666666666666667 | Q37: =+R[-7]C/R[-22]C -> 0.5 | R37: =+R[-7]C/R[-22]C -> 0.714285714285714 | S37: =+R[-7]C/R[-22]C -> 0.666666666666667 | T37: =+R[-7]C/R[-22]C -> 0.5 | U37: =+R[-7]C/R[-22]C -> 1 | V37: =+R[-7]C/R[-22]C -> 1 | W37: =+R[-7]C/R[-22]C -> 0.571428571428571 | X37: =+R[-7]C/R[-22]C -> 0.555555555555556 | Y37: =+R[-7]C/R[-22]C -> 0.875 | Z37: =+R[-7]C/R[-22]C -> 0.6 | AA37: =+R[-7]C/R[-22]C -> 1 | AB37: =+R[-7]C/R[-22]C -> 0.714285714285714 | AC37: =+R[-7]C/R[-22]C -> 0.833333333333333 | AD37: =+R[-7]C/R[-22]C -> 0.333333333333333 | AE37: =+R[-7]C/R[-22]C -> 0.666666666666667 | AF37: =+R[-7]C/R[-22]C -> 0.777777777777778 | AG37: =+R[-7]C/R[-22]C -> 0.6 | AH37: =+R[-7]C/R[-22]C -> 0.714285714285714 | AI37: =+R[-7]C/R[-22]C -> 0.8 | AJ37: =+R[-7]C/R[-22]C -> 0.545454545454545 | AK37: =+R[-7]C/R[-22]C -> 0.6 | AL37: =+R[-7]C/R[-22]C -> 1
A38: Dept5-2657 | B38: Medio | C38: 40930 | D38: 40948 | E38: =+LEFT(RC[-4],5) -> Dept5 | F38: =+VLOOKUP(RC[-4],Enunciado!R3C6:R5C7,2,0)+RC[-3] -> 40945 | G38: =+IF(RC[-1]>=RC[-3],"ON TIME","OUT OF TIME") -> OUT OF TIME | H38: =+YEAR(RC[-5]) -> 2012 | I38: =+MONTH(RC[-6]) -> 1 | J38: =+RC[-6]-RC[-7] -> 18 | K38: =+IF(RC[-4]="OUT of TIME",RC[-1]-VLOOKUP(RC[-9],Enunciado!R3C6:R5C7,2,0),"") -> 3 | N38: % OT-Dept2 | O38: =+R[-7]C/R[-22]C -> 0.666666666666667 | P38: =+R[-7]C/R[-22]C -> 0.833333333333333 | Q38: =+R[-7]C/R[-22]C -> 1 | R38: =+R[-7]C/R[-22]C -> 0.75 | S38: =+R[-7]C/R[-22]C -> 0.5 | T38: =+R[-7]C/R[-22]C -> 0.714285714285714 | U38: =+R[-7]C/R[-22]C -> 0.909090909090909 | V38: =+R[-7]C/R[-22]C -> 1 | W38: =+R[-7]C/R[-22]C -> 0.454545454545455 | X38: =+R[-7]C/R[-22]C -> 0.75 | Y38: =+R[-7]C/R[-22]C -> 0.888888888888889 | Z38: =+R[-7]C/R[-22]C -> 0.714285714285714 | AA38: =+R[-7]C/R[-22]C -> 0.636363636363636 | AB38: =+R[-7]C/R[-22]C -> 0.75 | AC38: =+R[-7]C/R[-22]C -> 1 | AD38: =+R[-7]C/R[-22]C -> 0.666666666666667 | AE38: =+R[-7]C/R[-22]C -> 0.5 | AF38: =+R[-7]C/R[-22]C -> 0.875 | AG38: =+R[-7]C/R[-22]C -> 0.5 | AH38: =+R[-7]C/R[-22]C -> 0.285714285714286 | AI38: =+R[-7]C/R[-22]C -> 0.714285714285714 | AJ38: =+R[-7]C/R[-22]C -> 0.8 | AK38: =+R[-7]C/R[-22]C -> 0.5 | AL38: =+R[-7]C/R[-22]C -> 0.888888888888889
A39: Dept2-29562 | B39: Alto | C39: 41446 | D39: 41450 | E39: =+LEFT(RC[-4],5) -> Dept2 | F39: =+VLOOKUP(RC[-4],Enunciado!R3C6:R5C7,2,0)+RC[-3] -> 41451 | G39: =+IF(RC[-1]>=RC[-3],"ON TIME","OUT OF TIME") -> ON TIME | H39: =+YEAR(RC[-5]) -> 2013 | I39: =+MONTH(RC[-6]) -> 6 | J39: =+RC[-6]-RC[-7] -> 4 | K39: =+IF(RC[-4]="OUT of TIME",RC[-1]-VLOOKUP(RC[-9],Enunciado!R3C6:R5C7,2,0),"") ->  | N39: % OT-Dept3 | O39: =+R[-7]C/R[-22]C -> 0 | P39: =+R[-7]C/R[-22]C -> 0.833333333333333 | Q39: =+R[-7]C/R[-22]C -> 0.428571428571429 | R39: =+R[-7]C/R[-22]C -> 0.444444444444444 | S39: =+R[-7]C/R[-22]C -> 1 | T39: =+R[-7]C/R[-22]C -> 0.5 | U39: =+R[-7]C/R[-22]C -> 0.615384615384615 | V39: =+R[-7]C/R[-22]C -> 0.8 | W39: =+R[-7]C/R[-22]C -> 0.75 | X39: =+R[-7]C/R[-22]C -> 0.666666666666667 | Y39: =+R[-7]C/R[-22]C -> 0.666666666666667 | Z39: =+R[-7]C/R[-22]C -> 1 | AA39: =+R[-7]C/R[-22]C -> 0.6 | AB39: =+R[-7]C/R[-22]C -> 0.5 | AC39: =+R[-7]C/R[-22]C -> 0.571428571428571 | AD39: =+R[-7]C/R[-22]C -> 1 | AE39: =+R[-7]C/R[-22]C -> 0.6 | AF39: =+R[-7]C/R[-22]C -> 0.909090909090909 | AG39: =+R[-7]C/R[-22]C -> 1 | AH39: =+R[-7]C/R[-22]C -> 0.8 | AI39: =+R[-7]C/R[-22]C -> 1 | AJ39: =+R[-7]C/R[-22]C -> 0.8 | AK39: =+R[-7]C/R[-22]C -> 1 | AL39: =+R[-7]C/R[-22]C -> 0.5
A40: Dept3-13004 | B40: Alto | C40: 41007 | D40: 41019 | E40: =+LEFT(RC[-4],5) -> Dept3 | F40: =+VLOOKUP(RC[-4],Enunciado!R3C6:R5C7,2,0)+RC[-3] -> 41012 | G40: =+IF(RC[-1]>=RC[-3],"ON TIME","OUT OF TIME") -> OUT OF TIME | H40: =+YEAR(RC[-5]) -> 2012 | I40: =+MONTH(RC[-6]) -> 4 | J40: =+RC[-6]-RC[-7] -> 12 | K40: =+IF(RC[-4]="OUT of TIME",RC[-1]-VLOOKUP(RC[-9],Enunciado!R3C6:R5C7,2,0),"") -> 7 | N40: OT-Dept4 | O40: =+R[-7]C/R[-22]C -> 1 | P40: =+R[-7]C/R[-22]C -> 0.5 | Q40: =+R[-7]C/R[-22]C -> 0.888888888888889 | R40: =+R[-7]C/R[-22]C -> 1 | S40: =+R[-7]C/R[-22]C -> 0.857142857142857 | T40: =+R[-7]C/R[-22]C -> 0.714285714285714 | U40: =+R[-7]C/R[-22]C -> 0.25 | V40: =+R[-7]C/R[-22]C -> 0.714285714285714 | W40: =+R[-7]C/R[-22]C -> 0.666666666666667 | X40: =+R[-7]C/R[-22]C -> 0.6 | Y40: =+R[-7]C/R[-22]C -> 0.777777777777778 | Z40: =+R[-7]C/R[-22]C -> 0.777777777777778 | AA40: =+R[-7]C/R[-22]C -> 1 | AB40: =+R[-7]C/R[-22]C -> 1 | AC40: =+R[-7]C/R[-22]C -> 0.444444444444444 | AD40: =+R[-7]C/R[-22]C -> 0.75 | AE40: =+R[-7]C/R[-22]C -> 0.75 | AF40: =+R[-7]C/R[-22]C -> 0.714285714285714 | AG40: =+R[-7]C/R[-22]C -> 1 | AH40: =+R[-7]C/R[-22]C -> 0.714285714285714 | AI40: =+R[-7]C/R[-22]C -> 0.6 | AJ40: =+R[-7]C/R[-22]C -> 0.8 | AK40: =+R[-7]C/R[-22]C -> 1 | AL40: =+R[-7]C/R[-22]C -> 0.833333333333333
A41: Dept2-2331 | B41: Medio | C41: 41119 | D41: 41120 | E41: =+LEFT(RC[-4],5) -> Dept2 | F41: =+VLOOKUP(RC[-4],Enunciado!R3C6:R5C7,2,0)+RC[-3] -> 41134 | G41: =+IF(RC[-1]>=RC[-3],"ON TIME","OUT OF TIME") -> ON TIME | H41: =+YEAR(RC[-5]) -> 2012 | I41: =+MONTH(RC[-6]) -> 7 | J41: =+RC[-6]-RC[-7] -> 1 | K41: =+IF(RC[-4]="OUT of TIME",RC[-1]-VLOOKUP(RC[-9],Enunciado!R3C6:R5C7,2,0),"") ->  | N41: OT-Dept5 | O41: =+R[-7]C/R[-22]C -> 0.7 | P41: =+R[-7]C/R[-22]C -> 0.333333333333333 | Q41: =+R[-7]C/R[-22]C -> 0.666666666666667 | R41: =+R[-7]C/R[-22]C -> 0.5 | S41: =+R[-7]C/R[-22]C -> 1 | T41: =+R[-7]C/R[-22]C -> 0.375 | U41: =+R[-7]C/R[-22]C -> 1 | V41: =+R[-7]C/R[-22]C -> 0.5 | W41: =+R[-7]C/R[-22]C -> 0.8 | X41: =+R[-7]C/R[-22]C -> 0 | Y41: =+R[-7]C/R[-22]C -> 0.555555555555556 | Z41: =+R[-7]C/R[-22]C -> 0.8 | AA41: =+R[-7]C/R[-22]C -> 0.714285714285714 | AB41: =+R[-7]C/R[-22]C -> 0.5 | AC41: =+R[-7]C/R[-22]C -> 0 | AD41: =+R[-7]C/R[-22]C -> 0.571428571428571 | AE41: =+R[-7]C/R[-22]C -> 0.888888888888889 | AF41: =+R[-7]C/R[-22]C -> 0.714285714285714 | AG41: =+R[-7]C/R[-22]C -> 0.7 | AH41: =+R[-7]C/R[-22]C -> 0.545454545454545 | AI41: =+R[-7]C/R[-22]C -> 0.538461538461538 | AJ41: =+R[-7]C/R[-22]C -> 0.888888888888889 | AK41: =+R[-7]C/R[-22]C -> 0.833333333333333 | AL41: =+R[-7]C/R[-22]C -> 0.8
A42: Dept2-11370 | B42: Medio | C42: 41159 | D42: 41172 | E42: =+LEFT(RC[-4],5) -> Dept2 | F42: =+VLOOKUP(RC[-4],Enunciado!R3C6:R5C7,2,0)+RC[-3] -> 41174 | G42: =+IF(RC[-1]>=RC[-3],"ON TIME","OUT OF TIME") -> ON TIME | H42: =+YEAR(RC[-5]) -> 2012 | I42: =+MONTH(RC[-6]) -> 9 | J42: =+RC[-6]-RC[-7] -> 13 | K42: =+IF(RC[-4]="OUT of TIME",RC[-1]-VLOOKUP(RC[-9],Enunciado!R3C6:R5C7,2,0),"") ->  | N42: OT-Dept6 | O42: =+R[-7]C/R[-22]C -> 0.4 | P42: =+R[-7]C/R[-22]C -> 0.833333333333333 | Q42: =+R[-7]C/R[-22]C -> 1 | R42: =+R[-7]C/R[-22]C -> 0.857142857142857 | S42: =+R[-7]C/R[-22]C -> 0.727272727272727 | T42: =+R[-7]C/R[-22]C -> 0.625 | U42: =+R[-7]C/R[-22]C -> 0.375 | V42: =+R[-7]C/R[-22]C -> 0.571428571428571 | W42: =+R[-7]C/R[-22]C -> 0.857142857142857 | X42: =+R[-7]C/R[-22]C -> 0.714285714285714 | Y42: =+R[-7]C/R[-22]C -> 0.8 | Z42: =+R[-7]C/R[-22]C -> 0.5 | AA42: =+R[-7]C/R[-22]C -> 0.4 | AB42: =+R[-7]C/R[-22]C -> 0.75 | AC42: =+R[-7]C/R[-22]C -> 0.857142857142857 | AD42: =+R[-7]C/R[-22]C -> 0.833333333333333 | AE42: =+R[-7]C/R[-22]C -> 0.6 | AF42: =+R[-7]C/R[-22]C -> 0.5 | AG42: =+R[-7]C/R[-22]C -> 1 | AH42: =+R[-7]C/R[-22]C -> 0.666666666666667 | AI42: =+R[-7]C/R[-22]C -> 0.333333333333333 | AJ42: =+R[-7]C/R[-22]C -> 0.833333333333333 | AK42: =+R[-7]C/R[-22]C -> 0.9 | AL42: =+R[-7]C/R[-22]C -> 0.571428571428571
A43: Dept6-16726 | B43: Alto | C43: 41445 | D43: 41486 | E43: =+LEFT(RC[-4],5) -> Dept6 | F43: =+VLOOKUP(RC[-4],Enunciado!R3C6:R5C7,2,0)+RC[-3] -> 41450 | G43: =+IF(RC[-1]>=RC[-3],"ON TIME","OUT OF TIME") -> OUT OF TIME | H43: =+YEAR(RC[-5]) -> 2013 | I43: =+MONTH(RC[-6]) -> 6 | J43: =+RC[-6]-RC[-7] -> 41 | K43: =+IF(RC[-4]="OUT of TIME",RC[-1]-VLOOKUP(RC[-9],Enunciado!R3C6:R5C7,2,0),"") -> 36 | N43: **OT = ON TIME
A44: Dept5-21016 | B44: Medio | C44: 41032 | D44: 41034 | E44: =+LEFT(RC[-4],5) -> Dept5 | F44: =+VLOOKUP(RC[-4],Enunciado!R3C6:R5C7,2,0)+RC[-3] -> 41047 | G44: =+IF(RC[-1]>=RC[-3],"ON TIME","OUT OF TIME") -> ON TIME | H44: =+YEAR(RC[-5]) -> 2012 | I44: =+MONTH(RC[-6]) -> 5 | J44: =+RC[-6]-RC[-7] -> 2 | K44: =+IF(RC[-4]="OUT of TIME",RC[-1]-VLOOKUP(RC[-9],Enunciado!R3C6:R5C7,2,0),"") -> 
A45: Dept1-15541 | B45: Alto | C45: 41389 | D45: 41410 | E45: =+LEFT(RC[-4],5) -> Dept1 | F45: =+VLOOKUP(RC[-4],Enunciado!R3C6:R5C7,2,0)+RC[-3] -> 41394 | G45: =+IF(RC[-1]>=RC[-3],"ON TIME","OUT OF TIME") -> OUT OF TIME | H45: =+YEAR(RC[-5]) -> 2013 | I45: =+MONTH(RC[-6]) -> 4 | J45: =+RC[-6]-RC[-7] -> 21 | K45: =+IF(RC[-4]="OUT of TIME",RC[-1]-VLOOKUP(RC[-9],Enunciado!R3C6:R5C7,2,0),"") -> 16
A46: Dept5-27154 | B46: Alto | C46: 41318 | D46: 41343 | E46: =+LEFT(RC[-4],5) -> Dept5 | F46: =+VLOOKUP(RC[-4],Enunciado!R3C6:R5C7,2,0)+RC[-3] -> 41323 | G46: =+IF(RC[-1]>=RC[-3],"ON TIME","OUT OF TIME") -> OUT OF TIME | H46: =+YEAR(RC[-5]) -> 2013 | I46: =+MONTH(RC[-6]) -> 2 | J46: =+RC[-6]-RC[-7] -> 25 | K46: =+IF(RC[-4]="OUT of TIME",RC[-1]-VLOOKUP(RC[-9],Enunciado!R3C6:R5C7,2,0),"") -> 20 | N46: Análisis Global: Desviaciones de tiempos de respuesta
A47: Dept5-12049 | B47: Bajo | C47: 41427 | D47: 41436 | E47: =+LEFT(RC[-4],5) -> Dept5 | F47: =+VLOOKUP(RC[-4],Enunciado!R3C6:R5C7,2,0)+RC[-3] -> 41457 | G47: =+IF(RC[-1]>=RC[-3],"ON TIME","OUT OF TIME") -> ON TIME | H47: =+YEAR(RC[-5]) -> 2013 | I47: =+MONTH(RC[-6]) -> 6 | J47: =+RC[-6]-RC[-7] -> 9 | K47: =+IF(RC[-4]="OUT of TIME",RC[-1]-VLOOKUP(RC[-9],Enunciado!R3C6:R5C7,2,0),"") -> 
A48: Dept1-8284 | B48: Medio | C48: 41086 | D48: 41094 | E48: =+LEFT(RC[-4],5) -> Dept1 | F48: =+VLOOKUP(RC[-4],Enunciado!R3C6:R5C7,2,0)+RC[-3] -> 41101 | G48: =+IF(RC[-1]>=RC[-3],"ON TIME","OUT OF TIME") -> ON TIME | H48: =+YEAR(RC[-5]) -> 2012 | I48: =+MONTH(RC[-6]) -> 6 | J48: =+RC[-6]-RC[-7] -> 8 | K48: =+IF(RC[-4]="OUT of TIME",RC[-1]-VLOOKUP(RC[-9],Enunciado!R3C6:R5C7,2,0),"") ->  | N48: Tipo de incidencia | O48: Target | P48: Valor
A49: Dept3-9707 | B49: Alto | C49: 41096 | D49: 41096 | E49: =+LEFT(RC[-4],5) -> Dept3 | F49: =+VLOOKUP(RC[-4],Enunciado!R3C6:R5C7,2,0)+RC[-3] -> 41101 | G49: =+IF(RC[-1]>=RC[-3],"ON TIME","OUT OF TIME") -> ON TIME | H49: =+YEAR(RC[-5]) -> 2012 | I49: =+MONTH(RC[-6]) -> 7 | J49: =+RC[-6]-RC[-7] -> 0 | K49: =+IF(RC[-4]="OUT of TIME",RC[-1]-VLOOKUP(RC[-9],Enunciado!R3C6:R5C7,2,0),"") ->  | N49: Alto | O49: 5 | P49: =+AVERAGEIFS(R2C11:R1001C11,R2C2:R1001C2,RC[-2],R2C7:R1001C7,"OUT OF TIME") -> 16.0229885057471
A50: Dept4-11233 | B50: Medio | C50: 41512 | D50: 41516 | E50: =+LEFT(RC[-4],5) -> Dept4 | F50: =+VLOOKUP(RC[-4],Enunciado!R3C6:R5C7,2,0)+RC[-3] -> 41527 | G50: =+IF(RC[-1]>=RC[-3],"ON TIME","OUT OF TIME") -> ON TIME | H50: =+YEAR(RC[-5]) -> 2013 | I50: =+MONTH(RC[-6]) -> 8 | J50: =+RC[-6]-RC[-7] -> 4 | K50: =+IF(RC[-4]="OUT of TIME",RC[-1]-VLOOKUP(RC[-9],Enunciado!R3C6:R5C7,2,0),"") ->  | N50: Medio | O50: 15 | P50: =+AVERAGEIFS(R2C11:R1001C11,R2C2:R1001C2,RC[-2],R2C7:R1001C7,"OUT OF TIME") -> 14.2842105263158
A51: Dept2-26054 | B51: Bajo | C51: 41124 | D51: 41125 | E51: =+LEFT(RC[-4],5) -> Dept2 | F51: =+VLOOKUP(RC[-4],Enunciado!R3C6:R5C7,2,0)+RC[-3] -> 41154 | G51: =+IF(RC[-1]>=RC[-3],"ON TIME","OUT OF TIME") -> ON TIME | H51: =+YEAR(RC[-5]) -> 2012 | I51: =+MONTH(RC[-6]) -> 8 | J51: =+RC[-6]-RC[-7] -> 1 | K51: =+IF(RC[-4]="OUT of TIME",RC[-1]-VLOOKUP(RC[-9],Enunciado!R3C6:R5C7,2,0),"") ->  | N51: Bajo | O51: 30 | P51: =+AVERAGEIFS(R2C11:R1001C11,R2C2:R1001C2,RC[-2],R2C7:R1001C7,"OUT OF TIME") -> 9.08571428571429
A52: Dept5-25227 | B52: Bajo | C52: 41416 | D52: 41425 | E52: =+LEFT(RC[-4],5) -> Dept5 | F52: =+VLOOKUP(RC[-4],Enunciado!R3C6:R5C7,2,0)+RC[-3] -> 41446 | G52: =+IF(RC[-1]>=RC[-3],"ON TIME","OUT OF TIME") -> ON TIME | H52: =+YEAR(RC[-5]) -> 2013 | I52: =+MONTH(RC[-6]) -> 5 | J52: =+RC[-6]-RC[-7] -> 9 | K52: =+IF(RC[-4]="OUT of TIME",RC[-1]-VLOOKUP(RC[-9],Enunciado!R3C6:R5C7,2,0),"") -> 
A53: Dept3-2340 | B53: Medio | C53: 41222 | D53: 41224 | E53: =+LEFT(RC[-4],5) -> Dept3 | F53: =+VLOOKUP(RC[-4],Enunciado!R3C6:R5C7,2,0)+RC[-3] -> 41237 | G53: =+IF(RC[-1]>=RC[-3],"ON TIME","OUT OF TIME") -> ON TIME | H53: =+YEAR(RC[-5]) -> 2012 | I53: =+MONTH(RC[-6]) -> 11 | J53: =+RC[-6]-RC[-7] -> 2 | K53: =+IF(RC[-4]="OUT of TIME",RC[-1]-VLOOKUP(RC[-9],Enunciado!R3C6:R5C7,2,0),"") -> 
A54: Dept1-17790 | B54: Alto | C54: 41133 | D54: 41136 | E54: =+LEFT(RC[-4],5) -> Dept1 | F54: =+VLOOKUP(RC[-4],Enunciado!R3C6:R5C7,2,0)+RC[-3] -> 41138 | G54: =+IF(RC[-1]>=RC[-3],"ON TIME","OUT OF TIME") -> ON TIME | H54: =+YEAR(RC[-5]) -> 2012 | I54: =+MONTH(RC[-6]) -> 8 | J54: =+RC[-6]-RC[-7] -> 3 | K54: =+IF(RC[-4]="OUT of TIME",RC[-1]-VLOOKUP(RC[-9],Enunciado!R3C6:R5C7,2,0),"") ->  | N54: Departamento | O54: Tiempo de respuesta | AN54: Total
A55: Dept4-17966 | B55: Alto | C55: 41351 | D55: 41354 | E55: =+LEFT(RC[-4],5) -> Dept4 | F55: =+VLOOKUP(RC[-4],Enunciado!R3C6:R5C7,2,0)+RC[-3] -> 41356 | G55: =+IF(RC[-1]>=RC[-3],"ON TIME","OUT OF TIME") -> ON TIME | H55: =+YEAR(RC[-5]) -> 2013 | I55: =+MONTH(RC[-6]) -> 3 | J55: =+RC[-6]-RC[-7] -> 3 | K55: =+IF(RC[-4]="OUT of TIME",RC[-1]-VLOOKUP(RC[-9],Enunciado!R3C6:R5C7,2,0),"") ->  | N55: Dept1 | O55: =+AVERAGEIFS(R2C10:R1001C10,R2C8:R1001C8,R5C15,R2C9:R1001C9,R6C,R2C5:R1001C5,RC14) -> 7 | P55: =+AVERAGEIFS(R2C10:R1001C10,R2C8:R1001C8,R5C15,R2C9:R1001C9,R6C,R2C5:R1001C5,RC14) -> 11.5 | Q55: =+AVERAGEIFS(R2C10:R1001C10,R2C8:R1001C8,R5C15,R2C9:R1001C9,R6C,R2C5:R1001C5,RC14) -> 19 | R55: =+AVERAGEIFS(R2C10:R1001C10,R2C8:R1001C8,R5C15,R2C9:R1001C9,R6C,R2C5:R1001C5,RC14) -> 9.71428571428571 | S55: =+AVERAGEIFS(R2C10:R1001C10,R2C8:R1001C8,R5C15,R2C9:R1001C9,R6C,R2C5:R1001C5,RC14) -> 8.33333333333333 | T55: =+AVERAGEIFS(R2C10:R1001C10,R2C8:R1001C8,R5C15,R2C9:R1001C9,R6C,R2C5:R1001C5,RC14) -> 16.25 | U55: =+AVERAGEIFS(R2C10:R1001C10,R2C8:R1001C8,R5C15,R2C9:R1001C9,R6C,R2C5:R1001C5,RC14) -> 4.16666666666667 | V55: =+AVERAGEIFS(R2C10:R1001C10,R2C8:R1001C8,R5C15,R2C9:R1001C9,R6C,R2C5:R1001C5,RC14) -> 7 | W55: =+AVERAGEIFS(R2C10:R1001C10,R2C8:R1001C8,R5C15,R2C9:R1001C9,R6C,R2C5:R1001C5,RC14) -> 13 | X55: =+AVERAGEIFS(R2C10:R1001C10,R2C8:R1001C8,R5C15,R2C9:R1001C9,R6C,R2C5:R1001C5,RC14) -> 13.6666666666667 | Y55: =+AVERAGEIFS(R2C10:R1001C10,R2C8:R1001C8,R5C15,R2C9:R1001C9,R6C,R2C5:R1001C5,RC14) -> 12.25 | Z55: =+AVERAGEIFS(R2C10:R1001C10,R2C8:R1001C8,R5C15,R2C9:R1001C9,R6C,R2C5:R1001C5,RC14) -> 14.1 | AA55: =+AVERAGEIFS(R2C10:R1001C10,R2C8:R1001C8,R5C27,R2C9:R1001C9,R6C,R2C5:R1001C5,RC14) -> 0.666666666666667 | AB55: =+AVERAGEIFS(R2C10:R1001C10,R2C8:R1001C8,R5C27,R2C9:R1001C9,R6C,R2C5:R1001C5,RC14) -> 17 | AC55: =+AVERAGEIFS(R2C10:R1001C10,R2C8:R1001C8,R5C27,R2C9:R1001C9,R6C,R2C5:R1001C5,RC14) -> 6.16666666666667 | AD55: =+AVERAGEIFS(R2C10:R1001C10,R2C8:R1001C8,R5C27,R2C9:R1001C9,R6C,R2C5:R1001C5,RC14) -> 13.3333333333333 | AE55: =+AVERAGEIFS(R2C10:R1001C10,R2C8:R1001C8,R5C27,R2C9:R1001C9,R6C,R2C5:R1001C5,RC14) -> 13 | AF55: =+AVERAGEIFS(R2C10:R1001C10,R2C8:R1001C8,R5C27,R2C9:R1001C9,R6C,R2C5:R1001C5,RC14) -> 12.7777777777778 | AG55: =+AVERAGEIFS(R2C10:R1001C10,R2C8:R1001C8,R5C27,R2C9:R1001C9,R6C,R2C5:R1001C5,RC14) -> 11.4 | AH55: =+AVERAGEIFS(R2C10:R1001C10,R2C8:R1001C8,R5C27,R2C9:R1001C9,R6C,R2C5:R1001C5,RC14) -> 10.5714285714286 | AI55: =+AVERAGEIFS(R2C10:R1001C10,R2C8:R1001C8,R5C27,R2C9:R1001C9,R6C,R2C5:R1001C5,RC14) -> 12.8 | AJ55: =+AVERAGEIFS(R2C10:R1001C10,R2C8:R1001C8,R5C27,R2C9:R1001C9,R6C,R2C5:R1001C5,RC14) -> 11.9090909090909 | AK55: =+AVERAGEIFS(R2C10:R1001C10,R2C8:R1001C8,R5C27,R2C9:R1001C9,R6C,R2C5:R1001C5,RC14) -> 15 | AL55: =+AVERAGEIFS(R2C10:R1001C10,R2C8:R1001C8,R5C27,R2C9:R1001C9,R6C,R2C5:R1001C5,RC14) -> 3.25 | AN55: =+AVERAGEIFS(R2C10:R1001C10,R2C5:R1001C5,RC14) -> 11.8705882352941
A56: Dept3-22800 | B56: Bajo | C56: 41613 | D56: 41645 | E56: =+LEFT(RC[-4],5) -> Dept3 | F56: =+VLOOKUP(RC[-4],Enunciado!R3C6:R5C7,2,0)+RC[-3] -> 41643 | G56: =+IF(RC[-1]>=RC[-3],"ON TIME","OUT OF TIME") -> OUT OF TIME | H56: =+YEAR(RC[-5]) -> 2013 | I56: =+MONTH(RC[-6]) -> 12 | J56: =+RC[-6]-RC[-7] -> 32 | K56: =+IF(RC[-4]="OUT of TIME",RC[-1]-VLOOKUP(RC[-9],Enunciado!R3C6:R5C7,2,0),"") -> 2 | N56: Dept2 | O56: =+AVERAGEIFS(R2C10:R1001C10,R2C8:R1001C8,R5C15,R2C9:R1001C9,R6C,R2C5:R1001C5,RC14) -> 13.6666666666667 | P56: =+AVERAGEIFS(R2C10:R1001C10,R2C8:R1001C8,R5C15,R2C9:R1001C9,R6C,R2C5:R1001C5,RC14) -> 11.1666666666667 | Q56: =+AVERAGEIFS(R2C10:R1001C10,R2C8:R1001C8,R5C15,R2C9:R1001C9,R6C,R2C5:R1001C5,RC14) -> 4.375 | R56: =+AVERAGEIFS(R2C10:R1001C10,R2C8:R1001C8,R5C15,R2C9:R1001C9,R6C,R2C5:R1001C5,RC14) -> 12.75 | S56: =+AVERAGEIFS(R2C10:R1001C10,R2C8:R1001C8,R5C15,R2C9:R1001C9,R6C,R2C5:R1001C5,RC14) -> 10 | T56: =+AVERAGEIFS(R2C10:R1001C10,R2C8:R1001C8,R5C15,R2C9:R1001C9,R6C,R2C5:R1001C5,RC14) -> 10.2857142857143 | U56: =+AVERAGEIFS(R2C10:R1001C10,R2C8:R1001C8,R5C15,R2C9:R1001C9,R6C,R2C5:R1001C5,RC14) -> 5.54545454545455 | V56: =+AVERAGEIFS(R2C10:R1001C10,R2C8:R1001C8,R5C15,R2C9:R1001C9,R6C,R2C5:R1001C5,RC14) -> 3.16666666666667 | W56: =+AVERAGEIFS(R2C10:R1001C10,R2C8:R1001C8,R5C15,R2C9:R1001C9,R6C,R2C5:R1001C5,RC14) -> 16 | X56: =+AVERAGEIFS(R2C10:R1001C10,R2C8:R1001C8,R5C15,R2C9:R1001C9,R6C,R2C5:R1001C5,RC14) -> 14.375 | Y56: =+AVERAGEIFS(R2C10:R1001C10,R2C8:R1001C8,R5C15,R2C9:R1001C9,R6C,R2C5:R1001C5,RC14) -> 9.44444444444444 | Z56: =+AVERAGEIFS(R2C10:R1001C10,R2C8:R1001C8,R5C15,R2C9:R1001C9,R6C,R2C5:R1001C5,RC14) -> 9.28571428571429 | AA56: =+AVERAGEIFS(R2C10:R1001C10,R2C8:R1001C8,R5C27,R2C9:R1001C9,R6C,R2C5:R1001C5,RC14) -> 13.1818181818182 | AB56: =+AVERAGEIFS(R2C10:R1001C10,R2C8:R1001C8,R5C27,R2C9:R1001C9,R6C,R2C5:R1001C5,RC14) -> 13.5 | AC56: =+AVERAGEIFS(R2C10:R1001C10,R2C8:R1001C8,R5C27,R2C9:R1001C9,R6C,R2C5:R1001C5,RC14) -> 4.5 | AD56: =+AVERAGEIFS(R2C10:R1001C10,R2C8:R1001C8,R5C27,R2C9:R1001C9,R6C,R2C5:R1001C5,RC14) -> 14.1666666666667 | AE56: =+AVERAGEIFS(R2C10:R1001C10,R2C8:R1001C8,R5C27,R2C9:R1001C9,R6C,R2C5:R1001C5,RC14) -> 14.75 | AF56: =+AVERAGEIFS(R2C10:R1001C10,R2C8:R1001C8,R5C27,R2C9:R1001C9,R6C,R2C5:R1001C5,RC14) -> 4.625 | AG56: =+AVERAGEIFS(R2C10:R1001C10,R2C8:R1001C8,R5C27,R2C9:R1001C9,R6C,R2C5:R1001C5,RC14) -> 25.3333333333333 | AH56: =+AVERAGEIFS(R2C10:R1001C10,R2C8:R1001C8,R5C27,R2C9:R1001C9,R6C,R2C5:R1001C5,RC14) -> 22.7142857142857 | AI56: =+AVERAGEIFS(R2C10:R1001C10,R2C8:R1001C8,R5C27,R2C9:R1001C9,R6C,R2C5:R1001C5,RC14) -> 11.4285714285714 | AJ56: =+AVERAGEIFS(R2C10:R1001C10,R2C8:R1001C8,R5C27,R2C9:R1001C9,R6C,R2C5:R1001C5,RC14) -> 7.5 | AK56: =+AVERAGEIFS(R2C10:R1001C10,R2C8:R1001C8,R5C27,R2C9:R1001C9,R6C,R2C5:R1001C5,RC14) -> 15.875 | AL56: =+AVERAGEIFS(R2C10:R1001C10,R2C8:R1001C8,R5C27,R2C9:R1001C9,R6C,R2C5:R1001C5,RC14) -> 8.22222222222222 | AN56: =+AVERAGEIFS(R2C10:R1001C10,R2C5:R1001C5,RC14) -> 11.2169312169312
A57: Dept4-6291 | B57: Bajo | C57: 41332 | D57: 41339 | E57: =+LEFT(RC[-4],5) -> Dept4 | F57: =+VLOOKUP(RC[-4],Enunciado!R3C6:R5C7,2,0)+RC[-3] -> 41362 | G57: =+IF(RC[-1]>=RC[-3],"ON TIME","OUT OF TIME") -> ON TIME | H57: =+YEAR(RC[-5]) -> 2013 | I57: =+MONTH(RC[-6]) -> 2 | J57: =+RC[-6]-RC[-7] -> 7 | K57: =+IF(RC[-4]="OUT of TIME",RC[-1]-VLOOKUP(RC[-9],Enunciado!R3C6:R5C7,2,0),"") ->  | N57: Dept3 | O57: =+AVERAGEIFS(R2C10:R1001C10,R2C8:R1001C8,R5C15,R2C9:R1001C9,R6C,R2C5:R1001C5,RC14) -> 34.6666666666667 | P57: =+AVERAGEIFS(R2C10:R1001C10,R2C8:R1001C8,R5C15,R2C9:R1001C9,R6C,R2C5:R1001C5,RC14) -> 8.16666666666667 | Q57: =+AVERAGEIFS(R2C10:R1001C10,R2C8:R1001C8,R5C15,R2C9:R1001C9,R6C,R2C5:R1001C5,RC14) -> 13.1428571428571 | R57: =+AVERAGEIFS(R2C10:R1001C10,R2C8:R1001C8,R5C15,R2C9:R1001C9,R6C,R2C5:R1001C5,RC14) -> 11.8888888888889 | S57: =+AVERAGEIFS(R2C10:R1001C10,R2C8:R1001C8,R5C15,R2C9:R1001C9,R6C,R2C5:R1001C5,RC14) -> 10 | T57: =+AVERAGEIFS(R2C10:R1001C10,R2C8:R1001C8,R5C15,R2C9:R1001C9,R6C,R2C5:R1001C5,RC14) -> 12.375 | U57: =+AVERAGEIFS(R2C10:R1001C10,R2C8:R1001C8,R5C15,R2C9:R1001C9,R6C,R2C5:R1001C5,RC14) -> 11.5384615384615 | V57: =+AVERAGEIFS(R2C10:R1001C10,R2C8:R1001C8,R5C15,R2C9:R1001C9,R6C,R2C5:R1001C5,RC14) -> 6.2 | W57: =+AVERAGEIFS(R2C10:R1001C10,R2C8:R1001C8,R5C15,R2C9:R1001C9,R6C,R2C5:R1001C5,RC14) -> 6.125 | X57: =+AVERAGEIFS(R2C10:R1001C10,R2C8:R1001C8,R5C15,R2C9:R1001C9,R6C,R2C5:R1001C5,RC14) -> 17 | Y57: =+AVERAGEIFS(R2C10:R1001C10,R2C8:R1001C8,R5C15,R2C9:R1001C9,R6C,R2C5:R1001C5,RC14) -> 9.33333333333333 | Z57: =+AVERAGEIFS(R2C10:R1001C10,R2C8:R1001C8,R5C15,R2C9:R1001C9,R6C,R2C5:R1001C5,RC14) -> 3.75 | AA57: =+AVERAGEIFS(R2C10:R1001C10,R2C8:R1001C8,R5C27,R2C9:R1001C9,R6C,R2C5:R1001C5,RC14) -> 12.2 | AB57: =+AVERAGEIFS(R2C10:R1001C10,R2C8:R1001C8,R5C27,R2C9:R1001C9,R6C,R2C5:R1001C5,RC14) -> 24 | AC57: =+AVERAGEIFS(R2C10:R1001C10,R2C8:R1001C8,R5C27,R2C9:R1001C9,R6C,R2C5:R1001C5,RC14) -> 14.5714285714286 | AD57: =+AVERAGEIFS(R2C10:R1001C10,R2C8:R1001C8,R5C27,R2C9:R1001C9,R6C,R2C5:R1001C5,RC14) -> 1.5 | AE57: =+AVERAGEIFS(R2C10:R1001C10,R2C8:R1001C8,R5C27,R2C9:R1001C9,R6C,R2C5:R1001C5,RC14) -> 12.3 | AF57: =+AVERAGEIFS(R2C10:R1001C10,R2C8:R1001C8,R5C27,R2C9:R1001C9,R6C,R2C5:R1001C5,RC14) -> 4.09090909090909 | AG57: =+AVERAGEIFS(R2C10:R1001C10,R2C8:R1001C8,R5C27,R2C9:R1001C9,R6C,R2C5:R1001C5,RC14) -> 5.375 | AH57: =+AVERAGEIFS(R2C10:R1001C10,R2C8:R1001C8,R5C27,R2C9:R1001C9,R6C,R2C5:R1001C5,RC14) -> 10.8 | AI57: =+AVERAGEIFS(R2C10:R1001C10,R2C8:R1001C8,R5C27,R2C9:R1001C9,R6C,R2C5:R1001C5,RC14) -> 15.5 | AJ57: =+AVERAGEIFS(R2C10:R1001C10,R2C8:R1001C8,R5C27,R2C9:R1001C9,R6C,R2C5:R1001C5,RC14) -> 7.8 | AK57: =+AVERAGEIFS(R2C10:R1001C10,R2C8:R1001C8,R5C27,R2C9:R1001C9,R6C,R2C5:R1001C5,RC14) -> 5 | AL57: =+AVERAGEIFS(R2C10:R1001C10,R2C8:R1001C8,R5C27,R2C9:R1001C9,R6C,R2C5:R1001C5,RC14) -> 22 | AN57: =+AVERAGEIFS(R2C10:R1001C10,R2C5:R1001C5,RC14) -> 11.1446540880503
A58: Dept2-28498 | B58: Alto | C58: 41439 | D58: 41442 | E58: =+LEFT(RC[-4],5) -> Dept2 | F58: =+VLOOKUP(RC[-4],Enunciado!R3C6:R5C7,2,0)+RC[-3] -> 41444 | G58: =+IF(RC[-1]>=RC[-3],"ON TIME","OUT OF TIME") -> ON TIME | H58: =+YEAR(RC[-5]) -> 2013 | I58: =+MONTH(RC[-6]) -> 6 | J58: =+RC[-6]-RC[-7] -> 3 | K58: =+IF(RC[-4]="OUT of TIME",RC[-1]-VLOOKUP(RC[-9],Enunciado!R3C6:R5C7,2,0),"") ->  | N58: Dept4 | O58: =+AVERAGEIFS(R2C10:R1001C10,R2C8:R1001C8,R5C15,R2C9:R1001C9,R6C,R2C5:R1001C5,RC14) -> 5.6 | P58: =+AVERAGEIFS(R2C10:R1001C10,R2C8:R1001C8,R5C15,R2C9:R1001C9,R6C,R2C5:R1001C5,RC14) -> 17.8 | Q58: =+AVERAGEIFS(R2C10:R1001C10,R2C8:R1001C8,R5C15,R2C9:R1001C9,R6C,R2C5:R1001C5,RC14) -> 11.5555555555556 | R58: =+AVERAGEIFS(R2C10:R1001C10,R2C8:R1001C8,R5C15,R2C9:R1001C9,R6C,R2C5:R1001C5,RC14) -> 5.16666666666667 | S58: =+AVERAGEIFS(R2C10:R1001C10,R2C8:R1001C8,R5C15,R2C9:R1001C9,R6C,R2C5:R1001C5,RC14) -> 6.42857142857143 | T58: =+AVERAGEIFS(R2C10:R1001C10,R2C8:R1001C8,R5C15,R2C9:R1001C9,R6C,R2C5:R1001C5,RC14) -> 12.2857142857143 | U58: =+AVERAGEIFS(R2C10:R1001C10,R2C8:R1001C8,R5C15,R2C9:R1001C9,R6C,R2C5:R1001C5,RC14) -> 16 | V58: =+AVERAGEIFS(R2C10:R1001C10,R2C8:R1001C8,R5C15,R2C9:R1001C9,R6C,R2C5:R1001C5,RC14) -> 7.85714285714286 | W58: =+AVERAGEIFS(R2C10:R1001C10,R2C8:R1001C8,R5C15,R2C9:R1001C9,R6C,R2C5:R1001C5,RC14) -> 6.66666666666667 | X58: =+AVERAGEIFS(R2C10:R1001C10,R2C8:R1001C8,R5C15,R2C9:R1001C9,R6C,R2C5:R1001C5,RC14) -> 21.2 | Y58: =+AVERAGEIFS(R2C10:R1001C10,R2C8:R1001C8,R5C15,R2C9:R1001C9,R6C,R2C5:R1001C5,RC14) -> 8 | Z58: =+AVERAGEIFS(R2C10:R1001C10,R2C8:R1001C8,R5C15,R2C9:R1001C9,R6C,R2C5:R1001C5,RC14) -> 10.4444444444444 | AA58: =+AVERAGEIFS(R2C10:R1001C10,R2C8:R1001C8,R5C27,R2C9:R1001C9,R6C,R2C5:R1001C5,RC14) -> 6.75 | AB58: =+AVERAGEIFS(R2C10:R1001C10,R2C8:R1001C8,R5C27,R2C9:R1001C9,R6C,R2C5:R1001C5,RC14) -> 6.66666666666667 | AC58: =+AVERAGEIFS(R2C10:R1001C10,R2C8:R1001C8,R5C27,R2C9:R1001C9,R6C,R2C5:R1001C5,RC14) -> 21.5555555555556 | AD58: =+AVERAGEIFS(R2C10:R1001C10,R2C8:R1001C8,R5C27,R2C9:R1001C9,R6C,R2C5:R1001C5,RC14) -> 11.25 | AE58: =+AVERAGEIFS(R2C10:R1001C10,R2C8:R1001C8,R5C27,R2C9:R1001C9,R6C,R2C5:R1001C5,RC14) -> 13.25 | AF58: =+AVERAGEIFS(R2C10:R1001C10,R2C8:R1001C8,R5C27,R2C9:R1001C9,R6C,R2C5:R1001C5,RC14) -> 8.71428571428571 | AG58: =+AVERAGEIFS(R2C10:R1001C10,R2C8:R1001C8,R5C27,R2C9:R1001C9,R6C,R2C5:R1001C5,RC14) -> 3.28571428571429 | AH58: =+AVERAGEIFS(R2C10:R1001C10,R2C8:R1001C8,R5C27,R2C9:R1001C9,R6C,R2C5:R1001C5,RC14) -> 15.4285714285714 | AI58: =+AVERAGEIFS(R2C10:R1001C10,R2C8:R1001C8,R5C27,R2C9:R1001C9,R6C,R2C5:R1001C5,RC14) -> 16.9 | AJ58: =+AVERAGEIFS(R2C10:R1001C10,R2C8:R1001C8,R5C27,R2C9:R1001C9,R6C,R2C5:R1001C5,RC14) -> 7.2 | AK58: =+AVERAGEIFS(R2C10:R1001C10,R2C8:R1001C8,R5C27,R2C9:R1001C9,R6C,R2C5:R1001C5,RC14) -> 0.5 | AL58: =+AVERAGEIFS(R2C10:R1001C10,R2C8:R1001C8,R5C27,R2C9:R1001C9,R6C,R2C5:R1001C5,RC14) -> 11.1666666666667 | AN58: =+AVERAGEIFS(R2C10:R1001C10,R2C5:R1001C5,RC14) -> 11.2405063291139
A59: Dept3-5867 | B59: Bajo | C59: 41318 | D59: 41333 | E59: =+LEFT(RC[-4],5) -> Dept3 | F59: =+VLOOKUP(RC[-4],Enunciado!R3C6:R5C7,2,0)+RC[-3] -> 41348 | G59: =+IF(RC[-1]>=RC[-3],"ON TIME","OUT OF TIME") -> ON TIME | H59: =+YEAR(RC[-5]) -> 2013 | I59: =+MONTH(RC[-6]) -> 2 | J59: =+RC[-6]-RC[-7] -> 15 | K59: =+IF(RC[-4]="OUT of TIME",RC[-1]-VLOOKUP(RC[-9],Enunciado!R3C6:R5C7,2,0),"") ->  | N59: Dept5 | O59: =+AVERAGEIFS(R2C10:R1001C10,R2C8:R1001C8,R5C15,R2C9:R1001C9,R6C,R2C5:R1001C5,RC14) -> 10.4 | P59: =+AVERAGEIFS(R2C10:R1001C10,R2C8:R1001C8,R5C15,R2C9:R1001C9,R6C,R2C5:R1001C5,RC14) -> 12 | Q59: =+AVERAGEIFS(R2C10:R1001C10,R2C8:R1001C8,R5C15,R2C9:R1001C9,R6C,R2C5:R1001C5,RC14) -> 19.3333333333333 | R59: =+AVERAGEIFS(R2C10:R1001C10,R2C8:R1001C8,R5C15,R2C9:R1001C9,R6C,R2C5:R1001C5,RC14) -> 9.5 | S59: =+AVERAGEIFS(R2C10:R1001C10,R2C8:R1001C8,R5C15,R2C9:R1001C9,R6C,R2C5:R1001C5,RC14) -> 5 | T59: =+AVERAGEIFS(R2C10:R1001C10,R2C8:R1001C8,R5C15,R2C9:R1001C9,R6C,R2C5:R1001C5,RC14) -> 20.125 | U59: =+AVERAGEIFS(R2C10:R1001C10,R2C8:R1001C8,R5C15,R2C9:R1001C9,R6C,R2C5:R1001C5,RC14) -> 5.25 | V59: =+AVERAGEIFS(R2C10:R1001C10,R2C8:R1001C8,R5C15,R2C9:R1001C9,R6C,R2C5:R1001C5,RC14) -> 14.1666666666667 | W59: =+AVERAGEIFS(R2C10:R1001C10,R2C8:R1001C8,R5C15,R2C9:R1001C9,R6C,R2C5:R1001C5,RC14) -> 5.2 | X59: =+AVERAGEIFS(R2C10:R1001C10,R2C8:R1001C8,R5C15,R2C9:R1001C9,R6C,R2C5:R1001C5,RC14) -> 26.5 | Y59: =+AVERAGEIFS(R2C10:R1001C10,R2C8:R1001C8,R5C15,R2C9:R1001C9,R6C,R2C5:R1001C5,RC14) -> 18.7777777777778 | Z59: =+AVERAGEIFS(R2C10:R1001C10,R2C8:R1001C8,R5C15,R2C9:R1001C9,R6C,R2C5:R1001C5,RC14) -> 9.6 | AA59: =+AVERAGEIFS(R2C10:R1001C10,R2C8:R1001C8,R5C27,R2C9:R1001C9,R6C,R2C5:R1001C5,RC14) -> 17 | AB59: =+AVERAGEIFS(R2C10:R1001C10,R2C8:R1001C8,R5C27,R2C9:R1001C9,R6C,R2C5:R1001C5,RC14) -> 17 | AC59: =+AVERAGEIFS(R2C10:R1001C10,R2C8:R1001C8,R5C27,R2C9:R1001C9,R6C,R2C5:R1001C5,RC14) -> 17 | AD59: =+AVERAGEIFS(R2C10:R1001C10,R2C8:R1001C8,R5C27,R2C9:R1001C9,R6C,R2C5:R1001C5,RC14) -> 13.8571428571429 | AE59: =+AVERAGEIFS(R2C10:R1001C10,R2C8:R1001C8,R5C27,R2C9:R1001C9,R6C,R2C5:R1001C5,RC14) -> 7.22222222222222 | AF59: =+AVERAGEIFS(R2C10:R1001C10,R2C8:R1001C8,R5C27,R2C9:R1001C9,R6C,R2C5:R1001C5,RC14) -> 16.2857142857143 | AG59: =+AVERAGEIFS(R2C10:R1001C10,R2C8:R1001C8,R5C27,R2C9:R1001C9,R6C,R2C5:R1001C5,RC14) -> 12.7 | AH59: =+AVERAGEIFS(R2C10:R1001C10,R2C8:R1001C8,R5C27,R2C9:R1001C9,R6C,R2C5:R1001C5,RC14) -> 15.9090909090909 | AI59: =+AVERAGEIFS(R2C10:R1001C10,R2C8:R1001C8,R5C27,R2C9:R1001C9,R6C,R2C5:R1001C5,RC14) -> 14.1538461538462 | AJ59: =+AVERAGEIFS(R2C10:R1001C10,R2C8:R1001C8,R5C27,R2C9:R1001C9,R6C,R2C5:R1001C5,RC14) -> 9.88888888888889 | AK59: =+AVERAGEIFS(R2C10:R1001C10,R2C8:R1001C8,R5C27,R2C9:R1001C9,R6C,R2C5:R1001C5,RC14) -> 10.1666666666667 | AL59: =+AVERAGEIFS(R2C10:R1001C10,R2C8:R1001C8,R5C27,R2C9:R1001C9,R6C,R2C5:R1001C5,RC14) -> 8.8 | AN59: =+AVERAGEIFS(R2C10:R1001C10,R2C5:R1001C5,RC14) -> 12.858024691358
A60: Dept2-20776 | B60: Medio | C60: 41072 | D60: 41088 | E60: =+LEFT(RC[-4],5) -> Dept2 | F60: =+VLOOKUP(RC[-4],Enunciado!R3C6:R5C7,2,0)+RC[-3] -> 41087 | G60: =+IF(RC[-1]>=RC[-3],"ON TIME","OUT OF TIME") -> OUT OF TIME | H60: =+YEAR(RC[-5]) -> 2012 | I60: =+MONTH(RC[-6]) -> 6 | J60: =+RC[-6]-RC[-7] -> 16 | K60: =+IF(RC[-4]="OUT of TIME",RC[-1]-VLOOKUP(RC[-9],Enunciado!R3C6:R5C7,2,0),"") -> 1 | N60: Dept6 | O60: =+AVERAGEIFS(R2C10:R1001C10,R2C8:R1001C8,R5C15,R2C9:R1001C9,R6C,R2C5:R1001C5,RC14) -> 15.6 | P60: =+AVERAGEIFS(R2C10:R1001C10,R2C8:R1001C8,R5C15,R2C9:R1001C9,R6C,R2C5:R1001C5,RC14) -> 6.5 | Q60: =+AVERAGEIFS(R2C10:R1001C10,R2C8:R1001C8,R5C15,R2C9:R1001C9,R6C,R2C5:R1001C5,RC14) -> 2 | R60: =+AVERAGEIFS(R2C10:R1001C10,R2C8:R1001C8,R5C15,R2C9:R1001C9,R6C,R2C5:R1001C5,RC14) -> 9.28571428571429 | S60: =+AVERAGEIFS(R2C10:R1001C10,R2C8:R1001C8,R5C15,R2C9:R1001C9,R6C,R2C5:R1001C5,RC14) -> 10.5454545454545 | T60: =+AVERAGEIFS(R2C10:R1001C10,R2C8:R1001C8,R5C15,R2C9:R1001C9,R6C,R2C5:R1001C5,RC14) -> 13.125 | U60: =+AVERAGEIFS(R2C10:R1001C10,R2C8:R1001C8,R5C15,R2C9:R1001C9,R6C,R2C5:R1001C5,RC14) -> 11.875 | V60: =+AVERAGEIFS(R2C10:R1001C10,R2C8:R1001C8,R5C15,R2C9:R1001C9,R6C,R2C5:R1001C5,RC14) -> 13.1428571428571 | W60: =+AVERAGEIFS(R2C10:R1001C10,R2C8:R1001C8,R5C15,R2C9:R1001C9,R6C,R2C5:R1001C5,RC14) -> 7.57142857142857 | X60: =+AVERAGEIFS(R2C10:R1001C10,R2C8:R1001C8,R5C15,R2C9:R1001C9,R6C,R2C5:R1001C5,RC14) -> 12.4285714285714 | Y60: =+AVERAGEIFS(R2C10:R1001C10,R2C8:R1001C8,R5C15,R2C9:R1001C9,R6C,R2C5:R1001C5,RC14) -> 11.4 | Z60: =+AVERAGEIFS(R2C10:R1001C10,R2C8:R1001C8,R5C15,R2C9:R1001C9,R6C,R2C5:R1001C5,RC14) -> 22.5 | AA60: =+AVERAGEIFS(R2C10:R1001C10,R2C8:R1001C8,R5C27,R2C9:R1001C9,R6C,R2C5:R1001C5,RC14) -> 11.4 | AB60: =+AVERAGEIFS(R2C10:R1001C10,R2C8:R1001C8,R5C27,R2C9:R1001C9,R6C,R2C5:R1001C5,RC14) -> 6.25 | AC60: =+AVERAGEIFS(R2C10:R1001C10,R2C8:R1001C8,R5C27,R2C9:R1001C9,R6C,R2C5:R1001C5,RC14) -> 12.1428571428571 | AD60: =+AVERAGEIFS(R2C10:R1001C10,R2C8:R1001C8,R5C27,R2C9:R1001C9,R6C,R2C5:R1001C5,RC14) -> 12.5 | AE60: =+AVERAGEIFS(R2C10:R1001C10,R2C8:R1001C8,R5C27,R2C9:R1001C9,R6C,R2C5:R1001C5,RC14) -> 15 | AF60: =+AVERAGEIFS(R2C10:R1001C10,R2C8:R1001C8,R5C27,R2C9:R1001C9,R6C,R2C5:R1001C5,RC14) -> 11.3333333333333 | AG60: =+AVERAGEIFS(R2C10:R1001C10,R2C8:R1001C8,R5C27,R2C9:R1001C9,R6C,R2C5:R1001C5,RC14) -> 11.25 | AH60: =+AVERAGEIFS(R2C10:R1001C10,R2C8:R1001C8,R5C27,R2C9:R1001C9,R6C,R2C5:R1001C5,RC14) -> 9.55555555555556 | AI60: =+AVERAGEIFS(R2C10:R1001C10,R2C8:R1001C8,R5C27,R2C9:R1001C9,R6C,R2C5:R1001C5,RC14) -> 20.1111111111111 | AJ60: =+AVERAGEIFS(R2C10:R1001C10,R2C8:R1001C8,R5C27,R2C9:R1001C9,R6C,R2C5:R1001C5,RC14) -> 8 | AK60: =+AVERAGEIFS(R2C10:R1001C10,R2C8:R1001C8,R5C27,R2C9:R1001C9,R6C,R2C5:R1001C5,RC14) -> 7.1 | AL60: =+AVERAGEIFS(R2C10:R1001C10,R2C8:R1001C8,R5C27,R2C9:R1001C9,R6C,R2C5:R1001C5,RC14) -> 12.4285714285714 | AN60: =+AVERAGEIFS(R2C10:R1001C10,R2C5:R1001C5,RC14) -> 11.6049382716049
A61: Dept3-8662 | B61: Alto | C61: 41209 | D61: 41210 | E61: =+LEFT(RC[-4],5) -> Dept3 | F61: =+VLOOKUP(RC[-4],Enunciado!R3C6:R5C7,2,0)+RC[-3] -> 41214 | G61: =+IF(RC[-1]>=RC[-3],"ON TIME","OUT OF TIME") -> ON TIME | H61: =+YEAR(RC[-5]) -> 2012 | I61: =+MONTH(RC[-6]) -> 10 | J61: =+RC[-6]-RC[-7] -> 1 | K61: =+IF(RC[-4]="OUT of TIME",RC[-1]-VLOOKUP(RC[-9],Enunciado!R3C6:R5C7,2,0),"") -> 
A62: Dept1-4550 | B62: Medio | C62: 41437 | D62: 41437 | E62: =+LEFT(RC[-4],5) -> Dept1 | F62: =+VLOOKUP(RC[-4],Enunciado!R3C6:R5C7,2,0)+RC[-3] -> 41452 | G62: =+IF(RC[-1]>=RC[-3],"ON TIME","OUT OF TIME") -> ON TIME | H62: =+YEAR(RC[-5]) -> 2013 | I62: =+MONTH(RC[-6]) -> 6 | J62: =+RC[-6]-RC[-7] -> 0 | K62: =+IF(RC[-4]="OUT of TIME",RC[-1]-VLOOKUP(RC[-9],Enunciado!R3C6:R5C7,2,0),"") -> 
A63: Dept5-4351 | B63: Bajo | C63: 41284 | D63: 41284 | E63: =+LEFT(RC[-4],5) -> Dept5 | F63: =+VLOOKUP(RC[-4],Enunciado!R3C6:R5C7,2,0)+RC[-3] -> 41314 | G63: =+IF(RC[-1]>=RC[-3],"ON TIME","OUT OF TIME") -> ON TIME | H63: =+YEAR(RC[-5]) -> 2013 | I63: =+MONTH(RC[-6]) -> 1 | J63: =+RC[-6]-RC[-7] -> 0 | K63: =+IF(RC[-4]="OUT of TIME",RC[-1]-VLOOKUP(RC[-9],Enunciado!R3C6:R5C7,2,0),"") -> 
A64: Dept2-13529 | B64: Medio | C64: 41115 | D64: 41117 | E64: =+LEFT(RC[-4],5) -> Dept2 | F64: =+VLOOKUP(RC[-4],Enunciado!R3C6:R5C7,2,0)+RC[-3] -> 41130 | G64: =+IF(RC[-1]>=RC[-3],"ON TIME","OUT OF TIME") -> ON TIME | H64: =+YEAR(RC[-5]) -> 2012 | I64: =+MONTH(RC[-6]) -> 7 | J64: =+RC[-6]-RC[-7] -> 2 | K64: =+IF(RC[-4]="OUT of TIME",RC[-1]-VLOOKUP(RC[-9],Enunciado!R3C6:R5C7,2,0),"") -> 
A65: Dept3-17206 | B65: Medio | C65: 41441 | D65: 41451 | E65: =+LEFT(RC[-4],5) -> Dept3 | F65: =+VLOOKUP(RC[-4],Enunciado!R3C6:R5C7,2,0)+RC[-3] -> 41456 | G65: =+IF(RC[-1]>=RC[-3],"ON TIME","OUT OF TIME") -> ON TIME | H65: =+YEAR(RC[-5]) -> 2013 | I65: =+MONTH(RC[-6]) -> 6 | J65: =+RC[-6]-RC[-7] -> 10 | K65: =+IF(RC[-4]="OUT of TIME",RC[-1]-VLOOKUP(RC[-9],Enunciado!R3C6:R5C7,2,0),"") -> 
A66: Dept4-6195 | B66: Alto | C66: 41636 | D66: 41640 | E66: =+LEFT(RC[-4],5) -> Dept4 | F66: =+VLOOKUP(RC[-4],Enunciado!R3C6:R5C7,2,0)+RC[-3] -> 41641 | G66: =+IF(RC[-1]>=RC[-3],"ON TIME","OUT OF TIME") -> ON TIME | H66: =+YEAR(RC[-5]) -> 2013 | I66: =+MONTH(RC[-6]) -> 12 | J66: =+RC[-6]-RC[-7] -> 4 | K66: =+IF(RC[-4]="OUT of TIME",RC[-1]-VLOOKUP(RC[-9],Enunciado!R3C6:R5C7,2,0),"") -> 
A67: Dept5-29683 | B67: Bajo | C67: 41069 | D67: 41072 | E67: =+LEFT(RC[-4],5) -> Dept5 | F67: =+VLOOKUP(RC[-4],Enunciado!R3C6:R5C7,2,0)+RC[-3] -> 41099 | G67: =+IF(RC[-1]>=RC[-3],"ON TIME","OUT OF TIME") -> ON TIME | H67: =+YEAR(RC[-5]) -> 2012 | I67: =+MONTH(RC[-6]) -> 6 | J67: =+RC[-6]-RC[-7] -> 3 | K67: =+IF(RC[-4]="OUT of TIME",RC[-1]-VLOOKUP(RC[-9],Enunciado!R3C6:R5C7,2,0),"") -> 
A68: Dept5-3312 | B68: Bajo | C68: 41522 | D68: 41529 | E68: =+LEFT(RC[-4],5) -> Dept5 | F68: =+VLOOKUP(RC[-4],Enunciado!R3C6:R5C7,2,0)+RC[-3] -> 41552 | G68: =+IF(RC[-1]>=RC[-3],"ON TIME","OUT OF TIME") -> ON TIME | H68: =+YEAR(RC[-5]) -> 2013 | I68: =+MONTH(RC[-6]) -> 9 | J68: =+RC[-6]-RC[-7] -> 7 | K68: =+IF(RC[-4]="OUT of TIME",RC[-1]-VLOOKUP(RC[-9],Enunciado!R3C6:R5C7,2,0),"") -> 
A69: Dept2-24239 | B69: Bajo | C69: 41613 | D69: 41616 | E69: =+LEFT(RC[-4],5) -> Dept2 | F69: =+VLOOKUP(RC[-4],Enunciado!R3C6:R5C7,2,0)+RC[-3] -> 41643 | G69: =+IF(RC[-1]>=RC[-3],"ON TIME","OUT OF TIME") -> ON TIME | H69: =+YEAR(RC[-5]) -> 2013 | I69: =+MONTH(RC[-6]) -> 12 | J69: =+RC[-6]-RC[-7] -> 3 | K69: =+IF(RC[-4]="OUT of TIME",RC[-1]-VLOOKUP(RC[-9],Enunciado!R3C6:R5C7,2,0),"") -> 
A70: Dept5-19763 | B70: Medio | C70: 41515 | D70: 41541 | E70: =+LEFT(RC[-4],5) -> Dept5 | F70: =+VLOOKUP(RC[-4],Enunciado!R3C6:R5C7,2,0)+RC[-3] -> 41530 | G70: =+IF(RC[-1]>=RC[-3],"ON TIME","OUT OF TIME") -> OUT OF TIME | H70: =+YEAR(RC[-5]) -> 2013 | I70: =+MONTH(RC[-6]) -> 8 | J70: =+RC[-6]-RC[-7] -> 26 | K70: =+IF(RC[-4]="OUT of TIME",RC[-1]-VLOOKUP(RC[-9],Enunciado!R3C6:R5C7,2,0),"") -> 11
A71: Dept4-22456 | B71: Medio | C71: 41392 | D71: 41395 | E71: =+LEFT(RC[-4],5) -> Dept4 | F71: =+VLOOKUP(RC[-4],Enunciado!R3C6:R5C7,2,0)+RC[-3] -> 41407 | G71: =+IF(RC[-1]>=RC[-3],"ON TIME","OUT OF TIME") -> ON TIME | H71: =+YEAR(RC[-5]) -> 2013 | I71: =+MONTH(RC[-6]) -> 4 | J71: =+RC[-6]-RC[-7] -> 3 | K71: =+IF(RC[-4]="OUT of TIME",RC[-1]-VLOOKUP(RC[-9],Enunciado!R3C6:R5C7,2,0),"") -> 
A72: Dept2-11042 | B72: Bajo | C72: 41529 | D72: 41538 | E72: =+LEFT(RC[-4],5) -> Dept2 | F72: =+VLOOKUP(RC[-4],Enunciado!R3C6:R5C7,2,0)+RC[-3] -> 41559 | G72: =+IF(RC[-1]>=RC[-3],"ON TIME","OUT OF TIME") -> ON TIME | H72: =+YEAR(RC[-5]) -> 2013 | I72: =+MONTH(RC[-6]) -> 9 | J72: =+RC[-6]-RC[-7] -> 9 | K72: =+IF(RC[-4]="OUT of TIME",RC[-1]-VLOOKUP(RC[-9],Enunciado!R3C6:R5C7,2,0),"") -> 
A73: Dept4-8042 | B73: Medio | C73: 41237 | D73: 41241 | E73: =+LEFT(RC[-4],5) -> Dept4 | F73: =+VLOOKUP(RC[-4],Enunciado!R3C6:R5C7,2,0)+RC[-3] -> 41252 | G73: =+IF(RC[-1]>=RC[-3],"ON TIME","OUT OF TIME") -> ON TIME | H73: =+YEAR(RC[-5]) -> 2012 | I73: =+MONTH(RC[-6]) -> 11 | J73: =+RC[-6]-RC[-7] -> 4 | K73: =+IF(RC[-4]="OUT of TIME",RC[-1]-VLOOKUP(RC[-9],Enunciado!R3C6:R5C7,2,0),"") -> 
A74: Dept3-2202 | B74: Medio | C74: 41081 | D74: 41081 | E74: =+LEFT(RC[-4],5) -> Dept3 | F74: =+VLOOKUP(RC[-4],Enunciado!R3C6:R5C7,2,0)+RC[-3] -> 41096 | G74: =+IF(RC[-1]>=RC[-3],"ON TIME","OUT OF TIME") -> ON TIME | H74: =+YEAR(RC[-5]) -> 2012 | I74: =+MONTH(RC[-6]) -> 6 | J74: =+RC[-6]-RC[-7] -> 0 | K74: =+IF(RC[-4]="OUT of TIME",RC[-1]-VLOOKUP(RC[-9],Enunciado!R3C6:R5C7,2,0),"") -> 
A75: Dept6-17744 | B75: Medio | C75: 40958 | D75: 40961 | E75: =+LEFT(RC[-4],5) -> Dept6 | F75: =+VLOOKUP(RC[-4],Enunciado!R3C6:R5C7,2,0)+RC[-3] -> 40973 | G75: =+IF(RC[-1]>=RC[-3],"ON TIME","OUT OF TIME") -> ON TIME | H75: =+YEAR(RC[-5]) -> 2012 | I75: =+MONTH(RC[-6]) -> 2 | J75: =+RC[-6]-RC[-7] -> 3 | K75: =+IF(RC[-4]="OUT of TIME",RC[-1]-VLOOKUP(RC[-9],Enunciado!R3C6:R5C7,2,0),"") -> 
A76: Dept1-4578 | B76: Medio | C76: 41472 | D76: 41476 | E76: =+LEFT(RC[-4],5) -> Dept1 | F76: =+VLOOKUP(RC[-4],Enunciado!R3C6:R5C7,2,0)+RC[-3] -> 41487 | G76: =+IF(RC[-1]>=RC[-3],"ON TIME","OUT OF TIME") -> ON TIME | H76: =+YEAR(RC[-5]) -> 2013 | I76: =+MONTH(RC[-6]) -> 7 | J76: =+RC[-6]-RC[-7] -> 4 | K76: =+IF(RC[-4]="OUT of TIME",RC[-1]-VLOOKUP(RC[-9],Enunciado!R3C6:R5C7,2,0),"") -> 
A77: Dept3-1770 | B77: Bajo | C77: 41474 | D77: 41479 | E77: =+LEFT(RC[-4],5) -> Dept3 | F77: =+VLOOKUP(RC[-4],Enunciado!R3C6:R5C7,2,0)+RC[-3] -> 41504 | G77: =+IF(RC[-1]>=RC[-3],"ON TIME","OUT OF TIME") -> ON TIME | H77: =+YEAR(RC[-5]) -> 2013 | I77: =+MONTH(RC[-6]) -> 7 | J77: =+RC[-6]-RC[-7] -> 5 | K77: =+IF(RC[-4]="OUT of TIME",RC[-1]-VLOOKUP(RC[-9],Enunciado!R3C6:R5C7,2,0),"") -> 
A78: Dept6-23103 | B78: Medio | C78: 41165 | D78: 41202 | E78: =+LEFT(RC[-4],5) -> Dept6 | F78: =+VLOOKUP(RC[-4],Enunciado!R3C6:R5C7,2,0)+RC[-3] -> 41180 | G78: =+IF(RC[-1]>=RC[-3],"ON TIME","OUT OF TIME") -> OUT OF TIME | H78: =+YEAR(RC[-5]) -> 2012 | I78: =+MONTH(RC[-6]) -> 9 | J78: =+RC[-6]-RC[-7] -> 37 | K78: =+IF(RC[-4]="OUT of TIME",RC[-1]-VLOOKUP(RC[-9],Enunciado!R3C6:R5C7,2,0),"") -> 22
A79: Dept2-22758 | B79: Alto | C79: 41587 | D79: 41590 | E79: =+LEFT(RC[-4],5) -> Dept2 | F79: =+VLOOKUP(RC[-4],Enunciado!R3C6:R5C7,2,0)+RC[-3] -> 41592 | G79: =+IF(RC[-1]>=RC[-3],"ON TIME","OUT OF TIME") -> ON TIME | H79: =+YEAR(RC[-5]) -> 2013 | I79: =+MONTH(RC[-6]) -> 11 | J79: =+RC[-6]-RC[-7] -> 3 | K79: =+IF(RC[-4]="OUT of TIME",RC[-1]-VLOOKUP(RC[-9],Enunciado!R3C6:R5C7,2,0),"") -> 
A80: Dept5-14505 | B80: Bajo | C80: 41597 | D80: 41597 | E80: =+LEFT(RC[-4],5) -> Dept5 | F80: =+VLOOKUP(RC[-4],Enunciado!R3C6:R5C7,2,0)+RC[-3] -> 41627 | G80: =+IF(RC[-1]>=RC[-3],"ON TIME","OUT OF TIME") -> ON TIME | H80: =+YEAR(RC[-5]) -> 2013 | I80: =+MONTH(RC[-6]) -> 11 | J80: =+RC[-6]-RC[-7] -> 0 | K80: =+IF(RC[-4]="OUT of TIME",RC[-1]-VLOOKUP(RC[-9],Enunciado!R3C6:R5C7,2,0),"") -> 
A81: Dept1-19858 | B81: Alto | C81: 40920 | D81: 40921 | E81: =+LEFT(RC[-4],5) -> Dept1 | F81: =+VLOOKUP(RC[-4],Enunciado!R3C6:R5C7,2,0)+RC[-3] -> 40925 | G81: =+IF(RC[-1]>=RC[-3],"ON TIME","OUT OF TIME") -> ON TIME | H81: =+YEAR(RC[-5]) -> 2012 | I81: =+MONTH(RC[-6]) -> 1 | J81: =+RC[-6]-RC[-7] -> 1 | K81: =+IF(RC[-4]="OUT of TIME",RC[-1]-VLOOKUP(RC[-9],Enunciado!R3C6:R5C7,2,0),"") -> 
A82: Dept4-24237 | B82: Bajo | C82: 40946 | D82: 40960 | E82: =+LEFT(RC[-4],5) -> Dept4 | F82: =+VLOOKUP(RC[-4],Enunciado!R3C6:R5C7,2,0)+RC[-3] -> 40976 | G82: =+IF(RC[-1]>=RC[-3],"ON TIME","OUT OF TIME") -> ON TIME | H82: =+YEAR(RC[-5]) -> 2012 | I82: =+MONTH(RC[-6]) -> 2 | J82: =+RC[-6]-RC[-7] -> 14 | K82: =+IF(RC[-4]="OUT of TIME",RC[-1]-VLOOKUP(RC[-9],Enunciado!R3C6:R5C7,2,0),"") -> 
A83: Dept4-22006 | B83: Medio | C83: 41183 | D83: 41185 | E83: =+LEFT(RC[-4],5) -> Dept4 | F83: =+VLOOKUP(RC[-4],Enunciado!R3C6:R5C7,2,0)+RC[-3] -> 41198 | G83: =+IF(RC[-1]>=RC[-3],"ON TIME","OUT OF TIME") -> ON TIME | H83: =+YEAR(RC[-5]) -> 2012 | I83: =+MONTH(RC[-6]) -> 10 | J83: =+RC[-6]-RC[-7] -> 2 | K83: =+IF(RC[-4]="OUT of TIME",RC[-1]-VLOOKUP(RC[-9],Enunciado!R3C6:R5C7,2,0),"") -> 
A84: Dept5-17412 | B84: Medio | C84: 41450 | D84: 41451 | E84: =+LEFT(RC[-4],5) -> Dept5 | F84: =+VLOOKUP(RC[-4],Enunciado!R3C6:R5C7,2,0)+RC[-3] -> 41465 | G84: =+IF(RC[-1]>=RC[-3],"ON TIME","OUT OF TIME") -> ON TIME | H84: =+YEAR(RC[-5]) -> 2013 | I84: =+MONTH(RC[-6]) -> 6 | J84: =+RC[-6]-RC[-7] -> 1 | K84: =+IF(RC[-4]="OUT of TIME",RC[-1]-VLOOKUP(RC[-9],Enunciado!R3C6:R5C7,2,0),"") -> 
A85: Dept5-21926 | B85: Bajo | C85: 40932 | D85: 40934 | E85: =+LEFT(RC[-4],5) -> Dept5 | F85: =+VLOOKUP(RC[-4],Enunciado!R3C6:R5C7,2,0)+RC[-3] -> 40962 | G85: =+IF(RC[-1]>=RC[-3],"ON TIME","OUT OF TIME") -> ON TIME | H85: =+YEAR(RC[-5]) -> 2012 | I85: =+MONTH(RC[-6]) -> 1 | J85: =+RC[-6]-RC[-7] -> 2 | K85: =+IF(RC[-4]="OUT of TIME",RC[-1]-VLOOKUP(RC[-9],Enunciado!R3C6:R5C7,2,0),"") -> 
A86: Dept5-6585 | B86: Bajo | C86: 41133 | D86: 41137 | E86: =+LEFT(RC[-4],5) -> Dept5 | F86: =+VLOOKUP(RC[-4],Enunciado!R3C6:R5C7,2,0)+RC[-3] -> 41163 | G86: =+IF(RC[-1]>=RC[-3],"ON TIME","OUT OF TIME") -> ON TIME | H86: =+YEAR(RC[-5]) -> 2012 | I86: =+MONTH(RC[-6]) -> 8 | J86: =+RC[-6]-RC[-7] -> 4 | K86: =+IF(RC[-4]="OUT of TIME",RC[-1]-VLOOKUP(RC[-9],Enunciado!R3C6:R5C7,2,0),"") -> 
A87: Dept5-19947 | B87: Alto | C87: 41387 | D87: 41402 | E87: =+LEFT(RC[-4],5) -> Dept5 | F87: =+VLOOKUP(RC[-4],Enunciado!R3C6:R5C7,2,0)+RC[-3] -> 41392 | G87: =+IF(RC[-1]>=RC[-3],"ON TIME","OUT OF TIME") -> OUT OF TIME | H87: =+YEAR(RC[-5]) -> 2013 | I87: =+MONTH(RC[-6]) -> 4 | J87: =+RC[-6]-RC[-7] -> 15 | K87: =+IF(RC[-4]="OUT of TIME",RC[-1]-VLOOKUP(RC[-9],Enunciado!R3C6:R5C7,2,0),"") -> 10
A88: Dept6-6676 | B88: Medio | C88: 41046 | D88: 41062 | E88: =+LEFT(RC[-4],5) -> Dept6 | F88: =+VLOOKUP(RC[-4],Enunciado!R3C6:R5C7,2,0)+RC[-3] -> 41061 | G88: =+IF(RC[-1]>=RC[-3],"ON TIME","OUT OF TIME") -> OUT OF TIME | H88: =+YEAR(RC[-5]) -> 2012 | I88: =+MONTH(RC[-6]) -> 5 | J88: =+RC[-6]-RC[-7] -> 16 | K88: =+IF(RC[-4]="OUT of TIME",RC[-1]-VLOOKUP(RC[-9],Enunciado!R3C6:R5C7,2,0),"") -> 1
A89: Dept4-4184 | B89: Bajo | C89: 41598 | D89: 41599 | E89: =+LEFT(RC[-4],5) -> Dept4 | F89: =+VLOOKUP(RC[-4],Enunciado!R3C6:R5C7,2,0)+RC[-3] -> 41628 | G89: =+IF(RC[-1]>=RC[-3],"ON TIME","OUT OF TIME") -> ON TIME | H89: =+YEAR(RC[-5]) -> 2013 | I89: =+MONTH(RC[-6]) -> 11 | J89: =+RC[-6]-RC[-7] -> 1 | K89: =+IF(RC[-4]="OUT of TIME",RC[-1]-VLOOKUP(RC[-9],Enunciado!R3C6:R5C7,2,0),"") -> 
A90: Dept2-14865 | B90: Alto | C90: 41053 | D90: 41061 | E90: =+LEFT(RC[-4],5) -> Dept2 | F90: =+VLOOKUP(RC[-4],Enunciado!R3C6:R5C7,2,0)+RC[-3] -> 41058 | G90: =+IF(RC[-1]>=RC[-3],"ON TIME","OUT OF TIME") -> OUT OF TIME | H90: =+YEAR(RC[-5]) -> 2012 | I90: =+MONTH(RC[-6]) -> 5 | J90: =+RC[-6]-RC[-7] -> 8 | K90: =+IF(RC[-4]="OUT of TIME",RC[-1]-VLOOKUP(RC[-9],Enunciado!R3C6:R5C7,2,0),"") -> 3
A91: Dept5-1146 | B91: Medio | C91: 41056 | D91: 41061 | E91: =+LEFT(RC[-4],5) -> Dept5 | F91: =+VLOOKUP(RC[-4],Enunciado!R3C6:R5C7,2,0)+RC[-3] -> 41071 | G91: =+IF(RC[-1]>=RC[-3],"ON TIME","OUT OF TIME") -> ON TIME | H91: =+YEAR(RC[-5]) -> 2012 | I91: =+MONTH(RC[-6]) -> 5 | J91: =+RC[-6]-RC[-7] -> 5 | K91: =+IF(RC[-4]="OUT of TIME",RC[-1]-VLOOKUP(RC[-9],Enunciado!R3C6:R5C7,2,0),"") -> 
A92: Dept5-10744 | B92: Medio | C92: 41448 | D92: 41479 | E92: =+LEFT(RC[-4],5) -> Dept5 | F92: =+VLOOKUP(RC[-4],Enunciado!R3C6:R5C7,2,0)+RC[-3] -> 41463 | G92: =+IF(RC[-1]>=RC[-3],"ON TIME","OUT OF TIME") -> OUT OF TIME | H92: =+YEAR(RC[-5]) -> 2013 | I92: =+MONTH(RC[-6]) -> 6 | J92: =+RC[-6]-RC[-7] -> 31 | K92: =+IF(RC[-4]="OUT of TIME",RC[-1]-VLOOKUP(RC[-9],Enunciado!R3C6:R5C7,2,0),"") -> 16
A93: Dept2-8342 | B93: Bajo | C93: 41394 | D93: 41396 | E93: =+LEFT(RC[-4],5) -> Dept2 | F93: =+VLOOKUP(RC[-4],Enunciado!R3C6:R5C7,2,0)+RC[-3] -> 41424 | G93: =+IF(RC[-1]>=RC[-3],"ON TIME","OUT OF TIME") -> ON TIME | H93: =+YEAR(RC[-5]) -> 2013 | I93: =+MONTH(RC[-6]) -> 4 | J93: =+RC[-6]-RC[-7] -> 2 | K93: =+IF(RC[-4]="OUT of TIME",RC[-1]-VLOOKUP(RC[-9],Enunciado!R3C6:R5C7,2,0),"") -> 
A94: Dept6-9570 | B94: Alto | C94: 41064 | D94: 41068 | E94: =+LEFT(RC[-4],5) -> Dept6 | F94: =+VLOOKUP(RC[-4],Enunciado!R3C6:R5C7,2,0)+RC[-3] -> 41069 | G94: =+IF(RC[-1]>=RC[-3],"ON TIME","OUT OF TIME") -> ON TIME | H94: =+YEAR(RC[-5]) -> 2012 | I94: =+MONTH(RC[-6]) -> 6 | J94: =+RC[-6]-RC[-7] -> 4 | K94: =+IF(RC[-4]="OUT of TIME",RC[-1]-VLOOKUP(RC[-9],Enunciado!R3C6:R5C7,2,0),"") -> 
A95: Dept3-17934 | B95: Bajo | C95: 41184 | D95: 41190 | E95: =+LEFT(RC[-4],5) -> Dept3 | F95: =+VLOOKUP(RC[-4],Enunciado!R3C6:R5C7,2,0)+RC[-3] -> 41214 | G95: =+IF(RC[-1]>=RC[-3],"ON TIME","OUT OF TIME") -> ON TIME | H95: =+YEAR(RC[-5]) -> 2012 | I95: =+MONTH(RC[-6]) -> 10 | J95: =+RC[-6]-RC[-7] -> 6 | K95: =+IF(RC[-4]="OUT of TIME",RC[-1]-VLOOKUP(RC[-9],Enunciado!R3C6:R5C7,2,0),"") -> 
A96: Dept4-28909 | B96: Alto | C96: 41138 | D96: 41139 | E96: =+LEFT(RC[-4],5) -> Dept4 | F96: =+VLOOKUP(RC[-4],Enunciado!R3C6:R5C7,2,0)+RC[-3] -> 41143 | G96: =+IF(RC[-1]>=RC[-3],"ON TIME","OUT OF TIME") -> ON TIME | H96: =+YEAR(RC[-5]) -> 2012 | I96: =+MONTH(RC[-6]) -> 8 | J96: =+RC[-6]-RC[-7] -> 1 | K96: =+IF(RC[-4]="OUT of TIME",RC[-1]-VLOOKUP(RC[-9],Enunciado!R3C6:R5C7,2,0),"") -> 
A97: Dept2-18015 | B97: Medio | C97: 41541 | D97: 41559 | E97: =+LEFT(RC[-4],5) -> Dept2 | F97: =+VLOOKUP(RC[-4],Enunciado!R3C6:R5C7,2,0)+RC[-3] -> 41556 | G97: =+IF(RC[-1]>=RC[-3],"ON TIME","OUT OF TIME") -> OUT OF TIME | H97: =+YEAR(RC[-5]) -> 2013 | I97: =+MONTH(RC[-6]) -> 9 | J97: =+RC[-6]-RC[-7] -> 18 | K97: =+IF(RC[-4]="OUT of TIME",RC[-1]-VLOOKUP(RC[-9],Enunciado!R3C6:R5C7,2,0),"") -> 3
A98: Dept2-16492 | B98: Medio | C98: 41016 | D98: 41024 | E98: =+LEFT(RC[-4],5) -> Dept2 | F98: =+VLOOKUP(RC[-4],Enunciado!R3C6:R5C7,2,0)+RC[-3] -> 41031 | G98: =+IF(RC[-1]>=RC[-3],"ON TIME","OUT OF TIME") -> ON TIME | H98: =+YEAR(RC[-5]) -> 2012 | I98: =+MONTH(RC[-6]) -> 4 | J98: =+RC[-6]-RC[-7] -> 8 | K98: =+IF(RC[-4]="OUT of TIME",RC[-1]-VLOOKUP(RC[-9],Enunciado!R3C6:R5C7,2,0),"") -> 
A99: Dept6-15561 | B99: Medio | C99: 40922 | D99: 40963 | E99: =+LEFT(RC[-4],5) -> Dept6 | F99: =+VLOOKUP(RC[-4],Enunciado!R3C6:R5C7,2,0)+RC[-3] -> 40937 | G99: =+IF(RC[-1]>=RC[-3],"ON TIME","OUT OF TIME") -> OUT OF TIME | H99: =+YEAR(RC[-5]) -> 2012 | I99: =+MONTH(RC[-6]) -> 1 | J99: =+RC[-6]-RC[-7] -> 41 | K99: =+IF(RC[-4]="OUT of TIME",RC[-1]-VLOOKUP(RC[-9],Enunciado!R3C6:R5C7,2,0),"") -> 26
A100: Dept4-4597 | B100: Bajo | C100: 41610 | D100: 41646 | E100: =+LEFT(RC[-4],5) -> Dept4 | F100: =+VLOOKUP(RC[-4],Enunciado!R3C6:R5C7,2,0)+RC[-3] -> 41640 | G100: =+IF(RC[-1]>=RC[-3],"ON TIME","OUT OF TIME") -> OUT OF TIME | H100: =+YEAR(RC[-5]) -> 2013 | I100: =+MONTH(RC[-6]) -> 12 | J100: =+RC[-6]-RC[-7] -> 36 | K100: =+IF(RC[-4]="OUT of TIME",RC[-1]-VLOOKUP(RC[-9],Enunciado!R3C6:R5C7,2,0),"") -> 6
A101: Dept3-12627 | B101: Medio | C101: 40990 | D101: 41006 | E101: =+LEFT(RC[-4],5) -> Dept3 | F101: =+VLOOKUP(RC[-4],Enunciado!R3C6:R5C7,2,0)+RC[-3] -> 41005 | G101: =+IF(RC[-1]>=RC[-3],"ON TIME","OUT OF TIME") -> OUT OF TIME | H101: =+YEAR(RC[-5]) -> 2012 | I101: =+MONTH(RC[-6]) -> 3 | J101: =+RC[-6]-RC[-7] -> 16 | K101: =+IF(RC[-4]="OUT of TIME",RC[-1]-VLOOKUP(RC[-9],Enunciado!R3C6:R5C7,2,0),"") -> 1
A102: Dept1-13762 | B102: Alto | C102: 41205 | D102: 41213 | E102: =+LEFT(RC[-4],5) -> Dept1 | F102: =+VLOOKUP(RC[-4],Enunciado!R3C6:R5C7,2,0)+RC[-3] -> 41210 | G102: =+IF(RC[-1]>=RC[-3],"ON TIME","OUT OF TIME") -> OUT OF TIME | H102: =+YEAR(RC[-5]) -> 2012 | I102: =+MONTH(RC[-6]) -> 10 | J102: =+RC[-6]-RC[-7] -> 8 | K102: =+IF(RC[-4]="OUT of TIME",RC[-1]-VLOOKUP(RC[-9],Enunciado!R3C6:R5C7,2,0),"") -> 3
A103: Dept6-24851 | B103: Medio | C103: 41043 | D103: 41051 | E103: =+LEFT(RC[-4],5) -> Dept6 | F103: =+VLOOKUP(RC[-4],Enunciado!R3C6:R5C7,2,0)+RC[-3] -> 41058 | G103: =+IF(RC[-1]>=RC[-3],"ON TIME","OUT OF TIME") -> ON TIME | H103: =+YEAR(RC[-5]) -> 2012 | I103: =+MONTH(RC[-6]) -> 5 | J103: =+RC[-6]-RC[-7] -> 8 | K103: =+IF(RC[-4]="OUT of TIME",RC[-1]-VLOOKUP(RC[-9],Enunciado!R3C6:R5C7,2,0),"") -> 
A104: Dept4-16148 | B104: Medio | C104: 40977 | D104: 40987 | E104: =+LEFT(RC[-4],5) -> Dept4 | F104: =+VLOOKUP(RC[-4],Enunciado!R3C6:R5C7,2,0)+RC[-3] -> 40992 | G104: =+IF(RC[-1]>=RC[-3],"ON TIME","OUT OF TIME") -> ON TIME | H104: =+YEAR(RC[-5]) -> 2012 | I104: =+MONTH(RC[-6]) -> 3 | J104: =+RC[-6]-RC[-7] -> 10 | K104: =+IF(RC[-4]="OUT of TIME",RC[-1]-VLOOKUP(RC[-9],Enunciado!R3C6:R5C7,2,0),"") -> 
A105: Dept2-28819 | B105: Bajo | C105: 41049 | D105: 41076 | E105: =+LEFT(RC[-4],5) -> Dept2 | F105: =+VLOOKUP(RC[-4],Enunciado!R3C6:R5C7,2,0)+RC[-3] -> 41079 | G105: =+IF(RC[-1]>=RC[-3],"ON TIME","OUT OF TIME") -> ON TIME | H105: =+YEAR(RC[-5]) -> 2012 | I105: =+MONTH(RC[-6]) -> 5 | J105: =+RC[-6]-RC[-7] -> 27 | K105: =+IF(RC[-4]="OUT of TIME",RC[-1]-VLOOKUP(RC[-9],Enunciado!R3C6:R5C7,2,0),"") -> 
A106: Dept2-6370 | B106: Medio | C106: 41352 | D106: 41362 | E106: =+LEFT(RC[-4],5) -> Dept2 | F106: =+VLOOKUP(RC[-4],Enunciado!R3C6:R5C7,2,0)+RC[-3] -> 41367 | G106: =+IF(RC[-1]>=RC[-3],"ON TIME","OUT OF TIME") -> ON TIME | H106: =+YEAR(RC[-5]) -> 2013 | I106: =+MONTH(RC[-6]) -> 3 | J106: =+RC[-6]-RC[-7] -> 10 | K106: =+IF(RC[-4]="OUT of TIME",RC[-1]-VLOOKUP(RC[-9],Enunciado!R3C6:R5C7,2,0),"") -> 
A107: Dept4-2363 | B107: Bajo | C107: 41032 | D107: 41035 | E107: =+LEFT(RC[-4],5) -> Dept4 | F107: =+VLOOKUP(RC[-4],Enunciado!R3C6:R5C7,2,0)+RC[-3] -> 41062 | G107: =+IF(RC[-1]>=RC[-3],"ON TIME","OUT OF TIME") -> ON TIME | H107: =+YEAR(RC[-5]) -> 2012 | I107: =+MONTH(RC[-6]) -> 5 | J107: =+RC[-6]-RC[-7] -> 3 | K107: =+IF(RC[-4]="OUT of TIME",RC[-1]-VLOOKUP(RC[-9],Enunciado!R3C6:R5C7,2,0),"") -> 
A108: Dept2-25092 | B108: Alto | C108: 41045 | D108: 41058 | E108: =+LEFT(RC[-4],5) -> Dept2 | F108: =+VLOOKUP(RC[-4],Enunciado!R3C6:R5C7,2,0)+RC[-3] -> 41050 | G108: =+IF(RC[-1]>=RC[-3],"ON TIME","OUT OF TIME") -> OUT OF TIME | H108: =+YEAR(RC[-5]) -> 2012 | I108: =+MONTH(RC[-6]) -> 5 | J108: =+RC[-6]-RC[-7] -> 13 | K108: =+IF(RC[-4]="OUT of TIME",RC[-1]-VLOOKUP(RC[-9],Enunciado!R3C6:R5C7,2,0),"") -> 8
A109: Dept1-19354 | B109: Alto | C109: 41550 | D109: 41568 | E109: =+LEFT(RC[-4],5) -> Dept1 | F109: =+VLOOKUP(RC[-4],Enunciado!R3C6:R5C7,2,0)+RC[-3] -> 41555 | G109: =+IF(RC[-1]>=RC[-3],"ON TIME","OUT OF TIME") -> OUT OF TIME | H109: =+YEAR(RC[-5]) -> 2013 | I109: =+MONTH(RC[-6]) -> 10 | J109: =+RC[-6]-RC[-7] -> 18 | K109: =+IF(RC[-4]="OUT of TIME",RC[-1]-VLOOKUP(RC[-9],Enunciado!R3C6:R5C7,2,0),"") -> 13
A110: Dept4-18209 | B110: Medio | C110: 41234 | D110: 41235 | E110: =+LEFT(RC[-4],5) -> Dept4 | F110: =+VLOOKUP(RC[-4],Enunciado!R3C6:R5C7,2,0)+RC[-3] -> 41249 | G110: =+IF(RC[-1]>=RC[-3],"ON TIME","OUT OF TIME") -> ON TIME | H110: =+YEAR(RC[-5]) -> 2012 | I110: =+MONTH(RC[-6]) -> 11 | J110: =+RC[-6]-RC[-7] -> 1 | K110: =+IF(RC[-4]="OUT of TIME",RC[-1]-VLOOKUP(RC[-9],Enunciado!R3C6:R5C7,2,0),"") -> 
A111: Dept5-8044 | B111: Alto | C111: 41254 | D111: 41256 | E111: =+LEFT(RC[-4],5) -> Dept5 | F111: =+VLOOKUP(RC[-4],Enunciado!R3C6:R5C7,2,0)+RC[-3] -> 41259 | G111: =+IF(RC[-1]>=RC[-3],"ON TIME","OUT OF TIME") -> ON TIME | H111: =+YEAR(RC[-5]) -> 2012 | I111: =+MONTH(RC[-6]) -> 12 | J111: =+RC[-6]-RC[-7] -> 2 | K111: =+IF(RC[-4]="OUT of TIME",RC[-1]-VLOOKUP(RC[-9],Enunciado!R3C6:R5C7,2,0),"") -> 
A112: Dept2-21935 | B112: Alto | C112: 41467 | D112: 41469 | E112: =+LEFT(RC[-4],5) -> Dept2 | F112: =+VLOOKUP(RC[-4],Enunciado!R3C6:R5C7,2,0)+RC[-3] -> 41472 | G112: =+IF(RC[-1]>=RC[-3],"ON TIME","OUT OF TIME") -> ON TIME | H112: =+YEAR(RC[-5]) -> 2013 | I112: =+MONTH(RC[-6]) -> 7 | J112: =+RC[-6]-RC[-7] -> 2 | K112: =+IF(RC[-4]="OUT of TIME",RC[-1]-VLOOKUP(RC[-9],Enunciado!R3C6:R5C7,2,0),"") -> 
A113: Dept4-19528 | B113: Medio | C113: 41402 | D113: 41419 | E113: =+LEFT(RC[-4],5) -> Dept4 | F113: =+VLOOKUP(RC[-4],Enunciado!R3C6:R5C7,2,0)+RC[-3] -> 41417 | G113: =+IF(RC[-1]>=RC[-3],"ON TIME","OUT OF TIME") -> OUT OF TIME | H113: =+YEAR(RC[-5]) -> 2013 | I113: =+MONTH(RC[-6]) -> 5 | J113: =+RC[-6]-RC[-7] -> 17 | K113: =+IF(RC[-4]="OUT of TIME",RC[-1]-VLOOKUP(RC[-9],Enunciado!R3C6:R5C7,2,0),"") -> 2
A114: Dept3-1594 | B114: Medio | C114: 40944 | D114: 40947 | E114: =+LEFT(RC[-4],5) -> Dept3 | F114: =+VLOOKUP(RC[-4],Enunciado!R3C6:R5C7,2,0)+RC[-3] -> 40959 | G114: =+IF(RC[-1]>=RC[-3],"ON TIME","OUT OF TIME") -> ON TIME | H114: =+YEAR(RC[-5]) -> 2012 | I114: =+MONTH(RC[-6]) -> 2 | J114: =+RC[-6]-RC[-7] -> 3 | K114: =+IF(RC[-4]="OUT of TIME",RC[-1]-VLOOKUP(RC[-9],Enunciado!R3C6:R5C7,2,0),"") -> 
A115: Dept6-387 | B115: Medio | C115: 41109 | D115: 41146 | E115: =+LEFT(RC[-4],5) -> Dept6 | F115: =+VLOOKUP(RC[-4],Enunciado!R3C6:R5C7,2,0)+RC[-3] -> 41124 | G115: =+IF(RC[-1]>=RC[-3],"ON TIME","OUT OF TIME") -> OUT OF TIME | H115: =+YEAR(RC[-5]) -> 2012 | I115: =+MONTH(RC[-6]) -> 7 | J115: =+RC[-6]-RC[-7] -> 37 | K115: =+IF(RC[-4]="OUT of TIME",RC[-1]-VLOOKUP(RC[-9],Enunciado!R3C6:R5C7,2,0),"") -> 22
A116: Dept2-29438 | B116: Bajo | C116: 41217 | D116: 41232 | E116: =+LEFT(RC[-4],5) -> Dept2 | F116: =+VLOOKUP(RC[-4],Enunciado!R3C6:R5C7,2,0)+RC[-3] -> 41247 | G116: =+IF(RC[-1]>=RC[-3],"ON TIME","OUT OF TIME") -> ON TIME | H116: =+YEAR(RC[-5]) -> 2012 | I116: =+MONTH(RC[-6]) -> 11 | J116: =+RC[-6]-RC[-7] -> 15 | K116: =+IF(RC[-4]="OUT of TIME",RC[-1]-VLOOKUP(RC[-9],Enunciado!R3C6:R5C7,2,0),"") -> 
A117: Dept4-21069 | B117: Bajo | C117: 41473 | D117: 41477 | E117: =+LEFT(RC[-4],5) -> Dept4 | F117: =+VLOOKUP(RC[-4],Enunciado!R3C6:R5C7,2,0)+RC[-3] -> 41503 | G117: =+IF(RC[-1]>=RC[-3],"ON TIME","OUT OF TIME") -> ON TIME | H117: =+YEAR(RC[-5]) -> 2013 | I117: =+MONTH(RC[-6]) -> 7 | J117: =+RC[-6]-RC[-7] -> 4 | K117: =+IF(RC[-4]="OUT of TIME",RC[-1]-VLOOKUP(RC[-9],Enunciado!R3C6:R5C7,2,0),"") -> 
A118: Dept2-24302 | B118: Alto | C118: 41134 | D118: 41138 | E118: =+LEFT(RC[-4],5) -> Dept2 | F118: =+VLOOKUP(RC[-4],Enunciado!R3C6:R5C7,2,0)+RC[-3] -> 41139 | G118: =+IF(RC[-1]>=RC[-3],"ON TIME","OUT OF TIME") -> ON TIME | H118: =+YEAR(RC[-5]) -> 2012 | I118: =+MONTH(RC[-6]) -> 8 | J118: =+RC[-6]-RC[-7] -> 4 | K118: =+IF(RC[-4]="OUT of TIME",RC[-1]-VLOOKUP(RC[-9],Enunciado!R3C6:R5C7,2,0),"") -> 
A119: Dept1-29083 | B119: Bajo | C119: 41170 | D119: 41170 | E119: =+LEFT(RC[-4],5) -> Dept1 | F119: =+VLOOKUP(RC[-4],Enunciado!R3C6:R5C7,2,0)+RC[-3] -> 41200 | G119: =+IF(RC[-1]>=RC[-3],"ON TIME","OUT OF TIME") -> ON TIME | H119: =+YEAR(RC[-5]) -> 2012 | I119: =+MONTH(RC[-6]) -> 9 | J119: =+RC[-6]-RC[-7] -> 0 | K119: =+IF(RC[-4]="OUT of TIME",RC[-1]-VLOOKUP(RC[-9],Enunciado!R3C6:R5C7,2,0),"") -> 
A120: Dept5-23402 | B120: Medio | C120: 41339 | D120: 41357 | E120: =+LEFT(RC[-4],5) -> Dept5 | F120: =+VLOOKUP(RC[-4],Enunciado!R3C6:R5C7,2,0)+RC[-3] -> 41354 | G120: =+IF(RC[-1]>=RC[-3],"ON TIME","OUT OF TIME") -> OUT OF TIME | H120: =+YEAR(RC[-5]) -> 2013 | I120: =+MONTH(RC[-6]) -> 3 | J120: =+RC[-6]-RC[-7] -> 18 | K120: =+IF(RC[-4]="OUT of TIME",RC[-1]-VLOOKUP(RC[-9],Enunciado!R3C6:R5C7,2,0),"") -> 3
A121: Dept3-3548 | B121: Bajo | C121: 41559 | D121: 41561 | E121: =+LEFT(RC[-4],5) -> Dept3 | F121: =+VLOOKUP(RC[-4],Enunciado!R3C6:R5C7,2,0)+RC[-3] -> 41589 | G121: =+IF(RC[-1]>=RC[-3],"ON TIME","OUT OF TIME") -> ON TIME | H121: =+YEAR(RC[-5]) -> 2013 | I121: =+MONTH(RC[-6]) -> 10 | J121: =+RC[-6]-RC[-7] -> 2 | K121: =+IF(RC[-4]="OUT of TIME",RC[-1]-VLOOKUP(RC[-9],Enunciado!R3C6:R5C7,2,0),"") -> 
A122: Dept3-14101 | B122: Bajo | C122: 41439 | D122: 41439 | E122: =+LEFT(RC[-4],5) -> Dept3 | F122: =+VLOOKUP(RC[-4],Enunciado!R3C6:R5C7,2,0)+RC[-3] -> 41469 | G122: =+IF(RC[-1]>=RC[-3],"ON TIME","OUT OF TIME") -> ON TIME | H122: =+YEAR(RC[-5]) -> 2013 | I122: =+MONTH(RC[-6]) -> 6 | J122: =+RC[-6]-RC[-7] -> 0 | K122: =+IF(RC[-4]="OUT of TIME",RC[-1]-VLOOKUP(RC[-9],Enunciado!R3C6:R5C7,2,0),"") -> 
A123: Dept2-15183 | B123: Medio | C123: 41045 | D123: 41048 | E123: =+LEFT(RC[-4],5) -> Dept2 | F123: =+VLOOKUP(RC[-4],Enunciado!R3C6:R5C7,2,0)+RC[-3] -> 41060 | G123: =+IF(RC[-1]>=RC[-3],"ON TIME","OUT OF TIME") -> ON TIME | H123: =+YEAR(RC[-5]) -> 2012 | I123: =+MONTH(RC[-6]) -> 5 | J123: =+RC[-6]-RC[-7] -> 3 | K123: =+IF(RC[-4]="OUT of TIME",RC[-1]-VLOOKUP(RC[-9],Enunciado!R3C6:R5C7,2,0),"") -> 
A124: Dept4-10943 | B124: Medio | C124: 41452 | D124: 41463 | E124: =+LEFT(RC[-4],5) -> Dept4 | F124: =+VLOOKUP(RC[-4],Enunciado!R3C6:R5C7,2,0)+RC[-3] -> 41467 | G124: =+IF(RC[-1]>=RC[-3],"ON TIME","OUT OF TIME") -> ON TIME | H124: =+YEAR(RC[-5]) -> 2013 | I124: =+MONTH(RC[-6]) -> 6 | J124: =+RC[-6]-RC[-7] -> 11 | K124: =+IF(RC[-4]="OUT of TIME",RC[-1]-VLOOKUP(RC[-9],Enunciado!R3C6:R5C7,2,0),"") -> 
A125: Dept1-3284 | B125: Bajo | C125: 41039 | D125: 41041 | E125: =+LEFT(RC[-4],5) -> Dept1 | F125: =+VLOOKUP(RC[-4],Enunciado!R3C6:R5C7,2,0)+RC[-3] -> 41069 | G125: =+IF(RC[-1]>=RC[-3],"ON TIME","OUT OF TIME") -> ON TIME | H125: =+YEAR(RC[-5]) -> 2012 | I125: =+MONTH(RC[-6]) -> 5 | J125: =+RC[-6]-RC[-7] -> 2 | K125: =+IF(RC[-4]="OUT of TIME",RC[-1]-VLOOKUP(RC[-9],Enunciado!R3C6:R5C7,2,0),"") -> 
A126: Dept1-20778 | B126: Alto | C126: 41563 | D126: 41600 | E126: =+LEFT(RC[-4],5) -> Dept1 | F126: =+VLOOKUP(RC[-4],Enunciado!R3C6:R5C7,2,0)+RC[-3] -> 41568 | G126: =+IF(RC[-1]>=RC[-3],"ON TIME","OUT OF TIME") -> OUT OF TIME | H126: =+YEAR(RC[-5]) -> 2013 | I126: =+MONTH(RC[-6]) -> 10 | J126: =+RC[-6]-RC[-7] -> 37 | K126: =+IF(RC[-4]="OUT of TIME",RC[-1]-VLOOKUP(RC[-9],Enunciado!R3C6:R5C7,2,0),"") -> 32
A127: Dept1-18752 | B127: Bajo | C127: 41161 | D127: 41179 | E127: =+LEFT(RC[-4],5) -> Dept1 | F127: =+VLOOKUP(RC[-4],Enunciado!R3C6:R5C7,2,0)+RC[-3] -> 41191 | G127: =+IF(RC[-1]>=RC[-3],"ON TIME","OUT OF TIME") -> ON TIME | H127: =+YEAR(RC[-5]) -> 2012 | I127: =+MONTH(RC[-6]) -> 9 | J127: =+RC[-6]-RC[-7] -> 18 | K127: =+IF(RC[-4]="OUT of TIME",RC[-1]-VLOOKUP(RC[-9],Enunciado!R3C6:R5C7,2,0),"") -> 
A128: Dept2-26278 | B128: Bajo | C128: 41499 | D128: 41503 | E128: =+LEFT(RC[-4],5) -> Dept2 | F128: =+VLOOKUP(RC[-4],Enunciado!R3C6:R5C7,2,0)+RC[-3] -> 41529 | G128: =+IF(RC[-1]>=RC[-3],"ON TIME","OUT OF TIME") -> ON TIME | H128: =+YEAR(RC[-5]) -> 2013 | I128: =+MONTH(RC[-6]) -> 8 | J128: =+RC[-6]-RC[-7] -> 4 | K128: =+IF(RC[-4]="OUT of TIME",RC[-1]-VLOOKUP(RC[-9],Enunciado!R3C6:R5C7,2,0),"") -> 
A129: Dept1-9749 | B129: Bajo | C129: 41267 | D129: 41281 | E129: =+LEFT(RC[-4],5) -> Dept1 | F129: =+VLOOKUP(RC[-4],Enunciado!R3C6:R5C7,2,0)+RC[-3] -> 41297 | G129: =+IF(RC[-1]>=RC[-3],"ON TIME","OUT OF TIME") -> ON TIME | H129: =+YEAR(RC[-5]) -> 2012 | I129: =+MONTH(RC[-6]) -> 12 | J129: =+RC[-6]-RC[-7] -> 14 | K129: =+IF(RC[-4]="OUT of TIME",RC[-1]-VLOOKUP(RC[-9],Enunciado!R3C6:R5C7,2,0),"") -> 
A130: Dept6-5674 | B130: Medio | C130: 41582 | D130: 41584 | E130: =+LEFT(RC[-4],5) -> Dept6 | F130: =+VLOOKUP(RC[-4],Enunciado!R3C6:R5C7,2,0)+RC[-3] -> 41597 | G130: =+IF(RC[-1]>=RC[-3],"ON TIME","OUT OF TIME") -> ON TIME | H130: =+YEAR(RC[-5]) -> 2013 | I130: =+MONTH(RC[-6]) -> 11 | J130: =+RC[-6]-RC[-7] -> 2 | K130: =+IF(RC[-4]="OUT of TIME",RC[-1]-VLOOKUP(RC[-9],Enunciado!R3C6:R5C7,2,0),"") -> 
A131: Dept4-4023 | B131: Alto | C131: 41284 | D131: 41289 | E131: =+LEFT(RC[-4],5) -> Dept4 | F131: =+VLOOKUP(RC[-4],Enunciado!R3C6:R5C7,2,0)+RC[-3] -> 41289 | G131: =+IF(RC[-1]>=RC[-3],"ON TIME","OUT OF TIME") -> ON TIME | H131: =+YEAR(RC[-5]) -> 2013 | I131: =+MONTH(RC[-6]) -> 1 | J131: =+RC[-6]-RC[-7] -> 5 | K131: =+IF(RC[-4]="OUT of TIME",RC[-1]-VLOOKUP(RC[-9],Enunciado!R3C6:R5C7,2,0),"") -> 
A132: Dept6-14005 | B132: Alto | C132: 41611 | D132: 41651 | E132: =+LEFT(RC[-4],5) -> Dept6 | F132: =+VLOOKUP(RC[-4],Enunciado!R3C6:R5C7,2,0)+RC[-3] -> 41616 | G132: =+IF(RC[-1]>=RC[-3],"ON TIME","OUT OF TIME") -> OUT OF TIME | H132: =+YEAR(RC[-5]) -> 2013 | I132: =+MONTH(RC[-6]) -> 12 | J132: =+RC[-6]-RC[-7] -> 40 | K132: =+IF(RC[-4]="OUT of TIME",RC[-1]-VLOOKUP(RC[-9],Enunciado!R3C6:R5C7,2,0),"") -> 35
A133: Dept3-19479 | B133: Alto | C133: 40941 | D133: 40961 | E133: =+LEFT(RC[-4],5) -> Dept3 | F133: =+VLOOKUP(RC[-4],Enunciado!R3C6:R5C7,2,0)+RC[-3] -> 40946 | G133: =+IF(RC[-1]>=RC[-3],"ON TIME","OUT OF TIME") -> OUT OF TIME | H133: =+YEAR(RC[-5]) -> 2012 | I133: =+MONTH(RC[-6]) -> 2 | J133: =+RC[-6]-RC[-7] -> 20 | K133: =+IF(RC[-4]="OUT of TIME",RC[-1]-VLOOKUP(RC[-9],Enunciado!R3C6:R5C7,2,0),"") -> 15
A134: Dept4-28714 | B134: Bajo | C134: 41224 | D134: 41237 | E134: =+LEFT(RC[-4],5) -> Dept4 | F134: =+VLOOKUP(RC[-4],Enunciado!R3C6:R5C7,2,0)+RC[-3] -> 41254 | G134: =+IF(RC[-1]>=RC[-3],"ON TIME","OUT OF TIME") -> ON TIME | H134: =+YEAR(RC[-5]) -> 2012 | I134: =+MONTH(RC[-6]) -> 11 | J134: =+RC[-6]-RC[-7] -> 13 | K134: =+IF(RC[-4]="OUT of TIME",RC[-1]-VLOOKUP(RC[-9],Enunciado!R3C6:R5C7,2,0),"") -> 
A135: Dept6-2057 | B135: Bajo | C135: 41607 | D135: 41615 | E135: =+LEFT(RC[-4],5) -> Dept6 | F135: =+VLOOKUP(RC[-4],Enunciado!R3C6:R5C7,2,0)+RC[-3] -> 41637 | G135: =+IF(RC[-1]>=RC[-3],"ON TIME","OUT OF TIME") -> ON TIME | H135: =+YEAR(RC[-5]) -> 2013 | I135: =+MONTH(RC[-6]) -> 11 | J135: =+RC[-6]-RC[-7] -> 8 | K135: =+IF(RC[-4]="OUT of TIME",RC[-1]-VLOOKUP(RC[-9],Enunciado!R3C6:R5C7,2,0),"") -> 
A136: Dept2-19884 | B136: Medio | C136: 41090 | D136: 41096 | E136: =+LEFT(RC[-4],5) -> Dept2 | F136: =+VLOOKUP(RC[-4],Enunciado!R3C6:R5C7,2,0)+RC[-3] -> 41105 | G136: =+IF(RC[-1]>=RC[-3],"ON TIME","OUT OF TIME") -> ON TIME | H136: =+YEAR(RC[-5]) -> 2012 | I136: =+MONTH(RC[-6]) -> 6 | J136: =+RC[-6]-RC[-7] -> 6 | K136: =+IF(RC[-4]="OUT of TIME",RC[-1]-VLOOKUP(RC[-9],Enunciado!R3C6:R5C7,2,0),"") -> 
A137: Dept1-7474 | B137: Medio | C137: 41585 | D137: 41591 | E137: =+LEFT(RC[-4],5) -> Dept1 | F137: =+VLOOKUP(RC[-4],Enunciado!R3C6:R5C7,2,0)+RC[-3] -> 41600 | G137: =+IF(RC[-1]>=RC[-3],"ON TIME","OUT OF TIME") -> ON TIME | H137: =+YEAR(RC[-5]) -> 2013 | I137: =+MONTH(RC[-6]) -> 11 | J137: =+RC[-6]-RC[-7] -> 6 | K137: =+IF(RC[-4]="OUT of TIME",RC[-1]-VLOOKUP(RC[-9],Enunciado!R3C6:R5C7,2,0),"") -> 
A138: Dept6-22939 | B138: Medio | C138: 41113 | D138: 41113 | E138: =+LEFT(RC[-4],5) -> Dept6 | F138: =+VLOOKUP(RC[-4],Enunciado!R3C6:R5C7,2,0)+RC[-3] -> 41128 | G138: =+IF(RC[-1]>=RC[-3],"ON TIME","OUT OF TIME") -> ON TIME | H138: =+YEAR(RC[-5]) -> 2012 | I138: =+MONTH(RC[-6]) -> 7 | J138: =+RC[-6]-RC[-7] -> 0 | K138: =+IF(RC[-4]="OUT of TIME",RC[-1]-VLOOKUP(RC[-9],Enunciado!R3C6:R5C7,2,0),"") -> 
A139: Dept1-10896 | B139: Medio | C139: 41221 | D139: 41223 | E139: =+LEFT(RC[-4],5) -> Dept1 | F139: =+VLOOKUP(RC[-4],Enunciado!R3C6:R5C7,2,0)+RC[-3] -> 41236 | G139: =+IF(RC[-1]>=RC[-3],"ON TIME","OUT OF TIME") -> ON TIME | H139: =+YEAR(RC[-5]) -> 2012 | I139: =+MONTH(RC[-6]) -> 11 | J139: =+RC[-6]-RC[-7] -> 2 | K139: =+IF(RC[-4]="OUT of TIME",RC[-1]-VLOOKUP(RC[-9],Enunciado!R3C6:R5C7,2,0),"") -> 
A140: Dept1-29118 | B140: Bajo | C140: 41315 | D140: 41342 | E140: =+LEFT(RC[-4],5) -> Dept1 | F140: =+VLOOKUP(RC[-4],Enunciado!R3C6:R5C7,2,0)+RC[-3] -> 41345 | G140: =+IF(RC[-1]>=RC[-3],"ON TIME","OUT OF TIME") -> ON TIME | H140: =+YEAR(RC[-5]) -> 2013 | I140: =+MONTH(RC[-6]) -> 2 | J140: =+RC[-6]-RC[-7] -> 27 | K140: =+IF(RC[-4]="OUT of TIME",RC[-1]-VLOOKUP(RC[-9],Enunciado!R3C6:R5C7,2,0),"") -> 
A141: Dept5-26106 | B141: Alto | C141: 41523 | D141: 41542 | E141: =+LEFT(RC[-4],5) -> Dept5 | F141: =+VLOOKUP(RC[-4],Enunciado!R3C6:R5C7,2,0)+RC[-3] -> 41528 | G141: =+IF(RC[-1]>=RC[-3],"ON TIME","OUT OF TIME") -> OUT OF TIME | H141: =+YEAR(RC[-5]) -> 2013 | I141: =+MONTH(RC[-6]) -> 9 | J141: =+RC[-6]-RC[-7] -> 19 | K141: =+IF(RC[-4]="OUT of TIME",RC[-1]-VLOOKUP(RC[-9],Enunciado!R3C6:R5C7,2,0),"") -> 14
A142: Dept4-26535 | B142: Medio | C142: 41560 | D142: 41561 | E142: =+LEFT(RC[-4],5) -> Dept4 | F142: =+VLOOKUP(RC[-4],Enunciado!R3C6:R5C7,2,0)+RC[-3] -> 41575 | G142: =+IF(RC[-1]>=RC[-3],"ON TIME","OUT OF TIME") -> ON TIME | H142: =+YEAR(RC[-5]) -> 2013 | I142: =+MONTH(RC[-6]) -> 10 | J142: =+RC[-6]-RC[-7] -> 1 | K142: =+IF(RC[-4]="OUT of TIME",RC[-1]-VLOOKUP(RC[-9],Enunciado!R3C6:R5C7,2,0),"") -> 
A143: Dept1-23221 | B143: Medio | C143: 41606 | D143: 41611 | E143: =+LEFT(RC[-4],5) -> Dept1 | F143: =+VLOOKUP(RC[-4],Enunciado!R3C6:R5C7,2,0)+RC[-3] -> 41621 | G143: =+IF(RC[-1]>=RC[-3],"ON TIME","OUT OF TIME") -> ON TIME | H143: =+YEAR(RC[-5]) -> 2013 | I143: =+MONTH(RC[-6]) -> 11 | J143: =+RC[-6]-RC[-7] -> 5 | K143: =+IF(RC[-4]="OUT of TIME",RC[-1]-VLOOKUP(RC[-9],Enunciado!R3C6:R5C7,2,0),"") -> 
A144: Dept3-22135 | B144: Medio | C144: 41033 | D144: 41035 | E144: =+LEFT(RC[-4],5) -> Dept3 | F144: =+VLOOKUP(RC[-4],Enunciado!R3C6:R5C7,2,0)+RC[-3] -> 41048 | G144: =+IF(RC[-1]>=RC[-3],"ON TIME","OUT OF TIME") -> ON TIME | H144: =+YEAR(RC[-5]) -> 2012 | I144: =+MONTH(RC[-6]) -> 5 | J144: =+RC[-6]-RC[-7] -> 2 | K144: =+IF(RC[-4]="OUT of TIME",RC[-1]-VLOOKUP(RC[-9],Enunciado!R3C6:R5C7,2,0),"") -> 
A145: Dept6-11530 | B145: Alto | C145: 41259 | D145: 41278 | E145: =+LEFT(RC[-4],5) -> Dept6 | F145: =+VLOOKUP(RC[-4],Enunciado!R3C6:R5C7,2,0)+RC[-3] -> 41264 | G145: =+IF(RC[-1]>=RC[-3],"ON TIME","OUT OF TIME") -> OUT OF TIME | H145: =+YEAR(RC[-5]) -> 2012 | I145: =+MONTH(RC[-6]) -> 12 | J145: =+RC[-6]-RC[-7] -> 19 | K145: =+IF(RC[-4]="OUT of TIME",RC[-1]-VLOOKUP(RC[-9],Enunciado!R3C6:R5C7,2,0),"") -> 14
A146: Dept2-2366 | B146: Alto | C146: 41596 | D146: 41614 | E146: =+LEFT(RC[-4],5) -> Dept2 | F146: =+VLOOKUP(RC[-4],Enunciado!R3C6:R5C7,2,0)+RC[-3] -> 41601 | G146: =+IF(RC[-1]>=RC[-3],"ON TIME","OUT OF TIME") -> OUT OF TIME | H146: =+YEAR(RC[-5]) -> 2013 | I146: =+MONTH(RC[-6]) -> 11 | J146: =+RC[-6]-RC[-7] -> 18 | K146: =+IF(RC[-4]="OUT of TIME",RC[-1]-VLOOKUP(RC[-9],Enunciado!R3C6:R5C7,2,0),"") -> 13
A147: Dept6-1509 | B147: Alto | C147: 41094 | D147: 41102 | E147: =+LEFT(RC[-4],5) -> Dept6 | F147: =+VLOOKUP(RC[-4],Enunciado!R3C6:R5C7,2,0)+RC[-3] -> 41099 | G147: =+IF(RC[-1]>=RC[-3],"ON TIME","OUT OF TIME") -> OUT OF TIME | H147: =+YEAR(RC[-5]) -> 2012 | I147: =+MONTH(RC[-6]) -> 7 | J147: =+RC[-6]-RC[-7] -> 8 | K147: =+IF(RC[-4]="OUT of TIME",RC[-1]-VLOOKUP(RC[-9],Enunciado!R3C6:R5C7,2,0),"") -> 3
A148: Dept6-7869 | B148: Medio | C148: 41216 | D148: 41219 | E148: =+LEFT(RC[-4],5) -> Dept6 | F148: =+VLOOKUP(RC[-4],Enunciado!R3C6:R5C7,2,0)+RC[-3] -> 41231 | G148: =+IF(RC[-1]>=RC[-3],"ON TIME","OUT OF TIME") -> ON TIME | H148: =+YEAR(RC[-5]) -> 2012 | I148: =+MONTH(RC[-6]) -> 11 | J148: =+RC[-6]-RC[-7] -> 3 | K148: =+IF(RC[-4]="OUT of TIME",RC[-1]-VLOOKUP(RC[-9],Enunciado!R3C6:R5C7,2,0),"") -> 
A149: Dept4-17584 | B149: Alto | C149: 41336 | D149: 41371 | E149: =+LEFT(RC[-4],5) -> Dept4 | F149: =+VLOOKUP(RC[-4],Enunciado!R3C6:R5C7,2,0)+RC[-3] -> 41341 | G149: =+IF(RC[-1]>=RC[-3],"ON TIME","OUT OF TIME") -> OUT OF TIME | H149: =+YEAR(RC[-5]) -> 2013 | I149: =+MONTH(RC[-6]) -> 3 | J149: =+RC[-6]-RC[-7] -> 35 | K149: =+IF(RC[-4]="OUT of TIME",RC[-1]-VLOOKUP(RC[-9],Enunciado!R3C6:R5C7,2,0),"") -> 30
A150: Dept2-25006 | B150: Bajo | C150: 41424 | D150: 41427 | E150: =+LEFT(RC[-4],5) -> Dept2 | F150: =+VLOOKUP(RC[-4],Enunciado!R3C6:R5C7,2,0)+RC[-3] -> 41454 | G150: =+IF(RC[-1]>=RC[-3],"ON TIME","OUT OF TIME") -> ON TIME | H150: =+YEAR(RC[-5]) -> 2013 | I150: =+MONTH(RC[-6]) -> 5 | J150: =+RC[-6]-RC[-7] -> 3 | K150: =+IF(RC[-4]="OUT of TIME",RC[-1]-VLOOKUP(RC[-9],Enunciado!R3C6:R5C7,2,0),"") -> 
A151: Dept4-10687 | B151: Medio | C151: 41110 | D151: 41111 | E151: =+LEFT(RC[-4],5) -> Dept4 | F151: =+VLOOKUP(RC[-4],Enunciado!R3C6:R5C7,2,0)+RC[-3] -> 41125 | G151: =+IF(RC[-1]>=RC[-3],"ON TIME","OUT OF TIME") -> ON TIME | H151: =+YEAR(RC[-5]) -> 2012 | I151: =+MONTH(RC[-6]) -> 7 | J151: =+RC[-6]-RC[-7] -> 1 | K151: =+IF(RC[-4]="OUT of TIME",RC[-1]-VLOOKUP(RC[-9],Enunciado!R3C6:R5C7,2,0),"") -> 
A152: Dept1-4540 | B152: Bajo | C152: 41439 | D152: 41441 | E152: =+LEFT(RC[-4],5) -> Dept1 | F152: =+VLOOKUP(RC[-4],Enunciado!R3C6:R5C7,2,0)+RC[-3] -> 41469 | G152: =+IF(RC[-1]>=RC[-3],"ON TIME","OUT OF TIME") -> ON TIME | H152: =+YEAR(RC[-5]) -> 2013 | I152: =+MONTH(RC[-6]) -> 6 | J152: =+RC[-6]-RC[-7] -> 2 | K152: =+IF(RC[-4]="OUT of TIME",RC[-1]-VLOOKUP(RC[-9],Enunciado!R3C6:R5C7,2,0),"") -> 
A153: Dept6-7197 | B153: Bajo | C153: 40932 | D153: 40947 | E153: =+LEFT(RC[-4],5) -> Dept6 | F153: =+VLOOKUP(RC[-4],Enunciado!R3C6:R5C7,2,0)+RC[-3] -> 40962 | G153: =+IF(RC[-1]>=RC[-3],"ON TIME","OUT OF TIME") -> ON TIME | H153: =+YEAR(RC[-5]) -> 2012 | I153: =+MONTH(RC[-6]) -> 1 | J153: =+RC[-6]-RC[-7] -> 15 | K153: =+IF(RC[-4]="OUT of TIME",RC[-1]-VLOOKUP(RC[-9],Enunciado!R3C6:R5C7,2,0),"") -> 
A154: Dept2-25268 | B154: Bajo | C154: 41462 | D154: 41478 | E154: =+LEFT(RC[-4],5) -> Dept2 | F154: =+VLOOKUP(RC[-4],Enunciado!R3C6:R5C7,2,0)+RC[-3] -> 41492 | G154: =+IF(RC[-1]>=RC[-3],"ON TIME","OUT OF TIME") -> ON TIME | H154: =+YEAR(RC[-5]) -> 2013 | I154: =+MONTH(RC[-6]) -> 7 | J154: =+RC[-6]-RC[-7] -> 16 | K154: =+IF(RC[-4]="OUT of TIME",RC[-1]-VLOOKUP(RC[-9],Enunciado!R3C6:R5C7,2,0),"") -> 
A155: Dept1-28290 | B155: Medio | C155: 41579 | D155: 41619 | E155: =+LEFT(RC[-4],5) -> Dept1 | F155: =+VLOOKUP(RC[-4],Enunciado!R3C6:R5C7,2,0)+RC[-3] -> 41594 | G155: =+IF(RC[-1]>=RC[-3],"ON TIME","OUT OF TIME") -> OUT OF TIME | H155: =+YEAR(RC[-5]) -> 2013 | I155: =+MONTH(RC[-6]) -> 11 | J155: =+RC[-6]-RC[-7] -> 40 | K155: =+IF(RC[-4]="OUT of TIME",RC[-1]-VLOOKUP(RC[-9],Enunciado!R3C6:R5C7,2,0),"") -> 25
A156: Dept3-27937 | B156: Bajo | C156: 41291 | D156: 41336 | E156: =+LEFT(RC[-4],5) -> Dept3 | F156: =+VLOOKUP(RC[-4],Enunciado!R3C6:R5C7,2,0)+RC[-3] -> 41321 | G156: =+IF(RC[-1]>=RC[-3],"ON TIME","OUT OF TIME") -> OUT OF TIME | H156: =+YEAR(RC[-5]) -> 2013 | I156: =+MONTH(RC[-6]) -> 1 | J156: =+RC[-6]-RC[-7] -> 45 | K156: =+IF(RC[-4]="OUT of TIME",RC[-1]-VLOOKUP(RC[-9],Enunciado!R3C6:R5C7,2,0),"") -> 15
A157: Dept4-11299 | B157: Bajo | C157: 40990 | D157: 41010 | E157: =+LEFT(RC[-4],5) -> Dept4 | F157: =+VLOOKUP(RC[-4],Enunciado!R3C6:R5C7,2,0)+RC[-3] -> 41020 | G157: =+IF(RC[-1]>=RC[-3],"ON TIME","OUT OF TIME") -> ON TIME | H157: =+YEAR(RC[-5]) -> 2012 | I157: =+MONTH(RC[-6]) -> 3 | J157: =+RC[-6]-RC[-7] -> 20 | K157: =+IF(RC[-4]="OUT of TIME",RC[-1]-VLOOKUP(RC[-9],Enunciado!R3C6:R5C7,2,0),"") -> 
A158: Dept3-22238 | B158: Bajo | C158: 41561 | D158: 41565 | E158: =+LEFT(RC[-4],5) -> Dept3 | F158: =+VLOOKUP(RC[-4],Enunciado!R3C6:R5C7,2,0)+RC[-3] -> 41591 | G158: =+IF(RC[-1]>=RC[-3],"ON TIME","OUT OF TIME") -> ON TIME | H158: =+YEAR(RC[-5]) -> 2013 | I158: =+MONTH(RC[-6]) -> 10 | J158: =+RC[-6]-RC[-7] -> 4 | K158: =+IF(RC[-4]="OUT of TIME",RC[-1]-VLOOKUP(RC[-9],Enunciado!R3C6:R5C7,2,0),"") -> 
A159: Dept2-2116 | B159: Medio | C159: 41168 | D159: 41202 | E159: =+LEFT(RC[-4],5) -> Dept2 | F159: =+VLOOKUP(RC[-4],Enunciado!R3C6:R5C7,2,0)+RC[-3] -> 41183 | G159: =+IF(RC[-1]>=RC[-3],"ON TIME","OUT OF TIME") -> OUT OF TIME | H159: =+YEAR(RC[-5]) -> 2012 | I159: =+MONTH(RC[-6]) -> 9 | J159: =+RC[-6]-RC[-7] -> 34 | K159: =+IF(RC[-4]="OUT of TIME",RC[-1]-VLOOKUP(RC[-9],Enunciado!R3C6:R5C7,2,0),"") -> 19
A160: Dept1-27200 | B160: Medio | C160: 40964 | D160: 40964 | E160: =+LEFT(RC[-4],5) -> Dept1 | F160: =+VLOOKUP(RC[-4],Enunciado!R3C6:R5C7,2,0)+RC[-3] -> 40979 | G160: =+IF(RC[-1]>=RC[-3],"ON TIME","OUT OF TIME") -> ON TIME | H160: =+YEAR(RC[-5]) -> 2012 | I160: =+MONTH(RC[-6]) -> 2 | J160: =+RC[-6]-RC[-7] -> 0 | K160: =+IF(RC[-4]="OUT of TIME",RC[-1]-VLOOKUP(RC[-9],Enunciado!R3C6:R5C7,2,0),"") -> 
A161: Dept5-25222 | B161: Bajo | C161: 41103 | D161: 41103 | E161: =+LEFT(RC[-4],5) -> Dept5 | F161: =+VLOOKUP(RC[-4],Enunciado!R3C6:R5C7,2,0)+RC[-3] -> 41133 | G161: =+IF(RC[-1]>=RC[-3],"ON TIME","OUT OF TIME") -> ON TIME | H161: =+YEAR(RC[-5]) -> 2012 | I161: =+MONTH(RC[-6]) -> 7 | J161: =+RC[-6]-RC[-7] -> 0 | K161: =+IF(RC[-4]="OUT of TIME",RC[-1]-VLOOKUP(RC[-9],Enunciado!R3C6:R5C7,2,0),"") -> 
A162: Dept6-2802 | B162: Alto | C162: 41317 | D162: 41325 | E162: =+LEFT(RC[-4],5) -> Dept6 | F162: =+VLOOKUP(RC[-4],Enunciado!R3C6:R5C7,2,0)+RC[-3] -> 41322 | G162: =+IF(RC[-1]>=RC[-3],"ON TIME","OUT OF TIME") -> OUT OF TIME | H162: =+YEAR(RC[-5]) -> 2013 | I162: =+MONTH(RC[-6]) -> 2 | J162: =+RC[-6]-RC[-7] -> 8 | K162: =+IF(RC[-4]="OUT of TIME",RC[-1]-VLOOKUP(RC[-9],Enunciado!R3C6:R5C7,2,0),"") -> 3
A163: Dept5-5384 | B163: Bajo | C163: 41547 | D163: 41548 | E163: =+LEFT(RC[-4],5) -> Dept5 | F163: =+VLOOKUP(RC[-4],Enunciado!R3C6:R5C7,2,0)+RC[-3] -> 41577 | G163: =+IF(RC[-1]>=RC[-3],"ON TIME","OUT OF TIME") -> ON TIME | H163: =+YEAR(RC[-5]) -> 2013 | I163: =+MONTH(RC[-6]) -> 9 | J163: =+RC[-6]-RC[-7] -> 1 | K163: =+IF(RC[-4]="OUT of TIME",RC[-1]-VLOOKUP(RC[-9],Enunciado!R3C6:R5C7,2,0),"") -> 
A164: Dept1-8098 | B164: Bajo | C164: 41193 | D164: 41209 | E164: =+LEFT(RC[-4],5) -> Dept1 | F164: =+VLOOKUP(RC[-4],Enunciado!R3C6:R5C7,2,0)+RC[-3] -> 41223 | G164: =+IF(RC[-1]>=RC[-3],"ON TIME","OUT OF TIME") -> ON TIME | H164: =+YEAR(RC[-5]) -> 2012 | I164: =+MONTH(RC[-6]) -> 10 | J164: =+RC[-6]-RC[-7] -> 16 | K164: =+IF(RC[-4]="OUT of TIME",RC[-1]-VLOOKUP(RC[-9],Enunciado!R3C6:R5C7,2,0),"") -> 
A165: Dept5-2609 | B165: Alto | C165: 40993 | D165: 40996 | E165: =+LEFT(RC[-4],5) -> Dept5 | F165: =+VLOOKUP(RC[-4],Enunciado!R3C6:R5C7,2,0)+RC[-3] -> 40998 | G165: =+IF(RC[-1]>=RC[-3],"ON TIME","OUT OF TIME") -> ON TIME | H165: =+YEAR(RC[-5]) -> 2012 | I165: =+MONTH(RC[-6]) -> 3 | J165: =+RC[-6]-RC[-7] -> 3 | K165: =+IF(RC[-4]="OUT of TIME",RC[-1]-VLOOKUP(RC[-9],Enunciado!R3C6:R5C7,2,0),"") -> 
A166: Dept1-18684 | B166: Medio | C166: 40997 | D166: 41015 | E166: =+LEFT(RC[-4],5) -> Dept1 | F166: =+VLOOKUP(RC[-4],Enunciado!R3C6:R5C7,2,0)+RC[-3] -> 41012 | G166: =+IF(RC[-1]>=RC[-3],"ON TIME","OUT OF TIME") -> OUT OF TIME | H166: =+YEAR(RC[-5]) -> 2012 | I166: =+MONTH(RC[-6]) -> 3 | J166: =+RC[-6]-RC[-7] -> 18 | K166: =+IF(RC[-4]="OUT of TIME",RC[-1]-VLOOKUP(RC[-9],Enunciado!R3C6:R5C7,2,0),"") -> 3
A167: Dept2-9388 | B167: Bajo | C167: 41286 | D167: 41289 | E167: =+LEFT(RC[-4],5) -> Dept2 | F167: =+VLOOKUP(RC[-4],Enunciado!R3C6:R5C7,2,0)+RC[-3] -> 41316 | G167: =+IF(RC[-1]>=RC[-3],"ON TIME","OUT OF TIME") -> ON TIME | H167: =+YEAR(RC[-5]) -> 2013 | I167: =+MONTH(RC[-6]) -> 1 | J167: =+RC[-6]-RC[-7] -> 3 | K167: =+IF(RC[-4]="OUT of TIME",RC[-1]-VLOOKUP(RC[-9],Enunciado!R3C6:R5C7,2,0),"") -> 
A168: Dept3-13813 | B168: Alto | C168: 41165 | D168: 41167 | E168: =+LEFT(RC[-4],5) -> Dept3 | F168: =+VLOOKUP(RC[-4],Enunciado!R3C6:R5C7,2,0)+RC[-3] -> 41170 | G168: =+IF(RC[-1]>=RC[-3],"ON TIME","OUT OF TIME") -> ON TIME | H168: =+YEAR(RC[-5]) -> 2012 | I168: =+MONTH(RC[-6]) -> 9 | J168: =+RC[-6]-RC[-7] -> 2 | K168: =+IF(RC[-4]="OUT of TIME",RC[-1]-VLOOKUP(RC[-9],Enunciado!R3C6:R5C7,2,0),"") -> 
A169: Dept2-6820 | B169: Bajo | C169: 41206 | D169: 41210 | E169: =+LEFT(RC[-4],5) -> Dept2 | F169: =+VLOOKUP(RC[-4],Enunciado!R3C6:R5C7,2,0)+RC[-3] -> 41236 | G169: =+IF(RC[-1]>=RC[-3],"ON TIME","OUT OF TIME") -> ON TIME | H169: =+YEAR(RC[-5]) -> 2012 | I169: =+MONTH(RC[-6]) -> 10 | J169: =+RC[-6]-RC[-7] -> 4 | K169: =+IF(RC[-4]="OUT of TIME",RC[-1]-VLOOKUP(RC[-9],Enunciado!R3C6:R5C7,2,0),"") -> 
A170: Dept6-20970 | B170: Medio | C170: 41055 | D170: 41062 | E170: =+LEFT(RC[-4],5) -> Dept6 | F170: =+VLOOKUP(RC[-4],Enunciado!R3C6:R5C7,2,0)+RC[-3] -> 41070 | G170: =+IF(RC[-1]>=RC[-3],"ON TIME","OUT OF TIME") -> ON TIME | H170: =+YEAR(RC[-5]) -> 2012 | I170: =+MONTH(RC[-6]) -> 5 | J170: =+RC[-6]-RC[-7] -> 7 | K170: =+IF(RC[-4]="OUT of TIME",RC[-1]-VLOOKUP(RC[-9],Enunciado!R3C6:R5C7,2,0),"") -> 
A171: Dept4-23655 | B171: Medio | C171: 41225 | D171: 41242 | E171: =+LEFT(RC[-4],5) -> Dept4 | F171: =+VLOOKUP(RC[-4],Enunciado!R3C6:R5C7,2,0)+RC[-3] -> 41240 | G171: =+IF(RC[-1]>=RC[-3],"ON TIME","OUT OF TIME") -> OUT OF TIME | H171: =+YEAR(RC[-5]) -> 2012 | I171: =+MONTH(RC[-6]) -> 11 | J171: =+RC[-6]-RC[-7] -> 17 | K171: =+IF(RC[-4]="OUT of TIME",RC[-1]-VLOOKUP(RC[-9],Enunciado!R3C6:R5C7,2,0),"") -> 2
A172: Dept2-23220 | B172: Alto | C172: 41375 | D172: 41393 | E172: =+LEFT(RC[-4],5) -> Dept2 | F172: =+VLOOKUP(RC[-4],Enunciado!R3C6:R5C7,2,0)+RC[-3] -> 41380 | G172: =+IF(RC[-1]>=RC[-3],"ON TIME","OUT OF TIME") -> OUT OF TIME | H172: =+YEAR(RC[-5]) -> 2013 | I172: =+MONTH(RC[-6]) -> 4 | J172: =+RC[-6]-RC[-7] -> 18 | K172: =+IF(RC[-4]="OUT of TIME",RC[-1]-VLOOKUP(RC[-9],Enunciado!R3C6:R5C7,2,0),"") -> 13
A173: Dept5-9838 | B173: Medio | C173: 41330 | D173: 41336 | E173: =+LEFT(RC[-4],5) -> Dept5 | F173: =+VLOOKUP(RC[-4],Enunciado!R3C6:R5C7,2,0)+RC[-3] -> 41345 | G173: =+IF(RC[-1]>=RC[-3],"ON TIME","OUT OF TIME") -> ON TIME | H173: =+YEAR(RC[-5]) -> 2013 | I173: =+MONTH(RC[-6]) -> 2 | J173: =+RC[-6]-RC[-7] -> 6 | K173: =+IF(RC[-4]="OUT of TIME",RC[-1]-VLOOKUP(RC[-9],Enunciado!R3C6:R5C7,2,0),"") -> 
A174: Dept4-2144 | B174: Bajo | C174: 41269 | D174: 41281 | E174: =+LEFT(RC[-4],5) -> Dept4 | F174: =+VLOOKUP(RC[-4],Enunciado!R3C6:R5C7,2,0)+RC[-3] -> 41299 | G174: =+IF(RC[-1]>=RC[-3],"ON TIME","OUT OF TIME") -> ON TIME | H174: =+YEAR(RC[-5]) -> 2012 | I174: =+MONTH(RC[-6]) -> 12 | J174: =+RC[-6]-RC[-7] -> 12 | K174: =+IF(RC[-4]="OUT of TIME",RC[-1]-VLOOKUP(RC[-9],Enunciado!R3C6:R5C7,2,0),"") -> 
A175: Dept6-3601 | B175: Medio | C175: 41228 | D175: 41228 | E175: =+LEFT(RC[-4],5) -> Dept6 | F175: =+VLOOKUP(RC[-4],Enunciado!R3C6:R5C7,2,0)+RC[-3] -> 41243 | G175: =+IF(RC[-1]>=RC[-3],"ON TIME","OUT OF TIME") -> ON TIME | H175: =+YEAR(RC[-5]) -> 2012 | I175: =+MONTH(RC[-6]) -> 11 | J175: =+RC[-6]-RC[-7] -> 0 | K175: =+IF(RC[-4]="OUT of TIME",RC[-1]-VLOOKUP(RC[-9],Enunciado!R3C6:R5C7,2,0),"") -> 
A176: Dept4-6669 | B176: Bajo | C176: 41453 | D176: 41453 | E176: =+LEFT(RC[-4],5) -> Dept4 | F176: =+VLOOKUP(RC[-4],Enunciado!R3C6:R5C7,2,0)+RC[-3] -> 41483 | G176: =+IF(RC[-1]>=RC[-3],"ON TIME","OUT OF TIME") -> ON TIME | H176: =+YEAR(RC[-5]) -> 2013 | I176: =+MONTH(RC[-6]) -> 6 | J176: =+RC[-6]-RC[-7] -> 0 | K176: =+IF(RC[-4]="OUT of TIME",RC[-1]-VLOOKUP(RC[-9],Enunciado!R3C6:R5C7,2,0),"") -> 
A177: Dept1-28676 | B177: Bajo | C177: 41087 | D177: 41129 | E177: =+LEFT(RC[-4],5) -> Dept1 | F177: =+VLOOKUP(RC[-4],Enunciado!R3C6:R5C7,2,0)+RC[-3] -> 41117 | G177: =+IF(RC[-1]>=RC[-3],"ON TIME","OUT OF TIME") -> OUT OF TIME | H177: =+YEAR(RC[-5]) -> 2012 | I177: =+MONTH(RC[-6]) -> 6 | J177: =+RC[-6]-RC[-7] -> 42 | K177: =+IF(RC[-4]="OUT of TIME",RC[-1]-VLOOKUP(RC[-9],Enunciado!R3C6:R5C7,2,0),"") -> 12
A178: Dept5-25616 | B178: Bajo | C178: 41589 | D178: 41592 | E178: =+LEFT(RC[-4],5) -> Dept5 | F178: =+VLOOKUP(RC[-4],Enunciado!R3C6:R5C7,2,0)+RC[-3] -> 41619 | G178: =+IF(RC[-1]>=RC[-3],"ON TIME","OUT OF TIME") -> ON TIME | H178: =+YEAR(RC[-5]) -> 2013 | I178: =+MONTH(RC[-6]) -> 11 | J178: =+RC[-6]-RC[-7] -> 3 | K178: =+IF(RC[-4]="OUT of TIME",RC[-1]-VLOOKUP(RC[-9],Enunciado!R3C6:R5C7,2,0),"") -> 
A179: Dept4-5686 | B179: Alto | C179: 41122 | D179: 41138 | E179: =+LEFT(RC[-4],5) -> Dept4 | F179: =+VLOOKUP(RC[-4],Enunciado!R3C6:R5C7,2,0)+RC[-3] -> 41127 | G179: =+IF(RC[-1]>=RC[-3],"ON TIME","OUT OF TIME") -> OUT OF TIME | H179: =+YEAR(RC[-5]) -> 2012 | I179: =+MONTH(RC[-6]) -> 8 | J179: =+RC[-6]-RC[-7] -> 16 | K179: =+IF(RC[-4]="OUT of TIME",RC[-1]-VLOOKUP(RC[-9],Enunciado!R3C6:R5C7,2,0),"") -> 11
A180: Dept3-19265 | B180: Alto | C180: 40990 | D180: 41011 | E180: =+LEFT(RC[-4],5) -> Dept3 | F180: =+VLOOKUP(RC[-4],Enunciado!R3C6:R5C7,2,0)+RC[-3] -> 40995 | G180: =+IF(RC[-1]>=RC[-3],"ON TIME","OUT OF TIME") -> OUT OF TIME | H180: =+YEAR(RC[-5]) -> 2012 | I180: =+MONTH(RC[-6]) -> 3 | J180: =+RC[-6]-RC[-7] -> 21 | K180: =+IF(RC[-4]="OUT of TIME",RC[-1]-VLOOKUP(RC[-9],Enunciado!R3C6:R5C7,2,0),"") -> 16
A181: Dept2-29281 | B181: Bajo | C181: 41233 | D181: 41235 | E181: =+LEFT(RC[-4],5) -> Dept2 | F181: =+VLOOKUP(RC[-4],Enunciado!R3C6:R5C7,2,0)+RC[-3] -> 41263 | G181: =+IF(RC[-1]>=RC[-3],"ON TIME","OUT OF TIME") -> ON TIME | H181: =+YEAR(RC[-5]) -> 2012 | I181: =+MONTH(RC[-6]) -> 11 | J181: =+RC[-6]-RC[-7] -> 2 | K181: =+IF(RC[-4]="OUT of TIME",RC[-1]-VLOOKUP(RC[-9],Enunciado!R3C6:R5C7,2,0),"") -> 
A182: Dept5-22758 | B182: Medio | C182: 41036 | D182: 41050 | E182: =+LEFT(RC[-4],5) -> Dept5 | F182: =+VLOOKUP(RC[-4],Enunciado!R3C6:R5C7,2,0)+RC[-3] -> 41051 | G182: =+IF(RC[-1]>=RC[-3],"ON TIME","OUT OF TIME") -> ON TIME | H182: =+YEAR(RC[-5]) -> 2012 | I182: =+MONTH(RC[-6]) -> 5 | J182: =+RC[-6]-RC[-7] -> 14 | K182: =+IF(RC[-4]="OUT of TIME",RC[-1]-VLOOKUP(RC[-9],Enunciado!R3C6:R5C7,2,0),"") -> 
A183: Dept6-20073 | B183: Medio | C183: 40985 | D183: 40988 | E183: =+LEFT(RC[-4],5) -> Dept6 | F183: =+VLOOKUP(RC[-4],Enunciado!R3C6:R5C7,2,0)+RC[-3] -> 41000 | G183: =+IF(RC[-1]>=RC[-3],"ON TIME","OUT OF TIME") -> ON TIME | H183: =+YEAR(RC[-5]) -> 2012 | I183: =+MONTH(RC[-6]) -> 3 | J183: =+RC[-6]-RC[-7] -> 3 | K183: =+IF(RC[-4]="OUT of TIME",RC[-1]-VLOOKUP(RC[-9],Enunciado!R3C6:R5C7,2,0),"") -> 
A184: Dept6-1651 | B184: Alto | C184: 40977 | D184: 40979 | E184: =+LEFT(RC[-4],5) -> Dept6 | F184: =+VLOOKUP(RC[-4],Enunciado!R3C6:R5C7,2,0)+RC[-3] -> 40982 | G184: =+IF(RC[-1]>=RC[-3],"ON TIME","OUT OF TIME") -> ON TIME | H184: =+YEAR(RC[-5]) -> 2012 | I184: =+MONTH(RC[-6]) -> 3 | J184: =+RC[-6]-RC[-7] -> 2 | K184: =+IF(RC[-4]="OUT of TIME",RC[-1]-VLOOKUP(RC[-9],Enunciado!R3C6:R5C7,2,0),"") -> 
A185: Dept1-17943 | B185: Medio | C185: 41452 | D185: 41464 | E185: =+LEFT(RC[-4],5) -> Dept1 | F185: =+VLOOKUP(RC[-4],Enunciado!R3C6:R5C7,2,0)+RC[-3] -> 41467 | G185: =+IF(RC[-1]>=RC[-3],"ON TIME","OUT OF TIME") -> ON TIME | H185: =+YEAR(RC[-5]) -> 2013 | I185: =+MONTH(RC[-6]) -> 6 | J185: =+RC[-6]-RC[-7] -> 12 | K185: =+IF(RC[-4]="OUT of TIME",RC[-1]-VLOOKUP(RC[-9],Enunciado!R3C6:R5C7,2,0),"") -> 
A186: Dept1-17429 | B186: Medio | C186: 41449 | D186: 41454 | E186: =+LEFT(RC[-4],5) -> Dept1 | F186: =+VLOOKUP(RC[-4],Enunciado!R3C6:R5C7,2,0)+RC[-3] -> 41464 | G186: =+IF(RC[-1]>=RC[-3],"ON TIME","OUT OF TIME") -> ON TIME | H186: =+YEAR(RC[-5]) -> 2013 | I186: =+MONTH(RC[-6]) -> 6 | J186: =+RC[-6]-RC[-7] -> 5 | K186: =+IF(RC[-4]="OUT of TIME",RC[-1]-VLOOKUP(RC[-9],Enunciado!R3C6:R5C7,2,0),"") -> 
A187: Dept5-20779 | B187: Alto | C187: 41623 | D187: 41654 | E187: =+LEFT(RC[-4],5) -> Dept5 | F187: =+VLOOKUP(RC[-4],Enunciado!R3C6:R5C7,2,0)+RC[-3] -> 41628 | G187: =+IF(RC[-1]>=RC[-3],"ON TIME","OUT OF TIME") -> OUT OF TIME | H187: =+YEAR(RC[-5]) -> 2013 | I187: =+MONTH(RC[-6]) -> 12 | J187: =+RC[-6]-RC[-7] -> 31 | K187: =+IF(RC[-4]="OUT of TIME",RC[-1]-VLOOKUP(RC[-9],Enunciado!R3C6:R5C7,2,0),"") -> 26
A188: Dept4-8288 | B188: Alto | C188: 41052 | D188: 41070 | E188: =+LEFT(RC[-4],5) -> Dept4 | F188: =+VLOOKUP(RC[-4],Enunciado!R3C6:R5C7,2,0)+RC[-3] -> 41057 | G188: =+IF(RC[-1]>=RC[-3],"ON TIME","OUT OF TIME") -> OUT OF TIME | H188: =+YEAR(RC[-5]) -> 2012 | I188: =+MONTH(RC[-6]) -> 5 | J188: =+RC[-6]-RC[-7] -> 18 | K188: =+IF(RC[-4]="OUT of TIME",RC[-1]-VLOOKUP(RC[-9],Enunciado!R3C6:R5C7,2,0),"") -> 13
A189: Dept1-20200 | B189: Bajo | C189: 41341 | D189: 41345 | E189: =+LEFT(RC[-4],5) -> Dept1 | F189: =+VLOOKUP(RC[-4],Enunciado!R3C6:R5C7,2,0)+RC[-3] -> 41371 | G189: =+IF(RC[-1]>=RC[-3],"ON TIME","OUT OF TIME") -> ON TIME | H189: =+YEAR(RC[-5]) -> 2013 | I189: =+MONTH(RC[-6]) -> 3 | J189: =+RC[-6]-RC[-7] -> 4 | K189: =+IF(RC[-4]="OUT of TIME",RC[-1]-VLOOKUP(RC[-9],Enunciado!R3C6:R5C7,2,0),"") -> 
A190: Dept6-28011 | B190: Bajo | C190: 41403 | D190: 41406 | E190: =+LEFT(RC[-4],5) -> Dept6 | F190: =+VLOOKUP(RC[-4],Enunciado!R3C6:R5C7,2,0)+RC[-3] -> 41433 | G190: =+IF(RC[-1]>=RC[-3],"ON TIME","OUT OF TIME") -> ON TIME | H190: =+YEAR(RC[-5]) -> 2013 | I190: =+MONTH(RC[-6]) -> 5 | J190: =+RC[-6]-RC[-7] -> 3 | K190: =+IF(RC[-4]="OUT of TIME",RC[-1]-VLOOKUP(RC[-9],Enunciado!R3C6:R5C7,2,0),"") -> 
A191: Dept6-23339 | B191: Medio | C191: 41412 | D191: 41427 | E191: =+LEFT(RC[-4],5) -> Dept6 | F191: =+VLOOKUP(RC[-4],Enunciado!R3C6:R5C7,2,0)+RC[-3] -> 41427 | G191: =+IF(RC[-1]>=RC[-3],"ON TIME","OUT OF TIME") -> ON TIME | H191: =+YEAR(RC[-5]) -> 2013 | I191: =+MONTH(RC[-6]) -> 5 | J191: =+RC[-6]-RC[-7] -> 15 | K191: =+IF(RC[-4]="OUT of TIME",RC[-1]-VLOOKUP(RC[-9],Enunciado!R3C6:R5C7,2,0),"") -> 
A192: Dept4-23237 | B192: Bajo | C192: 41132 | D192: 41133 | E192: =+LEFT(RC[-4],5) -> Dept4 | F192: =+VLOOKUP(RC[-4],Enunciado!R3C6:R5C7,2,0)+RC[-3] -> 41162 | G192: =+IF(RC[-1]>=RC[-3],"ON TIME","OUT OF TIME") -> ON TIME | H192: =+YEAR(RC[-5]) -> 2012 | I192: =+MONTH(RC[-6]) -> 8 | J192: =+RC[-6]-RC[-7] -> 1 | K192: =+IF(RC[-4]="OUT of TIME",RC[-1]-VLOOKUP(RC[-9],Enunciado!R3C6:R5C7,2,0),"") -> 
A193: Dept1-7244 | B193: Bajo | C193: 41259 | D193: 41269 | E193: =+LEFT(RC[-4],5) -> Dept1 | F193: =+VLOOKUP(RC[-4],Enunciado!R3C6:R5C7,2,0)+RC[-3] -> 41289 | G193: =+IF(RC[-1]>=RC[-3],"ON TIME","OUT OF TIME") -> ON TIME | H193: =+YEAR(RC[-5]) -> 2012 | I193: =+MONTH(RC[-6]) -> 12 | J193: =+RC[-6]-RC[-7] -> 10 | K193: =+IF(RC[-4]="OUT of TIME",RC[-1]-VLOOKUP(RC[-9],Enunciado!R3C6:R5C7,2,0),"") -> 
A194: Dept5-6940 | B194: Alto | C194: 41548 | D194: 41550 | E194: =+LEFT(RC[-4],5) -> Dept5 | F194: =+VLOOKUP(RC[-4],Enunciado!R3C6:R5C7,2,0)+RC[-3] -> 41553 | G194: =+IF(RC[-1]>=RC[-3],"ON TIME","OUT OF TIME") -> ON TIME | H194: =+YEAR(RC[-5]) -> 2013 | I194: =+MONTH(RC[-6]) -> 10 | J194: =+RC[-6]-RC[-7] -> 2 | K194: =+IF(RC[-4]="OUT of TIME",RC[-1]-VLOOKUP(RC[-9],Enunciado!R3C6:R5C7,2,0),"") -> 
A195: Dept5-29955 | B195: Medio | C195: 41584 | D195: 41584 | E195: =+LEFT(RC[-4],5) -> Dept5 | F195: =+VLOOKUP(RC[-4],Enunciado!R3C6:R5C7,2,0)+RC[-3] -> 41599 | G195: =+IF(RC[-1]>=RC[-3],"ON TIME","OUT OF TIME") -> ON TIME | H195: =+YEAR(RC[-5]) -> 2013 | I195: =+MONTH(RC[-6]) -> 11 | J195: =+RC[-6]-RC[-7] -> 0 | K195: =+IF(RC[-4]="OUT of TIME",RC[-1]-VLOOKUP(RC[-9],Enunciado!R3C6:R5C7,2,0),"") -> 
A196: Dept6-23439 | B196: Medio | C196: 41002 | D196: 41007 | E196: =+LEFT(RC[-4],5) -> Dept6 | F196: =+VLOOKUP(RC[-4],Enunciado!R3C6:R5C7,2,0)+RC[-3] -> 41017 | G196: =+IF(RC[-1]>=RC[-3],"ON TIME","OUT OF TIME") -> ON TIME | H196: =+YEAR(RC[-5]) -> 2012 | I196: =+MONTH(RC[-6]) -> 4 | J196: =+RC[-6]-RC[-7] -> 5 | K196: =+IF(RC[-4]="OUT of TIME",RC[-1]-VLOOKUP(RC[-9],Enunciado!R3C6:R5C7,2,0),"") -> 
A197: Dept1-9827 | B197: Alto | C197: 41156 | D197: 41174 | E197: =+LEFT(RC[-4],5) -> Dept1 | F197: =+VLOOKUP(RC[-4],Enunciado!R3C6:R5C7,2,0)+RC[-3] -> 41161 | G197: =+IF(RC[-1]>=RC[-3],"ON TIME","OUT OF TIME") -> OUT OF TIME | H197: =+YEAR(RC[-5]) -> 2012 | I197: =+MONTH(RC[-6]) -> 9 | J197: =+RC[-6]-RC[-7] -> 18 | K197: =+IF(RC[-4]="OUT of TIME",RC[-1]-VLOOKUP(RC[-9],Enunciado!R3C6:R5C7,2,0),"") -> 13
A198: Dept3-27734 | B198: Bajo | C198: 41297 | D198: 41301 | E198: =+LEFT(RC[-4],5) -> Dept3 | F198: =+VLOOKUP(RC[-4],Enunciado!R3C6:R5C7,2,0)+RC[-3] -> 41327 | G198: =+IF(RC[-1]>=RC[-3],"ON TIME","OUT OF TIME") -> ON TIME | H198: =+YEAR(RC[-5]) -> 2013 | I198: =+MONTH(RC[-6]) -> 1 | J198: =+RC[-6]-RC[-7] -> 4 | K198: =+IF(RC[-4]="OUT of TIME",RC[-1]-VLOOKUP(RC[-9],Enunciado!R3C6:R5C7,2,0),"") -> 
A199: Dept5-12156 | B199: Alto | C199: 41072 | D199: 41094 | E199: =+LEFT(RC[-4],5) -> Dept5 | F199: =+VLOOKUP(RC[-4],Enunciado!R3C6:R5C7,2,0)+RC[-3] -> 41077 | G199: =+IF(RC[-1]>=RC[-3],"ON TIME","OUT OF TIME") -> OUT OF TIME | H199: =+YEAR(RC[-5]) -> 2012 | I199: =+MONTH(RC[-6]) -> 6 | J199: =+RC[-6]-RC[-7] -> 22 | K199: =+IF(RC[-4]="OUT of TIME",RC[-1]-VLOOKUP(RC[-9],Enunciado!R3C6:R5C7,2,0),"") -> 17
A200: Dept2-19498 | B200: Bajo | C200: 40966 | D200: 40981 | E200: =+LEFT(RC[-4],5) -> Dept2 | F200: =+VLOOKUP(RC[-4],Enunciado!R3C6:R5C7,2,0)+RC[-3] -> 40996 | G200: =+IF(RC[-1]>=RC[-3],"ON TIME","OUT OF TIME") -> ON TIME | H200: =+YEAR(RC[-5]) -> 2012 | I200: =+MONTH(RC[-6]) -> 2 | J200: =+RC[-6]-RC[-7] -> 15 | K200: =+IF(RC[-4]="OUT of TIME",RC[-1]-VLOOKUP(RC[-9],Enunciado!R3C6:R5C7,2,0),"") -> 
A201: Dept3-29669 | B201: Medio | C201: 41175 | D201: 41194 | E201: =+LEFT(RC[-4],5) -> Dept3 | F201: =+VLOOKUP(RC[-4],Enunciado!R3C6:R5C7,2,0)+RC[-3] -> 41190 | G201: =+IF(RC[-1]>=RC[-3],"ON TIME","OUT OF TIME") -> OUT OF TIME | H201: =+YEAR(RC[-5]) -> 2012 | I201: =+MONTH(RC[-6]) -> 9 | J201: =+RC[-6]-RC[-7] -> 19 | K201: =+IF(RC[-4]="OUT of TIME",RC[-1]-VLOOKUP(RC[-9],Enunciado!R3C6:R5C7,2,0),"") -> 4
A202: Dept4-29526 | B202: Alto | C202: 41047 | D202: 41048 | E202: =+LEFT(RC[-4],5) -> Dept4 | F202: =+VLOOKUP(RC[-4],Enunciado!R3C6:R5C7,2,0)+RC[-3] -> 41052 | G202: =+IF(RC[-1]>=RC[-3],"ON TIME","OUT OF TIME") -> ON TIME | H202: =+YEAR(RC[-5]) -> 2012 | I202: =+MONTH(RC[-6]) -> 5 | J202: =+RC[-6]-RC[-7] -> 1 | K202: =+IF(RC[-4]="OUT of TIME",RC[-1]-VLOOKUP(RC[-9],Enunciado!R3C6:R5C7,2,0),"") -> 
A203: Dept2-20952 | B203: Medio | C203: 41437 | D203: 41440 | E203: =+LEFT(RC[-4],5) -> Dept2 | F203: =+VLOOKUP(RC[-4],Enunciado!R3C6:R5C7,2,0)+RC[-3] -> 41452 | G203: =+IF(RC[-1]>=RC[-3],"ON TIME","OUT OF TIME") -> ON TIME | H203: =+YEAR(RC[-5]) -> 2013 | I203: =+MONTH(RC[-6]) -> 6 | J203: =+RC[-6]-RC[-7] -> 3 | K203: =+IF(RC[-4]="OUT of TIME",RC[-1]-VLOOKUP(RC[-9],Enunciado!R3C6:R5C7,2,0),"") -> 
A204: Dept1-13961 | B204: Bajo | C204: 41202 | D204: 41203 | E204: =+LEFT(RC[-4],5) -> Dept1 | F204: =+VLOOKUP(RC[-4],Enunciado!R3C6:R5C7,2,0)+RC[-3] -> 41232 | G204: =+IF(RC[-1]>=RC[-3],"ON TIME","OUT OF TIME") -> ON TIME | H204: =+YEAR(RC[-5]) -> 2012 | I204: =+MONTH(RC[-6]) -> 10 | J204: =+RC[-6]-RC[-7] -> 1 | K204: =+IF(RC[-4]="OUT of TIME",RC[-1]-VLOOKUP(RC[-9],Enunciado!R3C6:R5C7,2,0),"") -> 
A205: Dept4-18362 | B205: Alto | C205: 41551 | D205: 41554 | E205: =+LEFT(RC[-4],5) -> Dept4 | F205: =+VLOOKUP(RC[-4],Enunciado!R3C6:R5C7,2,0)+RC[-3] -> 41556 | G205: =+IF(RC[-1]>=RC[-3],"ON TIME","OUT OF TIME") -> ON TIME | H205: =+YEAR(RC[-5]) -> 2013 | I205: =+MONTH(RC[-6]) -> 10 | J205: =+RC[-6]-RC[-7] -> 3 | K205: =+IF(RC[-4]="OUT of TIME",RC[-1]-VLOOKUP(RC[-9],Enunciado!R3C6:R5C7,2,0),"") -> 
A206: Dept4-19098 | B206: Medio | C206: 41403 | D206: 41406 | E206: =+LEFT(RC[-4],5) -> Dept4 | F206: =+VLOOKUP(RC[-4],Enunciado!R3C6:R5C7,2,0)+RC[-3] -> 41418 | G206: =+IF(RC[-1]>=RC[-3],"ON TIME","OUT OF TIME") -> ON TIME | H206: =+YEAR(RC[-5]) -> 2013 | I206: =+MONTH(RC[-6]) -> 5 | J206: =+RC[-6]-RC[-7] -> 3 | K206: =+IF(RC[-4]="OUT of TIME",RC[-1]-VLOOKUP(RC[-9],Enunciado!R3C6:R5C7,2,0),"") -> 
A207: Dept6-4495 | B207: Bajo | C207: 41386 | D207: 41409 | E207: =+LEFT(RC[-4],5) -> Dept6 | F207: =+VLOOKUP(RC[-4],Enunciado!R3C6:R5C7,2,0)+RC[-3] -> 41416 | G207: =+IF(RC[-1]>=RC[-3],"ON TIME","OUT OF TIME") -> ON TIME | H207: =+YEAR(RC[-5]) -> 2013 | I207: =+MONTH(RC[-6]) -> 4 | J207: =+RC[-6]-RC[-7] -> 23 | K207: =+IF(RC[-4]="OUT of TIME",RC[-1]-VLOOKUP(RC[-9],Enunciado!R3C6:R5C7,2,0),"") -> 
A208: Dept6-27099 | B208: Bajo | C208: 41333 | D208: 41335 | E208: =+LEFT(RC[-4],5) -> Dept6 | F208: =+VLOOKUP(RC[-4],Enunciado!R3C6:R5C7,2,0)+RC[-3] -> 41363 | G208: =+IF(RC[-1]>=RC[-3],"ON TIME","OUT OF TIME") -> ON TIME | H208: =+YEAR(RC[-5]) -> 2013 | I208: =+MONTH(RC[-6]) -> 2 | J208: =+RC[-6]-RC[-7] -> 2 | K208: =+IF(RC[-4]="OUT of TIME",RC[-1]-VLOOKUP(RC[-9],Enunciado!R3C6:R5C7,2,0),"") -> 
A209: Dept6-13778 | B209: Alto | C209: 41066 | D209: 41069 | E209: =+LEFT(RC[-4],5) -> Dept6 | F209: =+VLOOKUP(RC[-4],Enunciado!R3C6:R5C7,2,0)+RC[-3] -> 41071 | G209: =+IF(RC[-1]>=RC[-3],"ON TIME","OUT OF TIME") -> ON TIME | H209: =+YEAR(RC[-5]) -> 2012 | I209: =+MONTH(RC[-6]) -> 6 | J209: =+RC[-6]-RC[-7] -> 3 | K209: =+IF(RC[-4]="OUT of TIME",RC[-1]-VLOOKUP(RC[-9],Enunciado!R3C6:R5C7,2,0),"") -> 
A210: Dept1-10407 | B210: Alto | C210: 40971 | D210: 41012 | E210: =+LEFT(RC[-4],5) -> Dept1 | F210: =+VLOOKUP(RC[-4],Enunciado!R3C6:R5C7,2,0)+RC[-3] -> 40976 | G210: =+IF(RC[-1]>=RC[-3],"ON TIME","OUT OF TIME") -> OUT OF TIME | H210: =+YEAR(RC[-5]) -> 2012 | I210: =+MONTH(RC[-6]) -> 3 | J210: =+RC[-6]-RC[-7] -> 41 | K210: =+IF(RC[-4]="OUT of TIME",RC[-1]-VLOOKUP(RC[-9],Enunciado!R3C6:R5C7,2,0),"") -> 36
A211: Dept2-23230 | B211: Alto | C211: 41449 | D211: 41449 | E211: =+LEFT(RC[-4],5) -> Dept2 | F211: =+VLOOKUP(RC[-4],Enunciado!R3C6:R5C7,2,0)+RC[-3] -> 41454 | G211: =+IF(RC[-1]>=RC[-3],"ON TIME","OUT OF TIME") -> ON TIME | H211: =+YEAR(RC[-5]) -> 2013 | I211: =+MONTH(RC[-6]) -> 6 | J211: =+RC[-6]-RC[-7] -> 0 | K211: =+IF(RC[-4]="OUT of TIME",RC[-1]-VLOOKUP(RC[-9],Enunciado!R3C6:R5C7,2,0),"") -> 
A212: Dept1-10190 | B212: Bajo | C212: 41378 | D212: 41378 | E212: =+LEFT(RC[-4],5) -> Dept1 | F212: =+VLOOKUP(RC[-4],Enunciado!R3C6:R5C7,2,0)+RC[-3] -> 41408 | G212: =+IF(RC[-1]>=RC[-3],"ON TIME","OUT OF TIME") -> ON TIME | H212: =+YEAR(RC[-5]) -> 2013 | I212: =+MONTH(RC[-6]) -> 4 | J212: =+RC[-6]-RC[-7] -> 0 | K212: =+IF(RC[-4]="OUT of TIME",RC[-1]-VLOOKUP(RC[-9],Enunciado!R3C6:R5C7,2,0),"") -> 
A213: Dept6-13974 | B213: Medio | C213: 41536 | D213: 41539 | E213: =+LEFT(RC[-4],5) -> Dept6 | F213: =+VLOOKUP(RC[-4],Enunciado!R3C6:R5C7,2,0)+RC[-3] -> 41551 | G213: =+IF(RC[-1]>=RC[-3],"ON TIME","OUT OF TIME") -> ON TIME | H213: =+YEAR(RC[-5]) -> 2013 | I213: =+MONTH(RC[-6]) -> 9 | J213: =+RC[-6]-RC[-7] -> 3 | K213: =+IF(RC[-4]="OUT of TIME",RC[-1]-VLOOKUP(RC[-9],Enunciado!R3C6:R5C7,2,0),"") -> 
A214: Dept4-1620 | B214: Medio | C214: 41066 | D214: 41109 | E214: =+LEFT(RC[-4],5) -> Dept4 | F214: =+VLOOKUP(RC[-4],Enunciado!R3C6:R5C7,2,0)+RC[-3] -> 41081 | G214: =+IF(RC[-1]>=RC[-3],"ON TIME","OUT OF TIME") -> OUT OF TIME | H214: =+YEAR(RC[-5]) -> 2012 | I214: =+MONTH(RC[-6]) -> 6 | J214: =+RC[-6]-RC[-7] -> 43 | K214: =+IF(RC[-4]="OUT of TIME",RC[-1]-VLOOKUP(RC[-9],Enunciado!R3C6:R5C7,2,0),"") -> 28
A215: Dept4-22551 | B215: Bajo | C215: 41240 | D215: 41254 | E215: =+LEFT(RC[-4],5) -> Dept4 | F215: =+VLOOKUP(RC[-4],Enunciado!R3C6:R5C7,2,0)+RC[-3] -> 41270 | G215: =+IF(RC[-1]>=RC[-3],"ON TIME","OUT OF TIME") -> ON TIME | H215: =+YEAR(RC[-5]) -> 2012 | I215: =+MONTH(RC[-6]) -> 11 | J215: =+RC[-6]-RC[-7] -> 14 | K215: =+IF(RC[-4]="OUT of TIME",RC[-1]-VLOOKUP(RC[-9],Enunciado!R3C6:R5C7,2,0),"") -> 
A216: Dept4-6299 | B216: Alto | C216: 41258 | D216: 41259 | E216: =+LEFT(RC[-4],5) -> Dept4 | F216: =+VLOOKUP(RC[-4],Enunciado!R3C6:R5C7,2,0)+RC[-3] -> 41263 | G216: =+IF(RC[-1]>=RC[-3],"ON TIME","OUT OF TIME") -> ON TIME | H216: =+YEAR(RC[-5]) -> 2012 | I216: =+MONTH(RC[-6]) -> 12 | J216: =+RC[-6]-RC[-7] -> 1 | K216: =+IF(RC[-4]="OUT of TIME",RC[-1]-VLOOKUP(RC[-9],Enunciado!R3C6:R5C7,2,0),"") -> 
A217: Dept6-8599 | B217: Bajo | C217: 41166 | D217: 41170 | E217: =+LEFT(RC[-4],5) -> Dept6 | F217: =+VLOOKUP(RC[-4],Enunciado!R3C6:R5C7,2,0)+RC[-3] -> 41196 | G217: =+IF(RC[-1]>=RC[-3],"ON TIME","OUT OF TIME") -> ON TIME | H217: =+YEAR(RC[-5]) -> 2012 | I217: =+MONTH(RC[-6]) -> 9 | J217: =+RC[-6]-RC[-7] -> 4 | K217: =+IF(RC[-4]="OUT of TIME",RC[-1]-VLOOKUP(RC[-9],Enunciado!R3C6:R5C7,2,0),"") -> 
A218: Dept2-19646 | B218: Bajo | C218: 40935 | D218: 40974 | E218: =+LEFT(RC[-4],5) -> Dept2 | F218: =+VLOOKUP(RC[-4],Enunciado!R3C6:R5C7,2,0)+RC[-3] -> 40965 | G218: =+IF(RC[-1]>=RC[-3],"ON TIME","OUT OF TIME") -> OUT OF TIME | H218: =+YEAR(RC[-5]) -> 2012 | I218: =+MONTH(RC[-6]) -> 1 | J218: =+RC[-6]-RC[-7] -> 39 | K218: =+IF(RC[-4]="OUT of TIME",RC[-1]-VLOOKUP(RC[-9],Enunciado!R3C6:R5C7,2,0),"") -> 9
A219: Dept1-2963 | B219: Medio | C219: 41317 | D219: 41319 | E219: =+LEFT(RC[-4],5) -> Dept1 | F219: =+VLOOKUP(RC[-4],Enunciado!R3C6:R5C7,2,0)+RC[-3] -> 41332 | G219: =+IF(RC[-1]>=RC[-3],"ON TIME","OUT OF TIME") -> ON TIME | H219: =+YEAR(RC[-5]) -> 2013 | I219: =+MONTH(RC[-6]) -> 2 | J219: =+RC[-6]-RC[-7] -> 2 | K219: =+IF(RC[-4]="OUT of TIME",RC[-1]-VLOOKUP(RC[-9],Enunciado!R3C6:R5C7,2,0),"") -> 
A220: Dept1-18558 | B220: Alto | C220: 41250 | D220: 41266 | E220: =+LEFT(RC[-4],5) -> Dept1 | F220: =+VLOOKUP(RC[-4],Enunciado!R3C6:R5C7,2,0)+RC[-3] -> 41255 | G220: =+IF(RC[-1]>=RC[-3],"ON TIME","OUT OF TIME") -> OUT OF TIME | H220: =+YEAR(RC[-5]) -> 2012 | I220: =+MONTH(RC[-6]) -> 12 | J220: =+RC[-6]-RC[-7] -> 16 | K220: =+IF(RC[-4]="OUT of TIME",RC[-1]-VLOOKUP(RC[-9],Enunciado!R3C6:R5C7,2,0),"") -> 11
A221: Dept2-17800 | B221: Alto | C221: 41260 | D221: 41264 | E221: =+LEFT(RC[-4],5) -> Dept2 | F221: =+VLOOKUP(RC[-4],Enunciado!R3C6:R5C7,2,0)+RC[-3] -> 41265 | G221: =+IF(RC[-1]>=RC[-3],"ON TIME","OUT OF TIME") -> ON TIME | H221: =+YEAR(RC[-5]) -> 2012 | I221: =+MONTH(RC[-6]) -> 12 | J221: =+RC[-6]-RC[-7] -> 4 | K221: =+IF(RC[-4]="OUT of TIME",RC[-1]-VLOOKUP(RC[-9],Enunciado!R3C6:R5C7,2,0),"") -> 
A222: Dept1-22161 | B222: Alto | C222: 41574 | D222: 41575 | E222: =+LEFT(RC[-4],5) -> Dept1 | F222: =+VLOOKUP(RC[-4],Enunciado!R3C6:R5C7,2,0)+RC[-3] -> 41579 | G222: =+IF(RC[-1]>=RC[-3],"ON TIME","OUT OF TIME") -> ON TIME | H222: =+YEAR(RC[-5]) -> 2013 | I222: =+MONTH(RC[-6]) -> 10 | J222: =+RC[-6]-RC[-7] -> 1 | K222: =+IF(RC[-4]="OUT of TIME",RC[-1]-VLOOKUP(RC[-9],Enunciado!R3C6:R5C7,2,0),"") -> 
A223: Dept3-17734 | B223: Bajo | C223: 41011 | D223: 41017 | E223: =+LEFT(RC[-4],5) -> Dept3 | F223: =+VLOOKUP(RC[-4],Enunciado!R3C6:R5C7,2,0)+RC[-3] -> 41041 | G223: =+IF(RC[-1]>=RC[-3],"ON TIME","OUT OF TIME") -> ON TIME | H223: =+YEAR(RC[-5]) -> 2012 | I223: =+MONTH(RC[-6]) -> 4 | J223: =+RC[-6]-RC[-7] -> 6 | K223: =+IF(RC[-4]="OUT of TIME",RC[-1]-VLOOKUP(RC[-9],Enunciado!R3C6:R5C7,2,0),"") -> 
A224: Dept4-5951 | B224: Alto | C224: 41094 | D224: 41102 | E224: =+LEFT(RC[-4],5) -> Dept4 | F224: =+VLOOKUP(RC[-4],Enunciado!R3C6:R5C7,2,0)+RC[-3] -> 41099 | G224: =+IF(RC[-1]>=RC[-3],"ON TIME","OUT OF TIME") -> OUT OF TIME | H224: =+YEAR(RC[-5]) -> 2012 | I224: =+MONTH(RC[-6]) -> 7 | J224: =+RC[-6]-RC[-7] -> 8 | K224: =+IF(RC[-4]="OUT of TIME",RC[-1]-VLOOKUP(RC[-9],Enunciado!R3C6:R5C7,2,0),"") -> 3
A225: Dept2-18629 | B225: Medio | C225: 41181 | D225: 41182 | E225: =+LEFT(RC[-4],5) -> Dept2 | F225: =+VLOOKUP(RC[-4],Enunciado!R3C6:R5C7,2,0)+RC[-3] -> 41196 | G225: =+IF(RC[-1]>=RC[-3],"ON TIME","OUT OF TIME") -> ON TIME | H225: =+YEAR(RC[-5]) -> 2012 | I225: =+MONTH(RC[-6]) -> 9 | J225: =+RC[-6]-RC[-7] -> 1 | K225: =+IF(RC[-4]="OUT of TIME",RC[-1]-VLOOKUP(RC[-9],Enunciado!R3C6:R5C7,2,0),"") -> 
A226: Dept3-17150 | B226: Bajo | C226: 41089 | D226: 41093 | E226: =+LEFT(RC[-4],5) -> Dept3 | F226: =+VLOOKUP(RC[-4],Enunciado!R3C6:R5C7,2,0)+RC[-3] -> 41119 | G226: =+IF(RC[-1]>=RC[-3],"ON TIME","OUT OF TIME") -> ON TIME | H226: =+YEAR(RC[-5]) -> 2012 | I226: =+MONTH(RC[-6]) -> 6 | J226: =+RC[-6]-RC[-7] -> 4 | K226: =+IF(RC[-4]="OUT of TIME",RC[-1]-VLOOKUP(RC[-9],Enunciado!R3C6:R5C7,2,0),"") -> 
A227: Dept5-28049 | B227: Medio | C227: 41192 | D227: 41238 | E227: =+LEFT(RC[-4],5) -> Dept5 | F227: =+VLOOKUP(RC[-4],Enunciado!R3C6:R5C7,2,0)+RC[-3] -> 41207 | G227: =+IF(RC[-1]>=RC[-3],"ON TIME","OUT OF TIME") -> OUT OF TIME | H227: =+YEAR(RC[-5]) -> 2012 | I227: =+MONTH(RC[-6]) -> 10 | J227: =+RC[-6]-RC[-7] -> 46 | K227: =+IF(RC[-4]="OUT of TIME",RC[-1]-VLOOKUP(RC[-9],Enunciado!R3C6:R5C7,2,0),"") -> 31
A228: Dept5-6589 | B228: Medio | C228: 40992 | D228: 41033 | E228: =+LEFT(RC[-4],5) -> Dept5 | F228: =+VLOOKUP(RC[-4],Enunciado!R3C6:R5C7,2,0)+RC[-3] -> 41007 | G228: =+IF(RC[-1]>=RC[-3],"ON TIME","OUT OF TIME") -> OUT OF TIME | H228: =+YEAR(RC[-5]) -> 2012 | I228: =+MONTH(RC[-6]) -> 3 | J228: =+RC[-6]-RC[-7] -> 41 | K228: =+IF(RC[-4]="OUT of TIME",RC[-1]-VLOOKUP(RC[-9],Enunciado!R3C6:R5C7,2,0),"") -> 26
A229: Dept3-28948 | B229: Medio | C229: 41085 | D229: 41101 | E229: =+LEFT(RC[-4],5) -> Dept3 | F229: =+VLOOKUP(RC[-4],Enunciado!R3C6:R5C7,2,0)+RC[-3] -> 41100 | G229: =+IF(RC[-1]>=RC[-3],"ON TIME","OUT OF TIME") -> OUT OF TIME | H229: =+YEAR(RC[-5]) -> 2012 | I229: =+MONTH(RC[-6]) -> 6 | J229: =+RC[-6]-RC[-7] -> 16 | K229: =+IF(RC[-4]="OUT of TIME",RC[-1]-VLOOKUP(RC[-9],Enunciado!R3C6:R5C7,2,0),"") -> 1
A230: Dept4-9925 | B230: Medio | C230: 40919 | D230: 40931 | E230: =+LEFT(RC[-4],5) -> Dept4 | F230: =+VLOOKUP(RC[-4],Enunciado!R3C6:R5C7,2,0)+RC[-3] -> 40934 | G230: =+IF(RC[-1]>=RC[-3],"ON TIME","OUT OF TIME") -> ON TIME | H230: =+YEAR(RC[-5]) -> 2012 | I230: =+MONTH(RC[-6]) -> 1 | J230: =+RC[-6]-RC[-7] -> 12 | K230: =+IF(RC[-4]="OUT of TIME",RC[-1]-VLOOKUP(RC[-9],Enunciado!R3C6:R5C7,2,0),"") -> 
A231: Dept1-5673 | B231: Medio | C231: 41345 | D231: 41348 | E231: =+LEFT(RC[-4],5) -> Dept1 | F231: =+VLOOKUP(RC[-4],Enunciado!R3C6:R5C7,2,0)+RC[-3] -> 41360 | G231: =+IF(RC[-1]>=RC[-3],"ON TIME","OUT OF TIME") -> ON TIME | H231: =+YEAR(RC[-5]) -> 2013 | I231: =+MONTH(RC[-6]) -> 3 | J231: =+RC[-6]-RC[-7] -> 3 | K231: =+IF(RC[-4]="OUT of TIME",RC[-1]-VLOOKUP(RC[-9],Enunciado!R3C6:R5C7,2,0),"") -> 
A232: Dept6-28500 | B232: Medio | C232: 41055 | D232: 41056 | E232: =+LEFT(RC[-4],5) -> Dept6 | F232: =+VLOOKUP(RC[-4],Enunciado!R3C6:R5C7,2,0)+RC[-3] -> 41070 | G232: =+IF(RC[-1]>=RC[-3],"ON TIME","OUT OF TIME") -> ON TIME | H232: =+YEAR(RC[-5]) -> 2012 | I232: =+MONTH(RC[-6]) -> 5 | J232: =+RC[-6]-RC[-7] -> 1 | K232: =+IF(RC[-4]="OUT of TIME",RC[-1]-VLOOKUP(RC[-9],Enunciado!R3C6:R5C7,2,0),"") -> 
A233: Dept5-18834 | B233: Medio | C233: 41038 | D233: 41043 | E233: =+LEFT(RC[-4],5) -> Dept5 | F233: =+VLOOKUP(RC[-4],Enunciado!R3C6:R5C7,2,0)+RC[-3] -> 41053 | G233: =+IF(RC[-1]>=RC[-3],"ON TIME","OUT OF TIME") -> ON TIME | H233: =+YEAR(RC[-5]) -> 2012 | I233: =+MONTH(RC[-6]) -> 5 | J233: =+RC[-6]-RC[-7] -> 5 | K233: =+IF(RC[-4]="OUT of TIME",RC[-1]-VLOOKUP(RC[-9],Enunciado!R3C6:R5C7,2,0),"") -> 
A234: Dept2-17670 | B234: Medio | C234: 41111 | D234: 41112 | E234: =+LEFT(RC[-4],5) -> Dept2 | F234: =+VLOOKUP(RC[-4],Enunciado!R3C6:R5C7,2,0)+RC[-3] -> 41126 | G234: =+IF(RC[-1]>=RC[-3],"ON TIME","OUT OF TIME") -> ON TIME | H234: =+YEAR(RC[-5]) -> 2012 | I234: =+MONTH(RC[-6]) -> 7 | J234: =+RC[-6]-RC[-7] -> 1 | K234: =+IF(RC[-4]="OUT of TIME",RC[-1]-VLOOKUP(RC[-9],Enunciado!R3C6:R5C7,2,0),"") -> 
A235: Dept3-13101 | B235: Medio | C235: 41059 | D235: 41070 | E235: =+LEFT(RC[-4],5) -> Dept3 | F235: =+VLOOKUP(RC[-4],Enunciado!R3C6:R5C7,2,0)+RC[-3] -> 41074 | G235: =+IF(RC[-1]>=RC[-3],"ON TIME","OUT OF TIME") -> ON TIME | H235: =+YEAR(RC[-5]) -> 2012 | I235: =+MONTH(RC[-6]) -> 5 | J235: =+RC[-6]-RC[-7] -> 11 | K235: =+IF(RC[-4]="OUT of TIME",RC[-1]-VLOOKUP(RC[-9],Enunciado!R3C6:R5C7,2,0),"") -> 
A236: Dept2-7902 | B236: Bajo | C236: 41475 | D236: 41476 | E236: =+LEFT(RC[-4],5) -> Dept2 | F236: =+VLOOKUP(RC[-4],Enunciado!R3C6:R5C7,2,0)+RC[-3] -> 41505 | G236: =+IF(RC[-1]>=RC[-3],"ON TIME","OUT OF TIME") -> ON TIME | H236: =+YEAR(RC[-5]) -> 2013 | I236: =+MONTH(RC[-6]) -> 7 | J236: =+RC[-6]-RC[-7] -> 1 | K236: =+IF(RC[-4]="OUT of TIME",RC[-1]-VLOOKUP(RC[-9],Enunciado!R3C6:R5C7,2,0),"") -> 
A237: Dept4-9491 | B237: Bajo | C237: 40978 | D237: 40993 | E237: =+LEFT(RC[-4],5) -> Dept4 | F237: =+VLOOKUP(RC[-4],Enunciado!R3C6:R5C7,2,0)+RC[-3] -> 41008 | G237: =+IF(RC[-1]>=RC[-3],"ON TIME","OUT OF TIME") -> ON TIME | H237: =+YEAR(RC[-5]) -> 2012 | I237: =+MONTH(RC[-6]) -> 3 | J237: =+RC[-6]-RC[-7] -> 15 | K237: =+IF(RC[-4]="OUT of TIME",RC[-1]-VLOOKUP(RC[-9],Enunciado!R3C6:R5C7,2,0),"") -> 
A238: Dept3-1460 | B238: Alto | C238: 41017 | D238: 41025 | E238: =+LEFT(RC[-4],5) -> Dept3 | F238: =+VLOOKUP(RC[-4],Enunciado!R3C6:R5C7,2,0)+RC[-3] -> 41022 | G238: =+IF(RC[-1]>=RC[-3],"ON TIME","OUT OF TIME") -> OUT OF TIME | H238: =+YEAR(RC[-5]) -> 2012 | I238: =+MONTH(RC[-6]) -> 4 | J238: =+RC[-6]-RC[-7] -> 8 | K238: =+IF(RC[-4]="OUT of TIME",RC[-1]-VLOOKUP(RC[-9],Enunciado!R3C6:R5C7,2,0),"") -> 3
A239: Dept6-21218 | B239: Alto | C239: 41092 | D239: 41112 | E239: =+LEFT(RC[-4],5) -> Dept6 | F239: =+VLOOKUP(RC[-4],Enunciado!R3C6:R5C7,2,0)+RC[-3] -> 41097 | G239: =+IF(RC[-1]>=RC[-3],"ON TIME","OUT OF TIME") -> OUT OF TIME | H239: =+YEAR(RC[-5]) -> 2012 | I239: =+MONTH(RC[-6]) -> 7 | J239: =+RC[-6]-RC[-7] -> 20 | K239: =+IF(RC[-4]="OUT of TIME",RC[-1]-VLOOKUP(RC[-9],Enunciado!R3C6:R5C7,2,0),"") -> 15
A240: Dept1-14987 | B240: Alto | C240: 41203 | D240: 41235 | E240: =+LEFT(RC[-4],5) -> Dept1 | F240: =+VLOOKUP(RC[-4],Enunciado!R3C6:R5C7,2,0)+RC[-3] -> 41208 | G240: =+IF(RC[-1]>=RC[-3],"ON TIME","OUT OF TIME") -> OUT OF TIME | H240: =+YEAR(RC[-5]) -> 2012 | I240: =+MONTH(RC[-6]) -> 10 | J240: =+RC[-6]-RC[-7] -> 32 | K240: =+IF(RC[-4]="OUT of TIME",RC[-1]-VLOOKUP(RC[-9],Enunciado!R3C6:R5C7,2,0),"") -> 27
A241: Dept4-29649 | B241: Alto | C241: 41433 | D241: 41452 | E241: =+LEFT(RC[-4],5) -> Dept4 | F241: =+VLOOKUP(RC[-4],Enunciado!R3C6:R5C7,2,0)+RC[-3] -> 41438 | G241: =+IF(RC[-1]>=RC[-3],"ON TIME","OUT OF TIME") -> OUT OF TIME | H241: =+YEAR(RC[-5]) -> 2013 | I241: =+MONTH(RC[-6]) -> 6 | J241: =+RC[-6]-RC[-7] -> 19 | K241: =+IF(RC[-4]="OUT of TIME",RC[-1]-VLOOKUP(RC[-9],Enunciado!R3C6:R5C7,2,0),"") -> 14
A242: Dept4-15801 | B242: Medio | C242: 41562 | D242: 41572 | E242: =+LEFT(RC[-4],5) -> Dept4 | F242: =+VLOOKUP(RC[-4],Enunciado!R3C6:R5C7,2,0)+RC[-3] -> 41577 | G242: =+IF(RC[-1]>=RC[-3],"ON TIME","OUT OF TIME") -> ON TIME | H242: =+YEAR(RC[-5]) -> 2013 | I242: =+MONTH(RC[-6]) -> 10 | J242: =+RC[-6]-RC[-7] -> 10 | K242: =+IF(RC[-4]="OUT of TIME",RC[-1]-VLOOKUP(RC[-9],Enunciado!R3C6:R5C7,2,0),"") -> 
A243: Dept6-4452 | B243: Alto | C243: 41423 | D243: 41425 | E243: =+LEFT(RC[-4],5) -> Dept6 | F243: =+VLOOKUP(RC[-4],Enunciado!R3C6:R5C7,2,0)+RC[-3] -> 41428 | G243: =+IF(RC[-1]>=RC[-3],"ON TIME","OUT OF TIME") -> ON TIME | H243: =+YEAR(RC[-5]) -> 2013 | I243: =+MONTH(RC[-6]) -> 5 | J243: =+RC[-6]-RC[-7] -> 2 | K243: =+IF(RC[-4]="OUT of TIME",RC[-1]-VLOOKUP(RC[-9],Enunciado!R3C6:R5C7,2,0),"") -> 
A244: Dept5-17207 | B244: Medio | C244: 41532 | D244: 41554 | E244: =+LEFT(RC[-4],5) -> Dept5 | F244: =+VLOOKUP(RC[-4],Enunciado!R3C6:R5C7,2,0)+RC[-3] -> 41547 | G244: =+IF(RC[-1]>=RC[-3],"ON TIME","OUT OF TIME") -> OUT OF TIME | H244: =+YEAR(RC[-5]) -> 2013 | I244: =+MONTH(RC[-6]) -> 9 | J244: =+RC[-6]-RC[-7] -> 22 | K244: =+IF(RC[-4]="OUT of TIME",RC[-1]-VLOOKUP(RC[-9],Enunciado!R3C6:R5C7,2,0),"") -> 7
A245: Dept1-19475 | B245: Alto | C245: 41553 | D245: 41567 | E245: =+LEFT(RC[-4],5) -> Dept1 | F245: =+VLOOKUP(RC[-4],Enunciado!R3C6:R5C7,2,0)+RC[-3] -> 41558 | G245: =+IF(RC[-1]>=RC[-3],"ON TIME","OUT OF TIME") -> OUT OF TIME | H245: =+YEAR(RC[-5]) -> 2013 | I245: =+MONTH(RC[-6]) -> 10 | J245: =+RC[-6]-RC[-7] -> 14 | K245: =+IF(RC[-4]="OUT of TIME",RC[-1]-VLOOKUP(RC[-9],Enunciado!R3C6:R5C7,2,0),"") -> 9
A246: Dept3-5656 | B246: Medio | C246: 41493 | D246: 41537 | E246: =+LEFT(RC[-4],5) -> Dept3 | F246: =+VLOOKUP(RC[-4],Enunciado!R3C6:R5C7,2,0)+RC[-3] -> 41508 | G246: =+IF(RC[-1]>=RC[-3],"ON TIME","OUT OF TIME") -> OUT OF TIME | H246: =+YEAR(RC[-5]) -> 2013 | I246: =+MONTH(RC[-6]) -> 8 | J246: =+RC[-6]-RC[-7] -> 44 | K246: =+IF(RC[-4]="OUT of TIME",RC[-1]-VLOOKUP(RC[-9],Enunciado!R3C6:R5C7,2,0),"") -> 29
A247: Dept4-13435 | B247: Medio | C247: 41129 | D247: 41130 | E247: =+LEFT(RC[-4],5) -> Dept4 | F247: =+VLOOKUP(RC[-4],Enunciado!R3C6:R5C7,2,0)+RC[-3] -> 41144 | G247: =+IF(RC[-1]>=RC[-3],"ON TIME","OUT OF TIME") -> ON TIME | H247: =+YEAR(RC[-5]) -> 2012 | I247: =+MONTH(RC[-6]) -> 8 | J247: =+RC[-6]-RC[-7] -> 1 | K247: =+IF(RC[-4]="OUT of TIME",RC[-1]-VLOOKUP(RC[-9],Enunciado!R3C6:R5C7,2,0),"") -> 
A248: Dept5-10046 | B248: Bajo | C248: 41009 | D248: 41010 | E248: =+LEFT(RC[-4],5) -> Dept5 | F248: =+VLOOKUP(RC[-4],Enunciado!R3C6:R5C7,2,0)+RC[-3] -> 41039 | G248: =+IF(RC[-1]>=RC[-3],"ON TIME","OUT OF TIME") -> ON TIME | H248: =+YEAR(RC[-5]) -> 2012 | I248: =+MONTH(RC[-6]) -> 4 | J248: =+RC[-6]-RC[-7] -> 1 | K248: =+IF(RC[-4]="OUT of TIME",RC[-1]-VLOOKUP(RC[-9],Enunciado!R3C6:R5C7,2,0),"") -> 
A249: Dept2-11977 | B249: Alto | C249: 41185 | D249: 41223 | E249: =+LEFT(RC[-4],5) -> Dept2 | F249: =+VLOOKUP(RC[-4],Enunciado!R3C6:R5C7,2,0)+RC[-3] -> 41190 | G249: =+IF(RC[-1]>=RC[-3],"ON TIME","OUT OF TIME") -> OUT OF TIME | H249: =+YEAR(RC[-5]) -> 2012 | I249: =+MONTH(RC[-6]) -> 10 | J249: =+RC[-6]-RC[-7] -> 38 | K249: =+IF(RC[-4]="OUT of TIME",RC[-1]-VLOOKUP(RC[-9],Enunciado!R3C6:R5C7,2,0),"") -> 33
A250: Dept6-981 | B250: Alto | C250: 41428 | D250: 41440 | E250: =+LEFT(RC[-4],5) -> Dept6 | F250: =+VLOOKUP(RC[-4],Enunciado!R3C6:R5C7,2,0)+RC[-3] -> 41433 | G250: =+IF(RC[-1]>=RC[-3],"ON TIME","OUT OF TIME") -> OUT OF TIME | H250: =+YEAR(RC[-5]) -> 2013 | I250: =+MONTH(RC[-6]) -> 6 | J250: =+RC[-6]-RC[-7] -> 12 | K250: =+IF(RC[-4]="OUT of TIME",RC[-1]-VLOOKUP(RC[-9],Enunciado!R3C6:R5C7,2,0),"") -> 7
A251: Dept4-15155 | B251: Bajo | C251: 41008 | D251: 41010 | E251: =+LEFT(RC[-4],5) -> Dept4 | F251: =+VLOOKUP(RC[-4],Enunciado!R3C6:R5C7,2,0)+RC[-3] -> 41038 | G251: =+IF(RC[-1]>=RC[-3],"ON TIME","OUT OF TIME") -> ON TIME | H251: =+YEAR(RC[-5]) -> 2012 | I251: =+MONTH(RC[-6]) -> 4 | J251: =+RC[-6]-RC[-7] -> 2 | K251: =+IF(RC[-4]="OUT of TIME",RC[-1]-VLOOKUP(RC[-9],Enunciado!R3C6:R5C7,2,0),"") -> 
A252: Dept1-5311 | B252: Bajo | C252: 41501 | D252: 41543 | E252: =+LEFT(RC[-4],5) -> Dept1 | F252: =+VLOOKUP(RC[-4],Enunciado!R3C6:R5C7,2,0)+RC[-3] -> 41531 | G252: =+IF(RC[-1]>=RC[-3],"ON TIME","OUT OF TIME") -> OUT OF TIME | H252: =+YEAR(RC[-5]) -> 2013 | I252: =+MONTH(RC[-6]) -> 8 | J252: =+RC[-6]-RC[-7] -> 42 | K252: =+IF(RC[-4]="OUT of TIME",RC[-1]-VLOOKUP(RC[-9],Enunciado!R3C6:R5C7,2,0),"") -> 12
A253: Dept2-21912 | B253: Alto | C253: 41348 | D253: 41350 | E253: =+LEFT(RC[-4],5) -> Dept2 | F253: =+VLOOKUP(RC[-4],Enunciado!R3C6:R5C7,2,0)+RC[-3] -> 41353 | G253: =+IF(RC[-1]>=RC[-3],"ON TIME","OUT OF TIME") -> ON TIME | H253: =+YEAR(RC[-5]) -> 2013 | I253: =+MONTH(RC[-6]) -> 3 | J253: =+RC[-6]-RC[-7] -> 2 | K253: =+IF(RC[-4]="OUT of TIME",RC[-1]-VLOOKUP(RC[-9],Enunciado!R3C6:R5C7,2,0),"") -> 
A254: Dept1-18751 | B254: Bajo | C254: 41085 | D254: 41086 | E254: =+LEFT(RC[-4],5) -> Dept1 | F254: =+VLOOKUP(RC[-4],Enunciado!R3C6:R5C7,2,0)+RC[-3] -> 41115 | G254: =+IF(RC[-1]>=RC[-3],"ON TIME","OUT OF TIME") -> ON TIME | H254: =+YEAR(RC[-5]) -> 2012 | I254: =+MONTH(RC[-6]) -> 6 | J254: =+RC[-6]-RC[-7] -> 1 | K254: =+IF(RC[-4]="OUT of TIME",RC[-1]-VLOOKUP(RC[-9],Enunciado!R3C6:R5C7,2,0),"") -> 
A255: Dept5-10612 | B255: Bajo | C255: 41507 | D255: 41520 | E255: =+LEFT(RC[-4],5) -> Dept5 | F255: =+VLOOKUP(RC[-4],Enunciado!R3C6:R5C7,2,0)+RC[-3] -> 41537 | G255: =+IF(RC[-1]>=RC[-3],"ON TIME","OUT OF TIME") -> ON TIME | H255: =+YEAR(RC[-5]) -> 2013 | I255: =+MONTH(RC[-6]) -> 8 | J255: =+RC[-6]-RC[-7] -> 13 | K255: =+IF(RC[-4]="OUT of TIME",RC[-1]-VLOOKUP(RC[-9],Enunciado!R3C6:R5C7,2,0),"") -> 
A256: Dept2-26904 | B256: Alto | C256: 41031 | D256: 41039 | E256: =+LEFT(RC[-4],5) -> Dept2 | F256: =+VLOOKUP(RC[-4],Enunciado!R3C6:R5C7,2,0)+RC[-3] -> 41036 | G256: =+IF(RC[-1]>=RC[-3],"ON TIME","OUT OF TIME") -> OUT OF TIME | H256: =+YEAR(RC[-5]) -> 2012 | I256: =+MONTH(RC[-6]) -> 5 | J256: =+RC[-6]-RC[-7] -> 8 | K256: =+IF(RC[-4]="OUT of TIME",RC[-1]-VLOOKUP(RC[-9],Enunciado!R3C6:R5C7,2,0),"") -> 3
A257: Dept2-2190 | B257: Medio | C257: 41379 | D257: 41428 | E257: =+LEFT(RC[-4],5) -> Dept2 | F257: =+VLOOKUP(RC[-4],Enunciado!R3C6:R5C7,2,0)+RC[-3] -> 41394 | G257: =+IF(RC[-1]>=RC[-3],"ON TIME","OUT OF TIME") -> OUT OF TIME | H257: =+YEAR(RC[-5]) -> 2013 | I257: =+MONTH(RC[-6]) -> 4 | J257: =+RC[-6]-RC[-7] -> 49 | K257: =+IF(RC[-4]="OUT of TIME",RC[-1]-VLOOKUP(RC[-9],Enunciado!R3C6:R5C7,2,0),"") -> 34
A258: Dept3-2493 | B258: Medio | C258: 41231 | D258: 41241 | E258: =+LEFT(RC[-4],5) -> Dept3 | F258: =+VLOOKUP(RC[-4],Enunciado!R3C6:R5C7,2,0)+RC[-3] -> 41246 | G258: =+IF(RC[-1]>=RC[-3],"ON TIME","OUT OF TIME") -> ON TIME | H258: =+YEAR(RC[-5]) -> 2012 | I258: =+MONTH(RC[-6]) -> 11 | J258: =+RC[-6]-RC[-7] -> 10 | K258: =+IF(RC[-4]="OUT of TIME",RC[-1]-VLOOKUP(RC[-9],Enunciado!R3C6:R5C7,2,0),"") -> 
A259: Dept6-9979 | B259: Medio | C259: 41453 | D259: 41454 | E259: =+LEFT(RC[-4],5) -> Dept6 | F259: =+VLOOKUP(RC[-4],Enunciado!R3C6:R5C7,2,0)+RC[-3] -> 41468 | G259: =+IF(RC[-1]>=RC[-3],"ON TIME","OUT OF TIME") -> ON TIME | H259: =+YEAR(RC[-5]) -> 2013 | I259: =+MONTH(RC[-6]) -> 6 | J259: =+RC[-6]-RC[-7] -> 1 | K259: =+IF(RC[-4]="OUT of TIME",RC[-1]-VLOOKUP(RC[-9],Enunciado!R3C6:R5C7,2,0),"") -> 
A260: Dept2-24113 | B260: Bajo | C260: 41091 | D260: 41092 | E260: =+LEFT(RC[-4],5) -> Dept2 | F260: =+VLOOKUP(RC[-4],Enunciado!R3C6:R5C7,2,0)+RC[-3] -> 41121 | G260: =+IF(RC[-1]>=RC[-3],"ON TIME","OUT OF TIME") -> ON TIME | H260: =+YEAR(RC[-5]) -> 2012 | I260: =+MONTH(RC[-6]) -> 7 | J260: =+RC[-6]-RC[-7] -> 1 | K260: =+IF(RC[-4]="OUT of TIME",RC[-1]-VLOOKUP(RC[-9],Enunciado!R3C6:R5C7,2,0),"") -> 
A261: Dept5-17783 | B261: Alto | C261: 41510 | D261: 41510 | E261: =+LEFT(RC[-4],5) -> Dept5 | F261: =+VLOOKUP(RC[-4],Enunciado!R3C6:R5C7,2,0)+RC[-3] -> 41515 | G261: =+IF(RC[-1]>=RC[-3],"ON TIME","OUT OF TIME") -> ON TIME | H261: =+YEAR(RC[-5]) -> 2013 | I261: =+MONTH(RC[-6]) -> 8 | J261: =+RC[-6]-RC[-7] -> 0 | K261: =+IF(RC[-4]="OUT of TIME",RC[-1]-VLOOKUP(RC[-9],Enunciado!R3C6:R5C7,2,0),"") -> 
A262: Dept2-9321 | B262: Medio | C262: 41637 | D262: 41647 | E262: =+LEFT(RC[-4],5) -> Dept2 | F262: =+VLOOKUP(RC[-4],Enunciado!R3C6:R5C7,2,0)+RC[-3] -> 41652 | G262: =+IF(RC[-1]>=RC[-3],"ON TIME","OUT OF TIME") -> ON TIME | H262: =+YEAR(RC[-5]) -> 2013 | I262: =+MONTH(RC[-6]) -> 12 | J262: =+RC[-6]-RC[-7] -> 10 | K262: =+IF(RC[-4]="OUT of TIME",RC[-1]-VLOOKUP(RC[-9],Enunciado!R3C6:R5C7,2,0),"") -> 
A263: Dept1-15252 | B263: Bajo | C263: 41522 | D263: 41537 | E263: =+LEFT(RC[-4],5) -> Dept1 | F263: =+VLOOKUP(RC[-4],Enunciado!R3C6:R5C7,2,0)+RC[-3] -> 41552 | G263: =+IF(RC[-1]>=RC[-3],"ON TIME","OUT OF TIME") -> ON TIME | H263: =+YEAR(RC[-5]) -> 2013 | I263: =+MONTH(RC[-6]) -> 9 | J263: =+RC[-6]-RC[-7] -> 15 | K263: =+IF(RC[-4]="OUT of TIME",RC[-1]-VLOOKUP(RC[-9],Enunciado!R3C6:R5C7,2,0),"") -> 
A264: Dept2-2383 | B264: Medio | C264: 41632 | D264: 41634 | E264: =+LEFT(RC[-4],5) -> Dept2 | F264: =+VLOOKUP(RC[-4],Enunciado!R3C6:R5C7,2,0)+RC[-3] -> 41647 | G264: =+IF(RC[-1]>=RC[-3],"ON TIME","OUT OF TIME") -> ON TIME | H264: =+YEAR(RC[-5]) -> 2013 | I264: =+MONTH(RC[-6]) -> 12 | J264: =+RC[-6]-RC[-7] -> 2 | K264: =+IF(RC[-4]="OUT of TIME",RC[-1]-VLOOKUP(RC[-9],Enunciado!R3C6:R5C7,2,0),"") -> 
A265: Dept2-7128 | B265: Alto | C265: 41328 | D265: 41329 | E265: =+LEFT(RC[-4],5) -> Dept2 | F265: =+VLOOKUP(RC[-4],Enunciado!R3C6:R5C7,2,0)+RC[-3] -> 41333 | G265: =+IF(RC[-1]>=RC[-3],"ON TIME","OUT OF TIME") -> ON TIME | H265: =+YEAR(RC[-5]) -> 2013 | I265: =+MONTH(RC[-6]) -> 2 | J265: =+RC[-6]-RC[-7] -> 1 | K265: =+IF(RC[-4]="OUT of TIME",RC[-1]-VLOOKUP(RC[-9],Enunciado!R3C6:R5C7,2,0),"") -> 
A266: Dept2-14463 | B266: Bajo | C266: 41544 | D266: 41554 | E266: =+LEFT(RC[-4],5) -> Dept2 | F266: =+VLOOKUP(RC[-4],Enunciado!R3C6:R5C7,2,0)+RC[-3] -> 41574 | G266: =+IF(RC[-1]>=RC[-3],"ON TIME","OUT OF TIME") -> ON TIME | H266: =+YEAR(RC[-5]) -> 2013 | I266: =+MONTH(RC[-6]) -> 9 | J266: =+RC[-6]-RC[-7] -> 10 | K266: =+IF(RC[-4]="OUT of TIME",RC[-1]-VLOOKUP(RC[-9],Enunciado!R3C6:R5C7,2,0),"") -> 
A267: Dept2-10413 | B267: Alto | C267: 41572 | D267: 41578 | E267: =+LEFT(RC[-4],5) -> Dept2 | F267: =+VLOOKUP(RC[-4],Enunciado!R3C6:R5C7,2,0)+RC[-3] -> 41577 | G267: =+IF(RC[-1]>=RC[-3],"ON TIME","OUT OF TIME") -> OUT OF TIME | H267: =+YEAR(RC[-5]) -> 2013 | I267: =+MONTH(RC[-6]) -> 10 | J267: =+RC[-6]-RC[-7] -> 6 | K267: =+IF(RC[-4]="OUT of TIME",RC[-1]-VLOOKUP(RC[-9],Enunciado!R3C6:R5C7,2,0),"") -> 1
A268: Dept4-11606 | B268: Medio | C268: 41367 | D268: 41405 | E268: =+LEFT(RC[-4],5) -> Dept4 | F268: =+VLOOKUP(RC[-4],Enunciado!R3C6:R5C7,2,0)+RC[-3] -> 41382 | G268: =+IF(RC[-1]>=RC[-3],"ON TIME","OUT OF TIME") -> OUT OF TIME | H268: =+YEAR(RC[-5]) -> 2013 | I268: =+MONTH(RC[-6]) -> 4 | J268: =+RC[-6]-RC[-7] -> 38 | K268: =+IF(RC[-4]="OUT of TIME",RC[-1]-VLOOKUP(RC[-9],Enunciado!R3C6:R5C7,2,0),"") -> 23
A269: Dept3-1038 | B269: Alto | C269: 41167 | D269: 41175 | E269: =+LEFT(RC[-4],5) -> Dept3 | F269: =+VLOOKUP(RC[-4],Enunciado!R3C6:R5C7,2,0)+RC[-3] -> 41172 | G269: =+IF(RC[-1]>=RC[-3],"ON TIME","OUT OF TIME") -> OUT OF TIME | H269: =+YEAR(RC[-5]) -> 2012 | I269: =+MONTH(RC[-6]) -> 9 | J269: =+RC[-6]-RC[-7] -> 8 | K269: =+IF(RC[-4]="OUT of TIME",RC[-1]-VLOOKUP(RC[-9],Enunciado!R3C6:R5C7,2,0),"") -> 3
A270: Dept5-23292 | B270: Medio | C270: 41610 | D270: 41618 | E270: =+LEFT(RC[-4],5) -> Dept5 | F270: =+VLOOKUP(RC[-4],Enunciado!R3C6:R5C7,2,0)+RC[-3] -> 41625 | G270: =+IF(RC[-1]>=RC[-3],"ON TIME","OUT OF TIME") -> ON TIME | H270: =+YEAR(RC[-5]) -> 2013 | I270: =+MONTH(RC[-6]) -> 12 | J270: =+RC[-6]-RC[-7] -> 8 | K270: =+IF(RC[-4]="OUT of TIME",RC[-1]-VLOOKUP(RC[-9],Enunciado!R3C6:R5C7,2,0),"") -> 
A271: Dept3-19080 | B271: Medio | C271: 41168 | D271: 41169 | E271: =+LEFT(RC[-4],5) -> Dept3 | F271: =+VLOOKUP(RC[-4],Enunciado!R3C6:R5C7,2,0)+RC[-3] -> 41183 | G271: =+IF(RC[-1]>=RC[-3],"ON TIME","OUT OF TIME") -> ON TIME | H271: =+YEAR(RC[-5]) -> 2012 | I271: =+MONTH(RC[-6]) -> 9 | J271: =+RC[-6]-RC[-7] -> 1 | K271: =+IF(RC[-4]="OUT of TIME",RC[-1]-VLOOKUP(RC[-9],Enunciado!R3C6:R5C7,2,0),"") -> 
A272: Dept5-21897 | B272: Alto | C272: 41294 | D272: 41341 | E272: =+LEFT(RC[-4],5) -> Dept5 | F272: =+VLOOKUP(RC[-4],Enunciado!R3C6:R5C7,2,0)+RC[-3] -> 41299 | G272: =+IF(RC[-1]>=RC[-3],"ON TIME","OUT OF TIME") -> OUT OF TIME | H272: =+YEAR(RC[-5]) -> 2013 | I272: =+MONTH(RC[-6]) -> 1 | J272: =+RC[-6]-RC[-7] -> 47 | K272: =+IF(RC[-4]="OUT of TIME",RC[-1]-VLOOKUP(RC[-9],Enunciado!R3C6:R5C7,2,0),"") -> 42
A273: Dept6-19102 | B273: Medio | C273: 41356 | D273: 41369 | E273: =+LEFT(RC[-4],5) -> Dept6 | F273: =+VLOOKUP(RC[-4],Enunciado!R3C6:R5C7,2,0)+RC[-3] -> 41371 | G273: =+IF(RC[-1]>=RC[-3],"ON TIME","OUT OF TIME") -> ON TIME | H273: =+YEAR(RC[-5]) -> 2013 | I273: =+MONTH(RC[-6]) -> 3 | J273: =+RC[-6]-RC[-7] -> 13 | K273: =+IF(RC[-4]="OUT of TIME",RC[-1]-VLOOKUP(RC[-9],Enunciado!R3C6:R5C7,2,0),"") -> 
A274: Dept4-10860 | B274: Medio | C274: 41523 | D274: 41524 | E274: =+LEFT(RC[-4],5) -> Dept4 | F274: =+VLOOKUP(RC[-4],Enunciado!R3C6:R5C7,2,0)+RC[-3] -> 41538 | G274: =+IF(RC[-1]>=RC[-3],"ON TIME","OUT OF TIME") -> ON TIME | H274: =+YEAR(RC[-5]) -> 2013 | I274: =+MONTH(RC[-6]) -> 9 | J274: =+RC[-6]-RC[-7] -> 1 | K274: =+IF(RC[-4]="OUT of TIME",RC[-1]-VLOOKUP(RC[-9],Enunciado!R3C6:R5C7,2,0),"") -> 
A275: Dept1-19667 | B275: Medio | C275: 41084 | D275: 41108 | E275: =+LEFT(RC[-4],5) -> Dept1 | F275: =+VLOOKUP(RC[-4],Enunciado!R3C6:R5C7,2,0)+RC[-3] -> 41099 | G275: =+IF(RC[-1]>=RC[-3],"ON TIME","OUT OF TIME") -> OUT OF TIME | H275: =+YEAR(RC[-5]) -> 2012 | I275: =+MONTH(RC[-6]) -> 6 | J275: =+RC[-6]-RC[-7] -> 24 | K275: =+IF(RC[-4]="OUT of TIME",RC[-1]-VLOOKUP(RC[-9],Enunciado!R3C6:R5C7,2,0),"") -> 9
A276: Dept5-16877 | B276: Medio | C276: 41481 | D276: 41484 | E276: =+LEFT(RC[-4],5) -> Dept5 | F276: =+VLOOKUP(RC[-4],Enunciado!R3C6:R5C7,2,0)+RC[-3] -> 41496 | G276: =+IF(RC[-1]>=RC[-3],"ON TIME","OUT OF TIME") -> ON TIME | H276: =+YEAR(RC[-5]) -> 2013 | I276: =+MONTH(RC[-6]) -> 7 | J276: =+RC[-6]-RC[-7] -> 3 | K276: =+IF(RC[-4]="OUT of TIME",RC[-1]-VLOOKUP(RC[-9],Enunciado!R3C6:R5C7,2,0),"") -> 
A277: Dept1-3597 | B277: Alto | C277: 41002 | D277: 41049 | E277: =+LEFT(RC[-4],5) -> Dept1 | F277: =+VLOOKUP(RC[-4],Enunciado!R3C6:R5C7,2,0)+RC[-3] -> 41007 | G277: =+IF(RC[-1]>=RC[-3],"ON TIME","OUT OF TIME") -> OUT OF TIME | H277: =+YEAR(RC[-5]) -> 2012 | I277: =+MONTH(RC[-6]) -> 4 | J277: =+RC[-6]-RC[-7] -> 47 | K277: =+IF(RC[-4]="OUT of TIME",RC[-1]-VLOOKUP(RC[-9],Enunciado!R3C6:R5C7,2,0),"") -> 42
A278: Dept3-18928 | B278: Alto | C278: 41626 | D278: 41626 | E278: =+LEFT(RC[-4],5) -> Dept3 | F278: =+VLOOKUP(RC[-4],Enunciado!R3C6:R5C7,2,0)+RC[-3] -> 41631 | G278: =+IF(RC[-1]>=RC[-3],"ON TIME","OUT OF TIME") -> ON TIME | H278: =+YEAR(RC[-5]) -> 2013 | I278: =+MONTH(RC[-6]) -> 12 | J278: =+RC[-6]-RC[-7] -> 0 | K278: =+IF(RC[-4]="OUT of TIME",RC[-1]-VLOOKUP(RC[-9],Enunciado!R3C6:R5C7,2,0),"") -> 
A279: Dept3-18038 | B279: Medio | C279: 41101 | D279: 41120 | E279: =+LEFT(RC[-4],5) -> Dept3 | F279: =+VLOOKUP(RC[-4],Enunciado!R3C6:R5C7,2,0)+RC[-3] -> 41116 | G279: =+IF(RC[-1]>=RC[-3],"ON TIME","OUT OF TIME") -> OUT OF TIME | H279: =+YEAR(RC[-5]) -> 2012 | I279: =+MONTH(RC[-6]) -> 7 | J279: =+RC[-6]-RC[-7] -> 19 | K279: =+IF(RC[-4]="OUT of TIME",RC[-1]-VLOOKUP(RC[-9],Enunciado!R3C6:R5C7,2,0),"") -> 4
A280: Dept1-4455 | B280: Alto | C280: 41196 | D280: 41200 | E280: =+LEFT(RC[-4],5) -> Dept1 | F280: =+VLOOKUP(RC[-4],Enunciado!R3C6:R5C7,2,0)+RC[-3] -> 41201 | G280: =+IF(RC[-1]>=RC[-3],"ON TIME","OUT OF TIME") -> ON TIME | H280: =+YEAR(RC[-5]) -> 2012 | I280: =+MONTH(RC[-6]) -> 10 | J280: =+RC[-6]-RC[-7] -> 4 | K280: =+IF(RC[-4]="OUT of TIME",RC[-1]-VLOOKUP(RC[-9],Enunciado!R3C6:R5C7,2,0),"") -> 
A281: Dept2-890 | B281: Bajo | C281: 41615 | D281: 41616 | E281: =+LEFT(RC[-4],5) -> Dept2 | F281: =+VLOOKUP(RC[-4],Enunciado!R3C6:R5C7,2,0)+RC[-3] -> 41645 | G281: =+IF(RC[-1]>=RC[-3],"ON TIME","OUT OF TIME") -> ON TIME | H281: =+YEAR(RC[-5]) -> 2013 | I281: =+MONTH(RC[-6]) -> 12 | J281: =+RC[-6]-RC[-7] -> 1 | K281: =+IF(RC[-4]="OUT of TIME",RC[-1]-VLOOKUP(RC[-9],Enunciado!R3C6:R5C7,2,0),"") -> 
A282: Dept5-20498 | B282: Bajo | C282: 41562 | D282: 41578 | E282: =+LEFT(RC[-4],5) -> Dept5 | F282: =+VLOOKUP(RC[-4],Enunciado!R3C6:R5C7,2,0)+RC[-3] -> 41592 | G282: =+IF(RC[-1]>=RC[-3],"ON TIME","OUT OF TIME") -> ON TIME | H282: =+YEAR(RC[-5]) -> 2013 | I282: =+MONTH(RC[-6]) -> 10 | J282: =+RC[-6]-RC[-7] -> 16 | K282: =+IF(RC[-4]="OUT of TIME",RC[-1]-VLOOKUP(RC[-9],Enunciado!R3C6:R5C7,2,0),"") -> 
A283: Dept3-7666 | B283: Medio | C283: 41237 | D283: 41237 | E283: =+LEFT(RC[-4],5) -> Dept3 | F283: =+VLOOKUP(RC[-4],Enunciado!R3C6:R5C7,2,0)+RC[-3] -> 41252 | G283: =+IF(RC[-1]>=RC[-3],"ON TIME","OUT OF TIME") -> ON TIME | H283: =+YEAR(RC[-5]) -> 2012 | I283: =+MONTH(RC[-6]) -> 11 | J283: =+RC[-6]-RC[-7] -> 0 | K283: =+IF(RC[-4]="OUT of TIME",RC[-1]-VLOOKUP(RC[-9],Enunciado!R3C6:R5C7,2,0),"") -> 
A284: Dept2-5107 | B284: Medio | C284: 41284 | D284: 41290 | E284: =+LEFT(RC[-4],5) -> Dept2 | F284: =+VLOOKUP(RC[-4],Enunciado!R3C6:R5C7,2,0)+RC[-3] -> 41299 | G284: =+IF(RC[-1]>=RC[-3],"ON TIME","OUT OF TIME") -> ON TIME | H284: =+YEAR(RC[-5]) -> 2013 | I284: =+MONTH(RC[-6]) -> 1 | J284: =+RC[-6]-RC[-7] -> 6 | K284: =+IF(RC[-4]="OUT of TIME",RC[-1]-VLOOKUP(RC[-9],Enunciado!R3C6:R5C7,2,0),"") -> 
A285: Dept6-20347 | B285: Alto | C285: 41429 | D285: 41439 | E285: =+LEFT(RC[-4],5) -> Dept6 | F285: =+VLOOKUP(RC[-4],Enunciado!R3C6:R5C7,2,0)+RC[-3] -> 41434 | G285: =+IF(RC[-1]>=RC[-3],"ON TIME","OUT OF TIME") -> OUT OF TIME | H285: =+YEAR(RC[-5]) -> 2013 | I285: =+MONTH(RC[-6]) -> 6 | J285: =+RC[-6]-RC[-7] -> 10 | K285: =+IF(RC[-4]="OUT of TIME",RC[-1]-VLOOKUP(RC[-9],Enunciado!R3C6:R5C7,2,0),"") -> 5
A286: Dept5-1841 | B286: Medio | C286: 41122 | D286: 41144 | E286: =+LEFT(RC[-4],5) -> Dept5 | F286: =+VLOOKUP(RC[-4],Enunciado!R3C6:R5C7,2,0)+RC[-3] -> 41137 | G286: =+IF(RC[-1]>=RC[-3],"ON TIME","OUT OF TIME") -> OUT OF TIME | H286: =+YEAR(RC[-5]) -> 2012 | I286: =+MONTH(RC[-6]) -> 8 | J286: =+RC[-6]-RC[-7] -> 22 | K286: =+IF(RC[-4]="OUT of TIME",RC[-1]-VLOOKUP(RC[-9],Enunciado!R3C6:R5C7,2,0),"") -> 7
A287: Dept5-27287 | B287: Bajo | C287: 41545 | D287: 41545 | E287: =+LEFT(RC[-4],5) -> Dept5 | F287: =+VLOOKUP(RC[-4],Enunciado!R3C6:R5C7,2,0)+RC[-3] -> 41575 | G287: =+IF(RC[-1]>=RC[-3],"ON TIME","OUT OF TIME") -> ON TIME | H287: =+YEAR(RC[-5]) -> 2013 | I287: =+MONTH(RC[-6]) -> 9 | J287: =+RC[-6]-RC[-7] -> 0 | K287: =+IF(RC[-4]="OUT of TIME",RC[-1]-VLOOKUP(RC[-9],Enunciado!R3C6:R5C7,2,0),"") -> 
A288: Dept4-17660 | B288: Bajo | C288: 41562 | D288: 41573 | E288: =+LEFT(RC[-4],5) -> Dept4 | F288: =+VLOOKUP(RC[-4],Enunciado!R3C6:R5C7,2,0)+RC[-3] -> 41592 | G288: =+IF(RC[-1]>=RC[-3],"ON TIME","OUT OF TIME") -> ON TIME | H288: =+YEAR(RC[-5]) -> 2013 | I288: =+MONTH(RC[-6]) -> 10 | J288: =+RC[-6]-RC[-7] -> 11 | K288: =+IF(RC[-4]="OUT of TIME",RC[-1]-VLOOKUP(RC[-9],Enunciado!R3C6:R5C7,2,0),"") -> 
A289: Dept5-20738 | B289: Medio | C289: 41307 | D289: 41336 | E289: =+LEFT(RC[-4],5) -> Dept5 | F289: =+VLOOKUP(RC[-4],Enunciado!R3C6:R5C7,2,0)+RC[-3] -> 41322 | G289: =+IF(RC[-1]>=RC[-3],"ON TIME","OUT OF TIME") -> OUT OF TIME | H289: =+YEAR(RC[-5]) -> 2013 | I289: =+MONTH(RC[-6]) -> 2 | J289: =+RC[-6]-RC[-7] -> 29 | K289: =+IF(RC[-4]="OUT of TIME",RC[-1]-VLOOKUP(RC[-9],Enunciado!R3C6:R5C7,2,0),"") -> 14
A290: Dept2-22034 | B290: Medio | C290: 41059 | D290: 41075 | E290: =+LEFT(RC[-4],5) -> Dept2 | F290: =+VLOOKUP(RC[-4],Enunciado!R3C6:R5C7,2,0)+RC[-3] -> 41074 | G290: =+IF(RC[-1]>=RC[-3],"ON TIME","OUT OF TIME") -> OUT OF TIME | H290: =+YEAR(RC[-5]) -> 2012 | I290: =+MONTH(RC[-6]) -> 5 | J290: =+RC[-6]-RC[-7] -> 16 | K290: =+IF(RC[-4]="OUT of TIME",RC[-1]-VLOOKUP(RC[-9],Enunciado!R3C6:R5C7,2,0),"") -> 1
A291: Dept5-16056 | B291: Bajo | C291: 41519 | D291: 41534 | E291: =+LEFT(RC[-4],5) -> Dept5 | F291: =+VLOOKUP(RC[-4],Enunciado!R3C6:R5C7,2,0)+RC[-3] -> 41549 | G291: =+IF(RC[-1]>=RC[-3],"ON TIME","OUT OF TIME") -> ON TIME | H291: =+YEAR(RC[-5]) -> 2013 | I291: =+MONTH(RC[-6]) -> 9 | J291: =+RC[-6]-RC[-7] -> 15 | K291: =+IF(RC[-4]="OUT of TIME",RC[-1]-VLOOKUP(RC[-9],Enunciado!R3C6:R5C7,2,0),"") -> 
A292: Dept1-22571 | B292: Alto | C292: 41561 | D292: 41595 | E292: =+LEFT(RC[-4],5) -> Dept1 | F292: =+VLOOKUP(RC[-4],Enunciado!R3C6:R5C7,2,0)+RC[-3] -> 41566 | G292: =+IF(RC[-1]>=RC[-3],"ON TIME","OUT OF TIME") -> OUT OF TIME | H292: =+YEAR(RC[-5]) -> 2013 | I292: =+MONTH(RC[-6]) -> 10 | J292: =+RC[-6]-RC[-7] -> 34 | K292: =+IF(RC[-4]="OUT of TIME",RC[-1]-VLOOKUP(RC[-9],Enunciado!R3C6:R5C7,2,0),"") -> 29
A293: Dept1-24144 | B293: Medio | C293: 41198 | D293: 41207 | E293: =+LEFT(RC[-4],5) -> Dept1 | F293: =+VLOOKUP(RC[-4],Enunciado!R3C6:R5C7,2,0)+RC[-3] -> 41213 | G293: =+IF(RC[-1]>=RC[-3],"ON TIME","OUT OF TIME") -> ON TIME | H293: =+YEAR(RC[-5]) -> 2012 | I293: =+MONTH(RC[-6]) -> 10 | J293: =+RC[-6]-RC[-7] -> 9 | K293: =+IF(RC[-4]="OUT of TIME",RC[-1]-VLOOKUP(RC[-9],Enunciado!R3C6:R5C7,2,0),"") -> 
A294: Dept3-9985 | B294: Alto | C294: 41144 | D294: 41147 | E294: =+LEFT(RC[-4],5) -> Dept3 | F294: =+VLOOKUP(RC[-4],Enunciado!R3C6:R5C7,2,0)+RC[-3] -> 41149 | G294: =+IF(RC[-1]>=RC[-3],"ON TIME","OUT OF TIME") -> ON TIME | H294: =+YEAR(RC[-5]) -> 2012 | I294: =+MONTH(RC[-6]) -> 8 | J294: =+RC[-6]-RC[-7] -> 3 | K294: =+IF(RC[-4]="OUT of TIME",RC[-1]-VLOOKUP(RC[-9],Enunciado!R3C6:R5C7,2,0),"") -> 
A295: Dept3-6206 | B295: Alto | C295: 41346 | D295: 41350 | E295: =+LEFT(RC[-4],5) -> Dept3 | F295: =+VLOOKUP(RC[-4],Enunciado!R3C6:R5C7,2,0)+RC[-3] -> 41351 | G295: =+IF(RC[-1]>=RC[-3],"ON TIME","OUT OF TIME") -> ON TIME | H295: =+YEAR(RC[-5]) -> 2013 | I295: =+MONTH(RC[-6]) -> 3 | J295: =+RC[-6]-RC[-7] -> 4 | K295: =+IF(RC[-4]="OUT of TIME",RC[-1]-VLOOKUP(RC[-9],Enunciado!R3C6:R5C7,2,0),"") -> 
A296: Dept3-22708 | B296: Alto | C296: 41005 | D296: 41015 | E296: =+LEFT(RC[-4],5) -> Dept3 | F296: =+VLOOKUP(RC[-4],Enunciado!R3C6:R5C7,2,0)+RC[-3] -> 41010 | G296: =+IF(RC[-1]>=RC[-3],"ON TIME","OUT OF TIME") -> OUT OF TIME | H296: =+YEAR(RC[-5]) -> 2012 | I296: =+MONTH(RC[-6]) -> 4 | J296: =+RC[-6]-RC[-7] -> 10 | K296: =+IF(RC[-4]="OUT of TIME",RC[-1]-VLOOKUP(RC[-9],Enunciado!R3C6:R5C7,2,0),"") -> 5
A297: Dept5-27363 | B297: Bajo | C297: 41500 | D297: 41501 | E297: =+LEFT(RC[-4],5) -> Dept5 | F297: =+VLOOKUP(RC[-4],Enunciado!R3C6:R5C7,2,0)+RC[-3] -> 41530 | G297: =+IF(RC[-1]>=RC[-3],"ON TIME","OUT OF TIME") -> ON TIME | H297: =+YEAR(RC[-5]) -> 2013 | I297: =+MONTH(RC[-6]) -> 8 | J297: =+RC[-6]-RC[-7] -> 1 | K297: =+IF(RC[-4]="OUT of TIME",RC[-1]-VLOOKUP(RC[-9],Enunciado!R3C6:R5C7,2,0),"") -> 
A298: Dept6-18969 | B298: Alto | C298: 41514 | D298: 41526 | E298: =+LEFT(RC[-4],5) -> Dept6 | F298: =+VLOOKUP(RC[-4],Enunciado!R3C6:R5C7,2,0)+RC[-3] -> 41519 | G298: =+IF(RC[-1]>=RC[-3],"ON TIME","OUT OF TIME") -> OUT OF TIME | H298: =+YEAR(RC[-5]) -> 2013 | I298: =+MONTH(RC[-6]) -> 8 | J298: =+RC[-6]-RC[-7] -> 12 | K298: =+IF(RC[-4]="OUT of TIME",RC[-1]-VLOOKUP(RC[-9],Enunciado!R3C6:R5C7,2,0),"") -> 7
A299: Dept1-23202 | B299: Bajo | C299: 40964 | D299: 40967 | E299: =+LEFT(RC[-4],5) -> Dept1 | F299: =+VLOOKUP(RC[-4],Enunciado!R3C6:R5C7,2,0)+RC[-3] -> 40994 | G299: =+IF(RC[-1]>=RC[-3],"ON TIME","OUT OF TIME") -> ON TIME | H299: =+YEAR(RC[-5]) -> 2012 | I299: =+MONTH(RC[-6]) -> 2 | J299: =+RC[-6]-RC[-7] -> 3 | K299: =+IF(RC[-4]="OUT of TIME",RC[-1]-VLOOKUP(RC[-9],Enunciado!R3C6:R5C7,2,0),"") -> 
A300: Dept2-1636 | B300: Alto | C300: 41637 | D300: 41652 | E300: =+LEFT(RC[-4],5) -> Dept2 | F300: =+VLOOKUP(RC[-4],Enunciado!R3C6:R5C7,2,0)+RC[-3] -> 41642 | G300: =+IF(RC[-1]>=RC[-3],"ON TIME","OUT OF TIME") -> OUT OF TIME | H300: =+YEAR(RC[-5]) -> 2013 | I300: =+MONTH(RC[-6]) -> 12 | J300: =+RC[-6]-RC[-7] -> 15 | K300: =+IF(RC[-4]="OUT of TIME",RC[-1]-VLOOKUP(RC[-9],Enunciado!R3C6:R5C7,2,0),"") -> 10
A301: Dept3-10815 | B301: Medio | C301: 41634 | D301: 41649 | E301: =+LEFT(RC[-4],5) -> Dept3 | F301: =+VLOOKUP(RC[-4],Enunciado!R3C6:R5C7,2,0)+RC[-3] -> 41649 | G301: =+IF(RC[-1]>=RC[-3],"ON TIME","OUT OF TIME") -> ON TIME | H301: =+YEAR(RC[-5]) -> 2013 | I301: =+MONTH(RC[-6]) -> 12 | J301: =+RC[-6]-RC[-7] -> 15 | K301: =+IF(RC[-4]="OUT of TIME",RC[-1]-VLOOKUP(RC[-9],Enunciado!R3C6:R5C7,2,0),"") -> 
A302: Dept5-8657 | B302: Bajo | C302: 41082 | D302: 41117 | E302: =+LEFT(RC[-4],5) -> Dept5 | F302: =+VLOOKUP(RC[-4],Enunciado!R3C6:R5C7,2,0)+RC[-3] -> 41112 | G302: =+IF(RC[-1]>=RC[-3],"ON TIME","OUT OF TIME") -> OUT OF TIME | H302: =+YEAR(RC[-5]) -> 2012 | I302: =+MONTH(RC[-6]) -> 6 | J302: =+RC[-6]-RC[-7] -> 35 | K302: =+IF(RC[-4]="OUT of TIME",RC[-1]-VLOOKUP(RC[-9],Enunciado!R3C6:R5C7,2,0),"") -> 5
A303: Dept2-23395 | B303: Alto | C303: 41155 | D303: 41166 | E303: =+LEFT(RC[-4],5) -> Dept2 | F303: =+VLOOKUP(RC[-4],Enunciado!R3C6:R5C7,2,0)+RC[-3] -> 41160 | G303: =+IF(RC[-1]>=RC[-3],"ON TIME","OUT OF TIME") -> OUT OF TIME | H303: =+YEAR(RC[-5]) -> 2012 | I303: =+MONTH(RC[-6]) -> 9 | J303: =+RC[-6]-RC[-7] -> 11 | K303: =+IF(RC[-4]="OUT of TIME",RC[-1]-VLOOKUP(RC[-9],Enunciado!R3C6:R5C7,2,0),"") -> 6
A304: Dept3-9390 | B304: Bajo | C304: 41524 | D304: 41535 | E304: =+LEFT(RC[-4],5) -> Dept3 | F304: =+VLOOKUP(RC[-4],Enunciado!R3C6:R5C7,2,0)+RC[-3] -> 41554 | G304: =+IF(RC[-1]>=RC[-3],"ON TIME","OUT OF TIME") -> ON TIME | H304: =+YEAR(RC[-5]) -> 2013 | I304: =+MONTH(RC[-6]) -> 9 | J304: =+RC[-6]-RC[-7] -> 11 | K304: =+IF(RC[-4]="OUT of TIME",RC[-1]-VLOOKUP(RC[-9],Enunciado!R3C6:R5C7,2,0),"") -> 
A305: Dept1-14949 | B305: Alto | C305: 41601 | D305: 41605 | E305: =+LEFT(RC[-4],5) -> Dept1 | F305: =+VLOOKUP(RC[-4],Enunciado!R3C6:R5C7,2,0)+RC[-3] -> 41606 | G305: =+IF(RC[-1]>=RC[-3],"ON TIME","OUT OF TIME") -> ON TIME | H305: =+YEAR(RC[-5]) -> 2013 | I305: =+MONTH(RC[-6]) -> 11 | J305: =+RC[-6]-RC[-7] -> 4 | K305: =+IF(RC[-4]="OUT of TIME",RC[-1]-VLOOKUP(RC[-9],Enunciado!R3C6:R5C7,2,0),"") -> 
A306: Dept3-24647 | B306: Medio | C306: 41102 | D306: 41114 | E306: =+LEFT(RC[-4],5) -> Dept3 | F306: =+VLOOKUP(RC[-4],Enunciado!R3C6:R5C7,2,0)+RC[-3] -> 41117 | G306: =+IF(RC[-1]>=RC[-3],"ON TIME","OUT OF TIME") -> ON TIME | H306: =+YEAR(RC[-5]) -> 2012 | I306: =+MONTH(RC[-6]) -> 7 | J306: =+RC[-6]-RC[-7] -> 12 | K306: =+IF(RC[-4]="OUT of TIME",RC[-1]-VLOOKUP(RC[-9],Enunciado!R3C6:R5C7,2,0),"") -> 
A307: Dept5-19185 | B307: Bajo | C307: 41407 | D307: 41407 | E307: =+LEFT(RC[-4],5) -> Dept5 | F307: =+VLOOKUP(RC[-4],Enunciado!R3C6:R5C7,2,0)+RC[-3] -> 41437 | G307: =+IF(RC[-1]>=RC[-3],"ON TIME","OUT OF TIME") -> ON TIME | H307: =+YEAR(RC[-5]) -> 2013 | I307: =+MONTH(RC[-6]) -> 5 | J307: =+RC[-6]-RC[-7] -> 0 | K307: =+IF(RC[-4]="OUT of TIME",RC[-1]-VLOOKUP(RC[-9],Enunciado!R3C6:R5C7,2,0),"") -> 
A308: Dept6-15764 | B308: Alto | C308: 41561 | D308: 41577 | E308: =+LEFT(RC[-4],5) -> Dept6 | F308: =+VLOOKUP(RC[-4],Enunciado!R3C6:R5C7,2,0)+RC[-3] -> 41566 | G308: =+IF(RC[-1]>=RC[-3],"ON TIME","OUT OF TIME") -> OUT OF TIME | H308: =+YEAR(RC[-5]) -> 2013 | I308: =+MONTH(RC[-6]) -> 10 | J308: =+RC[-6]-RC[-7] -> 16 | K308: =+IF(RC[-4]="OUT of TIME",RC[-1]-VLOOKUP(RC[-9],Enunciado!R3C6:R5C7,2,0),"") -> 11
A309: Dept5-14152 | B309: Bajo | C309: 41590 | D309: 41598 | E309: =+LEFT(RC[-4],5) -> Dept5 | F309: =+VLOOKUP(RC[-4],Enunciado!R3C6:R5C7,2,0)+RC[-3] -> 41620 | G309: =+IF(RC[-1]>=RC[-3],"ON TIME","OUT OF TIME") -> ON TIME | H309: =+YEAR(RC[-5]) -> 2013 | I309: =+MONTH(RC[-6]) -> 11 | J309: =+RC[-6]-RC[-7] -> 8 | K309: =+IF(RC[-4]="OUT of TIME",RC[-1]-VLOOKUP(RC[-9],Enunciado!R3C6:R5C7,2,0),"") -> 
A310: Dept1-25499 | B310: Bajo | C310: 41246 | D310: 41248 | E310: =+LEFT(RC[-4],5) -> Dept1 | F310: =+VLOOKUP(RC[-4],Enunciado!R3C6:R5C7,2,0)+RC[-3] -> 41276 | G310: =+IF(RC[-1]>=RC[-3],"ON TIME","OUT OF TIME") -> ON TIME | H310: =+YEAR(RC[-5]) -> 2012 | I310: =+MONTH(RC[-6]) -> 12 | J310: =+RC[-6]-RC[-7] -> 2 | K310: =+IF(RC[-4]="OUT of TIME",RC[-1]-VLOOKUP(RC[-9],Enunciado!R3C6:R5C7,2,0),"") -> 
A311: Dept6-1671 | B311: Bajo | C311: 41530 | D311: 41568 | E311: =+LEFT(RC[-4],5) -> Dept6 | F311: =+VLOOKUP(RC[-4],Enunciado!R3C6:R5C7,2,0)+RC[-3] -> 41560 | G311: =+IF(RC[-1]>=RC[-3],"ON TIME","OUT OF TIME") -> OUT OF TIME | H311: =+YEAR(RC[-5]) -> 2013 | I311: =+MONTH(RC[-6]) -> 9 | J311: =+RC[-6]-RC[-7] -> 38 | K311: =+IF(RC[-4]="OUT of TIME",RC[-1]-VLOOKUP(RC[-9],Enunciado!R3C6:R5C7,2,0),"") -> 8
A312: Dept1-11088 | B312: Medio | C312: 41484 | D312: 41493 | E312: =+LEFT(RC[-4],5) -> Dept1 | F312: =+VLOOKUP(RC[-4],Enunciado!R3C6:R5C7,2,0)+RC[-3] -> 41499 | G312: =+IF(RC[-1]>=RC[-3],"ON TIME","OUT OF TIME") -> ON TIME | H312: =+YEAR(RC[-5]) -> 2013 | I312: =+MONTH(RC[-6]) -> 7 | J312: =+RC[-6]-RC[-7] -> 9 | K312: =+IF(RC[-4]="OUT of TIME",RC[-1]-VLOOKUP(RC[-9],Enunciado!R3C6:R5C7,2,0),"") -> 
A313: Dept5-8150 | B313: Bajo | C313: 40921 | D313: 40934 | E313: =+LEFT(RC[-4],5) -> Dept5 | F313: =+VLOOKUP(RC[-4],Enunciado!R3C6:R5C7,2,0)+RC[-3] -> 40951 | G313: =+IF(RC[-1]>=RC[-3],"ON TIME","OUT OF TIME") -> ON TIME | H313: =+YEAR(RC[-5]) -> 2012 | I313: =+MONTH(RC[-6]) -> 1 | J313: =+RC[-6]-RC[-7] -> 13 | K313: =+IF(RC[-4]="OUT of TIME",RC[-1]-VLOOKUP(RC[-9],Enunciado!R3C6:R5C7,2,0),"") -> 
A314: Dept5-17258 | B314: Bajo | C314: 41468 | D314: 41471 | E314: =+LEFT(RC[-4],5) -> Dept5 | F314: =+VLOOKUP(RC[-4],Enunciado!R3C6:R5C7,2,0)+RC[-3] -> 41498 | G314: =+IF(RC[-1]>=RC[-3],"ON TIME","OUT OF TIME") -> ON TIME | H314: =+YEAR(RC[-5]) -> 2013 | I314: =+MONTH(RC[-6]) -> 7 | J314: =+RC[-6]-RC[-7] -> 3 | K314: =+IF(RC[-4]="OUT of TIME",RC[-1]-VLOOKUP(RC[-9],Enunciado!R3C6:R5C7,2,0),"") -> 
A315: Dept5-20809 | B315: Medio | C315: 41367 | D315: 41384 | E315: =+LEFT(RC[-4],5) -> Dept5 | F315: =+VLOOKUP(RC[-4],Enunciado!R3C6:R5C7,2,0)+RC[-3] -> 41382 | G315: =+IF(RC[-1]>=RC[-3],"ON TIME","OUT OF TIME") -> OUT OF TIME | H315: =+YEAR(RC[-5]) -> 2013 | I315: =+MONTH(RC[-6]) -> 4 | J315: =+RC[-6]-RC[-7] -> 17 | K315: =+IF(RC[-4]="OUT of TIME",RC[-1]-VLOOKUP(RC[-9],Enunciado!R3C6:R5C7,2,0),"") -> 2
A316: Dept3-24511 | B316: Medio | C316: 41270 | D316: 41272 | E316: =+LEFT(RC[-4],5) -> Dept3 | F316: =+VLOOKUP(RC[-4],Enunciado!R3C6:R5C7,2,0)+RC[-3] -> 41285 | G316: =+IF(RC[-1]>=RC[-3],"ON TIME","OUT OF TIME") -> ON TIME | H316: =+YEAR(RC[-5]) -> 2012 | I316: =+MONTH(RC[-6]) -> 12 | J316: =+RC[-6]-RC[-7] -> 2 | K316: =+IF(RC[-4]="OUT of TIME",RC[-1]-VLOOKUP(RC[-9],Enunciado!R3C6:R5C7,2,0),"") -> 
A317: Dept3-918 | B317: Alto | C317: 41308 | D317: 41325 | E317: =+LEFT(RC[-4],5) -> Dept3 | F317: =+VLOOKUP(RC[-4],Enunciado!R3C6:R5C7,2,0)+RC[-3] -> 41313 | G317: =+IF(RC[-1]>=RC[-3],"ON TIME","OUT OF TIME") -> OUT OF TIME | H317: =+YEAR(RC[-5]) -> 2013 | I317: =+MONTH(RC[-6]) -> 2 | J317: =+RC[-6]-RC[-7] -> 17 | K317: =+IF(RC[-4]="OUT of TIME",RC[-1]-VLOOKUP(RC[-9],Enunciado!R3C6:R5C7,2,0),"") -> 12
A318: Dept5-15496 | B318: Medio | C318: 41557 | D318: 41571 | E318: =+LEFT(RC[-4],5) -> Dept5 | F318: =+VLOOKUP(RC[-4],Enunciado!R3C6:R5C7,2,0)+RC[-3] -> 41572 | G318: =+IF(RC[-1]>=RC[-3],"ON TIME","OUT OF TIME") -> ON TIME | H318: =+YEAR(RC[-5]) -> 2013 | I318: =+MONTH(RC[-6]) -> 10 | J318: =+RC[-6]-RC[-7] -> 14 | K318: =+IF(RC[-4]="OUT of TIME",RC[-1]-VLOOKUP(RC[-9],Enunciado!R3C6:R5C7,2,0),"") -> 
A319: Dept5-3070 | B319: Medio | C319: 41216 | D319: 41230 | E319: =+LEFT(RC[-4],5) -> Dept5 | F319: =+VLOOKUP(RC[-4],Enunciado!R3C6:R5C7,2,0)+RC[-3] -> 41231 | G319: =+IF(RC[-1]>=RC[-3],"ON TIME","OUT OF TIME") -> ON TIME | H319: =+YEAR(RC[-5]) -> 2012 | I319: =+MONTH(RC[-6]) -> 11 | J319: =+RC[-6]-RC[-7] -> 14 | K319: =+IF(RC[-4]="OUT of TIME",RC[-1]-VLOOKUP(RC[-9],Enunciado!R3C6:R5C7,2,0),"") -> 
A320: Dept6-29781 | B320: Medio | C320: 41298 | D320: 41301 | E320: =+LEFT(RC[-4],5) -> Dept6 | F320: =+VLOOKUP(RC[-4],Enunciado!R3C6:R5C7,2,0)+RC[-3] -> 41313 | G320: =+IF(RC[-1]>=RC[-3],"ON TIME","OUT OF TIME") -> ON TIME | H320: =+YEAR(RC[-5]) -> 2013 | I320: =+MONTH(RC[-6]) -> 1 | J320: =+RC[-6]-RC[-7] -> 3 | K320: =+IF(RC[-4]="OUT of TIME",RC[-1]-VLOOKUP(RC[-9],Enunciado!R3C6:R5C7,2,0),"") -> 
A321: Dept1-17087 | B321: Bajo | C321: 41531 | D321: 41531 | E321: =+LEFT(RC[-4],5) -> Dept1 | F321: =+VLOOKUP(RC[-4],Enunciado!R3C6:R5C7,2,0)+RC[-3] -> 41561 | G321: =+IF(RC[-1]>=RC[-3],"ON TIME","OUT OF TIME") -> ON TIME | H321: =+YEAR(RC[-5]) -> 2013 | I321: =+MONTH(RC[-6]) -> 9 | J321: =+RC[-6]-RC[-7] -> 0 | K321: =+IF(RC[-4]="OUT of TIME",RC[-1]-VLOOKUP(RC[-9],Enunciado!R3C6:R5C7,2,0),"") -> 
A322: Dept1-14834 | B322: Alto | C322: 41179 | D322: 41193 | E322: =+LEFT(RC[-4],5) -> Dept1 | F322: =+VLOOKUP(RC[-4],Enunciado!R3C6:R5C7,2,0)+RC[-3] -> 41184 | G322: =+IF(RC[-1]>=RC[-3],"ON TIME","OUT OF TIME") -> OUT OF TIME | H322: =+YEAR(RC[-5]) -> 2012 | I322: =+MONTH(RC[-6]) -> 9 | J322: =+RC[-6]-RC[-7] -> 14 | K322: =+IF(RC[-4]="OUT of TIME",RC[-1]-VLOOKUP(RC[-9],Enunciado!R3C6:R5C7,2,0),"") -> 9
A323: Dept2-26594 | B323: Alto | C323: 41439 | D323: 41445 | E323: =+LEFT(RC[-4],5) -> Dept2 | F323: =+VLOOKUP(RC[-4],Enunciado!R3C6:R5C7,2,0)+RC[-3] -> 41444 | G323: =+IF(RC[-1]>=RC[-3],"ON TIME","OUT OF TIME") -> OUT OF TIME | H323: =+YEAR(RC[-5]) -> 2013 | I323: =+MONTH(RC[-6]) -> 6 | J323: =+RC[-6]-RC[-7] -> 6 | K323: =+IF(RC[-4]="OUT of TIME",RC[-1]-VLOOKUP(RC[-9],Enunciado!R3C6:R5C7,2,0),"") -> 1
A324: Dept5-8526 | B324: Bajo | C324: 41104 | D324: 41119 | E324: =+LEFT(RC[-4],5) -> Dept5 | F324: =+VLOOKUP(RC[-4],Enunciado!R3C6:R5C7,2,0)+RC[-3] -> 41134 | G324: =+IF(RC[-1]>=RC[-3],"ON TIME","OUT OF TIME") -> ON TIME | H324: =+YEAR(RC[-5]) -> 2012 | I324: =+MONTH(RC[-6]) -> 7 | J324: =+RC[-6]-RC[-7] -> 15 | K324: =+IF(RC[-4]="OUT of TIME",RC[-1]-VLOOKUP(RC[-9],Enunciado!R3C6:R5C7,2,0),"") -> 
A325: Dept2-5845 | B325: Bajo | C325: 41558 | D325: 41566 | E325: =+LEFT(RC[-4],5) -> Dept2 | F325: =+VLOOKUP(RC[-4],Enunciado!R3C6:R5C7,2,0)+RC[-3] -> 41588 | G325: =+IF(RC[-1]>=RC[-3],"ON TIME","OUT OF TIME") -> ON TIME | H325: =+YEAR(RC[-5]) -> 2013 | I325: =+MONTH(RC[-6]) -> 10 | J325: =+RC[-6]-RC[-7] -> 8 | K325: =+IF(RC[-4]="OUT of TIME",RC[-1]-VLOOKUP(RC[-9],Enunciado!R3C6:R5C7,2,0),"") -> 
A326: Dept5-25978 | B326: Medio | C326: 41019 | D326: 41019 | E326: =+LEFT(RC[-4],5) -> Dept5 | F326: =+VLOOKUP(RC[-4],Enunciado!R3C6:R5C7,2,0)+RC[-3] -> 41034 | G326: =+IF(RC[-1]>=RC[-3],"ON TIME","OUT OF TIME") -> ON TIME | H326: =+YEAR(RC[-5]) -> 2012 | I326: =+MONTH(RC[-6]) -> 4 | J326: =+RC[-6]-RC[-7] -> 0 | K326: =+IF(RC[-4]="OUT of TIME",RC[-1]-VLOOKUP(RC[-9],Enunciado!R3C6:R5C7,2,0),"") -> 
A327: Dept4-3847 | B327: Alto | C327: 40949 | D327: 40958 | E327: =+LEFT(RC[-4],5) -> Dept4 | F327: =+VLOOKUP(RC[-4],Enunciado!R3C6:R5C7,2,0)+RC[-3] -> 40954 | G327: =+IF(RC[-1]>=RC[-3],"ON TIME","OUT OF TIME") -> OUT OF TIME | H327: =+YEAR(RC[-5]) -> 2012 | I327: =+MONTH(RC[-6]) -> 2 | J327: =+RC[-6]-RC[-7] -> 9 | K327: =+IF(RC[-4]="OUT of TIME",RC[-1]-VLOOKUP(RC[-9],Enunciado!R3C6:R5C7,2,0),"") -> 4
A328: Dept5-21039 | B328: Alto | C328: 41250 | D328: 41250 | E328: =+LEFT(RC[-4],5) -> Dept5 | F328: =+VLOOKUP(RC[-4],Enunciado!R3C6:R5C7,2,0)+RC[-3] -> 41255 | G328: =+IF(RC[-1]>=RC[-3],"ON TIME","OUT OF TIME") -> ON TIME | H328: =+YEAR(RC[-5]) -> 2012 | I328: =+MONTH(RC[-6]) -> 12 | J328: =+RC[-6]-RC[-7] -> 0 | K328: =+IF(RC[-4]="OUT of TIME",RC[-1]-VLOOKUP(RC[-9],Enunciado!R3C6:R5C7,2,0),"") -> 
A329: Dept2-22351 | B329: Bajo | C329: 40947 | D329: 40947 | E329: =+LEFT(RC[-4],5) -> Dept2 | F329: =+VLOOKUP(RC[-4],Enunciado!R3C6:R5C7,2,0)+RC[-3] -> 40977 | G329: =+IF(RC[-1]>=RC[-3],"ON TIME","OUT OF TIME") -> ON TIME | H329: =+YEAR(RC[-5]) -> 2012 | I329: =+MONTH(RC[-6]) -> 2 | J329: =+RC[-6]-RC[-7] -> 0 | K329: =+IF(RC[-4]="OUT of TIME",RC[-1]-VLOOKUP(RC[-9],Enunciado!R3C6:R5C7,2,0),"") -> 
A330: Dept4-249 | B330: Alto | C330: 40982 | D330: 40985 | E330: =+LEFT(RC[-4],5) -> Dept4 | F330: =+VLOOKUP(RC[-4],Enunciado!R3C6:R5C7,2,0)+RC[-3] -> 40987 | G330: =+IF(RC[-1]>=RC[-3],"ON TIME","OUT OF TIME") -> ON TIME | H330: =+YEAR(RC[-5]) -> 2012 | I330: =+MONTH(RC[-6]) -> 3 | J330: =+RC[-6]-RC[-7] -> 3 | K330: =+IF(RC[-4]="OUT of TIME",RC[-1]-VLOOKUP(RC[-9],Enunciado!R3C6:R5C7,2,0),"") -> 
A331: Dept1-1778 | B331: Alto | C331: 40951 | D331: 40970 | E331: =+LEFT(RC[-4],5) -> Dept1 | F331: =+VLOOKUP(RC[-4],Enunciado!R3C6:R5C7,2,0)+RC[-3] -> 40956 | G331: =+IF(RC[-1]>=RC[-3],"ON TIME","OUT OF TIME") -> OUT OF TIME | H331: =+YEAR(RC[-5]) -> 2012 | I331: =+MONTH(RC[-6]) -> 2 | J331: =+RC[-6]-RC[-7] -> 19 | K331: =+IF(RC[-4]="OUT of TIME",RC[-1]-VLOOKUP(RC[-9],Enunciado!R3C6:R5C7,2,0),"") -> 14
A332: Dept2-14554 | B332: Medio | C332: 41040 | D332: 41067 | E332: =+LEFT(RC[-4],5) -> Dept2 | F332: =+VLOOKUP(RC[-4],Enunciado!R3C6:R5C7,2,0)+RC[-3] -> 41055 | G332: =+IF(RC[-1]>=RC[-3],"ON TIME","OUT OF TIME") -> OUT OF TIME | H332: =+YEAR(RC[-5]) -> 2012 | I332: =+MONTH(RC[-6]) -> 5 | J332: =+RC[-6]-RC[-7] -> 27 | K332: =+IF(RC[-4]="OUT of TIME",RC[-1]-VLOOKUP(RC[-9],Enunciado!R3C6:R5C7,2,0),"") -> 12
A333: Dept1-26634 | B333: Bajo | C333: 41106 | D333: 41109 | E333: =+LEFT(RC[-4],5) -> Dept1 | F333: =+VLOOKUP(RC[-4],Enunciado!R3C6:R5C7,2,0)+RC[-3] -> 41136 | G333: =+IF(RC[-1]>=RC[-3],"ON TIME","OUT OF TIME") -> ON TIME | H333: =+YEAR(RC[-5]) -> 2012 | I333: =+MONTH(RC[-6]) -> 7 | J333: =+RC[-6]-RC[-7] -> 3 | K333: =+IF(RC[-4]="OUT of TIME",RC[-1]-VLOOKUP(RC[-9],Enunciado!R3C6:R5C7,2,0),"") -> 
A334: Dept6-1617 | B334: Bajo | C334: 41207 | D334: 41222 | E334: =+LEFT(RC[-4],5) -> Dept6 | F334: =+VLOOKUP(RC[-4],Enunciado!R3C6:R5C7,2,0)+RC[-3] -> 41237 | G334: =+IF(RC[-1]>=RC[-3],"ON TIME","OUT OF TIME") -> ON TIME | H334: =+YEAR(RC[-5]) -> 2012 | I334: =+MONTH(RC[-6]) -> 10 | J334: =+RC[-6]-RC[-7] -> 15 | K334: =+IF(RC[-4]="OUT of TIME",RC[-1]-VLOOKUP(RC[-9],Enunciado!R3C6:R5C7,2,0),"") -> 
A335: Dept1-29475 | B335: Bajo | C335: 41344 | D335: 41355 | E335: =+LEFT(RC[-4],5) -> Dept1 | F335: =+VLOOKUP(RC[-4],Enunciado!R3C6:R5C7,2,0)+RC[-3] -> 41374 | G335: =+IF(RC[-1]>=RC[-3],"ON TIME","OUT OF TIME") -> ON TIME | H335: =+YEAR(RC[-5]) -> 2013 | I335: =+MONTH(RC[-6]) -> 3 | J335: =+RC[-6]-RC[-7] -> 11 | K335: =+IF(RC[-4]="OUT of TIME",RC[-1]-VLOOKUP(RC[-9],Enunciado!R3C6:R5C7,2,0),"") -> 
A336: Dept5-29029 | B336: Bajo | C336: 41316 | D336: 41351 | E336: =+LEFT(RC[-4],5) -> Dept5 | F336: =+VLOOKUP(RC[-4],Enunciado!R3C6:R5C7,2,0)+RC[-3] -> 41346 | G336: =+IF(RC[-1]>=RC[-3],"ON TIME","OUT OF TIME") -> OUT OF TIME | H336: =+YEAR(RC[-5]) -> 2013 | I336: =+MONTH(RC[-6]) -> 2 | J336: =+RC[-6]-RC[-7] -> 35 | K336: =+IF(RC[-4]="OUT of TIME",RC[-1]-VLOOKUP(RC[-9],Enunciado!R3C6:R5C7,2,0),"") -> 5
A337: Dept5-20002 | B337: Medio | C337: 41286 | D337: 41324 | E337: =+LEFT(RC[-4],5) -> Dept5 | F337: =+VLOOKUP(RC[-4],Enunciado!R3C6:R5C7,2,0)+RC[-3] -> 41301 | G337: =+IF(RC[-1]>=RC[-3],"ON TIME","OUT OF TIME") -> OUT OF TIME | H337: =+YEAR(RC[-5]) -> 2013 | I337: =+MONTH(RC[-6]) -> 1 | J337: =+RC[-6]-RC[-7] -> 38 | K337: =+IF(RC[-4]="OUT of TIME",RC[-1]-VLOOKUP(RC[-9],Enunciado!R3C6:R5C7,2,0),"") -> 23
A338: Dept3-26225 | B338: Medio | C338: 41363 | D338: 41365 | E338: =+LEFT(RC[-4],5) -> Dept3 | F338: =+VLOOKUP(RC[-4],Enunciado!R3C6:R5C7,2,0)+RC[-3] -> 41378 | G338: =+IF(RC[-1]>=RC[-3],"ON TIME","OUT OF TIME") -> ON TIME | H338: =+YEAR(RC[-5]) -> 2013 | I338: =+MONTH(RC[-6]) -> 3 | J338: =+RC[-6]-RC[-7] -> 2 | K338: =+IF(RC[-4]="OUT of TIME",RC[-1]-VLOOKUP(RC[-9],Enunciado!R3C6:R5C7,2,0),"") -> 
A339: Dept3-13321 | B339: Medio | C339: 41607 | D339: 41618 | E339: =+LEFT(RC[-4],5) -> Dept3 | F339: =+VLOOKUP(RC[-4],Enunciado!R3C6:R5C7,2,0)+RC[-3] -> 41622 | G339: =+IF(RC[-1]>=RC[-3],"ON TIME","OUT OF TIME") -> ON TIME | H339: =+YEAR(RC[-5]) -> 2013 | I339: =+MONTH(RC[-6]) -> 11 | J339: =+RC[-6]-RC[-7] -> 11 | K339: =+IF(RC[-4]="OUT of TIME",RC[-1]-VLOOKUP(RC[-9],Enunciado!R3C6:R5C7,2,0),"") -> 
A340: Dept6-20429 | B340: Bajo | C340: 41554 | D340: 41556 | E340: =+LEFT(RC[-4],5) -> Dept6 | F340: =+VLOOKUP(RC[-4],Enunciado!R3C6:R5C7,2,0)+RC[-3] -> 41584 | G340: =+IF(RC[-1]>=RC[-3],"ON TIME","OUT OF TIME") -> ON TIME | H340: =+YEAR(RC[-5]) -> 2013 | I340: =+MONTH(RC[-6]) -> 10 | J340: =+RC[-6]-RC[-7] -> 2 | K340: =+IF(RC[-4]="OUT of TIME",RC[-1]-VLOOKUP(RC[-9],Enunciado!R3C6:R5C7,2,0),"") -> 
A341: Dept2-8952 | B341: Medio | C341: 41586 | D341: 41605 | E341: =+LEFT(RC[-4],5) -> Dept2 | F341: =+VLOOKUP(RC[-4],Enunciado!R3C6:R5C7,2,0)+RC[-3] -> 41601 | G341: =+IF(RC[-1]>=RC[-3],"ON TIME","OUT OF TIME") -> OUT OF TIME | H341: =+YEAR(RC[-5]) -> 2013 | I341: =+MONTH(RC[-6]) -> 11 | J341: =+RC[-6]-RC[-7] -> 19 | K341: =+IF(RC[-4]="OUT of TIME",RC[-1]-VLOOKUP(RC[-9],Enunciado!R3C6:R5C7,2,0),"") -> 4
A342: Dept3-9430 | B342: Alto | C342: 41119 | D342: 41130 | E342: =+LEFT(RC[-4],5) -> Dept3 | F342: =+VLOOKUP(RC[-4],Enunciado!R3C6:R5C7,2,0)+RC[-3] -> 41124 | G342: =+IF(RC[-1]>=RC[-3],"ON TIME","OUT OF TIME") -> OUT OF TIME | H342: =+YEAR(RC[-5]) -> 2012 | I342: =+MONTH(RC[-6]) -> 7 | J342: =+RC[-6]-RC[-7] -> 11 | K342: =+IF(RC[-4]="OUT of TIME",RC[-1]-VLOOKUP(RC[-9],Enunciado!R3C6:R5C7,2,0),"") -> 6
A343: Dept6-19648 | B343: Medio | C343: 41613 | D343: 41613 | E343: =+LEFT(RC[-4],5) -> Dept6 | F343: =+VLOOKUP(RC[-4],Enunciado!R3C6:R5C7,2,0)+RC[-3] -> 41628 | G343: =+IF(RC[-1]>=RC[-3],"ON TIME","OUT OF TIME") -> ON TIME | H343: =+YEAR(RC[-5]) -> 2013 | I343: =+MONTH(RC[-6]) -> 12 | J343: =+RC[-6]-RC[-7] -> 0 | K343: =+IF(RC[-4]="OUT of TIME",RC[-1]-VLOOKUP(RC[-9],Enunciado!R3C6:R5C7,2,0),"") -> 
A344: Dept2-21508 | B344: Alto | C344: 41341 | D344: 41343 | E344: =+LEFT(RC[-4],5) -> Dept2 | F344: =+VLOOKUP(RC[-4],Enunciado!R3C6:R5C7,2,0)+RC[-3] -> 41346 | G344: =+IF(RC[-1]>=RC[-3],"ON TIME","OUT OF TIME") -> ON TIME | H344: =+YEAR(RC[-5]) -> 2013 | I344: =+MONTH(RC[-6]) -> 3 | J344: =+RC[-6]-RC[-7] -> 2 | K344: =+IF(RC[-4]="OUT of TIME",RC[-1]-VLOOKUP(RC[-9],Enunciado!R3C6:R5C7,2,0),"") -> 
A345: Dept5-6569 | B345: Alto | C345: 41551 | D345: 41554 | E345: =+LEFT(RC[-4],5) -> Dept5 | F345: =+VLOOKUP(RC[-4],Enunciado!R3C6:R5C7,2,0)+RC[-3] -> 41556 | G345: =+IF(RC[-1]>=RC[-3],"ON TIME","OUT OF TIME") -> ON TIME | H345: =+YEAR(RC[-5]) -> 2013 | I345: =+MONTH(RC[-6]) -> 10 | J345: =+RC[-6]-RC[-7] -> 3 | K345: =+IF(RC[-4]="OUT of TIME",RC[-1]-VLOOKUP(RC[-9],Enunciado!R3C6:R5C7,2,0),"") -> 
A346: Dept4-20325 | B346: Medio | C346: 41083 | D346: 41084 | E346: =+LEFT(RC[-4],5) -> Dept4 | F346: =+VLOOKUP(RC[-4],Enunciado!R3C6:R5C7,2,0)+RC[-3] -> 41098 | G346: =+IF(RC[-1]>=RC[-3],"ON TIME","OUT OF TIME") -> ON TIME | H346: =+YEAR(RC[-5]) -> 2012 | I346: =+MONTH(RC[-6]) -> 6 | J346: =+RC[-6]-RC[-7] -> 1 | K346: =+IF(RC[-4]="OUT of TIME",RC[-1]-VLOOKUP(RC[-9],Enunciado!R3C6:R5C7,2,0),"") -> 
A347: Dept6-4898 | B347: Bajo | C347: 41127 | D347: 41130 | E347: =+LEFT(RC[-4],5) -> Dept6 | F347: =+VLOOKUP(RC[-4],Enunciado!R3C6:R5C7,2,0)+RC[-3] -> 41157 | G347: =+IF(RC[-1]>=RC[-3],"ON TIME","OUT OF TIME") -> ON TIME | H347: =+YEAR(RC[-5]) -> 2012 | I347: =+MONTH(RC[-6]) -> 8 | J347: =+RC[-6]-RC[-7] -> 3 | K347: =+IF(RC[-4]="OUT of TIME",RC[-1]-VLOOKUP(RC[-9],Enunciado!R3C6:R5C7,2,0),"") -> 
A348: Dept1-10084 | B348: Alto | C348: 41399 | D348: 41420 | E348: =+LEFT(RC[-4],5) -> Dept1 | F348: =+VLOOKUP(RC[-4],Enunciado!R3C6:R5C7,2,0)+RC[-3] -> 41404 | G348: =+IF(RC[-1]>=RC[-3],"ON TIME","OUT OF TIME") -> OUT OF TIME | H348: =+YEAR(RC[-5]) -> 2013 | I348: =+MONTH(RC[-6]) -> 5 | J348: =+RC[-6]-RC[-7] -> 21 | K348: =+IF(RC[-4]="OUT of TIME",RC[-1]-VLOOKUP(RC[-9],Enunciado!R3C6:R5C7,2,0),"") -> 16
A349: Dept3-11438 | B349: Bajo | C349: 41254 | D349: 41260 | E349: =+LEFT(RC[-4],5) -> Dept3 | F349: =+VLOOKUP(RC[-4],Enunciado!R3C6:R5C7,2,0)+RC[-3] -> 41284 | G349: =+IF(RC[-1]>=RC[-3],"ON TIME","OUT OF TIME") -> ON TIME | H349: =+YEAR(RC[-5]) -> 2012 | I349: =+MONTH(RC[-6]) -> 12 | J349: =+RC[-6]-RC[-7] -> 6 | K349: =+IF(RC[-4]="OUT of TIME",RC[-1]-VLOOKUP(RC[-9],Enunciado!R3C6:R5C7,2,0),"") -> 
A350: Dept6-13777 | B350: Alto | C350: 41520 | D350: 41530 | E350: =+LEFT(RC[-4],5) -> Dept6 | F350: =+VLOOKUP(RC[-4],Enunciado!R3C6:R5C7,2,0)+RC[-3] -> 41525 | G350: =+IF(RC[-1]>=RC[-3],"ON TIME","OUT OF TIME") -> OUT OF TIME | H350: =+YEAR(RC[-5]) -> 2013 | I350: =+MONTH(RC[-6]) -> 9 | J350: =+RC[-6]-RC[-7] -> 10 | K350: =+IF(RC[-4]="OUT of TIME",RC[-1]-VLOOKUP(RC[-9],Enunciado!R3C6:R5C7,2,0),"") -> 5
A351: Dept5-23275 | B351: Medio | C351: 41506 | D351: 41510 | E351: =+LEFT(RC[-4],5) -> Dept5 | F351: =+VLOOKUP(RC[-4],Enunciado!R3C6:R5C7,2,0)+RC[-3] -> 41521 | G351: =+IF(RC[-1]>=RC[-3],"ON TIME","OUT OF TIME") -> ON TIME | H351: =+YEAR(RC[-5]) -> 2013 | I351: =+MONTH(RC[-6]) -> 8 | J351: =+RC[-6]-RC[-7] -> 4 | K351: =+IF(RC[-4]="OUT of TIME",RC[-1]-VLOOKUP(RC[-9],Enunciado!R3C6:R5C7,2,0),"") -> 
A352: Dept1-24829 | B352: Alto | C352: 41407 | D352: 41409 | E352: =+LEFT(RC[-4],5) -> Dept1 | F352: =+VLOOKUP(RC[-4],Enunciado!R3C6:R5C7,2,0)+RC[-3] -> 41412 | G352: =+IF(RC[-1]>=RC[-3],"ON TIME","OUT OF TIME") -> ON TIME | H352: =+YEAR(RC[-5]) -> 2013 | I352: =+MONTH(RC[-6]) -> 5 | J352: =+RC[-6]-RC[-7] -> 2 | K352: =+IF(RC[-4]="OUT of TIME",RC[-1]-VLOOKUP(RC[-9],Enunciado!R3C6:R5C7,2,0),"") -> 
A353: Dept6-24048 | B353: Medio | C353: 41077 | D353: 41114 | E353: =+LEFT(RC[-4],5) -> Dept6 | F353: =+VLOOKUP(RC[-4],Enunciado!R3C6:R5C7,2,0)+RC[-3] -> 41092 | G353: =+IF(RC[-1]>=RC[-3],"ON TIME","OUT OF TIME") -> OUT OF TIME | H353: =+YEAR(RC[-5]) -> 2012 | I353: =+MONTH(RC[-6]) -> 6 | J353: =+RC[-6]-RC[-7] -> 37 | K353: =+IF(RC[-4]="OUT of TIME",RC[-1]-VLOOKUP(RC[-9],Enunciado!R3C6:R5C7,2,0),"") -> 22
A354: Dept2-9955 | B354: Alto | C354: 41515 | D354: 41525 | E354: =+LEFT(RC[-4],5) -> Dept2 | F354: =+VLOOKUP(RC[-4],Enunciado!R3C6:R5C7,2,0)+RC[-3] -> 41520 | G354: =+IF(RC[-1]>=RC[-3],"ON TIME","OUT OF TIME") -> OUT OF TIME | H354: =+YEAR(RC[-5]) -> 2013 | I354: =+MONTH(RC[-6]) -> 8 | J354: =+RC[-6]-RC[-7] -> 10 | K354: =+IF(RC[-4]="OUT of TIME",RC[-1]-VLOOKUP(RC[-9],Enunciado!R3C6:R5C7,2,0),"") -> 5
A355: Dept4-21905 | B355: Bajo | C355: 41047 | D355: 41064 | E355: =+LEFT(RC[-4],5) -> Dept4 | F355: =+VLOOKUP(RC[-4],Enunciado!R3C6:R5C7,2,0)+RC[-3] -> 41077 | G355: =+IF(RC[-1]>=RC[-3],"ON TIME","OUT OF TIME") -> ON TIME | H355: =+YEAR(RC[-5]) -> 2012 | I355: =+MONTH(RC[-6]) -> 5 | J355: =+RC[-6]-RC[-7] -> 17 | K355: =+IF(RC[-4]="OUT of TIME",RC[-1]-VLOOKUP(RC[-9],Enunciado!R3C6:R5C7,2,0),"") -> 
A356: Dept6-18542 | B356: Medio | C356: 41399 | D356: 41419 | E356: =+LEFT(RC[-4],5) -> Dept6 | F356: =+VLOOKUP(RC[-4],Enunciado!R3C6:R5C7,2,0)+RC[-3] -> 41414 | G356: =+IF(RC[-1]>=RC[-3],"ON TIME","OUT OF TIME") -> OUT OF TIME | H356: =+YEAR(RC[-5]) -> 2013 | I356: =+MONTH(RC[-6]) -> 5 | J356: =+RC[-6]-RC[-7] -> 20 | K356: =+IF(RC[-4]="OUT of TIME",RC[-1]-VLOOKUP(RC[-9],Enunciado!R3C6:R5C7,2,0),"") -> 5
A357: Dept4-10698 | B357: Medio | C357: 41231 | D357: 41237 | E357: =+LEFT(RC[-4],5) -> Dept4 | F357: =+VLOOKUP(RC[-4],Enunciado!R3C6:R5C7,2,0)+RC[-3] -> 41246 | G357: =+IF(RC[-1]>=RC[-3],"ON TIME","OUT OF TIME") -> ON TIME | H357: =+YEAR(RC[-5]) -> 2012 | I357: =+MONTH(RC[-6]) -> 11 | J357: =+RC[-6]-RC[-7] -> 6 | K357: =+IF(RC[-4]="OUT of TIME",RC[-1]-VLOOKUP(RC[-9],Enunciado!R3C6:R5C7,2,0),"") -> 
A358: Dept1-11362 | B358: Alto | C358: 41360 | D358: 41364 | E358: =+LEFT(RC[-4],5) -> Dept1 | F358: =+VLOOKUP(RC[-4],Enunciado!R3C6:R5C7,2,0)+RC[-3] -> 41365 | G358: =+IF(RC[-1]>=RC[-3],"ON TIME","OUT OF TIME") -> ON TIME | H358: =+YEAR(RC[-5]) -> 2013 | I358: =+MONTH(RC[-6]) -> 3 | J358: =+RC[-6]-RC[-7] -> 4 | K358: =+IF(RC[-4]="OUT of TIME",RC[-1]-VLOOKUP(RC[-9],Enunciado!R3C6:R5C7,2,0),"") -> 
A359: Dept4-3487 | B359: Bajo | C359: 41418 | D359: 41428 | E359: =+LEFT(RC[-4],5) -> Dept4 | F359: =+VLOOKUP(RC[-4],Enunciado!R3C6:R5C7,2,0)+RC[-3] -> 41448 | G359: =+IF(RC[-1]>=RC[-3],"ON TIME","OUT OF TIME") -> ON TIME | H359: =+YEAR(RC[-5]) -> 2013 | I359: =+MONTH(RC[-6]) -> 5 | J359: =+RC[-6]-RC[-7] -> 10 | K359: =+IF(RC[-4]="OUT of TIME",RC[-1]-VLOOKUP(RC[-9],Enunciado!R3C6:R5C7,2,0),"") -> 
A360: Dept1-18938 | B360: Bajo | C360: 40918 | D360: 40919 | E360: =+LEFT(RC[-4],5) -> Dept1 | F360: =+VLOOKUP(RC[-4],Enunciado!R3C6:R5C7,2,0)+RC[-3] -> 40948 | G360: =+IF(RC[-1]>=RC[-3],"ON TIME","OUT OF TIME") -> ON TIME | H360: =+YEAR(RC[-5]) -> 2012 | I360: =+MONTH(RC[-6]) -> 1 | J360: =+RC[-6]-RC[-7] -> 1 | K360: =+IF(RC[-4]="OUT of TIME",RC[-1]-VLOOKUP(RC[-9],Enunciado!R3C6:R5C7,2,0),"") -> 
A361: Dept6-24905 | B361: Alto | C361: 41104 | D361: 41116 | E361: =+LEFT(RC[-4],5) -> Dept6 | F361: =+VLOOKUP(RC[-4],Enunciado!R3C6:R5C7,2,0)+RC[-3] -> 41109 | G361: =+IF(RC[-1]>=RC[-3],"ON TIME","OUT OF TIME") -> OUT OF TIME | H361: =+YEAR(RC[-5]) -> 2012 | I361: =+MONTH(RC[-6]) -> 7 | J361: =+RC[-6]-RC[-7] -> 12 | K361: =+IF(RC[-4]="OUT of TIME",RC[-1]-VLOOKUP(RC[-9],Enunciado!R3C6:R5C7,2,0),"") -> 7
A362: Dept4-17367 | B362: Medio | C362: 41490 | D362: 41491 | E362: =+LEFT(RC[-4],5) -> Dept4 | F362: =+VLOOKUP(RC[-4],Enunciado!R3C6:R5C7,2,0)+RC[-3] -> 41505 | G362: =+IF(RC[-1]>=RC[-3],"ON TIME","OUT OF TIME") -> ON TIME | H362: =+YEAR(RC[-5]) -> 2013 | I362: =+MONTH(RC[-6]) -> 8 | J362: =+RC[-6]-RC[-7] -> 1 | K362: =+IF(RC[-4]="OUT of TIME",RC[-1]-VLOOKUP(RC[-9],Enunciado!R3C6:R5C7,2,0),"") -> 
A363: Dept3-16456 | B363: Medio | C363: 40926 | D363: 40942 | E363: =+LEFT(RC[-4],5) -> Dept3 | F363: =+VLOOKUP(RC[-4],Enunciado!R3C6:R5C7,2,0)+RC[-3] -> 40941 | G363: =+IF(RC[-1]>=RC[-3],"ON TIME","OUT OF TIME") -> OUT OF TIME | H363: =+YEAR(RC[-5]) -> 2012 | I363: =+MONTH(RC[-6]) -> 1 | J363: =+RC[-6]-RC[-7] -> 16 | K363: =+IF(RC[-4]="OUT of TIME",RC[-1]-VLOOKUP(RC[-9],Enunciado!R3C6:R5C7,2,0),"") -> 1
A364: Dept6-26922 | B364: Alto | C364: 41295 | D364: 41302 | E364: =+LEFT(RC[-4],5) -> Dept6 | F364: =+VLOOKUP(RC[-4],Enunciado!R3C6:R5C7,2,0)+RC[-3] -> 41300 | G364: =+IF(RC[-1]>=RC[-3],"ON TIME","OUT OF TIME") -> OUT OF TIME | H364: =+YEAR(RC[-5]) -> 2013 | I364: =+MONTH(RC[-6]) -> 1 | J364: =+RC[-6]-RC[-7] -> 7 | K364: =+IF(RC[-4]="OUT of TIME",RC[-1]-VLOOKUP(RC[-9],Enunciado!R3C6:R5C7,2,0),"") -> 2
A365: Dept6-6308 | B365: Alto | C365: 41055 | D365: 41061 | E365: =+LEFT(RC[-4],5) -> Dept6 | F365: =+VLOOKUP(RC[-4],Enunciado!R3C6:R5C7,2,0)+RC[-3] -> 41060 | G365: =+IF(RC[-1]>=RC[-3],"ON TIME","OUT OF TIME") -> OUT OF TIME | H365: =+YEAR(RC[-5]) -> 2012 | I365: =+MONTH(RC[-6]) -> 5 | J365: =+RC[-6]-RC[-7] -> 6 | K365: =+IF(RC[-4]="OUT of TIME",RC[-1]-VLOOKUP(RC[-9],Enunciado!R3C6:R5C7,2,0),"") -> 1
A366: Dept3-16234 | B366: Bajo | C366: 41393 | D366: 41394 | E366: =+LEFT(RC[-4],5) -> Dept3 | F366: =+VLOOKUP(RC[-4],Enunciado!R3C6:R5C7,2,0)+RC[-3] -> 41423 | G366: =+IF(RC[-1]>=RC[-3],"ON TIME","OUT OF TIME") -> ON TIME | H366: =+YEAR(RC[-5]) -> 2013 | I366: =+MONTH(RC[-6]) -> 4 | J366: =+RC[-6]-RC[-7] -> 1 | K366: =+IF(RC[-4]="OUT of TIME",RC[-1]-VLOOKUP(RC[-9],Enunciado!R3C6:R5C7,2,0),"") -> 
A367: Dept6-2633 | B367: Bajo | C367: 41623 | D367: 41635 | E367: =+LEFT(RC[-4],5) -> Dept6 | F367: =+VLOOKUP(RC[-4],Enunciado!R3C6:R5C7,2,0)+RC[-3] -> 41653 | G367: =+IF(RC[-1]>=RC[-3],"ON TIME","OUT OF TIME") -> ON TIME | H367: =+YEAR(RC[-5]) -> 2013 | I367: =+MONTH(RC[-6]) -> 12 | J367: =+RC[-6]-RC[-7] -> 12 | K367: =+IF(RC[-4]="OUT of TIME",RC[-1]-VLOOKUP(RC[-9],Enunciado!R3C6:R5C7,2,0),"") -> 
A368: Dept3-12376 | B368: Medio | C368: 41500 | D368: 41503 | E368: =+LEFT(RC[-4],5) -> Dept3 | F368: =+VLOOKUP(RC[-4],Enunciado!R3C6:R5C7,2,0)+RC[-3] -> 41515 | G368: =+IF(RC[-1]>=RC[-3],"ON TIME","OUT OF TIME") -> ON TIME | H368: =+YEAR(RC[-5]) -> 2013 | I368: =+MONTH(RC[-6]) -> 8 | J368: =+RC[-6]-RC[-7] -> 3 | K368: =+IF(RC[-4]="OUT of TIME",RC[-1]-VLOOKUP(RC[-9],Enunciado!R3C6:R5C7,2,0),"") -> 
A369: Dept1-7075 | B369: Medio | C369: 41255 | D369: 41267 | E369: =+LEFT(RC[-4],5) -> Dept1 | F369: =+VLOOKUP(RC[-4],Enunciado!R3C6:R5C7,2,0)+RC[-3] -> 41270 | G369: =+IF(RC[-1]>=RC[-3],"ON TIME","OUT OF TIME") -> ON TIME | H369: =+YEAR(RC[-5]) -> 2012 | I369: =+MONTH(RC[-6]) -> 12 | J369: =+RC[-6]-RC[-7] -> 12 | K369: =+IF(RC[-4]="OUT of TIME",RC[-1]-VLOOKUP(RC[-9],Enunciado!R3C6:R5C7,2,0),"") -> 
A370: Dept1-14656 | B370: Alto | C370: 41548 | D370: 41548 | E370: =+LEFT(RC[-4],5) -> Dept1 | F370: =+VLOOKUP(RC[-4],Enunciado!R3C6:R5C7,2,0)+RC[-3] -> 41553 | G370: =+IF(RC[-1]>=RC[-3],"ON TIME","OUT OF TIME") -> ON TIME | H370: =+YEAR(RC[-5]) -> 2013 | I370: =+MONTH(RC[-6]) -> 10 | J370: =+RC[-6]-RC[-7] -> 0 | K370: =+IF(RC[-4]="OUT of TIME",RC[-1]-VLOOKUP(RC[-9],Enunciado!R3C6:R5C7,2,0),"") -> 
A371: Dept6-12385 | B371: Alto | C371: 41195 | D371: 41196 | E371: =+LEFT(RC[-4],5) -> Dept6 | F371: =+VLOOKUP(RC[-4],Enunciado!R3C6:R5C7,2,0)+RC[-3] -> 41200 | G371: =+IF(RC[-1]>=RC[-3],"ON TIME","OUT OF TIME") -> ON TIME | H371: =+YEAR(RC[-5]) -> 2012 | I371: =+MONTH(RC[-6]) -> 10 | J371: =+RC[-6]-RC[-7] -> 1 | K371: =+IF(RC[-4]="OUT of TIME",RC[-1]-VLOOKUP(RC[-9],Enunciado!R3C6:R5C7,2,0),"") -> 
A372: Dept1-7436 | B372: Bajo | C372: 41590 | D372: 41601 | E372: =+LEFT(RC[-4],5) -> Dept1 | F372: =+VLOOKUP(RC[-4],Enunciado!R3C6:R5C7,2,0)+RC[-3] -> 41620 | G372: =+IF(RC[-1]>=RC[-3],"ON TIME","OUT OF TIME") -> ON TIME | H372: =+YEAR(RC[-5]) -> 2013 | I372: =+MONTH(RC[-6]) -> 11 | J372: =+RC[-6]-RC[-7] -> 11 | K372: =+IF(RC[-4]="OUT of TIME",RC[-1]-VLOOKUP(RC[-9],Enunciado!R3C6:R5C7,2,0),"") -> 
A373: Dept2-5811 | B373: Alto | C373: 40982 | D373: 40986 | E373: =+LEFT(RC[-4],5) -> Dept2 | F373: =+VLOOKUP(RC[-4],Enunciado!R3C6:R5C7,2,0)+RC[-3] -> 40987 | G373: =+IF(RC[-1]>=RC[-3],"ON TIME","OUT OF TIME") -> ON TIME | H373: =+YEAR(RC[-5]) -> 2012 | I373: =+MONTH(RC[-6]) -> 3 | J373: =+RC[-6]-RC[-7] -> 4 | K373: =+IF(RC[-4]="OUT of TIME",RC[-1]-VLOOKUP(RC[-9],Enunciado!R3C6:R5C7,2,0),"") -> 
A374: Dept3-14784 | B374: Medio | C374: 41613 | D374: 41639 | E374: =+LEFT(RC[-4],5) -> Dept3 | F374: =+VLOOKUP(RC[-4],Enunciado!R3C6:R5C7,2,0)+RC[-3] -> 41628 | G374: =+IF(RC[-1]>=RC[-3],"ON TIME","OUT OF TIME") -> OUT OF TIME | H374: =+YEAR(RC[-5]) -> 2013 | I374: =+MONTH(RC[-6]) -> 12 | J374: =+RC[-6]-RC[-7] -> 26 | K374: =+IF(RC[-4]="OUT of TIME",RC[-1]-VLOOKUP(RC[-9],Enunciado!R3C6:R5C7,2,0),"") -> 11
A375: Dept6-7280 | B375: Alto | C375: 40932 | D375: 40932 | E375: =+LEFT(RC[-4],5) -> Dept6 | F375: =+VLOOKUP(RC[-4],Enunciado!R3C6:R5C7,2,0)+RC[-3] -> 40937 | G375: =+IF(RC[-1]>=RC[-3],"ON TIME","OUT OF TIME") -> ON TIME | H375: =+YEAR(RC[-5]) -> 2012 | I375: =+MONTH(RC[-6]) -> 1 | J375: =+RC[-6]-RC[-7] -> 0 | K375: =+IF(RC[-4]="OUT of TIME",RC[-1]-VLOOKUP(RC[-9],Enunciado!R3C6:R5C7,2,0),"") -> 
A376: Dept4-27276 | B376: Bajo | C376: 41586 | D376: 41586 | E376: =+LEFT(RC[-4],5) -> Dept4 | F376: =+VLOOKUP(RC[-4],Enunciado!R3C6:R5C7,2,0)+RC[-3] -> 41616 | G376: =+IF(RC[-1]>=RC[-3],"ON TIME","OUT OF TIME") -> ON TIME | H376: =+YEAR(RC[-5]) -> 2013 | I376: =+MONTH(RC[-6]) -> 11 | J376: =+RC[-6]-RC[-7] -> 0 | K376: =+IF(RC[-4]="OUT of TIME",RC[-1]-VLOOKUP(RC[-9],Enunciado!R3C6:R5C7,2,0),"") -> 
A377: Dept2-28961 | B377: Alto | C377: 41575 | D377: 41594 | E377: =+LEFT(RC[-4],5) -> Dept2 | F377: =+VLOOKUP(RC[-4],Enunciado!R3C6:R5C7,2,0)+RC[-3] -> 41580 | G377: =+IF(RC[-1]>=RC[-3],"ON TIME","OUT OF TIME") -> OUT OF TIME | H377: =+YEAR(RC[-5]) -> 2013 | I377: =+MONTH(RC[-6]) -> 10 | J377: =+RC[-6]-RC[-7] -> 19 | K377: =+IF(RC[-4]="OUT of TIME",RC[-1]-VLOOKUP(RC[-9],Enunciado!R3C6:R5C7,2,0),"") -> 14
A378: Dept3-28760 | B378: Alto | C378: 41428 | D378: 41429 | E378: =+LEFT(RC[-4],5) -> Dept3 | F378: =+VLOOKUP(RC[-4],Enunciado!R3C6:R5C7,2,0)+RC[-3] -> 41433 | G378: =+IF(RC[-1]>=RC[-3],"ON TIME","OUT OF TIME") -> ON TIME | H378: =+YEAR(RC[-5]) -> 2013 | I378: =+MONTH(RC[-6]) -> 6 | J378: =+RC[-6]-RC[-7] -> 1 | K378: =+IF(RC[-4]="OUT of TIME",RC[-1]-VLOOKUP(RC[-9],Enunciado!R3C6:R5C7,2,0),"") -> 
A379: Dept6-243 | B379: Medio | C379: 41491 | D379: 41497 | E379: =+LEFT(RC[-4],5) -> Dept6 | F379: =+VLOOKUP(RC[-4],Enunciado!R3C6:R5C7,2,0)+RC[-3] -> 41506 | G379: =+IF(RC[-1]>=RC[-3],"ON TIME","OUT OF TIME") -> ON TIME | H379: =+YEAR(RC[-5]) -> 2013 | I379: =+MONTH(RC[-6]) -> 8 | J379: =+RC[-6]-RC[-7] -> 6 | K379: =+IF(RC[-4]="OUT of TIME",RC[-1]-VLOOKUP(RC[-9],Enunciado!R3C6:R5C7,2,0),"") -> 
A380: Dept5-28389 | B380: Bajo | C380: 40930 | D380: 40942 | E380: =+LEFT(RC[-4],5) -> Dept5 | F380: =+VLOOKUP(RC[-4],Enunciado!R3C6:R5C7,2,0)+RC[-3] -> 40960 | G380: =+IF(RC[-1]>=RC[-3],"ON TIME","OUT OF TIME") -> ON TIME | H380: =+YEAR(RC[-5]) -> 2012 | I380: =+MONTH(RC[-6]) -> 1 | J380: =+RC[-6]-RC[-7] -> 12 | K380: =+IF(RC[-4]="OUT of TIME",RC[-1]-VLOOKUP(RC[-9],Enunciado!R3C6:R5C7,2,0),"") -> 
A381: Dept2-9719 | B381: Alto | C381: 41046 | D381: 41059 | E381: =+LEFT(RC[-4],5) -> Dept2 | F381: =+VLOOKUP(RC[-4],Enunciado!R3C6:R5C7,2,0)+RC[-3] -> 41051 | G381: =+IF(RC[-1]>=RC[-3],"ON TIME","OUT OF TIME") -> OUT OF TIME | H381: =+YEAR(RC[-5]) -> 2012 | I381: =+MONTH(RC[-6]) -> 5 | J381: =+RC[-6]-RC[-7] -> 13 | K381: =+IF(RC[-4]="OUT of TIME",RC[-1]-VLOOKUP(RC[-9],Enunciado!R3C6:R5C7,2,0),"") -> 8
A382: Dept3-10747 | B382: Bajo | C382: 41220 | D382: 41224 | E382: =+LEFT(RC[-4],5) -> Dept3 | F382: =+VLOOKUP(RC[-4],Enunciado!R3C6:R5C7,2,0)+RC[-3] -> 41250 | G382: =+IF(RC[-1]>=RC[-3],"ON TIME","OUT OF TIME") -> ON TIME | H382: =+YEAR(RC[-5]) -> 2012 | I382: =+MONTH(RC[-6]) -> 11 | J382: =+RC[-6]-RC[-7] -> 4 | K382: =+IF(RC[-4]="OUT of TIME",RC[-1]-VLOOKUP(RC[-9],Enunciado!R3C6:R5C7,2,0),"") -> 
A383: Dept3-23214 | B383: Alto | C383: 41225 | D383: 41241 | E383: =+LEFT(RC[-4],5) -> Dept3 | F383: =+VLOOKUP(RC[-4],Enunciado!R3C6:R5C7,2,0)+RC[-3] -> 41230 | G383: =+IF(RC[-1]>=RC[-3],"ON TIME","OUT OF TIME") -> OUT OF TIME | H383: =+YEAR(RC[-5]) -> 2012 | I383: =+MONTH(RC[-6]) -> 11 | J383: =+RC[-6]-RC[-7] -> 16 | K383: =+IF(RC[-4]="OUT of TIME",RC[-1]-VLOOKUP(RC[-9],Enunciado!R3C6:R5C7,2,0),"") -> 11
A384: Dept2-24366 | B384: Alto | C384: 41057 | D384: 41060 | E384: =+LEFT(RC[-4],5) -> Dept2 | F384: =+VLOOKUP(RC[-4],Enunciado!R3C6:R5C7,2,0)+RC[-3] -> 41062 | G384: =+IF(RC[-1]>=RC[-3],"ON TIME","OUT OF TIME") -> ON TIME | H384: =+YEAR(RC[-5]) -> 2012 | I384: =+MONTH(RC[-6]) -> 5 | J384: =+RC[-6]-RC[-7] -> 3 | K384: =+IF(RC[-4]="OUT of TIME",RC[-1]-VLOOKUP(RC[-9],Enunciado!R3C6:R5C7,2,0),"") -> 
A385: Dept3-14435 | B385: Bajo | C385: 41040 | D385: 41056 | E385: =+LEFT(RC[-4],5) -> Dept3 | F385: =+VLOOKUP(RC[-4],Enunciado!R3C6:R5C7,2,0)+RC[-3] -> 41070 | G385: =+IF(RC[-1]>=RC[-3],"ON TIME","OUT OF TIME") -> ON TIME | H385: =+YEAR(RC[-5]) -> 2012 | I385: =+MONTH(RC[-6]) -> 5 | J385: =+RC[-6]-RC[-7] -> 16 | K385: =+IF(RC[-4]="OUT of TIME",RC[-1]-VLOOKUP(RC[-9],Enunciado!R3C6:R5C7,2,0),"") -> 
A386: Dept2-6461 | B386: Alto | C386: 40937 | D386: 40953 | E386: =+LEFT(RC[-4],5) -> Dept2 | F386: =+VLOOKUP(RC[-4],Enunciado!R3C6:R5C7,2,0)+RC[-3] -> 40942 | G386: =+IF(RC[-1]>=RC[-3],"ON TIME","OUT OF TIME") -> OUT OF TIME | H386: =+YEAR(RC[-5]) -> 2012 | I386: =+MONTH(RC[-6]) -> 1 | J386: =+RC[-6]-RC[-7] -> 16 | K386: =+IF(RC[-4]="OUT of TIME",RC[-1]-VLOOKUP(RC[-9],Enunciado!R3C6:R5C7,2,0),"") -> 11
A387: Dept2-12301 | B387: Medio | C387: 41051 | D387: 41054 | E387: =+LEFT(RC[-4],5) -> Dept2 | F387: =+VLOOKUP(RC[-4],Enunciado!R3C6:R5C7,2,0)+RC[-3] -> 41066 | G387: =+IF(RC[-1]>=RC[-3],"ON TIME","OUT OF TIME") -> ON TIME | H387: =+YEAR(RC[-5]) -> 2012 | I387: =+MONTH(RC[-6]) -> 5 | J387: =+RC[-6]-RC[-7] -> 3 | K387: =+IF(RC[-4]="OUT of TIME",RC[-1]-VLOOKUP(RC[-9],Enunciado!R3C6:R5C7,2,0),"") -> 
A388: Dept2-29181 | B388: Alto | C388: 41046 | D388: 41056 | E388: =+LEFT(RC[-4],5) -> Dept2 | F388: =+VLOOKUP(RC[-4],Enunciado!R3C6:R5C7,2,0)+RC[-3] -> 41051 | G388: =+IF(RC[-1]>=RC[-3],"ON TIME","OUT OF TIME") -> OUT OF TIME | H388: =+YEAR(RC[-5]) -> 2012 | I388: =+MONTH(RC[-6]) -> 5 | J388: =+RC[-6]-RC[-7] -> 10 | K388: =+IF(RC[-4]="OUT of TIME",RC[-1]-VLOOKUP(RC[-9],Enunciado!R3C6:R5C7,2,0),"") -> 5
A389: Dept4-26516 | B389: Alto | C389: 41537 | D389: 41585 | E389: =+LEFT(RC[-4],5) -> Dept4 | F389: =+VLOOKUP(RC[-4],Enunciado!R3C6:R5C7,2,0)+RC[-3] -> 41542 | G389: =+IF(RC[-1]>=RC[-3],"ON TIME","OUT OF TIME") -> OUT OF TIME | H389: =+YEAR(RC[-5]) -> 2013 | I389: =+MONTH(RC[-6]) -> 9 | J389: =+RC[-6]-RC[-7] -> 48 | K389: =+IF(RC[-4]="OUT of TIME",RC[-1]-VLOOKUP(RC[-9],Enunciado!R3C6:R5C7,2,0),"") -> 43
A390: Dept3-10202 | B390: Alto | C390: 41567 | D390: 41593 | E390: =+LEFT(RC[-4],5) -> Dept3 | F390: =+VLOOKUP(RC[-4],Enunciado!R3C6:R5C7,2,0)+RC[-3] -> 41572 | G390: =+IF(RC[-1]>=RC[-3],"ON TIME","OUT OF TIME") -> OUT OF TIME | H390: =+YEAR(RC[-5]) -> 2013 | I390: =+MONTH(RC[-6]) -> 10 | J390: =+RC[-6]-RC[-7] -> 26 | K390: =+IF(RC[-4]="OUT of TIME",RC[-1]-VLOOKUP(RC[-9],Enunciado!R3C6:R5C7,2,0),"") -> 21
A391: Dept1-440 | B391: Alto | C391: 41061 | D391: 41070 | E391: =+LEFT(RC[-4],5) -> Dept1 | F391: =+VLOOKUP(RC[-4],Enunciado!R3C6:R5C7,2,0)+RC[-3] -> 41066 | G391: =+IF(RC[-1]>=RC[-3],"ON TIME","OUT OF TIME") -> OUT OF TIME | H391: =+YEAR(RC[-5]) -> 2012 | I391: =+MONTH(RC[-6]) -> 6 | J391: =+RC[-6]-RC[-7] -> 9 | K391: =+IF(RC[-4]="OUT of TIME",RC[-1]-VLOOKUP(RC[-9],Enunciado!R3C6:R5C7,2,0),"") -> 4
A392: Dept4-7967 | B392: Alto | C392: 41532 | D392: 41535 | E392: =+LEFT(RC[-4],5) -> Dept4 | F392: =+VLOOKUP(RC[-4],Enunciado!R3C6:R5C7,2,0)+RC[-3] -> 41537 | G392: =+IF(RC[-1]>=RC[-3],"ON TIME","OUT OF TIME") -> ON TIME | H392: =+YEAR(RC[-5]) -> 2013 | I392: =+MONTH(RC[-6]) -> 9 | J392: =+RC[-6]-RC[-7] -> 3 | K392: =+IF(RC[-4]="OUT of TIME",RC[-1]-VLOOKUP(RC[-9],Enunciado!R3C6:R5C7,2,0),"") -> 
A393: Dept3-7838 | B393: Alto | C393: 41227 | D393: 41244 | E393: =+LEFT(RC[-4],5) -> Dept3 | F393: =+VLOOKUP(RC[-4],Enunciado!R3C6:R5C7,2,0)+RC[-3] -> 41232 | G393: =+IF(RC[-1]>=RC[-3],"ON TIME","OUT OF TIME") -> OUT OF TIME | H393: =+YEAR(RC[-5]) -> 2012 | I393: =+MONTH(RC[-6]) -> 11 | J393: =+RC[-6]-RC[-7] -> 17 | K393: =+IF(RC[-4]="OUT of TIME",RC[-1]-VLOOKUP(RC[-9],Enunciado!R3C6:R5C7,2,0),"") -> 12
A394: Dept2-9385 | B394: Alto | C394: 40948 | D394: 40949 | E394: =+LEFT(RC[-4],5) -> Dept2 | F394: =+VLOOKUP(RC[-4],Enunciado!R3C6:R5C7,2,0)+RC[-3] -> 40953 | G394: =+IF(RC[-1]>=RC[-3],"ON TIME","OUT OF TIME") -> ON TIME | H394: =+YEAR(RC[-5]) -> 2012 | I394: =+MONTH(RC[-6]) -> 2 | J394: =+RC[-6]-RC[-7] -> 1 | K394: =+IF(RC[-4]="OUT of TIME",RC[-1]-VLOOKUP(RC[-9],Enunciado!R3C6:R5C7,2,0),"") -> 
A395: Dept2-17548 | B395: Medio | C395: 40957 | D395: 40958 | E395: =+LEFT(RC[-4],5) -> Dept2 | F395: =+VLOOKUP(RC[-4],Enunciado!R3C6:R5C7,2,0)+RC[-3] -> 40972 | G395: =+IF(RC[-1]>=RC[-3],"ON TIME","OUT OF TIME") -> ON TIME | H395: =+YEAR(RC[-5]) -> 2012 | I395: =+MONTH(RC[-6]) -> 2 | J395: =+RC[-6]-RC[-7] -> 1 | K395: =+IF(RC[-4]="OUT of TIME",RC[-1]-VLOOKUP(RC[-9],Enunciado!R3C6:R5C7,2,0),"") -> 
A396: Dept6-15304 | B396: Alto | C396: 41106 | D396: 41115 | E396: =+LEFT(RC[-4],5) -> Dept6 | F396: =+VLOOKUP(RC[-4],Enunciado!R3C6:R5C7,2,0)+RC[-3] -> 41111 | G396: =+IF(RC[-1]>=RC[-3],"ON TIME","OUT OF TIME") -> OUT OF TIME | H396: =+YEAR(RC[-5]) -> 2012 | I396: =+MONTH(RC[-6]) -> 7 | J396: =+RC[-6]-RC[-7] -> 9 | K396: =+IF(RC[-4]="OUT of TIME",RC[-1]-VLOOKUP(RC[-9],Enunciado!R3C6:R5C7,2,0),"") -> 4
A397: Dept3-27649 | B397: Bajo | C397: 41461 | D397: 41465 | E397: =+LEFT(RC[-4],5) -> Dept3 | F397: =+VLOOKUP(RC[-4],Enunciado!R3C6:R5C7,2,0)+RC[-3] -> 41491 | G397: =+IF(RC[-1]>=RC[-3],"ON TIME","OUT OF TIME") -> ON TIME | H397: =+YEAR(RC[-5]) -> 2013 | I397: =+MONTH(RC[-6]) -> 7 | J397: =+RC[-6]-RC[-7] -> 4 | K397: =+IF(RC[-4]="OUT of TIME",RC[-1]-VLOOKUP(RC[-9],Enunciado!R3C6:R5C7,2,0),"") -> 
A398: Dept6-6572 | B398: Alto | C398: 41158 | D398: 41161 | E398: =+LEFT(RC[-4],5) -> Dept6 | F398: =+VLOOKUP(RC[-4],Enunciado!R3C6:R5C7,2,0)+RC[-3] -> 41163 | G398: =+IF(RC[-1]>=RC[-3],"ON TIME","OUT OF TIME") -> ON TIME | H398: =+YEAR(RC[-5]) -> 2012 | I398: =+MONTH(RC[-6]) -> 9 | J398: =+RC[-6]-RC[-7] -> 3 | K398: =+IF(RC[-4]="OUT of TIME",RC[-1]-VLOOKUP(RC[-9],Enunciado!R3C6:R5C7,2,0),"") -> 
A399: Dept1-28181 | B399: Bajo | C399: 41007 | D399: 41017 | E399: =+LEFT(RC[-4],5) -> Dept1 | F399: =+VLOOKUP(RC[-4],Enunciado!R3C6:R5C7,2,0)+RC[-3] -> 41037 | G399: =+IF(RC[-1]>=RC[-3],"ON TIME","OUT OF TIME") -> ON TIME | H399: =+YEAR(RC[-5]) -> 2012 | I399: =+MONTH(RC[-6]) -> 4 | J399: =+RC[-6]-RC[-7] -> 10 | K399: =+IF(RC[-4]="OUT of TIME",RC[-1]-VLOOKUP(RC[-9],Enunciado!R3C6:R5C7,2,0),"") -> 
A400: Dept4-10994 | B400: Bajo | C400: 41057 | D400: 41060 | E400: =+LEFT(RC[-4],5) -> Dept4 | F400: =+VLOOKUP(RC[-4],Enunciado!R3C6:R5C7,2,0)+RC[-3] -> 41087 | G400: =+IF(RC[-1]>=RC[-3],"ON TIME","OUT OF TIME") -> ON TIME | H400: =+YEAR(RC[-5]) -> 2012 | I400: =+MONTH(RC[-6]) -> 5 | J400: =+RC[-6]-RC[-7] -> 3 | K400: =+IF(RC[-4]="OUT of TIME",RC[-1]-VLOOKUP(RC[-9],Enunciado!R3C6:R5C7,2,0),"") -> 
A401: Dept6-8979 | B401: Alto | C401: 41447 | D401: 41451 | E401: =+LEFT(RC[-4],5) -> Dept6 | F401: =+VLOOKUP(RC[-4],Enunciado!R3C6:R5C7,2,0)+RC[-3] -> 41452 | G401: =+IF(RC[-1]>=RC[-3],"ON TIME","OUT OF TIME") -> ON TIME | H401: =+YEAR(RC[-5]) -> 2013 | I401: =+MONTH(RC[-6]) -> 6 | J401: =+RC[-6]-RC[-7] -> 4 | K401: =+IF(RC[-4]="OUT of TIME",RC[-1]-VLOOKUP(RC[-9],Enunciado!R3C6:R5C7,2,0),"") -> 
A402: Dept5-19002 | B402: Alto | C402: 41422 | D402: 41423 | E402: =+LEFT(RC[-4],5) -> Dept5 | F402: =+VLOOKUP(RC[-4],Enunciado!R3C6:R5C7,2,0)+RC[-3] -> 41427 | G402: =+IF(RC[-1]>=RC[-3],"ON TIME","OUT OF TIME") -> ON TIME | H402: =+YEAR(RC[-5]) -> 2013 | I402: =+MONTH(RC[-6]) -> 5 | J402: =+RC[-6]-RC[-7] -> 1 | K402: =+IF(RC[-4]="OUT of TIME",RC[-1]-VLOOKUP(RC[-9],Enunciado!R3C6:R5C7,2,0),"") -> 
A403: Dept5-26691 | B403: Medio | C403: 41282 | D403: 41283 | E403: =+LEFT(RC[-4],5) -> Dept5 | F403: =+VLOOKUP(RC[-4],Enunciado!R3C6:R5C7,2,0)+RC[-3] -> 41297 | G403: =+IF(RC[-1]>=RC[-3],"ON TIME","OUT OF TIME") -> ON TIME | H403: =+YEAR(RC[-5]) -> 2013 | I403: =+MONTH(RC[-6]) -> 1 | J403: =+RC[-6]-RC[-7] -> 1 | K403: =+IF(RC[-4]="OUT of TIME",RC[-1]-VLOOKUP(RC[-9],Enunciado!R3C6:R5C7,2,0),"") -> 
A404: Dept1-13347 | B404: Alto | C404: 41323 | D404: 41325 | E404: =+LEFT(RC[-4],5) -> Dept1 | F404: =+VLOOKUP(RC[-4],Enunciado!R3C6:R5C7,2,0)+RC[-3] -> 41328 | G404: =+IF(RC[-1]>=RC[-3],"ON TIME","OUT OF TIME") -> ON TIME | H404: =+YEAR(RC[-5]) -> 2013 | I404: =+MONTH(RC[-6]) -> 2 | J404: =+RC[-6]-RC[-7] -> 2 | K404: =+IF(RC[-4]="OUT of TIME",RC[-1]-VLOOKUP(RC[-9],Enunciado!R3C6:R5C7,2,0),"") -> 
A405: Dept1-22540 | B405: Bajo | C405: 40947 | D405: 40960 | E405: =+LEFT(RC[-4],5) -> Dept1 | F405: =+VLOOKUP(RC[-4],Enunciado!R3C6:R5C7,2,0)+RC[-3] -> 40977 | G405: =+IF(RC[-1]>=RC[-3],"ON TIME","OUT OF TIME") -> ON TIME | H405: =+YEAR(RC[-5]) -> 2012 | I405: =+MONTH(RC[-6]) -> 2 | J405: =+RC[-6]-RC[-7] -> 13 | K405: =+IF(RC[-4]="OUT of TIME",RC[-1]-VLOOKUP(RC[-9],Enunciado!R3C6:R5C7,2,0),"") -> 
A406: Dept4-25624 | B406: Bajo | C406: 41275 | D406: 41286 | E406: =+LEFT(RC[-4],5) -> Dept4 | F406: =+VLOOKUP(RC[-4],Enunciado!R3C6:R5C7,2,0)+RC[-3] -> 41305 | G406: =+IF(RC[-1]>=RC[-3],"ON TIME","OUT OF TIME") -> ON TIME | H406: =+YEAR(RC[-5]) -> 2013 | I406: =+MONTH(RC[-6]) -> 1 | J406: =+RC[-6]-RC[-7] -> 11 | K406: =+IF(RC[-4]="OUT of TIME",RC[-1]-VLOOKUP(RC[-9],Enunciado!R3C6:R5C7,2,0),"") -> 
A407: Dept5-19881 | B407: Bajo | C407: 41395 | D407: 41441 | E407: =+LEFT(RC[-4],5) -> Dept5 | F407: =+VLOOKUP(RC[-4],Enunciado!R3C6:R5C7,2,0)+RC[-3] -> 41425 | G407: =+IF(RC[-1]>=RC[-3],"ON TIME","OUT OF TIME") -> OUT OF TIME | H407: =+YEAR(RC[-5]) -> 2013 | I407: =+MONTH(RC[-6]) -> 5 | J407: =+RC[-6]-RC[-7] -> 46 | K407: =+IF(RC[-4]="OUT of TIME",RC[-1]-VLOOKUP(RC[-9],Enunciado!R3C6:R5C7,2,0),"") -> 16
A408: Dept1-19957 | B408: Alto | C408: 41031 | D408: 41035 | E408: =+LEFT(RC[-4],5) -> Dept1 | F408: =+VLOOKUP(RC[-4],Enunciado!R3C6:R5C7,2,0)+RC[-3] -> 41036 | G408: =+IF(RC[-1]>=RC[-3],"ON TIME","OUT OF TIME") -> ON TIME | H408: =+YEAR(RC[-5]) -> 2012 | I408: =+MONTH(RC[-6]) -> 5 | J408: =+RC[-6]-RC[-7] -> 4 | K408: =+IF(RC[-4]="OUT of TIME",RC[-1]-VLOOKUP(RC[-9],Enunciado!R3C6:R5C7,2,0),"") -> 
A409: Dept2-18137 | B409: Bajo | C409: 40918 | D409: 40938 | E409: =+LEFT(RC[-4],5) -> Dept2 | F409: =+VLOOKUP(RC[-4],Enunciado!R3C6:R5C7,2,0)+RC[-3] -> 40948 | G409: =+IF(RC[-1]>=RC[-3],"ON TIME","OUT OF TIME") -> ON TIME | H409: =+YEAR(RC[-5]) -> 2012 | I409: =+MONTH(RC[-6]) -> 1 | J409: =+RC[-6]-RC[-7] -> 20 | K409: =+IF(RC[-4]="OUT of TIME",RC[-1]-VLOOKUP(RC[-9],Enunciado!R3C6:R5C7,2,0),"") -> 
A410: Dept4-11626 | B410: Alto | C410: 41532 | D410: 41541 | E410: =+LEFT(RC[-4],5) -> Dept4 | F410: =+VLOOKUP(RC[-4],Enunciado!R3C6:R5C7,2,0)+RC[-3] -> 41537 | G410: =+IF(RC[-1]>=RC[-3],"ON TIME","OUT OF TIME") -> OUT OF TIME | H410: =+YEAR(RC[-5]) -> 2013 | I410: =+MONTH(RC[-6]) -> 9 | J410: =+RC[-6]-RC[-7] -> 9 | K410: =+IF(RC[-4]="OUT of TIME",RC[-1]-VLOOKUP(RC[-9],Enunciado!R3C6:R5C7,2,0),"") -> 4
A411: Dept1-17159 | B411: Bajo | C411: 41462 | D411: 41464 | E411: =+LEFT(RC[-4],5) -> Dept1 | F411: =+VLOOKUP(RC[-4],Enunciado!R3C6:R5C7,2,0)+RC[-3] -> 41492 | G411: =+IF(RC[-1]>=RC[-3],"ON TIME","OUT OF TIME") -> ON TIME | H411: =+YEAR(RC[-5]) -> 2013 | I411: =+MONTH(RC[-6]) -> 7 | J411: =+RC[-6]-RC[-7] -> 2 | K411: =+IF(RC[-4]="OUT of TIME",RC[-1]-VLOOKUP(RC[-9],Enunciado!R3C6:R5C7,2,0),"") -> 
A412: Dept1-25988 | B412: Alto | C412: 40956 | D412: 40964 | E412: =+LEFT(RC[-4],5) -> Dept1 | F412: =+VLOOKUP(RC[-4],Enunciado!R3C6:R5C7,2,0)+RC[-3] -> 40961 | G412: =+IF(RC[-1]>=RC[-3],"ON TIME","OUT OF TIME") -> OUT OF TIME | H412: =+YEAR(RC[-5]) -> 2012 | I412: =+MONTH(RC[-6]) -> 2 | J412: =+RC[-6]-RC[-7] -> 8 | K412: =+IF(RC[-4]="OUT of TIME",RC[-1]-VLOOKUP(RC[-9],Enunciado!R3C6:R5C7,2,0),"") -> 3
A413: Dept3-13574 | B413: Medio | C413: 41482 | D413: 41495 | E413: =+LEFT(RC[-4],5) -> Dept3 | F413: =+VLOOKUP(RC[-4],Enunciado!R3C6:R5C7,2,0)+RC[-3] -> 41497 | G413: =+IF(RC[-1]>=RC[-3],"ON TIME","OUT OF TIME") -> ON TIME | H413: =+YEAR(RC[-5]) -> 2013 | I413: =+MONTH(RC[-6]) -> 7 | J413: =+RC[-6]-RC[-7] -> 13 | K413: =+IF(RC[-4]="OUT of TIME",RC[-1]-VLOOKUP(RC[-9],Enunciado!R3C6:R5C7,2,0),"") -> 
A414: Dept4-20468 | B414: Medio | C414: 41328 | D414: 41331 | E414: =+LEFT(RC[-4],5) -> Dept4 | F414: =+VLOOKUP(RC[-4],Enunciado!R3C6:R5C7,2,0)+RC[-3] -> 41343 | G414: =+IF(RC[-1]>=RC[-3],"ON TIME","OUT OF TIME") -> ON TIME | H414: =+YEAR(RC[-5]) -> 2013 | I414: =+MONTH(RC[-6]) -> 2 | J414: =+RC[-6]-RC[-7] -> 3 | K414: =+IF(RC[-4]="OUT of TIME",RC[-1]-VLOOKUP(RC[-9],Enunciado!R3C6:R5C7,2,0),"") -> 
A415: Dept2-28199 | B415: Bajo | C415: 41311 | D415: 41350 | E415: =+LEFT(RC[-4],5) -> Dept2 | F415: =+VLOOKUP(RC[-4],Enunciado!R3C6:R5C7,2,0)+RC[-3] -> 41341 | G415: =+IF(RC[-1]>=RC[-3],"ON TIME","OUT OF TIME") -> OUT OF TIME | H415: =+YEAR(RC[-5]) -> 2013 | I415: =+MONTH(RC[-6]) -> 2 | J415: =+RC[-6]-RC[-7] -> 39 | K415: =+IF(RC[-4]="OUT of TIME",RC[-1]-VLOOKUP(RC[-9],Enunciado!R3C6:R5C7,2,0),"") -> 9
A416: Dept4-19956 | B416: Medio | C416: 41570 | D416: 41571 | E416: =+LEFT(RC[-4],5) -> Dept4 | F416: =+VLOOKUP(RC[-4],Enunciado!R3C6:R5C7,2,0)+RC[-3] -> 41585 | G416: =+IF(RC[-1]>=RC[-3],"ON TIME","OUT OF TIME") -> ON TIME | H416: =+YEAR(RC[-5]) -> 2013 | I416: =+MONTH(RC[-6]) -> 10 | J416: =+RC[-6]-RC[-7] -> 1 | K416: =+IF(RC[-4]="OUT of TIME",RC[-1]-VLOOKUP(RC[-9],Enunciado!R3C6:R5C7,2,0),"") -> 
A417: Dept3-21059 | B417: Medio | C417: 41034 | D417: 41045 | E417: =+LEFT(RC[-4],5) -> Dept3 | F417: =+VLOOKUP(RC[-4],Enunciado!R3C6:R5C7,2,0)+RC[-3] -> 41049 | G417: =+IF(RC[-1]>=RC[-3],"ON TIME","OUT OF TIME") -> ON TIME | H417: =+YEAR(RC[-5]) -> 2012 | I417: =+MONTH(RC[-6]) -> 5 | J417: =+RC[-6]-RC[-7] -> 11 | K417: =+IF(RC[-4]="OUT of TIME",RC[-1]-VLOOKUP(RC[-9],Enunciado!R3C6:R5C7,2,0),"") -> 
A418: Dept2-3414 | B418: Bajo | C418: 41596 | D418: 41598 | E418: =+LEFT(RC[-4],5) -> Dept2 | F418: =+VLOOKUP(RC[-4],Enunciado!R3C6:R5C7,2,0)+RC[-3] -> 41626 | G418: =+IF(RC[-1]>=RC[-3],"ON TIME","OUT OF TIME") -> ON TIME | H418: =+YEAR(RC[-5]) -> 2013 | I418: =+MONTH(RC[-6]) -> 11 | J418: =+RC[-6]-RC[-7] -> 2 | K418: =+IF(RC[-4]="OUT of TIME",RC[-1]-VLOOKUP(RC[-9],Enunciado!R3C6:R5C7,2,0),"") -> 
A419: Dept1-8095 | B419: Bajo | C419: 41029 | D419: 41029 | E419: =+LEFT(RC[-4],5) -> Dept1 | F419: =+VLOOKUP(RC[-4],Enunciado!R3C6:R5C7,2,0)+RC[-3] -> 41059 | G419: =+IF(RC[-1]>=RC[-3],"ON TIME","OUT OF TIME") -> ON TIME | H419: =+YEAR(RC[-5]) -> 2012 | I419: =+MONTH(RC[-6]) -> 4 | J419: =+RC[-6]-RC[-7] -> 0 | K419: =+IF(RC[-4]="OUT of TIME",RC[-1]-VLOOKUP(RC[-9],Enunciado!R3C6:R5C7,2,0),"") -> 
A420: Dept2-17004 | B420: Alto | C420: 41535 | D420: 41539 | E420: =+LEFT(RC[-4],5) -> Dept2 | F420: =+VLOOKUP(RC[-4],Enunciado!R3C6:R5C7,2,0)+RC[-3] -> 41540 | G420: =+IF(RC[-1]>=RC[-3],"ON TIME","OUT OF TIME") -> ON TIME | H420: =+YEAR(RC[-5]) -> 2013 | I420: =+MONTH(RC[-6]) -> 9 | J420: =+RC[-6]-RC[-7] -> 4 | K420: =+IF(RC[-4]="OUT of TIME",RC[-1]-VLOOKUP(RC[-9],Enunciado!R3C6:R5C7,2,0),"") -> 
A421: Dept4-11110 | B421: Alto | C421: 41085 | D421: 41090 | E421: =+LEFT(RC[-4],5) -> Dept4 | F421: =+VLOOKUP(RC[-4],Enunciado!R3C6:R5C7,2,0)+RC[-3] -> 41090 | G421: =+IF(RC[-1]>=RC[-3],"ON TIME","OUT OF TIME") -> ON TIME | H421: =+YEAR(RC[-5]) -> 2012 | I421: =+MONTH(RC[-6]) -> 6 | J421: =+RC[-6]-RC[-7] -> 5 | K421: =+IF(RC[-4]="OUT of TIME",RC[-1]-VLOOKUP(RC[-9],Enunciado!R3C6:R5C7,2,0),"") -> 
A422: Dept4-6559 | B422: Medio | C422: 41398 | D422: 41407 | E422: =+LEFT(RC[-4],5) -> Dept4 | F422: =+VLOOKUP(RC[-4],Enunciado!R3C6:R5C7,2,0)+RC[-3] -> 41413 | G422: =+IF(RC[-1]>=RC[-3],"ON TIME","OUT OF TIME") -> ON TIME | H422: =+YEAR(RC[-5]) -> 2013 | I422: =+MONTH(RC[-6]) -> 5 | J422: =+RC[-6]-RC[-7] -> 9 | K422: =+IF(RC[-4]="OUT of TIME",RC[-1]-VLOOKUP(RC[-9],Enunciado!R3C6:R5C7,2,0),"") -> 
A423: Dept4-20017 | B423: Medio | C423: 40967 | D423: 40969 | E423: =+LEFT(RC[-4],5) -> Dept4 | F423: =+VLOOKUP(RC[-4],Enunciado!R3C6:R5C7,2,0)+RC[-3] -> 40982 | G423: =+IF(RC[-1]>=RC[-3],"ON TIME","OUT OF TIME") -> ON TIME | H423: =+YEAR(RC[-5]) -> 2012 | I423: =+MONTH(RC[-6]) -> 2 | J423: =+RC[-6]-RC[-7] -> 2 | K423: =+IF(RC[-4]="OUT of TIME",RC[-1]-VLOOKUP(RC[-9],Enunciado!R3C6:R5C7,2,0),"") -> 
A424: Dept3-9689 | B424: Bajo | C424: 41529 | D424: 41547 | E424: =+LEFT(RC[-4],5) -> Dept3 | F424: =+VLOOKUP(RC[-4],Enunciado!R3C6:R5C7,2,0)+RC[-3] -> 41559 | G424: =+IF(RC[-1]>=RC[-3],"ON TIME","OUT OF TIME") -> ON TIME | H424: =+YEAR(RC[-5]) -> 2013 | I424: =+MONTH(RC[-6]) -> 9 | J424: =+RC[-6]-RC[-7] -> 18 | K424: =+IF(RC[-4]="OUT of TIME",RC[-1]-VLOOKUP(RC[-9],Enunciado!R3C6:R5C7,2,0),"") -> 
A425: Dept5-3961 | B425: Medio | C425: 40936 | D425: 40936 | E425: =+LEFT(RC[-4],5) -> Dept5 | F425: =+VLOOKUP(RC[-4],Enunciado!R3C6:R5C7,2,0)+RC[-3] -> 40951 | G425: =+IF(RC[-1]>=RC[-3],"ON TIME","OUT OF TIME") -> ON TIME | H425: =+YEAR(RC[-5]) -> 2012 | I425: =+MONTH(RC[-6]) -> 1 | J425: =+RC[-6]-RC[-7] -> 0 | K425: =+IF(RC[-4]="OUT of TIME",RC[-1]-VLOOKUP(RC[-9],Enunciado!R3C6:R5C7,2,0),"") -> 
A426: Dept6-5366 | B426: Bajo | C426: 41044 | D426: 41050 | E426: =+LEFT(RC[-4],5) -> Dept6 | F426: =+VLOOKUP(RC[-4],Enunciado!R3C6:R5C7,2,0)+RC[-3] -> 41074 | G426: =+IF(RC[-1]>=RC[-3],"ON TIME","OUT OF TIME") -> ON TIME | H426: =+YEAR(RC[-5]) -> 2012 | I426: =+MONTH(RC[-6]) -> 5 | J426: =+RC[-6]-RC[-7] -> 6 | K426: =+IF(RC[-4]="OUT of TIME",RC[-1]-VLOOKUP(RC[-9],Enunciado!R3C6:R5C7,2,0),"") -> 
A427: Dept6-15365 | B427: Bajo | C427: 41345 | D427: 41352 | E427: =+LEFT(RC[-4],5) -> Dept6 | F427: =+VLOOKUP(RC[-4],Enunciado!R3C6:R5C7,2,0)+RC[-3] -> 41375 | G427: =+IF(RC[-1]>=RC[-3],"ON TIME","OUT OF TIME") -> ON TIME | H427: =+YEAR(RC[-5]) -> 2013 | I427: =+MONTH(RC[-6]) -> 3 | J427: =+RC[-6]-RC[-7] -> 7 | K427: =+IF(RC[-4]="OUT of TIME",RC[-1]-VLOOKUP(RC[-9],Enunciado!R3C6:R5C7,2,0),"") -> 
A428: Dept6-16262 | B428: Alto | C428: 41444 | D428: 41444 | E428: =+LEFT(RC[-4],5) -> Dept6 | F428: =+VLOOKUP(RC[-4],Enunciado!R3C6:R5C7,2,0)+RC[-3] -> 41449 | G428: =+IF(RC[-1]>=RC[-3],"ON TIME","OUT OF TIME") -> ON TIME | H428: =+YEAR(RC[-5]) -> 2013 | I428: =+MONTH(RC[-6]) -> 6 | J428: =+RC[-6]-RC[-7] -> 0 | K428: =+IF(RC[-4]="OUT of TIME",RC[-1]-VLOOKUP(RC[-9],Enunciado!R3C6:R5C7,2,0),"") -> 
A429: Dept6-18471 | B429: Bajo | C429: 41574 | D429: 41581 | E429: =+LEFT(RC[-4],5) -> Dept6 | F429: =+VLOOKUP(RC[-4],Enunciado!R3C6:R5C7,2,0)+RC[-3] -> 41604 | G429: =+IF(RC[-1]>=RC[-3],"ON TIME","OUT OF TIME") -> ON TIME | H429: =+YEAR(RC[-5]) -> 2013 | I429: =+MONTH(RC[-6]) -> 10 | J429: =+RC[-6]-RC[-7] -> 7 | K429: =+IF(RC[-4]="OUT of TIME",RC[-1]-VLOOKUP(RC[-9],Enunciado!R3C6:R5C7,2,0),"") -> 
A430: Dept2-16693 | B430: Alto | C430: 40947 | D430: 40964 | E430: =+LEFT(RC[-4],5) -> Dept2 | F430: =+VLOOKUP(RC[-4],Enunciado!R3C6:R5C7,2,0)+RC[-3] -> 40952 | G430: =+IF(RC[-1]>=RC[-3],"ON TIME","OUT OF TIME") -> OUT OF TIME | H430: =+YEAR(RC[-5]) -> 2012 | I430: =+MONTH(RC[-6]) -> 2 | J430: =+RC[-6]-RC[-7] -> 17 | K430: =+IF(RC[-4]="OUT of TIME",RC[-1]-VLOOKUP(RC[-9],Enunciado!R3C6:R5C7,2,0),"") -> 12
A431: Dept4-11432 | B431: Medio | C431: 40956 | D431: 40967 | E431: =+LEFT(RC[-4],5) -> Dept4 | F431: =+VLOOKUP(RC[-4],Enunciado!R3C6:R5C7,2,0)+RC[-3] -> 40971 | G431: =+IF(RC[-1]>=RC[-3],"ON TIME","OUT OF TIME") -> ON TIME | H431: =+YEAR(RC[-5]) -> 2012 | I431: =+MONTH(RC[-6]) -> 2 | J431: =+RC[-6]-RC[-7] -> 11 | K431: =+IF(RC[-4]="OUT of TIME",RC[-1]-VLOOKUP(RC[-9],Enunciado!R3C6:R5C7,2,0),"") -> 
A432: Dept4-16446 | B432: Medio | C432: 41576 | D432: 41577 | E432: =+LEFT(RC[-4],5) -> Dept4 | F432: =+VLOOKUP(RC[-4],Enunciado!R3C6:R5C7,2,0)+RC[-3] -> 41591 | G432: =+IF(RC[-1]>=RC[-3],"ON TIME","OUT OF TIME") -> ON TIME | H432: =+YEAR(RC[-5]) -> 2013 | I432: =+MONTH(RC[-6]) -> 10 | J432: =+RC[-6]-RC[-7] -> 1 | K432: =+IF(RC[-4]="OUT of TIME",RC[-1]-VLOOKUP(RC[-9],Enunciado!R3C6:R5C7,2,0),"") -> 
A433: Dept3-28527 | B433: Alto | C433: 41177 | D433: 41177 | E433: =+LEFT(RC[-4],5) -> Dept3 | F433: =+VLOOKUP(RC[-4],Enunciado!R3C6:R5C7,2,0)+RC[-3] -> 41182 | G433: =+IF(RC[-1]>=RC[-3],"ON TIME","OUT OF TIME") -> ON TIME | H433: =+YEAR(RC[-5]) -> 2012 | I433: =+MONTH(RC[-6]) -> 9 | J433: =+RC[-6]-RC[-7] -> 0 | K433: =+IF(RC[-4]="OUT of TIME",RC[-1]-VLOOKUP(RC[-9],Enunciado!R3C6:R5C7,2,0),"") -> 
A434: Dept4-8327 | B434: Medio | C434: 41229 | D434: 41232 | E434: =+LEFT(RC[-4],5) -> Dept4 | F434: =+VLOOKUP(RC[-4],Enunciado!R3C6:R5C7,2,0)+RC[-3] -> 41244 | G434: =+IF(RC[-1]>=RC[-3],"ON TIME","OUT OF TIME") -> ON TIME | H434: =+YEAR(RC[-5]) -> 2012 | I434: =+MONTH(RC[-6]) -> 11 | J434: =+RC[-6]-RC[-7] -> 3 | K434: =+IF(RC[-4]="OUT of TIME",RC[-1]-VLOOKUP(RC[-9],Enunciado!R3C6:R5C7,2,0),"") -> 
A435: Dept6-6552 | B435: Bajo | C435: 41387 | D435: 41387 | E435: =+LEFT(RC[-4],5) -> Dept6 | F435: =+VLOOKUP(RC[-4],Enunciado!R3C6:R5C7,2,0)+RC[-3] -> 41417 | G435: =+IF(RC[-1]>=RC[-3],"ON TIME","OUT OF TIME") -> ON TIME | H435: =+YEAR(RC[-5]) -> 2013 | I435: =+MONTH(RC[-6]) -> 4 | J435: =+RC[-6]-RC[-7] -> 0 | K435: =+IF(RC[-4]="OUT of TIME",RC[-1]-VLOOKUP(RC[-9],Enunciado!R3C6:R5C7,2,0),"") -> 
A436: Dept4-14723 | B436: Alto | C436: 40968 | D436: 40971 | E436: =+LEFT(RC[-4],5) -> Dept4 | F436: =+VLOOKUP(RC[-4],Enunciado!R3C6:R5C7,2,0)+RC[-3] -> 40973 | G436: =+IF(RC[-1]>=RC[-3],"ON TIME","OUT OF TIME") -> ON TIME | H436: =+YEAR(RC[-5]) -> 2012 | I436: =+MONTH(RC[-6]) -> 2 | J436: =+RC[-6]-RC[-7] -> 3 | K436: =+IF(RC[-4]="OUT of TIME",RC[-1]-VLOOKUP(RC[-9],Enunciado!R3C6:R5C7,2,0),"") -> 
A437: Dept1-16952 | B437: Bajo | C437: 41226 | D437: 41251 | E437: =+LEFT(RC[-4],5) -> Dept1 | F437: =+VLOOKUP(RC[-4],Enunciado!R3C6:R5C7,2,0)+RC[-3] -> 41256 | G437: =+IF(RC[-1]>=RC[-3],"ON TIME","OUT OF TIME") -> ON TIME | H437: =+YEAR(RC[-5]) -> 2012 | I437: =+MONTH(RC[-6]) -> 11 | J437: =+RC[-6]-RC[-7] -> 25 | K437: =+IF(RC[-4]="OUT of TIME",RC[-1]-VLOOKUP(RC[-9],Enunciado!R3C6:R5C7,2,0),"") -> 
A438: Dept1-26013 | B438: Alto | C438: 41243 | D438: 41292 | E438: =+LEFT(RC[-4],5) -> Dept1 | F438: =+VLOOKUP(RC[-4],Enunciado!R3C6:R5C7,2,0)+RC[-3] -> 41248 | G438: =+IF(RC[-1]>=RC[-3],"ON TIME","OUT OF TIME") -> OUT OF TIME | H438: =+YEAR(RC[-5]) -> 2012 | I438: =+MONTH(RC[-6]) -> 11 | J438: =+RC[-6]-RC[-7] -> 49 | K438: =+IF(RC[-4]="OUT of TIME",RC[-1]-VLOOKUP(RC[-9],Enunciado!R3C6:R5C7,2,0),"") -> 44
A439: Dept6-22762 | B439: Alto | C439: 40975 | D439: 40976 | E439: =+LEFT(RC[-4],5) -> Dept6 | F439: =+VLOOKUP(RC[-4],Enunciado!R3C6:R5C7,2,0)+RC[-3] -> 40980 | G439: =+IF(RC[-1]>=RC[-3],"ON TIME","OUT OF TIME") -> ON TIME | H439: =+YEAR(RC[-5]) -> 2012 | I439: =+MONTH(RC[-6]) -> 3 | J439: =+RC[-6]-RC[-7] -> 1 | K439: =+IF(RC[-4]="OUT of TIME",RC[-1]-VLOOKUP(RC[-9],Enunciado!R3C6:R5C7,2,0),"") -> 
A440: Dept6-21111 | B440: Alto | C440: 40918 | D440: 40924 | E440: =+LEFT(RC[-4],5) -> Dept6 | F440: =+VLOOKUP(RC[-4],Enunciado!R3C6:R5C7,2,0)+RC[-3] -> 40923 | G440: =+IF(RC[-1]>=RC[-3],"ON TIME","OUT OF TIME") -> OUT OF TIME | H440: =+YEAR(RC[-5]) -> 2012 | I440: =+MONTH(RC[-6]) -> 1 | J440: =+RC[-6]-RC[-7] -> 6 | K440: =+IF(RC[-4]="OUT of TIME",RC[-1]-VLOOKUP(RC[-9],Enunciado!R3C6:R5C7,2,0),"") -> 1
A441: Dept5-6911 | B441: Alto | C441: 40925 | D441: 40928 | E441: =+LEFT(RC[-4],5) -> Dept5 | F441: =+VLOOKUP(RC[-4],Enunciado!R3C6:R5C7,2,0)+RC[-3] -> 40930 | G441: =+IF(RC[-1]>=RC[-3],"ON TIME","OUT OF TIME") -> ON TIME | H441: =+YEAR(RC[-5]) -> 2012 | I441: =+MONTH(RC[-6]) -> 1 | J441: =+RC[-6]-RC[-7] -> 3 | K441: =+IF(RC[-4]="OUT of TIME",RC[-1]-VLOOKUP(RC[-9],Enunciado!R3C6:R5C7,2,0),"") -> 
A442: Dept3-27986 | B442: Medio | C442: 41558 | D442: 41565 | E442: =+LEFT(RC[-4],5) -> Dept3 | F442: =+VLOOKUP(RC[-4],Enunciado!R3C6:R5C7,2,0)+RC[-3] -> 41573 | G442: =+IF(RC[-1]>=RC[-3],"ON TIME","OUT OF TIME") -> ON TIME | H442: =+YEAR(RC[-5]) -> 2013 | I442: =+MONTH(RC[-6]) -> 10 | J442: =+RC[-6]-RC[-7] -> 7 | K442: =+IF(RC[-4]="OUT of TIME",RC[-1]-VLOOKUP(RC[-9],Enunciado!R3C6:R5C7,2,0),"") -> 
A443: Dept5-5956 | B443: Bajo | C443: 41528 | D443: 41532 | E443: =+LEFT(RC[-4],5) -> Dept5 | F443: =+VLOOKUP(RC[-4],Enunciado!R3C6:R5C7,2,0)+RC[-3] -> 41558 | G443: =+IF(RC[-1]>=RC[-3],"ON TIME","OUT OF TIME") -> ON TIME | H443: =+YEAR(RC[-5]) -> 2013 | I443: =+MONTH(RC[-6]) -> 9 | J443: =+RC[-6]-RC[-7] -> 4 | K443: =+IF(RC[-4]="OUT of TIME",RC[-1]-VLOOKUP(RC[-9],Enunciado!R3C6:R5C7,2,0),"") -> 
A444: Dept4-9445 | B444: Alto | C444: 41538 | D444: 41540 | E444: =+LEFT(RC[-4],5) -> Dept4 | F444: =+VLOOKUP(RC[-4],Enunciado!R3C6:R5C7,2,0)+RC[-3] -> 41543 | G444: =+IF(RC[-1]>=RC[-3],"ON TIME","OUT OF TIME") -> ON TIME | H444: =+YEAR(RC[-5]) -> 2013 | I444: =+MONTH(RC[-6]) -> 9 | J444: =+RC[-6]-RC[-7] -> 2 | K444: =+IF(RC[-4]="OUT of TIME",RC[-1]-VLOOKUP(RC[-9],Enunciado!R3C6:R5C7,2,0),"") -> 
A445: Dept3-10816 | B445: Alto | C445: 41448 | D445: 41458 | E445: =+LEFT(RC[-4],5) -> Dept3 | F445: =+VLOOKUP(RC[-4],Enunciado!R3C6:R5C7,2,0)+RC[-3] -> 41453 | G445: =+IF(RC[-1]>=RC[-3],"ON TIME","OUT OF TIME") -> OUT OF TIME | H445: =+YEAR(RC[-5]) -> 2013 | I445: =+MONTH(RC[-6]) -> 6 | J445: =+RC[-6]-RC[-7] -> 10 | K445: =+IF(RC[-4]="OUT of TIME",RC[-1]-VLOOKUP(RC[-9],Enunciado!R3C6:R5C7,2,0),"") -> 5
A446: Dept5-27004 | B446: Alto | C446: 41020 | D446: 41026 | E446: =+LEFT(RC[-4],5) -> Dept5 | F446: =+VLOOKUP(RC[-4],Enunciado!R3C6:R5C7,2,0)+RC[-3] -> 41025 | G446: =+IF(RC[-1]>=RC[-3],"ON TIME","OUT OF TIME") -> OUT OF TIME | H446: =+YEAR(RC[-5]) -> 2012 | I446: =+MONTH(RC[-6]) -> 4 | J446: =+RC[-6]-RC[-7] -> 6 | K446: =+IF(RC[-4]="OUT of TIME",RC[-1]-VLOOKUP(RC[-9],Enunciado!R3C6:R5C7,2,0),"") -> 1
A447: Dept3-3543 | B447: Medio | C447: 41219 | D447: 41219 | E447: =+LEFT(RC[-4],5) -> Dept3 | F447: =+VLOOKUP(RC[-4],Enunciado!R3C6:R5C7,2,0)+RC[-3] -> 41234 | G447: =+IF(RC[-1]>=RC[-3],"ON TIME","OUT OF TIME") -> ON TIME | H447: =+YEAR(RC[-5]) -> 2012 | I447: =+MONTH(RC[-6]) -> 11 | J447: =+RC[-6]-RC[-7] -> 0 | K447: =+IF(RC[-4]="OUT of TIME",RC[-1]-VLOOKUP(RC[-9],Enunciado!R3C6:R5C7,2,0),"") -> 
A448: Dept2-3161 | B448: Alto | C448: 41579 | D448: 41625 | E448: =+LEFT(RC[-4],5) -> Dept2 | F448: =+VLOOKUP(RC[-4],Enunciado!R3C6:R5C7,2,0)+RC[-3] -> 41584 | G448: =+IF(RC[-1]>=RC[-3],"ON TIME","OUT OF TIME") -> OUT OF TIME | H448: =+YEAR(RC[-5]) -> 2013 | I448: =+MONTH(RC[-6]) -> 11 | J448: =+RC[-6]-RC[-7] -> 46 | K448: =+IF(RC[-4]="OUT of TIME",RC[-1]-VLOOKUP(RC[-9],Enunciado!R3C6:R5C7,2,0),"") -> 41
A449: Dept1-16734 | B449: Alto | C449: 41220 | D449: 41221 | E449: =+LEFT(RC[-4],5) -> Dept1 | F449: =+VLOOKUP(RC[-4],Enunciado!R3C6:R5C7,2,0)+RC[-3] -> 41225 | G449: =+IF(RC[-1]>=RC[-3],"ON TIME","OUT OF TIME") -> ON TIME | H449: =+YEAR(RC[-5]) -> 2012 | I449: =+MONTH(RC[-6]) -> 11 | J449: =+RC[-6]-RC[-7] -> 1 | K449: =+IF(RC[-4]="OUT of TIME",RC[-1]-VLOOKUP(RC[-9],Enunciado!R3C6:R5C7,2,0),"") -> 
A450: Dept5-29875 | B450: Bajo | C450: 41230 | D450: 41239 | E450: =+LEFT(RC[-4],5) -> Dept5 | F450: =+VLOOKUP(RC[-4],Enunciado!R3C6:R5C7,2,0)+RC[-3] -> 41260 | G450: =+IF(RC[-1]>=RC[-3],"ON TIME","OUT OF TIME") -> ON TIME | H450: =+YEAR(RC[-5]) -> 2012 | I450: =+MONTH(RC[-6]) -> 11 | J450: =+RC[-6]-RC[-7] -> 9 | K450: =+IF(RC[-4]="OUT of TIME",RC[-1]-VLOOKUP(RC[-9],Enunciado!R3C6:R5C7,2,0),"") -> 
A451: Dept4-19600 | B451: Alto | C451: 41562 | D451: 41569 | E451: =+LEFT(RC[-4],5) -> Dept4 | F451: =+VLOOKUP(RC[-4],Enunciado!R3C6:R5C7,2,0)+RC[-3] -> 41567 | G451: =+IF(RC[-1]>=RC[-3],"ON TIME","OUT OF TIME") -> OUT OF TIME | H451: =+YEAR(RC[-5]) -> 2013 | I451: =+MONTH(RC[-6]) -> 10 | J451: =+RC[-6]-RC[-7] -> 7 | K451: =+IF(RC[-4]="OUT of TIME",RC[-1]-VLOOKUP(RC[-9],Enunciado!R3C6:R5C7,2,0),"") -> 2
A452: Dept3-18575 | B452: Alto | C452: 41491 | D452: 41495 | E452: =+LEFT(RC[-4],5) -> Dept3 | F452: =+VLOOKUP(RC[-4],Enunciado!R3C6:R5C7,2,0)+RC[-3] -> 41496 | G452: =+IF(RC[-1]>=RC[-3],"ON TIME","OUT OF TIME") -> ON TIME | H452: =+YEAR(RC[-5]) -> 2013 | I452: =+MONTH(RC[-6]) -> 8 | J452: =+RC[-6]-RC[-7] -> 4 | K452: =+IF(RC[-4]="OUT of TIME",RC[-1]-VLOOKUP(RC[-9],Enunciado!R3C6:R5C7,2,0),"") -> 
A453: Dept1-12293 | B453: Medio | C453: 41258 | D453: 41268 | E453: =+LEFT(RC[-4],5) -> Dept1 | F453: =+VLOOKUP(RC[-4],Enunciado!R3C6:R5C7,2,0)+RC[-3] -> 41273 | G453: =+IF(RC[-1]>=RC[-3],"ON TIME","OUT OF TIME") -> ON TIME | H453: =+YEAR(RC[-5]) -> 2012 | I453: =+MONTH(RC[-6]) -> 12 | J453: =+RC[-6]-RC[-7] -> 10 | K453: =+IF(RC[-4]="OUT of TIME",RC[-1]-VLOOKUP(RC[-9],Enunciado!R3C6:R5C7,2,0),"") -> 
A454: Dept2-14495 | B454: Bajo | C454: 40988 | D454: 40992 | E454: =+LEFT(RC[-4],5) -> Dept2 | F454: =+VLOOKUP(RC[-4],Enunciado!R3C6:R5C7,2,0)+RC[-3] -> 41018 | G454: =+IF(RC[-1]>=RC[-3],"ON TIME","OUT OF TIME") -> ON TIME | H454: =+YEAR(RC[-5]) -> 2012 | I454: =+MONTH(RC[-6]) -> 3 | J454: =+RC[-6]-RC[-7] -> 4 | K454: =+IF(RC[-4]="OUT of TIME",RC[-1]-VLOOKUP(RC[-9],Enunciado!R3C6:R5C7,2,0),"") -> 
A455: Dept1-27531 | B455: Alto | C455: 41594 | D455: 41597 | E455: =+LEFT(RC[-4],5) -> Dept1 | F455: =+VLOOKUP(RC[-4],Enunciado!R3C6:R5C7,2,0)+RC[-3] -> 41599 | G455: =+IF(RC[-1]>=RC[-3],"ON TIME","OUT OF TIME") -> ON TIME | H455: =+YEAR(RC[-5]) -> 2013 | I455: =+MONTH(RC[-6]) -> 11 | J455: =+RC[-6]-RC[-7] -> 3 | K455: =+IF(RC[-4]="OUT of TIME",RC[-1]-VLOOKUP(RC[-9],Enunciado!R3C6:R5C7,2,0),"") -> 
A456: Dept4-15667 | B456: Medio | C456: 41358 | D456: 41370 | E456: =+LEFT(RC[-4],5) -> Dept4 | F456: =+VLOOKUP(RC[-4],Enunciado!R3C6:R5C7,2,0)+RC[-3] -> 41373 | G456: =+IF(RC[-1]>=RC[-3],"ON TIME","OUT OF TIME") -> ON TIME | H456: =+YEAR(RC[-5]) -> 2013 | I456: =+MONTH(RC[-6]) -> 3 | J456: =+RC[-6]-RC[-7] -> 12 | K456: =+IF(RC[-4]="OUT of TIME",RC[-1]-VLOOKUP(RC[-9],Enunciado!R3C6:R5C7,2,0),"") -> 
A457: Dept1-16088 | B457: Alto | C457: 41475 | D457: 41498 | E457: =+LEFT(RC[-4],5) -> Dept1 | F457: =+VLOOKUP(RC[-4],Enunciado!R3C6:R5C7,2,0)+RC[-3] -> 41480 | G457: =+IF(RC[-1]>=RC[-3],"ON TIME","OUT OF TIME") -> OUT OF TIME | H457: =+YEAR(RC[-5]) -> 2013 | I457: =+MONTH(RC[-6]) -> 7 | J457: =+RC[-6]-RC[-7] -> 23 | K457: =+IF(RC[-4]="OUT of TIME",RC[-1]-VLOOKUP(RC[-9],Enunciado!R3C6:R5C7,2,0),"") -> 18
A458: Dept1-4371 | B458: Medio | C458: 41590 | D458: 41609 | E458: =+LEFT(RC[-4],5) -> Dept1 | F458: =+VLOOKUP(RC[-4],Enunciado!R3C6:R5C7,2,0)+RC[-3] -> 41605 | G458: =+IF(RC[-1]>=RC[-3],"ON TIME","OUT OF TIME") -> OUT OF TIME | H458: =+YEAR(RC[-5]) -> 2013 | I458: =+MONTH(RC[-6]) -> 11 | J458: =+RC[-6]-RC[-7] -> 19 | K458: =+IF(RC[-4]="OUT of TIME",RC[-1]-VLOOKUP(RC[-9],Enunciado!R3C6:R5C7,2,0),"") -> 4
A459: Dept3-20221 | B459: Medio | C459: 41427 | D459: 41430 | E459: =+LEFT(RC[-4],5) -> Dept3 | F459: =+VLOOKUP(RC[-4],Enunciado!R3C6:R5C7,2,0)+RC[-3] -> 41442 | G459: =+IF(RC[-1]>=RC[-3],"ON TIME","OUT OF TIME") -> ON TIME | H459: =+YEAR(RC[-5]) -> 2013 | I459: =+MONTH(RC[-6]) -> 6 | J459: =+RC[-6]-RC[-7] -> 3 | K459: =+IF(RC[-4]="OUT of TIME",RC[-1]-VLOOKUP(RC[-9],Enunciado!R3C6:R5C7,2,0),"") -> 
A460: Dept3-6358 | B460: Bajo | C460: 41638 | D460: 41647 | E460: =+LEFT(RC[-4],5) -> Dept3 | F460: =+VLOOKUP(RC[-4],Enunciado!R3C6:R5C7,2,0)+RC[-3] -> 41668 | G460: =+IF(RC[-1]>=RC[-3],"ON TIME","OUT OF TIME") -> ON TIME | H460: =+YEAR(RC[-5]) -> 2013 | I460: =+MONTH(RC[-6]) -> 12 | J460: =+RC[-6]-RC[-7] -> 9 | K460: =+IF(RC[-4]="OUT of TIME",RC[-1]-VLOOKUP(RC[-9],Enunciado!R3C6:R5C7,2,0),"") -> 
A461: Dept1-26585 | B461: Medio | C461: 41125 | D461: 41140 | E461: =+LEFT(RC[-4],5) -> Dept1 | F461: =+VLOOKUP(RC[-4],Enunciado!R3C6:R5C7,2,0)+RC[-3] -> 41140 | G461: =+IF(RC[-1]>=RC[-3],"ON TIME","OUT OF TIME") -> ON TIME | H461: =+YEAR(RC[-5]) -> 2012 | I461: =+MONTH(RC[-6]) -> 8 | J461: =+RC[-6]-RC[-7] -> 15 | K461: =+IF(RC[-4]="OUT of TIME",RC[-1]-VLOOKUP(RC[-9],Enunciado!R3C6:R5C7,2,0),"") -> 
A462: Dept2-659 | B462: Alto | C462: 41257 | D462: 41257 | E462: =+LEFT(RC[-4],5) -> Dept2 | F462: =+VLOOKUP(RC[-4],Enunciado!R3C6:R5C7,2,0)+RC[-3] -> 41262 | G462: =+IF(RC[-1]>=RC[-3],"ON TIME","OUT OF TIME") -> ON TIME | H462: =+YEAR(RC[-5]) -> 2012 | I462: =+MONTH(RC[-6]) -> 12 | J462: =+RC[-6]-RC[-7] -> 0 | K462: =+IF(RC[-4]="OUT of TIME",RC[-1]-VLOOKUP(RC[-9],Enunciado!R3C6:R5C7,2,0),"") -> 
A463: Dept6-7698 | B463: Bajo | C463: 41499 | D463: 41499 | E463: =+LEFT(RC[-4],5) -> Dept6 | F463: =+VLOOKUP(RC[-4],Enunciado!R3C6:R5C7,2,0)+RC[-3] -> 41529 | G463: =+IF(RC[-1]>=RC[-3],"ON TIME","OUT OF TIME") -> ON TIME | H463: =+YEAR(RC[-5]) -> 2013 | I463: =+MONTH(RC[-6]) -> 8 | J463: =+RC[-6]-RC[-7] -> 0 | K463: =+IF(RC[-4]="OUT of TIME",RC[-1]-VLOOKUP(RC[-9],Enunciado!R3C6:R5C7,2,0),"") -> 
A464: Dept2-20294 | B464: Medio | C464: 41029 | D464: 41048 | E464: =+LEFT(RC[-4],5) -> Dept2 | F464: =+VLOOKUP(RC[-4],Enunciado!R3C6:R5C7,2,0)+RC[-3] -> 41044 | G464: =+IF(RC[-1]>=RC[-3],"ON TIME","OUT OF TIME") -> OUT OF TIME | H464: =+YEAR(RC[-5]) -> 2012 | I464: =+MONTH(RC[-6]) -> 4 | J464: =+RC[-6]-RC[-7] -> 19 | K464: =+IF(RC[-4]="OUT of TIME",RC[-1]-VLOOKUP(RC[-9],Enunciado!R3C6:R5C7,2,0),"") -> 4
A465: Dept3-8532 | B465: Bajo | C465: 41411 | D465: 41412 | E465: =+LEFT(RC[-4],5) -> Dept3 | F465: =+VLOOKUP(RC[-4],Enunciado!R3C6:R5C7,2,0)+RC[-3] -> 41441 | G465: =+IF(RC[-1]>=RC[-3],"ON TIME","OUT OF TIME") -> ON TIME | H465: =+YEAR(RC[-5]) -> 2013 | I465: =+MONTH(RC[-6]) -> 5 | J465: =+RC[-6]-RC[-7] -> 1 | K465: =+IF(RC[-4]="OUT of TIME",RC[-1]-VLOOKUP(RC[-9],Enunciado!R3C6:R5C7,2,0),"") -> 
A466: Dept6-11692 | B466: Bajo | C466: 41480 | D466: 41504 | E466: =+LEFT(RC[-4],5) -> Dept6 | F466: =+VLOOKUP(RC[-4],Enunciado!R3C6:R5C7,2,0)+RC[-3] -> 41510 | G466: =+IF(RC[-1]>=RC[-3],"ON TIME","OUT OF TIME") -> ON TIME | H466: =+YEAR(RC[-5]) -> 2013 | I466: =+MONTH(RC[-6]) -> 7 | J466: =+RC[-6]-RC[-7] -> 24 | K466: =+IF(RC[-4]="OUT of TIME",RC[-1]-VLOOKUP(RC[-9],Enunciado!R3C6:R5C7,2,0),"") -> 
A467: Dept6-22279 | B467: Medio | C467: 41051 | D467: 41055 | E467: =+LEFT(RC[-4],5) -> Dept6 | F467: =+VLOOKUP(RC[-4],Enunciado!R3C6:R5C7,2,0)+RC[-3] -> 41066 | G467: =+IF(RC[-1]>=RC[-3],"ON TIME","OUT OF TIME") -> ON TIME | H467: =+YEAR(RC[-5]) -> 2012 | I467: =+MONTH(RC[-6]) -> 5 | J467: =+RC[-6]-RC[-7] -> 4 | K467: =+IF(RC[-4]="OUT of TIME",RC[-1]-VLOOKUP(RC[-9],Enunciado!R3C6:R5C7,2,0),"") -> 
A468: Dept1-18129 | B468: Bajo | C468: 41287 | D468: 41287 | E468: =+LEFT(RC[-4],5) -> Dept1 | F468: =+VLOOKUP(RC[-4],Enunciado!R3C6:R5C7,2,0)+RC[-3] -> 41317 | G468: =+IF(RC[-1]>=RC[-3],"ON TIME","OUT OF TIME") -> ON TIME | H468: =+YEAR(RC[-5]) -> 2013 | I468: =+MONTH(RC[-6]) -> 1 | J468: =+RC[-6]-RC[-7] -> 0 | K468: =+IF(RC[-4]="OUT of TIME",RC[-1]-VLOOKUP(RC[-9],Enunciado!R3C6:R5C7,2,0),"") -> 
A469: Dept1-6860 | B469: Bajo | C469: 41272 | D469: 41313 | E469: =+LEFT(RC[-4],5) -> Dept1 | F469: =+VLOOKUP(RC[-4],Enunciado!R3C6:R5C7,2,0)+RC[-3] -> 41302 | G469: =+IF(RC[-1]>=RC[-3],"ON TIME","OUT OF TIME") -> OUT OF TIME | H469: =+YEAR(RC[-5]) -> 2012 | I469: =+MONTH(RC[-6]) -> 12 | J469: =+RC[-6]-RC[-7] -> 41 | K469: =+IF(RC[-4]="OUT of TIME",RC[-1]-VLOOKUP(RC[-9],Enunciado!R3C6:R5C7,2,0),"") -> 11
A470: Dept4-12 | B470: Medio | C470: 40955 | D470: 41004 | E470: =+LEFT(RC[-4],5) -> Dept4 | F470: =+VLOOKUP(RC[-4],Enunciado!R3C6:R5C7,2,0)+RC[-3] -> 40970 | G470: =+IF(RC[-1]>=RC[-3],"ON TIME","OUT OF TIME") -> OUT OF TIME | H470: =+YEAR(RC[-5]) -> 2012 | I470: =+MONTH(RC[-6]) -> 2 | J470: =+RC[-6]-RC[-7] -> 49 | K470: =+IF(RC[-4]="OUT of TIME",RC[-1]-VLOOKUP(RC[-9],Enunciado!R3C6:R5C7,2,0),"") -> 34
A471: Dept4-11237 | B471: Alto | C471: 41465 | D471: 41468 | E471: =+LEFT(RC[-4],5) -> Dept4 | F471: =+VLOOKUP(RC[-4],Enunciado!R3C6:R5C7,2,0)+RC[-3] -> 41470 | G471: =+IF(RC[-1]>=RC[-3],"ON TIME","OUT OF TIME") -> ON TIME | H471: =+YEAR(RC[-5]) -> 2013 | I471: =+MONTH(RC[-6]) -> 7 | J471: =+RC[-6]-RC[-7] -> 3 | K471: =+IF(RC[-4]="OUT of TIME",RC[-1]-VLOOKUP(RC[-9],Enunciado!R3C6:R5C7,2,0),"") -> 
A472: Dept2-22302 | B472: Bajo | C472: 41610 | D472: 41629 | E472: =+LEFT(RC[-4],5) -> Dept2 | F472: =+VLOOKUP(RC[-4],Enunciado!R3C6:R5C7,2,0)+RC[-3] -> 41640 | G472: =+IF(RC[-1]>=RC[-3],"ON TIME","OUT OF TIME") -> ON TIME | H472: =+YEAR(RC[-5]) -> 2013 | I472: =+MONTH(RC[-6]) -> 12 | J472: =+RC[-6]-RC[-7] -> 19 | K472: =+IF(RC[-4]="OUT of TIME",RC[-1]-VLOOKUP(RC[-9],Enunciado!R3C6:R5C7,2,0),"") -> 
A473: Dept4-28094 | B473: Medio | C473: 41131 | D473: 41132 | E473: =+LEFT(RC[-4],5) -> Dept4 | F473: =+VLOOKUP(RC[-4],Enunciado!R3C6:R5C7,2,0)+RC[-3] -> 41146 | G473: =+IF(RC[-1]>=RC[-3],"ON TIME","OUT OF TIME") -> ON TIME | H473: =+YEAR(RC[-5]) -> 2012 | I473: =+MONTH(RC[-6]) -> 8 | J473: =+RC[-6]-RC[-7] -> 1 | K473: =+IF(RC[-4]="OUT of TIME",RC[-1]-VLOOKUP(RC[-9],Enunciado!R3C6:R5C7,2,0),"") -> 
A474: Dept2-16902 | B474: Medio | C474: 41249 | D474: 41257 | E474: =+LEFT(RC[-4],5) -> Dept2 | F474: =+VLOOKUP(RC[-4],Enunciado!R3C6:R5C7,2,0)+RC[-3] -> 41264 | G474: =+IF(RC[-1]>=RC[-3],"ON TIME","OUT OF TIME") -> ON TIME | H474: =+YEAR(RC[-5]) -> 2012 | I474: =+MONTH(RC[-6]) -> 12 | J474: =+RC[-6]-RC[-7] -> 8 | K474: =+IF(RC[-4]="OUT of TIME",RC[-1]-VLOOKUP(RC[-9],Enunciado!R3C6:R5C7,2,0),"") -> 
A475: Dept6-6949 | B475: Alto | C475: 41593 | D475: 41596 | E475: =+LEFT(RC[-4],5) -> Dept6 | F475: =+VLOOKUP(RC[-4],Enunciado!R3C6:R5C7,2,0)+RC[-3] -> 41598 | G475: =+IF(RC[-1]>=RC[-3],"ON TIME","OUT OF TIME") -> ON TIME | H475: =+YEAR(RC[-5]) -> 2013 | I475: =+MONTH(RC[-6]) -> 11 | J475: =+RC[-6]-RC[-7] -> 3 | K475: =+IF(RC[-4]="OUT of TIME",RC[-1]-VLOOKUP(RC[-9],Enunciado!R3C6:R5C7,2,0),"") -> 
A476: Dept1-15321 | B476: Bajo | C476: 40918 | D476: 40928 | E476: =+LEFT(RC[-4],5) -> Dept1 | F476: =+VLOOKUP(RC[-4],Enunciado!R3C6:R5C7,2,0)+RC[-3] -> 40948 | G476: =+IF(RC[-1]>=RC[-3],"ON TIME","OUT OF TIME") -> ON TIME | H476: =+YEAR(RC[-5]) -> 2012 | I476: =+MONTH(RC[-6]) -> 1 | J476: =+RC[-6]-RC[-7] -> 10 | K476: =+IF(RC[-4]="OUT of TIME",RC[-1]-VLOOKUP(RC[-9],Enunciado!R3C6:R5C7,2,0),"") -> 
A477: Dept5-19256 | B477: Bajo | C477: 41288 | D477: 41315 | E477: =+LEFT(RC[-4],5) -> Dept5 | F477: =+VLOOKUP(RC[-4],Enunciado!R3C6:R5C7,2,0)+RC[-3] -> 41318 | G477: =+IF(RC[-1]>=RC[-3],"ON TIME","OUT OF TIME") -> ON TIME | H477: =+YEAR(RC[-5]) -> 2013 | I477: =+MONTH(RC[-6]) -> 1 | J477: =+RC[-6]-RC[-7] -> 27 | K477: =+IF(RC[-4]="OUT of TIME",RC[-1]-VLOOKUP(RC[-9],Enunciado!R3C6:R5C7,2,0),"") -> 
A478: Dept3-14416 | B478: Alto | C478: 41614 | D478: 41652 | E478: =+LEFT(RC[-4],5) -> Dept3 | F478: =+VLOOKUP(RC[-4],Enunciado!R3C6:R5C7,2,0)+RC[-3] -> 41619 | G478: =+IF(RC[-1]>=RC[-3],"ON TIME","OUT OF TIME") -> OUT OF TIME | H478: =+YEAR(RC[-5]) -> 2013 | I478: =+MONTH(RC[-6]) -> 12 | J478: =+RC[-6]-RC[-7] -> 38 | K478: =+IF(RC[-4]="OUT of TIME",RC[-1]-VLOOKUP(RC[-9],Enunciado!R3C6:R5C7,2,0),"") -> 33
A479: Dept2-4559 | B479: Medio | C479: 41301 | D479: 41316 | E479: =+LEFT(RC[-4],5) -> Dept2 | F479: =+VLOOKUP(RC[-4],Enunciado!R3C6:R5C7,2,0)+RC[-3] -> 41316 | G479: =+IF(RC[-1]>=RC[-3],"ON TIME","OUT OF TIME") -> ON TIME | H479: =+YEAR(RC[-5]) -> 2013 | I479: =+MONTH(RC[-6]) -> 1 | J479: =+RC[-6]-RC[-7] -> 15 | K479: =+IF(RC[-4]="OUT of TIME",RC[-1]-VLOOKUP(RC[-9],Enunciado!R3C6:R5C7,2,0),"") -> 
A480: Dept1-25542 | B480: Medio | C480: 41435 | D480: 41443 | E480: =+LEFT(RC[-4],5) -> Dept1 | F480: =+VLOOKUP(RC[-4],Enunciado!R3C6:R5C7,2,0)+RC[-3] -> 41450 | G480: =+IF(RC[-1]>=RC[-3],"ON TIME","OUT OF TIME") -> ON TIME | H480: =+YEAR(RC[-5]) -> 2013 | I480: =+MONTH(RC[-6]) -> 6 | J480: =+RC[-6]-RC[-7] -> 8 | K480: =+IF(RC[-4]="OUT of TIME",RC[-1]-VLOOKUP(RC[-9],Enunciado!R3C6:R5C7,2,0),"") -> 
A481: Dept2-4271 | B481: Medio | C481: 41565 | D481: 41565 | E481: =+LEFT(RC[-4],5) -> Dept2 | F481: =+VLOOKUP(RC[-4],Enunciado!R3C6:R5C7,2,0)+RC[-3] -> 41580 | G481: =+IF(RC[-1]>=RC[-3],"ON TIME","OUT OF TIME") -> ON TIME | H481: =+YEAR(RC[-5]) -> 2013 | I481: =+MONTH(RC[-6]) -> 10 | J481: =+RC[-6]-RC[-7] -> 0 | K481: =+IF(RC[-4]="OUT of TIME",RC[-1]-VLOOKUP(RC[-9],Enunciado!R3C6:R5C7,2,0),"") -> 
A482: Dept6-24909 | B482: Bajo | C482: 41232 | D482: 41240 | E482: =+LEFT(RC[-4],5) -> Dept6 | F482: =+VLOOKUP(RC[-4],Enunciado!R3C6:R5C7,2,0)+RC[-3] -> 41262 | G482: =+IF(RC[-1]>=RC[-3],"ON TIME","OUT OF TIME") -> ON TIME | H482: =+YEAR(RC[-5]) -> 2012 | I482: =+MONTH(RC[-6]) -> 11 | J482: =+RC[-6]-RC[-7] -> 8 | K482: =+IF(RC[-4]="OUT of TIME",RC[-1]-VLOOKUP(RC[-9],Enunciado!R3C6:R5C7,2,0),"") -> 
A483: Dept5-27128 | B483: Alto | C483: 41494 | D483: 41506 | E483: =+LEFT(RC[-4],5) -> Dept5 | F483: =+VLOOKUP(RC[-4],Enunciado!R3C6:R5C7,2,0)+RC[-3] -> 41499 | G483: =+IF(RC[-1]>=RC[-3],"ON TIME","OUT OF TIME") -> OUT OF TIME | H483: =+YEAR(RC[-5]) -> 2013 | I483: =+MONTH(RC[-6]) -> 8 | J483: =+RC[-6]-RC[-7] -> 12 | K483: =+IF(RC[-4]="OUT of TIME",RC[-1]-VLOOKUP(RC[-9],Enunciado!R3C6:R5C7,2,0),"") -> 7
A484: Dept3-10456 | B484: Alto | C484: 41106 | D484: 41108 | E484: =+LEFT(RC[-4],5) -> Dept3 | F484: =+VLOOKUP(RC[-4],Enunciado!R3C6:R5C7,2,0)+RC[-3] -> 41111 | G484: =+IF(RC[-1]>=RC[-3],"ON TIME","OUT OF TIME") -> ON TIME | H484: =+YEAR(RC[-5]) -> 2012 | I484: =+MONTH(RC[-6]) -> 7 | J484: =+RC[-6]-RC[-7] -> 2 | K484: =+IF(RC[-4]="OUT of TIME",RC[-1]-VLOOKUP(RC[-9],Enunciado!R3C6:R5C7,2,0),"") -> 
A485: Dept5-17879 | B485: Alto | C485: 41394 | D485: 41398 | E485: =+LEFT(RC[-4],5) -> Dept5 | F485: =+VLOOKUP(RC[-4],Enunciado!R3C6:R5C7,2,0)+RC[-3] -> 41399 | G485: =+IF(RC[-1]>=RC[-3],"ON TIME","OUT OF TIME") -> ON TIME | H485: =+YEAR(RC[-5]) -> 2013 | I485: =+MONTH(RC[-6]) -> 4 | J485: =+RC[-6]-RC[-7] -> 4 | K485: =+IF(RC[-4]="OUT of TIME",RC[-1]-VLOOKUP(RC[-9],Enunciado!R3C6:R5C7,2,0),"") -> 
A486: Dept4-18073 | B486: Medio | C486: 41556 | D486: 41556 | E486: =+LEFT(RC[-4],5) -> Dept4 | F486: =+VLOOKUP(RC[-4],Enunciado!R3C6:R5C7,2,0)+RC[-3] -> 41571 | G486: =+IF(RC[-1]>=RC[-3],"ON TIME","OUT OF TIME") -> ON TIME | H486: =+YEAR(RC[-5]) -> 2013 | I486: =+MONTH(RC[-6]) -> 10 | J486: =+RC[-6]-RC[-7] -> 0 | K486: =+IF(RC[-4]="OUT of TIME",RC[-1]-VLOOKUP(RC[-9],Enunciado!R3C6:R5C7,2,0),"") -> 
A487: Dept2-18294 | B487: Alto | C487: 41412 | D487: 41447 | E487: =+LEFT(RC[-4],5) -> Dept2 | F487: =+VLOOKUP(RC[-4],Enunciado!R3C6:R5C7,2,0)+RC[-3] -> 41417 | G487: =+IF(RC[-1]>=RC[-3],"ON TIME","OUT OF TIME") -> OUT OF TIME | H487: =+YEAR(RC[-5]) -> 2013 | I487: =+MONTH(RC[-6]) -> 5 | J487: =+RC[-6]-RC[-7] -> 35 | K487: =+IF(RC[-4]="OUT of TIME",RC[-1]-VLOOKUP(RC[-9],Enunciado!R3C6:R5C7,2,0),"") -> 30
A488: Dept2-17462 | B488: Medio | C488: 41232 | D488: 41235 | E488: =+LEFT(RC[-4],5) -> Dept2 | F488: =+VLOOKUP(RC[-4],Enunciado!R3C6:R5C7,2,0)+RC[-3] -> 41247 | G488: =+IF(RC[-1]>=RC[-3],"ON TIME","OUT OF TIME") -> ON TIME | H488: =+YEAR(RC[-5]) -> 2012 | I488: =+MONTH(RC[-6]) -> 11 | J488: =+RC[-6]-RC[-7] -> 3 | K488: =+IF(RC[-4]="OUT of TIME",RC[-1]-VLOOKUP(RC[-9],Enunciado!R3C6:R5C7,2,0),"") -> 
A489: Dept3-17030 | B489: Alto | C489: 41625 | D489: 41674 | E489: =+LEFT(RC[-4],5) -> Dept3 | F489: =+VLOOKUP(RC[-4],Enunciado!R3C6:R5C7,2,0)+RC[-3] -> 41630 | G489: =+IF(RC[-1]>=RC[-3],"ON TIME","OUT OF TIME") -> OUT OF TIME | H489: =+YEAR(RC[-5]) -> 2013 | I489: =+MONTH(RC[-6]) -> 12 | J489: =+RC[-6]-RC[-7] -> 49 | K489: =+IF(RC[-4]="OUT of TIME",RC[-1]-VLOOKUP(RC[-9],Enunciado!R3C6:R5C7,2,0),"") -> 44
A490: Dept6-5463 | B490: Alto | C490: 41584 | D490: 41586 | E490: =+LEFT(RC[-4],5) -> Dept6 | F490: =+VLOOKUP(RC[-4],Enunciado!R3C6:R5C7,2,0)+RC[-3] -> 41589 | G490: =+IF(RC[-1]>=RC[-3],"ON TIME","OUT OF TIME") -> ON TIME | H490: =+YEAR(RC[-5]) -> 2013 | I490: =+MONTH(RC[-6]) -> 11 | J490: =+RC[-6]-RC[-7] -> 2 | K490: =+IF(RC[-4]="OUT of TIME",RC[-1]-VLOOKUP(RC[-9],Enunciado!R3C6:R5C7,2,0),"") -> 
A491: Dept3-12429 | B491: Bajo | C491: 40914 | D491: 40960 | E491: =+LEFT(RC[-4],5) -> Dept3 | F491: =+VLOOKUP(RC[-4],Enunciado!R3C6:R5C7,2,0)+RC[-3] -> 40944 | G491: =+IF(RC[-1]>=RC[-3],"ON TIME","OUT OF TIME") -> OUT OF TIME | H491: =+YEAR(RC[-5]) -> 2012 | I491: =+MONTH(RC[-6]) -> 1 | J491: =+RC[-6]-RC[-7] -> 46 | K491: =+IF(RC[-4]="OUT of TIME",RC[-1]-VLOOKUP(RC[-9],Enunciado!R3C6:R5C7,2,0),"") -> 16
A492: Dept1-22154 | B492: Bajo | C492: 40925 | D492: 40942 | E492: =+LEFT(RC[-4],5) -> Dept1 | F492: =+VLOOKUP(RC[-4],Enunciado!R3C6:R5C7,2,0)+RC[-3] -> 40955 | G492: =+IF(RC[-1]>=RC[-3],"ON TIME","OUT OF TIME") -> ON TIME | H492: =+YEAR(RC[-5]) -> 2012 | I492: =+MONTH(RC[-6]) -> 1 | J492: =+RC[-6]-RC[-7] -> 17 | K492: =+IF(RC[-4]="OUT of TIME",RC[-1]-VLOOKUP(RC[-9],Enunciado!R3C6:R5C7,2,0),"") -> 
A493: Dept2-9804 | B493: Medio | C493: 41628 | D493: 41636 | E493: =+LEFT(RC[-4],5) -> Dept2 | F493: =+VLOOKUP(RC[-4],Enunciado!R3C6:R5C7,2,0)+RC[-3] -> 41643 | G493: =+IF(RC[-1]>=RC[-3],"ON TIME","OUT OF TIME") -> ON TIME | H493: =+YEAR(RC[-5]) -> 2013 | I493: =+MONTH(RC[-6]) -> 12 | J493: =+RC[-6]-RC[-7] -> 8 | K493: =+IF(RC[-4]="OUT of TIME",RC[-1]-VLOOKUP(RC[-9],Enunciado!R3C6:R5C7,2,0),"") -> 
A494: Dept6-2532 | B494: Bajo | C494: 41297 | D494: 41333 | E494: =+LEFT(RC[-4],5) -> Dept6 | F494: =+VLOOKUP(RC[-4],Enunciado!R3C6:R5C7,2,0)+RC[-3] -> 41327 | G494: =+IF(RC[-1]>=RC[-3],"ON TIME","OUT OF TIME") -> OUT OF TIME | H494: =+YEAR(RC[-5]) -> 2013 | I494: =+MONTH(RC[-6]) -> 1 | J494: =+RC[-6]-RC[-7] -> 36 | K494: =+IF(RC[-4]="OUT of TIME",RC[-1]-VLOOKUP(RC[-9],Enunciado!R3C6:R5C7,2,0),"") -> 6
A495: Dept6-12291 | B495: Alto | C495: 41126 | D495: 41133 | E495: =+LEFT(RC[-4],5) -> Dept6 | F495: =+VLOOKUP(RC[-4],Enunciado!R3C6:R5C7,2,0)+RC[-3] -> 41131 | G495: =+IF(RC[-1]>=RC[-3],"ON TIME","OUT OF TIME") -> OUT OF TIME | H495: =+YEAR(RC[-5]) -> 2012 | I495: =+MONTH(RC[-6]) -> 8 | J495: =+RC[-6]-RC[-7] -> 7 | K495: =+IF(RC[-4]="OUT of TIME",RC[-1]-VLOOKUP(RC[-9],Enunciado!R3C6:R5C7,2,0),"") -> 2
A496: Dept6-14101 | B496: Medio | C496: 41137 | D496: 41170 | E496: =+LEFT(RC[-4],5) -> Dept6 | F496: =+VLOOKUP(RC[-4],Enunciado!R3C6:R5C7,2,0)+RC[-3] -> 41152 | G496: =+IF(RC[-1]>=RC[-3],"ON TIME","OUT OF TIME") -> OUT OF TIME | H496: =+YEAR(RC[-5]) -> 2012 | I496: =+MONTH(RC[-6]) -> 8 | J496: =+RC[-6]-RC[-7] -> 33 | K496: =+IF(RC[-4]="OUT of TIME",RC[-1]-VLOOKUP(RC[-9],Enunciado!R3C6:R5C7,2,0),"") -> 18
A497: Dept5-11805 | B497: Bajo | C497: 41571 | D497: 41612 | E497: =+LEFT(RC[-4],5) -> Dept5 | F497: =+VLOOKUP(RC[-4],Enunciado!R3C6:R5C7,2,0)+RC[-3] -> 41601 | G497: =+IF(RC[-1]>=RC[-3],"ON TIME","OUT OF TIME") -> OUT OF TIME | H497: =+YEAR(RC[-5]) -> 2013 | I497: =+MONTH(RC[-6]) -> 10 | J497: =+RC[-6]-RC[-7] -> 41 | K497: =+IF(RC[-4]="OUT of TIME",RC[-1]-VLOOKUP(RC[-9],Enunciado!R3C6:R5C7,2,0),"") -> 11
A498: Dept2-28160 | B498: Alto | C498: 40956 | D498: 40994 | E498: =+LEFT(RC[-4],5) -> Dept2 | F498: =+VLOOKUP(RC[-4],Enunciado!R3C6:R5C7,2,0)+RC[-3] -> 40961 | G498: =+IF(RC[-1]>=RC[-3],"ON TIME","OUT OF TIME") -> OUT OF TIME | H498: =+YEAR(RC[-5]) -> 2012 | I498: =+MONTH(RC[-6]) -> 2 | J498: =+RC[-6]-RC[-7] -> 38 | K498: =+IF(RC[-4]="OUT of TIME",RC[-1]-VLOOKUP(RC[-9],Enunciado!R3C6:R5C7,2,0),"") -> 33
A499: Dept5-24185 | B499: Bajo | C499: 40976 | D499: 40990 | E499: =+LEFT(RC[-4],5) -> Dept5 | F499: =+VLOOKUP(RC[-4],Enunciado!R3C6:R5C7,2,0)+RC[-3] -> 41006 | G499: =+IF(RC[-1]>=RC[-3],"ON TIME","OUT OF TIME") -> ON TIME | H499: =+YEAR(RC[-5]) -> 2012 | I499: =+MONTH(RC[-6]) -> 3 | J499: =+RC[-6]-RC[-7] -> 14 | K499: =+IF(RC[-4]="OUT of TIME",RC[-1]-VLOOKUP(RC[-9],Enunciado!R3C6:R5C7,2,0),"") -> 
A500: Dept3-126 | B500: Alto | C500: 41272 | D500: 41275 | E500: =+LEFT(RC[-4],5) -> Dept3 | F500: =+VLOOKUP(RC[-4],Enunciado!R3C6:R5C7,2,0)+RC[-3] -> 41277 | G500: =+IF(RC[-1]>=RC[-3],"ON TIME","OUT OF TIME") -> ON TIME | H500: =+YEAR(RC[-5]) -> 2012 | I500: =+MONTH(RC[-6]) -> 12 | J500: =+RC[-6]-RC[-7] -> 3 | K500: =+IF(RC[-4]="OUT of TIME",RC[-1]-VLOOKUP(RC[-9],Enunciado!R3C6:R5C7,2,0),"") -> 
A501: Dept2-10076 | B501: Alto | C501: 41577 | D501: 41579 | E501: =+LEFT(RC[-4],5) -> Dept2 | F501: =+VLOOKUP(RC[-4],Enunciado!R3C6:R5C7,2,0)+RC[-3] -> 41582 | G501: =+IF(RC[-1]>=RC[-3],"ON TIME","OUT OF TIME") -> ON TIME | H501: =+YEAR(RC[-5]) -> 2013 | I501: =+MONTH(RC[-6]) -> 10 | J501: =+RC[-6]-RC[-7] -> 2 | K501: =+IF(RC[-4]="OUT of TIME",RC[-1]-VLOOKUP(RC[-9],Enunciado!R3C6:R5C7,2,0),"") -> 
A502: Dept6-21685 | B502: Alto | C502: 41026 | D502: 41069 | E502: =+LEFT(RC[-4],5) -> Dept6 | F502: =+VLOOKUP(RC[-4],Enunciado!R3C6:R5C7,2,0)+RC[-3] -> 41031 | G502: =+IF(RC[-1]>=RC[-3],"ON TIME","OUT OF TIME") -> OUT OF TIME | H502: =+YEAR(RC[-5]) -> 2012 | I502: =+MONTH(RC[-6]) -> 4 | J502: =+RC[-6]-RC[-7] -> 43 | K502: =+IF(RC[-4]="OUT of TIME",RC[-1]-VLOOKUP(RC[-9],Enunciado!R3C6:R5C7,2,0),"") -> 38
A503: Dept1-10617 | B503: Medio | C503: 41376 | D503: 41395 | E503: =+LEFT(RC[-4],5) -> Dept1 | F503: =+VLOOKUP(RC[-4],Enunciado!R3C6:R5C7,2,0)+RC[-3] -> 41391 | G503: =+IF(RC[-1]>=RC[-3],"ON TIME","OUT OF TIME") -> OUT OF TIME | H503: =+YEAR(RC[-5]) -> 2013 | I503: =+MONTH(RC[-6]) -> 4 | J503: =+RC[-6]-RC[-7] -> 19 | K503: =+IF(RC[-4]="OUT of TIME",RC[-1]-VLOOKUP(RC[-9],Enunciado!R3C6:R5C7,2,0),"") -> 4
A504: Dept6-15092 | B504: Alto | C504: 41600 | D504: 41619 | E504: =+LEFT(RC[-4],5) -> Dept6 | F504: =+VLOOKUP(RC[-4],Enunciado!R3C6:R5C7,2,0)+RC[-3] -> 41605 | G504: =+IF(RC[-1]>=RC[-3],"ON TIME","OUT OF TIME") -> OUT OF TIME | H504: =+YEAR(RC[-5]) -> 2013 | I504: =+MONTH(RC[-6]) -> 11 | J504: =+RC[-6]-RC[-7] -> 19 | K504: =+IF(RC[-4]="OUT of TIME",RC[-1]-VLOOKUP(RC[-9],Enunciado!R3C6:R5C7,2,0),"") -> 14
A505: Dept4-24499 | B505: Alto | C505: 40947 | D505: 40962 | E505: =+LEFT(RC[-4],5) -> Dept4 | F505: =+VLOOKUP(RC[-4],Enunciado!R3C6:R5C7,2,0)+RC[-3] -> 40952 | G505: =+IF(RC[-1]>=RC[-3],"ON TIME","OUT OF TIME") -> OUT OF TIME | H505: =+YEAR(RC[-5]) -> 2012 | I505: =+MONTH(RC[-6]) -> 2 | J505: =+RC[-6]-RC[-7] -> 15 | K505: =+IF(RC[-4]="OUT of TIME",RC[-1]-VLOOKUP(RC[-9],Enunciado!R3C6:R5C7,2,0),"") -> 10
A506: Dept4-7437 | B506: Medio | C506: 41044 | D506: 41044 | E506: =+LEFT(RC[-4],5) -> Dept4 | F506: =+VLOOKUP(RC[-4],Enunciado!R3C6:R5C7,2,0)+RC[-3] -> 41059 | G506: =+IF(RC[-1]>=RC[-3],"ON TIME","OUT OF TIME") -> ON TIME | H506: =+YEAR(RC[-5]) -> 2012 | I506: =+MONTH(RC[-6]) -> 5 | J506: =+RC[-6]-RC[-7] -> 0 | K506: =+IF(RC[-4]="OUT of TIME",RC[-1]-VLOOKUP(RC[-9],Enunciado!R3C6:R5C7,2,0),"") -> 
A507: Dept1-449 | B507: Medio | C507: 41088 | D507: 41116 | E507: =+LEFT(RC[-4],5) -> Dept1 | F507: =+VLOOKUP(RC[-4],Enunciado!R3C6:R5C7,2,0)+RC[-3] -> 41103 | G507: =+IF(RC[-1]>=RC[-3],"ON TIME","OUT OF TIME") -> OUT OF TIME | H507: =+YEAR(RC[-5]) -> 2012 | I507: =+MONTH(RC[-6]) -> 6 | J507: =+RC[-6]-RC[-7] -> 28 | K507: =+IF(RC[-4]="OUT of TIME",RC[-1]-VLOOKUP(RC[-9],Enunciado!R3C6:R5C7,2,0),"") -> 13
A508: Dept5-20178 | B508: Alto | C508: 41503 | D508: 41543 | E508: =+LEFT(RC[-4],5) -> Dept5 | F508: =+VLOOKUP(RC[-4],Enunciado!R3C6:R5C7,2,0)+RC[-3] -> 41508 | G508: =+IF(RC[-1]>=RC[-3],"ON TIME","OUT OF TIME") -> OUT OF TIME | H508: =+YEAR(RC[-5]) -> 2013 | I508: =+MONTH(RC[-6]) -> 8 | J508: =+RC[-6]-RC[-7] -> 40 | K508: =+IF(RC[-4]="OUT of TIME",RC[-1]-VLOOKUP(RC[-9],Enunciado!R3C6:R5C7,2,0),"") -> 35
A509: Dept6-26707 | B509: Alto | C509: 41247 | D509: 41293 | E509: =+LEFT(RC[-4],5) -> Dept6 | F509: =+VLOOKUP(RC[-4],Enunciado!R3C6:R5C7,2,0)+RC[-3] -> 41252 | G509: =+IF(RC[-1]>=RC[-3],"ON TIME","OUT OF TIME") -> OUT OF TIME | H509: =+YEAR(RC[-5]) -> 2012 | I509: =+MONTH(RC[-6]) -> 12 | J509: =+RC[-6]-RC[-7] -> 46 | K509: =+IF(RC[-4]="OUT of TIME",RC[-1]-VLOOKUP(RC[-9],Enunciado!R3C6:R5C7,2,0),"") -> 41
A510: Dept4-26767 | B510: Alto | C510: 41345 | D510: 41349 | E510: =+LEFT(RC[-4],5) -> Dept4 | F510: =+VLOOKUP(RC[-4],Enunciado!R3C6:R5C7,2,0)+RC[-3] -> 41350 | G510: =+IF(RC[-1]>=RC[-3],"ON TIME","OUT OF TIME") -> ON TIME | H510: =+YEAR(RC[-5]) -> 2013 | I510: =+MONTH(RC[-6]) -> 3 | J510: =+RC[-6]-RC[-7] -> 4 | K510: =+IF(RC[-4]="OUT of TIME",RC[-1]-VLOOKUP(RC[-9],Enunciado!R3C6:R5C7,2,0),"") -> 
A511: Dept4-26558 | B511: Medio | C511: 41432 | D511: 41433 | E511: =+LEFT(RC[-4],5) -> Dept4 | F511: =+VLOOKUP(RC[-4],Enunciado!R3C6:R5C7,2,0)+RC[-3] -> 41447 | G511: =+IF(RC[-1]>=RC[-3],"ON TIME","OUT OF TIME") -> ON TIME | H511: =+YEAR(RC[-5]) -> 2013 | I511: =+MONTH(RC[-6]) -> 6 | J511: =+RC[-6]-RC[-7] -> 1 | K511: =+IF(RC[-4]="OUT of TIME",RC[-1]-VLOOKUP(RC[-9],Enunciado!R3C6:R5C7,2,0),"") -> 
A512: Dept3-18664 | B512: Bajo | C512: 41478 | D512: 41482 | E512: =+LEFT(RC[-4],5) -> Dept3 | F512: =+VLOOKUP(RC[-4],Enunciado!R3C6:R5C7,2,0)+RC[-3] -> 41508 | G512: =+IF(RC[-1]>=RC[-3],"ON TIME","OUT OF TIME") -> ON TIME | H512: =+YEAR(RC[-5]) -> 2013 | I512: =+MONTH(RC[-6]) -> 7 | J512: =+RC[-6]-RC[-7] -> 4 | K512: =+IF(RC[-4]="OUT of TIME",RC[-1]-VLOOKUP(RC[-9],Enunciado!R3C6:R5C7,2,0),"") -> 
A513: Dept5-16484 | B513: Alto | C513: 41478 | D513: 41491 | E513: =+LEFT(RC[-4],5) -> Dept5 | F513: =+VLOOKUP(RC[-4],Enunciado!R3C6:R5C7,2,0)+RC[-3] -> 41483 | G513: =+IF(RC[-1]>=RC[-3],"ON TIME","OUT OF TIME") -> OUT OF TIME | H513: =+YEAR(RC[-5]) -> 2013 | I513: =+MONTH(RC[-6]) -> 7 | J513: =+RC[-6]-RC[-7] -> 13 | K513: =+IF(RC[-4]="OUT of TIME",RC[-1]-VLOOKUP(RC[-9],Enunciado!R3C6:R5C7,2,0),"") -> 8
A514: Dept2-17577 | B514: Medio | C514: 41196 | D514: 41202 | E514: =+LEFT(RC[-4],5) -> Dept2 | F514: =+VLOOKUP(RC[-4],Enunciado!R3C6:R5C7,2,0)+RC[-3] -> 41211 | G514: =+IF(RC[-1]>=RC[-3],"ON TIME","OUT OF TIME") -> ON TIME | H514: =+YEAR(RC[-5]) -> 2012 | I514: =+MONTH(RC[-6]) -> 10 | J514: =+RC[-6]-RC[-7] -> 6 | K514: =+IF(RC[-4]="OUT of TIME",RC[-1]-VLOOKUP(RC[-9],Enunciado!R3C6:R5C7,2,0),"") -> 
A515: Dept1-10991 | B515: Medio | C515: 41104 | D515: 41105 | E515: =+LEFT(RC[-4],5) -> Dept1 | F515: =+VLOOKUP(RC[-4],Enunciado!R3C6:R5C7,2,0)+RC[-3] -> 41119 | G515: =+IF(RC[-1]>=RC[-3],"ON TIME","OUT OF TIME") -> ON TIME | H515: =+YEAR(RC[-5]) -> 2012 | I515: =+MONTH(RC[-6]) -> 7 | J515: =+RC[-6]-RC[-7] -> 1 | K515: =+IF(RC[-4]="OUT of TIME",RC[-1]-VLOOKUP(RC[-9],Enunciado!R3C6:R5C7,2,0),"") -> 
A516: Dept6-29210 | B516: Bajo | C516: 41582 | D516: 41585 | E516: =+LEFT(RC[-4],5) -> Dept6 | F516: =+VLOOKUP(RC[-4],Enunciado!R3C6:R5C7,2,0)+RC[-3] -> 41612 | G516: =+IF(RC[-1]>=RC[-3],"ON TIME","OUT OF TIME") -> ON TIME | H516: =+YEAR(RC[-5]) -> 2013 | I516: =+MONTH(RC[-6]) -> 11 | J516: =+RC[-6]-RC[-7] -> 3 | K516: =+IF(RC[-4]="OUT of TIME",RC[-1]-VLOOKUP(RC[-9],Enunciado!R3C6:R5C7,2,0),"") -> 
A517: Dept6-15678 | B517: Bajo | C517: 41048 | D517: 41065 | E517: =+LEFT(RC[-4],5) -> Dept6 | F517: =+VLOOKUP(RC[-4],Enunciado!R3C6:R5C7,2,0)+RC[-3] -> 41078 | G517: =+IF(RC[-1]>=RC[-3],"ON TIME","OUT OF TIME") -> ON TIME | H517: =+YEAR(RC[-5]) -> 2012 | I517: =+MONTH(RC[-6]) -> 5 | J517: =+RC[-6]-RC[-7] -> 17 | K517: =+IF(RC[-4]="OUT of TIME",RC[-1]-VLOOKUP(RC[-9],Enunciado!R3C6:R5C7,2,0),"") -> 
A518: Dept1-1356 | B518: Bajo | C518: 41012 | D518: 41013 | E518: =+LEFT(RC[-4],5) -> Dept1 | F518: =+VLOOKUP(RC[-4],Enunciado!R3C6:R5C7,2,0)+RC[-3] -> 41042 | G518: =+IF(RC[-1]>=RC[-3],"ON TIME","OUT OF TIME") -> ON TIME | H518: =+YEAR(RC[-5]) -> 2012 | I518: =+MONTH(RC[-6]) -> 4 | J518: =+RC[-6]-RC[-7] -> 1 | K518: =+IF(RC[-4]="OUT of TIME",RC[-1]-VLOOKUP(RC[-9],Enunciado!R3C6:R5C7,2,0),"") -> 
A519: Dept4-17619 | B519: Medio | C519: 41265 | D519: 41274 | E519: =+LEFT(RC[-4],5) -> Dept4 | F519: =+VLOOKUP(RC[-4],Enunciado!R3C6:R5C7,2,0)+RC[-3] -> 41280 | G519: =+IF(RC[-1]>=RC[-3],"ON TIME","OUT OF TIME") -> ON TIME | H519: =+YEAR(RC[-5]) -> 2012 | I519: =+MONTH(RC[-6]) -> 12 | J519: =+RC[-6]-RC[-7] -> 9 | K519: =+IF(RC[-4]="OUT of TIME",RC[-1]-VLOOKUP(RC[-9],Enunciado!R3C6:R5C7,2,0),"") -> 
A520: Dept3-6638 | B520: Alto | C520: 41403 | D520: 41407 | E520: =+LEFT(RC[-4],5) -> Dept3 | F520: =+VLOOKUP(RC[-4],Enunciado!R3C6:R5C7,2,0)+RC[-3] -> 41408 | G520: =+IF(RC[-1]>=RC[-3],"ON TIME","OUT OF TIME") -> ON TIME | H520: =+YEAR(RC[-5]) -> 2013 | I520: =+MONTH(RC[-6]) -> 5 | J520: =+RC[-6]-RC[-7] -> 4 | K520: =+IF(RC[-4]="OUT of TIME",RC[-1]-VLOOKUP(RC[-9],Enunciado!R3C6:R5C7,2,0),"") -> 
A521: Dept3-9602 | B521: Medio | C521: 41469 | D521: 41473 | E521: =+LEFT(RC[-4],5) -> Dept3 | F521: =+VLOOKUP(RC[-4],Enunciado!R3C6:R5C7,2,0)+RC[-3] -> 41484 | G521: =+IF(RC[-1]>=RC[-3],"ON TIME","OUT OF TIME") -> ON TIME | H521: =+YEAR(RC[-5]) -> 2013 | I521: =+MONTH(RC[-6]) -> 7 | J521: =+RC[-6]-RC[-7] -> 4 | K521: =+IF(RC[-4]="OUT of TIME",RC[-1]-VLOOKUP(RC[-9],Enunciado!R3C6:R5C7,2,0),"") -> 
A522: Dept5-7706 | B522: Bajo | C522: 41464 | D522: 41479 | E522: =+LEFT(RC[-4],5) -> Dept5 | F522: =+VLOOKUP(RC[-4],Enunciado!R3C6:R5C7,2,0)+RC[-3] -> 41494 | G522: =+IF(RC[-1]>=RC[-3],"ON TIME","OUT OF TIME") -> ON TIME | H522: =+YEAR(RC[-5]) -> 2013 | I522: =+MONTH(RC[-6]) -> 7 | J522: =+RC[-6]-RC[-7] -> 15 | K522: =+IF(RC[-4]="OUT of TIME",RC[-1]-VLOOKUP(RC[-9],Enunciado!R3C6:R5C7,2,0),"") -> 
A523: Dept5-2299 | B523: Medio | C523: 41505 | D523: 41535 | E523: =+LEFT(RC[-4],5) -> Dept5 | F523: =+VLOOKUP(RC[-4],Enunciado!R3C6:R5C7,2,0)+RC[-3] -> 41520 | G523: =+IF(RC[-1]>=RC[-3],"ON TIME","OUT OF TIME") -> OUT OF TIME | H523: =+YEAR(RC[-5]) -> 2013 | I523: =+MONTH(RC[-6]) -> 8 | J523: =+RC[-6]-RC[-7] -> 30 | K523: =+IF(RC[-4]="OUT of TIME",RC[-1]-VLOOKUP(RC[-9],Enunciado!R3C6:R5C7,2,0),"") -> 15
A524: Dept3-10214 | B524: Bajo | C524: 41527 | D524: 41538 | E524: =+LEFT(RC[-4],5) -> Dept3 | F524: =+VLOOKUP(RC[-4],Enunciado!R3C6:R5C7,2,0)+RC[-3] -> 41557 | G524: =+IF(RC[-1]>=RC[-3],"ON TIME","OUT OF TIME") -> ON TIME | H524: =+YEAR(RC[-5]) -> 2013 | I524: =+MONTH(RC[-6]) -> 9 | J524: =+RC[-6]-RC[-7] -> 11 | K524: =+IF(RC[-4]="OUT of TIME",RC[-1]-VLOOKUP(RC[-9],Enunciado!R3C6:R5C7,2,0),"") -> 
A525: Dept5-15940 | B525: Medio | C525: 41165 | D525: 41176 | E525: =+LEFT(RC[-4],5) -> Dept5 | F525: =+VLOOKUP(RC[-4],Enunciado!R3C6:R5C7,2,0)+RC[-3] -> 41180 | G525: =+IF(RC[-1]>=RC[-3],"ON TIME","OUT OF TIME") -> ON TIME | H525: =+YEAR(RC[-5]) -> 2012 | I525: =+MONTH(RC[-6]) -> 9 | J525: =+RC[-6]-RC[-7] -> 11 | K525: =+IF(RC[-4]="OUT of TIME",RC[-1]-VLOOKUP(RC[-9],Enunciado!R3C6:R5C7,2,0),"") -> 
A526: Dept5-6376 | B526: Medio | C526: 41030 | D526: 41034 | E526: =+LEFT(RC[-4],5) -> Dept5 | F526: =+VLOOKUP(RC[-4],Enunciado!R3C6:R5C7,2,0)+RC[-3] -> 41045 | G526: =+IF(RC[-1]>=RC[-3],"ON TIME","OUT OF TIME") -> ON TIME | H526: =+YEAR(RC[-5]) -> 2012 | I526: =+MONTH(RC[-6]) -> 5 | J526: =+RC[-6]-RC[-7] -> 4 | K526: =+IF(RC[-4]="OUT of TIME",RC[-1]-VLOOKUP(RC[-9],Enunciado!R3C6:R5C7,2,0),"") -> 
A527: Dept3-20524 | B527: Medio | C527: 41507 | D527: 41507 | E527: =+LEFT(RC[-4],5) -> Dept3 | F527: =+VLOOKUP(RC[-4],Enunciado!R3C6:R5C7,2,0)+RC[-3] -> 41522 | G527: =+IF(RC[-1]>=RC[-3],"ON TIME","OUT OF TIME") -> ON TIME | H527: =+YEAR(RC[-5]) -> 2013 | I527: =+MONTH(RC[-6]) -> 8 | J527: =+RC[-6]-RC[-7] -> 0 | K527: =+IF(RC[-4]="OUT of TIME",RC[-1]-VLOOKUP(RC[-9],Enunciado!R3C6:R5C7,2,0),"") -> 
A528: Dept3-19428 | B528: Medio | C528: 41424 | D528: 41426 | E528: =+LEFT(RC[-4],5) -> Dept3 | F528: =+VLOOKUP(RC[-4],Enunciado!R3C6:R5C7,2,0)+RC[-3] -> 41439 | G528: =+IF(RC[-1]>=RC[-3],"ON TIME","OUT OF TIME") -> ON TIME | H528: =+YEAR(RC[-5]) -> 2013 | I528: =+MONTH(RC[-6]) -> 5 | J528: =+RC[-6]-RC[-7] -> 2 | K528: =+IF(RC[-4]="OUT of TIME",RC[-1]-VLOOKUP(RC[-9],Enunciado!R3C6:R5C7,2,0),"") -> 
A529: Dept5-11160 | B529: Bajo | C529: 41585 | D529: 41602 | E529: =+LEFT(RC[-4],5) -> Dept5 | F529: =+VLOOKUP(RC[-4],Enunciado!R3C6:R5C7,2,0)+RC[-3] -> 41615 | G529: =+IF(RC[-1]>=RC[-3],"ON TIME","OUT OF TIME") -> ON TIME | H529: =+YEAR(RC[-5]) -> 2013 | I529: =+MONTH(RC[-6]) -> 11 | J529: =+RC[-6]-RC[-7] -> 17 | K529: =+IF(RC[-4]="OUT of TIME",RC[-1]-VLOOKUP(RC[-9],Enunciado!R3C6:R5C7,2,0),"") -> 
A530: Dept6-26793 | B530: Medio | C530: 41103 | D530: 41107 | E530: =+LEFT(RC[-4],5) -> Dept6 | F530: =+VLOOKUP(RC[-4],Enunciado!R3C6:R5C7,2,0)+RC[-3] -> 41118 | G530: =+IF(RC[-1]>=RC[-3],"ON TIME","OUT OF TIME") -> ON TIME | H530: =+YEAR(RC[-5]) -> 2012 | I530: =+MONTH(RC[-6]) -> 7 | J530: =+RC[-6]-RC[-7] -> 4 | K530: =+IF(RC[-4]="OUT of TIME",RC[-1]-VLOOKUP(RC[-9],Enunciado!R3C6:R5C7,2,0),"") -> 
A531: Dept5-22583 | B531: Medio | C531: 41574 | D531: 41574 | E531: =+LEFT(RC[-4],5) -> Dept5 | F531: =+VLOOKUP(RC[-4],Enunciado!R3C6:R5C7,2,0)+RC[-3] -> 41589 | G531: =+IF(RC[-1]>=RC[-3],"ON TIME","OUT OF TIME") -> ON TIME | H531: =+YEAR(RC[-5]) -> 2013 | I531: =+MONTH(RC[-6]) -> 10 | J531: =+RC[-6]-RC[-7] -> 0 | K531: =+IF(RC[-4]="OUT of TIME",RC[-1]-VLOOKUP(RC[-9],Enunciado!R3C6:R5C7,2,0),"") -> 
A532: Dept5-27277 | B532: Bajo | C532: 41625 | D532: 41626 | E532: =+LEFT(RC[-4],5) -> Dept5 | F532: =+VLOOKUP(RC[-4],Enunciado!R3C6:R5C7,2,0)+RC[-3] -> 41655 | G532: =+IF(RC[-1]>=RC[-3],"ON TIME","OUT OF TIME") -> ON TIME | H532: =+YEAR(RC[-5]) -> 2013 | I532: =+MONTH(RC[-6]) -> 12 | J532: =+RC[-6]-RC[-7] -> 1 | K532: =+IF(RC[-4]="OUT of TIME",RC[-1]-VLOOKUP(RC[-9],Enunciado!R3C6:R5C7,2,0),"") -> 
A533: Dept1-14412 | B533: Medio | C533: 41420 | D533: 41423 | E533: =+LEFT(RC[-4],5) -> Dept1 | F533: =+VLOOKUP(RC[-4],Enunciado!R3C6:R5C7,2,0)+RC[-3] -> 41435 | G533: =+IF(RC[-1]>=RC[-3],"ON TIME","OUT OF TIME") -> ON TIME | H533: =+YEAR(RC[-5]) -> 2013 | I533: =+MONTH(RC[-6]) -> 5 | J533: =+RC[-6]-RC[-7] -> 3 | K533: =+IF(RC[-4]="OUT of TIME",RC[-1]-VLOOKUP(RC[-9],Enunciado!R3C6:R5C7,2,0),"") -> 
A534: Dept1-15094 | B534: Bajo | C534: 41494 | D534: 41498 | E534: =+LEFT(RC[-4],5) -> Dept1 | F534: =+VLOOKUP(RC[-4],Enunciado!R3C6:R5C7,2,0)+RC[-3] -> 41524 | G534: =+IF(RC[-1]>=RC[-3],"ON TIME","OUT OF TIME") -> ON TIME | H534: =+YEAR(RC[-5]) -> 2013 | I534: =+MONTH(RC[-6]) -> 8 | J534: =+RC[-6]-RC[-7] -> 4 | K534: =+IF(RC[-4]="OUT of TIME",RC[-1]-VLOOKUP(RC[-9],Enunciado!R3C6:R5C7,2,0),"") -> 
A535: Dept2-16216 | B535: Medio | C535: 41247 | D535: 41248 | E535: =+LEFT(RC[-4],5) -> Dept2 | F535: =+VLOOKUP(RC[-4],Enunciado!R3C6:R5C7,2,0)+RC[-3] -> 41262 | G535: =+IF(RC[-1]>=RC[-3],"ON TIME","OUT OF TIME") -> ON TIME | H535: =+YEAR(RC[-5]) -> 2012 | I535: =+MONTH(RC[-6]) -> 12 | J535: =+RC[-6]-RC[-7] -> 1 | K535: =+IF(RC[-4]="OUT of TIME",RC[-1]-VLOOKUP(RC[-9],Enunciado!R3C6:R5C7,2,0),"") -> 
A536: Dept3-21044 | B536: Bajo | C536: 41441 | D536: 41453 | E536: =+LEFT(RC[-4],5) -> Dept3 | F536: =+VLOOKUP(RC[-4],Enunciado!R3C6:R5C7,2,0)+RC[-3] -> 41471 | G536: =+IF(RC[-1]>=RC[-3],"ON TIME","OUT OF TIME") -> ON TIME | H536: =+YEAR(RC[-5]) -> 2013 | I536: =+MONTH(RC[-6]) -> 6 | J536: =+RC[-6]-RC[-7] -> 12 | K536: =+IF(RC[-4]="OUT of TIME",RC[-1]-VLOOKUP(RC[-9],Enunciado!R3C6:R5C7,2,0),"") -> 
A537: Dept1-28939 | B537: Medio | C537: 41631 | D537: 41633 | E537: =+LEFT(RC[-4],5) -> Dept1 | F537: =+VLOOKUP(RC[-4],Enunciado!R3C6:R5C7,2,0)+RC[-3] -> 41646 | G537: =+IF(RC[-1]>=RC[-3],"ON TIME","OUT OF TIME") -> ON TIME | H537: =+YEAR(RC[-5]) -> 2013 | I537: =+MONTH(RC[-6]) -> 12 | J537: =+RC[-6]-RC[-7] -> 2 | K537: =+IF(RC[-4]="OUT of TIME",RC[-1]-VLOOKUP(RC[-9],Enunciado!R3C6:R5C7,2,0),"") -> 
A538: Dept5-28653 | B538: Medio | C538: 41126 | D538: 41145 | E538: =+LEFT(RC[-4],5) -> Dept5 | F538: =+VLOOKUP(RC[-4],Enunciado!R3C6:R5C7,2,0)+RC[-3] -> 41141 | G538: =+IF(RC[-1]>=RC[-3],"ON TIME","OUT OF TIME") -> OUT OF TIME | H538: =+YEAR(RC[-5]) -> 2012 | I538: =+MONTH(RC[-6]) -> 8 | J538: =+RC[-6]-RC[-7] -> 19 | K538: =+IF(RC[-4]="OUT of TIME",RC[-1]-VLOOKUP(RC[-9],Enunciado!R3C6:R5C7,2,0),"") -> 4
A539: Dept1-26769 | B539: Bajo | C539: 41355 | D539: 41355 | E539: =+LEFT(RC[-4],5) -> Dept1 | F539: =+VLOOKUP(RC[-4],Enunciado!R3C6:R5C7,2,0)+RC[-3] -> 41385 | G539: =+IF(RC[-1]>=RC[-3],"ON TIME","OUT OF TIME") -> ON TIME | H539: =+YEAR(RC[-5]) -> 2013 | I539: =+MONTH(RC[-6]) -> 3 | J539: =+RC[-6]-RC[-7] -> 0 | K539: =+IF(RC[-4]="OUT of TIME",RC[-1]-VLOOKUP(RC[-9],Enunciado!R3C6:R5C7,2,0),"") -> 
A540: Dept5-580 | B540: Medio | C540: 41488 | D540: 41512 | E540: =+LEFT(RC[-4],5) -> Dept5 | F540: =+VLOOKUP(RC[-4],Enunciado!R3C6:R5C7,2,0)+RC[-3] -> 41503 | G540: =+IF(RC[-1]>=RC[-3],"ON TIME","OUT OF TIME") -> OUT OF TIME | H540: =+YEAR(RC[-5]) -> 2013 | I540: =+MONTH(RC[-6]) -> 8 | J540: =+RC[-6]-RC[-7] -> 24 | K540: =+IF(RC[-4]="OUT of TIME",RC[-1]-VLOOKUP(RC[-9],Enunciado!R3C6:R5C7,2,0),"") -> 9
A541: Dept2-20982 | B541: Bajo | C541: 40965 | D541: 40983 | E541: =+LEFT(RC[-4],5) -> Dept2 | F541: =+VLOOKUP(RC[-4],Enunciado!R3C6:R5C7,2,0)+RC[-3] -> 40995 | G541: =+IF(RC[-1]>=RC[-3],"ON TIME","OUT OF TIME") -> ON TIME | H541: =+YEAR(RC[-5]) -> 2012 | I541: =+MONTH(RC[-6]) -> 2 | J541: =+RC[-6]-RC[-7] -> 18 | K541: =+IF(RC[-4]="OUT of TIME",RC[-1]-VLOOKUP(RC[-9],Enunciado!R3C6:R5C7,2,0),"") -> 
A542: Dept1-18119 | B542: Bajo | C542: 40968 | D542: 40970 | E542: =+LEFT(RC[-4],5) -> Dept1 | F542: =+VLOOKUP(RC[-4],Enunciado!R3C6:R5C7,2,0)+RC[-3] -> 40998 | G542: =+IF(RC[-1]>=RC[-3],"ON TIME","OUT OF TIME") -> ON TIME | H542: =+YEAR(RC[-5]) -> 2012 | I542: =+MONTH(RC[-6]) -> 2 | J542: =+RC[-6]-RC[-7] -> 2 | K542: =+IF(RC[-4]="OUT of TIME",RC[-1]-VLOOKUP(RC[-9],Enunciado!R3C6:R5C7,2,0),"") -> 
A543: Dept2-4854 | B543: Medio | C543: 40967 | D543: 40971 | E543: =+LEFT(RC[-4],5) -> Dept2 | F543: =+VLOOKUP(RC[-4],Enunciado!R3C6:R5C7,2,0)+RC[-3] -> 40982 | G543: =+IF(RC[-1]>=RC[-3],"ON TIME","OUT OF TIME") -> ON TIME | H543: =+YEAR(RC[-5]) -> 2012 | I543: =+MONTH(RC[-6]) -> 2 | J543: =+RC[-6]-RC[-7] -> 4 | K543: =+IF(RC[-4]="OUT of TIME",RC[-1]-VLOOKUP(RC[-9],Enunciado!R3C6:R5C7,2,0),"") -> 
A544: Dept2-4088 | B544: Alto | C544: 41290 | D544: 41300 | E544: =+LEFT(RC[-4],5) -> Dept2 | F544: =+VLOOKUP(RC[-4],Enunciado!R3C6:R5C7,2,0)+RC[-3] -> 41295 | G544: =+IF(RC[-1]>=RC[-3],"ON TIME","OUT OF TIME") -> OUT OF TIME | H544: =+YEAR(RC[-5]) -> 2013 | I544: =+MONTH(RC[-6]) -> 1 | J544: =+RC[-6]-RC[-7] -> 10 | K544: =+IF(RC[-4]="OUT of TIME",RC[-1]-VLOOKUP(RC[-9],Enunciado!R3C6:R5C7,2,0),"") -> 5
A545: Dept5-26185 | B545: Alto | C545: 41414 | D545: 41416 | E545: =+LEFT(RC[-4],5) -> Dept5 | F545: =+VLOOKUP(RC[-4],Enunciado!R3C6:R5C7,2,0)+RC[-3] -> 41419 | G545: =+IF(RC[-1]>=RC[-3],"ON TIME","OUT OF TIME") -> ON TIME | H545: =+YEAR(RC[-5]) -> 2013 | I545: =+MONTH(RC[-6]) -> 5 | J545: =+RC[-6]-RC[-7] -> 2 | K545: =+IF(RC[-4]="OUT of TIME",RC[-1]-VLOOKUP(RC[-9],Enunciado!R3C6:R5C7,2,0),"") -> 
A546: Dept6-6942 | B546: Alto | C546: 41085 | D546: 41096 | E546: =+LEFT(RC[-4],5) -> Dept6 | F546: =+VLOOKUP(RC[-4],Enunciado!R3C6:R5C7,2,0)+RC[-3] -> 41090 | G546: =+IF(RC[-1]>=RC[-3],"ON TIME","OUT OF TIME") -> OUT OF TIME | H546: =+YEAR(RC[-5]) -> 2012 | I546: =+MONTH(RC[-6]) -> 6 | J546: =+RC[-6]-RC[-7] -> 11 | K546: =+IF(RC[-4]="OUT of TIME",RC[-1]-VLOOKUP(RC[-9],Enunciado!R3C6:R5C7,2,0),"") -> 6
A547: Dept4-11502 | B547: Bajo | C547: 41002 | D547: 41003 | E547: =+LEFT(RC[-4],5) -> Dept4 | F547: =+VLOOKUP(RC[-4],Enunciado!R3C6:R5C7,2,0)+RC[-3] -> 41032 | G547: =+IF(RC[-1]>=RC[-3],"ON TIME","OUT OF TIME") -> ON TIME | H547: =+YEAR(RC[-5]) -> 2012 | I547: =+MONTH(RC[-6]) -> 4 | J547: =+RC[-6]-RC[-7] -> 1 | K547: =+IF(RC[-4]="OUT of TIME",RC[-1]-VLOOKUP(RC[-9],Enunciado!R3C6:R5C7,2,0),"") -> 
A548: Dept4-21398 | B548: Alto | C548: 41174 | D548: 41188 | E548: =+LEFT(RC[-4],5) -> Dept4 | F548: =+VLOOKUP(RC[-4],Enunciado!R3C6:R5C7,2,0)+RC[-3] -> 41179 | G548: =+IF(RC[-1]>=RC[-3],"ON TIME","OUT OF TIME") -> OUT OF TIME | H548: =+YEAR(RC[-5]) -> 2012 | I548: =+MONTH(RC[-6]) -> 9 | J548: =+RC[-6]-RC[-7] -> 14 | K548: =+IF(RC[-4]="OUT of TIME",RC[-1]-VLOOKUP(RC[-9],Enunciado!R3C6:R5C7,2,0),"") -> 9
A549: Dept6-23505 | B549: Medio | C549: 40992 | D549: 40994 | E549: =+LEFT(RC[-4],5) -> Dept6 | F549: =+VLOOKUP(RC[-4],Enunciado!R3C6:R5C7,2,0)+RC[-3] -> 41007 | G549: =+IF(RC[-1]>=RC[-3],"ON TIME","OUT OF TIME") -> ON TIME | H549: =+YEAR(RC[-5]) -> 2012 | I549: =+MONTH(RC[-6]) -> 3 | J549: =+RC[-6]-RC[-7] -> 2 | K549: =+IF(RC[-4]="OUT of TIME",RC[-1]-VLOOKUP(RC[-9],Enunciado!R3C6:R5C7,2,0),"") -> 
A550: Dept5-8406 | B550: Alto | C550: 41002 | D550: 41030 | E550: =+LEFT(RC[-4],5) -> Dept5 | F550: =+VLOOKUP(RC[-4],Enunciado!R3C6:R5C7,2,0)+RC[-3] -> 41007 | G550: =+IF(RC[-1]>=RC[-3],"ON TIME","OUT OF TIME") -> OUT OF TIME | H550: =+YEAR(RC[-5]) -> 2012 | I550: =+MONTH(RC[-6]) -> 4 | J550: =+RC[-6]-RC[-7] -> 28 | K550: =+IF(RC[-4]="OUT of TIME",RC[-1]-VLOOKUP(RC[-9],Enunciado!R3C6:R5C7,2,0),"") -> 23
A551: Dept1-20819 | B551: Alto | C551: 41198 | D551: 41212 | E551: =+LEFT(RC[-4],5) -> Dept1 | F551: =+VLOOKUP(RC[-4],Enunciado!R3C6:R5C7,2,0)+RC[-3] -> 41203 | G551: =+IF(RC[-1]>=RC[-3],"ON TIME","OUT OF TIME") -> OUT OF TIME | H551: =+YEAR(RC[-5]) -> 2012 | I551: =+MONTH(RC[-6]) -> 10 | J551: =+RC[-6]-RC[-7] -> 14 | K551: =+IF(RC[-4]="OUT of TIME",RC[-1]-VLOOKUP(RC[-9],Enunciado!R3C6:R5C7,2,0),"") -> 9
A552: Dept2-4756 | B552: Alto | C552: 40994 | D552: 40997 | E552: =+LEFT(RC[-4],5) -> Dept2 | F552: =+VLOOKUP(RC[-4],Enunciado!R3C6:R5C7,2,0)+RC[-3] -> 40999 | G552: =+IF(RC[-1]>=RC[-3],"ON TIME","OUT OF TIME") -> ON TIME | H552: =+YEAR(RC[-5]) -> 2012 | I552: =+MONTH(RC[-6]) -> 3 | J552: =+RC[-6]-RC[-7] -> 3 | K552: =+IF(RC[-4]="OUT of TIME",RC[-1]-VLOOKUP(RC[-9],Enunciado!R3C6:R5C7,2,0),"") -> 
A553: Dept2-26614 | B553: Medio | C553: 41437 | D553: 41450 | E553: =+LEFT(RC[-4],5) -> Dept2 | F553: =+VLOOKUP(RC[-4],Enunciado!R3C6:R5C7,2,0)+RC[-3] -> 41452 | G553: =+IF(RC[-1]>=RC[-3],"ON TIME","OUT OF TIME") -> ON TIME | H553: =+YEAR(RC[-5]) -> 2013 | I553: =+MONTH(RC[-6]) -> 6 | J553: =+RC[-6]-RC[-7] -> 13 | K553: =+IF(RC[-4]="OUT of TIME",RC[-1]-VLOOKUP(RC[-9],Enunciado!R3C6:R5C7,2,0),"") -> 
A554: Dept1-10161 | B554: Alto | C554: 41079 | D554: 41091 | E554: =+LEFT(RC[-4],5) -> Dept1 | F554: =+VLOOKUP(RC[-4],Enunciado!R3C6:R5C7,2,0)+RC[-3] -> 41084 | G554: =+IF(RC[-1]>=RC[-3],"ON TIME","OUT OF TIME") -> OUT OF TIME | H554: =+YEAR(RC[-5]) -> 2012 | I554: =+MONTH(RC[-6]) -> 6 | J554: =+RC[-6]-RC[-7] -> 12 | K554: =+IF(RC[-4]="OUT of TIME",RC[-1]-VLOOKUP(RC[-9],Enunciado!R3C6:R5C7,2,0),"") -> 7
A555: Dept4-146 | B555: Bajo | C555: 41369 | D555: 41373 | E555: =+LEFT(RC[-4],5) -> Dept4 | F555: =+VLOOKUP(RC[-4],Enunciado!R3C6:R5C7,2,0)+RC[-3] -> 41399 | G555: =+IF(RC[-1]>=RC[-3],"ON TIME","OUT OF TIME") -> ON TIME | H555: =+YEAR(RC[-5]) -> 2013 | I555: =+MONTH(RC[-6]) -> 4 | J555: =+RC[-6]-RC[-7] -> 4 | K555: =+IF(RC[-4]="OUT of TIME",RC[-1]-VLOOKUP(RC[-9],Enunciado!R3C6:R5C7,2,0),"") -> 
A556: Dept2-7099 | B556: Medio | C556: 41065 | D556: 41081 | E556: =+LEFT(RC[-4],5) -> Dept2 | F556: =+VLOOKUP(RC[-4],Enunciado!R3C6:R5C7,2,0)+RC[-3] -> 41080 | G556: =+IF(RC[-1]>=RC[-3],"ON TIME","OUT OF TIME") -> OUT OF TIME | H556: =+YEAR(RC[-5]) -> 2012 | I556: =+MONTH(RC[-6]) -> 6 | J556: =+RC[-6]-RC[-7] -> 16 | K556: =+IF(RC[-4]="OUT of TIME",RC[-1]-VLOOKUP(RC[-9],Enunciado!R3C6:R5C7,2,0),"") -> 1
A557: Dept3-2807 | B557: Alto | C557: 41118 | D557: 41120 | E557: =+LEFT(RC[-4],5) -> Dept3 | F557: =+VLOOKUP(RC[-4],Enunciado!R3C6:R5C7,2,0)+RC[-3] -> 41123 | G557: =+IF(RC[-1]>=RC[-3],"ON TIME","OUT OF TIME") -> ON TIME | H557: =+YEAR(RC[-5]) -> 2012 | I557: =+MONTH(RC[-6]) -> 7 | J557: =+RC[-6]-RC[-7] -> 2 | K557: =+IF(RC[-4]="OUT of TIME",RC[-1]-VLOOKUP(RC[-9],Enunciado!R3C6:R5C7,2,0),"") -> 
A558: Dept1-26253 | B558: Alto | C558: 41420 | D558: 41423 | E558: =+LEFT(RC[-4],5) -> Dept1 | F558: =+VLOOKUP(RC[-4],Enunciado!R3C6:R5C7,2,0)+RC[-3] -> 41425 | G558: =+IF(RC[-1]>=RC[-3],"ON TIME","OUT OF TIME") -> ON TIME | H558: =+YEAR(RC[-5]) -> 2013 | I558: =+MONTH(RC[-6]) -> 5 | J558: =+RC[-6]-RC[-7] -> 3 | K558: =+IF(RC[-4]="OUT of TIME",RC[-1]-VLOOKUP(RC[-9],Enunciado!R3C6:R5C7,2,0),"") -> 
A559: Dept6-27711 | B559: Medio | C559: 41555 | D559: 41569 | E559: =+LEFT(RC[-4],5) -> Dept6 | F559: =+VLOOKUP(RC[-4],Enunciado!R3C6:R5C7,2,0)+RC[-3] -> 41570 | G559: =+IF(RC[-1]>=RC[-3],"ON TIME","OUT OF TIME") -> ON TIME | H559: =+YEAR(RC[-5]) -> 2013 | I559: =+MONTH(RC[-6]) -> 10 | J559: =+RC[-6]-RC[-7] -> 14 | K559: =+IF(RC[-4]="OUT of TIME",RC[-1]-VLOOKUP(RC[-9],Enunciado!R3C6:R5C7,2,0),"") -> 
A560: Dept1-27839 | B560: Medio | C560: 40936 | D560: 40946 | E560: =+LEFT(RC[-4],5) -> Dept1 | F560: =+VLOOKUP(RC[-4],Enunciado!R3C6:R5C7,2,0)+RC[-3] -> 40951 | G560: =+IF(RC[-1]>=RC[-3],"ON TIME","OUT OF TIME") -> ON TIME | H560: =+YEAR(RC[-5]) -> 2012 | I560: =+MONTH(RC[-6]) -> 1 | J560: =+RC[-6]-RC[-7] -> 10 | K560: =+IF(RC[-4]="OUT of TIME",RC[-1]-VLOOKUP(RC[-9],Enunciado!R3C6:R5C7,2,0),"") -> 
A561: Dept1-9410 | B561: Bajo | C561: 40951 | D561: 40954 | E561: =+LEFT(RC[-4],5) -> Dept1 | F561: =+VLOOKUP(RC[-4],Enunciado!R3C6:R5C7,2,0)+RC[-3] -> 40981 | G561: =+IF(RC[-1]>=RC[-3],"ON TIME","OUT OF TIME") -> ON TIME | H561: =+YEAR(RC[-5]) -> 2012 | I561: =+MONTH(RC[-6]) -> 2 | J561: =+RC[-6]-RC[-7] -> 3 | K561: =+IF(RC[-4]="OUT of TIME",RC[-1]-VLOOKUP(RC[-9],Enunciado!R3C6:R5C7,2,0),"") -> 
A562: Dept2-6655 | B562: Bajo | C562: 41433 | D562: 41437 | E562: =+LEFT(RC[-4],5) -> Dept2 | F562: =+VLOOKUP(RC[-4],Enunciado!R3C6:R5C7,2,0)+RC[-3] -> 41463 | G562: =+IF(RC[-1]>=RC[-3],"ON TIME","OUT OF TIME") -> ON TIME | H562: =+YEAR(RC[-5]) -> 2013 | I562: =+MONTH(RC[-6]) -> 6 | J562: =+RC[-6]-RC[-7] -> 4 | K562: =+IF(RC[-4]="OUT of TIME",RC[-1]-VLOOKUP(RC[-9],Enunciado!R3C6:R5C7,2,0),"") -> 
A563: Dept1-27785 | B563: Alto | C563: 41463 | D563: 41465 | E563: =+LEFT(RC[-4],5) -> Dept1 | F563: =+VLOOKUP(RC[-4],Enunciado!R3C6:R5C7,2,0)+RC[-3] -> 41468 | G563: =+IF(RC[-1]>=RC[-3],"ON TIME","OUT OF TIME") -> ON TIME | H563: =+YEAR(RC[-5]) -> 2013 | I563: =+MONTH(RC[-6]) -> 7 | J563: =+RC[-6]-RC[-7] -> 2 | K563: =+IF(RC[-4]="OUT of TIME",RC[-1]-VLOOKUP(RC[-9],Enunciado!R3C6:R5C7,2,0),"") -> 
A564: Dept1-16144 | B564: Medio | C564: 41397 | D564: 41446 | E564: =+LEFT(RC[-4],5) -> Dept1 | F564: =+VLOOKUP(RC[-4],Enunciado!R3C6:R5C7,2,0)+RC[-3] -> 41412 | G564: =+IF(RC[-1]>=RC[-3],"ON TIME","OUT OF TIME") -> OUT OF TIME | H564: =+YEAR(RC[-5]) -> 2013 | I564: =+MONTH(RC[-6]) -> 5 | J564: =+RC[-6]-RC[-7] -> 49 | K564: =+IF(RC[-4]="OUT of TIME",RC[-1]-VLOOKUP(RC[-9],Enunciado!R3C6:R5C7,2,0),"") -> 34
A565: Dept2-7682 | B565: Alto | C565: 41544 | D565: 41578 | E565: =+LEFT(RC[-4],5) -> Dept2 | F565: =+VLOOKUP(RC[-4],Enunciado!R3C6:R5C7,2,0)+RC[-3] -> 41549 | G565: =+IF(RC[-1]>=RC[-3],"ON TIME","OUT OF TIME") -> OUT OF TIME | H565: =+YEAR(RC[-5]) -> 2013 | I565: =+MONTH(RC[-6]) -> 9 | J565: =+RC[-6]-RC[-7] -> 34 | K565: =+IF(RC[-4]="OUT of TIME",RC[-1]-VLOOKUP(RC[-9],Enunciado!R3C6:R5C7,2,0),"") -> 29
A566: Dept5-24301 | B566: Bajo | C566: 41087 | D566: 41087 | E566: =+LEFT(RC[-4],5) -> Dept5 | F566: =+VLOOKUP(RC[-4],Enunciado!R3C6:R5C7,2,0)+RC[-3] -> 41117 | G566: =+IF(RC[-1]>=RC[-3],"ON TIME","OUT OF TIME") -> ON TIME | H566: =+YEAR(RC[-5]) -> 2012 | I566: =+MONTH(RC[-6]) -> 6 | J566: =+RC[-6]-RC[-7] -> 0 | K566: =+IF(RC[-4]="OUT of TIME",RC[-1]-VLOOKUP(RC[-9],Enunciado!R3C6:R5C7,2,0),"") -> 
A567: Dept6-23345 | B567: Medio | C567: 41262 | D567: 41296 | E567: =+LEFT(RC[-4],5) -> Dept6 | F567: =+VLOOKUP(RC[-4],Enunciado!R3C6:R5C7,2,0)+RC[-3] -> 41277 | G567: =+IF(RC[-1]>=RC[-3],"ON TIME","OUT OF TIME") -> OUT OF TIME | H567: =+YEAR(RC[-5]) -> 2012 | I567: =+MONTH(RC[-6]) -> 12 | J567: =+RC[-6]-RC[-7] -> 34 | K567: =+IF(RC[-4]="OUT of TIME",RC[-1]-VLOOKUP(RC[-9],Enunciado!R3C6:R5C7,2,0),"") -> 19
A568: Dept3-1720 | B568: Bajo | C568: 41493 | D568: 41499 | E568: =+LEFT(RC[-4],5) -> Dept3 | F568: =+VLOOKUP(RC[-4],Enunciado!R3C6:R5C7,2,0)+RC[-3] -> 41523 | G568: =+IF(RC[-1]>=RC[-3],"ON TIME","OUT OF TIME") -> ON TIME | H568: =+YEAR(RC[-5]) -> 2013 | I568: =+MONTH(RC[-6]) -> 8 | J568: =+RC[-6]-RC[-7] -> 6 | K568: =+IF(RC[-4]="OUT of TIME",RC[-1]-VLOOKUP(RC[-9],Enunciado!R3C6:R5C7,2,0),"") -> 
A569: Dept6-14226 | B569: Medio | C569: 41459 | D569: 41460 | E569: =+LEFT(RC[-4],5) -> Dept6 | F569: =+VLOOKUP(RC[-4],Enunciado!R3C6:R5C7,2,0)+RC[-3] -> 41474 | G569: =+IF(RC[-1]>=RC[-3],"ON TIME","OUT OF TIME") -> ON TIME | H569: =+YEAR(RC[-5]) -> 2013 | I569: =+MONTH(RC[-6]) -> 7 | J569: =+RC[-6]-RC[-7] -> 1 | K569: =+IF(RC[-4]="OUT of TIME",RC[-1]-VLOOKUP(RC[-9],Enunciado!R3C6:R5C7,2,0),"") -> 
A570: Dept6-19612 | B570: Alto | C570: 41043 | D570: 41044 | E570: =+LEFT(RC[-4],5) -> Dept6 | F570: =+VLOOKUP(RC[-4],Enunciado!R3C6:R5C7,2,0)+RC[-3] -> 41048 | G570: =+IF(RC[-1]>=RC[-3],"ON TIME","OUT OF TIME") -> ON TIME | H570: =+YEAR(RC[-5]) -> 2012 | I570: =+MONTH(RC[-6]) -> 5 | J570: =+RC[-6]-RC[-7] -> 1 | K570: =+IF(RC[-4]="OUT of TIME",RC[-1]-VLOOKUP(RC[-9],Enunciado!R3C6:R5C7,2,0),"") -> 
A571: Dept4-6221 | B571: Alto | C571: 41242 | D571: 41253 | E571: =+LEFT(RC[-4],5) -> Dept4 | F571: =+VLOOKUP(RC[-4],Enunciado!R3C6:R5C7,2,0)+RC[-3] -> 41247 | G571: =+IF(RC[-1]>=RC[-3],"ON TIME","OUT OF TIME") -> OUT OF TIME | H571: =+YEAR(RC[-5]) -> 2012 | I571: =+MONTH(RC[-6]) -> 11 | J571: =+RC[-6]-RC[-7] -> 11 | K571: =+IF(RC[-4]="OUT of TIME",RC[-1]-VLOOKUP(RC[-9],Enunciado!R3C6:R5C7,2,0),"") -> 6
A572: Dept1-23090 | B572: Alto | C572: 40946 | D572: 40987 | E572: =+LEFT(RC[-4],5) -> Dept1 | F572: =+VLOOKUP(RC[-4],Enunciado!R3C6:R5C7,2,0)+RC[-3] -> 40951 | G572: =+IF(RC[-1]>=RC[-3],"ON TIME","OUT OF TIME") -> OUT OF TIME | H572: =+YEAR(RC[-5]) -> 2012 | I572: =+MONTH(RC[-6]) -> 2 | J572: =+RC[-6]-RC[-7] -> 41 | K572: =+IF(RC[-4]="OUT of TIME",RC[-1]-VLOOKUP(RC[-9],Enunciado!R3C6:R5C7,2,0),"") -> 36
A573: Dept2-19893 | B573: Medio | C573: 41066 | D573: 41070 | E573: =+LEFT(RC[-4],5) -> Dept2 | F573: =+VLOOKUP(RC[-4],Enunciado!R3C6:R5C7,2,0)+RC[-3] -> 41081 | G573: =+IF(RC[-1]>=RC[-3],"ON TIME","OUT OF TIME") -> ON TIME | H573: =+YEAR(RC[-5]) -> 2012 | I573: =+MONTH(RC[-6]) -> 6 | J573: =+RC[-6]-RC[-7] -> 4 | K573: =+IF(RC[-4]="OUT of TIME",RC[-1]-VLOOKUP(RC[-9],Enunciado!R3C6:R5C7,2,0),"") -> 
A574: Dept5-2535 | B574: Bajo | C574: 41520 | D574: 41530 | E574: =+LEFT(RC[-4],5) -> Dept5 | F574: =+VLOOKUP(RC[-4],Enunciado!R3C6:R5C7,2,0)+RC[-3] -> 41550 | G574: =+IF(RC[-1]>=RC[-3],"ON TIME","OUT OF TIME") -> ON TIME | H574: =+YEAR(RC[-5]) -> 2013 | I574: =+MONTH(RC[-6]) -> 9 | J574: =+RC[-6]-RC[-7] -> 10 | K574: =+IF(RC[-4]="OUT of TIME",RC[-1]-VLOOKUP(RC[-9],Enunciado!R3C6:R5C7,2,0),"") -> 
A575: Dept5-24759 | B575: Bajo | C575: 41626 | D575: 41629 | E575: =+LEFT(RC[-4],5) -> Dept5 | F575: =+VLOOKUP(RC[-4],Enunciado!R3C6:R5C7,2,0)+RC[-3] -> 41656 | G575: =+IF(RC[-1]>=RC[-3],"ON TIME","OUT OF TIME") -> ON TIME | H575: =+YEAR(RC[-5]) -> 2013 | I575: =+MONTH(RC[-6]) -> 12 | J575: =+RC[-6]-RC[-7] -> 3 | K575: =+IF(RC[-4]="OUT of TIME",RC[-1]-VLOOKUP(RC[-9],Enunciado!R3C6:R5C7,2,0),"") -> 
A576: Dept4-3376 | B576: Medio | C576: 41242 | D576: 41245 | E576: =+LEFT(RC[-4],5) -> Dept4 | F576: =+VLOOKUP(RC[-4],Enunciado!R3C6:R5C7,2,0)+RC[-3] -> 41257 | G576: =+IF(RC[-1]>=RC[-3],"ON TIME","OUT OF TIME") -> ON TIME | H576: =+YEAR(RC[-5]) -> 2012 | I576: =+MONTH(RC[-6]) -> 11 | J576: =+RC[-6]-RC[-7] -> 3 | K576: =+IF(RC[-4]="OUT of TIME",RC[-1]-VLOOKUP(RC[-9],Enunciado!R3C6:R5C7,2,0),"") -> 
A577: Dept2-6186 | B577: Alto | C577: 41402 | D577: 41420 | E577: =+LEFT(RC[-4],5) -> Dept2 | F577: =+VLOOKUP(RC[-4],Enunciado!R3C6:R5C7,2,0)+RC[-3] -> 41407 | G577: =+IF(RC[-1]>=RC[-3],"ON TIME","OUT OF TIME") -> OUT OF TIME | H577: =+YEAR(RC[-5]) -> 2013 | I577: =+MONTH(RC[-6]) -> 5 | J577: =+RC[-6]-RC[-7] -> 18 | K577: =+IF(RC[-4]="OUT of TIME",RC[-1]-VLOOKUP(RC[-9],Enunciado!R3C6:R5C7,2,0),"") -> 13
A578: Dept4-22066 | B578: Medio | C578: 41251 | D578: 41252 | E578: =+LEFT(RC[-4],5) -> Dept4 | F578: =+VLOOKUP(RC[-4],Enunciado!R3C6:R5C7,2,0)+RC[-3] -> 41266 | G578: =+IF(RC[-1]>=RC[-3],"ON TIME","OUT OF TIME") -> ON TIME | H578: =+YEAR(RC[-5]) -> 2012 | I578: =+MONTH(RC[-6]) -> 12 | J578: =+RC[-6]-RC[-7] -> 1 | K578: =+IF(RC[-4]="OUT of TIME",RC[-1]-VLOOKUP(RC[-9],Enunciado!R3C6:R5C7,2,0),"") -> 
A579: Dept4-8973 | B579: Alto | C579: 41613 | D579: 41617 | E579: =+LEFT(RC[-4],5) -> Dept4 | F579: =+VLOOKUP(RC[-4],Enunciado!R3C6:R5C7,2,0)+RC[-3] -> 41618 | G579: =+IF(RC[-1]>=RC[-3],"ON TIME","OUT OF TIME") -> ON TIME | H579: =+YEAR(RC[-5]) -> 2013 | I579: =+MONTH(RC[-6]) -> 12 | J579: =+RC[-6]-RC[-7] -> 4 | K579: =+IF(RC[-4]="OUT of TIME",RC[-1]-VLOOKUP(RC[-9],Enunciado!R3C6:R5C7,2,0),"") -> 
A580: Dept5-23585 | B580: Medio | C580: 41564 | D580: 41564 | E580: =+LEFT(RC[-4],5) -> Dept5 | F580: =+VLOOKUP(RC[-4],Enunciado!R3C6:R5C7,2,0)+RC[-3] -> 41579 | G580: =+IF(RC[-1]>=RC[-3],"ON TIME","OUT OF TIME") -> ON TIME | H580: =+YEAR(RC[-5]) -> 2013 | I580: =+MONTH(RC[-6]) -> 10 | J580: =+RC[-6]-RC[-7] -> 0 | K580: =+IF(RC[-4]="OUT of TIME",RC[-1]-VLOOKUP(RC[-9],Enunciado!R3C6:R5C7,2,0),"") -> 
A581: Dept3-29171 | B581: Medio | C581: 41176 | D581: 41180 | E581: =+LEFT(RC[-4],5) -> Dept3 | F581: =+VLOOKUP(RC[-4],Enunciado!R3C6:R5C7,2,0)+RC[-3] -> 41191 | G581: =+IF(RC[-1]>=RC[-3],"ON TIME","OUT OF TIME") -> ON TIME | H581: =+YEAR(RC[-5]) -> 2012 | I581: =+MONTH(RC[-6]) -> 9 | J581: =+RC[-6]-RC[-7] -> 4 | K581: =+IF(RC[-4]="OUT of TIME",RC[-1]-VLOOKUP(RC[-9],Enunciado!R3C6:R5C7,2,0),"") -> 
A582: Dept3-23285 | B582: Alto | C582: 41234 | D582: 41255 | E582: =+LEFT(RC[-4],5) -> Dept3 | F582: =+VLOOKUP(RC[-4],Enunciado!R3C6:R5C7,2,0)+RC[-3] -> 41239 | G582: =+IF(RC[-1]>=RC[-3],"ON TIME","OUT OF TIME") -> OUT OF TIME | H582: =+YEAR(RC[-5]) -> 2012 | I582: =+MONTH(RC[-6]) -> 11 | J582: =+RC[-6]-RC[-7] -> 21 | K582: =+IF(RC[-4]="OUT of TIME",RC[-1]-VLOOKUP(RC[-9],Enunciado!R3C6:R5C7,2,0),"") -> 16
A583: Dept2-23206 | B583: Medio | C583: 41323 | D583: 41332 | E583: =+LEFT(RC[-4],5) -> Dept2 | F583: =+VLOOKUP(RC[-4],Enunciado!R3C6:R5C7,2,0)+RC[-3] -> 41338 | G583: =+IF(RC[-1]>=RC[-3],"ON TIME","OUT OF TIME") -> ON TIME | H583: =+YEAR(RC[-5]) -> 2013 | I583: =+MONTH(RC[-6]) -> 2 | J583: =+RC[-6]-RC[-7] -> 9 | K583: =+IF(RC[-4]="OUT of TIME",RC[-1]-VLOOKUP(RC[-9],Enunciado!R3C6:R5C7,2,0),"") -> 
A584: Dept5-3380 | B584: Alto | C584: 41061 | D584: 41081 | E584: =+LEFT(RC[-4],5) -> Dept5 | F584: =+VLOOKUP(RC[-4],Enunciado!R3C6:R5C7,2,0)+RC[-3] -> 41066 | G584: =+IF(RC[-1]>=RC[-3],"ON TIME","OUT OF TIME") -> OUT OF TIME | H584: =+YEAR(RC[-5]) -> 2012 | I584: =+MONTH(RC[-6]) -> 6 | J584: =+RC[-6]-RC[-7] -> 20 | K584: =+IF(RC[-4]="OUT of TIME",RC[-1]-VLOOKUP(RC[-9],Enunciado!R3C6:R5C7,2,0),"") -> 15
A585: Dept6-10879 | B585: Medio | C585: 41504 | D585: 41522 | E585: =+LEFT(RC[-4],5) -> Dept6 | F585: =+VLOOKUP(RC[-4],Enunciado!R3C6:R5C7,2,0)+RC[-3] -> 41519 | G585: =+IF(RC[-1]>=RC[-3],"ON TIME","OUT OF TIME") -> OUT OF TIME | H585: =+YEAR(RC[-5]) -> 2013 | I585: =+MONTH(RC[-6]) -> 8 | J585: =+RC[-6]-RC[-7] -> 18 | K585: =+IF(RC[-4]="OUT of TIME",RC[-1]-VLOOKUP(RC[-9],Enunciado!R3C6:R5C7,2,0),"") -> 3
A586: Dept2-11891 | B586: Alto | C586: 41526 | D586: 41530 | E586: =+LEFT(RC[-4],5) -> Dept2 | F586: =+VLOOKUP(RC[-4],Enunciado!R3C6:R5C7,2,0)+RC[-3] -> 41531 | G586: =+IF(RC[-1]>=RC[-3],"ON TIME","OUT OF TIME") -> ON TIME | H586: =+YEAR(RC[-5]) -> 2013 | I586: =+MONTH(RC[-6]) -> 9 | J586: =+RC[-6]-RC[-7] -> 4 | K586: =+IF(RC[-4]="OUT of TIME",RC[-1]-VLOOKUP(RC[-9],Enunciado!R3C6:R5C7,2,0),"") -> 
A587: Dept3-16282 | B587: Bajo | C587: 41079 | D587: 41079 | E587: =+LEFT(RC[-4],5) -> Dept3 | F587: =+VLOOKUP(RC[-4],Enunciado!R3C6:R5C7,2,0)+RC[-3] -> 41109 | G587: =+IF(RC[-1]>=RC[-3],"ON TIME","OUT OF TIME") -> ON TIME | H587: =+YEAR(RC[-5]) -> 2012 | I587: =+MONTH(RC[-6]) -> 6 | J587: =+RC[-6]-RC[-7] -> 0 | K587: =+IF(RC[-4]="OUT of TIME",RC[-1]-VLOOKUP(RC[-9],Enunciado!R3C6:R5C7,2,0),"") -> 
A588: Dept5-19373 | B588: Medio | C588: 41071 | D588: 41112 | E588: =+LEFT(RC[-4],5) -> Dept5 | F588: =+VLOOKUP(RC[-4],Enunciado!R3C6:R5C7,2,0)+RC[-3] -> 41086 | G588: =+IF(RC[-1]>=RC[-3],"ON TIME","OUT OF TIME") -> OUT OF TIME | H588: =+YEAR(RC[-5]) -> 2012 | I588: =+MONTH(RC[-6]) -> 6 | J588: =+RC[-6]-RC[-7] -> 41 | K588: =+IF(RC[-4]="OUT of TIME",RC[-1]-VLOOKUP(RC[-9],Enunciado!R3C6:R5C7,2,0),"") -> 26
A589: Dept3-18216 | B589: Medio | C589: 41440 | D589: 41442 | E589: =+LEFT(RC[-4],5) -> Dept3 | F589: =+VLOOKUP(RC[-4],Enunciado!R3C6:R5C7,2,0)+RC[-3] -> 41455 | G589: =+IF(RC[-1]>=RC[-3],"ON TIME","OUT OF TIME") -> ON TIME | H589: =+YEAR(RC[-5]) -> 2013 | I589: =+MONTH(RC[-6]) -> 6 | J589: =+RC[-6]-RC[-7] -> 2 | K589: =+IF(RC[-4]="OUT of TIME",RC[-1]-VLOOKUP(RC[-9],Enunciado!R3C6:R5C7,2,0),"") -> 
A590: Dept3-16224 | B590: Alto | C590: 41309 | D590: 41343 | E590: =+LEFT(RC[-4],5) -> Dept3 | F590: =+VLOOKUP(RC[-4],Enunciado!R3C6:R5C7,2,0)+RC[-3] -> 41314 | G590: =+IF(RC[-1]>=RC[-3],"ON TIME","OUT OF TIME") -> OUT OF TIME | H590: =+YEAR(RC[-5]) -> 2013 | I590: =+MONTH(RC[-6]) -> 2 | J590: =+RC[-6]-RC[-7] -> 34 | K590: =+IF(RC[-4]="OUT of TIME",RC[-1]-VLOOKUP(RC[-9],Enunciado!R3C6:R5C7,2,0),"") -> 29
A591: Dept1-29162 | B591: Medio | C591: 41447 | D591: 41463 | E591: =+LEFT(RC[-4],5) -> Dept1 | F591: =+VLOOKUP(RC[-4],Enunciado!R3C6:R5C7,2,0)+RC[-3] -> 41462 | G591: =+IF(RC[-1]>=RC[-3],"ON TIME","OUT OF TIME") -> OUT OF TIME | H591: =+YEAR(RC[-5]) -> 2013 | I591: =+MONTH(RC[-6]) -> 6 | J591: =+RC[-6]-RC[-7] -> 16 | K591: =+IF(RC[-4]="OUT of TIME",RC[-1]-VLOOKUP(RC[-9],Enunciado!R3C6:R5C7,2,0),"") -> 1
A592: Dept5-896 | B592: Medio | C592: 41386 | D592: 41389 | E592: =+LEFT(RC[-4],5) -> Dept5 | F592: =+VLOOKUP(RC[-4],Enunciado!R3C6:R5C7,2,0)+RC[-3] -> 41401 | G592: =+IF(RC[-1]>=RC[-3],"ON TIME","OUT OF TIME") -> ON TIME | H592: =+YEAR(RC[-5]) -> 2013 | I592: =+MONTH(RC[-6]) -> 4 | J592: =+RC[-6]-RC[-7] -> 3 | K592: =+IF(RC[-4]="OUT of TIME",RC[-1]-VLOOKUP(RC[-9],Enunciado!R3C6:R5C7,2,0),"") -> 
A593: Dept6-9365 | B593: Medio | C593: 41541 | D593: 41566 | E593: =+LEFT(RC[-4],5) -> Dept6 | F593: =+VLOOKUP(RC[-4],Enunciado!R3C6:R5C7,2,0)+RC[-3] -> 41556 | G593: =+IF(RC[-1]>=RC[-3],"ON TIME","OUT OF TIME") -> OUT OF TIME | H593: =+YEAR(RC[-5]) -> 2013 | I593: =+MONTH(RC[-6]) -> 9 | J593: =+RC[-6]-RC[-7] -> 25 | K593: =+IF(RC[-4]="OUT of TIME",RC[-1]-VLOOKUP(RC[-9],Enunciado!R3C6:R5C7,2,0),"") -> 10
A594: Dept3-26807 | B594: Bajo | C594: 41321 | D594: 41351 | E594: =+LEFT(RC[-4],5) -> Dept3 | F594: =+VLOOKUP(RC[-4],Enunciado!R3C6:R5C7,2,0)+RC[-3] -> 41351 | G594: =+IF(RC[-1]>=RC[-3],"ON TIME","OUT OF TIME") -> ON TIME | H594: =+YEAR(RC[-5]) -> 2013 | I594: =+MONTH(RC[-6]) -> 2 | J594: =+RC[-6]-RC[-7] -> 30 | K594: =+IF(RC[-4]="OUT of TIME",RC[-1]-VLOOKUP(RC[-9],Enunciado!R3C6:R5C7,2,0),"") -> 
A595: Dept1-20104 | B595: Bajo | C595: 41070 | D595: 41089 | E595: =+LEFT(RC[-4],5) -> Dept1 | F595: =+VLOOKUP(RC[-4],Enunciado!R3C6:R5C7,2,0)+RC[-3] -> 41100 | G595: =+IF(RC[-1]>=RC[-3],"ON TIME","OUT OF TIME") -> ON TIME | H595: =+YEAR(RC[-5]) -> 2012 | I595: =+MONTH(RC[-6]) -> 6 | J595: =+RC[-6]-RC[-7] -> 19 | K595: =+IF(RC[-4]="OUT of TIME",RC[-1]-VLOOKUP(RC[-9],Enunciado!R3C6:R5C7,2,0),"") -> 
A596: Dept6-3290 | B596: Medio | C596: 41205 | D596: 41211 | E596: =+LEFT(RC[-4],5) -> Dept6 | F596: =+VLOOKUP(RC[-4],Enunciado!R3C6:R5C7,2,0)+RC[-3] -> 41220 | G596: =+IF(RC[-1]>=RC[-3],"ON TIME","OUT OF TIME") -> ON TIME | H596: =+YEAR(RC[-5]) -> 2012 | I596: =+MONTH(RC[-6]) -> 10 | J596: =+RC[-6]-RC[-7] -> 6 | K596: =+IF(RC[-4]="OUT of TIME",RC[-1]-VLOOKUP(RC[-9],Enunciado!R3C6:R5C7,2,0),"") -> 
A597: Dept1-7697 | B597: Medio | C597: 41500 | D597: 41503 | E597: =+LEFT(RC[-4],5) -> Dept1 | F597: =+VLOOKUP(RC[-4],Enunciado!R3C6:R5C7,2,0)+RC[-3] -> 41515 | G597: =+IF(RC[-1]>=RC[-3],"ON TIME","OUT OF TIME") -> ON TIME | H597: =+YEAR(RC[-5]) -> 2013 | I597: =+MONTH(RC[-6]) -> 8 | J597: =+RC[-6]-RC[-7] -> 3 | K597: =+IF(RC[-4]="OUT of TIME",RC[-1]-VLOOKUP(RC[-9],Enunciado!R3C6:R5C7,2,0),"") -> 
A598: Dept6-3368 | B598: Bajo | C598: 41362 | D598: 41367 | E598: =+LEFT(RC[-4],5) -> Dept6 | F598: =+VLOOKUP(RC[-4],Enunciado!R3C6:R5C7,2,0)+RC[-3] -> 41392 | G598: =+IF(RC[-1]>=RC[-3],"ON TIME","OUT OF TIME") -> ON TIME | H598: =+YEAR(RC[-5]) -> 2013 | I598: =+MONTH(RC[-6]) -> 3 | J598: =+RC[-6]-RC[-7] -> 5 | K598: =+IF(RC[-4]="OUT of TIME",RC[-1]-VLOOKUP(RC[-9],Enunciado!R3C6:R5C7,2,0),"") -> 
A599: Dept4-27318 | B599: Bajo | C599: 41346 | D599: 41377 | E599: =+LEFT(RC[-4],5) -> Dept4 | F599: =+VLOOKUP(RC[-4],Enunciado!R3C6:R5C7,2,0)+RC[-3] -> 41376 | G599: =+IF(RC[-1]>=RC[-3],"ON TIME","OUT OF TIME") -> OUT OF TIME | H599: =+YEAR(RC[-5]) -> 2013 | I599: =+MONTH(RC[-6]) -> 3 | J599: =+RC[-6]-RC[-7] -> 31 | K599: =+IF(RC[-4]="OUT of TIME",RC[-1]-VLOOKUP(RC[-9],Enunciado!R3C6:R5C7,2,0),"") -> 1
A600: Dept2-8682 | B600: Bajo | C600: 41587 | D600: 41624 | E600: =+LEFT(RC[-4],5) -> Dept2 | F600: =+VLOOKUP(RC[-4],Enunciado!R3C6:R5C7,2,0)+RC[-3] -> 41617 | G600: =+IF(RC[-1]>=RC[-3],"ON TIME","OUT OF TIME") -> OUT OF TIME | H600: =+YEAR(RC[-5]) -> 2013 | I600: =+MONTH(RC[-6]) -> 11 | J600: =+RC[-6]-RC[-7] -> 37 | K600: =+IF(RC[-4]="OUT of TIME",RC[-1]-VLOOKUP(RC[-9],Enunciado!R3C6:R5C7,2,0),"") -> 7
A601: Dept6-13173 | B601: Medio | C601: 41518 | D601: 41520 | E601: =+LEFT(RC[-4],5) -> Dept6 | F601: =+VLOOKUP(RC[-4],Enunciado!R3C6:R5C7,2,0)+RC[-3] -> 41533 | G601: =+IF(RC[-1]>=RC[-3],"ON TIME","OUT OF TIME") -> ON TIME | H601: =+YEAR(RC[-5]) -> 2013 | I601: =+MONTH(RC[-6]) -> 9 | J601: =+RC[-6]-RC[-7] -> 2 | K601: =+IF(RC[-4]="OUT of TIME",RC[-1]-VLOOKUP(RC[-9],Enunciado!R3C6:R5C7,2,0),"") -> 
A602: Dept3-9378 | B602: Alto | C602: 40993 | D602: 41000 | E602: =+LEFT(RC[-4],5) -> Dept3 | F602: =+VLOOKUP(RC[-4],Enunciado!R3C6:R5C7,2,0)+RC[-3] -> 40998 | G602: =+IF(RC[-1]>=RC[-3],"ON TIME","OUT OF TIME") -> OUT OF TIME | H602: =+YEAR(RC[-5]) -> 2012 | I602: =+MONTH(RC[-6]) -> 3 | J602: =+RC[-6]-RC[-7] -> 7 | K602: =+IF(RC[-4]="OUT of TIME",RC[-1]-VLOOKUP(RC[-9],Enunciado!R3C6:R5C7,2,0),"") -> 2
A603: Dept3-9118 | B603: Medio | C603: 41355 | D603: 41376 | E603: =+LEFT(RC[-4],5) -> Dept3 | F603: =+VLOOKUP(RC[-4],Enunciado!R3C6:R5C7,2,0)+RC[-3] -> 41370 | G603: =+IF(RC[-1]>=RC[-3],"ON TIME","OUT OF TIME") -> OUT OF TIME | H603: =+YEAR(RC[-5]) -> 2013 | I603: =+MONTH(RC[-6]) -> 3 | J603: =+RC[-6]-RC[-7] -> 21 | K603: =+IF(RC[-4]="OUT of TIME",RC[-1]-VLOOKUP(RC[-9],Enunciado!R3C6:R5C7,2,0),"") -> 6
A604: Dept5-4268 | B604: Medio | C604: 41638 | D604: 41639 | E604: =+LEFT(RC[-4],5) -> Dept5 | F604: =+VLOOKUP(RC[-4],Enunciado!R3C6:R5C7,2,0)+RC[-3] -> 41653 | G604: =+IF(RC[-1]>=RC[-3],"ON TIME","OUT OF TIME") -> ON TIME | H604: =+YEAR(RC[-5]) -> 2013 | I604: =+MONTH(RC[-6]) -> 12 | J604: =+RC[-6]-RC[-7] -> 1 | K604: =+IF(RC[-4]="OUT of TIME",RC[-1]-VLOOKUP(RC[-9],Enunciado!R3C6:R5C7,2,0),"") -> 
A605: Dept3-11253 | B605: Medio | C605: 41084 | D605: 41088 | E605: =+LEFT(RC[-4],5) -> Dept3 | F605: =+VLOOKUP(RC[-4],Enunciado!R3C6:R5C7,2,0)+RC[-3] -> 41099 | G605: =+IF(RC[-1]>=RC[-3],"ON TIME","OUT OF TIME") -> ON TIME | H605: =+YEAR(RC[-5]) -> 2012 | I605: =+MONTH(RC[-6]) -> 6 | J605: =+RC[-6]-RC[-7] -> 4 | K605: =+IF(RC[-4]="OUT of TIME",RC[-1]-VLOOKUP(RC[-9],Enunciado!R3C6:R5C7,2,0),"") -> 
A606: Dept3-24078 | B606: Bajo | C606: 41463 | D606: 41463 | E606: =+LEFT(RC[-4],5) -> Dept3 | F606: =+VLOOKUP(RC[-4],Enunciado!R3C6:R5C7,2,0)+RC[-3] -> 41493 | G606: =+IF(RC[-1]>=RC[-3],"ON TIME","OUT OF TIME") -> ON TIME | H606: =+YEAR(RC[-5]) -> 2013 | I606: =+MONTH(RC[-6]) -> 7 | J606: =+RC[-6]-RC[-7] -> 0 | K606: =+IF(RC[-4]="OUT of TIME",RC[-1]-VLOOKUP(RC[-9],Enunciado!R3C6:R5C7,2,0),"") -> 
A607: Dept1-21585 | B607: Alto | C607: 41055 | D607: 41074 | E607: =+LEFT(RC[-4],5) -> Dept1 | F607: =+VLOOKUP(RC[-4],Enunciado!R3C6:R5C7,2,0)+RC[-3] -> 41060 | G607: =+IF(RC[-1]>=RC[-3],"ON TIME","OUT OF TIME") -> OUT OF TIME | H607: =+YEAR(RC[-5]) -> 2012 | I607: =+MONTH(RC[-6]) -> 5 | J607: =+RC[-6]-RC[-7] -> 19 | K607: =+IF(RC[-4]="OUT of TIME",RC[-1]-VLOOKUP(RC[-9],Enunciado!R3C6:R5C7,2,0),"") -> 14
A608: Dept4-8092 | B608: Alto | C608: 41075 | D608: 41076 | E608: =+LEFT(RC[-4],5) -> Dept4 | F608: =+VLOOKUP(RC[-4],Enunciado!R3C6:R5C7,2,0)+RC[-3] -> 41080 | G608: =+IF(RC[-1]>=RC[-3],"ON TIME","OUT OF TIME") -> ON TIME | H608: =+YEAR(RC[-5]) -> 2012 | I608: =+MONTH(RC[-6]) -> 6 | J608: =+RC[-6]-RC[-7] -> 1 | K608: =+IF(RC[-4]="OUT of TIME",RC[-1]-VLOOKUP(RC[-9],Enunciado!R3C6:R5C7,2,0),"") -> 
A609: Dept1-19300 | B609: Alto | C609: 40979 | D609: 40997 | E609: =+LEFT(RC[-4],5) -> Dept1 | F609: =+VLOOKUP(RC[-4],Enunciado!R3C6:R5C7,2,0)+RC[-3] -> 40984 | G609: =+IF(RC[-1]>=RC[-3],"ON TIME","OUT OF TIME") -> OUT OF TIME | H609: =+YEAR(RC[-5]) -> 2012 | I609: =+MONTH(RC[-6]) -> 3 | J609: =+RC[-6]-RC[-7] -> 18 | K609: =+IF(RC[-4]="OUT of TIME",RC[-1]-VLOOKUP(RC[-9],Enunciado!R3C6:R5C7,2,0),"") -> 13
A610: Dept2-2012 | B610: Bajo | C610: 41361 | D610: 41365 | E610: =+LEFT(RC[-4],5) -> Dept2 | F610: =+VLOOKUP(RC[-4],Enunciado!R3C6:R5C7,2,0)+RC[-3] -> 41391 | G610: =+IF(RC[-1]>=RC[-3],"ON TIME","OUT OF TIME") -> ON TIME | H610: =+YEAR(RC[-5]) -> 2013 | I610: =+MONTH(RC[-6]) -> 3 | J610: =+RC[-6]-RC[-7] -> 4 | K610: =+IF(RC[-4]="OUT of TIME",RC[-1]-VLOOKUP(RC[-9],Enunciado!R3C6:R5C7,2,0),"") -> 
A611: Dept1-13718 | B611: Medio | C611: 41222 | D611: 41226 | E611: =+LEFT(RC[-4],5) -> Dept1 | F611: =+VLOOKUP(RC[-4],Enunciado!R3C6:R5C7,2,0)+RC[-3] -> 41237 | G611: =+IF(RC[-1]>=RC[-3],"ON TIME","OUT OF TIME") -> ON TIME | H611: =+YEAR(RC[-5]) -> 2012 | I611: =+MONTH(RC[-6]) -> 11 | J611: =+RC[-6]-RC[-7] -> 4 | K611: =+IF(RC[-4]="OUT of TIME",RC[-1]-VLOOKUP(RC[-9],Enunciado!R3C6:R5C7,2,0),"") -> 
A612: Dept2-12331 | B612: Alto | C612: 41574 | D612: 41578 | E612: =+LEFT(RC[-4],5) -> Dept2 | F612: =+VLOOKUP(RC[-4],Enunciado!R3C6:R5C7,2,0)+RC[-3] -> 41579 | G612: =+IF(RC[-1]>=RC[-3],"ON TIME","OUT OF TIME") -> ON TIME | H612: =+YEAR(RC[-5]) -> 2013 | I612: =+MONTH(RC[-6]) -> 10 | J612: =+RC[-6]-RC[-7] -> 4 | K612: =+IF(RC[-4]="OUT of TIME",RC[-1]-VLOOKUP(RC[-9],Enunciado!R3C6:R5C7,2,0),"") -> 
A613: Dept6-20488 | B613: Medio | C613: 41273 | D613: 41286 | E613: =+LEFT(RC[-4],5) -> Dept6 | F613: =+VLOOKUP(RC[-4],Enunciado!R3C6:R5C7,2,0)+RC[-3] -> 41288 | G613: =+IF(RC[-1]>=RC[-3],"ON TIME","OUT OF TIME") -> ON TIME | H613: =+YEAR(RC[-5]) -> 2012 | I613: =+MONTH(RC[-6]) -> 12 | J613: =+RC[-6]-RC[-7] -> 13 | K613: =+IF(RC[-4]="OUT of TIME",RC[-1]-VLOOKUP(RC[-9],Enunciado!R3C6:R5C7,2,0),"") -> 
A614: Dept6-57 | B614: Alto | C614: 41554 | D614: 41554 | E614: =+LEFT(RC[-4],5) -> Dept6 | F614: =+VLOOKUP(RC[-4],Enunciado!R3C6:R5C7,2,0)+RC[-3] -> 41559 | G614: =+IF(RC[-1]>=RC[-3],"ON TIME","OUT OF TIME") -> ON TIME | H614: =+YEAR(RC[-5]) -> 2013 | I614: =+MONTH(RC[-6]) -> 10 | J614: =+RC[-6]-RC[-7] -> 0 | K614: =+IF(RC[-4]="OUT of TIME",RC[-1]-VLOOKUP(RC[-9],Enunciado!R3C6:R5C7,2,0),"") -> 
A615: Dept6-20093 | B615: Alto | C615: 40954 | D615: 40964 | E615: =+LEFT(RC[-4],5) -> Dept6 | F615: =+VLOOKUP(RC[-4],Enunciado!R3C6:R5C7,2,0)+RC[-3] -> 40959 | G615: =+IF(RC[-1]>=RC[-3],"ON TIME","OUT OF TIME") -> OUT OF TIME | H615: =+YEAR(RC[-5]) -> 2012 | I615: =+MONTH(RC[-6]) -> 2 | J615: =+RC[-6]-RC[-7] -> 10 | K615: =+IF(RC[-4]="OUT of TIME",RC[-1]-VLOOKUP(RC[-9],Enunciado!R3C6:R5C7,2,0),"") -> 5
A616: Dept2-24072 | B616: Alto | C616: 41172 | D616: 41194 | E616: =+LEFT(RC[-4],5) -> Dept2 | F616: =+VLOOKUP(RC[-4],Enunciado!R3C6:R5C7,2,0)+RC[-3] -> 41177 | G616: =+IF(RC[-1]>=RC[-3],"ON TIME","OUT OF TIME") -> OUT OF TIME | H616: =+YEAR(RC[-5]) -> 2012 | I616: =+MONTH(RC[-6]) -> 9 | J616: =+RC[-6]-RC[-7] -> 22 | K616: =+IF(RC[-4]="OUT of TIME",RC[-1]-VLOOKUP(RC[-9],Enunciado!R3C6:R5C7,2,0),"") -> 17
A617: Dept3-25210 | B617: Bajo | C617: 41594 | D617: 41595 | E617: =+LEFT(RC[-4],5) -> Dept3 | F617: =+VLOOKUP(RC[-4],Enunciado!R3C6:R5C7,2,0)+RC[-3] -> 41624 | G617: =+IF(RC[-1]>=RC[-3],"ON TIME","OUT OF TIME") -> ON TIME | H617: =+YEAR(RC[-5]) -> 2013 | I617: =+MONTH(RC[-6]) -> 11 | J617: =+RC[-6]-RC[-7] -> 1 | K617: =+IF(RC[-4]="OUT of TIME",RC[-1]-VLOOKUP(RC[-9],Enunciado!R3C6:R5C7,2,0),"") -> 
A618: Dept3-11958 | B618: Bajo | C618: 40911 | D618: 40953 | E618: =+LEFT(RC[-4],5) -> Dept3 | F618: =+VLOOKUP(RC[-4],Enunciado!R3C6:R5C7,2,0)+RC[-3] -> 40941 | G618: =+IF(RC[-1]>=RC[-3],"ON TIME","OUT OF TIME") -> OUT OF TIME | H618: =+YEAR(RC[-5]) -> 2012 | I618: =+MONTH(RC[-6]) -> 1 | J618: =+RC[-6]-RC[-7] -> 42 | K618: =+IF(RC[-4]="OUT of TIME",RC[-1]-VLOOKUP(RC[-9],Enunciado!R3C6:R5C7,2,0),"") -> 12
A619: Dept3-1018 | B619: Alto | C619: 41431 | D619: 41432 | E619: =+LEFT(RC[-4],5) -> Dept3 | F619: =+VLOOKUP(RC[-4],Enunciado!R3C6:R5C7,2,0)+RC[-3] -> 41436 | G619: =+IF(RC[-1]>=RC[-3],"ON TIME","OUT OF TIME") -> ON TIME | H619: =+YEAR(RC[-5]) -> 2013 | I619: =+MONTH(RC[-6]) -> 6 | J619: =+RC[-6]-RC[-7] -> 1 | K619: =+IF(RC[-4]="OUT of TIME",RC[-1]-VLOOKUP(RC[-9],Enunciado!R3C6:R5C7,2,0),"") -> 
A620: Dept6-23597 | B620: Medio | C620: 41126 | D620: 41168 | E620: =+LEFT(RC[-4],5) -> Dept6 | F620: =+VLOOKUP(RC[-4],Enunciado!R3C6:R5C7,2,0)+RC[-3] -> 41141 | G620: =+IF(RC[-1]>=RC[-3],"ON TIME","OUT OF TIME") -> OUT OF TIME | H620: =+YEAR(RC[-5]) -> 2012 | I620: =+MONTH(RC[-6]) -> 8 | J620: =+RC[-6]-RC[-7] -> 42 | K620: =+IF(RC[-4]="OUT of TIME",RC[-1]-VLOOKUP(RC[-9],Enunciado!R3C6:R5C7,2,0),"") -> 27
A621: Dept3-19980 | B621: Alto | C621: 41074 | D621: 41085 | E621: =+LEFT(RC[-4],5) -> Dept3 | F621: =+VLOOKUP(RC[-4],Enunciado!R3C6:R5C7,2,0)+RC[-3] -> 41079 | G621: =+IF(RC[-1]>=RC[-3],"ON TIME","OUT OF TIME") -> OUT OF TIME | H621: =+YEAR(RC[-5]) -> 2012 | I621: =+MONTH(RC[-6]) -> 6 | J621: =+RC[-6]-RC[-7] -> 11 | K621: =+IF(RC[-4]="OUT of TIME",RC[-1]-VLOOKUP(RC[-9],Enunciado!R3C6:R5C7,2,0),"") -> 6
A622: Dept4-20354 | B622: Bajo | C622: 40912 | D622: 40916 | E622: =+LEFT(RC[-4],5) -> Dept4 | F622: =+VLOOKUP(RC[-4],Enunciado!R3C6:R5C7,2,0)+RC[-3] -> 40942 | G622: =+IF(RC[-1]>=RC[-3],"ON TIME","OUT OF TIME") -> ON TIME | H622: =+YEAR(RC[-5]) -> 2012 | I622: =+MONTH(RC[-6]) -> 1 | J622: =+RC[-6]-RC[-7] -> 4 | K622: =+IF(RC[-4]="OUT of TIME",RC[-1]-VLOOKUP(RC[-9],Enunciado!R3C6:R5C7,2,0),"") -> 
A623: Dept1-20191 | B623: Medio | C623: 41075 | D623: 41075 | E623: =+LEFT(RC[-4],5) -> Dept1 | F623: =+VLOOKUP(RC[-4],Enunciado!R3C6:R5C7,2,0)+RC[-3] -> 41090 | G623: =+IF(RC[-1]>=RC[-3],"ON TIME","OUT OF TIME") -> ON TIME | H623: =+YEAR(RC[-5]) -> 2012 | I623: =+MONTH(RC[-6]) -> 6 | J623: =+RC[-6]-RC[-7] -> 0 | K623: =+IF(RC[-4]="OUT of TIME",RC[-1]-VLOOKUP(RC[-9],Enunciado!R3C6:R5C7,2,0),"") -> 
A624: Dept5-20161 | B624: Bajo | C624: 41544 | D624: 41547 | E624: =+LEFT(RC[-4],5) -> Dept5 | F624: =+VLOOKUP(RC[-4],Enunciado!R3C6:R5C7,2,0)+RC[-3] -> 41574 | G624: =+IF(RC[-1]>=RC[-3],"ON TIME","OUT OF TIME") -> ON TIME | H624: =+YEAR(RC[-5]) -> 2013 | I624: =+MONTH(RC[-6]) -> 9 | J624: =+RC[-6]-RC[-7] -> 3 | K624: =+IF(RC[-4]="OUT of TIME",RC[-1]-VLOOKUP(RC[-9],Enunciado!R3C6:R5C7,2,0),"") -> 
A625: Dept6-13840 | B625: Medio | C625: 41244 | D625: 41256 | E625: =+LEFT(RC[-4],5) -> Dept6 | F625: =+VLOOKUP(RC[-4],Enunciado!R3C6:R5C7,2,0)+RC[-3] -> 41259 | G625: =+IF(RC[-1]>=RC[-3],"ON TIME","OUT OF TIME") -> ON TIME | H625: =+YEAR(RC[-5]) -> 2012 | I625: =+MONTH(RC[-6]) -> 12 | J625: =+RC[-6]-RC[-7] -> 12 | K625: =+IF(RC[-4]="OUT of TIME",RC[-1]-VLOOKUP(RC[-9],Enunciado!R3C6:R5C7,2,0),"") -> 
A626: Dept6-26312 | B626: Bajo | C626: 41395 | D626: 41430 | E626: =+LEFT(RC[-4],5) -> Dept6 | F626: =+VLOOKUP(RC[-4],Enunciado!R3C6:R5C7,2,0)+RC[-3] -> 41425 | G626: =+IF(RC[-1]>=RC[-3],"ON TIME","OUT OF TIME") -> OUT OF TIME | H626: =+YEAR(RC[-5]) -> 2013 | I626: =+MONTH(RC[-6]) -> 5 | J626: =+RC[-6]-RC[-7] -> 35 | K626: =+IF(RC[-4]="OUT of TIME",RC[-1]-VLOOKUP(RC[-9],Enunciado!R3C6:R5C7,2,0),"") -> 5
A627: Dept5-9852 | B627: Bajo | C627: 40935 | D627: 40935 | E627: =+LEFT(RC[-4],5) -> Dept5 | F627: =+VLOOKUP(RC[-4],Enunciado!R3C6:R5C7,2,0)+RC[-3] -> 40965 | G627: =+IF(RC[-1]>=RC[-3],"ON TIME","OUT OF TIME") -> ON TIME | H627: =+YEAR(RC[-5]) -> 2012 | I627: =+MONTH(RC[-6]) -> 1 | J627: =+RC[-6]-RC[-7] -> 0 | K627: =+IF(RC[-4]="OUT of TIME",RC[-1]-VLOOKUP(RC[-9],Enunciado!R3C6:R5C7,2,0),"") -> 
A628: Dept4-25277 | B628: Bajo | C628: 41191 | D628: 41191 | E628: =+LEFT(RC[-4],5) -> Dept4 | F628: =+VLOOKUP(RC[-4],Enunciado!R3C6:R5C7,2,0)+RC[-3] -> 41221 | G628: =+IF(RC[-1]>=RC[-3],"ON TIME","OUT OF TIME") -> ON TIME | H628: =+YEAR(RC[-5]) -> 2012 | I628: =+MONTH(RC[-6]) -> 10 | J628: =+RC[-6]-RC[-7] -> 0 | K628: =+IF(RC[-4]="OUT of TIME",RC[-1]-VLOOKUP(RC[-9],Enunciado!R3C6:R5C7,2,0),"") -> 
A629: Dept1-2271 | B629: Alto | C629: 41026 | D629: 41034 | E629: =+LEFT(RC[-4],5) -> Dept1 | F629: =+VLOOKUP(RC[-4],Enunciado!R3C6:R5C7,2,0)+RC[-3] -> 41031 | G629: =+IF(RC[-1]>=RC[-3],"ON TIME","OUT OF TIME") -> OUT OF TIME | H629: =+YEAR(RC[-5]) -> 2012 | I629: =+MONTH(RC[-6]) -> 4 | J629: =+RC[-6]-RC[-7] -> 8 | K629: =+IF(RC[-4]="OUT of TIME",RC[-1]-VLOOKUP(RC[-9],Enunciado!R3C6:R5C7,2,0),"") -> 3
A630: Dept2-26359 | B630: Bajo | C630: 40990 | D630: 41008 | E630: =+LEFT(RC[-4],5) -> Dept2 | F630: =+VLOOKUP(RC[-4],Enunciado!R3C6:R5C7,2,0)+RC[-3] -> 41020 | G630: =+IF(RC[-1]>=RC[-3],"ON TIME","OUT OF TIME") -> ON TIME | H630: =+YEAR(RC[-5]) -> 2012 | I630: =+MONTH(RC[-6]) -> 3 | J630: =+RC[-6]-RC[-7] -> 18 | K630: =+IF(RC[-4]="OUT of TIME",RC[-1]-VLOOKUP(RC[-9],Enunciado!R3C6:R5C7,2,0),"") -> 
A631: Dept2-23446 | B631: Alto | C631: 41582 | D631: 41583 | E631: =+LEFT(RC[-4],5) -> Dept2 | F631: =+VLOOKUP(RC[-4],Enunciado!R3C6:R5C7,2,0)+RC[-3] -> 41587 | G631: =+IF(RC[-1]>=RC[-3],"ON TIME","OUT OF TIME") -> ON TIME | H631: =+YEAR(RC[-5]) -> 2013 | I631: =+MONTH(RC[-6]) -> 11 | J631: =+RC[-6]-RC[-7] -> 1 | K631: =+IF(RC[-4]="OUT of TIME",RC[-1]-VLOOKUP(RC[-9],Enunciado!R3C6:R5C7,2,0),"") -> 
A632: Dept1-3494 | B632: Medio | C632: 41159 | D632: 41196 | E632: =+LEFT(RC[-4],5) -> Dept1 | F632: =+VLOOKUP(RC[-4],Enunciado!R3C6:R5C7,2,0)+RC[-3] -> 41174 | G632: =+IF(RC[-1]>=RC[-3],"ON TIME","OUT OF TIME") -> OUT OF TIME | H632: =+YEAR(RC[-5]) -> 2012 | I632: =+MONTH(RC[-6]) -> 9 | J632: =+RC[-6]-RC[-7] -> 37 | K632: =+IF(RC[-4]="OUT of TIME",RC[-1]-VLOOKUP(RC[-9],Enunciado!R3C6:R5C7,2,0),"") -> 22
A633: Dept2-28592 | B633: Alto | C633: 41175 | D633: 41178 | E633: =+LEFT(RC[-4],5) -> Dept2 | F633: =+VLOOKUP(RC[-4],Enunciado!R3C6:R5C7,2,0)+RC[-3] -> 41180 | G633: =+IF(RC[-1]>=RC[-3],"ON TIME","OUT OF TIME") -> ON TIME | H633: =+YEAR(RC[-5]) -> 2012 | I633: =+MONTH(RC[-6]) -> 9 | J633: =+RC[-6]-RC[-7] -> 3 | K633: =+IF(RC[-4]="OUT of TIME",RC[-1]-VLOOKUP(RC[-9],Enunciado!R3C6:R5C7,2,0),"") -> 
A634: Dept5-27013 | B634: Alto | C634: 40917 | D634: 40919 | E634: =+LEFT(RC[-4],5) -> Dept5 | F634: =+VLOOKUP(RC[-4],Enunciado!R3C6:R5C7,2,0)+RC[-3] -> 40922 | G634: =+IF(RC[-1]>=RC[-3],"ON TIME","OUT OF TIME") -> ON TIME | H634: =+YEAR(RC[-5]) -> 2012 | I634: =+MONTH(RC[-6]) -> 1 | J634: =+RC[-6]-RC[-7] -> 2 | K634: =+IF(RC[-4]="OUT of TIME",RC[-1]-VLOOKUP(RC[-9],Enunciado!R3C6:R5C7,2,0),"") -> 
A635: Dept6-15772 | B635: Alto | C635: 41375 | D635: 41379 | E635: =+LEFT(RC[-4],5) -> Dept6 | F635: =+VLOOKUP(RC[-4],Enunciado!R3C6:R5C7,2,0)+RC[-3] -> 41380 | G635: =+IF(RC[-1]>=RC[-3],"ON TIME","OUT OF TIME") -> ON TIME | H635: =+YEAR(RC[-5]) -> 2013 | I635: =+MONTH(RC[-6]) -> 4 | J635: =+RC[-6]-RC[-7] -> 4 | K635: =+IF(RC[-4]="OUT of TIME",RC[-1]-VLOOKUP(RC[-9],Enunciado!R3C6:R5C7,2,0),"") -> 
A636: Dept2-10679 | B636: Bajo | C636: 41029 | D636: 41052 | E636: =+LEFT(RC[-4],5) -> Dept2 | F636: =+VLOOKUP(RC[-4],Enunciado!R3C6:R5C7,2,0)+RC[-3] -> 41059 | G636: =+IF(RC[-1]>=RC[-3],"ON TIME","OUT OF TIME") -> ON TIME | H636: =+YEAR(RC[-5]) -> 2012 | I636: =+MONTH(RC[-6]) -> 4 | J636: =+RC[-6]-RC[-7] -> 23 | K636: =+IF(RC[-4]="OUT of TIME",RC[-1]-VLOOKUP(RC[-9],Enunciado!R3C6:R5C7,2,0),"") -> 
A637: Dept2-12874 | B637: Bajo | C637: 41242 | D637: 41246 | E637: =+LEFT(RC[-4],5) -> Dept2 | F637: =+VLOOKUP(RC[-4],Enunciado!R3C6:R5C7,2,0)+RC[-3] -> 41272 | G637: =+IF(RC[-1]>=RC[-3],"ON TIME","OUT OF TIME") -> ON TIME | H637: =+YEAR(RC[-5]) -> 2012 | I637: =+MONTH(RC[-6]) -> 11 | J637: =+RC[-6]-RC[-7] -> 4 | K637: =+IF(RC[-4]="OUT of TIME",RC[-1]-VLOOKUP(RC[-9],Enunciado!R3C6:R5C7,2,0),"") -> 
A638: Dept6-6810 | B638: Alto | C638: 41284 | D638: 41285 | E638: =+LEFT(RC[-4],5) -> Dept6 | F638: =+VLOOKUP(RC[-4],Enunciado!R3C6:R5C7,2,0)+RC[-3] -> 41289 | G638: =+IF(RC[-1]>=RC[-3],"ON TIME","OUT OF TIME") -> ON TIME | H638: =+YEAR(RC[-5]) -> 2013 | I638: =+MONTH(RC[-6]) -> 1 | J638: =+RC[-6]-RC[-7] -> 1 | K638: =+IF(RC[-4]="OUT of TIME",RC[-1]-VLOOKUP(RC[-9],Enunciado!R3C6:R5C7,2,0),"") -> 
A639: Dept5-20644 | B639: Bajo | C639: 41159 | D639: 41161 | E639: =+LEFT(RC[-4],5) -> Dept5 | F639: =+VLOOKUP(RC[-4],Enunciado!R3C6:R5C7,2,0)+RC[-3] -> 41189 | G639: =+IF(RC[-1]>=RC[-3],"ON TIME","OUT OF TIME") -> ON TIME | H639: =+YEAR(RC[-5]) -> 2012 | I639: =+MONTH(RC[-6]) -> 9 | J639: =+RC[-6]-RC[-7] -> 2 | K639: =+IF(RC[-4]="OUT of TIME",RC[-1]-VLOOKUP(RC[-9],Enunciado!R3C6:R5C7,2,0),"") -> 
A640: Dept4-9798 | B640: Alto | C640: 41141 | D640: 41145 | E640: =+LEFT(RC[-4],5) -> Dept4 | F640: =+VLOOKUP(RC[-4],Enunciado!R3C6:R5C7,2,0)+RC[-3] -> 41146 | G640: =+IF(RC[-1]>=RC[-3],"ON TIME","OUT OF TIME") -> ON TIME | H640: =+YEAR(RC[-5]) -> 2012 | I640: =+MONTH(RC[-6]) -> 8 | J640: =+RC[-6]-RC[-7] -> 4 | K640: =+IF(RC[-4]="OUT of TIME",RC[-1]-VLOOKUP(RC[-9],Enunciado!R3C6:R5C7,2,0),"") -> 
A641: Dept2-8339 | B641: Medio | C641: 41158 | D641: 41171 | E641: =+LEFT(RC[-4],5) -> Dept2 | F641: =+VLOOKUP(RC[-4],Enunciado!R3C6:R5C7,2,0)+RC[-3] -> 41173 | G641: =+IF(RC[-1]>=RC[-3],"ON TIME","OUT OF TIME") -> ON TIME | H641: =+YEAR(RC[-5]) -> 2012 | I641: =+MONTH(RC[-6]) -> 9 | J641: =+RC[-6]-RC[-7] -> 13 | K641: =+IF(RC[-4]="OUT of TIME",RC[-1]-VLOOKUP(RC[-9],Enunciado!R3C6:R5C7,2,0),"") -> 
A642: Dept3-5842 | B642: Medio | C642: 41365 | D642: 41367 | E642: =+LEFT(RC[-4],5) -> Dept3 | F642: =+VLOOKUP(RC[-4],Enunciado!R3C6:R5C7,2,0)+RC[-3] -> 41380 | G642: =+IF(RC[-1]>=RC[-3],"ON TIME","OUT OF TIME") -> ON TIME | H642: =+YEAR(RC[-5]) -> 2013 | I642: =+MONTH(RC[-6]) -> 4 | J642: =+RC[-6]-RC[-7] -> 2 | K642: =+IF(RC[-4]="OUT of TIME",RC[-1]-VLOOKUP(RC[-9],Enunciado!R3C6:R5C7,2,0),"") -> 
A643: Dept4-6048 | B643: Bajo | C643: 40969 | D643: 40978 | E643: =+LEFT(RC[-4],5) -> Dept4 | F643: =+VLOOKUP(RC[-4],Enunciado!R3C6:R5C7,2,0)+RC[-3] -> 40999 | G643: =+IF(RC[-1]>=RC[-3],"ON TIME","OUT OF TIME") -> ON TIME | H643: =+YEAR(RC[-5]) -> 2012 | I643: =+MONTH(RC[-6]) -> 3 | J643: =+RC[-6]-RC[-7] -> 9 | K643: =+IF(RC[-4]="OUT of TIME",RC[-1]-VLOOKUP(RC[-9],Enunciado!R3C6:R5C7,2,0),"") -> 
A644: Dept3-24200 | B644: Bajo | C644: 41537 | D644: 41559 | E644: =+LEFT(RC[-4],5) -> Dept3 | F644: =+VLOOKUP(RC[-4],Enunciado!R3C6:R5C7,2,0)+RC[-3] -> 41567 | G644: =+IF(RC[-1]>=RC[-3],"ON TIME","OUT OF TIME") -> ON TIME | H644: =+YEAR(RC[-5]) -> 2013 | I644: =+MONTH(RC[-6]) -> 9 | J644: =+RC[-6]-RC[-7] -> 22 | K644: =+IF(RC[-4]="OUT of TIME",RC[-1]-VLOOKUP(RC[-9],Enunciado!R3C6:R5C7,2,0),"") -> 
A645: Dept5-15271 | B645: Bajo | C645: 41540 | D645: 41581 | E645: =+LEFT(RC[-4],5) -> Dept5 | F645: =+VLOOKUP(RC[-4],Enunciado!R3C6:R5C7,2,0)+RC[-3] -> 41570 | G645: =+IF(RC[-1]>=RC[-3],"ON TIME","OUT OF TIME") -> OUT OF TIME | H645: =+YEAR(RC[-5]) -> 2013 | I645: =+MONTH(RC[-6]) -> 9 | J645: =+RC[-6]-RC[-7] -> 41 | K645: =+IF(RC[-4]="OUT of TIME",RC[-1]-VLOOKUP(RC[-9],Enunciado!R3C6:R5C7,2,0),"") -> 11
A646: Dept1-12783 | B646: Medio | C646: 41494 | D646: 41496 | E646: =+LEFT(RC[-4],5) -> Dept1 | F646: =+VLOOKUP(RC[-4],Enunciado!R3C6:R5C7,2,0)+RC[-3] -> 41509 | G646: =+IF(RC[-1]>=RC[-3],"ON TIME","OUT OF TIME") -> ON TIME | H646: =+YEAR(RC[-5]) -> 2013 | I646: =+MONTH(RC[-6]) -> 8 | J646: =+RC[-6]-RC[-7] -> 2 | K646: =+IF(RC[-4]="OUT of TIME",RC[-1]-VLOOKUP(RC[-9],Enunciado!R3C6:R5C7,2,0),"") -> 
A647: Dept5-6791 | B647: Alto | C647: 40964 | D647: 40979 | E647: =+LEFT(RC[-4],5) -> Dept5 | F647: =+VLOOKUP(RC[-4],Enunciado!R3C6:R5C7,2,0)+RC[-3] -> 40969 | G647: =+IF(RC[-1]>=RC[-3],"ON TIME","OUT OF TIME") -> OUT OF TIME | H647: =+YEAR(RC[-5]) -> 2012 | I647: =+MONTH(RC[-6]) -> 2 | J647: =+RC[-6]-RC[-7] -> 15 | K647: =+IF(RC[-4]="OUT of TIME",RC[-1]-VLOOKUP(RC[-9],Enunciado!R3C6:R5C7,2,0),"") -> 10
A648: Dept4-28394 | B648: Alto | C648: 41265 | D648: 41284 | E648: =+LEFT(RC[-4],5) -> Dept4 | F648: =+VLOOKUP(RC[-4],Enunciado!R3C6:R5C7,2,0)+RC[-3] -> 41270 | G648: =+IF(RC[-1]>=RC[-3],"ON TIME","OUT OF TIME") -> OUT OF TIME | H648: =+YEAR(RC[-5]) -> 2012 | I648: =+MONTH(RC[-6]) -> 12 | J648: =+RC[-6]-RC[-7] -> 19 | K648: =+IF(RC[-4]="OUT of TIME",RC[-1]-VLOOKUP(RC[-9],Enunciado!R3C6:R5C7,2,0),"") -> 14
A649: Dept4-12420 | B649: Medio | C649: 41053 | D649: 41056 | E649: =+LEFT(RC[-4],5) -> Dept4 | F649: =+VLOOKUP(RC[-4],Enunciado!R3C6:R5C7,2,0)+RC[-3] -> 41068 | G649: =+IF(RC[-1]>=RC[-3],"ON TIME","OUT OF TIME") -> ON TIME | H649: =+YEAR(RC[-5]) -> 2012 | I649: =+MONTH(RC[-6]) -> 5 | J649: =+RC[-6]-RC[-7] -> 3 | K649: =+IF(RC[-4]="OUT of TIME",RC[-1]-VLOOKUP(RC[-9],Enunciado!R3C6:R5C7,2,0),"") -> 
A650: Dept6-9425 | B650: Alto | C650: 41251 | D650: 41287 | E650: =+LEFT(RC[-4],5) -> Dept6 | F650: =+VLOOKUP(RC[-4],Enunciado!R3C6:R5C7,2,0)+RC[-3] -> 41256 | G650: =+IF(RC[-1]>=RC[-3],"ON TIME","OUT OF TIME") -> OUT OF TIME | H650: =+YEAR(RC[-5]) -> 2012 | I650: =+MONTH(RC[-6]) -> 12 | J650: =+RC[-6]-RC[-7] -> 36 | K650: =+IF(RC[-4]="OUT of TIME",RC[-1]-VLOOKUP(RC[-9],Enunciado!R3C6:R5C7,2,0),"") -> 31
A651: Dept5-24668 | B651: Medio | C651: 41028 | D651: 41047 | E651: =+LEFT(RC[-4],5) -> Dept5 | F651: =+VLOOKUP(RC[-4],Enunciado!R3C6:R5C7,2,0)+RC[-3] -> 41043 | G651: =+IF(RC[-1]>=RC[-3],"ON TIME","OUT OF TIME") -> OUT OF TIME | H651: =+YEAR(RC[-5]) -> 2012 | I651: =+MONTH(RC[-6]) -> 4 | J651: =+RC[-6]-RC[-7] -> 19 | K651: =+IF(RC[-4]="OUT of TIME",RC[-1]-VLOOKUP(RC[-9],Enunciado!R3C6:R5C7,2,0),"") -> 4
A652: Dept1-26334 | B652: Bajo | C652: 41621 | D652: 41629 | E652: =+LEFT(RC[-4],5) -> Dept1 | F652: =+VLOOKUP(RC[-4],Enunciado!R3C6:R5C7,2,0)+RC[-3] -> 41651 | G652: =+IF(RC[-1]>=RC[-3],"ON TIME","OUT OF TIME") -> ON TIME | H652: =+YEAR(RC[-5]) -> 2013 | I652: =+MONTH(RC[-6]) -> 12 | J652: =+RC[-6]-RC[-7] -> 8 | K652: =+IF(RC[-4]="OUT of TIME",RC[-1]-VLOOKUP(RC[-9],Enunciado!R3C6:R5C7,2,0),"") -> 
A653: Dept5-25911 | B653: Alto | C653: 41035 | D653: 41040 | E653: =+LEFT(RC[-4],5) -> Dept5 | F653: =+VLOOKUP(RC[-4],Enunciado!R3C6:R5C7,2,0)+RC[-3] -> 41040 | G653: =+IF(RC[-1]>=RC[-3],"ON TIME","OUT OF TIME") -> ON TIME | H653: =+YEAR(RC[-5]) -> 2012 | I653: =+MONTH(RC[-6]) -> 5 | J653: =+RC[-6]-RC[-7] -> 5 | K653: =+IF(RC[-4]="OUT of TIME",RC[-1]-VLOOKUP(RC[-9],Enunciado!R3C6:R5C7,2,0),"") -> 
A654: Dept4-22703 | B654: Alto | C654: 41546 | D654: 41582 | E654: =+LEFT(RC[-4],5) -> Dept4 | F654: =+VLOOKUP(RC[-4],Enunciado!R3C6:R5C7,2,0)+RC[-3] -> 41551 | G654: =+IF(RC[-1]>=RC[-3],"ON TIME","OUT OF TIME") -> OUT OF TIME | H654: =+YEAR(RC[-5]) -> 2013 | I654: =+MONTH(RC[-6]) -> 9 | J654: =+RC[-6]-RC[-7] -> 36 | K654: =+IF(RC[-4]="OUT of TIME",RC[-1]-VLOOKUP(RC[-9],Enunciado!R3C6:R5C7,2,0),"") -> 31
A655: Dept1-26110 | B655: Medio | C655: 41100 | D655: 41101 | E655: =+LEFT(RC[-4],5) -> Dept1 | F655: =+VLOOKUP(RC[-4],Enunciado!R3C6:R5C7,2,0)+RC[-3] -> 41115 | G655: =+IF(RC[-1]>=RC[-3],"ON TIME","OUT OF TIME") -> ON TIME | H655: =+YEAR(RC[-5]) -> 2012 | I655: =+MONTH(RC[-6]) -> 7 | J655: =+RC[-6]-RC[-7] -> 1 | K655: =+IF(RC[-4]="OUT of TIME",RC[-1]-VLOOKUP(RC[-9],Enunciado!R3C6:R5C7,2,0),"") -> 
A656: Dept6-17198 | B656: Bajo | C656: 41605 | D656: 41607 | E656: =+LEFT(RC[-4],5) -> Dept6 | F656: =+VLOOKUP(RC[-4],Enunciado!R3C6:R5C7,2,0)+RC[-3] -> 41635 | G656: =+IF(RC[-1]>=RC[-3],"ON TIME","OUT OF TIME") -> ON TIME | H656: =+YEAR(RC[-5]) -> 2013 | I656: =+MONTH(RC[-6]) -> 11 | J656: =+RC[-6]-RC[-7] -> 2 | K656: =+IF(RC[-4]="OUT of TIME",RC[-1]-VLOOKUP(RC[-9],Enunciado!R3C6:R5C7,2,0),"") -> 
A657: Dept3-25647 | B657: Alto | C657: 41111 | D657: 41126 | E657: =+LEFT(RC[-4],5) -> Dept3 | F657: =+VLOOKUP(RC[-4],Enunciado!R3C6:R5C7,2,0)+RC[-3] -> 41116 | G657: =+IF(RC[-1]>=RC[-3],"ON TIME","OUT OF TIME") -> OUT OF TIME | H657: =+YEAR(RC[-5]) -> 2012 | I657: =+MONTH(RC[-6]) -> 7 | J657: =+RC[-6]-RC[-7] -> 15 | K657: =+IF(RC[-4]="OUT of TIME",RC[-1]-VLOOKUP(RC[-9],Enunciado!R3C6:R5C7,2,0),"") -> 10
A658: Dept1-4233 | B658: Alto | C658: 40964 | D658: 40967 | E658: =+LEFT(RC[-4],5) -> Dept1 | F658: =+VLOOKUP(RC[-4],Enunciado!R3C6:R5C7,2,0)+RC[-3] -> 40969 | G658: =+IF(RC[-1]>=RC[-3],"ON TIME","OUT OF TIME") -> ON TIME | H658: =+YEAR(RC[-5]) -> 2012 | I658: =+MONTH(RC[-6]) -> 2 | J658: =+RC[-6]-RC[-7] -> 3 | K658: =+IF(RC[-4]="OUT of TIME",RC[-1]-VLOOKUP(RC[-9],Enunciado!R3C6:R5C7,2,0),"") -> 
A659: Dept3-7342 | B659: Alto | C659: 41287 | D659: 41298 | E659: =+LEFT(RC[-4],5) -> Dept3 | F659: =+VLOOKUP(RC[-4],Enunciado!R3C6:R5C7,2,0)+RC[-3] -> 41292 | G659: =+IF(RC[-1]>=RC[-3],"ON TIME","OUT OF TIME") -> OUT OF TIME | H659: =+YEAR(RC[-5]) -> 2013 | I659: =+MONTH(RC[-6]) -> 1 | J659: =+RC[-6]-RC[-7] -> 11 | K659: =+IF(RC[-4]="OUT of TIME",RC[-1]-VLOOKUP(RC[-9],Enunciado!R3C6:R5C7,2,0),"") -> 6
A660: Dept1-28668 | B660: Alto | C660: 41329 | D660: 41375 | E660: =+LEFT(RC[-4],5) -> Dept1 | F660: =+VLOOKUP(RC[-4],Enunciado!R3C6:R5C7,2,0)+RC[-3] -> 41334 | G660: =+IF(RC[-1]>=RC[-3],"ON TIME","OUT OF TIME") -> OUT OF TIME | H660: =+YEAR(RC[-5]) -> 2013 | I660: =+MONTH(RC[-6]) -> 2 | J660: =+RC[-6]-RC[-7] -> 46 | K660: =+IF(RC[-4]="OUT of TIME",RC[-1]-VLOOKUP(RC[-9],Enunciado!R3C6:R5C7,2,0),"") -> 41
A661: Dept4-9215 | B661: Medio | C661: 41471 | D661: 41471 | E661: =+LEFT(RC[-4],5) -> Dept4 | F661: =+VLOOKUP(RC[-4],Enunciado!R3C6:R5C7,2,0)+RC[-3] -> 41486 | G661: =+IF(RC[-1]>=RC[-3],"ON TIME","OUT OF TIME") -> ON TIME | H661: =+YEAR(RC[-5]) -> 2013 | I661: =+MONTH(RC[-6]) -> 7 | J661: =+RC[-6]-RC[-7] -> 0 | K661: =+IF(RC[-4]="OUT of TIME",RC[-1]-VLOOKUP(RC[-9],Enunciado!R3C6:R5C7,2,0),"") -> 
A662: Dept5-17336 | B662: Alto | C662: 41222 | D662: 41262 | E662: =+LEFT(RC[-4],5) -> Dept5 | F662: =+VLOOKUP(RC[-4],Enunciado!R3C6:R5C7,2,0)+RC[-3] -> 41227 | G662: =+IF(RC[-1]>=RC[-3],"ON TIME","OUT OF TIME") -> OUT OF TIME | H662: =+YEAR(RC[-5]) -> 2012 | I662: =+MONTH(RC[-6]) -> 11 | J662: =+RC[-6]-RC[-7] -> 40 | K662: =+IF(RC[-4]="OUT of TIME",RC[-1]-VLOOKUP(RC[-9],Enunciado!R3C6:R5C7,2,0),"") -> 35
A663: Dept2-7043 | B663: Bajo | C663: 40913 | D663: 40917 | E663: =+LEFT(RC[-4],5) -> Dept2 | F663: =+VLOOKUP(RC[-4],Enunciado!R3C6:R5C7,2,0)+RC[-3] -> 40943 | G663: =+IF(RC[-1]>=RC[-3],"ON TIME","OUT OF TIME") -> ON TIME | H663: =+YEAR(RC[-5]) -> 2012 | I663: =+MONTH(RC[-6]) -> 1 | J663: =+RC[-6]-RC[-7] -> 4 | K663: =+IF(RC[-4]="OUT of TIME",RC[-1]-VLOOKUP(RC[-9],Enunciado!R3C6:R5C7,2,0),"") -> 
A664: Dept5-7717 | B664: Alto | C664: 41535 | D664: 41554 | E664: =+LEFT(RC[-4],5) -> Dept5 | F664: =+VLOOKUP(RC[-4],Enunciado!R3C6:R5C7,2,0)+RC[-3] -> 41540 | G664: =+IF(RC[-1]>=RC[-3],"ON TIME","OUT OF TIME") -> OUT OF TIME | H664: =+YEAR(RC[-5]) -> 2013 | I664: =+MONTH(RC[-6]) -> 9 | J664: =+RC[-6]-RC[-7] -> 19 | K664: =+IF(RC[-4]="OUT of TIME",RC[-1]-VLOOKUP(RC[-9],Enunciado!R3C6:R5C7,2,0),"") -> 14
A665: Dept5-3296 | B665: Alto | C665: 41199 | D665: 41206 | E665: =+LEFT(RC[-4],5) -> Dept5 | F665: =+VLOOKUP(RC[-4],Enunciado!R3C6:R5C7,2,0)+RC[-3] -> 41204 | G665: =+IF(RC[-1]>=RC[-3],"ON TIME","OUT OF TIME") -> OUT OF TIME | H665: =+YEAR(RC[-5]) -> 2012 | I665: =+MONTH(RC[-6]) -> 10 | J665: =+RC[-6]-RC[-7] -> 7 | K665: =+IF(RC[-4]="OUT of TIME",RC[-1]-VLOOKUP(RC[-9],Enunciado!R3C6:R5C7,2,0),"") -> 2
A666: Dept2-11578 | B666: Alto | C666: 41177 | D666: 41186 | E666: =+LEFT(RC[-4],5) -> Dept2 | F666: =+VLOOKUP(RC[-4],Enunciado!R3C6:R5C7,2,0)+RC[-3] -> 41182 | G666: =+IF(RC[-1]>=RC[-3],"ON TIME","OUT OF TIME") -> OUT OF TIME | H666: =+YEAR(RC[-5]) -> 2012 | I666: =+MONTH(RC[-6]) -> 9 | J666: =+RC[-6]-RC[-7] -> 9 | K666: =+IF(RC[-4]="OUT of TIME",RC[-1]-VLOOKUP(RC[-9],Enunciado!R3C6:R5C7,2,0),"") -> 4
A667: Dept3-6496 | B667: Bajo | C667: 41495 | D667: 41510 | E667: =+LEFT(RC[-4],5) -> Dept3 | F667: =+VLOOKUP(RC[-4],Enunciado!R3C6:R5C7,2,0)+RC[-3] -> 41525 | G667: =+IF(RC[-1]>=RC[-3],"ON TIME","OUT OF TIME") -> ON TIME | H667: =+YEAR(RC[-5]) -> 2013 | I667: =+MONTH(RC[-6]) -> 8 | J667: =+RC[-6]-RC[-7] -> 15 | K667: =+IF(RC[-4]="OUT of TIME",RC[-1]-VLOOKUP(RC[-9],Enunciado!R3C6:R5C7,2,0),"") -> 
A668: Dept1-18883 | B668: Medio | C668: 41285 | D668: 41286 | E668: =+LEFT(RC[-4],5) -> Dept1 | F668: =+VLOOKUP(RC[-4],Enunciado!R3C6:R5C7,2,0)+RC[-3] -> 41300 | G668: =+IF(RC[-1]>=RC[-3],"ON TIME","OUT OF TIME") -> ON TIME | H668: =+YEAR(RC[-5]) -> 2013 | I668: =+MONTH(RC[-6]) -> 1 | J668: =+RC[-6]-RC[-7] -> 1 | K668: =+IF(RC[-4]="OUT of TIME",RC[-1]-VLOOKUP(RC[-9],Enunciado!R3C6:R5C7,2,0),"") -> 
A669: Dept1-12569 | B669: Alto | C669: 41316 | D669: 41328 | E669: =+LEFT(RC[-4],5) -> Dept1 | F669: =+VLOOKUP(RC[-4],Enunciado!R3C6:R5C7,2,0)+RC[-3] -> 41321 | G669: =+IF(RC[-1]>=RC[-3],"ON TIME","OUT OF TIME") -> OUT OF TIME | H669: =+YEAR(RC[-5]) -> 2013 | I669: =+MONTH(RC[-6]) -> 2 | J669: =+RC[-6]-RC[-7] -> 12 | K669: =+IF(RC[-4]="OUT of TIME",RC[-1]-VLOOKUP(RC[-9],Enunciado!R3C6:R5C7,2,0),"") -> 7
A670: Dept1-24793 | B670: Medio | C670: 41635 | D670: 41635 | E670: =+LEFT(RC[-4],5) -> Dept1 | F670: =+VLOOKUP(RC[-4],Enunciado!R3C6:R5C7,2,0)+RC[-3] -> 41650 | G670: =+IF(RC[-1]>=RC[-3],"ON TIME","OUT OF TIME") -> ON TIME | H670: =+YEAR(RC[-5]) -> 2013 | I670: =+MONTH(RC[-6]) -> 12 | J670: =+RC[-6]-RC[-7] -> 0 | K670: =+IF(RC[-4]="OUT of TIME",RC[-1]-VLOOKUP(RC[-9],Enunciado!R3C6:R5C7,2,0),"") -> 
A671: Dept3-17251 | B671: Bajo | C671: 41136 | D671: 41136 | E671: =+LEFT(RC[-4],5) -> Dept3 | F671: =+VLOOKUP(RC[-4],Enunciado!R3C6:R5C7,2,0)+RC[-3] -> 41166 | G671: =+IF(RC[-1]>=RC[-3],"ON TIME","OUT OF TIME") -> ON TIME | H671: =+YEAR(RC[-5]) -> 2012 | I671: =+MONTH(RC[-6]) -> 8 | J671: =+RC[-6]-RC[-7] -> 0 | K671: =+IF(RC[-4]="OUT of TIME",RC[-1]-VLOOKUP(RC[-9],Enunciado!R3C6:R5C7,2,0),"") -> 
A672: Dept2-56 | B672: Bajo | C672: 41573 | D672: 41592 | E672: =+LEFT(RC[-4],5) -> Dept2 | F672: =+VLOOKUP(RC[-4],Enunciado!R3C6:R5C7,2,0)+RC[-3] -> 41603 | G672: =+IF(RC[-1]>=RC[-3],"ON TIME","OUT OF TIME") -> ON TIME | H672: =+YEAR(RC[-5]) -> 2013 | I672: =+MONTH(RC[-6]) -> 10 | J672: =+RC[-6]-RC[-7] -> 19 | K672: =+IF(RC[-4]="OUT of TIME",RC[-1]-VLOOKUP(RC[-9],Enunciado!R3C6:R5C7,2,0),"") -> 
A673: Dept5-6115 | B673: Medio | C673: 41262 | D673: 41267 | E673: =+LEFT(RC[-4],5) -> Dept5 | F673: =+VLOOKUP(RC[-4],Enunciado!R3C6:R5C7,2,0)+RC[-3] -> 41277 | G673: =+IF(RC[-1]>=RC[-3],"ON TIME","OUT OF TIME") -> ON TIME | H673: =+YEAR(RC[-5]) -> 2012 | I673: =+MONTH(RC[-6]) -> 12 | J673: =+RC[-6]-RC[-7] -> 5 | K673: =+IF(RC[-4]="OUT of TIME",RC[-1]-VLOOKUP(RC[-9],Enunciado!R3C6:R5C7,2,0),"") -> 
A674: Dept4-2618 | B674: Bajo | C674: 41295 | D674: 41306 | E674: =+LEFT(RC[-4],5) -> Dept4 | F674: =+VLOOKUP(RC[-4],Enunciado!R3C6:R5C7,2,0)+RC[-3] -> 41325 | G674: =+IF(RC[-1]>=RC[-3],"ON TIME","OUT OF TIME") -> ON TIME | H674: =+YEAR(RC[-5]) -> 2013 | I674: =+MONTH(RC[-6]) -> 1 | J674: =+RC[-6]-RC[-7] -> 11 | K674: =+IF(RC[-4]="OUT of TIME",RC[-1]-VLOOKUP(RC[-9],Enunciado!R3C6:R5C7,2,0),"") -> 
A675: Dept2-26275 | B675: Alto | C675: 41264 | D675: 41280 | E675: =+LEFT(RC[-4],5) -> Dept2 | F675: =+VLOOKUP(RC[-4],Enunciado!R3C6:R5C7,2,0)+RC[-3] -> 41269 | G675: =+IF(RC[-1]>=RC[-3],"ON TIME","OUT OF TIME") -> OUT OF TIME | H675: =+YEAR(RC[-5]) -> 2012 | I675: =+MONTH(RC[-6]) -> 12 | J675: =+RC[-6]-RC[-7] -> 16 | K675: =+IF(RC[-4]="OUT of TIME",RC[-1]-VLOOKUP(RC[-9],Enunciado!R3C6:R5C7,2,0),"") -> 11
A676: Dept1-5754 | B676: Alto | C676: 41177 | D676: 41181 | E676: =+LEFT(RC[-4],5) -> Dept1 | F676: =+VLOOKUP(RC[-4],Enunciado!R3C6:R5C7,2,0)+RC[-3] -> 41182 | G676: =+IF(RC[-1]>=RC[-3],"ON TIME","OUT OF TIME") -> ON TIME | H676: =+YEAR(RC[-5]) -> 2012 | I676: =+MONTH(RC[-6]) -> 9 | J676: =+RC[-6]-RC[-7] -> 4 | K676: =+IF(RC[-4]="OUT of TIME",RC[-1]-VLOOKUP(RC[-9],Enunciado!R3C6:R5C7,2,0),"") -> 
A677: Dept3-1330 | B677: Alto | C677: 41580 | D677: 41583 | E677: =+LEFT(RC[-4],5) -> Dept3 | F677: =+VLOOKUP(RC[-4],Enunciado!R3C6:R5C7,2,0)+RC[-3] -> 41585 | G677: =+IF(RC[-1]>=RC[-3],"ON TIME","OUT OF TIME") -> ON TIME | H677: =+YEAR(RC[-5]) -> 2013 | I677: =+MONTH(RC[-6]) -> 11 | J677: =+RC[-6]-RC[-7] -> 3 | K677: =+IF(RC[-4]="OUT of TIME",RC[-1]-VLOOKUP(RC[-9],Enunciado!R3C6:R5C7,2,0),"") -> 
A678: Dept5-15527 | B678: Medio | C678: 41081 | D678: 41099 | E678: =+LEFT(RC[-4],5) -> Dept5 | F678: =+VLOOKUP(RC[-4],Enunciado!R3C6:R5C7,2,0)+RC[-3] -> 41096 | G678: =+IF(RC[-1]>=RC[-3],"ON TIME","OUT OF TIME") -> OUT OF TIME | H678: =+YEAR(RC[-5]) -> 2012 | I678: =+MONTH(RC[-6]) -> 6 | J678: =+RC[-6]-RC[-7] -> 18 | K678: =+IF(RC[-4]="OUT of TIME",RC[-1]-VLOOKUP(RC[-9],Enunciado!R3C6:R5C7,2,0),"") -> 3
A679: Dept4-8614 | B679: Bajo | C679: 41458 | D679: 41467 | E679: =+LEFT(RC[-4],5) -> Dept4 | F679: =+VLOOKUP(RC[-4],Enunciado!R3C6:R5C7,2,0)+RC[-3] -> 41488 | G679: =+IF(RC[-1]>=RC[-3],"ON TIME","OUT OF TIME") -> ON TIME | H679: =+YEAR(RC[-5]) -> 2013 | I679: =+MONTH(RC[-6]) -> 7 | J679: =+RC[-6]-RC[-7] -> 9 | K679: =+IF(RC[-4]="OUT of TIME",RC[-1]-VLOOKUP(RC[-9],Enunciado!R3C6:R5C7,2,0),"") -> 
A680: Dept6-7909 | B680: Medio | C680: 41358 | D680: 41370 | E680: =+LEFT(RC[-4],5) -> Dept6 | F680: =+VLOOKUP(RC[-4],Enunciado!R3C6:R5C7,2,0)+RC[-3] -> 41373 | G680: =+IF(RC[-1]>=RC[-3],"ON TIME","OUT OF TIME") -> ON TIME | H680: =+YEAR(RC[-5]) -> 2013 | I680: =+MONTH(RC[-6]) -> 3 | J680: =+RC[-6]-RC[-7] -> 12 | K680: =+IF(RC[-4]="OUT of TIME",RC[-1]-VLOOKUP(RC[-9],Enunciado!R3C6:R5C7,2,0),"") -> 
A681: Dept2-5321 | B681: Medio | C681: 41158 | D681: 41197 | E681: =+LEFT(RC[-4],5) -> Dept2 | F681: =+VLOOKUP(RC[-4],Enunciado!R3C6:R5C7,2,0)+RC[-3] -> 41173 | G681: =+IF(RC[-1]>=RC[-3],"ON TIME","OUT OF TIME") -> OUT OF TIME | H681: =+YEAR(RC[-5]) -> 2012 | I681: =+MONTH(RC[-6]) -> 9 | J681: =+RC[-6]-RC[-7] -> 39 | K681: =+IF(RC[-4]="OUT of TIME",RC[-1]-VLOOKUP(RC[-9],Enunciado!R3C6:R5C7,2,0),"") -> 24
A682: Dept3-3355 | B682: Medio | C682: 41488 | D682: 41490 | E682: =+LEFT(RC[-4],5) -> Dept3 | F682: =+VLOOKUP(RC[-4],Enunciado!R3C6:R5C7,2,0)+RC[-3] -> 41503 | G682: =+IF(RC[-1]>=RC[-3],"ON TIME","OUT OF TIME") -> ON TIME | H682: =+YEAR(RC[-5]) -> 2013 | I682: =+MONTH(RC[-6]) -> 8 | J682: =+RC[-6]-RC[-7] -> 2 | K682: =+IF(RC[-4]="OUT of TIME",RC[-1]-VLOOKUP(RC[-9],Enunciado!R3C6:R5C7,2,0),"") -> 
A683: Dept4-7544 | B683: Alto | C683: 41454 | D683: 41455 | E683: =+LEFT(RC[-4],5) -> Dept4 | F683: =+VLOOKUP(RC[-4],Enunciado!R3C6:R5C7,2,0)+RC[-3] -> 41459 | G683: =+IF(RC[-1]>=RC[-3],"ON TIME","OUT OF TIME") -> ON TIME | H683: =+YEAR(RC[-5]) -> 2013 | I683: =+MONTH(RC[-6]) -> 6 | J683: =+RC[-6]-RC[-7] -> 1 | K683: =+IF(RC[-4]="OUT of TIME",RC[-1]-VLOOKUP(RC[-9],Enunciado!R3C6:R5C7,2,0),"") -> 
A684: Dept1-4147 | B684: Bajo | C684: 41170 | D684: 41170 | E684: =+LEFT(RC[-4],5) -> Dept1 | F684: =+VLOOKUP(RC[-4],Enunciado!R3C6:R5C7,2,0)+RC[-3] -> 41200 | G684: =+IF(RC[-1]>=RC[-3],"ON TIME","OUT OF TIME") -> ON TIME | H684: =+YEAR(RC[-5]) -> 2012 | I684: =+MONTH(RC[-6]) -> 9 | J684: =+RC[-6]-RC[-7] -> 0 | K684: =+IF(RC[-4]="OUT of TIME",RC[-1]-VLOOKUP(RC[-9],Enunciado!R3C6:R5C7,2,0),"") -> 
A685: Dept6-23823 | B685: Alto | C685: 41058 | D685: 41061 | E685: =+LEFT(RC[-4],5) -> Dept6 | F685: =+VLOOKUP(RC[-4],Enunciado!R3C6:R5C7,2,0)+RC[-3] -> 41063 | G685: =+IF(RC[-1]>=RC[-3],"ON TIME","OUT OF TIME") -> ON TIME | H685: =+YEAR(RC[-5]) -> 2012 | I685: =+MONTH(RC[-6]) -> 5 | J685: =+RC[-6]-RC[-7] -> 3 | K685: =+IF(RC[-4]="OUT of TIME",RC[-1]-VLOOKUP(RC[-9],Enunciado!R3C6:R5C7,2,0),"") -> 
A686: Dept2-7336 | B686: Bajo | C686: 40977 | D686: 40978 | E686: =+LEFT(RC[-4],5) -> Dept2 | F686: =+VLOOKUP(RC[-4],Enunciado!R3C6:R5C7,2,0)+RC[-3] -> 41007 | G686: =+IF(RC[-1]>=RC[-3],"ON TIME","OUT OF TIME") -> ON TIME | H686: =+YEAR(RC[-5]) -> 2012 | I686: =+MONTH(RC[-6]) -> 3 | J686: =+RC[-6]-RC[-7] -> 1 | K686: =+IF(RC[-4]="OUT of TIME",RC[-1]-VLOOKUP(RC[-9],Enunciado!R3C6:R5C7,2,0),"") -> 
A687: Dept2-12232 | B687: Medio | C687: 41137 | D687: 41138 | E687: =+LEFT(RC[-4],5) -> Dept2 | F687: =+VLOOKUP(RC[-4],Enunciado!R3C6:R5C7,2,0)+RC[-3] -> 41152 | G687: =+IF(RC[-1]>=RC[-3],"ON TIME","OUT OF TIME") -> ON TIME | H687: =+YEAR(RC[-5]) -> 2012 | I687: =+MONTH(RC[-6]) -> 8 | J687: =+RC[-6]-RC[-7] -> 1 | K687: =+IF(RC[-4]="OUT of TIME",RC[-1]-VLOOKUP(RC[-9],Enunciado!R3C6:R5C7,2,0),"") -> 
A688: Dept5-13567 | B688: Bajo | C688: 41431 | D688: 41449 | E688: =+LEFT(RC[-4],5) -> Dept5 | F688: =+VLOOKUP(RC[-4],Enunciado!R3C6:R5C7,2,0)+RC[-3] -> 41461 | G688: =+IF(RC[-1]>=RC[-3],"ON TIME","OUT OF TIME") -> ON TIME | H688: =+YEAR(RC[-5]) -> 2013 | I688: =+MONTH(RC[-6]) -> 6 | J688: =+RC[-6]-RC[-7] -> 18 | K688: =+IF(RC[-4]="OUT of TIME",RC[-1]-VLOOKUP(RC[-9],Enunciado!R3C6:R5C7,2,0),"") -> 
A689: Dept2-17597 | B689: Medio | C689: 41168 | D689: 41171 | E689: =+LEFT(RC[-4],5) -> Dept2 | F689: =+VLOOKUP(RC[-4],Enunciado!R3C6:R5C7,2,0)+RC[-3] -> 41183 | G689: =+IF(RC[-1]>=RC[-3],"ON TIME","OUT OF TIME") -> ON TIME | H689: =+YEAR(RC[-5]) -> 2012 | I689: =+MONTH(RC[-6]) -> 9 | J689: =+RC[-6]-RC[-7] -> 3 | K689: =+IF(RC[-4]="OUT of TIME",RC[-1]-VLOOKUP(RC[-9],Enunciado!R3C6:R5C7,2,0),"") -> 
A690: Dept3-19631 | B690: Bajo | C690: 41123 | D690: 41126 | E690: =+LEFT(RC[-4],5) -> Dept3 | F690: =+VLOOKUP(RC[-4],Enunciado!R3C6:R5C7,2,0)+RC[-3] -> 41153 | G690: =+IF(RC[-1]>=RC[-3],"ON TIME","OUT OF TIME") -> ON TIME | H690: =+YEAR(RC[-5]) -> 2012 | I690: =+MONTH(RC[-6]) -> 8 | J690: =+RC[-6]-RC[-7] -> 3 | K690: =+IF(RC[-4]="OUT of TIME",RC[-1]-VLOOKUP(RC[-9],Enunciado!R3C6:R5C7,2,0),"") -> 
A691: Dept2-22886 | B691: Alto | C691: 41481 | D691: 41519 | E691: =+LEFT(RC[-4],5) -> Dept2 | F691: =+VLOOKUP(RC[-4],Enunciado!R3C6:R5C7,2,0)+RC[-3] -> 41486 | G691: =+IF(RC[-1]>=RC[-3],"ON TIME","OUT OF TIME") -> OUT OF TIME | H691: =+YEAR(RC[-5]) -> 2013 | I691: =+MONTH(RC[-6]) -> 7 | J691: =+RC[-6]-RC[-7] -> 38 | K691: =+IF(RC[-4]="OUT of TIME",RC[-1]-VLOOKUP(RC[-9],Enunciado!R3C6:R5C7,2,0),"") -> 33
A692: Dept4-20026 | B692: Bajo | C692: 41001 | D692: 41016 | E692: =+LEFT(RC[-4],5) -> Dept4 | F692: =+VLOOKUP(RC[-4],Enunciado!R3C6:R5C7,2,0)+RC[-3] -> 41031 | G692: =+IF(RC[-1]>=RC[-3],"ON TIME","OUT OF TIME") -> ON TIME | H692: =+YEAR(RC[-5]) -> 2012 | I692: =+MONTH(RC[-6]) -> 4 | J692: =+RC[-6]-RC[-7] -> 15 | K692: =+IF(RC[-4]="OUT of TIME",RC[-1]-VLOOKUP(RC[-9],Enunciado!R3C6:R5C7,2,0),"") -> 
A693: Dept2-16342 | B693: Bajo | C693: 41051 | D693: 41055 | E693: =+LEFT(RC[-4],5) -> Dept2 | F693: =+VLOOKUP(RC[-4],Enunciado!R3C6:R5C7,2,0)+RC[-3] -> 41081 | G693: =+IF(RC[-1]>=RC[-3],"ON TIME","OUT OF TIME") -> ON TIME | H693: =+YEAR(RC[-5]) -> 2012 | I693: =+MONTH(RC[-6]) -> 5 | J693: =+RC[-6]-RC[-7] -> 4 | K693: =+IF(RC[-4]="OUT of TIME",RC[-1]-VLOOKUP(RC[-9],Enunciado!R3C6:R5C7,2,0),"") -> 
A694: Dept1-20362 | B694: Medio | C694: 41001 | D694: 41001 | E694: =+LEFT(RC[-4],5) -> Dept1 | F694: =+VLOOKUP(RC[-4],Enunciado!R3C6:R5C7,2,0)+RC[-3] -> 41016 | G694: =+IF(RC[-1]>=RC[-3],"ON TIME","OUT OF TIME") -> ON TIME | H694: =+YEAR(RC[-5]) -> 2012 | I694: =+MONTH(RC[-6]) -> 4 | J694: =+RC[-6]-RC[-7] -> 0 | K694: =+IF(RC[-4]="OUT of TIME",RC[-1]-VLOOKUP(RC[-9],Enunciado!R3C6:R5C7,2,0),"") -> 
A695: Dept5-3420 | B695: Bajo | C695: 41284 | D695: 41287 | E695: =+LEFT(RC[-4],5) -> Dept5 | F695: =+VLOOKUP(RC[-4],Enunciado!R3C6:R5C7,2,0)+RC[-3] -> 41314 | G695: =+IF(RC[-1]>=RC[-3],"ON TIME","OUT OF TIME") -> ON TIME | H695: =+YEAR(RC[-5]) -> 2013 | I695: =+MONTH(RC[-6]) -> 1 | J695: =+RC[-6]-RC[-7] -> 3 | K695: =+IF(RC[-4]="OUT of TIME",RC[-1]-VLOOKUP(RC[-9],Enunciado!R3C6:R5C7,2,0),"") -> 
A696: Dept4-12915 | B696: Alto | C696: 41172 | D696: 41176 | E696: =+LEFT(RC[-4],5) -> Dept4 | F696: =+VLOOKUP(RC[-4],Enunciado!R3C6:R5C7,2,0)+RC[-3] -> 41177 | G696: =+IF(RC[-1]>=RC[-3],"ON TIME","OUT OF TIME") -> ON TIME | H696: =+YEAR(RC[-5]) -> 2012 | I696: =+MONTH(RC[-6]) -> 9 | J696: =+RC[-6]-RC[-7] -> 4 | K696: =+IF(RC[-4]="OUT of TIME",RC[-1]-VLOOKUP(RC[-9],Enunciado!R3C6:R5C7,2,0),"") -> 
A697: Dept2-97 | B697: Medio | C697: 41561 | D697: 41563 | E697: =+LEFT(RC[-4],5) -> Dept2 | F697: =+VLOOKUP(RC[-4],Enunciado!R3C6:R5C7,2,0)+RC[-3] -> 41576 | G697: =+IF(RC[-1]>=RC[-3],"ON TIME","OUT OF TIME") -> ON TIME | H697: =+YEAR(RC[-5]) -> 2013 | I697: =+MONTH(RC[-6]) -> 10 | J697: =+RC[-6]-RC[-7] -> 2 | K697: =+IF(RC[-4]="OUT of TIME",RC[-1]-VLOOKUP(RC[-9],Enunciado!R3C6:R5C7,2,0),"") -> 
A698: Dept2-22137 | B698: Bajo | C698: 40966 | D698: 40989 | E698: =+LEFT(RC[-4],5) -> Dept2 | F698: =+VLOOKUP(RC[-4],Enunciado!R3C6:R5C7,2,0)+RC[-3] -> 40996 | G698: =+IF(RC[-1]>=RC[-3],"ON TIME","OUT OF TIME") -> ON TIME | H698: =+YEAR(RC[-5]) -> 2012 | I698: =+MONTH(RC[-6]) -> 2 | J698: =+RC[-6]-RC[-7] -> 23 | K698: =+IF(RC[-4]="OUT of TIME",RC[-1]-VLOOKUP(RC[-9],Enunciado!R3C6:R5C7,2,0),"") -> 
A699: Dept1-21602 | B699: Bajo | C699: 41429 | D699: 41450 | E699: =+LEFT(RC[-4],5) -> Dept1 | F699: =+VLOOKUP(RC[-4],Enunciado!R3C6:R5C7,2,0)+RC[-3] -> 41459 | G699: =+IF(RC[-1]>=RC[-3],"ON TIME","OUT OF TIME") -> ON TIME | H699: =+YEAR(RC[-5]) -> 2013 | I699: =+MONTH(RC[-6]) -> 6 | J699: =+RC[-6]-RC[-7] -> 21 | K699: =+IF(RC[-4]="OUT of TIME",RC[-1]-VLOOKUP(RC[-9],Enunciado!R3C6:R5C7,2,0),"") -> 
A700: Dept6-5445 | B700: Medio | C700: 41341 | D700: 41376 | E700: =+LEFT(RC[-4],5) -> Dept6 | F700: =+VLOOKUP(RC[-4],Enunciado!R3C6:R5C7,2,0)+RC[-3] -> 41356 | G700: =+IF(RC[-1]>=RC[-3],"ON TIME","OUT OF TIME") -> OUT OF TIME | H700: =+YEAR(RC[-5]) -> 2013 | I700: =+MONTH(RC[-6]) -> 3 | J700: =+RC[-6]-RC[-7] -> 35 | K700: =+IF(RC[-4]="OUT of TIME",RC[-1]-VLOOKUP(RC[-9],Enunciado!R3C6:R5C7,2,0),"") -> 20
A701: Dept4-28150 | B701: Medio | C701: 41377 | D701: 41377 | E701: =+LEFT(RC[-4],5) -> Dept4 | F701: =+VLOOKUP(RC[-4],Enunciado!R3C6:R5C7,2,0)+RC[-3] -> 41392 | G701: =+IF(RC[-1]>=RC[-3],"ON TIME","OUT OF TIME") -> ON TIME | H701: =+YEAR(RC[-5]) -> 2013 | I701: =+MONTH(RC[-6]) -> 4 | J701: =+RC[-6]-RC[-7] -> 0 | K701: =+IF(RC[-4]="OUT of TIME",RC[-1]-VLOOKUP(RC[-9],Enunciado!R3C6:R5C7,2,0),"") -> 
A702: Dept5-2090 | B702: Medio | C702: 40945 | D702: 40964 | E702: =+LEFT(RC[-4],5) -> Dept5 | F702: =+VLOOKUP(RC[-4],Enunciado!R3C6:R5C7,2,0)+RC[-3] -> 40960 | G702: =+IF(RC[-1]>=RC[-3],"ON TIME","OUT OF TIME") -> OUT OF TIME | H702: =+YEAR(RC[-5]) -> 2012 | I702: =+MONTH(RC[-6]) -> 2 | J702: =+RC[-6]-RC[-7] -> 19 | K702: =+IF(RC[-4]="OUT of TIME",RC[-1]-VLOOKUP(RC[-9],Enunciado!R3C6:R5C7,2,0),"") -> 4
A703: Dept1-6716 | B703: Bajo | C703: 41316 | D703: 41344 | E703: =+LEFT(RC[-4],5) -> Dept1 | F703: =+VLOOKUP(RC[-4],Enunciado!R3C6:R5C7,2,0)+RC[-3] -> 41346 | G703: =+IF(RC[-1]>=RC[-3],"ON TIME","OUT OF TIME") -> ON TIME | H703: =+YEAR(RC[-5]) -> 2013 | I703: =+MONTH(RC[-6]) -> 2 | J703: =+RC[-6]-RC[-7] -> 28 | K703: =+IF(RC[-4]="OUT of TIME",RC[-1]-VLOOKUP(RC[-9],Enunciado!R3C6:R5C7,2,0),"") -> 
A704: Dept6-428 | B704: Medio | C704: 41109 | D704: 41114 | E704: =+LEFT(RC[-4],5) -> Dept6 | F704: =+VLOOKUP(RC[-4],Enunciado!R3C6:R5C7,2,0)+RC[-3] -> 41124 | G704: =+IF(RC[-1]>=RC[-3],"ON TIME","OUT OF TIME") -> ON TIME | H704: =+YEAR(RC[-5]) -> 2012 | I704: =+MONTH(RC[-6]) -> 7 | J704: =+RC[-6]-RC[-7] -> 5 | K704: =+IF(RC[-4]="OUT of TIME",RC[-1]-VLOOKUP(RC[-9],Enunciado!R3C6:R5C7,2,0),"") -> 
A705: Dept3-15443 | B705: Alto | C705: 41241 | D705: 41252 | E705: =+LEFT(RC[-4],5) -> Dept3 | F705: =+VLOOKUP(RC[-4],Enunciado!R3C6:R5C7,2,0)+RC[-3] -> 41246 | G705: =+IF(RC[-1]>=RC[-3],"ON TIME","OUT OF TIME") -> OUT OF TIME | H705: =+YEAR(RC[-5]) -> 2012 | I705: =+MONTH(RC[-6]) -> 11 | J705: =+RC[-6]-RC[-7] -> 11 | K705: =+IF(RC[-4]="OUT of TIME",RC[-1]-VLOOKUP(RC[-9],Enunciado!R3C6:R5C7,2,0),"") -> 6
A706: Dept5-21404 | B706: Medio | C706: 41225 | D706: 41255 | E706: =+LEFT(RC[-4],5) -> Dept5 | F706: =+VLOOKUP(RC[-4],Enunciado!R3C6:R5C7,2,0)+RC[-3] -> 41240 | G706: =+IF(RC[-1]>=RC[-3],"ON TIME","OUT OF TIME") -> OUT OF TIME | H706: =+YEAR(RC[-5]) -> 2012 | I706: =+MONTH(RC[-6]) -> 11 | J706: =+RC[-6]-RC[-7] -> 30 | K706: =+IF(RC[-4]="OUT of TIME",RC[-1]-VLOOKUP(RC[-9],Enunciado!R3C6:R5C7,2,0),"") -> 15
A707: Dept2-24714 | B707: Medio | C707: 41093 | D707: 41097 | E707: =+LEFT(RC[-4],5) -> Dept2 | F707: =+VLOOKUP(RC[-4],Enunciado!R3C6:R5C7,2,0)+RC[-3] -> 41108 | G707: =+IF(RC[-1]>=RC[-3],"ON TIME","OUT OF TIME") -> ON TIME | H707: =+YEAR(RC[-5]) -> 2012 | I707: =+MONTH(RC[-6]) -> 7 | J707: =+RC[-6]-RC[-7] -> 4 | K707: =+IF(RC[-4]="OUT of TIME",RC[-1]-VLOOKUP(RC[-9],Enunciado!R3C6:R5C7,2,0),"") -> 
A708: Dept5-23555 | B708: Alto | C708: 41588 | D708: 41621 | E708: =+LEFT(RC[-4],5) -> Dept5 | F708: =+VLOOKUP(RC[-4],Enunciado!R3C6:R5C7,2,0)+RC[-3] -> 41593 | G708: =+IF(RC[-1]>=RC[-3],"ON TIME","OUT OF TIME") -> OUT OF TIME | H708: =+YEAR(RC[-5]) -> 2013 | I708: =+MONTH(RC[-6]) -> 11 | J708: =+RC[-6]-RC[-7] -> 33 | K708: =+IF(RC[-4]="OUT of TIME",RC[-1]-VLOOKUP(RC[-9],Enunciado!R3C6:R5C7,2,0),"") -> 28
A709: Dept3-26478 | B709: Alto | C709: 41457 | D709: 41459 | E709: =+LEFT(RC[-4],5) -> Dept3 | F709: =+VLOOKUP(RC[-4],Enunciado!R3C6:R5C7,2,0)+RC[-3] -> 41462 | G709: =+IF(RC[-1]>=RC[-3],"ON TIME","OUT OF TIME") -> ON TIME | H709: =+YEAR(RC[-5]) -> 2013 | I709: =+MONTH(RC[-6]) -> 7 | J709: =+RC[-6]-RC[-7] -> 2 | K709: =+IF(RC[-4]="OUT of TIME",RC[-1]-VLOOKUP(RC[-9],Enunciado!R3C6:R5C7,2,0),"") -> 
A710: Dept6-22350 | B710: Bajo | C710: 41025 | D710: 41028 | E710: =+LEFT(RC[-4],5) -> Dept6 | F710: =+VLOOKUP(RC[-4],Enunciado!R3C6:R5C7,2,0)+RC[-3] -> 41055 | G710: =+IF(RC[-1]>=RC[-3],"ON TIME","OUT OF TIME") -> ON TIME | H710: =+YEAR(RC[-5]) -> 2012 | I710: =+MONTH(RC[-6]) -> 4 | J710: =+RC[-6]-RC[-7] -> 3 | K710: =+IF(RC[-4]="OUT of TIME",RC[-1]-VLOOKUP(RC[-9],Enunciado!R3C6:R5C7,2,0),"") -> 
A711: Dept1-20874 | B711: Alto | C711: 41463 | D711: 41485 | E711: =+LEFT(RC[-4],5) -> Dept1 | F711: =+VLOOKUP(RC[-4],Enunciado!R3C6:R5C7,2,0)+RC[-3] -> 41468 | G711: =+IF(RC[-1]>=RC[-3],"ON TIME","OUT OF TIME") -> OUT OF TIME | H711: =+YEAR(RC[-5]) -> 2013 | I711: =+MONTH(RC[-6]) -> 7 | J711: =+RC[-6]-RC[-7] -> 22 | K711: =+IF(RC[-4]="OUT of TIME",RC[-1]-VLOOKUP(RC[-9],Enunciado!R3C6:R5C7,2,0),"") -> 17
A712: Dept3-14179 | B712: Medio | C712: 40954 | D712: 40956 | E712: =+LEFT(RC[-4],5) -> Dept3 | F712: =+VLOOKUP(RC[-4],Enunciado!R3C6:R5C7,2,0)+RC[-3] -> 40969 | G712: =+IF(RC[-1]>=RC[-3],"ON TIME","OUT OF TIME") -> ON TIME | H712: =+YEAR(RC[-5]) -> 2012 | I712: =+MONTH(RC[-6]) -> 2 | J712: =+RC[-6]-RC[-7] -> 2 | K712: =+IF(RC[-4]="OUT of TIME",RC[-1]-VLOOKUP(RC[-9],Enunciado!R3C6:R5C7,2,0),"") -> 
A713: Dept5-6725 | B713: Bajo | C713: 41146 | D713: 41163 | E713: =+LEFT(RC[-4],5) -> Dept5 | F713: =+VLOOKUP(RC[-4],Enunciado!R3C6:R5C7,2,0)+RC[-3] -> 41176 | G713: =+IF(RC[-1]>=RC[-3],"ON TIME","OUT OF TIME") -> ON TIME | H713: =+YEAR(RC[-5]) -> 2012 | I713: =+MONTH(RC[-6]) -> 8 | J713: =+RC[-6]-RC[-7] -> 17 | K713: =+IF(RC[-4]="OUT of TIME",RC[-1]-VLOOKUP(RC[-9],Enunciado!R3C6:R5C7,2,0),"") -> 
A714: Dept6-22809 | B714: Medio | C714: 41491 | D714: 41492 | E714: =+LEFT(RC[-4],5) -> Dept6 | F714: =+VLOOKUP(RC[-4],Enunciado!R3C6:R5C7,2,0)+RC[-3] -> 41506 | G714: =+IF(RC[-1]>=RC[-3],"ON TIME","OUT OF TIME") -> ON TIME | H714: =+YEAR(RC[-5]) -> 2013 | I714: =+MONTH(RC[-6]) -> 8 | J714: =+RC[-6]-RC[-7] -> 1 | K714: =+IF(RC[-4]="OUT of TIME",RC[-1]-VLOOKUP(RC[-9],Enunciado!R3C6:R5C7,2,0),"") -> 
A715: Dept1-19959 | B715: Bajo | C715: 41193 | D715: 41200 | E715: =+LEFT(RC[-4],5) -> Dept1 | F715: =+VLOOKUP(RC[-4],Enunciado!R3C6:R5C7,2,0)+RC[-3] -> 41223 | G715: =+IF(RC[-1]>=RC[-3],"ON TIME","OUT OF TIME") -> ON TIME | H715: =+YEAR(RC[-5]) -> 2012 | I715: =+MONTH(RC[-6]) -> 10 | J715: =+RC[-6]-RC[-7] -> 7 | K715: =+IF(RC[-4]="OUT of TIME",RC[-1]-VLOOKUP(RC[-9],Enunciado!R3C6:R5C7,2,0),"") -> 
A716: Dept2-23598 | B716: Medio | C716: 41570 | D716: 41582 | E716: =+LEFT(RC[-4],5) -> Dept2 | F716: =+VLOOKUP(RC[-4],Enunciado!R3C6:R5C7,2,0)+RC[-3] -> 41585 | G716: =+IF(RC[-1]>=RC[-3],"ON TIME","OUT OF TIME") -> ON TIME | H716: =+YEAR(RC[-5]) -> 2013 | I716: =+MONTH(RC[-6]) -> 10 | J716: =+RC[-6]-RC[-7] -> 12 | K716: =+IF(RC[-4]="OUT of TIME",RC[-1]-VLOOKUP(RC[-9],Enunciado!R3C6:R5C7,2,0),"") -> 
A717: Dept2-1526 | B717: Medio | C717: 41093 | D717: 41096 | E717: =+LEFT(RC[-4],5) -> Dept2 | F717: =+VLOOKUP(RC[-4],Enunciado!R3C6:R5C7,2,0)+RC[-3] -> 41108 | G717: =+IF(RC[-1]>=RC[-3],"ON TIME","OUT OF TIME") -> ON TIME | H717: =+YEAR(RC[-5]) -> 2012 | I717: =+MONTH(RC[-6]) -> 7 | J717: =+RC[-6]-RC[-7] -> 3 | K717: =+IF(RC[-4]="OUT of TIME",RC[-1]-VLOOKUP(RC[-9],Enunciado!R3C6:R5C7,2,0),"") -> 
A718: Dept2-18313 | B718: Medio | C718: 41201 | D718: 41248 | E718: =+LEFT(RC[-4],5) -> Dept2 | F718: =+VLOOKUP(RC[-4],Enunciado!R3C6:R5C7,2,0)+RC[-3] -> 41216 | G718: =+IF(RC[-1]>=RC[-3],"ON TIME","OUT OF TIME") -> OUT OF TIME | H718: =+YEAR(RC[-5]) -> 2012 | I718: =+MONTH(RC[-6]) -> 10 | J718: =+RC[-6]-RC[-7] -> 47 | K718: =+IF(RC[-4]="OUT of TIME",RC[-1]-VLOOKUP(RC[-9],Enunciado!R3C6:R5C7,2,0),"") -> 32
A719: Dept6-3868 | B719: Medio | C719: 41059 | D719: 41106 | E719: =+LEFT(RC[-4],5) -> Dept6 | F719: =+VLOOKUP(RC[-4],Enunciado!R3C6:R5C7,2,0)+RC[-3] -> 41074 | G719: =+IF(RC[-1]>=RC[-3],"ON TIME","OUT OF TIME") -> OUT OF TIME | H719: =+YEAR(RC[-5]) -> 2012 | I719: =+MONTH(RC[-6]) -> 5 | J719: =+RC[-6]-RC[-7] -> 47 | K719: =+IF(RC[-4]="OUT of TIME",RC[-1]-VLOOKUP(RC[-9],Enunciado!R3C6:R5C7,2,0),"") -> 32
A720: Dept6-833 | B720: Alto | C720: 41132 | D720: 41133 | E720: =+LEFT(RC[-4],5) -> Dept6 | F720: =+VLOOKUP(RC[-4],Enunciado!R3C6:R5C7,2,0)+RC[-3] -> 41137 | G720: =+IF(RC[-1]>=RC[-3],"ON TIME","OUT OF TIME") -> ON TIME | H720: =+YEAR(RC[-5]) -> 2012 | I720: =+MONTH(RC[-6]) -> 8 | J720: =+RC[-6]-RC[-7] -> 1 | K720: =+IF(RC[-4]="OUT of TIME",RC[-1]-VLOOKUP(RC[-9],Enunciado!R3C6:R5C7,2,0),"") -> 
A721: Dept2-22504 | B721: Medio | C721: 41630 | D721: 41642 | E721: =+LEFT(RC[-4],5) -> Dept2 | F721: =+VLOOKUP(RC[-4],Enunciado!R3C6:R5C7,2,0)+RC[-3] -> 41645 | G721: =+IF(RC[-1]>=RC[-3],"ON TIME","OUT OF TIME") -> ON TIME | H721: =+YEAR(RC[-5]) -> 2013 | I721: =+MONTH(RC[-6]) -> 12 | J721: =+RC[-6]-RC[-7] -> 12 | K721: =+IF(RC[-4]="OUT of TIME",RC[-1]-VLOOKUP(RC[-9],Enunciado!R3C6:R5C7,2,0),"") -> 
A722: Dept6-11571 | B722: Alto | C722: 41366 | D722: 41413 | E722: =+LEFT(RC[-4],5) -> Dept6 | F722: =+VLOOKUP(RC[-4],Enunciado!R3C6:R5C7,2,0)+RC[-3] -> 41371 | G722: =+IF(RC[-1]>=RC[-3],"ON TIME","OUT OF TIME") -> OUT OF TIME | H722: =+YEAR(RC[-5]) -> 2013 | I722: =+MONTH(RC[-6]) -> 4 | J722: =+RC[-6]-RC[-7] -> 47 | K722: =+IF(RC[-4]="OUT of TIME",RC[-1]-VLOOKUP(RC[-9],Enunciado!R3C6:R5C7,2,0),"") -> 42
A723: Dept4-6797 | B723: Bajo | C723: 41186 | D723: 41231 | E723: =+LEFT(RC[-4],5) -> Dept4 | F723: =+VLOOKUP(RC[-4],Enunciado!R3C6:R5C7,2,0)+RC[-3] -> 41216 | G723: =+IF(RC[-1]>=RC[-3],"ON TIME","OUT OF TIME") -> OUT OF TIME | H723: =+YEAR(RC[-5]) -> 2012 | I723: =+MONTH(RC[-6]) -> 10 | J723: =+RC[-6]-RC[-7] -> 45 | K723: =+IF(RC[-4]="OUT of TIME",RC[-1]-VLOOKUP(RC[-9],Enunciado!R3C6:R5C7,2,0),"") -> 15
A724: Dept1-5912 | B724: Bajo | C724: 41224 | D724: 41228 | E724: =+LEFT(RC[-4],5) -> Dept1 | F724: =+VLOOKUP(RC[-4],Enunciado!R3C6:R5C7,2,0)+RC[-3] -> 41254 | G724: =+IF(RC[-1]>=RC[-3],"ON TIME","OUT OF TIME") -> ON TIME | H724: =+YEAR(RC[-5]) -> 2012 | I724: =+MONTH(RC[-6]) -> 11 | J724: =+RC[-6]-RC[-7] -> 4 | K724: =+IF(RC[-4]="OUT of TIME",RC[-1]-VLOOKUP(RC[-9],Enunciado!R3C6:R5C7,2,0),"") -> 
A725: Dept3-11464 | B725: Medio | C725: 41177 | D725: 41180 | E725: =+LEFT(RC[-4],5) -> Dept3 | F725: =+VLOOKUP(RC[-4],Enunciado!R3C6:R5C7,2,0)+RC[-3] -> 41192 | G725: =+IF(RC[-1]>=RC[-3],"ON TIME","OUT OF TIME") -> ON TIME | H725: =+YEAR(RC[-5]) -> 2012 | I725: =+MONTH(RC[-6]) -> 9 | J725: =+RC[-6]-RC[-7] -> 3 | K725: =+IF(RC[-4]="OUT of TIME",RC[-1]-VLOOKUP(RC[-9],Enunciado!R3C6:R5C7,2,0),"") -> 
A726: Dept3-19498 | B726: Medio | C726: 41100 | D726: 41146 | E726: =+LEFT(RC[-4],5) -> Dept3 | F726: =+VLOOKUP(RC[-4],Enunciado!R3C6:R5C7,2,0)+RC[-3] -> 41115 | G726: =+IF(RC[-1]>=RC[-3],"ON TIME","OUT OF TIME") -> OUT OF TIME | H726: =+YEAR(RC[-5]) -> 2012 | I726: =+MONTH(RC[-6]) -> 7 | J726: =+RC[-6]-RC[-7] -> 46 | K726: =+IF(RC[-4]="OUT of TIME",RC[-1]-VLOOKUP(RC[-9],Enunciado!R3C6:R5C7,2,0),"") -> 31
A727: Dept1-7891 | B727: Alto | C727: 41484 | D727: 41502 | E727: =+LEFT(RC[-4],5) -> Dept1 | F727: =+VLOOKUP(RC[-4],Enunciado!R3C6:R5C7,2,0)+RC[-3] -> 41489 | G727: =+IF(RC[-1]>=RC[-3],"ON TIME","OUT OF TIME") -> OUT OF TIME | H727: =+YEAR(RC[-5]) -> 2013 | I727: =+MONTH(RC[-6]) -> 7 | J727: =+RC[-6]-RC[-7] -> 18 | K727: =+IF(RC[-4]="OUT of TIME",RC[-1]-VLOOKUP(RC[-9],Enunciado!R3C6:R5C7,2,0),"") -> 13
A728: Dept4-10649 | B728: Medio | C728: 40998 | D728: 41000 | E728: =+LEFT(RC[-4],5) -> Dept4 | F728: =+VLOOKUP(RC[-4],Enunciado!R3C6:R5C7,2,0)+RC[-3] -> 41013 | G728: =+IF(RC[-1]>=RC[-3],"ON TIME","OUT OF TIME") -> ON TIME | H728: =+YEAR(RC[-5]) -> 2012 | I728: =+MONTH(RC[-6]) -> 3 | J728: =+RC[-6]-RC[-7] -> 2 | K728: =+IF(RC[-4]="OUT of TIME",RC[-1]-VLOOKUP(RC[-9],Enunciado!R3C6:R5C7,2,0),"") -> 
A729: Dept1-21807 | B729: Bajo | C729: 41579 | D729: 41590 | E729: =+LEFT(RC[-4],5) -> Dept1 | F729: =+VLOOKUP(RC[-4],Enunciado!R3C6:R5C7,2,0)+RC[-3] -> 41609 | G729: =+IF(RC[-1]>=RC[-3],"ON TIME","OUT OF TIME") -> ON TIME | H729: =+YEAR(RC[-5]) -> 2013 | I729: =+MONTH(RC[-6]) -> 11 | J729: =+RC[-6]-RC[-7] -> 11 | K729: =+IF(RC[-4]="OUT of TIME",RC[-1]-VLOOKUP(RC[-9],Enunciado!R3C6:R5C7,2,0),"") -> 
A730: Dept6-27753 | B730: Medio | C730: 41516 | D730: 41517 | E730: =+LEFT(RC[-4],5) -> Dept6 | F730: =+VLOOKUP(RC[-4],Enunciado!R3C6:R5C7,2,0)+RC[-3] -> 41531 | G730: =+IF(RC[-1]>=RC[-3],"ON TIME","OUT OF TIME") -> ON TIME | H730: =+YEAR(RC[-5]) -> 2013 | I730: =+MONTH(RC[-6]) -> 8 | J730: =+RC[-6]-RC[-7] -> 1 | K730: =+IF(RC[-4]="OUT of TIME",RC[-1]-VLOOKUP(RC[-9],Enunciado!R3C6:R5C7,2,0),"") -> 
A731: Dept2-11404 | B731: Bajo | C731: 41279 | D731: 41282 | E731: =+LEFT(RC[-4],5) -> Dept2 | F731: =+VLOOKUP(RC[-4],Enunciado!R3C6:R5C7,2,0)+RC[-3] -> 41309 | G731: =+IF(RC[-1]>=RC[-3],"ON TIME","OUT OF TIME") -> ON TIME | H731: =+YEAR(RC[-5]) -> 2013 | I731: =+MONTH(RC[-6]) -> 1 | J731: =+RC[-6]-RC[-7] -> 3 | K731: =+IF(RC[-4]="OUT of TIME",RC[-1]-VLOOKUP(RC[-9],Enunciado!R3C6:R5C7,2,0),"") -> 
A732: Dept3-6927 | B732: Medio | C732: 40977 | D732: 40977 | E732: =+LEFT(RC[-4],5) -> Dept3 | F732: =+VLOOKUP(RC[-4],Enunciado!R3C6:R5C7,2,0)+RC[-3] -> 40992 | G732: =+IF(RC[-1]>=RC[-3],"ON TIME","OUT OF TIME") -> ON TIME | H732: =+YEAR(RC[-5]) -> 2012 | I732: =+MONTH(RC[-6]) -> 3 | J732: =+RC[-6]-RC[-7] -> 0 | K732: =+IF(RC[-4]="OUT of TIME",RC[-1]-VLOOKUP(RC[-9],Enunciado!R3C6:R5C7,2,0),"") -> 
A733: Dept1-17430 | B733: Alto | C733: 41244 | D733: 41254 | E733: =+LEFT(RC[-4],5) -> Dept1 | F733: =+VLOOKUP(RC[-4],Enunciado!R3C6:R5C7,2,0)+RC[-3] -> 41249 | G733: =+IF(RC[-1]>=RC[-3],"ON TIME","OUT OF TIME") -> OUT OF TIME | H733: =+YEAR(RC[-5]) -> 2012 | I733: =+MONTH(RC[-6]) -> 12 | J733: =+RC[-6]-RC[-7] -> 10 | K733: =+IF(RC[-4]="OUT of TIME",RC[-1]-VLOOKUP(RC[-9],Enunciado!R3C6:R5C7,2,0),"") -> 5
A734: Dept6-12764 | B734: Medio | C734: 41540 | D734: 41588 | E734: =+LEFT(RC[-4],5) -> Dept6 | F734: =+VLOOKUP(RC[-4],Enunciado!R3C6:R5C7,2,0)+RC[-3] -> 41555 | G734: =+IF(RC[-1]>=RC[-3],"ON TIME","OUT OF TIME") -> OUT OF TIME | H734: =+YEAR(RC[-5]) -> 2013 | I734: =+MONTH(RC[-6]) -> 9 | J734: =+RC[-6]-RC[-7] -> 48 | K734: =+IF(RC[-4]="OUT of TIME",RC[-1]-VLOOKUP(RC[-9],Enunciado!R3C6:R5C7,2,0),"") -> 33
A735: Dept1-14353 | B735: Medio | C735: 41472 | D735: 41496 | E735: =+LEFT(RC[-4],5) -> Dept1 | F735: =+VLOOKUP(RC[-4],Enunciado!R3C6:R5C7,2,0)+RC[-3] -> 41487 | G735: =+IF(RC[-1]>=RC[-3],"ON TIME","OUT OF TIME") -> OUT OF TIME | H735: =+YEAR(RC[-5]) -> 2013 | I735: =+MONTH(RC[-6]) -> 7 | J735: =+RC[-6]-RC[-7] -> 24 | K735: =+IF(RC[-4]="OUT of TIME",RC[-1]-VLOOKUP(RC[-9],Enunciado!R3C6:R5C7,2,0),"") -> 9
A736: Dept5-2478 | B736: Bajo | C736: 41221 | D736: 41234 | E736: =+LEFT(RC[-4],5) -> Dept5 | F736: =+VLOOKUP(RC[-4],Enunciado!R3C6:R5C7,2,0)+RC[-3] -> 41251 | G736: =+IF(RC[-1]>=RC[-3],"ON TIME","OUT OF TIME") -> ON TIME | H736: =+YEAR(RC[-5]) -> 2012 | I736: =+MONTH(RC[-6]) -> 11 | J736: =+RC[-6]-RC[-7] -> 13 | K736: =+IF(RC[-4]="OUT of TIME",RC[-1]-VLOOKUP(RC[-9],Enunciado!R3C6:R5C7,2,0),"") -> 
A737: Dept4-9132 | B737: Medio | C737: 40915 | D737: 40916 | E737: =+LEFT(RC[-4],5) -> Dept4 | F737: =+VLOOKUP(RC[-4],Enunciado!R3C6:R5C7,2,0)+RC[-3] -> 40930 | G737: =+IF(RC[-1]>=RC[-3],"ON TIME","OUT OF TIME") -> ON TIME | H737: =+YEAR(RC[-5]) -> 2012 | I737: =+MONTH(RC[-6]) -> 1 | J737: =+RC[-6]-RC[-7] -> 1 | K737: =+IF(RC[-4]="OUT of TIME",RC[-1]-VLOOKUP(RC[-9],Enunciado!R3C6:R5C7,2,0),"") -> 
A738: Dept3-1262 | B738: Bajo | C738: 41512 | D738: 41514 | E738: =+LEFT(RC[-4],5) -> Dept3 | F738: =+VLOOKUP(RC[-4],Enunciado!R3C6:R5C7,2,0)+RC[-3] -> 41542 | G738: =+IF(RC[-1]>=RC[-3],"ON TIME","OUT OF TIME") -> ON TIME | H738: =+YEAR(RC[-5]) -> 2013 | I738: =+MONTH(RC[-6]) -> 8 | J738: =+RC[-6]-RC[-7] -> 2 | K738: =+IF(RC[-4]="OUT of TIME",RC[-1]-VLOOKUP(RC[-9],Enunciado!R3C6:R5C7,2,0),"") -> 
A739: Dept5-11675 | B739: Alto | C739: 41481 | D739: 41484 | E739: =+LEFT(RC[-4],5) -> Dept5 | F739: =+VLOOKUP(RC[-4],Enunciado!R3C6:R5C7,2,0)+RC[-3] -> 41486 | G739: =+IF(RC[-1]>=RC[-3],"ON TIME","OUT OF TIME") -> ON TIME | H739: =+YEAR(RC[-5]) -> 2013 | I739: =+MONTH(RC[-6]) -> 7 | J739: =+RC[-6]-RC[-7] -> 3 | K739: =+IF(RC[-4]="OUT of TIME",RC[-1]-VLOOKUP(RC[-9],Enunciado!R3C6:R5C7,2,0),"") -> 
A740: Dept1-24167 | B740: Bajo | C740: 41091 | D740: 41107 | E740: =+LEFT(RC[-4],5) -> Dept1 | F740: =+VLOOKUP(RC[-4],Enunciado!R3C6:R5C7,2,0)+RC[-3] -> 41121 | G740: =+IF(RC[-1]>=RC[-3],"ON TIME","OUT OF TIME") -> ON TIME | H740: =+YEAR(RC[-5]) -> 2012 | I740: =+MONTH(RC[-6]) -> 7 | J740: =+RC[-6]-RC[-7] -> 16 | K740: =+IF(RC[-4]="OUT of TIME",RC[-1]-VLOOKUP(RC[-9],Enunciado!R3C6:R5C7,2,0),"") -> 
A741: Dept2-18528 | B741: Medio | C741: 41141 | D741: 41149 | E741: =+LEFT(RC[-4],5) -> Dept2 | F741: =+VLOOKUP(RC[-4],Enunciado!R3C6:R5C7,2,0)+RC[-3] -> 41156 | G741: =+IF(RC[-1]>=RC[-3],"ON TIME","OUT OF TIME") -> ON TIME | H741: =+YEAR(RC[-5]) -> 2012 | I741: =+MONTH(RC[-6]) -> 8 | J741: =+RC[-6]-RC[-7] -> 8 | K741: =+IF(RC[-4]="OUT of TIME",RC[-1]-VLOOKUP(RC[-9],Enunciado!R3C6:R5C7,2,0),"") -> 
A742: Dept2-17315 | B742: Medio | C742: 41514 | D742: 41527 | E742: =+LEFT(RC[-4],5) -> Dept2 | F742: =+VLOOKUP(RC[-4],Enunciado!R3C6:R5C7,2,0)+RC[-3] -> 41529 | G742: =+IF(RC[-1]>=RC[-3],"ON TIME","OUT OF TIME") -> ON TIME | H742: =+YEAR(RC[-5]) -> 2013 | I742: =+MONTH(RC[-6]) -> 8 | J742: =+RC[-6]-RC[-7] -> 13 | K742: =+IF(RC[-4]="OUT of TIME",RC[-1]-VLOOKUP(RC[-9],Enunciado!R3C6:R5C7,2,0),"") -> 
A743: Dept5-8884 | B743: Medio | C743: 41136 | D743: 41137 | E743: =+LEFT(RC[-4],5) -> Dept5 | F743: =+VLOOKUP(RC[-4],Enunciado!R3C6:R5C7,2,0)+RC[-3] -> 41151 | G743: =+IF(RC[-1]>=RC[-3],"ON TIME","OUT OF TIME") -> ON TIME | H743: =+YEAR(RC[-5]) -> 2012 | I743: =+MONTH(RC[-6]) -> 8 | J743: =+RC[-6]-RC[-7] -> 1 | K743: =+IF(RC[-4]="OUT of TIME",RC[-1]-VLOOKUP(RC[-9],Enunciado!R3C6:R5C7,2,0),"") -> 
A744: Dept2-8768 | B744: Bajo | C744: 41368 | D744: 41369 | E744: =+LEFT(RC[-4],5) -> Dept2 | F744: =+VLOOKUP(RC[-4],Enunciado!R3C6:R5C7,2,0)+RC[-3] -> 41398 | G744: =+IF(RC[-1]>=RC[-3],"ON TIME","OUT OF TIME") -> ON TIME | H744: =+YEAR(RC[-5]) -> 2013 | I744: =+MONTH(RC[-6]) -> 4 | J744: =+RC[-6]-RC[-7] -> 1 | K744: =+IF(RC[-4]="OUT of TIME",RC[-1]-VLOOKUP(RC[-9],Enunciado!R3C6:R5C7,2,0),"") -> 
A745: Dept6-19445 | B745: Alto | C745: 41491 | D745: 41494 | E745: =+LEFT(RC[-4],5) -> Dept6 | F745: =+VLOOKUP(RC[-4],Enunciado!R3C6:R5C7,2,0)+RC[-3] -> 41496 | G745: =+IF(RC[-1]>=RC[-3],"ON TIME","OUT OF TIME") -> ON TIME | H745: =+YEAR(RC[-5]) -> 2013 | I745: =+MONTH(RC[-6]) -> 8 | J745: =+RC[-6]-RC[-7] -> 3 | K745: =+IF(RC[-4]="OUT of TIME",RC[-1]-VLOOKUP(RC[-9],Enunciado!R3C6:R5C7,2,0),"") -> 
A746: Dept6-6851 | B746: Medio | C746: 41002 | D746: 41010 | E746: =+LEFT(RC[-4],5) -> Dept6 | F746: =+VLOOKUP(RC[-4],Enunciado!R3C6:R5C7,2,0)+RC[-3] -> 41017 | G746: =+IF(RC[-1]>=RC[-3],"ON TIME","OUT OF TIME") -> ON TIME | H746: =+YEAR(RC[-5]) -> 2012 | I746: =+MONTH(RC[-6]) -> 4 | J746: =+RC[-6]-RC[-7] -> 8 | K746: =+IF(RC[-4]="OUT of TIME",RC[-1]-VLOOKUP(RC[-9],Enunciado!R3C6:R5C7,2,0),"") -> 
A747: Dept4-12225 | B747: Bajo | C747: 41396 | D747: 41425 | E747: =+LEFT(RC[-4],5) -> Dept4 | F747: =+VLOOKUP(RC[-4],Enunciado!R3C6:R5C7,2,0)+RC[-3] -> 41426 | G747: =+IF(RC[-1]>=RC[-3],"ON TIME","OUT OF TIME") -> ON TIME | H747: =+YEAR(RC[-5]) -> 2013 | I747: =+MONTH(RC[-6]) -> 5 | J747: =+RC[-6]-RC[-7] -> 29 | K747: =+IF(RC[-4]="OUT of TIME",RC[-1]-VLOOKUP(RC[-9],Enunciado!R3C6:R5C7,2,0),"") -> 
A748: Dept2-1250 | B748: Medio | C748: 40965 | D748: 40979 | E748: =+LEFT(RC[-4],5) -> Dept2 | F748: =+VLOOKUP(RC[-4],Enunciado!R3C6:R5C7,2,0)+RC[-3] -> 40980 | G748: =+IF(RC[-1]>=RC[-3],"ON TIME","OUT OF TIME") -> ON TIME | H748: =+YEAR(RC[-5]) -> 2012 | I748: =+MONTH(RC[-6]) -> 2 | J748: =+RC[-6]-RC[-7] -> 14 | K748: =+IF(RC[-4]="OUT of TIME",RC[-1]-VLOOKUP(RC[-9],Enunciado!R3C6:R5C7,2,0),"") -> 
A749: Dept4-6835 | B749: Bajo | C749: 41102 | D749: 41144 | E749: =+LEFT(RC[-4],5) -> Dept4 | F749: =+VLOOKUP(RC[-4],Enunciado!R3C6:R5C7,2,0)+RC[-3] -> 41132 | G749: =+IF(RC[-1]>=RC[-3],"ON TIME","OUT OF TIME") -> OUT OF TIME | H749: =+YEAR(RC[-5]) -> 2012 | I749: =+MONTH(RC[-6]) -> 7 | J749: =+RC[-6]-RC[-7] -> 42 | K749: =+IF(RC[-4]="OUT of TIME",RC[-1]-VLOOKUP(RC[-9],Enunciado!R3C6:R5C7,2,0),"") -> 12
A750: Dept4-9699 | B750: Alto | C750: 41022 | D750: 41026 | E750: =+LEFT(RC[-4],5) -> Dept4 | F750: =+VLOOKUP(RC[-4],Enunciado!R3C6:R5C7,2,0)+RC[-3] -> 41027 | G750: =+IF(RC[-1]>=RC[-3],"ON TIME","OUT OF TIME") -> ON TIME | H750: =+YEAR(RC[-5]) -> 2012 | I750: =+MONTH(RC[-6]) -> 4 | J750: =+RC[-6]-RC[-7] -> 4 | K750: =+IF(RC[-4]="OUT of TIME",RC[-1]-VLOOKUP(RC[-9],Enunciado!R3C6:R5C7,2,0),"") -> 
A751: Dept1-26333 | B751: Medio | C751: 41061 | D751: 41065 | E751: =+LEFT(RC[-4],5) -> Dept1 | F751: =+VLOOKUP(RC[-4],Enunciado!R3C6:R5C7,2,0)+RC[-3] -> 41076 | G751: =+IF(RC[-1]>=RC[-3],"ON TIME","OUT OF TIME") -> ON TIME | H751: =+YEAR(RC[-5]) -> 2012 | I751: =+MONTH(RC[-6]) -> 6 | J751: =+RC[-6]-RC[-7] -> 4 | K751: =+IF(RC[-4]="OUT of TIME",RC[-1]-VLOOKUP(RC[-9],Enunciado!R3C6:R5C7,2,0),"") -> 
A752: Dept5-558 | B752: Bajo | C752: 41230 | D752: 41254 | E752: =+LEFT(RC[-4],5) -> Dept5 | F752: =+VLOOKUP(RC[-4],Enunciado!R3C6:R5C7,2,0)+RC[-3] -> 41260 | G752: =+IF(RC[-1]>=RC[-3],"ON TIME","OUT OF TIME") -> ON TIME | H752: =+YEAR(RC[-5]) -> 2012 | I752: =+MONTH(RC[-6]) -> 11 | J752: =+RC[-6]-RC[-7] -> 24 | K752: =+IF(RC[-4]="OUT of TIME",RC[-1]-VLOOKUP(RC[-9],Enunciado!R3C6:R5C7,2,0),"") -> 
A753: Dept4-13180 | B753: Alto | C753: 41069 | D753: 41070 | E753: =+LEFT(RC[-4],5) -> Dept4 | F753: =+VLOOKUP(RC[-4],Enunciado!R3C6:R5C7,2,0)+RC[-3] -> 41074 | G753: =+IF(RC[-1]>=RC[-3],"ON TIME","OUT OF TIME") -> ON TIME | H753: =+YEAR(RC[-5]) -> 2012 | I753: =+MONTH(RC[-6]) -> 6 | J753: =+RC[-6]-RC[-7] -> 1 | K753: =+IF(RC[-4]="OUT of TIME",RC[-1]-VLOOKUP(RC[-9],Enunciado!R3C6:R5C7,2,0),"") -> 
A754: Dept1-9113 | B754: Bajo | C754: 41069 | D754: 41111 | E754: =+LEFT(RC[-4],5) -> Dept1 | F754: =+VLOOKUP(RC[-4],Enunciado!R3C6:R5C7,2,0)+RC[-3] -> 41099 | G754: =+IF(RC[-1]>=RC[-3],"ON TIME","OUT OF TIME") -> OUT OF TIME | H754: =+YEAR(RC[-5]) -> 2012 | I754: =+MONTH(RC[-6]) -> 6 | J754: =+RC[-6]-RC[-7] -> 42 | K754: =+IF(RC[-4]="OUT of TIME",RC[-1]-VLOOKUP(RC[-9],Enunciado!R3C6:R5C7,2,0),"") -> 12
A755: Dept4-29387 | B755: Alto | C755: 41269 | D755: 41270 | E755: =+LEFT(RC[-4],5) -> Dept4 | F755: =+VLOOKUP(RC[-4],Enunciado!R3C6:R5C7,2,0)+RC[-3] -> 41274 | G755: =+IF(RC[-1]>=RC[-3],"ON TIME","OUT OF TIME") -> ON TIME | H755: =+YEAR(RC[-5]) -> 2012 | I755: =+MONTH(RC[-6]) -> 12 | J755: =+RC[-6]-RC[-7] -> 1 | K755: =+IF(RC[-4]="OUT of TIME",RC[-1]-VLOOKUP(RC[-9],Enunciado!R3C6:R5C7,2,0),"") -> 
A756: Dept6-22889 | B756: Bajo | C756: 41247 | D756: 41260 | E756: =+LEFT(RC[-4],5) -> Dept6 | F756: =+VLOOKUP(RC[-4],Enunciado!R3C6:R5C7,2,0)+RC[-3] -> 41277 | G756: =+IF(RC[-1]>=RC[-3],"ON TIME","OUT OF TIME") -> ON TIME | H756: =+YEAR(RC[-5]) -> 2012 | I756: =+MONTH(RC[-6]) -> 12 | J756: =+RC[-6]-RC[-7] -> 13 | K756: =+IF(RC[-4]="OUT of TIME",RC[-1]-VLOOKUP(RC[-9],Enunciado!R3C6:R5C7,2,0),"") -> 
A757: Dept4-12395 | B757: Medio | C757: 41402 | D757: 41406 | E757: =+LEFT(RC[-4],5) -> Dept4 | F757: =+VLOOKUP(RC[-4],Enunciado!R3C6:R5C7,2,0)+RC[-3] -> 41417 | G757: =+IF(RC[-1]>=RC[-3],"ON TIME","OUT OF TIME") -> ON TIME | H757: =+YEAR(RC[-5]) -> 2013 | I757: =+MONTH(RC[-6]) -> 5 | J757: =+RC[-6]-RC[-7] -> 4 | K757: =+IF(RC[-4]="OUT of TIME",RC[-1]-VLOOKUP(RC[-9],Enunciado!R3C6:R5C7,2,0),"") -> 
A758: Dept2-28807 | B758: Alto | C758: 41301 | D758: 41304 | E758: =+LEFT(RC[-4],5) -> Dept2 | F758: =+VLOOKUP(RC[-4],Enunciado!R3C6:R5C7,2,0)+RC[-3] -> 41306 | G758: =+IF(RC[-1]>=RC[-3],"ON TIME","OUT OF TIME") -> ON TIME | H758: =+YEAR(RC[-5]) -> 2013 | I758: =+MONTH(RC[-6]) -> 1 | J758: =+RC[-6]-RC[-7] -> 3 | K758: =+IF(RC[-4]="OUT of TIME",RC[-1]-VLOOKUP(RC[-9],Enunciado!R3C6:R5C7,2,0),"") -> 
A759: Dept2-15767 | B759: Medio | C759: 41609 | D759: 41613 | E759: =+LEFT(RC[-4],5) -> Dept2 | F759: =+VLOOKUP(RC[-4],Enunciado!R3C6:R5C7,2,0)+RC[-3] -> 41624 | G759: =+IF(RC[-1]>=RC[-3],"ON TIME","OUT OF TIME") -> ON TIME | H759: =+YEAR(RC[-5]) -> 2013 | I759: =+MONTH(RC[-6]) -> 12 | J759: =+RC[-6]-RC[-7] -> 4 | K759: =+IF(RC[-4]="OUT of TIME",RC[-1]-VLOOKUP(RC[-9],Enunciado!R3C6:R5C7,2,0),"") -> 
A760: Dept5-22482 | B760: Alto | C760: 40949 | D760: 40951 | E760: =+LEFT(RC[-4],5) -> Dept5 | F760: =+VLOOKUP(RC[-4],Enunciado!R3C6:R5C7,2,0)+RC[-3] -> 40954 | G760: =+IF(RC[-1]>=RC[-3],"ON TIME","OUT OF TIME") -> ON TIME | H760: =+YEAR(RC[-5]) -> 2012 | I760: =+MONTH(RC[-6]) -> 2 | J760: =+RC[-6]-RC[-7] -> 2 | K760: =+IF(RC[-4]="OUT of TIME",RC[-1]-VLOOKUP(RC[-9],Enunciado!R3C6:R5C7,2,0),"") -> 
A761: Dept1-11240 | B761: Bajo | C761: 41308 | D761: 41310 | E761: =+LEFT(RC[-4],5) -> Dept1 | F761: =+VLOOKUP(RC[-4],Enunciado!R3C6:R5C7,2,0)+RC[-3] -> 41338 | G761: =+IF(RC[-1]>=RC[-3],"ON TIME","OUT OF TIME") -> ON TIME | H761: =+YEAR(RC[-5]) -> 2013 | I761: =+MONTH(RC[-6]) -> 2 | J761: =+RC[-6]-RC[-7] -> 2 | K761: =+IF(RC[-4]="OUT of TIME",RC[-1]-VLOOKUP(RC[-9],Enunciado!R3C6:R5C7,2,0),"") -> 
A762: Dept6-27487 | B762: Medio | C762: 41389 | D762: 41390 | E762: =+LEFT(RC[-4],5) -> Dept6 | F762: =+VLOOKUP(RC[-4],Enunciado!R3C6:R5C7,2,0)+RC[-3] -> 41404 | G762: =+IF(RC[-1]>=RC[-3],"ON TIME","OUT OF TIME") -> ON TIME | H762: =+YEAR(RC[-5]) -> 2013 | I762: =+MONTH(RC[-6]) -> 4 | J762: =+RC[-6]-RC[-7] -> 1 | K762: =+IF(RC[-4]="OUT of TIME",RC[-1]-VLOOKUP(RC[-9],Enunciado!R3C6:R5C7,2,0),"") -> 
A763: Dept5-16212 | B763: Alto | C763: 41574 | D763: 41578 | E763: =+LEFT(RC[-4],5) -> Dept5 | F763: =+VLOOKUP(RC[-4],Enunciado!R3C6:R5C7,2,0)+RC[-3] -> 41579 | G763: =+IF(RC[-1]>=RC[-3],"ON TIME","OUT OF TIME") -> ON TIME | H763: =+YEAR(RC[-5]) -> 2013 | I763: =+MONTH(RC[-6]) -> 10 | J763: =+RC[-6]-RC[-7] -> 4 | K763: =+IF(RC[-4]="OUT of TIME",RC[-1]-VLOOKUP(RC[-9],Enunciado!R3C6:R5C7,2,0),"") -> 
A764: Dept1-29890 | B764: Bajo | C764: 40942 | D764: 40970 | E764: =+LEFT(RC[-4],5) -> Dept1 | F764: =+VLOOKUP(RC[-4],Enunciado!R3C6:R5C7,2,0)+RC[-3] -> 40972 | G764: =+IF(RC[-1]>=RC[-3],"ON TIME","OUT OF TIME") -> ON TIME | H764: =+YEAR(RC[-5]) -> 2012 | I764: =+MONTH(RC[-6]) -> 2 | J764: =+RC[-6]-RC[-7] -> 28 | K764: =+IF(RC[-4]="OUT of TIME",RC[-1]-VLOOKUP(RC[-9],Enunciado!R3C6:R5C7,2,0),"") -> 
A765: Dept1-28221 | B765: Bajo | C765: 41521 | D765: 41524 | E765: =+LEFT(RC[-4],5) -> Dept1 | F765: =+VLOOKUP(RC[-4],Enunciado!R3C6:R5C7,2,0)+RC[-3] -> 41551 | G765: =+IF(RC[-1]>=RC[-3],"ON TIME","OUT OF TIME") -> ON TIME | H765: =+YEAR(RC[-5]) -> 2013 | I765: =+MONTH(RC[-6]) -> 9 | J765: =+RC[-6]-RC[-7] -> 3 | K765: =+IF(RC[-4]="OUT of TIME",RC[-1]-VLOOKUP(RC[-9],Enunciado!R3C6:R5C7,2,0),"") -> 
A766: Dept2-10876 | B766: Alto | C766: 41041 | D766: 41060 | E766: =+LEFT(RC[-4],5) -> Dept2 | F766: =+VLOOKUP(RC[-4],Enunciado!R3C6:R5C7,2,0)+RC[-3] -> 41046 | G766: =+IF(RC[-1]>=RC[-3],"ON TIME","OUT OF TIME") -> OUT OF TIME | H766: =+YEAR(RC[-5]) -> 2012 | I766: =+MONTH(RC[-6]) -> 5 | J766: =+RC[-6]-RC[-7] -> 19 | K766: =+IF(RC[-4]="OUT of TIME",RC[-1]-VLOOKUP(RC[-9],Enunciado!R3C6:R5C7,2,0),"") -> 14
A767: Dept4-5473 | B767: Alto | C767: 41565 | D767: 41568 | E767: =+LEFT(RC[-4],5) -> Dept4 | F767: =+VLOOKUP(RC[-4],Enunciado!R3C6:R5C7,2,0)+RC[-3] -> 41570 | G767: =+IF(RC[-1]>=RC[-3],"ON TIME","OUT OF TIME") -> ON TIME | H767: =+YEAR(RC[-5]) -> 2013 | I767: =+MONTH(RC[-6]) -> 10 | J767: =+RC[-6]-RC[-7] -> 3 | K767: =+IF(RC[-4]="OUT of TIME",RC[-1]-VLOOKUP(RC[-9],Enunciado!R3C6:R5C7,2,0),"") -> 
A768: Dept4-27768 | B768: Alto | C768: 41443 | D768: 41453 | E768: =+LEFT(RC[-4],5) -> Dept4 | F768: =+VLOOKUP(RC[-4],Enunciado!R3C6:R5C7,2,0)+RC[-3] -> 41448 | G768: =+IF(RC[-1]>=RC[-3],"ON TIME","OUT OF TIME") -> OUT OF TIME | H768: =+YEAR(RC[-5]) -> 2013 | I768: =+MONTH(RC[-6]) -> 6 | J768: =+RC[-6]-RC[-7] -> 10 | K768: =+IF(RC[-4]="OUT of TIME",RC[-1]-VLOOKUP(RC[-9],Enunciado!R3C6:R5C7,2,0),"") -> 5
A769: Dept5-19998 | B769: Bajo | C769: 41479 | D769: 41496 | E769: =+LEFT(RC[-4],5) -> Dept5 | F769: =+VLOOKUP(RC[-4],Enunciado!R3C6:R5C7,2,0)+RC[-3] -> 41509 | G769: =+IF(RC[-1]>=RC[-3],"ON TIME","OUT OF TIME") -> ON TIME | H769: =+YEAR(RC[-5]) -> 2013 | I769: =+MONTH(RC[-6]) -> 7 | J769: =+RC[-6]-RC[-7] -> 17 | K769: =+IF(RC[-4]="OUT of TIME",RC[-1]-VLOOKUP(RC[-9],Enunciado!R3C6:R5C7,2,0),"") -> 
A770: Dept6-1255 | B770: Alto | C770: 41635 | D770: 41654 | E770: =+LEFT(RC[-4],5) -> Dept6 | F770: =+VLOOKUP(RC[-4],Enunciado!R3C6:R5C7,2,0)+RC[-3] -> 41640 | G770: =+IF(RC[-1]>=RC[-3],"ON TIME","OUT OF TIME") -> OUT OF TIME | H770: =+YEAR(RC[-5]) -> 2013 | I770: =+MONTH(RC[-6]) -> 12 | J770: =+RC[-6]-RC[-7] -> 19 | K770: =+IF(RC[-4]="OUT of TIME",RC[-1]-VLOOKUP(RC[-9],Enunciado!R3C6:R5C7,2,0),"") -> 14
A771: Dept6-27472 | B771: Bajo | C771: 41536 | D771: 41548 | E771: =+LEFT(RC[-4],5) -> Dept6 | F771: =+VLOOKUP(RC[-4],Enunciado!R3C6:R5C7,2,0)+RC[-3] -> 41566 | G771: =+IF(RC[-1]>=RC[-3],"ON TIME","OUT OF TIME") -> ON TIME | H771: =+YEAR(RC[-5]) -> 2013 | I771: =+MONTH(RC[-6]) -> 9 | J771: =+RC[-6]-RC[-7] -> 12 | K771: =+IF(RC[-4]="OUT of TIME",RC[-1]-VLOOKUP(RC[-9],Enunciado!R3C6:R5C7,2,0),"") -> 
A772: Dept4-14151 | B772: Medio | C772: 41530 | D772: 41533 | E772: =+LEFT(RC[-4],5) -> Dept4 | F772: =+VLOOKUP(RC[-4],Enunciado!R3C6:R5C7,2,0)+RC[-3] -> 41545 | G772: =+IF(RC[-1]>=RC[-3],"ON TIME","OUT OF TIME") -> ON TIME | H772: =+YEAR(RC[-5]) -> 2013 | I772: =+MONTH(RC[-6]) -> 9 | J772: =+RC[-6]-RC[-7] -> 3 | K772: =+IF(RC[-4]="OUT of TIME",RC[-1]-VLOOKUP(RC[-9],Enunciado!R3C6:R5C7,2,0),"") -> 
A773: Dept2-25293 | B773: Alto | C773: 41516 | D773: 41559 | E773: =+LEFT(RC[-4],5) -> Dept2 | F773: =+VLOOKUP(RC[-4],Enunciado!R3C6:R5C7,2,0)+RC[-3] -> 41521 | G773: =+IF(RC[-1]>=RC[-3],"ON TIME","OUT OF TIME") -> OUT OF TIME | H773: =+YEAR(RC[-5]) -> 2013 | I773: =+MONTH(RC[-6]) -> 8 | J773: =+RC[-6]-RC[-7] -> 43 | K773: =+IF(RC[-4]="OUT of TIME",RC[-1]-VLOOKUP(RC[-9],Enunciado!R3C6:R5C7,2,0),"") -> 38
A774: Dept4-14484 | B774: Alto | C774: 41069 | D774: 41102 | E774: =+LEFT(RC[-4],5) -> Dept4 | F774: =+VLOOKUP(RC[-4],Enunciado!R3C6:R5C7,2,0)+RC[-3] -> 41074 | G774: =+IF(RC[-1]>=RC[-3],"ON TIME","OUT OF TIME") -> OUT OF TIME | H774: =+YEAR(RC[-5]) -> 2012 | I774: =+MONTH(RC[-6]) -> 6 | J774: =+RC[-6]-RC[-7] -> 33 | K774: =+IF(RC[-4]="OUT of TIME",RC[-1]-VLOOKUP(RC[-9],Enunciado!R3C6:R5C7,2,0),"") -> 28
A775: Dept4-27955 | B775: Alto | C775: 41076 | D775: 41078 | E775: =+LEFT(RC[-4],5) -> Dept4 | F775: =+VLOOKUP(RC[-4],Enunciado!R3C6:R5C7,2,0)+RC[-3] -> 41081 | G775: =+IF(RC[-1]>=RC[-3],"ON TIME","OUT OF TIME") -> ON TIME | H775: =+YEAR(RC[-5]) -> 2012 | I775: =+MONTH(RC[-6]) -> 6 | J775: =+RC[-6]-RC[-7] -> 2 | K775: =+IF(RC[-4]="OUT of TIME",RC[-1]-VLOOKUP(RC[-9],Enunciado!R3C6:R5C7,2,0),"") -> 
A776: Dept2-13236 | B776: Bajo | C776: 41095 | D776: 41096 | E776: =+LEFT(RC[-4],5) -> Dept2 | F776: =+VLOOKUP(RC[-4],Enunciado!R3C6:R5C7,2,0)+RC[-3] -> 41125 | G776: =+IF(RC[-1]>=RC[-3],"ON TIME","OUT OF TIME") -> ON TIME | H776: =+YEAR(RC[-5]) -> 2012 | I776: =+MONTH(RC[-6]) -> 7 | J776: =+RC[-6]-RC[-7] -> 1 | K776: =+IF(RC[-4]="OUT of TIME",RC[-1]-VLOOKUP(RC[-9],Enunciado!R3C6:R5C7,2,0),"") -> 
A777: Dept4-16294 | B777: Bajo | C777: 40981 | D777: 40985 | E777: =+LEFT(RC[-4],5) -> Dept4 | F777: =+VLOOKUP(RC[-4],Enunciado!R3C6:R5C7,2,0)+RC[-3] -> 41011 | G777: =+IF(RC[-1]>=RC[-3],"ON TIME","OUT OF TIME") -> ON TIME | H777: =+YEAR(RC[-5]) -> 2012 | I777: =+MONTH(RC[-6]) -> 3 | J777: =+RC[-6]-RC[-7] -> 4 | K777: =+IF(RC[-4]="OUT of TIME",RC[-1]-VLOOKUP(RC[-9],Enunciado!R3C6:R5C7,2,0),"") -> 
A778: Dept5-14543 | B778: Medio | C778: 41108 | D778: 41112 | E778: =+LEFT(RC[-4],5) -> Dept5 | F778: =+VLOOKUP(RC[-4],Enunciado!R3C6:R5C7,2,0)+RC[-3] -> 41123 | G778: =+IF(RC[-1]>=RC[-3],"ON TIME","OUT OF TIME") -> ON TIME | H778: =+YEAR(RC[-5]) -> 2012 | I778: =+MONTH(RC[-6]) -> 7 | J778: =+RC[-6]-RC[-7] -> 4 | K778: =+IF(RC[-4]="OUT of TIME",RC[-1]-VLOOKUP(RC[-9],Enunciado!R3C6:R5C7,2,0),"") -> 
A779: Dept2-24654 | B779: Bajo | C779: 40925 | D779: 40928 | E779: =+LEFT(RC[-4],5) -> Dept2 | F779: =+VLOOKUP(RC[-4],Enunciado!R3C6:R5C7,2,0)+RC[-3] -> 40955 | G779: =+IF(RC[-1]>=RC[-3],"ON TIME","OUT OF TIME") -> ON TIME | H779: =+YEAR(RC[-5]) -> 2012 | I779: =+MONTH(RC[-6]) -> 1 | J779: =+RC[-6]-RC[-7] -> 3 | K779: =+IF(RC[-4]="OUT of TIME",RC[-1]-VLOOKUP(RC[-9],Enunciado!R3C6:R5C7,2,0),"") -> 
A780: Dept6-3665 | B780: Alto | C780: 41302 | D780: 41312 | E780: =+LEFT(RC[-4],5) -> Dept6 | F780: =+VLOOKUP(RC[-4],Enunciado!R3C6:R5C7,2,0)+RC[-3] -> 41307 | G780: =+IF(RC[-1]>=RC[-3],"ON TIME","OUT OF TIME") -> OUT OF TIME | H780: =+YEAR(RC[-5]) -> 2013 | I780: =+MONTH(RC[-6]) -> 1 | J780: =+RC[-6]-RC[-7] -> 10 | K780: =+IF(RC[-4]="OUT of TIME",RC[-1]-VLOOKUP(RC[-9],Enunciado!R3C6:R5C7,2,0),"") -> 5
A781: Dept6-27562 | B781: Alto | C781: 41616 | D781: 41616 | E781: =+LEFT(RC[-4],5) -> Dept6 | F781: =+VLOOKUP(RC[-4],Enunciado!R3C6:R5C7,2,0)+RC[-3] -> 41621 | G781: =+IF(RC[-1]>=RC[-3],"ON TIME","OUT OF TIME") -> ON TIME | H781: =+YEAR(RC[-5]) -> 2013 | I781: =+MONTH(RC[-6]) -> 12 | J781: =+RC[-6]-RC[-7] -> 0 | K781: =+IF(RC[-4]="OUT of TIME",RC[-1]-VLOOKUP(RC[-9],Enunciado!R3C6:R5C7,2,0),"") -> 
A782: Dept1-25554 | B782: Bajo | C782: 41083 | D782: 41089 | E782: =+LEFT(RC[-4],5) -> Dept1 | F782: =+VLOOKUP(RC[-4],Enunciado!R3C6:R5C7,2,0)+RC[-3] -> 41113 | G782: =+IF(RC[-1]>=RC[-3],"ON TIME","OUT OF TIME") -> ON TIME | H782: =+YEAR(RC[-5]) -> 2012 | I782: =+MONTH(RC[-6]) -> 6 | J782: =+RC[-6]-RC[-7] -> 6 | K782: =+IF(RC[-4]="OUT of TIME",RC[-1]-VLOOKUP(RC[-9],Enunciado!R3C6:R5C7,2,0),"") -> 
A783: Dept3-14937 | B783: Bajo | C783: 41630 | D783: 41637 | E783: =+LEFT(RC[-4],5) -> Dept3 | F783: =+VLOOKUP(RC[-4],Enunciado!R3C6:R5C7,2,0)+RC[-3] -> 41660 | G783: =+IF(RC[-1]>=RC[-3],"ON TIME","OUT OF TIME") -> ON TIME | H783: =+YEAR(RC[-5]) -> 2013 | I783: =+MONTH(RC[-6]) -> 12 | J783: =+RC[-6]-RC[-7] -> 7 | K783: =+IF(RC[-4]="OUT of TIME",RC[-1]-VLOOKUP(RC[-9],Enunciado!R3C6:R5C7,2,0),"") -> 
A784: Dept2-4303 | B784: Medio | C784: 41291 | D784: 41327 | E784: =+LEFT(RC[-4],5) -> Dept2 | F784: =+VLOOKUP(RC[-4],Enunciado!R3C6:R5C7,2,0)+RC[-3] -> 41306 | G784: =+IF(RC[-1]>=RC[-3],"ON TIME","OUT OF TIME") -> OUT OF TIME | H784: =+YEAR(RC[-5]) -> 2013 | I784: =+MONTH(RC[-6]) -> 1 | J784: =+RC[-6]-RC[-7] -> 36 | K784: =+IF(RC[-4]="OUT of TIME",RC[-1]-VLOOKUP(RC[-9],Enunciado!R3C6:R5C7,2,0),"") -> 21
A785: Dept1-22437 | B785: Medio | C785: 41111 | D785: 41112 | E785: =+LEFT(RC[-4],5) -> Dept1 | F785: =+VLOOKUP(RC[-4],Enunciado!R3C6:R5C7,2,0)+RC[-3] -> 41126 | G785: =+IF(RC[-1]>=RC[-3],"ON TIME","OUT OF TIME") -> ON TIME | H785: =+YEAR(RC[-5]) -> 2012 | I785: =+MONTH(RC[-6]) -> 7 | J785: =+RC[-6]-RC[-7] -> 1 | K785: =+IF(RC[-4]="OUT of TIME",RC[-1]-VLOOKUP(RC[-9],Enunciado!R3C6:R5C7,2,0),"") -> 
A786: Dept3-11320 | B786: Medio | C786: 41011 | D786: 41022 | E786: =+LEFT(RC[-4],5) -> Dept3 | F786: =+VLOOKUP(RC[-4],Enunciado!R3C6:R5C7,2,0)+RC[-3] -> 41026 | G786: =+IF(RC[-1]>=RC[-3],"ON TIME","OUT OF TIME") -> ON TIME | H786: =+YEAR(RC[-5]) -> 2012 | I786: =+MONTH(RC[-6]) -> 4 | J786: =+RC[-6]-RC[-7] -> 11 | K786: =+IF(RC[-4]="OUT of TIME",RC[-1]-VLOOKUP(RC[-9],Enunciado!R3C6:R5C7,2,0),"") -> 
A787: Dept3-10968 | B787: Bajo | C787: 41018 | D787: 41022 | E787: =+LEFT(RC[-4],5) -> Dept3 | F787: =+VLOOKUP(RC[-4],Enunciado!R3C6:R5C7,2,0)+RC[-3] -> 41048 | G787: =+IF(RC[-1]>=RC[-3],"ON TIME","OUT OF TIME") -> ON TIME | H787: =+YEAR(RC[-5]) -> 2012 | I787: =+MONTH(RC[-6]) -> 4 | J787: =+RC[-6]-RC[-7] -> 4 | K787: =+IF(RC[-4]="OUT of TIME",RC[-1]-VLOOKUP(RC[-9],Enunciado!R3C6:R5C7,2,0),"") -> 
A788: Dept5-17521 | B788: Alto | C788: 41463 | D788: 41468 | E788: =+LEFT(RC[-4],5) -> Dept5 | F788: =+VLOOKUP(RC[-4],Enunciado!R3C6:R5C7,2,0)+RC[-3] -> 41468 | G788: =+IF(RC[-1]>=RC[-3],"ON TIME","OUT OF TIME") -> ON TIME | H788: =+YEAR(RC[-5]) -> 2013 | I788: =+MONTH(RC[-6]) -> 7 | J788: =+RC[-6]-RC[-7] -> 5 | K788: =+IF(RC[-4]="OUT of TIME",RC[-1]-VLOOKUP(RC[-9],Enunciado!R3C6:R5C7,2,0),"") -> 
A789: Dept3-6947 | B789: Bajo | C789: 40969 | D789: 41004 | E789: =+LEFT(RC[-4],5) -> Dept3 | F789: =+VLOOKUP(RC[-4],Enunciado!R3C6:R5C7,2,0)+RC[-3] -> 40999 | G789: =+IF(RC[-1]>=RC[-3],"ON TIME","OUT OF TIME") -> OUT OF TIME | H789: =+YEAR(RC[-5]) -> 2012 | I789: =+MONTH(RC[-6]) -> 3 | J789: =+RC[-6]-RC[-7] -> 35 | K789: =+IF(RC[-4]="OUT of TIME",RC[-1]-VLOOKUP(RC[-9],Enunciado!R3C6:R5C7,2,0),"") -> 5
A790: Dept4-2353 | B790: Bajo | C790: 41521 | D790: 41545 | E790: =+LEFT(RC[-4],5) -> Dept4 | F790: =+VLOOKUP(RC[-4],Enunciado!R3C6:R5C7,2,0)+RC[-3] -> 41551 | G790: =+IF(RC[-1]>=RC[-3],"ON TIME","OUT OF TIME") -> ON TIME | H790: =+YEAR(RC[-5]) -> 2013 | I790: =+MONTH(RC[-6]) -> 9 | J790: =+RC[-6]-RC[-7] -> 24 | K790: =+IF(RC[-4]="OUT of TIME",RC[-1]-VLOOKUP(RC[-9],Enunciado!R3C6:R5C7,2,0),"") -> 
A791: Dept5-22362 | B791: Bajo | C791: 41454 | D791: 41458 | E791: =+LEFT(RC[-4],5) -> Dept5 | F791: =+VLOOKUP(RC[-4],Enunciado!R3C6:R5C7,2,0)+RC[-3] -> 41484 | G791: =+IF(RC[-1]>=RC[-3],"ON TIME","OUT OF TIME") -> ON TIME | H791: =+YEAR(RC[-5]) -> 2013 | I791: =+MONTH(RC[-6]) -> 6 | J791: =+RC[-6]-RC[-7] -> 4 | K791: =+IF(RC[-4]="OUT of TIME",RC[-1]-VLOOKUP(RC[-9],Enunciado!R3C6:R5C7,2,0),"") -> 
A792: Dept3-9977 | B792: Bajo | C792: 41559 | D792: 41559 | E792: =+LEFT(RC[-4],5) -> Dept3 | F792: =+VLOOKUP(RC[-4],Enunciado!R3C6:R5C7,2,0)+RC[-3] -> 41589 | G792: =+IF(RC[-1]>=RC[-3],"ON TIME","OUT OF TIME") -> ON TIME | H792: =+YEAR(RC[-5]) -> 2013 | I792: =+MONTH(RC[-6]) -> 10 | J792: =+RC[-6]-RC[-7] -> 0 | K792: =+IF(RC[-4]="OUT of TIME",RC[-1]-VLOOKUP(RC[-9],Enunciado!R3C6:R5C7,2,0),"") -> 
A793: Dept6-1207 | B793: Medio | C793: 41468 | D793: 41478 | E793: =+LEFT(RC[-4],5) -> Dept6 | F793: =+VLOOKUP(RC[-4],Enunciado!R3C6:R5C7,2,0)+RC[-3] -> 41483 | G793: =+IF(RC[-1]>=RC[-3],"ON TIME","OUT OF TIME") -> ON TIME | H793: =+YEAR(RC[-5]) -> 2013 | I793: =+MONTH(RC[-6]) -> 7 | J793: =+RC[-6]-RC[-7] -> 10 | K793: =+IF(RC[-4]="OUT of TIME",RC[-1]-VLOOKUP(RC[-9],Enunciado!R3C6:R5C7,2,0),"") -> 
A794: Dept2-20402 | B794: Medio | C794: 41374 | D794: 41389 | E794: =+LEFT(RC[-4],5) -> Dept2 | F794: =+VLOOKUP(RC[-4],Enunciado!R3C6:R5C7,2,0)+RC[-3] -> 41389 | G794: =+IF(RC[-1]>=RC[-3],"ON TIME","OUT OF TIME") -> ON TIME | H794: =+YEAR(RC[-5]) -> 2013 | I794: =+MONTH(RC[-6]) -> 4 | J794: =+RC[-6]-RC[-7] -> 15 | K794: =+IF(RC[-4]="OUT of TIME",RC[-1]-VLOOKUP(RC[-9],Enunciado!R3C6:R5C7,2,0),"") -> 
A795: Dept2-16340 | B795: Bajo | C795: 40964 | D795: 40965 | E795: =+LEFT(RC[-4],5) -> Dept2 | F795: =+VLOOKUP(RC[-4],Enunciado!R3C6:R5C7,2,0)+RC[-3] -> 40994 | G795: =+IF(RC[-1]>=RC[-3],"ON TIME","OUT OF TIME") -> ON TIME | H795: =+YEAR(RC[-5]) -> 2012 | I795: =+MONTH(RC[-6]) -> 2 | J795: =+RC[-6]-RC[-7] -> 1 | K795: =+IF(RC[-4]="OUT of TIME",RC[-1]-VLOOKUP(RC[-9],Enunciado!R3C6:R5C7,2,0),"") -> 
A796: Dept3-20897 | B796: Medio | C796: 41361 | D796: 41363 | E796: =+LEFT(RC[-4],5) -> Dept3 | F796: =+VLOOKUP(RC[-4],Enunciado!R3C6:R5C7,2,0)+RC[-3] -> 41376 | G796: =+IF(RC[-1]>=RC[-3],"ON TIME","OUT OF TIME") -> ON TIME | H796: =+YEAR(RC[-5]) -> 2013 | I796: =+MONTH(RC[-6]) -> 3 | J796: =+RC[-6]-RC[-7] -> 2 | K796: =+IF(RC[-4]="OUT of TIME",RC[-1]-VLOOKUP(RC[-9],Enunciado!R3C6:R5C7,2,0),"") -> 
A797: Dept2-18335 | B797: Alto | C797: 41229 | D797: 41262 | E797: =+LEFT(RC[-4],5) -> Dept2 | F797: =+VLOOKUP(RC[-4],Enunciado!R3C6:R5C7,2,0)+RC[-3] -> 41234 | G797: =+IF(RC[-1]>=RC[-3],"ON TIME","OUT OF TIME") -> OUT OF TIME | H797: =+YEAR(RC[-5]) -> 2012 | I797: =+MONTH(RC[-6]) -> 11 | J797: =+RC[-6]-RC[-7] -> 33 | K797: =+IF(RC[-4]="OUT of TIME",RC[-1]-VLOOKUP(RC[-9],Enunciado!R3C6:R5C7,2,0),"") -> 28
A798: Dept5-10490 | B798: Bajo | C798: 41502 | D798: 41525 | E798: =+LEFT(RC[-4],5) -> Dept5 | F798: =+VLOOKUP(RC[-4],Enunciado!R3C6:R5C7,2,0)+RC[-3] -> 41532 | G798: =+IF(RC[-1]>=RC[-3],"ON TIME","OUT OF TIME") -> ON TIME | H798: =+YEAR(RC[-5]) -> 2013 | I798: =+MONTH(RC[-6]) -> 8 | J798: =+RC[-6]-RC[-7] -> 23 | K798: =+IF(RC[-4]="OUT of TIME",RC[-1]-VLOOKUP(RC[-9],Enunciado!R3C6:R5C7,2,0),"") -> 
A799: Dept6-5390 | B799: Medio | C799: 41602 | D799: 41606 | E799: =+LEFT(RC[-4],5) -> Dept6 | F799: =+VLOOKUP(RC[-4],Enunciado!R3C6:R5C7,2,0)+RC[-3] -> 41617 | G799: =+IF(RC[-1]>=RC[-3],"ON TIME","OUT OF TIME") -> ON TIME | H799: =+YEAR(RC[-5]) -> 2013 | I799: =+MONTH(RC[-6]) -> 11 | J799: =+RC[-6]-RC[-7] -> 4 | K799: =+IF(RC[-4]="OUT of TIME",RC[-1]-VLOOKUP(RC[-9],Enunciado!R3C6:R5C7,2,0),"") -> 
A800: Dept6-7859 | B800: Bajo | C800: 41205 | D800: 41211 | E800: =+LEFT(RC[-4],5) -> Dept6 | F800: =+VLOOKUP(RC[-4],Enunciado!R3C6:R5C7,2,0)+RC[-3] -> 41235 | G800: =+IF(RC[-1]>=RC[-3],"ON TIME","OUT OF TIME") -> ON TIME | H800: =+YEAR(RC[-5]) -> 2012 | I800: =+MONTH(RC[-6]) -> 10 | J800: =+RC[-6]-RC[-7] -> 6 | K800: =+IF(RC[-4]="OUT of TIME",RC[-1]-VLOOKUP(RC[-9],Enunciado!R3C6:R5C7,2,0),"") -> 
A801: Dept2-20851 | B801: Alto | C801: 41278 | D801: 41278 | E801: =+LEFT(RC[-4],5) -> Dept2 | F801: =+VLOOKUP(RC[-4],Enunciado!R3C6:R5C7,2,0)+RC[-3] -> 41283 | G801: =+IF(RC[-1]>=RC[-3],"ON TIME","OUT OF TIME") -> ON TIME | H801: =+YEAR(RC[-5]) -> 2013 | I801: =+MONTH(RC[-6]) -> 1 | J801: =+RC[-6]-RC[-7] -> 0 | K801: =+IF(RC[-4]="OUT of TIME",RC[-1]-VLOOKUP(RC[-9],Enunciado!R3C6:R5C7,2,0),"") -> 
A802: Dept5-20443 | B802: Bajo | C802: 41069 | D802: 41091 | E802: =+LEFT(RC[-4],5) -> Dept5 | F802: =+VLOOKUP(RC[-4],Enunciado!R3C6:R5C7,2,0)+RC[-3] -> 41099 | G802: =+IF(RC[-1]>=RC[-3],"ON TIME","OUT OF TIME") -> ON TIME | H802: =+YEAR(RC[-5]) -> 2012 | I802: =+MONTH(RC[-6]) -> 6 | J802: =+RC[-6]-RC[-7] -> 22 | K802: =+IF(RC[-4]="OUT of TIME",RC[-1]-VLOOKUP(RC[-9],Enunciado!R3C6:R5C7,2,0),"") -> 
A803: Dept2-22416 | B803: Bajo | C803: 41413 | D803: 41416 | E803: =+LEFT(RC[-4],5) -> Dept2 | F803: =+VLOOKUP(RC[-4],Enunciado!R3C6:R5C7,2,0)+RC[-3] -> 41443 | G803: =+IF(RC[-1]>=RC[-3],"ON TIME","OUT OF TIME") -> ON TIME | H803: =+YEAR(RC[-5]) -> 2013 | I803: =+MONTH(RC[-6]) -> 5 | J803: =+RC[-6]-RC[-7] -> 3 | K803: =+IF(RC[-4]="OUT of TIME",RC[-1]-VLOOKUP(RC[-9],Enunciado!R3C6:R5C7,2,0),"") -> 
A804: Dept6-70 | B804: Alto | C804: 41179 | D804: 41182 | E804: =+LEFT(RC[-4],5) -> Dept6 | F804: =+VLOOKUP(RC[-4],Enunciado!R3C6:R5C7,2,0)+RC[-3] -> 41184 | G804: =+IF(RC[-1]>=RC[-3],"ON TIME","OUT OF TIME") -> ON TIME | H804: =+YEAR(RC[-5]) -> 2012 | I804: =+MONTH(RC[-6]) -> 9 | J804: =+RC[-6]-RC[-7] -> 3 | K804: =+IF(RC[-4]="OUT of TIME",RC[-1]-VLOOKUP(RC[-9],Enunciado!R3C6:R5C7,2,0),"") -> 
A805: Dept6-4584 | B805: Medio | C805: 41323 | D805: 41327 | E805: =+LEFT(RC[-4],5) -> Dept6 | F805: =+VLOOKUP(RC[-4],Enunciado!R3C6:R5C7,2,0)+RC[-3] -> 41338 | G805: =+IF(RC[-1]>=RC[-3],"ON TIME","OUT OF TIME") -> ON TIME | H805: =+YEAR(RC[-5]) -> 2013 | I805: =+MONTH(RC[-6]) -> 2 | J805: =+RC[-6]-RC[-7] -> 4 | K805: =+IF(RC[-4]="OUT of TIME",RC[-1]-VLOOKUP(RC[-9],Enunciado!R3C6:R5C7,2,0),"") -> 
A806: Dept6-27921 | B806: Alto | C806: 41238 | D806: 41282 | E806: =+LEFT(RC[-4],5) -> Dept6 | F806: =+VLOOKUP(RC[-4],Enunciado!R3C6:R5C7,2,0)+RC[-3] -> 41243 | G806: =+IF(RC[-1]>=RC[-3],"ON TIME","OUT OF TIME") -> OUT OF TIME | H806: =+YEAR(RC[-5]) -> 2012 | I806: =+MONTH(RC[-6]) -> 11 | J806: =+RC[-6]-RC[-7] -> 44 | K806: =+IF(RC[-4]="OUT of TIME",RC[-1]-VLOOKUP(RC[-9],Enunciado!R3C6:R5C7,2,0),"") -> 39
A807: Dept2-13401 | B807: Bajo | C807: 41278 | D807: 41325 | E807: =+LEFT(RC[-4],5) -> Dept2 | F807: =+VLOOKUP(RC[-4],Enunciado!R3C6:R5C7,2,0)+RC[-3] -> 41308 | G807: =+IF(RC[-1]>=RC[-3],"ON TIME","OUT OF TIME") -> OUT OF TIME | H807: =+YEAR(RC[-5]) -> 2013 | I807: =+MONTH(RC[-6]) -> 1 | J807: =+RC[-6]-RC[-7] -> 47 | K807: =+IF(RC[-4]="OUT of TIME",RC[-1]-VLOOKUP(RC[-9],Enunciado!R3C6:R5C7,2,0),"") -> 17
A808: Dept4-19148 | B808: Bajo | C808: 41497 | D808: 41513 | E808: =+LEFT(RC[-4],5) -> Dept4 | F808: =+VLOOKUP(RC[-4],Enunciado!R3C6:R5C7,2,0)+RC[-3] -> 41527 | G808: =+IF(RC[-1]>=RC[-3],"ON TIME","OUT OF TIME") -> ON TIME | H808: =+YEAR(RC[-5]) -> 2013 | I808: =+MONTH(RC[-6]) -> 8 | J808: =+RC[-6]-RC[-7] -> 16 | K808: =+IF(RC[-4]="OUT of TIME",RC[-1]-VLOOKUP(RC[-9],Enunciado!R3C6:R5C7,2,0),"") -> 
A809: Dept5-83 | B809: Bajo | C809: 41431 | D809: 41440 | E809: =+LEFT(RC[-4],5) -> Dept5 | F809: =+VLOOKUP(RC[-4],Enunciado!R3C6:R5C7,2,0)+RC[-3] -> 41461 | G809: =+IF(RC[-1]>=RC[-3],"ON TIME","OUT OF TIME") -> ON TIME | H809: =+YEAR(RC[-5]) -> 2013 | I809: =+MONTH(RC[-6]) -> 6 | J809: =+RC[-6]-RC[-7] -> 9 | K809: =+IF(RC[-4]="OUT of TIME",RC[-1]-VLOOKUP(RC[-9],Enunciado!R3C6:R5C7,2,0),"") -> 
A810: Dept5-14947 | B810: Medio | C810: 41245 | D810: 41286 | E810: =+LEFT(RC[-4],5) -> Dept5 | F810: =+VLOOKUP(RC[-4],Enunciado!R3C6:R5C7,2,0)+RC[-3] -> 41260 | G810: =+IF(RC[-1]>=RC[-3],"ON TIME","OUT OF TIME") -> OUT OF TIME | H810: =+YEAR(RC[-5]) -> 2012 | I810: =+MONTH(RC[-6]) -> 12 | J810: =+RC[-6]-RC[-7] -> 41 | K810: =+IF(RC[-4]="OUT of TIME",RC[-1]-VLOOKUP(RC[-9],Enunciado!R3C6:R5C7,2,0),"") -> 26
A811: Dept3-7560 | B811: Bajo | C811: 41350 | D811: 41358 | E811: =+LEFT(RC[-4],5) -> Dept3 | F811: =+VLOOKUP(RC[-4],Enunciado!R3C6:R5C7,2,0)+RC[-3] -> 41380 | G811: =+IF(RC[-1]>=RC[-3],"ON TIME","OUT OF TIME") -> ON TIME | H811: =+YEAR(RC[-5]) -> 2013 | I811: =+MONTH(RC[-6]) -> 3 | J811: =+RC[-6]-RC[-7] -> 8 | K811: =+IF(RC[-4]="OUT of TIME",RC[-1]-VLOOKUP(RC[-9],Enunciado!R3C6:R5C7,2,0),"") -> 
A812: Dept3-7406 | B812: Medio | C812: 41451 | D812: 41454 | E812: =+LEFT(RC[-4],5) -> Dept3 | F812: =+VLOOKUP(RC[-4],Enunciado!R3C6:R5C7,2,0)+RC[-3] -> 41466 | G812: =+IF(RC[-1]>=RC[-3],"ON TIME","OUT OF TIME") -> ON TIME | H812: =+YEAR(RC[-5]) -> 2013 | I812: =+MONTH(RC[-6]) -> 6 | J812: =+RC[-6]-RC[-7] -> 3 | K812: =+IF(RC[-4]="OUT of TIME",RC[-1]-VLOOKUP(RC[-9],Enunciado!R3C6:R5C7,2,0),"") -> 
A813: Dept2-21518 | B813: Medio | C813: 40910 | D813: 40910 | E813: =+LEFT(RC[-4],5) -> Dept2 | F813: =+VLOOKUP(RC[-4],Enunciado!R3C6:R5C7,2,0)+RC[-3] -> 40925 | G813: =+IF(RC[-1]>=RC[-3],"ON TIME","OUT OF TIME") -> ON TIME | H813: =+YEAR(RC[-5]) -> 2012 | I813: =+MONTH(RC[-6]) -> 1 | J813: =+RC[-6]-RC[-7] -> 0 | K813: =+IF(RC[-4]="OUT of TIME",RC[-1]-VLOOKUP(RC[-9],Enunciado!R3C6:R5C7,2,0),"") -> 
A814: Dept4-19942 | B814: Alto | C814: 41176 | D814: 41178 | E814: =+LEFT(RC[-4],5) -> Dept4 | F814: =+VLOOKUP(RC[-4],Enunciado!R3C6:R5C7,2,0)+RC[-3] -> 41181 | G814: =+IF(RC[-1]>=RC[-3],"ON TIME","OUT OF TIME") -> ON TIME | H814: =+YEAR(RC[-5]) -> 2012 | I814: =+MONTH(RC[-6]) -> 9 | J814: =+RC[-6]-RC[-7] -> 2 | K814: =+IF(RC[-4]="OUT of TIME",RC[-1]-VLOOKUP(RC[-9],Enunciado!R3C6:R5C7,2,0),"") -> 
A815: Dept4-24995 | B815: Alto | C815: 41094 | D815: 41107 | E815: =+LEFT(RC[-4],5) -> Dept4 | F815: =+VLOOKUP(RC[-4],Enunciado!R3C6:R5C7,2,0)+RC[-3] -> 41099 | G815: =+IF(RC[-1]>=RC[-3],"ON TIME","OUT OF TIME") -> OUT OF TIME | H815: =+YEAR(RC[-5]) -> 2012 | I815: =+MONTH(RC[-6]) -> 7 | J815: =+RC[-6]-RC[-7] -> 13 | K815: =+IF(RC[-4]="OUT of TIME",RC[-1]-VLOOKUP(RC[-9],Enunciado!R3C6:R5C7,2,0),"") -> 8
A816: Dept4-3632 | B816: Medio | C816: 41631 | D816: 41636 | E816: =+LEFT(RC[-4],5) -> Dept4 | F816: =+VLOOKUP(RC[-4],Enunciado!R3C6:R5C7,2,0)+RC[-3] -> 41646 | G816: =+IF(RC[-1]>=RC[-3],"ON TIME","OUT OF TIME") -> ON TIME | H816: =+YEAR(RC[-5]) -> 2013 | I816: =+MONTH(RC[-6]) -> 12 | J816: =+RC[-6]-RC[-7] -> 5 | K816: =+IF(RC[-4]="OUT of TIME",RC[-1]-VLOOKUP(RC[-9],Enunciado!R3C6:R5C7,2,0),"") -> 
A817: Dept5-23089 | B817: Medio | C817: 41404 | D817: 41406 | E817: =+LEFT(RC[-4],5) -> Dept5 | F817: =+VLOOKUP(RC[-4],Enunciado!R3C6:R5C7,2,0)+RC[-3] -> 41419 | G817: =+IF(RC[-1]>=RC[-3],"ON TIME","OUT OF TIME") -> ON TIME | H817: =+YEAR(RC[-5]) -> 2013 | I817: =+MONTH(RC[-6]) -> 5 | J817: =+RC[-6]-RC[-7] -> 2 | K817: =+IF(RC[-4]="OUT of TIME",RC[-1]-VLOOKUP(RC[-9],Enunciado!R3C6:R5C7,2,0),"") -> 
A818: Dept1-17256 | B818: Medio | C818: 41476 | D818: 41483 | E818: =+LEFT(RC[-4],5) -> Dept1 | F818: =+VLOOKUP(RC[-4],Enunciado!R3C6:R5C7,2,0)+RC[-3] -> 41491 | G818: =+IF(RC[-1]>=RC[-3],"ON TIME","OUT OF TIME") -> ON TIME | H818: =+YEAR(RC[-5]) -> 2013 | I818: =+MONTH(RC[-6]) -> 7 | J818: =+RC[-6]-RC[-7] -> 7 | K818: =+IF(RC[-4]="OUT of TIME",RC[-1]-VLOOKUP(RC[-9],Enunciado!R3C6:R5C7,2,0),"") -> 
A819: Dept2-21854 | B819: Medio | C819: 41294 | D819: 41310 | E819: =+LEFT(RC[-4],5) -> Dept2 | F819: =+VLOOKUP(RC[-4],Enunciado!R3C6:R5C7,2,0)+RC[-3] -> 41309 | G819: =+IF(RC[-1]>=RC[-3],"ON TIME","OUT OF TIME") -> OUT OF TIME | H819: =+YEAR(RC[-5]) -> 2013 | I819: =+MONTH(RC[-6]) -> 1 | J819: =+RC[-6]-RC[-7] -> 16 | K819: =+IF(RC[-4]="OUT of TIME",RC[-1]-VLOOKUP(RC[-9],Enunciado!R3C6:R5C7,2,0),"") -> 1
A820: Dept1-26368 | B820: Medio | C820: 41603 | D820: 41622 | E820: =+LEFT(RC[-4],5) -> Dept1 | F820: =+VLOOKUP(RC[-4],Enunciado!R3C6:R5C7,2,0)+RC[-3] -> 41618 | G820: =+IF(RC[-1]>=RC[-3],"ON TIME","OUT OF TIME") -> OUT OF TIME | H820: =+YEAR(RC[-5]) -> 2013 | I820: =+MONTH(RC[-6]) -> 11 | J820: =+RC[-6]-RC[-7] -> 19 | K820: =+IF(RC[-4]="OUT of TIME",RC[-1]-VLOOKUP(RC[-9],Enunciado!R3C6:R5C7,2,0),"") -> 4
A821: Dept1-12931 | B821: Bajo | C821: 41241 | D821: 41242 | E821: =+LEFT(RC[-4],5) -> Dept1 | F821: =+VLOOKUP(RC[-4],Enunciado!R3C6:R5C7,2,0)+RC[-3] -> 41271 | G821: =+IF(RC[-1]>=RC[-3],"ON TIME","OUT OF TIME") -> ON TIME | H821: =+YEAR(RC[-5]) -> 2012 | I821: =+MONTH(RC[-6]) -> 11 | J821: =+RC[-6]-RC[-7] -> 1 | K821: =+IF(RC[-4]="OUT of TIME",RC[-1]-VLOOKUP(RC[-9],Enunciado!R3C6:R5C7,2,0),"") -> 
A822: Dept2-14196 | B822: Alto | C822: 41568 | D822: 41571 | E822: =+LEFT(RC[-4],5) -> Dept2 | F822: =+VLOOKUP(RC[-4],Enunciado!R3C6:R5C7,2,0)+RC[-3] -> 41573 | G822: =+IF(RC[-1]>=RC[-3],"ON TIME","OUT OF TIME") -> ON TIME | H822: =+YEAR(RC[-5]) -> 2013 | I822: =+MONTH(RC[-6]) -> 10 | J822: =+RC[-6]-RC[-7] -> 3 | K822: =+IF(RC[-4]="OUT of TIME",RC[-1]-VLOOKUP(RC[-9],Enunciado!R3C6:R5C7,2,0),"") -> 
A823: Dept3-22987 | B823: Bajo | C823: 41122 | D823: 41140 | E823: =+LEFT(RC[-4],5) -> Dept3 | F823: =+VLOOKUP(RC[-4],Enunciado!R3C6:R5C7,2,0)+RC[-3] -> 41152 | G823: =+IF(RC[-1]>=RC[-3],"ON TIME","OUT OF TIME") -> ON TIME | H823: =+YEAR(RC[-5]) -> 2012 | I823: =+MONTH(RC[-6]) -> 8 | J823: =+RC[-6]-RC[-7] -> 18 | K823: =+IF(RC[-4]="OUT of TIME",RC[-1]-VLOOKUP(RC[-9],Enunciado!R3C6:R5C7,2,0),"") -> 
A824: Dept3-24695 | B824: Bajo | C824: 41461 | D824: 41472 | E824: =+LEFT(RC[-4],5) -> Dept3 | F824: =+VLOOKUP(RC[-4],Enunciado!R3C6:R5C7,2,0)+RC[-3] -> 41491 | G824: =+IF(RC[-1]>=RC[-3],"ON TIME","OUT OF TIME") -> ON TIME | H824: =+YEAR(RC[-5]) -> 2013 | I824: =+MONTH(RC[-6]) -> 7 | J824: =+RC[-6]-RC[-7] -> 11 | K824: =+IF(RC[-4]="OUT of TIME",RC[-1]-VLOOKUP(RC[-9],Enunciado!R3C6:R5C7,2,0),"") -> 
A825: Dept6-24522 | B825: Alto | C825: 41160 | D825: 41160 | E825: =+LEFT(RC[-4],5) -> Dept6 | F825: =+VLOOKUP(RC[-4],Enunciado!R3C6:R5C7,2,0)+RC[-3] -> 41165 | G825: =+IF(RC[-1]>=RC[-3],"ON TIME","OUT OF TIME") -> ON TIME | H825: =+YEAR(RC[-5]) -> 2012 | I825: =+MONTH(RC[-6]) -> 9 | J825: =+RC[-6]-RC[-7] -> 0 | K825: =+IF(RC[-4]="OUT of TIME",RC[-1]-VLOOKUP(RC[-9],Enunciado!R3C6:R5C7,2,0),"") -> 
A826: Dept3-5561 | B826: Medio | C826: 41261 | D826: 41265 | E826: =+LEFT(RC[-4],5) -> Dept3 | F826: =+VLOOKUP(RC[-4],Enunciado!R3C6:R5C7,2,0)+RC[-3] -> 41276 | G826: =+IF(RC[-1]>=RC[-3],"ON TIME","OUT OF TIME") -> ON TIME | H826: =+YEAR(RC[-5]) -> 2012 | I826: =+MONTH(RC[-6]) -> 12 | J826: =+RC[-6]-RC[-7] -> 4 | K826: =+IF(RC[-4]="OUT of TIME",RC[-1]-VLOOKUP(RC[-9],Enunciado!R3C6:R5C7,2,0),"") -> 
A827: Dept4-22101 | B827: Bajo | C827: 40968 | D827: 40977 | E827: =+LEFT(RC[-4],5) -> Dept4 | F827: =+VLOOKUP(RC[-4],Enunciado!R3C6:R5C7,2,0)+RC[-3] -> 40998 | G827: =+IF(RC[-1]>=RC[-3],"ON TIME","OUT OF TIME") -> ON TIME | H827: =+YEAR(RC[-5]) -> 2012 | I827: =+MONTH(RC[-6]) -> 2 | J827: =+RC[-6]-RC[-7] -> 9 | K827: =+IF(RC[-4]="OUT of TIME",RC[-1]-VLOOKUP(RC[-9],Enunciado!R3C6:R5C7,2,0),"") -> 
A828: Dept2-16512 | B828: Medio | C828: 41203 | D828: 41203 | E828: =+LEFT(RC[-4],5) -> Dept2 | F828: =+VLOOKUP(RC[-4],Enunciado!R3C6:R5C7,2,0)+RC[-3] -> 41218 | G828: =+IF(RC[-1]>=RC[-3],"ON TIME","OUT OF TIME") -> ON TIME | H828: =+YEAR(RC[-5]) -> 2012 | I828: =+MONTH(RC[-6]) -> 10 | J828: =+RC[-6]-RC[-7] -> 0 | K828: =+IF(RC[-4]="OUT of TIME",RC[-1]-VLOOKUP(RC[-9],Enunciado!R3C6:R5C7,2,0),"") -> 
A829: Dept4-5586 | B829: Bajo | C829: 41253 | D829: 41282 | E829: =+LEFT(RC[-4],5) -> Dept4 | F829: =+VLOOKUP(RC[-4],Enunciado!R3C6:R5C7,2,0)+RC[-3] -> 41283 | G829: =+IF(RC[-1]>=RC[-3],"ON TIME","OUT OF TIME") -> ON TIME | H829: =+YEAR(RC[-5]) -> 2012 | I829: =+MONTH(RC[-6]) -> 12 | J829: =+RC[-6]-RC[-7] -> 29 | K829: =+IF(RC[-4]="OUT of TIME",RC[-1]-VLOOKUP(RC[-9],Enunciado!R3C6:R5C7,2,0),"") -> 
A830: Dept6-25668 | B830: Medio | C830: 40940 | D830: 40942 | E830: =+LEFT(RC[-4],5) -> Dept6 | F830: =+VLOOKUP(RC[-4],Enunciado!R3C6:R5C7,2,0)+RC[-3] -> 40955 | G830: =+IF(RC[-1]>=RC[-3],"ON TIME","OUT OF TIME") -> ON TIME | H830: =+YEAR(RC[-5]) -> 2012 | I830: =+MONTH(RC[-6]) -> 2 | J830: =+RC[-6]-RC[-7] -> 2 | K830: =+IF(RC[-4]="OUT of TIME",RC[-1]-VLOOKUP(RC[-9],Enunciado!R3C6:R5C7,2,0),"") -> 
A831: Dept6-9416 | B831: Alto | C831: 40930 | D831: 40946 | E831: =+LEFT(RC[-4],5) -> Dept6 | F831: =+VLOOKUP(RC[-4],Enunciado!R3C6:R5C7,2,0)+RC[-3] -> 40935 | G831: =+IF(RC[-1]>=RC[-3],"ON TIME","OUT OF TIME") -> OUT OF TIME | H831: =+YEAR(RC[-5]) -> 2012 | I831: =+MONTH(RC[-6]) -> 1 | J831: =+RC[-6]-RC[-7] -> 16 | K831: =+IF(RC[-4]="OUT of TIME",RC[-1]-VLOOKUP(RC[-9],Enunciado!R3C6:R5C7,2,0),"") -> 11
A832: Dept3-24316 | B832: Alto | C832: 41184 | D832: 41228 | E832: =+LEFT(RC[-4],5) -> Dept3 | F832: =+VLOOKUP(RC[-4],Enunciado!R3C6:R5C7,2,0)+RC[-3] -> 41189 | G832: =+IF(RC[-1]>=RC[-3],"ON TIME","OUT OF TIME") -> OUT OF TIME | H832: =+YEAR(RC[-5]) -> 2012 | I832: =+MONTH(RC[-6]) -> 10 | J832: =+RC[-6]-RC[-7] -> 44 | K832: =+IF(RC[-4]="OUT of TIME",RC[-1]-VLOOKUP(RC[-9],Enunciado!R3C6:R5C7,2,0),"") -> 39
A833: Dept6-14504 | B833: Medio | C833: 41383 | D833: 41383 | E833: =+LEFT(RC[-4],5) -> Dept6 | F833: =+VLOOKUP(RC[-4],Enunciado!R3C6:R5C7,2,0)+RC[-3] -> 41398 | G833: =+IF(RC[-1]>=RC[-3],"ON TIME","OUT OF TIME") -> ON TIME | H833: =+YEAR(RC[-5]) -> 2013 | I833: =+MONTH(RC[-6]) -> 4 | J833: =+RC[-6]-RC[-7] -> 0 | K833: =+IF(RC[-4]="OUT of TIME",RC[-1]-VLOOKUP(RC[-9],Enunciado!R3C6:R5C7,2,0),"") -> 
A834: Dept1-27892 | B834: Medio | C834: 41562 | D834: 41564 | E834: =+LEFT(RC[-4],5) -> Dept1 | F834: =+VLOOKUP(RC[-4],Enunciado!R3C6:R5C7,2,0)+RC[-3] -> 41577 | G834: =+IF(RC[-1]>=RC[-3],"ON TIME","OUT OF TIME") -> ON TIME | H834: =+YEAR(RC[-5]) -> 2013 | I834: =+MONTH(RC[-6]) -> 10 | J834: =+RC[-6]-RC[-7] -> 2 | K834: =+IF(RC[-4]="OUT of TIME",RC[-1]-VLOOKUP(RC[-9],Enunciado!R3C6:R5C7,2,0),"") -> 
A835: Dept4-6821 | B835: Medio | C835: 41029 | D835: 41031 | E835: =+LEFT(RC[-4],5) -> Dept4 | F835: =+VLOOKUP(RC[-4],Enunciado!R3C6:R5C7,2,0)+RC[-3] -> 41044 | G835: =+IF(RC[-1]>=RC[-3],"ON TIME","OUT OF TIME") -> ON TIME | H835: =+YEAR(RC[-5]) -> 2012 | I835: =+MONTH(RC[-6]) -> 4 | J835: =+RC[-6]-RC[-7] -> 2 | K835: =+IF(RC[-4]="OUT of TIME",RC[-1]-VLOOKUP(RC[-9],Enunciado!R3C6:R5C7,2,0),"") -> 
A836: Dept4-18487 | B836: Alto | C836: 41352 | D836: 41386 | E836: =+LEFT(RC[-4],5) -> Dept4 | F836: =+VLOOKUP(RC[-4],Enunciado!R3C6:R5C7,2,0)+RC[-3] -> 41357 | G836: =+IF(RC[-1]>=RC[-3],"ON TIME","OUT OF TIME") -> OUT OF TIME | H836: =+YEAR(RC[-5]) -> 2013 | I836: =+MONTH(RC[-6]) -> 3 | J836: =+RC[-6]-RC[-7] -> 34 | K836: =+IF(RC[-4]="OUT of TIME",RC[-1]-VLOOKUP(RC[-9],Enunciado!R3C6:R5C7,2,0),"") -> 29
A837: Dept6-4215 | B837: Bajo | C837: 40963 | D837: 40965 | E837: =+LEFT(RC[-4],5) -> Dept6 | F837: =+VLOOKUP(RC[-4],Enunciado!R3C6:R5C7,2,0)+RC[-3] -> 40993 | G837: =+IF(RC[-1]>=RC[-3],"ON TIME","OUT OF TIME") -> ON TIME | H837: =+YEAR(RC[-5]) -> 2012 | I837: =+MONTH(RC[-6]) -> 2 | J837: =+RC[-6]-RC[-7] -> 2 | K837: =+IF(RC[-4]="OUT of TIME",RC[-1]-VLOOKUP(RC[-9],Enunciado!R3C6:R5C7,2,0),"") -> 
A838: Dept6-11687 | B838: Alto | C838: 40946 | D838: 40948 | E838: =+LEFT(RC[-4],5) -> Dept6 | F838: =+VLOOKUP(RC[-4],Enunciado!R3C6:R5C7,2,0)+RC[-3] -> 40951 | G838: =+IF(RC[-1]>=RC[-3],"ON TIME","OUT OF TIME") -> ON TIME | H838: =+YEAR(RC[-5]) -> 2012 | I838: =+MONTH(RC[-6]) -> 2 | J838: =+RC[-6]-RC[-7] -> 2 | K838: =+IF(RC[-4]="OUT of TIME",RC[-1]-VLOOKUP(RC[-9],Enunciado!R3C6:R5C7,2,0),"") -> 
A839: Dept3-20534 | B839: Bajo | C839: 41014 | D839: 41053 | E839: =+LEFT(RC[-4],5) -> Dept3 | F839: =+VLOOKUP(RC[-4],Enunciado!R3C6:R5C7,2,0)+RC[-3] -> 41044 | G839: =+IF(RC[-1]>=RC[-3],"ON TIME","OUT OF TIME") -> OUT OF TIME | H839: =+YEAR(RC[-5]) -> 2012 | I839: =+MONTH(RC[-6]) -> 4 | J839: =+RC[-6]-RC[-7] -> 39 | K839: =+IF(RC[-4]="OUT of TIME",RC[-1]-VLOOKUP(RC[-9],Enunciado!R3C6:R5C7,2,0),"") -> 9
A840: Dept4-18065 | B840: Bajo | C840: 41415 | D840: 41418 | E840: =+LEFT(RC[-4],5) -> Dept4 | F840: =+VLOOKUP(RC[-4],Enunciado!R3C6:R5C7,2,0)+RC[-3] -> 41445 | G840: =+IF(RC[-1]>=RC[-3],"ON TIME","OUT OF TIME") -> ON TIME | H840: =+YEAR(RC[-5]) -> 2013 | I840: =+MONTH(RC[-6]) -> 5 | J840: =+RC[-6]-RC[-7] -> 3 | K840: =+IF(RC[-4]="OUT of TIME",RC[-1]-VLOOKUP(RC[-9],Enunciado!R3C6:R5C7,2,0),"") -> 
A841: Dept4-3626 | B841: Medio | C841: 41253 | D841: 41271 | E841: =+LEFT(RC[-4],5) -> Dept4 | F841: =+VLOOKUP(RC[-4],Enunciado!R3C6:R5C7,2,0)+RC[-3] -> 41268 | G841: =+IF(RC[-1]>=RC[-3],"ON TIME","OUT OF TIME") -> OUT OF TIME | H841: =+YEAR(RC[-5]) -> 2012 | I841: =+MONTH(RC[-6]) -> 12 | J841: =+RC[-6]-RC[-7] -> 18 | K841: =+IF(RC[-4]="OUT of TIME",RC[-1]-VLOOKUP(RC[-9],Enunciado!R3C6:R5C7,2,0),"") -> 3
A842: Dept2-7126 | B842: Bajo | C842: 41102 | D842: 41112 | E842: =+LEFT(RC[-4],5) -> Dept2 | F842: =+VLOOKUP(RC[-4],Enunciado!R3C6:R5C7,2,0)+RC[-3] -> 41132 | G842: =+IF(RC[-1]>=RC[-3],"ON TIME","OUT OF TIME") -> ON TIME | H842: =+YEAR(RC[-5]) -> 2012 | I842: =+MONTH(RC[-6]) -> 7 | J842: =+RC[-6]-RC[-7] -> 10 | K842: =+IF(RC[-4]="OUT of TIME",RC[-1]-VLOOKUP(RC[-9],Enunciado!R3C6:R5C7,2,0),"") -> 
A843: Dept2-1254 | B843: Medio | C843: 41188 | D843: 41197 | E843: =+LEFT(RC[-4],5) -> Dept2 | F843: =+VLOOKUP(RC[-4],Enunciado!R3C6:R5C7,2,0)+RC[-3] -> 41203 | G843: =+IF(RC[-1]>=RC[-3],"ON TIME","OUT OF TIME") -> ON TIME | H843: =+YEAR(RC[-5]) -> 2012 | I843: =+MONTH(RC[-6]) -> 10 | J843: =+RC[-6]-RC[-7] -> 9 | K843: =+IF(RC[-4]="OUT of TIME",RC[-1]-VLOOKUP(RC[-9],Enunciado!R3C6:R5C7,2,0),"") -> 
A844: Dept5-19035 | B844: Alto | C844: 41475 | D844: 41520 | E844: =+LEFT(RC[-4],5) -> Dept5 | F844: =+VLOOKUP(RC[-4],Enunciado!R3C6:R5C7,2,0)+RC[-3] -> 41480 | G844: =+IF(RC[-1]>=RC[-3],"ON TIME","OUT OF TIME") -> OUT OF TIME | H844: =+YEAR(RC[-5]) -> 2013 | I844: =+MONTH(RC[-6]) -> 7 | J844: =+RC[-6]-RC[-7] -> 45 | K844: =+IF(RC[-4]="OUT of TIME",RC[-1]-VLOOKUP(RC[-9],Enunciado!R3C6:R5C7,2,0),"") -> 40
A845: Dept4-6517 | B845: Bajo | C845: 41438 | D845: 41457 | E845: =+LEFT(RC[-4],5) -> Dept4 | F845: =+VLOOKUP(RC[-4],Enunciado!R3C6:R5C7,2,0)+RC[-3] -> 41468 | G845: =+IF(RC[-1]>=RC[-3],"ON TIME","OUT OF TIME") -> ON TIME | H845: =+YEAR(RC[-5]) -> 2013 | I845: =+MONTH(RC[-6]) -> 6 | J845: =+RC[-6]-RC[-7] -> 19 | K845: =+IF(RC[-4]="OUT of TIME",RC[-1]-VLOOKUP(RC[-9],Enunciado!R3C6:R5C7,2,0),"") -> 
A846: Dept6-6926 | B846: Bajo | C846: 41004 | D846: 41008 | E846: =+LEFT(RC[-4],5) -> Dept6 | F846: =+VLOOKUP(RC[-4],Enunciado!R3C6:R5C7,2,0)+RC[-3] -> 41034 | G846: =+IF(RC[-1]>=RC[-3],"ON TIME","OUT OF TIME") -> ON TIME | H846: =+YEAR(RC[-5]) -> 2012 | I846: =+MONTH(RC[-6]) -> 4 | J846: =+RC[-6]-RC[-7] -> 4 | K846: =+IF(RC[-4]="OUT of TIME",RC[-1]-VLOOKUP(RC[-9],Enunciado!R3C6:R5C7,2,0),"") -> 
A847: Dept2-21817 | B847: Bajo | C847: 41094 | D847: 41113 | E847: =+LEFT(RC[-4],5) -> Dept2 | F847: =+VLOOKUP(RC[-4],Enunciado!R3C6:R5C7,2,0)+RC[-3] -> 41124 | G847: =+IF(RC[-1]>=RC[-3],"ON TIME","OUT OF TIME") -> ON TIME | H847: =+YEAR(RC[-5]) -> 2012 | I847: =+MONTH(RC[-6]) -> 7 | J847: =+RC[-6]-RC[-7] -> 19 | K847: =+IF(RC[-4]="OUT of TIME",RC[-1]-VLOOKUP(RC[-9],Enunciado!R3C6:R5C7,2,0),"") -> 
A848: Dept6-20107 | B848: Bajo | C848: 40956 | D848: 40976 | E848: =+LEFT(RC[-4],5) -> Dept6 | F848: =+VLOOKUP(RC[-4],Enunciado!R3C6:R5C7,2,0)+RC[-3] -> 40986 | G848: =+IF(RC[-1]>=RC[-3],"ON TIME","OUT OF TIME") -> ON TIME | H848: =+YEAR(RC[-5]) -> 2012 | I848: =+MONTH(RC[-6]) -> 2 | J848: =+RC[-6]-RC[-7] -> 20 | K848: =+IF(RC[-4]="OUT of TIME",RC[-1]-VLOOKUP(RC[-9],Enunciado!R3C6:R5C7,2,0),"") -> 
A849: Dept3-17947 | B849: Bajo | C849: 41215 | D849: 41243 | E849: =+LEFT(RC[-4],5) -> Dept3 | F849: =+VLOOKUP(RC[-4],Enunciado!R3C6:R5C7,2,0)+RC[-3] -> 41245 | G849: =+IF(RC[-1]>=RC[-3],"ON TIME","OUT OF TIME") -> ON TIME | H849: =+YEAR(RC[-5]) -> 2012 | I849: =+MONTH(RC[-6]) -> 11 | J849: =+RC[-6]-RC[-7] -> 28 | K849: =+IF(RC[-4]="OUT of TIME",RC[-1]-VLOOKUP(RC[-9],Enunciado!R3C6:R5C7,2,0),"") -> 
A850: Dept3-25983 | B850: Alto | C850: 41413 | D850: 41422 | E850: =+LEFT(RC[-4],5) -> Dept3 | F850: =+VLOOKUP(RC[-4],Enunciado!R3C6:R5C7,2,0)+RC[-3] -> 41418 | G850: =+IF(RC[-1]>=RC[-3],"ON TIME","OUT OF TIME") -> OUT OF TIME | H850: =+YEAR(RC[-5]) -> 2013 | I850: =+MONTH(RC[-6]) -> 5 | J850: =+RC[-6]-RC[-7] -> 9 | K850: =+IF(RC[-4]="OUT of TIME",RC[-1]-VLOOKUP(RC[-9],Enunciado!R3C6:R5C7,2,0),"") -> 4
A851: Dept4-12357 | B851: Bajo | C851: 40978 | D851: 41011 | E851: =+LEFT(RC[-4],5) -> Dept4 | F851: =+VLOOKUP(RC[-4],Enunciado!R3C6:R5C7,2,0)+RC[-3] -> 41008 | G851: =+IF(RC[-1]>=RC[-3],"ON TIME","OUT OF TIME") -> OUT OF TIME | H851: =+YEAR(RC[-5]) -> 2012 | I851: =+MONTH(RC[-6]) -> 3 | J851: =+RC[-6]-RC[-7] -> 33 | K851: =+IF(RC[-4]="OUT of TIME",RC[-1]-VLOOKUP(RC[-9],Enunciado!R3C6:R5C7,2,0),"") -> 3
A852: Dept5-25995 | B852: Alto | C852: 41032 | D852: 41032 | E852: =+LEFT(RC[-4],5) -> Dept5 | F852: =+VLOOKUP(RC[-4],Enunciado!R3C6:R5C7,2,0)+RC[-3] -> 41037 | G852: =+IF(RC[-1]>=RC[-3],"ON TIME","OUT OF TIME") -> ON TIME | H852: =+YEAR(RC[-5]) -> 2012 | I852: =+MONTH(RC[-6]) -> 5 | J852: =+RC[-6]-RC[-7] -> 0 | K852: =+IF(RC[-4]="OUT of TIME",RC[-1]-VLOOKUP(RC[-9],Enunciado!R3C6:R5C7,2,0),"") -> 
A853: Dept1-18161 | B853: Medio | C853: 40941 | D853: 40958 | E853: =+LEFT(RC[-4],5) -> Dept1 | F853: =+VLOOKUP(RC[-4],Enunciado!R3C6:R5C7,2,0)+RC[-3] -> 40956 | G853: =+IF(RC[-1]>=RC[-3],"ON TIME","OUT OF TIME") -> OUT OF TIME | H853: =+YEAR(RC[-5]) -> 2012 | I853: =+MONTH(RC[-6]) -> 2 | J853: =+RC[-6]-RC[-7] -> 17 | K853: =+IF(RC[-4]="OUT of TIME",RC[-1]-VLOOKUP(RC[-9],Enunciado!R3C6:R5C7,2,0),"") -> 2
A854: Dept1-18401 | B854: Medio | C854: 41558 | D854: 41560 | E854: =+LEFT(RC[-4],5) -> Dept1 | F854: =+VLOOKUP(RC[-4],Enunciado!R3C6:R5C7,2,0)+RC[-3] -> 41573 | G854: =+IF(RC[-1]>=RC[-3],"ON TIME","OUT OF TIME") -> ON TIME | H854: =+YEAR(RC[-5]) -> 2013 | I854: =+MONTH(RC[-6]) -> 10 | J854: =+RC[-6]-RC[-7] -> 2 | K854: =+IF(RC[-4]="OUT of TIME",RC[-1]-VLOOKUP(RC[-9],Enunciado!R3C6:R5C7,2,0),"") -> 
A855: Dept6-12956 | B855: Bajo | C855: 41603 | D855: 41629 | E855: =+LEFT(RC[-4],5) -> Dept6 | F855: =+VLOOKUP(RC[-4],Enunciado!R3C6:R5C7,2,0)+RC[-3] -> 41633 | G855: =+IF(RC[-1]>=RC[-3],"ON TIME","OUT OF TIME") -> ON TIME | H855: =+YEAR(RC[-5]) -> 2013 | I855: =+MONTH(RC[-6]) -> 11 | J855: =+RC[-6]-RC[-7] -> 26 | K855: =+IF(RC[-4]="OUT of TIME",RC[-1]-VLOOKUP(RC[-9],Enunciado!R3C6:R5C7,2,0),"") -> 
A856: Dept6-28201 | B856: Bajo | C856: 41161 | D856: 41164 | E856: =+LEFT(RC[-4],5) -> Dept6 | F856: =+VLOOKUP(RC[-4],Enunciado!R3C6:R5C7,2,0)+RC[-3] -> 41191 | G856: =+IF(RC[-1]>=RC[-3],"ON TIME","OUT OF TIME") -> ON TIME | H856: =+YEAR(RC[-5]) -> 2012 | I856: =+MONTH(RC[-6]) -> 9 | J856: =+RC[-6]-RC[-7] -> 3 | K856: =+IF(RC[-4]="OUT of TIME",RC[-1]-VLOOKUP(RC[-9],Enunciado!R3C6:R5C7,2,0),"") -> 
A857: Dept1-23996 | B857: Medio | C857: 41258 | D857: 41262 | E857: =+LEFT(RC[-4],5) -> Dept1 | F857: =+VLOOKUP(RC[-4],Enunciado!R3C6:R5C7,2,0)+RC[-3] -> 41273 | G857: =+IF(RC[-1]>=RC[-3],"ON TIME","OUT OF TIME") -> ON TIME | H857: =+YEAR(RC[-5]) -> 2012 | I857: =+MONTH(RC[-6]) -> 12 | J857: =+RC[-6]-RC[-7] -> 4 | K857: =+IF(RC[-4]="OUT of TIME",RC[-1]-VLOOKUP(RC[-9],Enunciado!R3C6:R5C7,2,0),"") -> 
A858: Dept6-12025 | B858: Medio | C858: 41211 | D858: 41225 | E858: =+LEFT(RC[-4],5) -> Dept6 | F858: =+VLOOKUP(RC[-4],Enunciado!R3C6:R5C7,2,0)+RC[-3] -> 41226 | G858: =+IF(RC[-1]>=RC[-3],"ON TIME","OUT OF TIME") -> ON TIME | H858: =+YEAR(RC[-5]) -> 2012 | I858: =+MONTH(RC[-6]) -> 10 | J858: =+RC[-6]-RC[-7] -> 14 | K858: =+IF(RC[-4]="OUT of TIME",RC[-1]-VLOOKUP(RC[-9],Enunciado!R3C6:R5C7,2,0),"") -> 
A859: Dept2-13807 | B859: Alto | C859: 41219 | D859: 41221 | E859: =+LEFT(RC[-4],5) -> Dept2 | F859: =+VLOOKUP(RC[-4],Enunciado!R3C6:R5C7,2,0)+RC[-3] -> 41224 | G859: =+IF(RC[-1]>=RC[-3],"ON TIME","OUT OF TIME") -> ON TIME | H859: =+YEAR(RC[-5]) -> 2012 | I859: =+MONTH(RC[-6]) -> 11 | J859: =+RC[-6]-RC[-7] -> 2 | K859: =+IF(RC[-4]="OUT of TIME",RC[-1]-VLOOKUP(RC[-9],Enunciado!R3C6:R5C7,2,0),"") -> 
A860: Dept6-23296 | B860: Alto | C860: 41519 | D860: 41529 | E860: =+LEFT(RC[-4],5) -> Dept6 | F860: =+VLOOKUP(RC[-4],Enunciado!R3C6:R5C7,2,0)+RC[-3] -> 41524 | G860: =+IF(RC[-1]>=RC[-3],"ON TIME","OUT OF TIME") -> OUT OF TIME | H860: =+YEAR(RC[-5]) -> 2013 | I860: =+MONTH(RC[-6]) -> 9 | J860: =+RC[-6]-RC[-7] -> 10 | K860: =+IF(RC[-4]="OUT of TIME",RC[-1]-VLOOKUP(RC[-9],Enunciado!R3C6:R5C7,2,0),"") -> 5
A861: Dept1-7786 | B861: Medio | C861: 41102 | D861: 41105 | E861: =+LEFT(RC[-4],5) -> Dept1 | F861: =+VLOOKUP(RC[-4],Enunciado!R3C6:R5C7,2,0)+RC[-3] -> 41117 | G861: =+IF(RC[-1]>=RC[-3],"ON TIME","OUT OF TIME") -> ON TIME | H861: =+YEAR(RC[-5]) -> 2012 | I861: =+MONTH(RC[-6]) -> 7 | J861: =+RC[-6]-RC[-7] -> 3 | K861: =+IF(RC[-4]="OUT of TIME",RC[-1]-VLOOKUP(RC[-9],Enunciado!R3C6:R5C7,2,0),"") -> 
A862: Dept1-10473 | B862: Alto | C862: 41151 | D862: 41154 | E862: =+LEFT(RC[-4],5) -> Dept1 | F862: =+VLOOKUP(RC[-4],Enunciado!R3C6:R5C7,2,0)+RC[-3] -> 41156 | G862: =+IF(RC[-1]>=RC[-3],"ON TIME","OUT OF TIME") -> ON TIME | H862: =+YEAR(RC[-5]) -> 2012 | I862: =+MONTH(RC[-6]) -> 8 | J862: =+RC[-6]-RC[-7] -> 3 | K862: =+IF(RC[-4]="OUT of TIME",RC[-1]-VLOOKUP(RC[-9],Enunciado!R3C6:R5C7,2,0),"") -> 
A863: Dept3-12863 | B863: Alto | C863: 41089 | D863: 41105 | E863: =+LEFT(RC[-4],5) -> Dept3 | F863: =+VLOOKUP(RC[-4],Enunciado!R3C6:R5C7,2,0)+RC[-3] -> 41094 | G863: =+IF(RC[-1]>=RC[-3],"ON TIME","OUT OF TIME") -> OUT OF TIME | H863: =+YEAR(RC[-5]) -> 2012 | I863: =+MONTH(RC[-6]) -> 6 | J863: =+RC[-6]-RC[-7] -> 16 | K863: =+IF(RC[-4]="OUT of TIME",RC[-1]-VLOOKUP(RC[-9],Enunciado!R3C6:R5C7,2,0),"") -> 11
A864: Dept3-8700 | B864: Bajo | C864: 41298 | D864: 41298 | E864: =+LEFT(RC[-4],5) -> Dept3 | F864: =+VLOOKUP(RC[-4],Enunciado!R3C6:R5C7,2,0)+RC[-3] -> 41328 | G864: =+IF(RC[-1]>=RC[-3],"ON TIME","OUT OF TIME") -> ON TIME | H864: =+YEAR(RC[-5]) -> 2013 | I864: =+MONTH(RC[-6]) -> 1 | J864: =+RC[-6]-RC[-7] -> 0 | K864: =+IF(RC[-4]="OUT of TIME",RC[-1]-VLOOKUP(RC[-9],Enunciado!R3C6:R5C7,2,0),"") -> 
A865: Dept4-3770 | B865: Bajo | C865: 41620 | D865: 41637 | E865: =+LEFT(RC[-4],5) -> Dept4 | F865: =+VLOOKUP(RC[-4],Enunciado!R3C6:R5C7,2,0)+RC[-3] -> 41650 | G865: =+IF(RC[-1]>=RC[-3],"ON TIME","OUT OF TIME") -> ON TIME | H865: =+YEAR(RC[-5]) -> 2013 | I865: =+MONTH(RC[-6]) -> 12 | J865: =+RC[-6]-RC[-7] -> 17 | K865: =+IF(RC[-4]="OUT of TIME",RC[-1]-VLOOKUP(RC[-9],Enunciado!R3C6:R5C7,2,0),"") -> 
A866: Dept2-22662 | B866: Alto | C866: 41319 | D866: 41324 | E866: =+LEFT(RC[-4],5) -> Dept2 | F866: =+VLOOKUP(RC[-4],Enunciado!R3C6:R5C7,2,0)+RC[-3] -> 41324 | G866: =+IF(RC[-1]>=RC[-3],"ON TIME","OUT OF TIME") -> ON TIME | H866: =+YEAR(RC[-5]) -> 2013 | I866: =+MONTH(RC[-6]) -> 2 | J866: =+RC[-6]-RC[-7] -> 5 | K866: =+IF(RC[-4]="OUT of TIME",RC[-1]-VLOOKUP(RC[-9],Enunciado!R3C6:R5C7,2,0),"") -> 
A867: Dept3-20999 | B867: Alto | C867: 41356 | D867: 41373 | E867: =+LEFT(RC[-4],5) -> Dept3 | F867: =+VLOOKUP(RC[-4],Enunciado!R3C6:R5C7,2,0)+RC[-3] -> 41361 | G867: =+IF(RC[-1]>=RC[-3],"ON TIME","OUT OF TIME") -> OUT OF TIME | H867: =+YEAR(RC[-5]) -> 2013 | I867: =+MONTH(RC[-6]) -> 3 | J867: =+RC[-6]-RC[-7] -> 17 | K867: =+IF(RC[-4]="OUT of TIME",RC[-1]-VLOOKUP(RC[-9],Enunciado!R3C6:R5C7,2,0),"") -> 12
A868: Dept2-15963 | B868: Bajo | C868: 41046 | D868: 41047 | E868: =+LEFT(RC[-4],5) -> Dept2 | F868: =+VLOOKUP(RC[-4],Enunciado!R3C6:R5C7,2,0)+RC[-3] -> 41076 | G868: =+IF(RC[-1]>=RC[-3],"ON TIME","OUT OF TIME") -> ON TIME | H868: =+YEAR(RC[-5]) -> 2012 | I868: =+MONTH(RC[-6]) -> 5 | J868: =+RC[-6]-RC[-7] -> 1 | K868: =+IF(RC[-4]="OUT of TIME",RC[-1]-VLOOKUP(RC[-9],Enunciado!R3C6:R5C7,2,0),"") -> 
A869: Dept3-11997 | B869: Bajo | C869: 41453 | D869: 41454 | E869: =+LEFT(RC[-4],5) -> Dept3 | F869: =+VLOOKUP(RC[-4],Enunciado!R3C6:R5C7,2,0)+RC[-3] -> 41483 | G869: =+IF(RC[-1]>=RC[-3],"ON TIME","OUT OF TIME") -> ON TIME | H869: =+YEAR(RC[-5]) -> 2013 | I869: =+MONTH(RC[-6]) -> 6 | J869: =+RC[-6]-RC[-7] -> 1 | K869: =+IF(RC[-4]="OUT of TIME",RC[-1]-VLOOKUP(RC[-9],Enunciado!R3C6:R5C7,2,0),"") -> 
A870: Dept3-9845 | B870: Alto | C870: 41011 | D870: 41012 | E870: =+LEFT(RC[-4],5) -> Dept3 | F870: =+VLOOKUP(RC[-4],Enunciado!R3C6:R5C7,2,0)+RC[-3] -> 41016 | G870: =+IF(RC[-1]>=RC[-3],"ON TIME","OUT OF TIME") -> ON TIME | H870: =+YEAR(RC[-5]) -> 2012 | I870: =+MONTH(RC[-6]) -> 4 | J870: =+RC[-6]-RC[-7] -> 1 | K870: =+IF(RC[-4]="OUT of TIME",RC[-1]-VLOOKUP(RC[-9],Enunciado!R3C6:R5C7,2,0),"") -> 
A871: Dept5-14667 | B871: Bajo | C871: 41564 | D871: 41573 | E871: =+LEFT(RC[-4],5) -> Dept5 | F871: =+VLOOKUP(RC[-4],Enunciado!R3C6:R5C7,2,0)+RC[-3] -> 41594 | G871: =+IF(RC[-1]>=RC[-3],"ON TIME","OUT OF TIME") -> ON TIME | H871: =+YEAR(RC[-5]) -> 2013 | I871: =+MONTH(RC[-6]) -> 10 | J871: =+RC[-6]-RC[-7] -> 9 | K871: =+IF(RC[-4]="OUT of TIME",RC[-1]-VLOOKUP(RC[-9],Enunciado!R3C6:R5C7,2,0),"") -> 
A872: Dept1-1549 | B872: Bajo | C872: 41516 | D872: 41519 | E872: =+LEFT(RC[-4],5) -> Dept1 | F872: =+VLOOKUP(RC[-4],Enunciado!R3C6:R5C7,2,0)+RC[-3] -> 41546 | G872: =+IF(RC[-1]>=RC[-3],"ON TIME","OUT OF TIME") -> ON TIME | H872: =+YEAR(RC[-5]) -> 2013 | I872: =+MONTH(RC[-6]) -> 8 | J872: =+RC[-6]-RC[-7] -> 3 | K872: =+IF(RC[-4]="OUT of TIME",RC[-1]-VLOOKUP(RC[-9],Enunciado!R3C6:R5C7,2,0),"") -> 
A873: Dept6-29734 | B873: Alto | C873: 41085 | D873: 41088 | E873: =+LEFT(RC[-4],5) -> Dept6 | F873: =+VLOOKUP(RC[-4],Enunciado!R3C6:R5C7,2,0)+RC[-3] -> 41090 | G873: =+IF(RC[-1]>=RC[-3],"ON TIME","OUT OF TIME") -> ON TIME | H873: =+YEAR(RC[-5]) -> 2012 | I873: =+MONTH(RC[-6]) -> 6 | J873: =+RC[-6]-RC[-7] -> 3 | K873: =+IF(RC[-4]="OUT of TIME",RC[-1]-VLOOKUP(RC[-9],Enunciado!R3C6:R5C7,2,0),"") -> 
A874: Dept5-20142 | B874: Medio | C874: 41176 | D874: 41180 | E874: =+LEFT(RC[-4],5) -> Dept5 | F874: =+VLOOKUP(RC[-4],Enunciado!R3C6:R5C7,2,0)+RC[-3] -> 41191 | G874: =+IF(RC[-1]>=RC[-3],"ON TIME","OUT OF TIME") -> ON TIME | H874: =+YEAR(RC[-5]) -> 2012 | I874: =+MONTH(RC[-6]) -> 9 | J874: =+RC[-6]-RC[-7] -> 4 | K874: =+IF(RC[-4]="OUT of TIME",RC[-1]-VLOOKUP(RC[-9],Enunciado!R3C6:R5C7,2,0),"") -> 
A875: Dept6-16049 | B875: Bajo | C875: 41088 | D875: 41091 | E875: =+LEFT(RC[-4],5) -> Dept6 | F875: =+VLOOKUP(RC[-4],Enunciado!R3C6:R5C7,2,0)+RC[-3] -> 41118 | G875: =+IF(RC[-1]>=RC[-3],"ON TIME","OUT OF TIME") -> ON TIME | H875: =+YEAR(RC[-5]) -> 2012 | I875: =+MONTH(RC[-6]) -> 6 | J875: =+RC[-6]-RC[-7] -> 3 | K875: =+IF(RC[-4]="OUT of TIME",RC[-1]-VLOOKUP(RC[-9],Enunciado!R3C6:R5C7,2,0),"") -> 
A876: Dept2-15115 | B876: Medio | C876: 41187 | D876: 41187 | E876: =+LEFT(RC[-4],5) -> Dept2 | F876: =+VLOOKUP(RC[-4],Enunciado!R3C6:R5C7,2,0)+RC[-3] -> 41202 | G876: =+IF(RC[-1]>=RC[-3],"ON TIME","OUT OF TIME") -> ON TIME | H876: =+YEAR(RC[-5]) -> 2012 | I876: =+MONTH(RC[-6]) -> 10 | J876: =+RC[-6]-RC[-7] -> 0 | K876: =+IF(RC[-4]="OUT of TIME",RC[-1]-VLOOKUP(RC[-9],Enunciado!R3C6:R5C7,2,0),"") -> 
A877: Dept4-371 | B877: Bajo | C877: 41280 | D877: 41280 | E877: =+LEFT(RC[-4],5) -> Dept4 | F877: =+VLOOKUP(RC[-4],Enunciado!R3C6:R5C7,2,0)+RC[-3] -> 41310 | G877: =+IF(RC[-1]>=RC[-3],"ON TIME","OUT OF TIME") -> ON TIME | H877: =+YEAR(RC[-5]) -> 2013 | I877: =+MONTH(RC[-6]) -> 1 | J877: =+RC[-6]-RC[-7] -> 0 | K877: =+IF(RC[-4]="OUT of TIME",RC[-1]-VLOOKUP(RC[-9],Enunciado!R3C6:R5C7,2,0),"") -> 
A878: Dept6-567 | B878: Medio | C878: 41241 | D878: 41243 | E878: =+LEFT(RC[-4],5) -> Dept6 | F878: =+VLOOKUP(RC[-4],Enunciado!R3C6:R5C7,2,0)+RC[-3] -> 41256 | G878: =+IF(RC[-1]>=RC[-3],"ON TIME","OUT OF TIME") -> ON TIME | H878: =+YEAR(RC[-5]) -> 2012 | I878: =+MONTH(RC[-6]) -> 11 | J878: =+RC[-6]-RC[-7] -> 2 | K878: =+IF(RC[-4]="OUT of TIME",RC[-1]-VLOOKUP(RC[-9],Enunciado!R3C6:R5C7,2,0),"") -> 
A879: Dept2-717 | B879: Medio | C879: 41216 | D879: 41230 | E879: =+LEFT(RC[-4],5) -> Dept2 | F879: =+VLOOKUP(RC[-4],Enunciado!R3C6:R5C7,2,0)+RC[-3] -> 41231 | G879: =+IF(RC[-1]>=RC[-3],"ON TIME","OUT OF TIME") -> ON TIME | H879: =+YEAR(RC[-5]) -> 2012 | I879: =+MONTH(RC[-6]) -> 11 | J879: =+RC[-6]-RC[-7] -> 14 | K879: =+IF(RC[-4]="OUT of TIME",RC[-1]-VLOOKUP(RC[-9],Enunciado!R3C6:R5C7,2,0),"") -> 
A880: Dept1-15290 | B880: Bajo | C880: 40984 | D880: 40990 | E880: =+LEFT(RC[-4],5) -> Dept1 | F880: =+VLOOKUP(RC[-4],Enunciado!R3C6:R5C7,2,0)+RC[-3] -> 41014 | G880: =+IF(RC[-1]>=RC[-3],"ON TIME","OUT OF TIME") -> ON TIME | H880: =+YEAR(RC[-5]) -> 2012 | I880: =+MONTH(RC[-6]) -> 3 | J880: =+RC[-6]-RC[-7] -> 6 | K880: =+IF(RC[-4]="OUT of TIME",RC[-1]-VLOOKUP(RC[-9],Enunciado!R3C6:R5C7,2,0),"") -> 
A881: Dept3-9824 | B881: Medio | C881: 41404 | D881: 41453 | E881: =+LEFT(RC[-4],5) -> Dept3 | F881: =+VLOOKUP(RC[-4],Enunciado!R3C6:R5C7,2,0)+RC[-3] -> 41419 | G881: =+IF(RC[-1]>=RC[-3],"ON TIME","OUT OF TIME") -> OUT OF TIME | H881: =+YEAR(RC[-5]) -> 2013 | I881: =+MONTH(RC[-6]) -> 5 | J881: =+RC[-6]-RC[-7] -> 49 | K881: =+IF(RC[-4]="OUT of TIME",RC[-1]-VLOOKUP(RC[-9],Enunciado!R3C6:R5C7,2,0),"") -> 34
A882: Dept5-6562 | B882: Alto | C882: 41017 | D882: 41020 | E882: =+LEFT(RC[-4],5) -> Dept5 | F882: =+VLOOKUP(RC[-4],Enunciado!R3C6:R5C7,2,0)+RC[-3] -> 41022 | G882: =+IF(RC[-1]>=RC[-3],"ON TIME","OUT OF TIME") -> ON TIME | H882: =+YEAR(RC[-5]) -> 2012 | I882: =+MONTH(RC[-6]) -> 4 | J882: =+RC[-6]-RC[-7] -> 3 | K882: =+IF(RC[-4]="OUT of TIME",RC[-1]-VLOOKUP(RC[-9],Enunciado!R3C6:R5C7,2,0),"") -> 
A883: Dept2-22788 | B883: Bajo | C883: 41090 | D883: 41099 | E883: =+LEFT(RC[-4],5) -> Dept2 | F883: =+VLOOKUP(RC[-4],Enunciado!R3C6:R5C7,2,0)+RC[-3] -> 41120 | G883: =+IF(RC[-1]>=RC[-3],"ON TIME","OUT OF TIME") -> ON TIME | H883: =+YEAR(RC[-5]) -> 2012 | I883: =+MONTH(RC[-6]) -> 6 | J883: =+RC[-6]-RC[-7] -> 9 | K883: =+IF(RC[-4]="OUT of TIME",RC[-1]-VLOOKUP(RC[-9],Enunciado!R3C6:R5C7,2,0),"") -> 
A884: Dept1-22962 | B884: Bajo | C884: 41463 | D884: 41466 | E884: =+LEFT(RC[-4],5) -> Dept1 | F884: =+VLOOKUP(RC[-4],Enunciado!R3C6:R5C7,2,0)+RC[-3] -> 41493 | G884: =+IF(RC[-1]>=RC[-3],"ON TIME","OUT OF TIME") -> ON TIME | H884: =+YEAR(RC[-5]) -> 2013 | I884: =+MONTH(RC[-6]) -> 7 | J884: =+RC[-6]-RC[-7] -> 3 | K884: =+IF(RC[-4]="OUT of TIME",RC[-1]-VLOOKUP(RC[-9],Enunciado!R3C6:R5C7,2,0),"") -> 
A885: Dept1-10450 | B885: Bajo | C885: 41571 | D885: 41575 | E885: =+LEFT(RC[-4],5) -> Dept1 | F885: =+VLOOKUP(RC[-4],Enunciado!R3C6:R5C7,2,0)+RC[-3] -> 41601 | G885: =+IF(RC[-1]>=RC[-3],"ON TIME","OUT OF TIME") -> ON TIME | H885: =+YEAR(RC[-5]) -> 2013 | I885: =+MONTH(RC[-6]) -> 10 | J885: =+RC[-6]-RC[-7] -> 4 | K885: =+IF(RC[-4]="OUT of TIME",RC[-1]-VLOOKUP(RC[-9],Enunciado!R3C6:R5C7,2,0),"") -> 
A886: Dept6-29029 | B886: Alto | C886: 41590 | D886: 41592 | E886: =+LEFT(RC[-4],5) -> Dept6 | F886: =+VLOOKUP(RC[-4],Enunciado!R3C6:R5C7,2,0)+RC[-3] -> 41595 | G886: =+IF(RC[-1]>=RC[-3],"ON TIME","OUT OF TIME") -> ON TIME | H886: =+YEAR(RC[-5]) -> 2013 | I886: =+MONTH(RC[-6]) -> 11 | J886: =+RC[-6]-RC[-7] -> 2 | K886: =+IF(RC[-4]="OUT of TIME",RC[-1]-VLOOKUP(RC[-9],Enunciado!R3C6:R5C7,2,0),"") -> 
A887: Dept1-17581 | B887: Alto | C887: 41521 | D887: 41562 | E887: =+LEFT(RC[-4],5) -> Dept1 | F887: =+VLOOKUP(RC[-4],Enunciado!R3C6:R5C7,2,0)+RC[-3] -> 41526 | G887: =+IF(RC[-1]>=RC[-3],"ON TIME","OUT OF TIME") -> OUT OF TIME | H887: =+YEAR(RC[-5]) -> 2013 | I887: =+MONTH(RC[-6]) -> 9 | J887: =+RC[-6]-RC[-7] -> 41 | K887: =+IF(RC[-4]="OUT of TIME",RC[-1]-VLOOKUP(RC[-9],Enunciado!R3C6:R5C7,2,0),"") -> 36
A888: Dept2-12056 | B888: Medio | C888: 41089 | D888: 41092 | E888: =+LEFT(RC[-4],5) -> Dept2 | F888: =+VLOOKUP(RC[-4],Enunciado!R3C6:R5C7,2,0)+RC[-3] -> 41104 | G888: =+IF(RC[-1]>=RC[-3],"ON TIME","OUT OF TIME") -> ON TIME | H888: =+YEAR(RC[-5]) -> 2012 | I888: =+MONTH(RC[-6]) -> 6 | J888: =+RC[-6]-RC[-7] -> 3 | K888: =+IF(RC[-4]="OUT of TIME",RC[-1]-VLOOKUP(RC[-9],Enunciado!R3C6:R5C7,2,0),"") -> 
A889: Dept1-2442 | B889: Alto | C889: 41605 | D889: 41637 | E889: =+LEFT(RC[-4],5) -> Dept1 | F889: =+VLOOKUP(RC[-4],Enunciado!R3C6:R5C7,2,0)+RC[-3] -> 41610 | G889: =+IF(RC[-1]>=RC[-3],"ON TIME","OUT OF TIME") -> OUT OF TIME | H889: =+YEAR(RC[-5]) -> 2013 | I889: =+MONTH(RC[-6]) -> 11 | J889: =+RC[-6]-RC[-7] -> 32 | K889: =+IF(RC[-4]="OUT of TIME",RC[-1]-VLOOKUP(RC[-9],Enunciado!R3C6:R5C7,2,0),"") -> 27
A890: Dept5-8859 | B890: Alto | C890: 40936 | D890: 40976 | E890: =+LEFT(RC[-4],5) -> Dept5 | F890: =+VLOOKUP(RC[-4],Enunciado!R3C6:R5C7,2,0)+RC[-3] -> 40941 | G890: =+IF(RC[-1]>=RC[-3],"ON TIME","OUT OF TIME") -> OUT OF TIME | H890: =+YEAR(RC[-5]) -> 2012 | I890: =+MONTH(RC[-6]) -> 1 | J890: =+RC[-6]-RC[-7] -> 40 | K890: =+IF(RC[-4]="OUT of TIME",RC[-1]-VLOOKUP(RC[-9],Enunciado!R3C6:R5C7,2,0),"") -> 35
A891: Dept3-1769 | B891: Bajo | C891: 41395 | D891: 41399 | E891: =+LEFT(RC[-4],5) -> Dept3 | F891: =+VLOOKUP(RC[-4],Enunciado!R3C6:R5C7,2,0)+RC[-3] -> 41425 | G891: =+IF(RC[-1]>=RC[-3],"ON TIME","OUT OF TIME") -> ON TIME | H891: =+YEAR(RC[-5]) -> 2013 | I891: =+MONTH(RC[-6]) -> 5 | J891: =+RC[-6]-RC[-7] -> 4 | K891: =+IF(RC[-4]="OUT of TIME",RC[-1]-VLOOKUP(RC[-9],Enunciado!R3C6:R5C7,2,0),"") -> 
A892: Dept1-17812 | B892: Medio | C892: 40990 | D892: 40996 | E892: =+LEFT(RC[-4],5) -> Dept1 | F892: =+VLOOKUP(RC[-4],Enunciado!R3C6:R5C7,2,0)+RC[-3] -> 41005 | G892: =+IF(RC[-1]>=RC[-3],"ON TIME","OUT OF TIME") -> ON TIME | H892: =+YEAR(RC[-5]) -> 2012 | I892: =+MONTH(RC[-6]) -> 3 | J892: =+RC[-6]-RC[-7] -> 6 | K892: =+IF(RC[-4]="OUT of TIME",RC[-1]-VLOOKUP(RC[-9],Enunciado!R3C6:R5C7,2,0),"") -> 
A893: Dept5-12747 | B893: Medio | C893: 41248 | D893: 41248 | E893: =+LEFT(RC[-4],5) -> Dept5 | F893: =+VLOOKUP(RC[-4],Enunciado!R3C6:R5C7,2,0)+RC[-3] -> 41263 | G893: =+IF(RC[-1]>=RC[-3],"ON TIME","OUT OF TIME") -> ON TIME | H893: =+YEAR(RC[-5]) -> 2012 | I893: =+MONTH(RC[-6]) -> 12 | J893: =+RC[-6]-RC[-7] -> 0 | K893: =+IF(RC[-4]="OUT of TIME",RC[-1]-VLOOKUP(RC[-9],Enunciado!R3C6:R5C7,2,0),"") -> 
A894: Dept5-8966 | B894: Bajo | C894: 41471 | D894: 41472 | E894: =+LEFT(RC[-4],5) -> Dept5 | F894: =+VLOOKUP(RC[-4],Enunciado!R3C6:R5C7,2,0)+RC[-3] -> 41501 | G894: =+IF(RC[-1]>=RC[-3],"ON TIME","OUT OF TIME") -> ON TIME | H894: =+YEAR(RC[-5]) -> 2013 | I894: =+MONTH(RC[-6]) -> 7 | J894: =+RC[-6]-RC[-7] -> 1 | K894: =+IF(RC[-4]="OUT of TIME",RC[-1]-VLOOKUP(RC[-9],Enunciado!R3C6:R5C7,2,0),"") -> 
A895: Dept1-11044 | B895: Bajo | C895: 41005 | D895: 41007 | E895: =+LEFT(RC[-4],5) -> Dept1 | F895: =+VLOOKUP(RC[-4],Enunciado!R3C6:R5C7,2,0)+RC[-3] -> 41035 | G895: =+IF(RC[-1]>=RC[-3],"ON TIME","OUT OF TIME") -> ON TIME | H895: =+YEAR(RC[-5]) -> 2012 | I895: =+MONTH(RC[-6]) -> 4 | J895: =+RC[-6]-RC[-7] -> 2 | K895: =+IF(RC[-4]="OUT of TIME",RC[-1]-VLOOKUP(RC[-9],Enunciado!R3C6:R5C7,2,0),"") -> 
A896: Dept6-12573 | B896: Alto | C896: 41351 | D896: 41356 | E896: =+LEFT(RC[-4],5) -> Dept6 | F896: =+VLOOKUP(RC[-4],Enunciado!R3C6:R5C7,2,0)+RC[-3] -> 41356 | G896: =+IF(RC[-1]>=RC[-3],"ON TIME","OUT OF TIME") -> ON TIME | H896: =+YEAR(RC[-5]) -> 2013 | I896: =+MONTH(RC[-6]) -> 3 | J896: =+RC[-6]-RC[-7] -> 5 | K896: =+IF(RC[-4]="OUT of TIME",RC[-1]-VLOOKUP(RC[-9],Enunciado!R3C6:R5C7,2,0),"") -> 
A897: Dept3-21461 | B897: Alto | C897: 41100 | D897: 41100 | E897: =+LEFT(RC[-4],5) -> Dept3 | F897: =+VLOOKUP(RC[-4],Enunciado!R3C6:R5C7,2,0)+RC[-3] -> 41105 | G897: =+IF(RC[-1]>=RC[-3],"ON TIME","OUT OF TIME") -> ON TIME | H897: =+YEAR(RC[-5]) -> 2012 | I897: =+MONTH(RC[-6]) -> 7 | J897: =+RC[-6]-RC[-7] -> 0 | K897: =+IF(RC[-4]="OUT of TIME",RC[-1]-VLOOKUP(RC[-9],Enunciado!R3C6:R5C7,2,0),"") -> 
A898: Dept5-3816 | B898: Medio | C898: 41420 | D898: 41421 | E898: =+LEFT(RC[-4],5) -> Dept5 | F898: =+VLOOKUP(RC[-4],Enunciado!R3C6:R5C7,2,0)+RC[-3] -> 41435 | G898: =+IF(RC[-1]>=RC[-3],"ON TIME","OUT OF TIME") -> ON TIME | H898: =+YEAR(RC[-5]) -> 2013 | I898: =+MONTH(RC[-6]) -> 5 | J898: =+RC[-6]-RC[-7] -> 1 | K898: =+IF(RC[-4]="OUT of TIME",RC[-1]-VLOOKUP(RC[-9],Enunciado!R3C6:R5C7,2,0),"") -> 
A899: Dept6-15263 | B899: Medio | C899: 41314 | D899: 41325 | E899: =+LEFT(RC[-4],5) -> Dept6 | F899: =+VLOOKUP(RC[-4],Enunciado!R3C6:R5C7,2,0)+RC[-3] -> 41329 | G899: =+IF(RC[-1]>=RC[-3],"ON TIME","OUT OF TIME") -> ON TIME | H899: =+YEAR(RC[-5]) -> 2013 | I899: =+MONTH(RC[-6]) -> 2 | J899: =+RC[-6]-RC[-7] -> 11 | K899: =+IF(RC[-4]="OUT of TIME",RC[-1]-VLOOKUP(RC[-9],Enunciado!R3C6:R5C7,2,0),"") -> 
A900: Dept4-29063 | B900: Medio | C900: 40960 | D900: 40984 | E900: =+LEFT(RC[-4],5) -> Dept4 | F900: =+VLOOKUP(RC[-4],Enunciado!R3C6:R5C7,2,0)+RC[-3] -> 40975 | G900: =+IF(RC[-1]>=RC[-3],"ON TIME","OUT OF TIME") -> OUT OF TIME | H900: =+YEAR(RC[-5]) -> 2012 | I900: =+MONTH(RC[-6]) -> 2 | J900: =+RC[-6]-RC[-7] -> 24 | K900: =+IF(RC[-4]="OUT of TIME",RC[-1]-VLOOKUP(RC[-9],Enunciado!R3C6:R5C7,2,0),"") -> 9
A901: Dept2-15744 | B901: Alto | C901: 41216 | D901: 41220 | E901: =+LEFT(RC[-4],5) -> Dept2 | F901: =+VLOOKUP(RC[-4],Enunciado!R3C6:R5C7,2,0)+RC[-3] -> 41221 | G901: =+IF(RC[-1]>=RC[-3],"ON TIME","OUT OF TIME") -> ON TIME | H901: =+YEAR(RC[-5]) -> 2012 | I901: =+MONTH(RC[-6]) -> 11 | J901: =+RC[-6]-RC[-7] -> 4 | K901: =+IF(RC[-4]="OUT of TIME",RC[-1]-VLOOKUP(RC[-9],Enunciado!R3C6:R5C7,2,0),"") -> 
A902: Dept4-6458 | B902: Bajo | C902: 41462 | D902: 41464 | E902: =+LEFT(RC[-4],5) -> Dept4 | F902: =+VLOOKUP(RC[-4],Enunciado!R3C6:R5C7,2,0)+RC[-3] -> 41492 | G902: =+IF(RC[-1]>=RC[-3],"ON TIME","OUT OF TIME") -> ON TIME | H902: =+YEAR(RC[-5]) -> 2013 | I902: =+MONTH(RC[-6]) -> 7 | J902: =+RC[-6]-RC[-7] -> 2 | K902: =+IF(RC[-4]="OUT of TIME",RC[-1]-VLOOKUP(RC[-9],Enunciado!R3C6:R5C7,2,0),"") -> 
A903: Dept1-21111 | B903: Alto | C903: 41269 | D903: 41291 | E903: =+LEFT(RC[-4],5) -> Dept1 | F903: =+VLOOKUP(RC[-4],Enunciado!R3C6:R5C7,2,0)+RC[-3] -> 41274 | G903: =+IF(RC[-1]>=RC[-3],"ON TIME","OUT OF TIME") -> OUT OF TIME | H903: =+YEAR(RC[-5]) -> 2012 | I903: =+MONTH(RC[-6]) -> 12 | J903: =+RC[-6]-RC[-7] -> 22 | K903: =+IF(RC[-4]="OUT of TIME",RC[-1]-VLOOKUP(RC[-9],Enunciado!R3C6:R5C7,2,0),"") -> 17
A904: Dept2-21165 | B904: Medio | C904: 41294 | D904: 41300 | E904: =+LEFT(RC[-4],5) -> Dept2 | F904: =+VLOOKUP(RC[-4],Enunciado!R3C6:R5C7,2,0)+RC[-3] -> 41309 | G904: =+IF(RC[-1]>=RC[-3],"ON TIME","OUT OF TIME") -> ON TIME | H904: =+YEAR(RC[-5]) -> 2013 | I904: =+MONTH(RC[-6]) -> 1 | J904: =+RC[-6]-RC[-7] -> 6 | K904: =+IF(RC[-4]="OUT of TIME",RC[-1]-VLOOKUP(RC[-9],Enunciado!R3C6:R5C7,2,0),"") -> 
A905: Dept4-21222 | B905: Alto | C905: 41244 | D905: 41248 | E905: =+LEFT(RC[-4],5) -> Dept4 | F905: =+VLOOKUP(RC[-4],Enunciado!R3C6:R5C7,2,0)+RC[-3] -> 41249 | G905: =+IF(RC[-1]>=RC[-3],"ON TIME","OUT OF TIME") -> ON TIME | H905: =+YEAR(RC[-5]) -> 2012 | I905: =+MONTH(RC[-6]) -> 12 | J905: =+RC[-6]-RC[-7] -> 4 | K905: =+IF(RC[-4]="OUT of TIME",RC[-1]-VLOOKUP(RC[-9],Enunciado!R3C6:R5C7,2,0),"") -> 
A906: Dept2-23059 | B906: Alto | C906: 41024 | D906: 41025 | E906: =+LEFT(RC[-4],5) -> Dept2 | F906: =+VLOOKUP(RC[-4],Enunciado!R3C6:R5C7,2,0)+RC[-3] -> 41029 | G906: =+IF(RC[-1]>=RC[-3],"ON TIME","OUT OF TIME") -> ON TIME | H906: =+YEAR(RC[-5]) -> 2012 | I906: =+MONTH(RC[-6]) -> 4 | J906: =+RC[-6]-RC[-7] -> 1 | K906: =+IF(RC[-4]="OUT of TIME",RC[-1]-VLOOKUP(RC[-9],Enunciado!R3C6:R5C7,2,0),"") -> 
A907: Dept4-2258 | B907: Alto | C907: 41621 | D907: 41622 | E907: =+LEFT(RC[-4],5) -> Dept4 | F907: =+VLOOKUP(RC[-4],Enunciado!R3C6:R5C7,2,0)+RC[-3] -> 41626 | G907: =+IF(RC[-1]>=RC[-3],"ON TIME","OUT OF TIME") -> ON TIME | H907: =+YEAR(RC[-5]) -> 2013 | I907: =+MONTH(RC[-6]) -> 12 | J907: =+RC[-6]-RC[-7] -> 1 | K907: =+IF(RC[-4]="OUT of TIME",RC[-1]-VLOOKUP(RC[-9],Enunciado!R3C6:R5C7,2,0),"") -> 
A908: Dept5-2208 | B908: Alto | C908: 40932 | D908: 40946 | E908: =+LEFT(RC[-4],5) -> Dept5 | F908: =+VLOOKUP(RC[-4],Enunciado!R3C6:R5C7,2,0)+RC[-3] -> 40937 | G908: =+IF(RC[-1]>=RC[-3],"ON TIME","OUT OF TIME") -> OUT OF TIME | H908: =+YEAR(RC[-5]) -> 2012 | I908: =+MONTH(RC[-6]) -> 1 | J908: =+RC[-6]-RC[-7] -> 14 | K908: =+IF(RC[-4]="OUT of TIME",RC[-1]-VLOOKUP(RC[-9],Enunciado!R3C6:R5C7,2,0),"") -> 9
A909: Dept5-20892 | B909: Alto | C909: 41003 | D909: 41020 | E909: =+LEFT(RC[-4],5) -> Dept5 | F909: =+VLOOKUP(RC[-4],Enunciado!R3C6:R5C7,2,0)+RC[-3] -> 41008 | G909: =+IF(RC[-1]>=RC[-3],"ON TIME","OUT OF TIME") -> OUT OF TIME | H909: =+YEAR(RC[-5]) -> 2012 | I909: =+MONTH(RC[-6]) -> 4 | J909: =+RC[-6]-RC[-7] -> 17 | K909: =+IF(RC[-4]="OUT of TIME",RC[-1]-VLOOKUP(RC[-9],Enunciado!R3C6:R5C7,2,0),"") -> 12
A910: Dept4-14928 | B910: Alto | C910: 41409 | D910: 41440 | E910: =+LEFT(RC[-4],5) -> Dept4 | F910: =+VLOOKUP(RC[-4],Enunciado!R3C6:R5C7,2,0)+RC[-3] -> 41414 | G910: =+IF(RC[-1]>=RC[-3],"ON TIME","OUT OF TIME") -> OUT OF TIME | H910: =+YEAR(RC[-5]) -> 2013 | I910: =+MONTH(RC[-6]) -> 5 | J910: =+RC[-6]-RC[-7] -> 31 | K910: =+IF(RC[-4]="OUT of TIME",RC[-1]-VLOOKUP(RC[-9],Enunciado!R3C6:R5C7,2,0),"") -> 26
A911: Dept2-17007 | B911: Medio | C911: 41458 | D911: 41506 | E911: =+LEFT(RC[-4],5) -> Dept2 | F911: =+VLOOKUP(RC[-4],Enunciado!R3C6:R5C7,2,0)+RC[-3] -> 41473 | G911: =+IF(RC[-1]>=RC[-3],"ON TIME","OUT OF TIME") -> OUT OF TIME | H911: =+YEAR(RC[-5]) -> 2013 | I911: =+MONTH(RC[-6]) -> 7 | J911: =+RC[-6]-RC[-7] -> 48 | K911: =+IF(RC[-4]="OUT of TIME",RC[-1]-VLOOKUP(RC[-9],Enunciado!R3C6:R5C7,2,0),"") -> 33
A912: Dept3-10745 | B912: Bajo | C912: 41284 | D912: 41285 | E912: =+LEFT(RC[-4],5) -> Dept3 | F912: =+VLOOKUP(RC[-4],Enunciado!R3C6:R5C7,2,0)+RC[-3] -> 41314 | G912: =+IF(RC[-1]>=RC[-3],"ON TIME","OUT OF TIME") -> ON TIME | H912: =+YEAR(RC[-5]) -> 2013 | I912: =+MONTH(RC[-6]) -> 1 | J912: =+RC[-6]-RC[-7] -> 1 | K912: =+IF(RC[-4]="OUT of TIME",RC[-1]-VLOOKUP(RC[-9],Enunciado!R3C6:R5C7,2,0),"") -> 
A913: Dept3-1533 | B913: Alto | C913: 41407 | D913: 41426 | E913: =+LEFT(RC[-4],5) -> Dept3 | F913: =+VLOOKUP(RC[-4],Enunciado!R3C6:R5C7,2,0)+RC[-3] -> 41412 | G913: =+IF(RC[-1]>=RC[-3],"ON TIME","OUT OF TIME") -> OUT OF TIME | H913: =+YEAR(RC[-5]) -> 2013 | I913: =+MONTH(RC[-6]) -> 5 | J913: =+RC[-6]-RC[-7] -> 19 | K913: =+IF(RC[-4]="OUT of TIME",RC[-1]-VLOOKUP(RC[-9],Enunciado!R3C6:R5C7,2,0),"") -> 14
A914: Dept4-18057 | B914: Bajo | C914: 41549 | D914: 41584 | E914: =+LEFT(RC[-4],5) -> Dept4 | F914: =+VLOOKUP(RC[-4],Enunciado!R3C6:R5C7,2,0)+RC[-3] -> 41579 | G914: =+IF(RC[-1]>=RC[-3],"ON TIME","OUT OF TIME") -> OUT OF TIME | H914: =+YEAR(RC[-5]) -> 2013 | I914: =+MONTH(RC[-6]) -> 10 | J914: =+RC[-6]-RC[-7] -> 35 | K914: =+IF(RC[-4]="OUT of TIME",RC[-1]-VLOOKUP(RC[-9],Enunciado!R3C6:R5C7,2,0),"") -> 5
A915: Dept5-3462 | B915: Medio | C915: 41105 | D915: 41107 | E915: =+LEFT(RC[-4],5) -> Dept5 | F915: =+VLOOKUP(RC[-4],Enunciado!R3C6:R5C7,2,0)+RC[-3] -> 41120 | G915: =+IF(RC[-1]>=RC[-3],"ON TIME","OUT OF TIME") -> ON TIME | H915: =+YEAR(RC[-5]) -> 2012 | I915: =+MONTH(RC[-6]) -> 7 | J915: =+RC[-6]-RC[-7] -> 2 | K915: =+IF(RC[-4]="OUT of TIME",RC[-1]-VLOOKUP(RC[-9],Enunciado!R3C6:R5C7,2,0),"") -> 
A916: Dept6-23834 | B916: Bajo | C916: 41027 | D916: 41028 | E916: =+LEFT(RC[-4],5) -> Dept6 | F916: =+VLOOKUP(RC[-4],Enunciado!R3C6:R5C7,2,0)+RC[-3] -> 41057 | G916: =+IF(RC[-1]>=RC[-3],"ON TIME","OUT OF TIME") -> ON TIME | H916: =+YEAR(RC[-5]) -> 2012 | I916: =+MONTH(RC[-6]) -> 4 | J916: =+RC[-6]-RC[-7] -> 1 | K916: =+IF(RC[-4]="OUT of TIME",RC[-1]-VLOOKUP(RC[-9],Enunciado!R3C6:R5C7,2,0),"") -> 
A917: Dept3-7608 | B917: Medio | C917: 41229 | D917: 41230 | E917: =+LEFT(RC[-4],5) -> Dept3 | F917: =+VLOOKUP(RC[-4],Enunciado!R3C6:R5C7,2,0)+RC[-3] -> 41244 | G917: =+IF(RC[-1]>=RC[-3],"ON TIME","OUT OF TIME") -> ON TIME | H917: =+YEAR(RC[-5]) -> 2012 | I917: =+MONTH(RC[-6]) -> 11 | J917: =+RC[-6]-RC[-7] -> 1 | K917: =+IF(RC[-4]="OUT of TIME",RC[-1]-VLOOKUP(RC[-9],Enunciado!R3C6:R5C7,2,0),"") -> 
A918: Dept4-142 | B918: Medio | C918: 40944 | D918: 40986 | E918: =+LEFT(RC[-4],5) -> Dept4 | F918: =+VLOOKUP(RC[-4],Enunciado!R3C6:R5C7,2,0)+RC[-3] -> 40959 | G918: =+IF(RC[-1]>=RC[-3],"ON TIME","OUT OF TIME") -> OUT OF TIME | H918: =+YEAR(RC[-5]) -> 2012 | I918: =+MONTH(RC[-6]) -> 2 | J918: =+RC[-6]-RC[-7] -> 42 | K918: =+IF(RC[-4]="OUT of TIME",RC[-1]-VLOOKUP(RC[-9],Enunciado!R3C6:R5C7,2,0),"") -> 27
A919: Dept4-2173 | B919: Bajo | C919: 41493 | D919: 41493 | E919: =+LEFT(RC[-4],5) -> Dept4 | F919: =+VLOOKUP(RC[-4],Enunciado!R3C6:R5C7,2,0)+RC[-3] -> 41523 | G919: =+IF(RC[-1]>=RC[-3],"ON TIME","OUT OF TIME") -> ON TIME | H919: =+YEAR(RC[-5]) -> 2013 | I919: =+MONTH(RC[-6]) -> 8 | J919: =+RC[-6]-RC[-7] -> 0 | K919: =+IF(RC[-4]="OUT of TIME",RC[-1]-VLOOKUP(RC[-9],Enunciado!R3C6:R5C7,2,0),"") -> 
A920: Dept1-27822 | B920: Alto | C920: 41355 | D920: 41370 | E920: =+LEFT(RC[-4],5) -> Dept1 | F920: =+VLOOKUP(RC[-4],Enunciado!R3C6:R5C7,2,0)+RC[-3] -> 41360 | G920: =+IF(RC[-1]>=RC[-3],"ON TIME","OUT OF TIME") -> OUT OF TIME | H920: =+YEAR(RC[-5]) -> 2013 | I920: =+MONTH(RC[-6]) -> 3 | J920: =+RC[-6]-RC[-7] -> 15 | K920: =+IF(RC[-4]="OUT of TIME",RC[-1]-VLOOKUP(RC[-9],Enunciado!R3C6:R5C7,2,0),"") -> 10
A921: Dept1-22674 | B921: Bajo | C921: 41183 | D921: 41215 | E921: =+LEFT(RC[-4],5) -> Dept1 | F921: =+VLOOKUP(RC[-4],Enunciado!R3C6:R5C7,2,0)+RC[-3] -> 41213 | G921: =+IF(RC[-1]>=RC[-3],"ON TIME","OUT OF TIME") -> OUT OF TIME | H921: =+YEAR(RC[-5]) -> 2012 | I921: =+MONTH(RC[-6]) -> 10 | J921: =+RC[-6]-RC[-7] -> 32 | K921: =+IF(RC[-4]="OUT of TIME",RC[-1]-VLOOKUP(RC[-9],Enunciado!R3C6:R5C7,2,0),"") -> 2
A922: Dept4-25124 | B922: Medio | C922: 41461 | D922: 41466 | E922: =+LEFT(RC[-4],5) -> Dept4 | F922: =+VLOOKUP(RC[-4],Enunciado!R3C6:R5C7,2,0)+RC[-3] -> 41476 | G922: =+IF(RC[-1]>=RC[-3],"ON TIME","OUT OF TIME") -> ON TIME | H922: =+YEAR(RC[-5]) -> 2013 | I922: =+MONTH(RC[-6]) -> 7 | J922: =+RC[-6]-RC[-7] -> 5 | K922: =+IF(RC[-4]="OUT of TIME",RC[-1]-VLOOKUP(RC[-9],Enunciado!R3C6:R5C7,2,0),"") -> 
A923: Dept2-26302 | B923: Alto | C923: 41042 | D923: 41045 | E923: =+LEFT(RC[-4],5) -> Dept2 | F923: =+VLOOKUP(RC[-4],Enunciado!R3C6:R5C7,2,0)+RC[-3] -> 41047 | G923: =+IF(RC[-1]>=RC[-3],"ON TIME","OUT OF TIME") -> ON TIME | H923: =+YEAR(RC[-5]) -> 2012 | I923: =+MONTH(RC[-6]) -> 5 | J923: =+RC[-6]-RC[-7] -> 3 | K923: =+IF(RC[-4]="OUT of TIME",RC[-1]-VLOOKUP(RC[-9],Enunciado!R3C6:R5C7,2,0),"") -> 
A924: Dept4-6622 | B924: Bajo | C924: 40997 | D924: 41005 | E924: =+LEFT(RC[-4],5) -> Dept4 | F924: =+VLOOKUP(RC[-4],Enunciado!R3C6:R5C7,2,0)+RC[-3] -> 41027 | G924: =+IF(RC[-1]>=RC[-3],"ON TIME","OUT OF TIME") -> ON TIME | H924: =+YEAR(RC[-5]) -> 2012 | I924: =+MONTH(RC[-6]) -> 3 | J924: =+RC[-6]-RC[-7] -> 8 | K924: =+IF(RC[-4]="OUT of TIME",RC[-1]-VLOOKUP(RC[-9],Enunciado!R3C6:R5C7,2,0),"") -> 
A925: Dept3-8282 | B925: Alto | C925: 41123 | D925: 41130 | E925: =+LEFT(RC[-4],5) -> Dept3 | F925: =+VLOOKUP(RC[-4],Enunciado!R3C6:R5C7,2,0)+RC[-3] -> 41128 | G925: =+IF(RC[-1]>=RC[-3],"ON TIME","OUT OF TIME") -> OUT OF TIME | H925: =+YEAR(RC[-5]) -> 2012 | I925: =+MONTH(RC[-6]) -> 8 | J925: =+RC[-6]-RC[-7] -> 7 | K925: =+IF(RC[-4]="OUT of TIME",RC[-1]-VLOOKUP(RC[-9],Enunciado!R3C6:R5C7,2,0),"") -> 2
A926: Dept5-5211 | B926: Alto | C926: 41025 | D926: 41027 | E926: =+LEFT(RC[-4],5) -> Dept5 | F926: =+VLOOKUP(RC[-4],Enunciado!R3C6:R5C7,2,0)+RC[-3] -> 41030 | G926: =+IF(RC[-1]>=RC[-3],"ON TIME","OUT OF TIME") -> ON TIME | H926: =+YEAR(RC[-5]) -> 2012 | I926: =+MONTH(RC[-6]) -> 4 | J926: =+RC[-6]-RC[-7] -> 2 | K926: =+IF(RC[-4]="OUT of TIME",RC[-1]-VLOOKUP(RC[-9],Enunciado!R3C6:R5C7,2,0),"") -> 
A927: Dept4-29271 | B927: Bajo | C927: 40933 | D927: 40937 | E927: =+LEFT(RC[-4],5) -> Dept4 | F927: =+VLOOKUP(RC[-4],Enunciado!R3C6:R5C7,2,0)+RC[-3] -> 40963 | G927: =+IF(RC[-1]>=RC[-3],"ON TIME","OUT OF TIME") -> ON TIME | H927: =+YEAR(RC[-5]) -> 2012 | I927: =+MONTH(RC[-6]) -> 1 | J927: =+RC[-6]-RC[-7] -> 4 | K927: =+IF(RC[-4]="OUT of TIME",RC[-1]-VLOOKUP(RC[-9],Enunciado!R3C6:R5C7,2,0),"") -> 
A928: Dept6-27499 | B928: Alto | C928: 41062 | D928: 41094 | E928: =+LEFT(RC[-4],5) -> Dept6 | F928: =+VLOOKUP(RC[-4],Enunciado!R3C6:R5C7,2,0)+RC[-3] -> 41067 | G928: =+IF(RC[-1]>=RC[-3],"ON TIME","OUT OF TIME") -> OUT OF TIME | H928: =+YEAR(RC[-5]) -> 2012 | I928: =+MONTH(RC[-6]) -> 6 | J928: =+RC[-6]-RC[-7] -> 32 | K928: =+IF(RC[-4]="OUT of TIME",RC[-1]-VLOOKUP(RC[-9],Enunciado!R3C6:R5C7,2,0),"") -> 27
A929: Dept3-10390 | B929: Alto | C929: 41026 | D929: 41042 | E929: =+LEFT(RC[-4],5) -> Dept3 | F929: =+VLOOKUP(RC[-4],Enunciado!R3C6:R5C7,2,0)+RC[-3] -> 41031 | G929: =+IF(RC[-1]>=RC[-3],"ON TIME","OUT OF TIME") -> OUT OF TIME | H929: =+YEAR(RC[-5]) -> 2012 | I929: =+MONTH(RC[-6]) -> 4 | J929: =+RC[-6]-RC[-7] -> 16 | K929: =+IF(RC[-4]="OUT of TIME",RC[-1]-VLOOKUP(RC[-9],Enunciado!R3C6:R5C7,2,0),"") -> 11
A930: Dept5-417 | B930: Alto | C930: 41219 | D930: 41236 | E930: =+LEFT(RC[-4],5) -> Dept5 | F930: =+VLOOKUP(RC[-4],Enunciado!R3C6:R5C7,2,0)+RC[-3] -> 41224 | G930: =+IF(RC[-1]>=RC[-3],"ON TIME","OUT OF TIME") -> OUT OF TIME | H930: =+YEAR(RC[-5]) -> 2012 | I930: =+MONTH(RC[-6]) -> 11 | J930: =+RC[-6]-RC[-7] -> 17 | K930: =+IF(RC[-4]="OUT of TIME",RC[-1]-VLOOKUP(RC[-9],Enunciado!R3C6:R5C7,2,0),"") -> 12
A931: Dept2-29924 | B931: Medio | C931: 41516 | D931: 41557 | E931: =+LEFT(RC[-4],5) -> Dept2 | F931: =+VLOOKUP(RC[-4],Enunciado!R3C6:R5C7,2,0)+RC[-3] -> 41531 | G931: =+IF(RC[-1]>=RC[-3],"ON TIME","OUT OF TIME") -> OUT OF TIME | H931: =+YEAR(RC[-5]) -> 2013 | I931: =+MONTH(RC[-6]) -> 8 | J931: =+RC[-6]-RC[-7] -> 41 | K931: =+IF(RC[-4]="OUT of TIME",RC[-1]-VLOOKUP(RC[-9],Enunciado!R3C6:R5C7,2,0),"") -> 26
A932: Dept6-4347 | B932: Medio | C932: 41212 | D932: 41247 | E932: =+LEFT(RC[-4],5) -> Dept6 | F932: =+VLOOKUP(RC[-4],Enunciado!R3C6:R5C7,2,0)+RC[-3] -> 41227 | G932: =+IF(RC[-1]>=RC[-3],"ON TIME","OUT OF TIME") -> OUT OF TIME | H932: =+YEAR(RC[-5]) -> 2012 | I932: =+MONTH(RC[-6]) -> 10 | J932: =+RC[-6]-RC[-7] -> 35 | K932: =+IF(RC[-4]="OUT of TIME",RC[-1]-VLOOKUP(RC[-9],Enunciado!R3C6:R5C7,2,0),"") -> 20
A933: Dept4-3268 | B933: Medio | C933: 41012 | D933: 41019 | E933: =+LEFT(RC[-4],5) -> Dept4 | F933: =+VLOOKUP(RC[-4],Enunciado!R3C6:R5C7,2,0)+RC[-3] -> 41027 | G933: =+IF(RC[-1]>=RC[-3],"ON TIME","OUT OF TIME") -> ON TIME | H933: =+YEAR(RC[-5]) -> 2012 | I933: =+MONTH(RC[-6]) -> 4 | J933: =+RC[-6]-RC[-7] -> 7 | K933: =+IF(RC[-4]="OUT of TIME",RC[-1]-VLOOKUP(RC[-9],Enunciado!R3C6:R5C7,2,0),"") -> 
A934: Dept5-15588 | B934: Medio | C934: 41503 | D934: 41505 | E934: =+LEFT(RC[-4],5) -> Dept5 | F934: =+VLOOKUP(RC[-4],Enunciado!R3C6:R5C7,2,0)+RC[-3] -> 41518 | G934: =+IF(RC[-1]>=RC[-3],"ON TIME","OUT OF TIME") -> ON TIME | H934: =+YEAR(RC[-5]) -> 2013 | I934: =+MONTH(RC[-6]) -> 8 | J934: =+RC[-6]-RC[-7] -> 2 | K934: =+IF(RC[-4]="OUT of TIME",RC[-1]-VLOOKUP(RC[-9],Enunciado!R3C6:R5C7,2,0),"") -> 
A935: Dept1-5181 | B935: Bajo | C935: 40935 | D935: 40938 | E935: =+LEFT(RC[-4],5) -> Dept1 | F935: =+VLOOKUP(RC[-4],Enunciado!R3C6:R5C7,2,0)+RC[-3] -> 40965 | G935: =+IF(RC[-1]>=RC[-3],"ON TIME","OUT OF TIME") -> ON TIME | H935: =+YEAR(RC[-5]) -> 2012 | I935: =+MONTH(RC[-6]) -> 1 | J935: =+RC[-6]-RC[-7] -> 3 | K935: =+IF(RC[-4]="OUT of TIME",RC[-1]-VLOOKUP(RC[-9],Enunciado!R3C6:R5C7,2,0),"") -> 
A936: Dept2-8473 | B936: Medio | C936: 40971 | D936: 40972 | E936: =+LEFT(RC[-4],5) -> Dept2 | F936: =+VLOOKUP(RC[-4],Enunciado!R3C6:R5C7,2,0)+RC[-3] -> 40986 | G936: =+IF(RC[-1]>=RC[-3],"ON TIME","OUT OF TIME") -> ON TIME | H936: =+YEAR(RC[-5]) -> 2012 | I936: =+MONTH(RC[-6]) -> 3 | J936: =+RC[-6]-RC[-7] -> 1 | K936: =+IF(RC[-4]="OUT of TIME",RC[-1]-VLOOKUP(RC[-9],Enunciado!R3C6:R5C7,2,0),"") -> 
A937: Dept5-10900 | B937: Bajo | C937: 41302 | D937: 41305 | E937: =+LEFT(RC[-4],5) -> Dept5 | F937: =+VLOOKUP(RC[-4],Enunciado!R3C6:R5C7,2,0)+RC[-3] -> 41332 | G937: =+IF(RC[-1]>=RC[-3],"ON TIME","OUT OF TIME") -> ON TIME | H937: =+YEAR(RC[-5]) -> 2013 | I937: =+MONTH(RC[-6]) -> 1 | J937: =+RC[-6]-RC[-7] -> 3 | K937: =+IF(RC[-4]="OUT of TIME",RC[-1]-VLOOKUP(RC[-9],Enunciado!R3C6:R5C7,2,0),"") -> 
A938: Dept3-14937 | B938: Medio | C938: 40947 | D938: 40961 | E938: =+LEFT(RC[-4],5) -> Dept3 | F938: =+VLOOKUP(RC[-4],Enunciado!R3C6:R5C7,2,0)+RC[-3] -> 40962 | G938: =+IF(RC[-1]>=RC[-3],"ON TIME","OUT OF TIME") -> ON TIME | H938: =+YEAR(RC[-5]) -> 2012 | I938: =+MONTH(RC[-6]) -> 2 | J938: =+RC[-6]-RC[-7] -> 14 | K938: =+IF(RC[-4]="OUT of TIME",RC[-1]-VLOOKUP(RC[-9],Enunciado!R3C6:R5C7,2,0),"") -> 
A939: Dept4-192 | B939: Medio | C939: 41515 | D939: 41523 | E939: =+LEFT(RC[-4],5) -> Dept4 | F939: =+VLOOKUP(RC[-4],Enunciado!R3C6:R5C7,2,0)+RC[-3] -> 41530 | G939: =+IF(RC[-1]>=RC[-3],"ON TIME","OUT OF TIME") -> ON TIME | H939: =+YEAR(RC[-5]) -> 2013 | I939: =+MONTH(RC[-6]) -> 8 | J939: =+RC[-6]-RC[-7] -> 8 | K939: =+IF(RC[-4]="OUT of TIME",RC[-1]-VLOOKUP(RC[-9],Enunciado!R3C6:R5C7,2,0),"") -> 
A940: Dept4-16876 | B940: Bajo | C940: 41516 | D940: 41554 | E940: =+LEFT(RC[-4],5) -> Dept4 | F940: =+VLOOKUP(RC[-4],Enunciado!R3C6:R5C7,2,0)+RC[-3] -> 41546 | G940: =+IF(RC[-1]>=RC[-3],"ON TIME","OUT OF TIME") -> OUT OF TIME | H940: =+YEAR(RC[-5]) -> 2013 | I940: =+MONTH(RC[-6]) -> 8 | J940: =+RC[-6]-RC[-7] -> 38 | K940: =+IF(RC[-4]="OUT of TIME",RC[-1]-VLOOKUP(RC[-9],Enunciado!R3C6:R5C7,2,0),"") -> 8
A941: Dept3-25893 | B941: Bajo | C941: 40950 | D941: 40957 | E941: =+LEFT(RC[-4],5) -> Dept3 | F941: =+VLOOKUP(RC[-4],Enunciado!R3C6:R5C7,2,0)+RC[-3] -> 40980 | G941: =+IF(RC[-1]>=RC[-3],"ON TIME","OUT OF TIME") -> ON TIME | H941: =+YEAR(RC[-5]) -> 2012 | I941: =+MONTH(RC[-6]) -> 2 | J941: =+RC[-6]-RC[-7] -> 7 | K941: =+IF(RC[-4]="OUT of TIME",RC[-1]-VLOOKUP(RC[-9],Enunciado!R3C6:R5C7,2,0),"") -> 
A942: Dept3-4072 | B942: Alto | C942: 41423 | D942: 41425 | E942: =+LEFT(RC[-4],5) -> Dept3 | F942: =+VLOOKUP(RC[-4],Enunciado!R3C6:R5C7,2,0)+RC[-3] -> 41428 | G942: =+IF(RC[-1]>=RC[-3],"ON TIME","OUT OF TIME") -> ON TIME | H942: =+YEAR(RC[-5]) -> 2013 | I942: =+MONTH(RC[-6]) -> 5 | J942: =+RC[-6]-RC[-7] -> 2 | K942: =+IF(RC[-4]="OUT of TIME",RC[-1]-VLOOKUP(RC[-9],Enunciado!R3C6:R5C7,2,0),"") -> 
A943: Dept6-6000 | B943: Bajo | C943: 41250 | D943: 41257 | E943: =+LEFT(RC[-4],5) -> Dept6 | F943: =+VLOOKUP(RC[-4],Enunciado!R3C6:R5C7,2,0)+RC[-3] -> 41280 | G943: =+IF(RC[-1]>=RC[-3],"ON TIME","OUT OF TIME") -> ON TIME | H943: =+YEAR(RC[-5]) -> 2012 | I943: =+MONTH(RC[-6]) -> 12 | J943: =+RC[-6]-RC[-7] -> 7 | K943: =+IF(RC[-4]="OUT of TIME",RC[-1]-VLOOKUP(RC[-9],Enunciado!R3C6:R5C7,2,0),"") -> 
A944: Dept6-28032 | B944: Medio | C944: 41079 | D944: 41091 | E944: =+LEFT(RC[-4],5) -> Dept6 | F944: =+VLOOKUP(RC[-4],Enunciado!R3C6:R5C7,2,0)+RC[-3] -> 41094 | G944: =+IF(RC[-1]>=RC[-3],"ON TIME","OUT OF TIME") -> ON TIME | H944: =+YEAR(RC[-5]) -> 2012 | I944: =+MONTH(RC[-6]) -> 6 | J944: =+RC[-6]-RC[-7] -> 12 | K944: =+IF(RC[-4]="OUT of TIME",RC[-1]-VLOOKUP(RC[-9],Enunciado!R3C6:R5C7,2,0),"") -> 
A945: Dept3-25886 | B945: Medio | C945: 41423 | D945: 41436 | E945: =+LEFT(RC[-4],5) -> Dept3 | F945: =+VLOOKUP(RC[-4],Enunciado!R3C6:R5C7,2,0)+RC[-3] -> 41438 | G945: =+IF(RC[-1]>=RC[-3],"ON TIME","OUT OF TIME") -> ON TIME | H945: =+YEAR(RC[-5]) -> 2013 | I945: =+MONTH(RC[-6]) -> 5 | J945: =+RC[-6]-RC[-7] -> 13 | K945: =+IF(RC[-4]="OUT of TIME",RC[-1]-VLOOKUP(RC[-9],Enunciado!R3C6:R5C7,2,0),"") -> 
A946: Dept2-29530 | B946: Alto | C946: 41534 | D946: 41535 | E946: =+LEFT(RC[-4],5) -> Dept2 | F946: =+VLOOKUP(RC[-4],Enunciado!R3C6:R5C7,2,0)+RC[-3] -> 41539 | G946: =+IF(RC[-1]>=RC[-3],"ON TIME","OUT OF TIME") -> ON TIME | H946: =+YEAR(RC[-5]) -> 2013 | I946: =+MONTH(RC[-6]) -> 9 | J946: =+RC[-6]-RC[-7] -> 1 | K946: =+IF(RC[-4]="OUT of TIME",RC[-1]-VLOOKUP(RC[-9],Enunciado!R3C6:R5C7,2,0),"") -> 
A947: Dept2-24689 | B947: Alto | C947: 41262 | D947: 41298 | E947: =+LEFT(RC[-4],5) -> Dept2 | F947: =+VLOOKUP(RC[-4],Enunciado!R3C6:R5C7,2,0)+RC[-3] -> 41267 | G947: =+IF(RC[-1]>=RC[-3],"ON TIME","OUT OF TIME") -> OUT OF TIME | H947: =+YEAR(RC[-5]) -> 2012 | I947: =+MONTH(RC[-6]) -> 12 | J947: =+RC[-6]-RC[-7] -> 36 | K947: =+IF(RC[-4]="OUT of TIME",RC[-1]-VLOOKUP(RC[-9],Enunciado!R3C6:R5C7,2,0),"") -> 31
A948: Dept4-5172 | B948: Medio | C948: 41126 | D948: 41157 | E948: =+LEFT(RC[-4],5) -> Dept4 | F948: =+VLOOKUP(RC[-4],Enunciado!R3C6:R5C7,2,0)+RC[-3] -> 41141 | G948: =+IF(RC[-1]>=RC[-3],"ON TIME","OUT OF TIME") -> OUT OF TIME | H948: =+YEAR(RC[-5]) -> 2012 | I948: =+MONTH(RC[-6]) -> 8 | J948: =+RC[-6]-RC[-7] -> 31 | K948: =+IF(RC[-4]="OUT of TIME",RC[-1]-VLOOKUP(RC[-9],Enunciado!R3C6:R5C7,2,0),"") -> 16
A949: Dept4-27450 | B949: Bajo | C949: 41349 | D949: 41352 | E949: =+LEFT(RC[-4],5) -> Dept4 | F949: =+VLOOKUP(RC[-4],Enunciado!R3C6:R5C7,2,0)+RC[-3] -> 41379 | G949: =+IF(RC[-1]>=RC[-3],"ON TIME","OUT OF TIME") -> ON TIME | H949: =+YEAR(RC[-5]) -> 2013 | I949: =+MONTH(RC[-6]) -> 3 | J949: =+RC[-6]-RC[-7] -> 3 | K949: =+IF(RC[-4]="OUT of TIME",RC[-1]-VLOOKUP(RC[-9],Enunciado!R3C6:R5C7,2,0),"") -> 
A950: Dept1-5804 | B950: Medio | C950: 41444 | D950: 41492 | E950: =+LEFT(RC[-4],5) -> Dept1 | F950: =+VLOOKUP(RC[-4],Enunciado!R3C6:R5C7,2,0)+RC[-3] -> 41459 | G950: =+IF(RC[-1]>=RC[-3],"ON TIME","OUT OF TIME") -> OUT OF TIME | H950: =+YEAR(RC[-5]) -> 2013 | I950: =+MONTH(RC[-6]) -> 6 | J950: =+RC[-6]-RC[-7] -> 48 | K950: =+IF(RC[-4]="OUT of TIME",RC[-1]-VLOOKUP(RC[-9],Enunciado!R3C6:R5C7,2,0),"") -> 33
A951: Dept6-22047 | B951: Alto | C951: 41192 | D951: 41202 | E951: =+LEFT(RC[-4],5) -> Dept6 | F951: =+VLOOKUP(RC[-4],Enunciado!R3C6:R5C7,2,0)+RC[-3] -> 41197 | G951: =+IF(RC[-1]>=RC[-3],"ON TIME","OUT OF TIME") -> OUT OF TIME | H951: =+YEAR(RC[-5]) -> 2012 | I951: =+MONTH(RC[-6]) -> 10 | J951: =+RC[-6]-RC[-7] -> 10 | K951: =+IF(RC[-4]="OUT of TIME",RC[-1]-VLOOKUP(RC[-9],Enunciado!R3C6:R5C7,2,0),"") -> 5
A952: Dept6-7062 | B952: Bajo | C952: 41516 | D952: 41527 | E952: =+LEFT(RC[-4],5) -> Dept6 | F952: =+VLOOKUP(RC[-4],Enunciado!R3C6:R5C7,2,0)+RC[-3] -> 41546 | G952: =+IF(RC[-1]>=RC[-3],"ON TIME","OUT OF TIME") -> ON TIME | H952: =+YEAR(RC[-5]) -> 2013 | I952: =+MONTH(RC[-6]) -> 8 | J952: =+RC[-6]-RC[-7] -> 11 | K952: =+IF(RC[-4]="OUT of TIME",RC[-1]-VLOOKUP(RC[-9],Enunciado!R3C6:R5C7,2,0),"") -> 
A953: Dept6-27502 | B953: Bajo | C953: 41567 | D953: 41576 | E953: =+LEFT(RC[-4],5) -> Dept6 | F953: =+VLOOKUP(RC[-4],Enunciado!R3C6:R5C7,2,0)+RC[-3] -> 41597 | G953: =+IF(RC[-1]>=RC[-3],"ON TIME","OUT OF TIME") -> ON TIME | H953: =+YEAR(RC[-5]) -> 2013 | I953: =+MONTH(RC[-6]) -> 10 | J953: =+RC[-6]-RC[-7] -> 9 | K953: =+IF(RC[-4]="OUT of TIME",RC[-1]-VLOOKUP(RC[-9],Enunciado!R3C6:R5C7,2,0),"") -> 
A954: Dept4-29882 | B954: Medio | C954: 40925 | D954: 40932 | E954: =+LEFT(RC[-4],5) -> Dept4 | F954: =+VLOOKUP(RC[-4],Enunciado!R3C6:R5C7,2,0)+RC[-3] -> 40940 | G954: =+IF(RC[-1]>=RC[-3],"ON TIME","OUT OF TIME") -> ON TIME | H954: =+YEAR(RC[-5]) -> 2012 | I954: =+MONTH(RC[-6]) -> 1 | J954: =+RC[-6]-RC[-7] -> 7 | K954: =+IF(RC[-4]="OUT of TIME",RC[-1]-VLOOKUP(RC[-9],Enunciado!R3C6:R5C7,2,0),"") -> 
A955: Dept6-7717 | B955: Medio | C955: 41125 | D955: 41130 | E955: =+LEFT(RC[-4],5) -> Dept6 | F955: =+VLOOKUP(RC[-4],Enunciado!R3C6:R5C7,2,0)+RC[-3] -> 41140 | G955: =+IF(RC[-1]>=RC[-3],"ON TIME","OUT OF TIME") -> ON TIME | H955: =+YEAR(RC[-5]) -> 2012 | I955: =+MONTH(RC[-6]) -> 8 | J955: =+RC[-6]-RC[-7] -> 5 | K955: =+IF(RC[-4]="OUT of TIME",RC[-1]-VLOOKUP(RC[-9],Enunciado!R3C6:R5C7,2,0),"") -> 
A956: Dept5-26290 | B956: Alto | C956: 41361 | D956: 41377 | E956: =+LEFT(RC[-4],5) -> Dept5 | F956: =+VLOOKUP(RC[-4],Enunciado!R3C6:R5C7,2,0)+RC[-3] -> 41366 | G956: =+IF(RC[-1]>=RC[-3],"ON TIME","OUT OF TIME") -> OUT OF TIME | H956: =+YEAR(RC[-5]) -> 2013 | I956: =+MONTH(RC[-6]) -> 3 | J956: =+RC[-6]-RC[-7] -> 16 | K956: =+IF(RC[-4]="OUT of TIME",RC[-1]-VLOOKUP(RC[-9],Enunciado!R3C6:R5C7,2,0),"") -> 11
A957: Dept3-12203 | B957: Medio | C957: 40969 | D957: 40970 | E957: =+LEFT(RC[-4],5) -> Dept3 | F957: =+VLOOKUP(RC[-4],Enunciado!R3C6:R5C7,2,0)+RC[-3] -> 40984 | G957: =+IF(RC[-1]>=RC[-3],"ON TIME","OUT OF TIME") -> ON TIME | H957: =+YEAR(RC[-5]) -> 2012 | I957: =+MONTH(RC[-6]) -> 3 | J957: =+RC[-6]-RC[-7] -> 1 | K957: =+IF(RC[-4]="OUT of TIME",RC[-1]-VLOOKUP(RC[-9],Enunciado!R3C6:R5C7,2,0),"") -> 
A958: Dept2-13270 | B958: Alto | C958: 41488 | D958: 41501 | E958: =+LEFT(RC[-4],5) -> Dept2 | F958: =+VLOOKUP(RC[-4],Enunciado!R3C6:R5C7,2,0)+RC[-3] -> 41493 | G958: =+IF(RC[-1]>=RC[-3],"ON TIME","OUT OF TIME") -> OUT OF TIME | H958: =+YEAR(RC[-5]) -> 2013 | I958: =+MONTH(RC[-6]) -> 8 | J958: =+RC[-6]-RC[-7] -> 13 | K958: =+IF(RC[-4]="OUT of TIME",RC[-1]-VLOOKUP(RC[-9],Enunciado!R3C6:R5C7,2,0),"") -> 8
A959: Dept5-2858 | B959: Medio | C959: 41139 | D959: 41161 | E959: =+LEFT(RC[-4],5) -> Dept5 | F959: =+VLOOKUP(RC[-4],Enunciado!R3C6:R5C7,2,0)+RC[-3] -> 41154 | G959: =+IF(RC[-1]>=RC[-3],"ON TIME","OUT OF TIME") -> OUT OF TIME | H959: =+YEAR(RC[-5]) -> 2012 | I959: =+MONTH(RC[-6]) -> 8 | J959: =+RC[-6]-RC[-7] -> 22 | K959: =+IF(RC[-4]="OUT of TIME",RC[-1]-VLOOKUP(RC[-9],Enunciado!R3C6:R5C7,2,0),"") -> 7
A960: Dept6-15040 | B960: Medio | C960: 40974 | D960: 40976 | E960: =+LEFT(RC[-4],5) -> Dept6 | F960: =+VLOOKUP(RC[-4],Enunciado!R3C6:R5C7,2,0)+RC[-3] -> 40989 | G960: =+IF(RC[-1]>=RC[-3],"ON TIME","OUT OF TIME") -> ON TIME | H960: =+YEAR(RC[-5]) -> 2012 | I960: =+MONTH(RC[-6]) -> 3 | J960: =+RC[-6]-RC[-7] -> 2 | K960: =+IF(RC[-4]="OUT of TIME",RC[-1]-VLOOKUP(RC[-9],Enunciado!R3C6:R5C7,2,0),"") -> 
A961: Dept2-3370 | B961: Medio | C961: 41163 | D961: 41191 | E961: =+LEFT(RC[-4],5) -> Dept2 | F961: =+VLOOKUP(RC[-4],Enunciado!R3C6:R5C7,2,0)+RC[-3] -> 41178 | G961: =+IF(RC[-1]>=RC[-3],"ON TIME","OUT OF TIME") -> OUT OF TIME | H961: =+YEAR(RC[-5]) -> 2012 | I961: =+MONTH(RC[-6]) -> 9 | J961: =+RC[-6]-RC[-7] -> 28 | K961: =+IF(RC[-4]="OUT of TIME",RC[-1]-VLOOKUP(RC[-9],Enunciado!R3C6:R5C7,2,0),"") -> 13
A962: Dept5-11527 | B962: Bajo | C962: 41387 | D962: 41403 | E962: =+LEFT(RC[-4],5) -> Dept5 | F962: =+VLOOKUP(RC[-4],Enunciado!R3C6:R5C7,2,0)+RC[-3] -> 41417 | G962: =+IF(RC[-1]>=RC[-3],"ON TIME","OUT OF TIME") -> ON TIME | H962: =+YEAR(RC[-5]) -> 2013 | I962: =+MONTH(RC[-6]) -> 4 | J962: =+RC[-6]-RC[-7] -> 16 | K962: =+IF(RC[-4]="OUT of TIME",RC[-1]-VLOOKUP(RC[-9],Enunciado!R3C6:R5C7,2,0),"") -> 
A963: Dept5-15296 | B963: Alto | C963: 41536 | D963: 41553 | E963: =+LEFT(RC[-4],5) -> Dept5 | F963: =+VLOOKUP(RC[-4],Enunciado!R3C6:R5C7,2,0)+RC[-3] -> 41541 | G963: =+IF(RC[-1]>=RC[-3],"ON TIME","OUT OF TIME") -> OUT OF TIME | H963: =+YEAR(RC[-5]) -> 2013 | I963: =+MONTH(RC[-6]) -> 9 | J963: =+RC[-6]-RC[-7] -> 17 | K963: =+IF(RC[-4]="OUT of TIME",RC[-1]-VLOOKUP(RC[-9],Enunciado!R3C6:R5C7,2,0),"") -> 12
A964: Dept1-8379 | B964: Bajo | C964: 41611 | D964: 41614 | E964: =+LEFT(RC[-4],5) -> Dept1 | F964: =+VLOOKUP(RC[-4],Enunciado!R3C6:R5C7,2,0)+RC[-3] -> 41641 | G964: =+IF(RC[-1]>=RC[-3],"ON TIME","OUT OF TIME") -> ON TIME | H964: =+YEAR(RC[-5]) -> 2013 | I964: =+MONTH(RC[-6]) -> 12 | J964: =+RC[-6]-RC[-7] -> 3 | K964: =+IF(RC[-4]="OUT of TIME",RC[-1]-VLOOKUP(RC[-9],Enunciado!R3C6:R5C7,2,0),"") -> 
A965: Dept6-22381 | B965: Bajo | C965: 41166 | D965: 41169 | E965: =+LEFT(RC[-4],5) -> Dept6 | F965: =+VLOOKUP(RC[-4],Enunciado!R3C6:R5C7,2,0)+RC[-3] -> 41196 | G965: =+IF(RC[-1]>=RC[-3],"ON TIME","OUT OF TIME") -> ON TIME | H965: =+YEAR(RC[-5]) -> 2012 | I965: =+MONTH(RC[-6]) -> 9 | J965: =+RC[-6]-RC[-7] -> 3 | K965: =+IF(RC[-4]="OUT of TIME",RC[-1]-VLOOKUP(RC[-9],Enunciado!R3C6:R5C7,2,0),"") -> 
A966: Dept2-21298 | B966: Bajo | C966: 41584 | D966: 41585 | E966: =+LEFT(RC[-4],5) -> Dept2 | F966: =+VLOOKUP(RC[-4],Enunciado!R3C6:R5C7,2,0)+RC[-3] -> 41614 | G966: =+IF(RC[-1]>=RC[-3],"ON TIME","OUT OF TIME") -> ON TIME | H966: =+YEAR(RC[-5]) -> 2013 | I966: =+MONTH(RC[-6]) -> 11 | J966: =+RC[-6]-RC[-7] -> 1 | K966: =+IF(RC[-4]="OUT of TIME",RC[-1]-VLOOKUP(RC[-9],Enunciado!R3C6:R5C7,2,0),"") -> 
A967: Dept3-22187 | B967: Medio | C967: 41216 | D967: 41218 | E967: =+LEFT(RC[-4],5) -> Dept3 | F967: =+VLOOKUP(RC[-4],Enunciado!R3C6:R5C7,2,0)+RC[-3] -> 41231 | G967: =+IF(RC[-1]>=RC[-3],"ON TIME","OUT OF TIME") -> ON TIME | H967: =+YEAR(RC[-5]) -> 2012 | I967: =+MONTH(RC[-6]) -> 11 | J967: =+RC[-6]-RC[-7] -> 2 | K967: =+IF(RC[-4]="OUT of TIME",RC[-1]-VLOOKUP(RC[-9],Enunciado!R3C6:R5C7,2,0),"") -> 
A968: Dept1-15036 | B968: Medio | C968: 41238 | D968: 41250 | E968: =+LEFT(RC[-4],5) -> Dept1 | F968: =+VLOOKUP(RC[-4],Enunciado!R3C6:R5C7,2,0)+RC[-3] -> 41253 | G968: =+IF(RC[-1]>=RC[-3],"ON TIME","OUT OF TIME") -> ON TIME | H968: =+YEAR(RC[-5]) -> 2012 | I968: =+MONTH(RC[-6]) -> 11 | J968: =+RC[-6]-RC[-7] -> 12 | K968: =+IF(RC[-4]="OUT of TIME",RC[-1]-VLOOKUP(RC[-9],Enunciado!R3C6:R5C7,2,0),"") -> 
A969: Dept3-1581 | B969: Alto | C969: 41497 | D969: 41525 | E969: =+LEFT(RC[-4],5) -> Dept3 | F969: =+VLOOKUP(RC[-4],Enunciado!R3C6:R5C7,2,0)+RC[-3] -> 41502 | G969: =+IF(RC[-1]>=RC[-3],"ON TIME","OUT OF TIME") -> OUT OF TIME | H969: =+YEAR(RC[-5]) -> 2013 | I969: =+MONTH(RC[-6]) -> 8 | J969: =+RC[-6]-RC[-7] -> 28 | K969: =+IF(RC[-4]="OUT of TIME",RC[-1]-VLOOKUP(RC[-9],Enunciado!R3C6:R5C7,2,0),"") -> 23
A970: Dept3-24841 | B970: Medio | C970: 41066 | D970: 41114 | E970: =+LEFT(RC[-4],5) -> Dept3 | F970: =+VLOOKUP(RC[-4],Enunciado!R3C6:R5C7,2,0)+RC[-3] -> 41081 | G970: =+IF(RC[-1]>=RC[-3],"ON TIME","OUT OF TIME") -> OUT OF TIME | H970: =+YEAR(RC[-5]) -> 2012 | I970: =+MONTH(RC[-6]) -> 6 | J970: =+RC[-6]-RC[-7] -> 48 | K970: =+IF(RC[-4]="OUT of TIME",RC[-1]-VLOOKUP(RC[-9],Enunciado!R3C6:R5C7,2,0),"") -> 33
A971: Dept6-20166 | B971: Bajo | C971: 41352 | D971: 41360 | E971: =+LEFT(RC[-4],5) -> Dept6 | F971: =+VLOOKUP(RC[-4],Enunciado!R3C6:R5C7,2,0)+RC[-3] -> 41382 | G971: =+IF(RC[-1]>=RC[-3],"ON TIME","OUT OF TIME") -> ON TIME | H971: =+YEAR(RC[-5]) -> 2013 | I971: =+MONTH(RC[-6]) -> 3 | J971: =+RC[-6]-RC[-7] -> 8 | K971: =+IF(RC[-4]="OUT of TIME",RC[-1]-VLOOKUP(RC[-9],Enunciado!R3C6:R5C7,2,0),"") -> 
A972: Dept3-5683 | B972: Medio | C972: 40997 | D972: 41009 | E972: =+LEFT(RC[-4],5) -> Dept3 | F972: =+VLOOKUP(RC[-4],Enunciado!R3C6:R5C7,2,0)+RC[-3] -> 41012 | G972: =+IF(RC[-1]>=RC[-3],"ON TIME","OUT OF TIME") -> ON TIME | H972: =+YEAR(RC[-5]) -> 2012 | I972: =+MONTH(RC[-6]) -> 3 | J972: =+RC[-6]-RC[-7] -> 12 | K972: =+IF(RC[-4]="OUT of TIME",RC[-1]-VLOOKUP(RC[-9],Enunciado!R3C6:R5C7,2,0),"") -> 
A973: Dept2-3187 | B973: Medio | C973: 41427 | D973: 41431 | E973: =+LEFT(RC[-4],5) -> Dept2 | F973: =+VLOOKUP(RC[-4],Enunciado!R3C6:R5C7,2,0)+RC[-3] -> 41442 | G973: =+IF(RC[-1]>=RC[-3],"ON TIME","OUT OF TIME") -> ON TIME | H973: =+YEAR(RC[-5]) -> 2013 | I973: =+MONTH(RC[-6]) -> 6 | J973: =+RC[-6]-RC[-7] -> 4 | K973: =+IF(RC[-4]="OUT of TIME",RC[-1]-VLOOKUP(RC[-9],Enunciado!R3C6:R5C7,2,0),"") -> 
A974: Dept4-12062 | B974: Medio | C974: 41323 | D974: 41333 | E974: =+LEFT(RC[-4],5) -> Dept4 | F974: =+VLOOKUP(RC[-4],Enunciado!R3C6:R5C7,2,0)+RC[-3] -> 41338 | G974: =+IF(RC[-1]>=RC[-3],"ON TIME","OUT OF TIME") -> ON TIME | H974: =+YEAR(RC[-5]) -> 2013 | I974: =+MONTH(RC[-6]) -> 2 | J974: =+RC[-6]-RC[-7] -> 10 | K974: =+IF(RC[-4]="OUT of TIME",RC[-1]-VLOOKUP(RC[-9],Enunciado!R3C6:R5C7,2,0),"") -> 
A975: Dept1-23008 | B975: Medio | C975: 41408 | D975: 41408 | E975: =+LEFT(RC[-4],5) -> Dept1 | F975: =+VLOOKUP(RC[-4],Enunciado!R3C6:R5C7,2,0)+RC[-3] -> 41423 | G975: =+IF(RC[-1]>=RC[-3],"ON TIME","OUT OF TIME") -> ON TIME | H975: =+YEAR(RC[-5]) -> 2013 | I975: =+MONTH(RC[-6]) -> 5 | J975: =+RC[-6]-RC[-7] -> 0 | K975: =+IF(RC[-4]="OUT of TIME",RC[-1]-VLOOKUP(RC[-9],Enunciado!R3C6:R5C7,2,0),"") -> 
A976: Dept5-28716 | B976: Medio | C976: 41234 | D976: 41256 | E976: =+LEFT(RC[-4],5) -> Dept5 | F976: =+VLOOKUP(RC[-4],Enunciado!R3C6:R5C7,2,0)+RC[-3] -> 41249 | G976: =+IF(RC[-1]>=RC[-3],"ON TIME","OUT OF TIME") -> OUT OF TIME | H976: =+YEAR(RC[-5]) -> 2012 | I976: =+MONTH(RC[-6]) -> 11 | J976: =+RC[-6]-RC[-7] -> 22 | K976: =+IF(RC[-4]="OUT of TIME",RC[-1]-VLOOKUP(RC[-9],Enunciado!R3C6:R5C7,2,0),"") -> 7
A977: Dept4-25695 | B977: Alto | C977: 41353 | D977: 41376 | E977: =+LEFT(RC[-4],5) -> Dept4 | F977: =+VLOOKUP(RC[-4],Enunciado!R3C6:R5C7,2,0)+RC[-3] -> 41358 | G977: =+IF(RC[-1]>=RC[-3],"ON TIME","OUT OF TIME") -> OUT OF TIME | H977: =+YEAR(RC[-5]) -> 2013 | I977: =+MONTH(RC[-6]) -> 3 | J977: =+RC[-6]-RC[-7] -> 23 | K977: =+IF(RC[-4]="OUT of TIME",RC[-1]-VLOOKUP(RC[-9],Enunciado!R3C6:R5C7,2,0),"") -> 18
A978: Dept6-10043 | B978: Medio | C978: 41638 | D978: 41639 | E978: =+LEFT(RC[-4],5) -> Dept6 | F978: =+VLOOKUP(RC[-4],Enunciado!R3C6:R5C7,2,0)+RC[-3] -> 41653 | G978: =+IF(RC[-1]>=RC[-3],"ON TIME","OUT OF TIME") -> ON TIME | H978: =+YEAR(RC[-5]) -> 2013 | I978: =+MONTH(RC[-6]) -> 12 | J978: =+RC[-6]-RC[-7] -> 1 | K978: =+IF(RC[-4]="OUT of TIME",RC[-1]-VLOOKUP(RC[-9],Enunciado!R3C6:R5C7,2,0),"") -> 
A979: Dept6-6784 | B979: Medio | C979: 41015 | D979: 41016 | E979: =+LEFT(RC[-4],5) -> Dept6 | F979: =+VLOOKUP(RC[-4],Enunciado!R3C6:R5C7,2,0)+RC[-3] -> 41030 | G979: =+IF(RC[-1]>=RC[-3],"ON TIME","OUT OF TIME") -> ON TIME | H979: =+YEAR(RC[-5]) -> 2012 | I979: =+MONTH(RC[-6]) -> 4 | J979: =+RC[-6]-RC[-7] -> 1 | K979: =+IF(RC[-4]="OUT of TIME",RC[-1]-VLOOKUP(RC[-9],Enunciado!R3C6:R5C7,2,0),"") -> 
A980: Dept6-3538 | B980: Bajo | C980: 41465 | D980: 41475 | E980: =+LEFT(RC[-4],5) -> Dept6 | F980: =+VLOOKUP(RC[-4],Enunciado!R3C6:R5C7,2,0)+RC[-3] -> 41495 | G980: =+IF(RC[-1]>=RC[-3],"ON TIME","OUT OF TIME") -> ON TIME | H980: =+YEAR(RC[-5]) -> 2013 | I980: =+MONTH(RC[-6]) -> 7 | J980: =+RC[-6]-RC[-7] -> 10 | K980: =+IF(RC[-4]="OUT of TIME",RC[-1]-VLOOKUP(RC[-9],Enunciado!R3C6:R5C7,2,0),"") -> 
A981: Dept1-27788 | B981: Alto | C981: 41436 | D981: 41439 | E981: =+LEFT(RC[-4],5) -> Dept1 | F981: =+VLOOKUP(RC[-4],Enunciado!R3C6:R5C7,2,0)+RC[-3] -> 41441 | G981: =+IF(RC[-1]>=RC[-3],"ON TIME","OUT OF TIME") -> ON TIME | H981: =+YEAR(RC[-5]) -> 2013 | I981: =+MONTH(RC[-6]) -> 6 | J981: =+RC[-6]-RC[-7] -> 3 | K981: =+IF(RC[-4]="OUT of TIME",RC[-1]-VLOOKUP(RC[-9],Enunciado!R3C6:R5C7,2,0),"") -> 
A982: Dept6-77 | B982: Medio | C982: 41492 | D982: 41526 | E982: =+LEFT(RC[-4],5) -> Dept6 | F982: =+VLOOKUP(RC[-4],Enunciado!R3C6:R5C7,2,0)+RC[-3] -> 41507 | G982: =+IF(RC[-1]>=RC[-3],"ON TIME","OUT OF TIME") -> OUT OF TIME | H982: =+YEAR(RC[-5]) -> 2013 | I982: =+MONTH(RC[-6]) -> 8 | J982: =+RC[-6]-RC[-7] -> 34 | K982: =+IF(RC[-4]="OUT of TIME",RC[-1]-VLOOKUP(RC[-9],Enunciado!R3C6:R5C7,2,0),"") -> 19
A983: Dept2-12514 | B983: Alto | C983: 40942 | D983: 40944 | E983: =+LEFT(RC[-4],5) -> Dept2 | F983: =+VLOOKUP(RC[-4],Enunciado!R3C6:R5C7,2,0)+RC[-3] -> 40947 | G983: =+IF(RC[-1]>=RC[-3],"ON TIME","OUT OF TIME") -> ON TIME | H983: =+YEAR(RC[-5]) -> 2012 | I983: =+MONTH(RC[-6]) -> 2 | J983: =+RC[-6]-RC[-7] -> 2 | K983: =+IF(RC[-4]="OUT of TIME",RC[-1]-VLOOKUP(RC[-9],Enunciado!R3C6:R5C7,2,0),"") -> 
A984: Dept4-1339 | B984: Medio | C984: 41520 | D984: 41561 | E984: =+LEFT(RC[-4],5) -> Dept4 | F984: =+VLOOKUP(RC[-4],Enunciado!R3C6:R5C7,2,0)+RC[-3] -> 41535 | G984: =+IF(RC[-1]>=RC[-3],"ON TIME","OUT OF TIME") -> OUT OF TIME | H984: =+YEAR(RC[-5]) -> 2013 | I984: =+MONTH(RC[-6]) -> 9 | J984: =+RC[-6]-RC[-7] -> 41 | K984: =+IF(RC[-4]="OUT of TIME",RC[-1]-VLOOKUP(RC[-9],Enunciado!R3C6:R5C7,2,0),"") -> 26
A985: Dept5-19740 | B985: Medio | C985: 41476 | D985: 41498 | E985: =+LEFT(RC[-4],5) -> Dept5 | F985: =+VLOOKUP(RC[-4],Enunciado!R3C6:R5C7,2,0)+RC[-3] -> 41491 | G985: =+IF(RC[-1]>=RC[-3],"ON TIME","OUT OF TIME") -> OUT OF TIME | H985: =+YEAR(RC[-5]) -> 2013 | I985: =+MONTH(RC[-6]) -> 7 | J985: =+RC[-6]-RC[-7] -> 22 | K985: =+IF(RC[-4]="OUT of TIME",RC[-1]-VLOOKUP(RC[-9],Enunciado!R3C6:R5C7,2,0),"") -> 7
A986: Dept1-22197 | B986: Bajo | C986: 41507 | D986: 41508 | E986: =+LEFT(RC[-4],5) -> Dept1 | F986: =+VLOOKUP(RC[-4],Enunciado!R3C6:R5C7,2,0)+RC[-3] -> 41537 | G986: =+IF(RC[-1]>=RC[-3],"ON TIME","OUT OF TIME") -> ON TIME | H986: =+YEAR(RC[-5]) -> 2013 | I986: =+MONTH(RC[-6]) -> 8 | J986: =+RC[-6]-RC[-7] -> 1 | K986: =+IF(RC[-4]="OUT of TIME",RC[-1]-VLOOKUP(RC[-9],Enunciado!R3C6:R5C7,2,0),"") -> 
A987: Dept5-16327 | B987: Medio | C987: 41447 | D987: 41489 | E987: =+LEFT(RC[-4],5) -> Dept5 | F987: =+VLOOKUP(RC[-4],Enunciado!R3C6:R5C7,2,0)+RC[-3] -> 41462 | G987: =+IF(RC[-1]>=RC[-3],"ON TIME","OUT OF TIME") -> OUT OF TIME | H987: =+YEAR(RC[-5]) -> 2013 | I987: =+MONTH(RC[-6]) -> 6 | J987: =+RC[-6]-RC[-7] -> 42 | K987: =+IF(RC[-4]="OUT of TIME",RC[-1]-VLOOKUP(RC[-9],Enunciado!R3C6:R5C7,2,0),"") -> 27
A988: Dept2-23376 | B988: Alto | C988: 40987 | D988: 40989 | E988: =+LEFT(RC[-4],5) -> Dept2 | F988: =+VLOOKUP(RC[-4],Enunciado!R3C6:R5C7,2,0)+RC[-3] -> 40992 | G988: =+IF(RC[-1]>=RC[-3],"ON TIME","OUT OF TIME") -> ON TIME | H988: =+YEAR(RC[-5]) -> 2012 | I988: =+MONTH(RC[-6]) -> 3 | J988: =+RC[-6]-RC[-7] -> 2 | K988: =+IF(RC[-4]="OUT of TIME",RC[-1]-VLOOKUP(RC[-9],Enunciado!R3C6:R5C7,2,0),"") -> 
A989: Dept1-12322 | B989: Medio | C989: 41548 | D989: 41548 | E989: =+LEFT(RC[-4],5) -> Dept1 | F989: =+VLOOKUP(RC[-4],Enunciado!R3C6:R5C7,2,0)+RC[-3] -> 41563 | G989: =+IF(RC[-1]>=RC[-3],"ON TIME","OUT OF TIME") -> ON TIME | H989: =+YEAR(RC[-5]) -> 2013 | I989: =+MONTH(RC[-6]) -> 10 | J989: =+RC[-6]-RC[-7] -> 0 | K989: =+IF(RC[-4]="OUT of TIME",RC[-1]-VLOOKUP(RC[-9],Enunciado!R3C6:R5C7,2,0),"") -> 
A990: Dept5-17205 | B990: Bajo | C990: 41422 | D990: 41422 | E990: =+LEFT(RC[-4],5) -> Dept5 | F990: =+VLOOKUP(RC[-4],Enunciado!R3C6:R5C7,2,0)+RC[-3] -> 41452 | G990: =+IF(RC[-1]>=RC[-3],"ON TIME","OUT OF TIME") -> ON TIME | H990: =+YEAR(RC[-5]) -> 2013 | I990: =+MONTH(RC[-6]) -> 5 | J990: =+RC[-6]-RC[-7] -> 0 | K990: =+IF(RC[-4]="OUT of TIME",RC[-1]-VLOOKUP(RC[-9],Enunciado!R3C6:R5C7,2,0),"") -> 
A991: Dept1-17115 | B991: Bajo | C991: 40972 | D991: 40997 | E991: =+LEFT(RC[-4],5) -> Dept1 | F991: =+VLOOKUP(RC[-4],Enunciado!R3C6:R5C7,2,0)+RC[-3] -> 41002 | G991: =+IF(RC[-1]>=RC[-3],"ON TIME","OUT OF TIME") -> ON TIME | H991: =+YEAR(RC[-5]) -> 2012 | I991: =+MONTH(RC[-6]) -> 3 | J991: =+RC[-6]-RC[-7] -> 25 | K991: =+IF(RC[-4]="OUT of TIME",RC[-1]-VLOOKUP(RC[-9],Enunciado!R3C6:R5C7,2,0),"") -> 
A992: Dept4-26757 | B992: Bajo | C992: 41205 | D992: 41251 | E992: =+LEFT(RC[-4],5) -> Dept4 | F992: =+VLOOKUP(RC[-4],Enunciado!R3C6:R5C7,2,0)+RC[-3] -> 41235 | G992: =+IF(RC[-1]>=RC[-3],"ON TIME","OUT OF TIME") -> OUT OF TIME | H992: =+YEAR(RC[-5]) -> 2012 | I992: =+MONTH(RC[-6]) -> 10 | J992: =+RC[-6]-RC[-7] -> 46 | K992: =+IF(RC[-4]="OUT of TIME",RC[-1]-VLOOKUP(RC[-9],Enunciado!R3C6:R5C7,2,0),"") -> 16
A993: Dept2-3212 | B993: Alto | C993: 41456 | D993: 41503 | E993: =+LEFT(RC[-4],5) -> Dept2 | F993: =+VLOOKUP(RC[-4],Enunciado!R3C6:R5C7,2,0)+RC[-3] -> 41461 | G993: =+IF(RC[-1]>=RC[-3],"ON TIME","OUT OF TIME") -> OUT OF TIME | H993: =+YEAR(RC[-5]) -> 2013 | I993: =+MONTH(RC[-6]) -> 7 | J993: =+RC[-6]-RC[-7] -> 47 | K993: =+IF(RC[-4]="OUT of TIME",RC[-1]-VLOOKUP(RC[-9],Enunciado!R3C6:R5C7,2,0),"") -> 42
A994: Dept6-6209 | B994: Bajo | C994: 41142 | D994: 41143 | E994: =+LEFT(RC[-4],5) -> Dept6 | F994: =+VLOOKUP(RC[-4],Enunciado!R3C6:R5C7,2,0)+RC[-3] -> 41172 | G994: =+IF(RC[-1]>=RC[-3],"ON TIME","OUT OF TIME") -> ON TIME | H994: =+YEAR(RC[-5]) -> 2012 | I994: =+MONTH(RC[-6]) -> 8 | J994: =+RC[-6]-RC[-7] -> 1 | K994: =+IF(RC[-4]="OUT of TIME",RC[-1]-VLOOKUP(RC[-9],Enunciado!R3C6:R5C7,2,0),"") -> 
A995: Dept3-11691 | B995: Bajo | C995: 41340 | D995: 41388 | E995: =+LEFT(RC[-4],5) -> Dept3 | F995: =+VLOOKUP(RC[-4],Enunciado!R3C6:R5C7,2,0)+RC[-3] -> 41370 | G995: =+IF(RC[-1]>=RC[-3],"ON TIME","OUT OF TIME") -> OUT OF TIME | H995: =+YEAR(RC[-5]) -> 2013 | I995: =+MONTH(RC[-6]) -> 3 | J995: =+RC[-6]-RC[-7] -> 48 | K995: =+IF(RC[-4]="OUT of TIME",RC[-1]-VLOOKUP(RC[-9],Enunciado!R3C6:R5C7,2,0),"") -> 18
A996: Dept5-17721 | B996: Medio | C996: 41179 | D996: 41182 | E996: =+LEFT(RC[-4],5) -> Dept5 | F996: =+VLOOKUP(RC[-4],Enunciado!R3C6:R5C7,2,0)+RC[-3] -> 41194 | G996: =+IF(RC[-1]>=RC[-3],"ON TIME","OUT OF TIME") -> ON TIME | H996: =+YEAR(RC[-5]) -> 2012 | I996: =+MONTH(RC[-6]) -> 9 | J996: =+RC[-6]-RC[-7] -> 3 | K996: =+IF(RC[-4]="OUT of TIME",RC[-1]-VLOOKUP(RC[-9],Enunciado!R3C6:R5C7,2,0),"") -> 
A997: Dept5-896 | B997: Bajo | C997: 41419 | D997: 41423 | E997: =+LEFT(RC[-4],5) -> Dept5 | F997: =+VLOOKUP(RC[-4],Enunciado!R3C6:R5C7,2,0)+RC[-3] -> 41449 | G997: =+IF(RC[-1]>=RC[-3],"ON TIME","OUT OF TIME") -> ON TIME | H997: =+YEAR(RC[-5]) -> 2013 | I997: =+MONTH(RC[-6]) -> 5 | J997: =+RC[-6]-RC[-7] -> 4 | K997: =+IF(RC[-4]="OUT of TIME",RC[-1]-VLOOKUP(RC[-9],Enunciado!R3C6:R5C7,2,0),"") -> 
A998: Dept4-7650 | B998: Medio | C998: 41482 | D998: 41482 | E998: =+LEFT(RC[-4],5) -> Dept4 | F998: =+VLOOKUP(RC[-4],Enunciado!R3C6:R5C7,2,0)+RC[-3] -> 41497 | G998: =+IF(RC[-1]>=RC[-3],"ON TIME","OUT OF TIME") -> ON TIME | H998: =+YEAR(RC[-5]) -> 2013 | I998: =+MONTH(RC[-6]) -> 7 | J998: =+RC[-6]-RC[-7] -> 0 | K998: =+IF(RC[-4]="OUT of TIME",RC[-1]-VLOOKUP(RC[-9],Enunciado!R3C6:R5C7,2,0),"") -> 
A999: Dept6-7442 | B999: Bajo | C999: 41540 | D999: 41573 | E999: =+LEFT(RC[-4],5) -> Dept6 | F999: =+VLOOKUP(RC[-4],Enunciado!R3C6:R5C7,2,0)+RC[-3] -> 41570 | G999: =+IF(RC[-1]>=RC[-3],"ON TIME","OUT OF TIME") -> OUT OF TIME | H999: =+YEAR(RC[-5]) -> 2013 | I999: =+MONTH(RC[-6]) -> 9 | J999: =+RC[-6]-RC[-7] -> 33 | K999: =+IF(RC[-4]="OUT of TIME",RC[-1]-VLOOKUP(RC[-9],Enunciado!R3C6:R5C7,2,0),"") -> 3
A1000: Dept5-2417 | B1000: Alto | C1000: 41160 | D1000: 41166 | E1000: =+LEFT(RC[-4],5) -> Dept5 | F1000: =+VLOOKUP(RC[-4],Enunciado!R3C6:R5C7,2,0)+RC[-3] -> 41165 | G1000: =+IF(RC[-1]>=RC[-3],"ON TIME","OUT OF TIME") -> OUT OF TIME | H1000: =+YEAR(RC[-5]) -> 2012 | I1000: =+MONTH(RC[-6]) -> 9 | J1000: =+RC[-6]-RC[-7] -> 6 | K1000: =+IF(RC[-4]="OUT of TIME",RC[-1]-VLOOKUP(RC[-9],Enunciado!R3C6:R5C7,2,0),"") -> 1
A1001: Dept3-26079 | B1001: Bajo | C1001: 41091 | D1001: 41124 | E1001: =+LEFT(RC[-4],5) -> Dept3 | F1001: =+VLOOKUP(RC[-4],Enunciado!R3C6:R5C7,2,0)+RC[-3] -> 41121 | G1001: =+IF(RC[-1]>=RC[-3],"ON TIME","OUT OF TIME") -> OUT OF TIME | H1001: =+YEAR(RC[-5]) -> 2012 | I1001: =+MONTH(RC[-6]) -> 7 | J1001: =+RC[-6]-RC[-7] -> 33 | K1001: =+IF(RC[-4]="OUT of TIME",RC[-1]-VLOOKUP(RC[-9],Enunciado!R3C6:R5C7,2,0),"") -> 3